,book_link,isbn,isbn13,book_title,avg_rating,author_name,book_desc,genres
0,http://goodreads.com/book/show/3869.A_Brief_History_of_Time,0553380168,9780553380163,A Brief History of Time,4.18,['Stephen Hawking'],"In the ten years since its publication in 1988, Stephen Hawking's classic work has become a landmark volume in scientific writing, with more than nine million copies in forty languages sold worldwide. That edition was on the cutting edge of what was then known about the origins and nature of the universe. But the intervening years have seen extraordinary advances in the technology of observing both the micro- and the macrocosmic worlds. These observations have confirmed many of Professor Hawking's theoretical predictions in the first edition of his book, including the recent discoveries of the Cosmic Background Explorer satellite (COBE), which probed back in time to within 300,000 years of the universe's beginning and revealed wrinkles in the fabric of space-time that he had projected. Eager to bring to his original text the new knowledge revealed by these observations, as well as his own recent research, Professor Hawking has prepared a new introduction to the book, written an entirely new chapter on wormholes and time travel, and updated the chapters throughout.","['Science', 'Nonfiction', 'Science', 'Physics', 'History', 'Science', 'Astronomy', 'Philosophy', 'Classics', 'Science', 'Popular Science', 'Space', 'Audiobook']"
1,http://goodreads.com/book/show/21.A_Short_History_of_Nearly_Everything,076790818X,9780767908184,A Short History of Nearly Everything,4.2,['Bill Bryson'],"In Bryson's biggest book, he confronts his greatest challenge: to understand—and, if possible, answer—the oldest, biggest questions we have posed about the universe and ourselves. Taking as territory everything from the Big Bang to the rise of civilization, Bryson seeks to understand how we got from there being nothing at all to there being us. To that end, he has attached himself to a host of the world’s most advanced (and often obsessed) archaeologists, anthropologists, and mathematicians, travelling to their offices, laboratories, and field camps. He has read (or tried to read) their books, pestered them with questions, apprenticed himself to their powerful minds. A Short History of Nearly Everything is the record of this quest, and it is a sometimes profound, sometimes funny, and always supremely clear and entertaining adventure in the realms of human knowledge, as only Bill Bryson can render it. Science has never been more involving or entertaining.","['Nonfiction', 'Science', 'History', 'Audiobook', 'Humor', 'Science', 'Popular Science', 'Science', 'Physics', 'Historical', 'Unfinished', 'Philosophy']"
2,http://goodreads.com/book/show/61535.The_Selfish_Gene,0199291152,9780199291151,The Selfish Gene,4.14,['Richard Dawkins'],"The Selfish Gene: 30th Anniversary Edition—with a new Introduction by the AuthorInheriting the mantle of revolutionary biologist from Darwin, Watson, and Crick, Richard Dawkins forced an enormous change in the way we see ourselves and the world with the publication of The Selfish Gene. Suppose, instead of thinking about organisms using genes to reproduce themselves, as we had since Mendel's work was rediscovered, we turn it around and imagine that ""our"" genes build and maintain us in order to make more genes. That simple reversal seems to answer many puzzlers which had stumped scientists for years, and we haven't thought of evolution in the same way since.Why are there miles and miles of ""unused"" DNA within each of our bodies? Why should a bee give up its own chance to reproduce to help raise her sisters and brothers? With a prophet's clarity, Dawkins told us the answers from the perspective of molecules competing for limited space and resources to produce more of their own kind. Drawing fascinating examples from every field of biology, he paved the way for a serious re-evaluation of evolution. He also introduced the concept of self-reproducing ideas, or memes, which (seemingly) use humans exclusively for their propagation. If we are puppets, he says, at least we can try to understand our strings. —Rob Lightner","['Science', 'Nonfiction', 'Science', 'Biology', 'Biology', 'Evolution', 'Philosophy', 'Psychology', 'Science', 'Popular Science', 'Biology', 'Genetics', 'Audiobook', 'Religion', 'Atheism']"
3,http://goodreads.com/book/show/23692271-sapiens,0062316095,9780062316097,Sapiens: A Brief History of Humankind,4.42,['Yuval Noah Harari'],"100,000 years ago, at least six human species inhabited the earth. Today there is just one. Us. Homo sapiens. How did our species succeed in the battle for dominance? Why did our foraging ancestors come together to create cities and kingdoms? How did we come to believe in gods, nations and human rights; to trust money, books and laws; and to be enslaved by bureaucracy, timetables and consumerism? And what will our world be like in the millennia to come? In Sapiens, Dr Yuval Noah Harari spans the whole of human history, from the very first humans to walk the earth to the radical – and sometimes devastating – breakthroughs of the Cognitive, Agricultural and Scientific Revolutions. Drawing on insights from biology, anthropology, paleontology and economics, he explores how the currents of history have shaped our human societies, the animals and plants around us, and even our personalities. Have we become happier as history has unfolded? Can we ever free our behaviour from the heritage of our ancestors? And what, if anything, can we do to influence the course of the centuries to come? Bold, wide-ranging and provocative, Sapiens challenges everything we thought we knew about being human: our thoughts, our actions, our power ... and our future.","['Nonfiction', 'History', 'Science', 'Philosophy', 'Anthropology', 'Audiobook', 'Sociology', 'Historical', 'Psychology', 'Biology', 'Evolution']"
4,http://goodreads.com/book/show/55030.Cosmos,0375508325,9780375508325,Cosmos,4.37,['Carl Sagan'],"Cosmos has 13 heavily illustrated chapters, corresponding to the 13 episodes of the Cosmos television series. In the book, Sagan explores 15 billion years of cosmic evolution and the development of science and civilization. Cosmos traces the origins of knowledge and the scientific method, mixing science and philosophy, and speculates to the future of science. The book also discusses the underlying premises of science by providing biographical anecdotes about many prominent scientists throughout history, placing their contributions into the broader context of the development of modern science.The book covers a broad range of topics, comprising Sagan's reflections on anthropological, cosmological, biological, historical, and astronomical matters from antiquity to contemporary times. Sagan reiterates his position on extraterrestrial life—that the magnitude of the universe permits the existence of thousands of alien civilizations, but no credible evidence exists to demonstrate that such life has ever visited earth.","['Science', 'Nonfiction', 'Science', 'Astronomy', 'Science', 'Physics', 'History', 'Space', 'Philosophy', 'Science', 'Popular Science', 'Classics', 'Audiobook']"
5,http://goodreads.com/book/show/63697.The_Man_Who_Mistook_His_Wife_for_a_Hat_and_Other_Clinical_Tales,0684853949,9780684853949,The Man Who Mistook His Wife for a Hat and Other Clinical Tales,4.06,['Oliver Sacks'],"If a man has lost a leg or an eye, he knows he has lost a leg or an eye; but if he has lost a self—himself—he cannot know it, because he is no longer there to know it. Dr. Oliver Sacks recounts the stories of patients struggling to adapt to often bizarre worlds of neurological disorder. Here are people who can no longer recognize everyday objects or those they love; who are stricken with violent tics or shout involuntary obscenities; who have been dismissed as autistic or retarded, yet are gifted with uncanny artistic or mathematical talents. If inconceivably strange, these brilliant tales illuminate what it means to be human.","['Nonfiction', 'Psychology', 'Science', 'Health', 'Medicine', 'Biology', 'Neuroscience', 'Medical', 'Short Stories', 'Writing', 'Essays', 'Health', 'Health', 'Mental Health']"
6,http://goodreads.com/book/show/21413662-what-if-serious-scientific-answers-to-absurd-hypothetical-questions,0544272994,9780544272996,What If? Serious Scientific Answers to Absurd Hypothetical Questions,4.15,['Randall Munroe'],"Randall Munroe left NASA in 2005 to start up his hugely popular site XKCD 'a web comic of romance, sarcasm, math and language' which offers a witty take on the world of science and geeks. It now has 600,000 to a million page hits daily. Every now and then, Munroe would get emails asking him to arbitrate a science debate. 'My friend and I were arguing about what would happen if a bullet got struck by lightning, and we agreed that you should resolve it . . . ' He liked these questions so much that he started up What If. If your cells suddenly lost the power to divide, how long would you survive? How dangerous is it, really, to be in a swimming pool in a thunderstorm? If we hooked turbines to people exercising in gyms, how much power could we produce? What if everyone only had one soulmate?When (if ever) did the sun go down on the British empire?  How fast can you hit a speed bump while driving and live?What would happen if the moon went away?In pursuit of answers, Munroe runs computer simulations, pores over stacks of declassified military research memos, solves differential equations, and consults with nuclear reactor operators. His responses are masterpieces of clarity and hilarity, studded with memorable cartoons and infographics. They often predict the complete annihilation of humankind, or at least a really big explosion. Far more than a book for geeks, WHAT IF: Serious Scientific Answers to Absurd Hypothetical Questions explains the laws of science in operation in a way that every intelligent reader will enjoy and feel much the smarter for having read.","['Nonfiction', 'Science', 'Humor', 'Audiobook', 'Science', 'Physics', 'Humor', 'Comedy', 'Science', 'Popular Science', 'Sequential Art', 'Comics', 'Adult', 'Reference']"
7,http://goodreads.com/book/show/1842.Guns_Germs_and_Steel,0739467352,9780739467350,"Guns, Germs, and Steel: The Fates of Human Societies",4.03,['Jared Diamond'],"""Diamond has written a book of remarkable scope ... one of the most important and readable works on the human past published in recent years.""Winner of the Pulitzer Prize and a national bestseller: the global account of the rise of civilization that is also a stunning refutation of ideas of human development based on race.In this ""artful, informative, and delightful"" (William H. McNeill, New York Review of Books) book, Jared Diamond convincingly argues that geographical and environmental factors shaped the modern world. Societies that had a head start in food production advanced beyond the hunter-gatherer stage, and then developed writing, technology, government, and organized religion—as well as nasty germs and potent weapons of war—and adventured on sea and land to conquer and decimate preliterate cultures. A major advance in our understanding of human societies, Guns, Germs, and Steel chronicles the way that the modern world came to be and stunningly dismantles racially based theories of human history.Winner of the Pulitzer Prize, the Phi Beta Kappa Award in Science, the Rhone-Poulenc Prize, and the Commonwealth Club of California's Gold Medal","['History', 'Nonfiction', 'Science', 'Anthropology', 'Sociology', 'Politics', 'Economics', 'Historical', 'History', 'World History', 'Science', 'Geography']"
8,http://goodreads.com/book/show/8049273-the-elegant-universe,039333810X,9780393338102,"The Elegant Universe: Superstrings, Hidden Dimensions, and the Quest for the Ultimate Theory",4.07,['Brian Greene'],"The international bestseller that inspired a major Nova special and sparked a new understanding of the universe, now with a new preface and epilogue.Brian Greene, one of the world's leading string theorists, peels away layers of mystery to reveal a universe that consists of eleven dimensions, where the fabric of space tears and repairs itself, and all matter—from the smallest quarks to the most gargantuan supernovas—is generated by the vibrations of microscopically tiny loops of energy. The Elegant Universe makes some of the most sophisticated concepts ever contemplated accessible and thoroughly entertaining, bringing us closer than ever to understanding how the universe works.","['Science', 'Nonfiction', 'Science', 'Physics', 'Science', 'Astronomy', 'Science', 'Popular Science', 'Philosophy', 'Space', 'Science', 'Mathematics', 'Unfinished', 'Philosophy', 'Theory']"
9,http://goodreads.com/book/show/3272165-bad-science,0007240198,9780007240197,Bad Science,4.06,['Ben Goldacre'],"Full of spleen, this is a hilarious, invigorating and informative journey through the world of Bad Science. When Dr Ben Goldacre saw someone on daytime TV dipping her feet in an 'Aqua Detox' footbath, releasing her toxins into the water, turning it brown, he thought he'd try the same at home. 'Like some kind of Johnny Ball cum Witchfinder General', using his girlfriend's Barbie doll, he gently passed an electrical current through the warm salt water. It turned brown. In his words: 'before my very eyes, the world's first Detox Barbie was sat, with her feet in a pool of brown sludge, purged of a weekend's immorality.' Dr Ben Goldacre is the author of the Bad Science column in the Guardian. His book is about all the 'bad science' we are constantly bombarded with in the media and in advertising. At a time when science is used to prove everything and nothing, everyone has their own 'bad science' moments from the useless pie-chart on the back of cereal packets to the use of the word 'visibly' in cosmetics ads.","['Science', 'Nonfiction', 'Health', 'Medicine', 'Science', 'Popular Science', 'Health', 'Psychology', 'Philosophy', 'Skepticism', 'Medical', 'Audiobook', 'Humor']"
10,http://goodreads.com/book/show/11468377-thinking-fast-and-slow,0374275637,9780374275631,"Thinking, Fast and Slow",4.16,['Daniel Kahneman'],"In the highly anticipated Thinking, Fast and Slow, Kahneman takes us on a groundbreaking tour of the mind and explains the two systems that drive the way we think. System 1 is fast, intuitive, and emotional; System 2 is slower, more deliberative, and more logical. Kahneman exposes the extraordinary capabilities—and also the faults and biases—of fast thinking, and reveals the pervasive influence of intuitive impressions on our thoughts and behavior. The impact of loss aversion and overconfidence on corporate strategies, the difficulties of predicting what will make us happy in the future, the challenges of properly framing risks at work and at home, the profound effect of cognitive biases on everything from playing the stock market to planning the next vacation—each of these can be understood only by knowing how the two systems work together to shape our judgments and decisions.Engaging the reader in a lively conversation about how we think, Kahneman reveals where we can and cannot trust our intuitions and how we can tap into the benefits of slow thinking. He offers practical and enlightening insights into how choices are made in both our business and our personal lives—and how we can use different techniques to guard against the mental glitches that often get us into trouble. Thinking, Fast and Slow will transform the way you think about thinking.","['Nonfiction', 'Psychology', 'Science', 'Business', 'Economics', 'Self Help', 'Self Help', 'Personal Development', 'Philosophy', 'Audiobook', 'Unfinished']"
11,http://goodreads.com/book/show/35167685-surely-you-re-joking-mr-feynman,0393355624,9780393355628,"""Surely You're Joking, Mr. Feynman!"": Adventures of a Curious Character",4.27,['Richard P. Feynman'],"A New York Times bestseller—the outrageous exploits of one of this century's greatest scientific minds and a legendary American original.Richard Feynman, winner of the Nobel Prize in physics, thrived on outrageous adventures. Here he recounts in his inimitable voice his experience trading ideas on atomic physics with Einstein and Bohr and ideas on gambling with Nick the Greek; cracking the uncrackable safes guarding the most deeply held nuclear secrets; accompanying a ballet on his bongo drums; painting a naked female toreador. In short, here is Feynman's life in all its eccentric—a combustible mixture of high intelligence, unlimited curiosity, and raging chutzpah.","['Science', 'Nonfiction', 'Biography', 'Science', 'Physics', 'Autobiography', 'Memoir', 'Biography', 'Autobiography', 'Humor', 'History', 'Biography Memoir', 'Science', 'Popular Science']"
12,http://goodreads.com/book/show/6117055-the-greatest-show-on-earth,059306173X,9780593061732,The Greatest Show on Earth: The Evidence for Evolution,4.16,['Richard Dawkins'],"Charles Darwin’s masterpiece, On the Origin of Species, shook society to its core on publication in 1859. Darwin was only too aware of the storm his theory of evolution would provoke but he would surely have raised an incredulous eyebrow at the controversy still raging a century and a half later. Evolution is accepted as scientific fact by all reputable scientists and indeed theologians, yet millions of people continue to question its veracity.In The Greatest Show on Earth Richard Dawkins takes on creationists, including followers of ‘Intelligent Design’ and all those who question the fact of evolution through natural selection. Like a detective arriving on the scene of a crime, he sifts through fascinating layers of scientific facts and disciplines to build a cast-iron case: from the living examples of natural selection in birds and insects; the ‘time clocks’ of trees and radioactive dating that calibrate a timescale for evolution; the fossil record and the traces of our earliest ancestors; to confirmation from molecular biology and genetics. All of this, and much more, bears witness to the truth of evolution.The Greatest Show on Earth comes at a critical time: systematic opposition to the fact of evolution is now flourishing as never before, especially in America. In Britain and elsewhere in the world, teachers witness insidious attempts to undermine the status of science in their classrooms. Richard Dawkins provides unequivocal evidence that boldly and comprehensively rebuts such nonsense. At the same time he shares with us his palpable love of the natural world and the essential role that science plays in its interpretation. Written with elegance, wit and passion, it is hard-hitting, absorbing and totally convincing.","['Science', 'Nonfiction', 'Biology', 'Evolution', 'Science', 'Biology', 'Religion', 'Religion', 'Atheism', 'Science', 'Popular Science', 'Philosophy', 'History', 'Audiobook']"
13,http://goodreads.com/book/show/14743.The_God_Delusion,0618680004,9780618680009,The God Delusion,3.9,['Richard Dawkins'],"A preeminent scientist - and the world's most prominent atheist - asserts the irrationality of belief in God, and the grievous harm religion has inflicted on society, from the Crusades to 9/11.With rigor and wit, Dawkins examines God in all his forms, from the sex-obsessed tyrant of the Old Testament, to the more benign (but still illogical) Celestial Watchmaker favored by some Enlightenment thinkers. He eviscerates the major arguments for religion, and demonstrates the supreme improbability of a supreme being. He shows how religion fuels war, foments bigotry, and abuses children, buttressing his points with historical and contemporary evidence.The God Delusion makes a compelling case that belief in God is not just wrong, but potentially deadly. It also offers exhilarating insight into the advantages of atheism to the individual and society, not the least of which is a clearer, truer appreciation of the universe's wonders than any faith could ever muster.","['Nonfiction', 'Religion', 'Science', 'Philosophy', 'Religion', 'Atheism', 'Audiobook', 'Religion', 'Theology', 'Spirituality', 'Psychology', 'Biology', 'Evolution']"
14,http://goodreads.com/book/show/8520362-the-grand-design,0553805371,9780553805376,The Grand Design,4.04,['Stephen Hawking'],"THE FIRST MAJOR WORK IN NEARLY A DECADE BY ONE OF THE WORLD’S GREAT THINKERS—A MARVELOUSLY CONCISE BOOK WITH NEW ANSWERS TO THE ULTIMATE QUESTIONS OF LIFE When and how did the universe begin? Why are we here? Why is there something rather than nothing? What is the nature of reality? Why are the laws of nature so finely tuned as to allow for the existence of beings like ourselves? And, finally, is the apparent “grand design” of our universe evidence of a benevolent creator who set things in motion—or does science offer another explanation? The most fundamental questions about the origins of the universe and of life itself, once the province of philosophy, now occupy the territory where scientists, philosophers, and theologians meet—if only to disagree. In their new book, Stephen Hawking and Leonard Mlodinow present the most recent scientific thinking about the mysteries of the universe, in nontechnical language marked by both brilliance and simplicity. In The Grand Design they explain that according to quantum theory, the cosmos does not have just a single existence or history, but rather that every possible history of the universe exists simultaneously. When applied to the universe as a whole, this idea calls into question the very notion of cause and effect. But the “top-down” approach to cosmology that Hawking and Mlodinow describe would say that the fact that the past takes no definite form means that we create history by observing it, rather than that history creates us. The authors further explain that we ourselves are the product of quantum fluctuations in the very early universe, and show how quantum theory predicts the “multiverse”—the idea that ours is just one of many universes that appeared spontaneously out of nothing, each with different laws of nature.Along the way Hawking and Mlodinow question the conventional concept of reality, posing a “model-dependent” theory of reality as the best we can hope to find. And they conclude with a riveting assessment of M-theory, an explanation of the laws governing us and our universe that is currently the only viable candidate for a complete “theory of everything.” If confirmed, they write, it will be the unified theory that Einstein was looking for, and the ultimate triumph of human reason.A succinct, startling, and lavishly illustrated guide to discoveries that are altering our understanding and threatening some of our most cherished belief systems, The Grand Design is a book that will inform—and provoke—like no other.'","['Science', 'Nonfiction', 'Science', 'Physics', 'Philosophy', 'Science', 'Popular Science', 'Science', 'Astronomy', 'Audiobook', 'Religion', 'History', 'Space']"
15,http://goodreads.com/book/show/17349.The_Demon_Haunted_World,0345409469,9780345409461,The Demon-Haunted World: Science as a Candle in the Dark,4.27,['Carl Sagan'],"How can we make intelligent decisions about our increasingly technology-driven lives if we don’t understand the difference between the myths of pseudoscience and the testable hypotheses of science? Pulitzer Prize-winning author and distinguished astronomer Carl Sagan argues that scientific thinking is critical not only to the pursuit of truth but to the very well-being of our democratic institutions.Casting a wide net through history and culture, Sagan examines and authoritatively debunks such celebrated fallacies of the past as witchcraft, faith healing, demons, and UFOs. And yet, disturbingly, in today's so-called information age, pseudoscience is burgeoning with stories of alien abduction, channeling past lives, and communal hallucinations commanding growing attention and respect. As Sagan demonstrates with lucid eloquence, the siren song of unreason is not just a cultural wrong turn but a dangerous plunge into darkness that threatens our most basic freedoms.","['Science', 'Nonfiction', 'Philosophy', 'Religion', 'History', 'Philosophy', 'Skepticism', 'Religion', 'Atheism', 'Science', 'Popular Science', 'Science', 'Physics', 'Psychology']"
