,book_link,isbn,isbn13,book_title,avg_rating,author_name,book_desc,genres
16,http://goodreads.com/book/show/31138556-homo-deus,1910701882,9781910701881,Homo Deus: A History of Tomorrow,4.25,['Yuval Noah Harari'],"Yuval Noah Harari, author of the critically-acclaimed New York Times bestseller and international phenomenon Sapiens, returns with an equally original, compelling, and provocative book, turning his focus toward humanity’s future, and our quest to upgrade humans into gods.Over the past century humankind has managed to do the impossible and rein in famine, plague, and war. This may seem hard to accept, but, as Harari explains in his trademark style—thorough, yet riveting—famine, plague and war have been transformed from incomprehensible and uncontrollable forces of nature into manageable challenges. For the first time ever, more people die from eating too much than from eating too little; more people die from old age than from infectious diseases; and more people commit suicide than are killed by soldiers, terrorists and criminals put together. The average American is a thousand times more likely to die from binging at McDonalds than from being blown up by Al Qaeda.What then will replace famine, plague, and war at the top of the human agenda? As the self-made gods of planet earth, what destinies will we set ourselves, and which quests will we undertake? Homo Deus explores the projects, dreams and nightmares that will shape the twenty-first century—from overcoming death to creating artificial life. It asks the fundamental questions: Where do we go from here? And how will we protect this fragile world from our own destructive powers? This is the next stage of evolution. This is Homo Deus.With the same insight and clarity that made Sapiens an international hit and a New York Times bestseller, Harari maps out our future. ","['Nonfiction', 'History', 'Science', 'Philosophy', 'Anthropology', 'Audiobook', 'Sociology', 'Science', 'Technology', 'Politics', 'Psychology']"
17,http://goodreads.com/book/show/64582.Chaos,0140092501,9780140092509,Chaos: Making a New Science,4.01,['James Gleick'],"A work of popular science in the tradition of Stephen Hawking and Carl Sagan, this 20th-anniversary edition of James Gleick’s groundbreaking bestseller Chaos introduces a whole new readership to chaos theory, one of the most significant waves of scientific knowledge in our time. From Edward Lorenz’s discovery of the Butterfly Effect, to Mitchell Feigenbaum’s calculation of a universal constant, to Benoit Mandelbrot’s concept of fractals, which created a new geometry of nature, Gleick’s engaging narrative focuses on the key figures whose genius converged to chart an innovative direction for science. In Chaos, Gleick makes the story of chaos theory not only fascinating but also accessible to beginners, and opens our eyes to a surprising new view of the universe.","['Science', 'Nonfiction', 'Science', 'Mathematics', 'Science', 'Physics', 'Science', 'Popular Science', 'Philosophy', 'History', 'Unfinished', 'Audiobook', 'Psychology']"
18,http://goodreads.com/book/show/1202.Freakonomics,0061234001,9780061234002,Freakonomics: A Rogue Economist Explores the Hidden Side of Everything,3.98,['Steven D. Levitt'],"Which is more dangerous, a gun or a swimming pool? What do schoolteachers and sumo wrestlers have in common? Why do drug dealers still live with their moms? How much do parents really matter? What kind of impact did Roe v. Wade have on violent crime? Freakonomics will literally redefine the way we view the modern world.These may not sound like typical questions for an economist to ask. But Steven D. Levitt is not a typical economist. He is a much heralded scholar who studies the stuff and riddles of everyday life -- from cheating and crime to sports and child rearing -- and whose conclusions regularly turn the conventional wisdom on its head. He usually begins with a mountain of data and a simple, unasked question. Some of these questions concern life-and-death issues; others have an admittedly freakish quality. Thus the new field of study contained in this book: freakonomics.Through forceful storytelling and wry insight, Levitt and co-author Stephen J. Dubner show that economics is, at root, the study of incentives -- how people get what they want, or need, especially when other people want or need the same thing. In Freakonomics, they set out to explore the hidden side of ... well, everything. The inner workings of a crack gang. The truth about real-estate agents. The myths of campaign finance. The telltale marks of a cheating schoolteacher. The secrets of the Ku Klux Klan.What unites all these stories is a belief that the modern world, despite a surfeit of obfuscation, complication, and downright deceit, is not impenetrable, is not unknowable, and -- if the right questions are asked -- is even more intriguing than we think. All it takes is a new way of looking. Steven Levitt, through devilishly clever and clear-eyed thinking, shows how to see through all the clutter.Freakonomics establishes this unconventional premise: If morality represents how we would like the world to work, then economics represents how it actually does work. It is true that readers of this book will be armed with enough riddles and stories to last a thousand cocktail parties. But Freakonomics can provide more than that. It will literally redefine the way we view the modern world.(front flap)","['Nonfiction', 'Economics', 'Business', 'Science', 'Psychology', 'Sociology', 'Politics', 'Economics', 'Finance', 'Audiobook', 'Social Science']"
19,http://goodreads.com/book/show/32191710-astrophysics-for-people-in-a-hurry,0393609391,9780393609394,Astrophysics for People in a Hurry,4.08,['Neil deGrasse Tyson'],"What is the nature of space and time? How do we fit within the universe? How does the universe fit within us? There’s no better guide through these mind-expanding questions than acclaimed astrophysicist and best-selling author Neil deGrasse Tyson.But today, few of us have time to contemplate the cosmos. So Tyson brings the universe down to Earth succinctly and clearly, with sparkling wit, in tasty chapters consumable anytime and anywhere in your busy day.","['Nonfiction', 'Science', 'Audiobook', 'Science', 'Physics', 'Space', 'Science', 'Astronomy', 'Science', 'Popular Science', 'Adult', 'History', 'Education']"
20,http://goodreads.com/book/show/117047.The_Blind_Watchmaker,0141026162,9780141026169,The Blind Watchmaker: Why the Evidence of Evolution Reveals a Universe Without Design,4.08,['Richard Dawkins'],"***30th Anniversary Edition*** Cover note: Each copy of the anniversary edition of The Blind Watchmaker features a unique biomorph. No two covers are exactly alike.Acclaimed as the most influential work on evolution written in the last hundred years, The Blind Watchmaker offers an inspiring and accessible introduction to one of the most important scientific discoveries of all time. A brilliant and controversial book which demonstrates that evolution by natural selection - the unconscious, automatic, blind yet essentially non-random process discovered by Darwin - is the only answer to the biggest question of all: why do we exist?","['Science', 'Nonfiction', 'Biology', 'Evolution', 'Science', 'Biology', 'Philosophy', 'Religion', 'Religion', 'Atheism', 'Science', 'Popular Science', 'Audiobook', 'Biology', 'Genetics']"
21,http://goodreads.com/book/show/6493208-the-immortal-life-of-henrietta-lacks,1400052173,9781400052172,The Immortal Life of Henrietta Lacks,4.07,['Rebecca Skloot'],"Her name was Henrietta Lacks, but scientists know her as HeLa. She was a poor Southern tobacco farmer who worked the same land as her slave ancestors, yet her cells—taken without her knowledge—became one of the most important tools in medicine. The first “immortal” human cells grown in culture, they are still alive today, though she has been dead for more than sixty years. If you could pile all HeLa cells ever grown onto a scale, they’d weigh more than 50 million metric tons—as much as a hundred Empire State Buildings. HeLa cells were vital for developing the polio vaccine; uncovered secrets of cancer, viruses, and the atom bomb’s effects; helped lead to important advances like in vitro fertilization, cloning, and gene mapping; and have been bought and sold by the billions.Yet Henrietta Lacks remains virtually unknown, buried in an unmarked grave.Now Rebecca Skloot takes us on an extraordinary journey, from the “colored” ward of Johns Hopkins Hospital in the 1950s to stark white laboratories with freezers full of HeLa cells; from Henrietta’s small, dying hometown of Clover, Virginia — a land of wooden slave quarters, faith healings, and voodoo — to East Baltimore today, where her children and grandchildren live and struggle with the legacy of her cells.Henrietta’s family did not learn of her “immortality” until more than twenty years after her death, when scientists investigating HeLa began using her husband and children in research without informed consent. And though the cells had launched a multimillion-dollar industry that sells human biological materials, her family never saw any of the profits. As Rebecca Skloot so brilliantly shows, the story of the Lacks family — past and present — is inextricably connected to the dark history of experimentation on African Americans, the birth of bioethics, and the legal battles over whether we control the stuff we are made of.Over the decade it took to uncover this story, Rebecca became enmeshed in the lives of the Lacks family—especially Henrietta’s daughter Deborah, who was devastated to learn about her mother’s cells. She was consumed with questions: Had scientists cloned her mother? Did it hurt her when researchers infected her cells with viruses and shot them into space? What happened to her sister, Elsie, who died in a mental institution at the age of fifteen? And if her mother was so important to medicine, why couldn’t her children afford health insurance?Intimate in feeling, astonishing in scope, and impossible to put down, The Immortal Life of Henrietta Lacks captures the beauty and drama of scientific discovery, as well as its human consequences.","['Nonfiction', 'Science', 'History', 'Biography', 'Health', 'Medicine', 'Audiobook', 'Book Club', 'Medical', 'Biography Memoir', 'Historical']"
22,http://goodreads.com/book/show/22435.The_Fabric_of_the_Cosmos,0965900584,9780965900584,"The Fabric of the Cosmos: Space, Time, and the Texture of Reality",4.11,['Brian Greene'],"From Brian Greene, one of the world’s leading physicists and author the Pulitzer Prize finalist The Elegant Universe, comes a grand tour of the universe that makes us look at reality in a completely different way.Space and time form the very fabric of the cosmos. Yet they remain among the most mysterious of concepts. Is space an entity? Why does time have a direction? Could the universe exist without space and time? Can we travel to the past? Greene has set himself a daunting task: to explain non-intuitive, mathematical concepts like String Theory, the Heisenberg Uncertainty Principle, and Inflationary Cosmology with analogies drawn from common experience. From Newton’s unchanging realm in which space and time are absolute, to Einstein’s fluid conception of spacetime, to quantum mechanics’ entangled arena where vastly distant objects can instantaneously coordinate their behavior, Greene takes us all, regardless of our scientific backgrounds, on an irresistible and revelatory journey to the new layers of reality that modern physics has discovered lying just beneath the surface of our everyday world.","['Science', 'Nonfiction', 'Science', 'Physics', 'Science', 'Astronomy', 'Science', 'Popular Science', 'Space', 'Philosophy', 'Audiobook', 'History', 'Physics', 'Quantum Mechanics']"
23,http://goodreads.com/book/show/7170627-the-emperor-of-all-maladies,1439170916,9781439170915,The Emperor of All Maladies: A Biography of Cancer,4.29,['Siddhartha Mukherjee'],"Alternate Cover Edition ISBN 1439107955 (ISBN13: 9781439107959)The Emperor of All Maladies is a magnificent, profoundly humane “biography” of cancer - from its first documented appearances thousands of years ago through the epic battles in the twentieth century to cure, control, and conquer it to a radical new understanding of its essence. Physician, researcher, and award-winning science writer, Siddhartha Mukherjee examines cancer with a cellular biologist’s precision, a historian’s perspective, and a biographer’s passion. The result is an astonishingly lucid and eloquent chronicle of a disease humans have lived with - and perished from - for more than five thousand years. The story of cancer is a story of human ingenuity, resilience, and perseverance, but also of hubris, paternalism, and misperception. Mukherjee recounts centuries of discoveries, setbacks, victories, and deaths, told through the eyes of his predecessors and peers, training their wits against an infinitely resourceful adversary that, just three decades ago, was thought to be easily vanquished in an all-out “war against cancer.” The book reads like a literary thriller with cancer as the protagonist. From the Persian Queen Atossa, whose Greek slave cut off her malignant breast, to the nineteenth-century recipients of primitive radiation and chemotherapy to Mukherjee’s own leukemia patient, Carla, The Emperor of All Maladies is about the people who have soldiered through fiercely demanding regimens in order to survive—and to increase our understanding of this iconic disease. Riveting, urgent, and surprising, The Emperor of All Maladies provides a fascinating glimpse into the future of cancer treatments. It is an illuminating book that provides hope and clarity to those seeking to demystify cancer.","['Nonfiction', 'Science', 'History', 'Health', 'Medicine', 'Medical', 'Health', 'Science', 'Biology', 'Audiobook', 'Biography', 'Science', 'Popular Science']"
24,http://goodreads.com/book/show/1168341.Physics_of_the_Impossible,0385520697,9780385520690,Physics of the Impossible,4.07,['Michio Kaku'],"A fascinating exploration of the science of the impossible—from death rays and force fields to invisibility cloaks—revealing to what extent such technologies might be achievable decades or millennia into the future.One hundred years ago, scientists would have said that lasers, televisions, and the atomic bomb were beyond the realm of physical possibility. In Physics of the Impossible, the renowned physicist Michio Kaku explores to what extent the technologies and devices of science fiction that are deemed equally impossible today might well become commonplace in the future.From teleportation to telekinesis, Kaku uses the world of science fiction to explore the fundamentals—and the limits—of the laws of physics as we know them today. He ranks the impossible technologies by categories—Class I, II, and III, depending on when they might be achieved, within the next century, millennia, or perhaps never. In a compelling and thought-provoking narrative, he explains:· How the science of optics and electromagnetism may one day enable us to bend light around an object, like a stream flowing around a boulder, making the object invisible to observers “downstream”· How ramjet rockets, laser sails, antimatter engines, and nanorockets may one day take us to the nearby stars· How telepathy and psychokinesis, once considered pseudoscience, may one day be possible using advances in MRI, computers, superconductivity, and nanotechnology· Why a time machine is apparently consistent with the known laws of quantum physics, although it would take an unbelievably advanced civilization to actually build oneKaku uses his discussion of each technology as a jumping-off point to explain the science behind it. An extraordinary scientific adventure, Physics of the Impossible takes readers on an unforgettable, mesmerizing journey into the world of science that both enlightens and entertains.","['Science', 'Nonfiction', 'Science', 'Physics', 'Science', 'Popular Science', 'Science', 'Technology', 'Science', 'Astronomy', 'Space', 'Science Fiction', 'Time Travel', 'Audiobook', 'Reference']"
25,http://goodreads.com/book/show/38412.Fermat_s_Enigma,0385493622,9780385493628,Fermat's Enigma: The Epic Quest to Solve the World's Greatest Mathematical Problem,4.26,['Simon Singh'],"xn + yn = zn, where n represents 3, 4, 5, ...no solution""I have discovered a truly marvelous demonstration of this proposition which this margin is too narrow to contain.""With these words, the seventeenth-century French mathematician Pierre de Fermat threw down the gauntlet to future generations.  What came to be known as Fermat's Last Theorem looked simple; proving it, however, became the Holy Grail of mathematics, baffling its finest minds for more than 350 years.  In Fermat's Enigma--based on the author's award-winning documentary film, which aired on PBS's ""Nova""--Simon Singh tells the astonishingly entertaining story of the pursuit of that grail, and the lives that were devoted to, sacrificed for, and saved by it.  Here is a mesmerizing tale of heartbreak and mastery that will forever change your feelings about mathematics.","['Science', 'Nonfiction', 'Science', 'Mathematics', 'History', 'Science', 'Popular Science', 'Biography', 'Historical', 'Philosophy', 'Science', 'History Of Science', 'Science', 'Physics']"
26,http://goodreads.com/book/show/24113.G_del_Escher_Bach,0465026567,9780465026562,"Gödel, Escher, Bach: An Eternal Golden Braid",4.28,['Douglas R. Hofstadter'],"Douglas Hofstadter's book is concerned directly with the nature of “maps” or links between formal systems. However, according to Hofstadter, the formal system that underlies all mental activity transcends the system that supports it. If life can grow out of the formal chemical substrate of the cell, if consciousness can emerge out of a formal system of firing neurons, then so too will computers attain human intelligence. Gödel, Escher, Bach is a wonderful exploration of fascinating ideas at the heart of cognitive science: meaning, reduction, recursion, and much more.","['Science', 'Nonfiction', 'Philosophy', 'Science', 'Mathematics', 'Music', 'Psychology', 'Science', 'Computer Science', 'Art', 'Unfinished', 'History']"
27,http://goodreads.com/book/show/32145.Stiff,0393324826,9780393324822,Stiff: The Curious Lives of Human Cadavers,4.06,['Mary Roach'],"Stiff is an oddly compelling, often hilarious exploration of the strange lives of our bodies postmortem. For two thousand years, cadavers—some willingly, some unwittingly—have been involved in science's boldest strides and weirdest undertakings. In this fascinating account, Mary Roach visits the good deeds of cadavers over the centuries and tells the engrossing story of our bodies when we are no longer with them.","['Nonfiction', 'Science', 'Humor', 'Medical', 'Death', 'Health', 'Medicine', 'Audiobook', 'History', 'Adult', 'Science', 'Biology']"
28,http://goodreads.com/book/show/17994.The_Code_Book,0385495323,9780385495325,The Code Book: The Science of Secrecy from Ancient Egypt to Quantum Cryptography,4.28,['Simon Singh'],"In his first book since the bestselling Fermat’s Enigma, Simon Singh offers the first sweeping history of encryption, tracing its evolution and revealing the dramatic effects codes have had on wars, nations, and individual lives. From Mary, Queen of Scots, trapped by her own code, to the Navajo Code Talkers who helped the Allies win World War II, to the incredible (and incredibly simple) logisitical breakthrough that made Internet commerce secure, The Code Book tells the story of the most powerful intellectual weapon ever known: secrecy.Throughout the text are clear technical and mathematical explanations, and portraits of the remarkable personalities who wrote and broke the world’s most difficult codes. Accessible, compelling, and remarkably far-reaching, this book will forever alter your view of history and what drives it. It will also make you wonder how private that e-mail you just sent really is.","['Nonfiction', 'Science', 'History', 'Science', 'Mathematics', 'Science', 'Computer Science', 'Science', 'Technology', 'Science', 'Popular Science', 'Computer Science', 'Computers', 'History', 'Microhistory', 'Spy Thriller', 'Espionage']"
29,http://goodreads.com/book/show/27276428-the-gene,1476733503,9781476733500,The Gene: An Intimate History,4.35,['Siddhartha Mukherjee'],"Spanning the globe and several centuries, The Gene is the story of the quest to decipher the master-code that makes and defines humans, that governs our form and function.The story of the gene begins in an obscure Augustinian abbey in Moravia in 1856 where a monk stumbles on the idea of a ‘unit of heredity’. It intersects with Darwin’s theory of evolution, and collides with the horrors of Nazi eugenics in the 1940s. The gene transforms post-war biology. It reorganizes our understanding of sexuality, temperament, choice and free will. This is a story driven by human ingenuity and obsessive minds – from Charles Darwin and Gregor Mendel to Francis Crick, James Watson and Rosalind Franklin, and the thousands of scientists still working to understand the code of codes.This is an epic, moving history of a scientific idea coming to life, by the author of The Emperor of All Maladies. But woven through The Gene, like a red line, is also an intimate history – the story of Mukherjee’s own family and its recurring pattern of mental illness, reminding us that genetics is vitally relevant to everyday lives. These concerns reverberate even more urgently today as we learn to “read” and “write” the human genome – unleashing the potential to change the fates and identities of our children.Majestic in its ambition, and unflinching in its honesty, The Gene gives us a definitive account of the fundamental unit of heredity – and a vision of both humanity’s past and future.","['Science', 'Nonfiction', 'History', 'Science', 'Biology', 'Health', 'Medicine', 'Biology', 'Genetics', 'Health', 'Audiobook', 'Medical', 'Science', 'Popular Science']"
30,http://goodreads.com/book/show/40102.Blink,0316010669,9780316010665,Blink: The Power of Thinking Without Thinking,3.94,['Malcolm Gladwell'],"Drawing on cutting-edge neuroscience and psychology and displaying all of the brilliance that made The Tipping Point a classic, Blink changes the way you'll understand every decision you make. Never again will you think about thinking the same way.Malcolm Gladwell redefined how we understand the world around us. Now, in Blink, he revolutionizes the way we understand the world within. Blink is a book about how we think without thinking, about choices that seem to be made in an instant - in the blink of an eye - that actually aren't as simple as they seem. Why are some people brilliant decision makers, while others are consistently inept? Why do some people follow their instincts and win, while others end up stumbling into error? How do our brains really work - in the office, in the classroom, in the kitchen, and in the bedroom? And why are the best decisions often those that are impossible to explain to others? In Blink we meet the psychologist who has learned to predict whether a marriage will last, based on a few minutes of observing a couple; the tennis coach who knows when a player will double-fault before the racket even makes contact with the ball; the antiquities experts who recognize a fake at a glance. Here, too, are great failures of ""blink"": the election of Warren Harding; ""New Coke""; and the shooting of Amadou Diallo by police. Blink reveals that great decision makers aren't those who process the most information or spend the most time deliberating, but those who have perfected the art of ""thin-slicing"" - filtering the very few factors that matter from an overwhelming number of variables.","['Nonfiction', 'Psychology', 'Business', 'Science', 'Self Help', 'Sociology', 'Audiobook', 'Self Help', 'Personal Development', 'Philosophy', 'Leadership']"
