,isbn,user_link,ranking,review
9,0393355500,http://goodreads.com/user/show/79967313-walter-schutjens,5," 1.0 Events during the reading of 'From Bacteria to Bach and Back'- 1. Meeting Daniel C. Dennett!I was lucky enough to find Dennett giving a lecture at the Psycholinguistics Institute of Nijmegen on Oct. 17th, a mere 3 hours by train from my native the Hague. This of course was an opportunity I could not afford to miss, and so I attended the lecture along with my good friend and fellow pseudo-philosopher Leon Grant. The lecture was specifically regarding this book, and so while reading it I had a nice overview given for a public audience already making the relevant neural connections and Bayesian inference in my brain. I had the honour of talking to Dennett while he was signing my copy of 'Consciousness Explained', and asked him about my dilemma between studying either Neuroscience or Philosophy. His reply was, ""I have many students that have finished their PhD's and are now looking into studying Philosophy as they did not find the answers to their questions in Neuroscience"". 2. A family dilemma...- I had just finished reading the section of the book pertaining the nature of human consciousness, and for those unbeknownst of the work of Dennett he is quite the physicalist, specifically when it comes to questions on free-will and our conscious perception. Currently staying at my religious grandparents, I was asked at the breakfast table to tell about the book I was currently reading. To further ground my personal understanding of the concepts in the book, I gave a thorough explanation on the evolution of their minds, along with the cultural evolution of thoughts and ""memes"" or abstract symbionts of information. Stating that the brain is no more than a biological mass that has been hijacked by informational parasites that seek to be spread, that created our cognitive architecture, creating a manifest view of the world, allow us to be ""competent with comprehension"". Eventually concluding that consciousness is no more than an oversimplified user illusion of the output of the unimaginably complex nature of our cognition. Free-will being something that is not allowed for through our consciousness as it has no causal link to the informational processing of our brains. Later that afternoon my grandmother approached me with two books, one of a pastor, and one of the Dalai Lama, stating that it would be better for my future if I had read these books first...2.0 The Book  I am in no regards an expert on this topic, and so cannot say much on the validity of the arguments presented in this book. I am aware that there is an academic war going on between thinkers such as Dennett and Harris, or Chalmers, something he often hinted at in both his talks and his books, and I am looking forward to reading the argumentation on the other side of the aisle. I can however review this books in terms of how it reads for a Philosophy of Mind beginner, in terms of how well the concepts are explained and being a semi-'popular science' book, how enjoyable it was to read. The concepts investigated in this book are definitely challenging, it starts off easy, explaining basic evolutionary theory, with small intrusions of philosophy regarding the definition of a 'reason' or the darwinian inversion of reasoning. The book progresses into the notion of cultural evolution, and how the recent endosymbiotic relation of Homo sapien and 'memes' allowed for complex thought and a method for introspection. This contains fairly complex philosophical reasoning but nothing that cant be understood with careful and critical reading (the average reading time of a page was 1 min. 20 sec. an all time high). In the conclusion of the book there is no answer provided as to how exactly a phenomenal experience arises from our perception of the manifest reality (what we think to see). But the reasons that we do have a conscious perception of the manifest reality, in the sense that it is an abstraction of the scientific reality is explained in a satisfactory manner. I specifically found the parts of the book that regard our communication as a beneficiary and need of our conscious perception to be especially interesting. Eventually giving this book 5/5 stars because of its bearing of light on truths that are reasoned against my own intuition of belief. Why read a Franz Kafka to be unsettled when you can read a Dennett and be violently dethroned from our human superiority complex in terms of the nature of your very perception of reality, our being."
10,0393355500,http://goodreads.com/user/show/2704424-nick-klagge,4,"This is one of those books that I really liked, wanted to write a great review for, and consequently put off writing the review for way too long! I am remedying that now, not by writing a great review, but by writing a review.Dennett's purpose in the book is to sketch an outline of how consciousness as humans experience it could have grown out of a purely mechanistic process. This has been a focus of much of his work for decades, but he says in this book that he wants to attempt a summation, and that recent research can provide further support for things he has talked about in the past.The book is certainly too rich for me to summarize adequately here, but I will mention a few things. First, the concept of ""memes"" plays a huge role, and if you think memes are cat pictures, UR DOIN IT RONG. This was the first extended serious treatment of memetic theory that I've read, and I felt pretty amenable to it. More or less the idea is that there are patterns of thought that can reproduce themselves in other minds via communication, that there is some type of mutation that goes on when such a pattern is translated from one mind to another, and that these patterns have differential success in durably reproducing themselves in other minds. These patterns, or memes, can be a really wide range of things, from songs that get stuck in your head to big concepts like agriculture. The three characteristics I listed above are the same ones that Darwin describes regarding genes, and themselves are sufficient to produce natural selection effects. It's a little harder to think about memes than genes, but I'd be hard-pressed to argue against the premises and conclusion that memes reproduce and are subject to natural selection just like genes.Second, I'll mention the three ""strange inversions"" that Dennett kind of structures the book around. These are conceptual breakthroughs that he sees as paving the way for a theory of the evolution of minds. First is Darwin's own inversion, which says that you can have ""reasons without reasoners."" The concept of natural selection allows us to say that a certain type of bird has a long beak ""so that"" it can drink nectar from a certain flower, without ascribing that reasoning to any conscious actor. Second is Turing's inversion, which says that you can have ""competence without comprehension."" A Turing machine shows us that it is possible for an entity to do arithmetic (and much more complex tasks!) while demonstrably just following a deterministic set of instructions. Finally, and maybe most interestingly, is Hume's inversion. I don't think Dennett gave a catchy description of this one like the other two. But this inversion is the understanding that many things that we feel we ""perceive in the outside world"" are really only internal to us, including the perception of causation, sexiness, cuteness, sweetness, etc.Anyway, if you want to get a deeper sense of the argument, read the book! Last, I want to mention a few interesting quotes from the end, where Dennett is talking about the implications of ""thinking"" technology, particularly modern advancements such as deep learning.""The real danger, I think, is not that machines more intelligent than we are will usurp our role as captains of our destinies, but that we will over-estimate the comprehension of our latest thinking tools, prematurely ceding authority to them far beyond their competence."" (402)""Systems that deliberately conceal their shortcuts and gaps of incompetence should be deemed fraudulent, and their creators should go to jail for the crime of creating or using an artificial intelligence that impersonates a human being."" (403) - This is astonishingly close to the commandment of the Butlerian Jihad in Dune, ""Thou shalt not create a machine in the likeness of a human mind""!"
11,0393355500,http://goodreads.com/user/show/44021534-jules-findlay,2,"There is very little about Bacteria, even less about Bach. Dennett revisits his arguments to date, combining them into a fairly long-winded and non-essential worldview. It’s the same reductive materialist ontology that permeates all of his work. He attempts to explain away the problem of consciousness, accusing us of being faillible to ‘Cartesian gravity’. In other words there is no such things as ‘I’. Our minds are thousands of tiny robots dancing and self-control is an illusion. The mind isn’t composed, as Descartes argued, of something other than matter, but matter itself. Our inventions and societies are top down intelligent design from bottom-up evolution; only now are we beginning to understand that our competence can be comprehended. The designed have become the designers, and it is physical processes that give rise to phenomenal character, nothing else. Honestly I would give this one a miss and try some of his other books. Cue the haters. "
12,0393355500,http://goodreads.com/user/show/1045774-mehrsa,4,"I love the way Dennett thinks and reasons. He is the king of finding good analogies to explain difficult concepts. It's just a joy to hear him think through problems and offer counter arguments and reason his way through problems. I loved his other books and a friend recommended I read this one after I was over the moon about The Human Instinct by Miller. And perhaps if I had read this one first, I would love loved it, but the Miller book was so much more profound than this one. The promise of this book is incredibly ambitious--how does conscious come about? but the answer is sort of flat and predictable--just evolution and in the same way as other animals. I mean, yes, I agree with the answer, but he seems to evade or dismiss most claims of human superiority as just thinking we're special. Miller goes much further in explaining consciousness while never straying from a strictly evolutionary standpoint. So I would say read that one. "
13,0393355500,http://goodreads.com/user/show/26929453-todd,2,"There are great ideas in here, but they are not presented in a clear or convincing way. Some people may find Dennett's (somewhat subversive) writing style enjoyable, but I find it tedious and meandering. It is more of a clearinghouse of the author's scholarly knowledge than any organized idea or thesis. Try the first chapter and see if it works for you. I expected the intro to be a bit more scattered than the rest of the book, but unfortunately it never gets any better.That said, some of his metaphors make more and more sense as the book progresses such as the computer desktop interface model of higher thought process."
14,0393355500,http://goodreads.com/user/show/5594877-jl,2,"Way too much ""I/Me""; the author obviously likes to ""hear"" himself write. Frequently incomprehensibly didactic, and purposefully pedantic. Sample sentence: ""We won't have a complete science of consciousness until we can align our manifest-image identifications of mental states by their contents with scientific-image identifications of the subpersonal information structures and events that are causally responsible for generating the details of the user-illusion we take ourselves to operate in."" Riiiiiight."
15,0393355500,http://goodreads.com/user/show/16212136-peter-pete-mcloughlin,5,"First I really enjoyed the book even though many felt Dennett circled around topics too much. I enjoyed the circling around an idea and looking at it from different angles. Like a diamond with many facets explaining big topics like origins of life, language, consciousness are gonna take a careful dissection. I also get the vibe that Dennett is used to being distorted or misunderstood so he wanted to nail his case. His story on consciousness is actually quite plausible. I think Graziano whose book I read recently is a bit more direct and easily understood on explaining the hard problem of consciousness and uses language that can get through to even a qualia freak like myself but I think Dennett gives so much more detailed description of evolution, neuroscience, artificial intelligence, and philosophy that you get all kinds of interesting digressions some people might be turned off by all the diversions but I enjoyed it. Although in the end, I think Graziano explains for me the same solution to the hard problem a bit more intuitively. I will leave a link to his book on Goodreads.https://www.goodreads.com/book/show/4..."
16,0393355500,http://goodreads.com/user/show/1054712-kent-winward,4,"Dennett continues more on how our consciousness is an emergent property of evolution, but the thing that struck me the most was the underlying implication that our consciousness seems to arise almost outside ourselves. Without language and social structure, we don't have consciousness. Our body remembers early childhood trauma, our mind does not. Our first conscious memories only come until we are three or four as we first start to realize we are part of a bigger world. (This is my musings, not Dennett's.) We have limited thinking that our thoughts arise out of our brains, but our brains are designed for helping us an organism survive in the world. As a survival mechanism, socialization and language for humans has proven extremely effective. Awareness has levels and the ability to self-talk only can come after we learn to talk to others. Somehow in this process consciousness emerges, but it is more than just our brains that creates this, it is our surroundings and other humans. Consciousness is something we share. "
17,0393355500,http://goodreads.com/user/show/1339246-gendou,3,"This book explores the evolution of the human mind. Unfortunately, Dennett isn't an evolutionary biologist, so it's mostly driven by philosophical questions. Sometimes those questions have answers, other times, frustratingly, they do not. This isn't as well organized as other books/arguments by Dennett. It reuses a lot of material from his other books.I'd recommend this one for anyone who isn't convinced that the human mind evolved."
18,0393355500,http://goodreads.com/user/show/38288046-sopyka,2,"This book feels it's made only of Prefaces. Every chapters so far is explaining why he's writing the book and asking readers not to be angry with him for what he's writing.Write something of substance and let me decide if I want to be angry!And I'm getting sick of authors explaining why they've chosen a guy (ie. Bach) over a woman. I am looking for a book on the brain, I don't care if it's male or female.Have some balls and state your opinion."
19,0393355500,http://goodreads.com/user/show/27745736-kayson-fakhar,4,Great overview of mind and evolution of it. sometimes you need to pause and think and read the whole page again so I think it's because of the complexity of the subject and not a problem of the writer. 
20,0393355500,http://goodreads.com/user/show/22752-nat,0,Infected my necktop with lots of new memes.
21,0393355500,http://goodreads.com/user/show/1954093-phyllis,3,"First of all, dense and hard to read. Second, a little too much academic squabbling. But, third, very interesting. "
22,0393355500,http://goodreads.com/user/show/71924987-payel-kundu,2,"This book is Dennett looking back on a long and prolific career, and summarizing what he has learned. Except it seems like Dennett has given up all ambition of being concise. This book was too long, and pretty self-indulgent. In classic Dennett style, he spends a lot of the book laying out the criticisms of his work, and then refuting them, which gives a nice logical structure to the book. However, there was absolutely nothing new. The point of it seems to be like a reference book, in case you wanted the current thinking on this topic compiled in one place for easy reference. But for that, it’s terrible, because the organization is chatty, not really reference. And Dennett is not a scientist in a relevant field, but rather an enthusiastic amateur. It kind of left me wondering who this book was written for. The world’s two remaining neuroscientists who don’t agree with his argument that the mind is composed of tiny automatons without comprehension of their own? It’s surely not for a dualist lay-person as I found the book fairly dense even as a practicing scientist in the field. Overall, interesting enough because Dennett is a good writer, but not a book I will remember or recommend. "
23,0393355500,http://goodreads.com/user/show/24870603-jan,4,"Dennett’s valiant and probably ultimate attempt at convincing us of his views on consciousness, which he generously admits are rather outlandish. Although, like most people, I don’t agree with his conclusions, his arguments leading up to those conclusions are valuable insights into the evolutionary process and are interesting to read.His reasoning is more or less as follows: Life is information processing that produces design from the bottom up, by the blind, purposeless algorithm of natural selection, from the simplest microbes to complex multicellular organisms and social organisms like ants, and the intelligent adaptive bevaviour displayed by all these organisms. All this implies what Dennett calls ‘free-floating reasons’. A bacterium swims towards food in order to eat. It has a reason and a purpose, even though in fact it’s just a mechanism. A bird is more advanced. It has a representation of its environment, which is not the real, scientific image but a manifest image that improves its capacity to interact with it and survive. It acts as if it is wounded to distract the predator from its eggs, so it does it for a reason, although without being aware of it. Without actually understanding that reason. It's competence without comprehension. But even though it does not understand the reason, it is there, and it’s very useful to use this concept to describe its behaviour. Human beings have evolved a complex brain that resembles an ant colony. It produces very complex, adaptive, intelligent behaviour. These brains are used by memes, which enable cultural evolution by thinking tools like language, vastly extending their thinking power to abstract concepts and real understanding of the free-floating reasons. We can think about reasons, and we can think about thinking about reasons, and we can, for the first time in the history of life, carry out top down intelligent design. We can even build computers that can think, and have free-floating reasons, though no true comprehension, because they are just mechanisms that compute.Now instead of taking the introspective view and wondering at the mystery of how we humans can actually really understand, Dennett proposes, as usual, to take the third person, scientific view, from which our reasons are also just free-floating reasons. Consciousness is our manifest image. A ‘user illlusion’ constituted by the brain's activity. Like the desktop icons that symbolize the computations of ones and zeros in a computer, the manifest image consists of icons that symbolize the scientific image of physics.In this last step he loses me, because taking the third person view of consciousness is not to explain it but to lose sight of it. Consciousness just ís the first person, subjective view. It seems to me that pretending to take an objective, third person view and then call yourself an illusion is not done because it’s in any way plausible, but only in order to ‘explain away’ consciousness and try to save the doctrine of materialism.I would say the manifest image is the contents of consciousness. It's everything we experience. It's not consciousness itself. I agree with people like David Chalmers that this seems to fall outside all the categories of physics. I don't believe in dualism or panpsychism either. I do think consciousness is fundamental rather than 'matter', and I think a proper view of reality that may lead to a real theory of everything is best given by a form of idealism."
24,0393355500,http://goodreads.com/user/show/40019240-jan-vantilburg,4,"Very interesting ideas and theories! Although it took way too long to get Back from Bach!Much of the book is leading up to the concluding chapers. As interesting as the preceding were, they could have been much shorter. My main reason to read this book was the sub tittle: The Evolution of Minds.And to some degree the book delivered! There are explanations given where consciousness comes from and how understanding evolves.Although Dennett does admit: ..”the goal of delineating and explaining our stack of competences via bottom-up neuroscience alone is remote”.A degree of speculation does exist.For me the revelation was that consciousness comes gradually upon mastering language.“The arrival of language sets the stage for a great moment in evolutionary history: the origin of comprehension”.Dennett then states that Comprehension is only made possible by the arrival of a new kind of evolutionary replicator: culturally transmitted informational entities: memes.Words are the basic memes.And that in turn also affects the neurological pathways in the brain. Language evolved to fit the brain before the brain evolved to better accommodate language.For Dennett no “spark” that originates consciousness. It is a gradual process upon learning a language. All there is, is the material brain. Consciousness explained!The practise of sharing information in communicative action with others, giving and demanding reasons, is what creates our personal user-illusions.Communication makes our manifest image manifest to us! The self becomes apparent.Dennett used the concept of the computer throughout the book as a comparison to the brain. And it does help to clarify how our brain works. An intriguing thought came up then.About the soul (suppose it exist). If an AI becomes sentient, able to perceive or feel things, does it have a soul then?This is no issue for materialists but I wonder what dualists would make of it?(am now reading the book “Do Androids dream of Electric Sheeps” by Philip K. Dick written in 1968) in which androids can be detected because of their lack of empathy. Empathy is stated as one of the defining qualities of humans)From Bacteria => Competence without Comprehension, Natural Selection via Evolution to Bach => Comprehension, Top Down Design and Back => much of humanities current tools (computers et.al.) are not understood anymore. Research is done by multidisciplinary teams. One can not understand all of science anymore. Some concepts:Carthesian: means of or relating to the French philosopher René Descartes—from his Latinized name Cartesius.Descartes said: “I think, therefore I am”. Dualistic.The Carthesian wound is then materialism. There is no separate soul. From this Dennetts Carthesian Gravity is derived. The pull that humans feel towards dualism. This concept keeps on coming back in this book. And I had difficulty grasping it. Now I understand.Also to keep in mind, this is not a why narrative but a “how come”. The book is not about morality."
25,0393355500,http://goodreads.com/user/show/3093693-angie-boyter,0,"I have enjoyed many of Dennett's books, but I DID NOT LAST LONG AT ALL in this one )which is why I decided not to give it a star rating. MAYBE it got better.)! It seems everything in his writing that has annoyed me at all is here in spades. One is his EXTENDED use of what he considers clever metaphors that he is so proud of he grinds them into the ground and that I too often do not find very apt, like his term ""Cartesian gravity"", which I initially had trouble understanding and then decided was not worth the trouble after I figured it out!A part of my annoyance is that the book was poorly edited. There are too many editorial errors of the sort I might see in an ARC but not in a finished work. For example, I looked for Cartesian gravity in the index, and it said it began on page 15. It actually began on page 16, not a big deal, but no excuse in today's electronic world. Other errors may have been harder to spot and just made it harder to follow his thoughts. In addition to mechanical issues, though, he does things like using a puzzle about crossing a bridge as an example of a puzzle that has a retrospectively obvious solution. He gives the full problem---and then never provides the solution (Fortunately, Wikipedia did.). Using the puzzle at all and the retrospectively obvious solution was a digression not relevant to his subject, and the frequency of his digressions made the book all that much harder to follow.My bottom line is that I felt I was listening to the rambling musings of a very smart man who has a bit too much age on him to attempt a book like this without more editorial intervention than he apparently received."
