,isbn,user_link,ranking,review
5,0670025291,http://goodreads.com/user/show/6857911-ryan,3,"If you don’t know much about the current state of artificial intelligence, brain science, or the philosophy of consciousness, and don’t mind a little bit of technical discussion, Kurzweil does a fine job of articulating the current rapid converge between these areas of understanding. However, if you already do know the basics, this book probably isn’t going to do much to expand your own consciousness.Speaking as a software engineer who has a fascination with AI, I largely agree with Kurzweil's glowing assessments about the future of machine intelligence, though I'd probably push his timeframe back a few decades and could do with a bit less of his self-promotion. Though there's a lot we still don't understand about how the human brain operates, neuroscience and computer science are starting to form the same fundamental insights about how intelligence ""works"", whether it's represented as neurons or a mathematical process. In a truly intelligent machine, data from the outside world is taken in by a large, hierarchical array of pattern-recognizers, which gradually rewire themselves to better anticipate the messy-but-hierarchical patterns of the real world (visual squiggles to letters, letters to words, words to syntax, syntax to meanings, meanings to relationships, relationships to concepts, concepts to insights -- and back down again). To some extent, the software world has already made useful progress in this direction.However, most of the insights Kurzweil offers aren’t anything new. Indeed, most of what he says was explored in Jeff Hawkin’s 2004 book, On Intelligence, and in academia before that. Briefly stated, the hierarchical architecture of the human brain’s neocortex is the major engine of human intelligence, and it seems to start out mostly as a blank slate, a generalized learning machine that builds neural connections through experience, eventually forming a complex inductive model of reality, which constantly makes predictions about what comes next. Kurzweil shares some of his own successes solving certain kinds of problems decades ago, but the new ideas he advances seem somewhat vague and underdeveloped (maybe he’s saving the nuts and bolts for his new job at Google).Still, there's plenty here for a general audience, when he gets away from the geekery. Kurzweil is passionate and pretty convincing about his belief that even limited gains in awareness of how the human brain works still provide AI researchers with some powerful springboards, and that, conversely, advances (or missteps) in AI teach us more about the brain. As he points out in discussing Watson, the IBM computer system that famously won on Jeopardy after acquiring most of its knowledge from scanning natural-language documents (the sampling of questions it got right is impressive), things have already come a long way. And there's no reason to believe that the rapid convergence won't continue, especially in the post-cloud computing world. After all, the specific, idiosyncratic way our monkey-rat-lizard brains were shaped to think as our ancestors crawled/darted/clambered around undoubtedly isn't the only way an evolutionary process can discover thought.There’s also a succinct but informative history of the field of AI, with brief overviews of significant thinkers and developments. And Kurzweil wades a little bit into the philosophy of consciousness, exploring some its more paradoxical aspects in light of what science knows about the human brain. For example, it's been shown that the two cerebral hemispheres, in patients with a severed connection, operate almost as two separate brains. Yet, each one still seems to think it has a conscious link to the other. Maybe such individuals are more like two people in one body, but don't realize it? Eerie, huh? His other thought experiments are nothing new, but still fun. Everyone should know what the Chinese Room is.Finally, there’s a section in which Kurzweil responds to critics, and calls out a few flagrant misunderstandings of his ideas. While it’s debatable how on-target his past predictions about technology have been, as far as I’m concerned, if he was even halfway right, then he’ll be fully right soon enough.Overall, I think I would recommend this book most to AI neophytes who haven’t read anything by Kurzweil before. His enthusiasm for the topic can be quite inspiring. For other readers, especially those who have read On Intelligence, I don’t think you’re missing anything essential. I’d probably give this one 4 stars for the former audience, 2.5 for the latter, 3.5 overall."
6,0670025291,http://goodreads.com/user/show/33276635-chaunceton-bird,4,"This is a fascinating look into how our brains operate, and how the first synthetic brains have been operating, and will operate as they become more sophisticated (and, eventually, sentient). "
7,0670025291,http://goodreads.com/user/show/13472185-andrej-karpathy,3,"Kurzweil's book offers an overview of the biological brain and briefly overviews some attempts toward replicating its structure or function inside the computer. He also offers his own high-level ideas that are mostly a restatement of what can already be found in other books (such as Hawkins' On Intelligence) with a few modifications (he admits this himself though at one point, for which he gets bonus points). Finally, he applies his Law Of Accelerating Returns (LOAR) to field of AI and produces some predictions for the future of this field. The good: Nice thought experiments section, nice overview of the biological brain (both old brain/cortex and their function), reasonably ok philosophical mambo jambo parts about consciousness and whether it is possible for a computer to be a mind (if you're into that), some analysis of relevant computational trends. By the end, you're almost convinced we're almost there!The bad: First, his own theories are extremely vague and half-baked (though I forgive this. If he knew more he would be busier with things other than writing this book) and essentially reduce to some form of Hierarchical Hidden Markov Model. That's not especially exciting, I think most researchers in the field will agree on such high-level things. I also find it puzzling that he claims to be talking about the mind in its entirety, but then his exposition focuses almost entirely on temporal modeling/prediction aspects and mostly ignores a lot of other magical components of a mind, such as a flexible and efficient knowledge representation / inference engine, or a reinforcement learning - like actor /critic system that surely exists somewhere at the core of all of our learning and reasoning.All in all, I would recommend this book to anyone who's interested in some pointers to our efforts to replicate a brain in the computer, who wants to learn a bit about the biological brain, or who's into the philosophy of it all."
8,0670025291,http://goodreads.com/user/show/2531665-charlene,5,"Well, I am simply in love with Kurzweil. How could I not be? This was one of the best books on Philosophy of Mind that I could imagine reading. Early on in the book, Kurzweil respectlfully disagreed with Steven Pinker, and imo, setting himself apart from the good genes crew (Dawkins et. al.). He went on to take his lucky reader on a tour of the future of the mind, teaching them about everything that has been done to date to try to create a mind. In 2008, I took a cognitive science class that featured a lot of Kurzweil's work, as well as many other things included in this book. I later took two courses in Philosophy of Mind. All of these courses focused heavily on AI. I loved those classes so very much and this book brought everything flooding back. You will be treated to the role Hidden Markov Models (HHMs) play in speech dictation. In fact, this very book was written not by hand, but was dictated using Dragon Dictation (which is a product of HMMs). Kurzweil also provided his reader with a short but excellent history of Philosophy of Mind by including Jackson's Mary (The Knowledge Argument), Searle's Chinese room, Chalmers zombies, and Dennett's ideas about all of that. I was sad that he didn't include Andy Clark, but even with that oversight, it was one of the best and most relatable summaries of Philosophy of Mind that I have read. He took out the jargon and, instead, made every concept easy enough for a middle schooler to grasp, yet interesting enough for academics.Kurzweil chose the most interesting bits of neuroscience to include in this book, all of which are still exciting in 2016. I can only imagine what I would have felt like if I had read this book in 2012. I would have been blown away. The efforts to create a mind have been ongoing for decades. There is not stopping it, much to the chagrin of many. If you want to be informed about how this process works, read this and Kevin Kelly's The Inevitable. They pair nicely with one another. "
9,0670025291,http://goodreads.com/user/show/8660033-aaron-thibeault,4,"*A full executive summary of this book is available here: http://newbooksinbrief.com/2012/11/27...When IBM's Deep Blue defeated humanity's greatest chess player Garry Kasparov in 1997 it marked a major turning point in the progress of artificial intelligence (AI). A still more impressive turning point in AI was achieved in 2011 when another creation of IBM named Watson defeated Jeopardy! phenoms Ken Jennings and Brad Rutter at their own game. As time marches on and technology advances we can easily envision still more impressive feats coming out of AI. And yet when it comes to the prospect of a computer ever actually matching human intelligence in all of its complexity and intricacy, we may find ourselves skeptical that this could ever be fully achieved. There seems to be a fundamental difference between the way a human mind works and the way even the most sophisticated machine works--a qualitative difference that could never be breached. Famous inventor and futurist Ray Kurzweil begs to differ.To begin with--despite the richness and complexity of human thought--Kurzweil argues that the underlying principles and neuro-networks that are responsible for higher-order thinking are actually relatively simple, and in fact fully replicable. Indeed, for Kurzweil, our most sophisticated AI machines are already beginning to employ the same principles and are mimicking the same neuro-structures that are present in the human brain.Beginning with the brain, Kurzweil argues that recent advances in neuroscience indicate that the neocortex (whence our higher-level thinking comes) operates according to a sophisticated (though relatively straightforward) pattern recognition scheme. This pattern recognition scheme is hierarchical in nature, such that lower-level patterns representing discrete bits of input (coming in from the surrounding environment) combine to trigger higher-level patterns that represent more general categories that are more abstract in nature. The hierarchical structure is innate, but the specific categories and meta-categories are filled in by way of learning. Also, the direction of information travel is not only from the bottom up, but also from the top down, such that the activation of higher-order patterns can trigger lower-order ones, and there is feedback between the varying levels. (The theory that sees the brain operating in this way is referred to as the Pattern Recognition Theory of the Mind or PRTM).As Kurzweil points out, this pattern recognition scheme is actually remarkably similar to the technology that our most sophisticated AI machines are already using. Indeed, not only are these machines designed to process information in a hierarchical way (just as our brain is), but machines such as Watson (and even Siri, the voice recognition software available on the iPhone), are structured in such a way that they are capable of learning from the environment. For example, Watson was able to modify its software based on the information it gathered from reading the entire Wikipedia file. (The technology that these machines are using is known as the hierarchical hidden Markov model or HHMM, and Kurzweil was himself a part of developing this technology in the 1980's and 1990's.)Given that our AI machines are now running according to the same principles as our brains, and given the exponential rate at which all information-based technologies advance, Kurzweil predicts a time when computers will in fact be capable of matching human thought--right down to having such features as consciousness, identity and free will (Kurzweil's specific prediction here is that this will occur by the year 2029).What's more, because computer technology does not have some of the limitations inherent in biological systems, Kurzweil predicts a time when computers will even vastly outstrip human capabilities. Of course, since we use our tools as a natural extension of ourselves (figuratively, but sometimes also literally), this will also be a time when our own capabilities will vastly outstrip our capabilities of today. Ultimately, Kurzweil thinks, we will simply use the markedly superior computer technology to replace our outdated neurochemistry (as we now replace a limb with a prosthetic), and thus fully merge with our machines (a state that Kurzweil refers to as the singularity). This is the argument that Kurzweil makes in his new book 'How to Create a Mind: The Secret of Human Thought Revealed'.Kurzweil lays out his arguments very clearly, and he does have a knack for explaining some very difficult concepts in a very simple way. My only objection to the book is that there is a fair bit of repetition, and some of the philosophical arguments (on such things as consciousness, identity and free will) drag on longer than need be. All in all there is much of interest to be learned both about artificial intelligence and neuroscience. A full executive summary of this book is available here: http://newbooksinbrief.com/2012/11/27... A podcast discussion of the book will be available soon."
10,0670025291,http://goodreads.com/user/show/4742971-bryan-vartabedian,5,"Beyond some spurious dialog of computer modeling, the book is cleanly written and well-argued. The chapter on consciousness offers an amazing discussion of how a computer can (or can’t) replicate a human mind. The author finishes by taking on objections to his ideas. Highly recommended.While the brain has been considered by many to be beyond the scope of comprehension, history is replete with claims of what couldn’t be done. How to Create a Mind offers a thoroughly supported argument for the eventual reverse engineering of the human brain."
11,0670025291,http://goodreads.com/user/show/5948865-james,4,"Very interesting look at how to create a mind. One of the most fascinating and real world experiences I now better understand is how the Dragon Speech to text engine was created. In the last couple of years, I have been working with dictation applications and the struggles we have had with the tool. You often hear why doesn't it understand what I'm saying. Listening to this book, I now understand how the fundamentals of recognition were constructed and why folks may be struggling. Very interesting and not something I expected to learn from this book. Good insights, Thank you."
12,0670025291,http://goodreads.com/user/show/12307604,4,"So this was probably the fattest, densest science book I've read this year. As programmer, I want to understand the theory behind the latest advancements in AI/machine-learning, but as a normal human, I'm fascinated by the brain and all these concepts (conscience, identity, mechanics of memory, etc) science hasn't quite figured out.I'll say this about Ray Kurzweil just from reading this book. This guy has been in the field for more than 30 years and is highly respected, and in his writing he comes across as a guy who likes to toot his own horn. I guess it's just normal if you've been in the field for this long, but he loves to refer to his own accomplishments. When he doesn't do that though, his line of argumentation is very convincing, and the model he puts forward in the beginning of the book, the hierarchical model of pattern recognition (turtles all the way down) was quite revelatory for me personally. I don't know if it's his theory, but no matter. This model answers quite a lot of questions I've asked myself and stirred me to form deeper, more involved lines of thought, so for that this book is already worth it.I hear that there's criticism of this theory, as you'd expect, but for a layman it's a good starting point to get into the subject matter.After that, the book moves towards more philosophical stuff. It's thought provoking, sure, but a lot of it wasn't that groundbreaking to me, though still enjoyable. I'll say the best bits are in the first half for sure. The last chapter is just him refuting some guy who once criticized an essay of Kurzweil and it was jarring how petty it felt. He literally went over a bunch of arguments that person wrote that they didn't agree with in Kurzweil's essay and refuted them, and put that in print (I presume, I'm reading the ebook version). The last chapter feels utterly unnecessary and just underlined my impression that Kurzweil is a bit of a twat haha"
13,0670025291,http://goodreads.com/user/show/927546-rachel-williams,4,"I had always dismissed Kurzweil's theories about ""strong"" artificial intelligence to be wishful thinking but this book changed my mind. I'm not quite as optimistic about scaling things up to human adult levels, but reading this book gave me new found respect for his ideas and the evidence and theories he uses to back them up. I had no idea how powerful ""hidden Markov models"" are for solving problems, and Kurzweil makes a good argument that neocortical pattern recognition (essentially a form of probabilistic prediction making) is computationally approximate enough to these hidden Markov models that, if you put 300 billion such pattern recognizers and gave it the entire internet to ""grow up"" in, then you could create a reasonable approximation of the intelligence worth wanting: categorizing pattern recognizing problem solvers with huge memories and lightning speed. Also, when Kurzweil delved into heady philosophical territory he held himself fairly well and exposed many of the fallacious and sadly misinformed criticisms of his views, many I once held myself due to lack of familiarity with what his views actually amount to, which are more modest than his vocal popularizers would have you believe. Granted, this is the only book of his I have read, so I can't pretend to stand behind all his ideas, but the AI stuff in this book seemed solid to me. His view of an ""intelligent mind"" is really a modified form of Jeff Hawkin's thoery of neocortical intelligence as a giant massively redudundant, hierarchical, recursive, and self-learning memory-prediction machine.4/5 stars."
14,0670025291,http://goodreads.com/user/show/10635083-john-patterson,5,"In How to Create a Mind, Ray Kurzweil argues that the human mind is composed of hierarchy of pattern recognizer that uses a statistical model to learn, store, and retrieve information. He then goes on to argue about how this model can be used to develop artificially intelligent machines. He argues that in fact huge strides have been made towards this goal in such machines as Watson (the computer that handily defeated Ken Jennings at Jeopardy!)This may seem dry, but this book has engaged my imagination in ways that few novels have. He finishes with the philosophical and social implications that such advances in technology could have and addresses potential objections to his arguments. I found myself stopping on occasion to reflect on what I have read. Highly recommended for those interested in cognitive psychology or in artificial intelligence."
15,0670025291,http://goodreads.com/user/show/4975321-joseph,4,"I consider myself a singularity skeptic, and I'm definitely not convinced by Kurzweil's so-called ""Law of Accelerating Returns"", but starry-eyed idealism about the future aside, this book is quite well-reasoned and well-argued. I've seen firsthand how deep learning applications can deliver some pretty amazing results, and it's hardly a stretch to say that can only get better faster as long as Moore's Law holds (which could end tomorrow or a century from now).But honestly what surprised me the most out of this book was how willing Kurzweil was to grapple with philosophical issues, as opposed to merely technical ones. Though I seem to recall he once or twice attributed quotes or ideas to the wrong people, the ideas were fully formed, and highly relevant. I've definitely reevaluated my opinion of Kurzweil, and I think I'll check out his other stuff."
16,0670025291,http://goodreads.com/user/show/9795663-rodan,5,"As my friends well know, a great deal of my neocortex is dedicated to pattern recognition in search of ways to prevent the robot apocalypse. Kurzweil paints a bright picture over a frightening future where humans and computer minds blur and robots overtake the world. When the Kurzweiltron 3000 (controlled by a copy of Ray's consciousness) has been destroyed and I stand on top of a pile of mangled rivets and torn metal, I'll rip the neocortex extender out of my forehead (allowing my amygdala let me feel feelings again) and shout ""Kurzweil, you magnificent bastard, I read your book!"""
17,0670025291,http://goodreads.com/user/show/87751-rachel,1,"The thing about fiction is that I accept errors or lack of reference as long as the story is interesting. In nonfiction, I need all of those elements there. So, when you're completely ripping off Plato, maybe you should give him a hat tip (and not just vaguely 100 pages later about an entirely different topic)."
18,0670025291,http://goodreads.com/user/show/44289250-robert-martin,4,"A fascinating weave of neuroscience, artificial intelligence, and the philosophy of mind.Kurzweil presents the pattern recognition theory of mind (PRTM), which holds that the fundamental unit of computation in the brain is a group of ~100 neurons in the neocortex that recognises a pattern. The clever part is that these patterns can exist within arbitrarily complex hierarchies, containing ""pointers"" to other patterns, and feeding input/output to both sub-patterns and parents. It's a nice theory and seems to explain some empirical findings in neuroscience, though I would defer to a domain expert to comment more on that. Some of his arguments seem quite suspicious: for example, he often justifies his view of how the brain works by implementing the procedure on a computer – if it works on a computer, that is likely how it works in the brain. The second half of the book is somewhat disorganised, covering the whole gamut of standard topics within the philosophy of mind: computation, consciousness, free will, identity, etc. Nevertheless, it's a highly accessible introduction containing plenty of references to famous thought experiments and philosophical writings. The chapter relating to the ""Law of Accelerating Returns"" is scary. Due to the linear nature of our neocortices, humans consistently misunderstand exponential growth trends. As a result, the future will come much faster than people realise. Kurzweil convincingly argues that within the next twenty years, we will have reached the singularity and that by the end of this century, cybernetic enhancements will be the norm. Well worth a read if you are interested in neuroscience, AI, philosophy, or futurism. This book is an excellent complement to sci-fi books dealing with uploading consciousness (e.g Ubik, Greg Egan's short stories) – which may not be fiction for much longer!"
19,0670025291,http://goodreads.com/user/show/8527195-alex,4,"This book was fascinating and mildly terrifying. Kurzweil's main point is the Pattern Recognition Theory of Mind: that idea the human brain is nothing more than a series of pattern recognizers and mechanisms for interpreting and acting on those patterns. The suggestion that all of a human's experience (yes, including consciousness) can be reduced to and explained by such a system, and the subsequent implication that this system can be modeled with machines, is depressing, if not a little insulting. But it's tough to argue with.Kurzweil does a decent job of explaining complex concepts in a way that is somewhat understandable by the layperson, although I'm not convinced that it was necessary to provide explanations - even simplified ones - of every topic introduced (yes, it was cool to feel like I understood vector quantization, but no, it was not necessary for my understanding of the book overall). Additionally, while I appreciated the discussion of consciousness near the end of the book (I was worried he would conveniently avoid the topic), it was overly philosophical and dense - I needed multiple sittings to get through chapter 9.I'm also glad Kurzweil addressed (successfully, in my opinion) objections to his theories and predictions (although it was a little awkward for him to call out Paul Allen all over the place - I think he could have made his points without naming any names). This book was well-organized and certainly comprehensive, and it has made me welcome the idea of one day becoming a cyborg."
