,isbn,user_link,ranking,review
19,0896087794,http://goodreads.com/user/show/284289-franco,5,"Making the choiceAfter reading on the internet a number of unsatisfactory articles about climate change, I decided to read a good book on this essential topic. I compared them basing my choice on the information I could find about the three books I’d been proposed, and on the need to verify some of my opinions: first, the opinion I had since thirty years ago that the industrial revolution has an important negative effect on climate - this lead me to easily trust those who fifteen years later said that the reduction amount agreement in Kyoto was just a symbolic act because of the irrelevant quantity; second, the opinion that the data published by the FAO about animal farming, which would be responsible of 18% of the CO2 equivalent emissions, is correct and is just a little further confirmation we need to considerably change our lifestyle.I scannedd 'Heat!' in a library to find the data I was looking for. What I read on the internet about it made me sure it was at least good for an important step: understanding the real needs in terms of reduction.One of the first things I read were the tables at the end of the book. I got the impression that the book was not very good for me: it seemed not to mention the animal farming contributes, ascribe to the traffic part of the emissions which are probably due to other fuel combustion and one of the first things the author says is he doesn’t want to change his lifestyle. But, he sais, It’s possible and easy to quickly reduce the emissions by 90% and save the human race this way. In my quick search I couldn’t find positive suggestions or solutions, but only the demolition of suggestions made by others, and an apparently useless report on untrue writings. No way to believe it would say the things I wanted to find. Anyway, it certainly said something important. Well then, I thought, I’ll have to read it all.Surprising though knownMonbiot chose very well his sources and writes very well. He points out that science reports need to be selected by peer review to be considered valid, while politicians and journalists (not scientists) make a tremendous confusion and get victims of false reports especially for a main reason: they attribute the more importance and credibility to a speaker the more he appears in the media. He shows how some big industries like Philip Morris and Exxon can manipulate the public opinion. It’s enough to get the information selected by peer review, that is, all the articles published by scientists’ magazines as Science and Nature to understand what is happening and will happen in the very next decades according to all scientific contributes, none excluded.At the end of the second chapter, Monbiot even easily explains the psychology that brings scientists to accept politicians’ decisions even if they know they are a simply ridiculous and mad suicide.Achieved resultsThe quick reduction of greenhouse gases emission must become the most important task of our governments. We must ask for this. The reduction must involve everybody. Most of it has to take place before 2012.Monbiot succeeds in his scopes: convince that in the case of climate change and fighting is worth the trouble, and find the most politically efficacious ways to reduce our energy need and its CO2 content. His comparison among all the suggested solutions brings to evidence which are the best solutions for behaviours and policies in the main fields to take into account: energy production and use, transport and building trade. Only in one sentence, though, it speaks about animal gases production, and as in the case of Al Gore not a word is spent to say how important vegetarianism among the necessary solutions. We can forgive him just because of its starting point (I don't want to change my lifestyle), which he thought so important to attract readers. He got me, and I'm happy about that."
20,0896087794,http://goodreads.com/user/show/395599-shannon-giraffe-days,5,"With Heat, George Monbiot has moved past the obfuscating arguments being slung like mud back and forth across the globe, and faces not just the alarming truth of global warming but the seemingly impossible task of actually doing something about it.This book is, as he points out in the introduction, a manifesto. It is a plan of action. The goal is to cut our carbon dioxide emissions by 90% by 2030. This is the ""seemingly impossible"" aspect, especially when you look at Canada's current situation (this Canadian edition includes a foreward designed to wipe the smug smiles off our faces, and effectively brings his manifesto into our own backyard).Using the UK as his base, Monbiot focuses on high-energy users and high emission-producing industries, from ""our leaky homes"" to gas, coal and nuclear plants, cars, public transport, the cement industry, heat, lighting and aviation. Before getting onto the task of fixing our situation before it gets worse, he spends a chapter on the current data and where it will lead us, and on the ""denial industry"". This chapter alone is worth your time. It is engrossing, enlightening and actually quite entertaining.For all his sources, Monbiot does a thorough background check. This process, of following individuals and organisations from their comments all the way to who is funding them, adds a detective element to the book - a bit like the TV show House. It also serves to add legitimacy to the people Monbiot does quote - although he makes a point of being sceptical of anyone who is selling something.One of the other truly great chapters in this book is on public transport. Using models put forward by other thinkers, Monbiot restructures the English transit system, making it more user-friendly, affordable, quicker, and drastically reduces not only the amount of cars on the road, but also the amount of road. As with the aviation industry, more money is being spent on expanding roads, which will only fill up with twice as many cars, than on finding other transport solutions or ""greener"" cars.His chapter on fuel, especially his breakdown on so-called ""green fuels"", is less heartening. Although he remains incredibly optimistic throughout the book, his conclusions regarding our fuel options are downright depressing. Still, we can only persevere. Likewise, the amount of energy a supermarket uses to keep the fridges on while at the same time heating the place, is shocking, but not surprising. What is really shocking, is that we are all so accustomed to it that no one even thinks about the waste of energy our expectations of convenience cause.Heat moves nimbly past all the bickering politicians and scientists and everyone else with an opinion, and looks at ways we can save the planet without sacrificing as much as we will if we do absolutely nothing. But his final point is clear: as long as we refuse to change our lifestyle, make some cuts in our own way of living, we are going to be pretty adverse to politicians regulating - as Monbiot says they need to do - and also give them a good reason to not even try.As a manifesto, Heat provides a great deal of clear-headed, well-researched and rational information. When one of our politicians decides to take the situation seriously, they would do well to start here."
21,0896087794,http://goodreads.com/user/show/132592-matthew,3,"Upon finishing George Monbiot's Heat, I am reminded by what a public affairs executive at the Singapore office of an oil major whispered over at a conference: that the debate on global warming seems confusing because it involves so many issues. What do you think we can do? he said.For a start, read Monbiot's book. Not because Heat will answer questions, or make them simpler, but it will help frame the issues.Actually, global warming is easy to understand - the world is getting warmer as a result of human activity, with disastrous consequences for both nature and ourselves. The complex part is the myriad approaches to mitigating global warming, for many of which the estimated costs and benefits are still under debate. There is no panacea, no one single area which, if addressed, would be sufficient in and of itself to combat climate change.That, effectively, is the thesis of Heat. What must we do to avoid global warming?, Monbiot asks in the first chapter. His answer: slash the amount of greenhouse gases we release by 90 per cent by 2030. (This, he argues, is necessary to keep carbon dioxide in the atmosphere to under 450 parts per million, which means a two-thirds chance the world will warm by no more than 2 degrees Celsius.)The rest of the book has Monbiot, a columnist for the Guardian and visiting professor at Oxford Brookes University, poking through reports and chasing down leads, leaving few stones unturned as he attempts to find out whether, and how, the reduction is possible.His target is vastly more stringent than what governments are pledging, and Heat shows why. Monbiot damn near gets his carbon reductions, but only after renewing much of the existing housing stock, revamped the public transport system and energy grid, introduced hydrogen fuel cells and carbon capture and storage. Given the current states of political will and economic structures, all these are unlikely. In the chapter on aviation, even Monbiot concedes defeat, after concluding that to slash emissions there, humans must fly 10 times fewer miles.Besides this, Heat is a great example of the questions we should ask policy makers as they decide our future. Monbiot chases down the “denial” camp, showing that many of the naysayers of manmade climate change are themselves quoting spurious evidence. Writing on nuclear energy, he notes that while plants can, in theory, be run safely, plant operators in the UK are notorious for cheating and covering up on leaks. The book is best seen an a pioneering attempt to take stock of wide research, to cut through noise and blather and to try to come to hard conclusions about what, if anything, must be done. The problem is that in many cases, the information isn’t there. On how much nuclear energy really costs, for example, Monbiot quotes various reports, then says: “The only honest reply is that I haven’t the faintest idea.”"
22,0896087794,http://goodreads.com/user/show/271043-bruce-sanders,5,"This book starts with a simple premise. Since a two degree centigrade increase in global temperatures by 2030 will have devastating effects on the climate, the world has to reduce it's carbon footprint drastically; and Britain's fair share in this regard is a 90% reduction in greenhouse gas emissions. The rest of the book is an exercise in seeing if there is any way for Britain to do this and still maintain a modern economy. Monbiot writes clearly. The arguments are laid out well with lots of footnotes documenting every idea. He is very thorough in working through the problem. There are few stones left unturned in searching for a solution to the problem. Monbiot looks at how well Britain's homes are insulated and what can be done about it, how electricity can be generated without generating greenhouse gases, how it can be transmitted more efficiently, the transportation problem, and finally he looks at two high carbon footprint industries to see to what extent they can reduce their emissions (supermarkets and concrete production). The book is full of ingenious pragmatic ideas for meeting the stated goal (e.g., moving bus terminals to major highway intersections outside of city centers, and switching to direct current for long-range power transmission), as well as obvious ideas (e.g., goodbye airline industry for mass transit). Every idea mentioned is doable. The book concludes that in fact a 90% reduction in Britain's carbon footprint can be combined with a modern society, but that it will be an immense undertaking and time is running out. Working through this problem with Monbiot is an exercise every informed citizen needs to undertake. Turning this thought experiment into an exercise in reality is something every citizen should be working for. The book is really a breath of fresh air in that it takes climate change seriously, but is not a doomsday book. The problem can be solved if the political will is there. The political will won't be there if people don't educate themselves on these issues. The book was penned in 2006. Since then Monbiot has become a little more pro nuclear energy and less skeptical of the idea of peak oil. Unfortunately, little progress has been made in the first world on implementing any of the ideas in the book. In fact, there are few signs that first world governments are even taking the problem seriously. An exception might be with regards to allternative energy generation, but that is being motivated by peak oil not by climate change. Humankind is apparently determined to enter a dark age and undergo a population crash. "
23,0896087794,http://goodreads.com/user/show/7855283-david,3,"I have a interesting personal relationship with this book. The year of the publication of the 2007 edition I graduated with a Bachelors Degree from Cardiff University in Modern History and Politics, where George Monboit (introduced as the author of this book) received a honourary doctorate at my graduation. In his speech he urged us all to follow the path we wanted in life, and not the path we should take because when we have the money to enable us to follow our dreams we are too old and tied down to do anything about it. I followed his advice.Fast forward a decade and I am now doing a PhD in a topic related to sustainability, and finally got around to reading this book.In this book George Monbiot offers a manifesto of sorts for preventing climate change, mainly by claiming that a 90% reduction is needed. In each chapter he goes through various carbon emitting sectors (energy generation, transport, etc) to show how this can be done (and occasionally not done).The book is thoroughly well researched and referenced, making it a dream for people who want to look deeper into what he has written about. It is also fairly holistic, even doing as far as to attach the 'climate change denial industry'. Another strength of this book is that he presupposes no knowledge of these topics by the reader.There are however shortcomings. Firstly, its use is limited in 2017 due to the age of the data. Whilst much of it is still relevant, we have moved a bit further in 10 years in some of the technologies he and ideas he discusses, however I'm sure it is not at a pace that he is happy with. Some of the aspects of the work are quite numerical and dry, and he is a bit of a grumpy bugger at times (but that's probably necessary).It's biggest weakness though is it's feasibility, it requires such a a huge sacrifice from everyone that I can't really see his ideas being adopted. Points for effort though.All in all this worth a read for people who are interested in climate change (although fairly UK centric) literature, but it is more of a curiosity exercise (both historically and practically) than it is a feasible manifesto for change."
24,0896087794,http://goodreads.com/user/show/728718-dan,5,"Monbiot says we must reduce global carbon release by 90 percent by 2030 in order to stop catastrophic climate change -- and he shows how we can do it. He relentlessly tears down the arguments of those people -- many from industry -- who say we can stop climate change through technological quick fixes. He shows that biofuels, for example, are an ecological disaster, and actually are one of the most carbon-intensive fuels you could burn. He also owns up to the real limits to wind and solar power. Using Britain as an example, he shows that it would be basically impossible to switch to full wind, wave, and solar power -- there will still be a need for auxiliary carbon-based to handle peak demands. But then he shows that a push for wind, wave, and solar -- combined with more energy efficient homes and offices; more efficient appliances; and better energy storage; and carbon capture and storage -- could reduce carbon usage by 90 percent for electricity. This book is full of good ideas that an ecosocialist local or state level government could apply to reduce carbon emissions -- he has a great chapter on creating high speed bus lines; lots of good stuff about how to improve how we insulate and heat our homes and offices; and his chapter on cement manufacture (which is responsible for 5% of global carbon emissions) is a surprising page-turner. But he makes clear that without action at the national level to ration carbon, these efforts will fail. Monbiot wrote this book ten years ago. It still holds up. But in one way I think he's improved his message. In this book he talks about the changes needed as ""austerity."" And certainly we need severe restrictions on carbon usage by the rich. But lately, as the possibility of a Corbyn-led government gets nearer, George has started to talk about a new vision: we need to fight for, what he calls private sufficiency -- making sure everyone has enough food and money to live a decent life -- and public luxury -- creating great parks, hospitals, housing projects, libraries and public transit for all to enjoy. That's a vision that I think can help us make his program real."
25,0896087794,http://goodreads.com/user/show/15014899-clivemichael,4,"Comprehensive discussion and researched concepts detailed at length. Unfortunate conclusions implying necessary unwelcome options.""I have sought the means of proving otherwise, not least because it would make my task of persuading people to adopt the proposals in this book much easier. But it has become plain to me that long-distance travel, high speed and the curtaiment of climate change are not compatible. If you fly, you destry other people's lives."" Chapter 9 Love Miles.- Enjoyed most the last chapters."
26,0896087794,http://goodreads.com/user/show/70544811-felipe,4,"I read this book several years ago. On one hand, it is a very pragmatic and in-depth approach to what can actually be done to reach carbon emission targets - something I've seen in few books and even documents on the topic. On the other, (perhaps precisely because of its objectivity) the book gives, overall, a very pessimistic message that preventing climate change is virtually impossible. It is also very much focussed on UK data. Just bear those things in mind."
27,0896087794,http://goodreads.com/user/show/71649668-rudelee,5,"Heat is not a fun book to read, but I believe it is an important one. While the statistics- and fact-driven narrative can be dull and difficult to slog through, this book would not be nearly as persuasive without it. Monbiot has a good sense of humour and seems to have a gift for explaining difficult concepts well.The book was written in 2006, but rather than this detracting from its importance it makes me wish there was a follow-up with more recent stats."
28,0896087794,http://goodreads.com/user/show/3826800-neil-powell,3,"A book that attempts to propose practical solutions to a problem that many of the worlds governments appear to be ignoring. Some of his ideas are radical (carbon rationing), others seem like common sense (making supermarkets into warehouses and forcing people to shop online).His writing style did grate a little with me, but it is a meticulously researched book"
29,0896087794,http://goodreads.com/user/show/7133770-florence,5,George Monbiot does not argue that climate change is occurring in his book. Yet blatantly corporations and politicians still contradict this theory! Monbiot makes alot of suggestions on how this devastating effect can be stopped. It is a fantastic book making the reader question the possibility of stopping the present downhill spiral to human destruction.
30,0896087794,http://goodreads.com/user/show/547821-barry,4,Forget Kyoto. Forget naive deep-green medievalism. This book looks at what we (rich/Western we) really need to do in the face of human created global climate change. Refreshinlgy practical and constructive.
31,0896087794,http://goodreads.com/user/show/476304-jm,5,"Describes what it's going to take to meet the current scientific consensus on an ""acceptable"" CO2 ppm.I'm not optimistic we'll make it.However, great analysis of how it could be done, as well as arguments anyone can use."
32,0896087794,http://goodreads.com/user/show/1221874-tristesse,5,I was forced into looking at the environmental crisis the planet is facing after reading this book. I found it helpful because rather than focusing on the hopelessness of the situation Monbiot really looks at possible solutions with intelligence and a great deal of research. 
33,0896087794,http://goodreads.com/user/show/1378882-basswood,5,"Not really a book to review: 5 stars – rather meaningless, not a work to enjoy or appreciate aesthetically in the usual sense – rather one that is vital for our times and the challenge that the human race is facing."
34,0896087794,http://goodreads.com/user/show/2214838-irene-toh,5,"the fog, inertia, and conspiracy surrounding climate change and the call for action, this book gives the a-z perspective. i like the central metaphor of the book which is that we have signed a Faustian pact - living it up like there's no tomorrow."
35,0896087794,http://goodreads.com/user/show/3667788-kynthia-d,4,A book with great ideas about saving our planet although the writer has been called an utopist by most people. A book revealling the hard truth about the state we are in and giving some hope about the future.
36,0896087794,http://goodreads.com/user/show/86070504-mac,5,A book that I would recommend to any family member or friend who is having a hard time dealing with the realities of our planet. This book presents global warming in a concise and persuasive way along with real world applications and solutions.
37,0896087794,http://goodreads.com/user/show/5751398-kolin,4,"Important read. Monbiot's analysis of the science will keep you up at night, but his faith in humanity will motivate you to be a part of the solution. Every public official should be given a copy."
38,0896087794,http://goodreads.com/user/show/178008-jeff,4,"Good book on climate change, many of the things proposed do are very simple steps. "
39,0896087794,http://goodreads.com/user/show/72654-goya-champuru,4,Just to give you a guilty conscience about all those air miles ...;-)
40,0896087794,http://goodreads.com/user/show/563257-martin-empson,5,Review at Resolute Reader
41,0896087794,http://goodreads.com/user/show/383005-derm,5,This is an essential read for anyone that wants to know what real steps need to be taken to solve the climate crisis
42,0896087794,http://goodreads.com/user/show/984947-lisa,5,Fabulous book - lays it all out on the line in simple terms... makes it very clear that we need to drastically change the way we live. Everyone should read this. Right now.
43,0896087794,http://goodreads.com/user/show/33345-peace,4,Pretty intense.The guy seems to have some serious stuff to say.. the real question is how to get people to listen.The chapter about the denial industry was really eye-opening.
44,0896087794,http://goodreads.com/user/show/1311753-brooks,0,"This book not only makes a compelling case for the rich nations of the world to cut their carbon emissions by 90% in the next 22 years, it shows how it can be done. "
45,0896087794,http://goodreads.com/user/show/152145-matt,4,"Excellent analysis of solutions to global warming. This is the answer to the questions ""what should we do about the problem?"" The discussions revolve around his home of England."
46,0896087794,http://goodreads.com/user/show/27677-kathryn,5,"woah, a modern day horror story"
47,0896087794,http://goodreads.com/user/show/708965-sarah,3,"This book got a little quantitative for my liking, though I understanding completely why such tactics are necessary. An important book, a dull read."
48,0896087794,http://goodreads.com/user/show/1663051-steven,4,i quit airplanes after reading this one
49,0896087794,http://goodreads.com/user/show/3146874-bradley-jarvis,5,Excellent suggestions for how to deal with global warming.
50,0896087794,http://goodreads.com/user/show/1814158-shefali,0,Heat: How to Stop the Planet From Burning by George Monbiot (2009)
51,0896087794,http://goodreads.com/user/show/4671027-miquixote,4,Detailed and technical discussion on the possibilities of saving the planet from environmental destruction. Great for your debates with climate-changer deniers. 
52,0896087794,http://goodreads.com/user/show/4687053-mrspl,4,"Essential reading on climate change - really makes you think about whether stopping climate change is possible, and if so, how."
53,0896087794,http://goodreads.com/user/show/5178507-bill,4,A good attempt to actually address the possibility of solutions to the problem of Global Warming. I doubt many of his suggestions will be heeded in time.
54,0896087794,http://goodreads.com/user/show/7225549-terry-moore,0,A well written and researched book by an honest and in some respects courageous journalist. A must read for al those trying to understand how decarbonization 
55,0896087794,http://goodreads.com/user/show/3508022-tracy,4,This is a fantastically positive look at how to address climate change.Read the full review at OurBookClub
56,0896087794,http://goodreads.com/user/show/8146241-stuart-hodge,4,a well written and extensively researched polemic. should be used as a how-to guide.
57,0896087794,http://goodreads.com/user/show/5868871-kat,4,"Good info, well thought out and logical. I understand the removal of political bias, but unconvinced this mass simplification is really helpful."
