,isbn,user_link,ranking,review
13,0201483408,http://goodreads.com/user/show/19023554-akhil-jain,3,"""Kauffman’s Law states that above a certain point, increasing the richness of connections between agents freezes adaptation. nothing gets done because too many actions hinge on too many other contradictory actions. Too many agents have a say in each other’s work, and bureaucratic rigor mortis sets in.""""The primary goal that any system seeks is survival. The secondary search is for the ideal parameters to keep the system tuned for maximal flexibility. But it is the third order search that ismost exciting: the search for strategies and feedback mechanisms that will increasingly self-tune the system each step on the way""Although the f=ma law still holds sway over the balloon, other forces such as propulsion and airlift push and pull, generate an unpredictable trajectory. in its chaotic dance, the careening balloon mirrors the unpredictable waltz of sunspot cycles, ice age’s temperatures, epidemics, the flow of water down a tube, and, more to the point, the flux of the stock market. But is the balloon really unpredictable? if you tried to solve the equations for the balloon’s crazy flitter, its path would be nonlinear, therefore almost unsolvable, and therefore unforeseeable. yet, a teenager reared on nintendo could learn how to catch the balloon. not infallibly, but better than chance. after a couple dozen tries, the teenage brain begins to mould a theory—an intuition, an induction—based on the data. after a thousand balloon take offs, his brain has modeled some aspect of the rubber’s flight. It cannot predict precisely where the balloon will land, but it detects a direction the missile favors, say, to the rear of the launch or following a certain pattern of loops. Perhaps overtime, the balloon-catcher hits 10 percent more than chance would dictate. For balloon catching, what more do you need? in some games, one doesn’t require much information to make a prediction that is useful. while running from lions, or investing in stocks, the tiniest edge over raw luck is significant. Both the long-term, unpredictable nature of the high dimensional systems, and the short-term, predictable nature of low-dimensional systems, derive from the fact that “chaos” is not the same thing as “randomness.” “There is order in chaos,”""Immediately after Saddam’s initial invasion, the war gamers shifted internal Look to running endless variations of the “real” scenario. They focused on a group of possibilities revolving around the variant: “what if Saddam keeps on coming right away?” it took ware’s computers about 5 minutes to run each iteration of the forecasted thirty day war. By running those simulations in many directions the team quickly learned that airpower would be the decisive key in this war. Further refined iterations clearly showed the war gamers that if airpower was successful, the U.S. war would be successful. The war gamers cheekily joked that no model reflects the white flag as a weapons system so few long-term predictions prove correct that statistically they are all wrong. yet, by the same statistical measure, so many short term predictions are right, that all short-term predictions are right.""""Modis addresses three types of found order in the greater web of human interactions. Each variety forms a pocket of predictability at certain times. The three pockets of Modis: Invariants, Growth Curves, Cyclic Waves- Invariants: Instead of walking a half hour to work, you now drive a half hour to work.- Growth Curves: The worldwide production of cars per year or the lifetime production of symphonies composed by Mozart both fit an S-curve with great precision. This law says that the shape of the ending is symmetrical to the shape of the beginning - Cyclic Waves: The apparent complex behavior of a system is partly a reflection of the complex structure of the system’s environment. This was pointed out over 30 years ago by herbert simon, who used the journey of an ant over the ground as an illustration. The ant’s jig-jagging path across the soil reflected not the ant’s complex locomotion but the complex structure of its environment. according to Modis, cyclic phenomenon in nature can infuse a cyclic flavor to systems running within itTogether, these three modes of prediction suggest that at certain moments of heightened visibility, the invisible pattern of order becomes clear to those paying attention. Pockets of prediction won’t keep away big surprises. But an image of an approaching predator becomes information about the future now. ""Fundamentalists, as they are called, attempt to understand the driving forces, the underlying dynamics, and the fundamental conditions of a complex phenomenon. in short they seek a theory: f=ma.""Wrong assumptions. even the best model can be sidetracked by false premises. Theoriginal key assumption of the model was that the world contains only a 250-year supplyof nonrenewable resources, and that the demands on that supply are exponential. Twenty years later we know both those assumptions are wrong""The only way for a system to evolve into something new is to have a flexible structure. Atiny tadpole can change into a frog, but a 747 Jumbo Jet can’t add six inches to its lengthwithout crippling itself. This is why distributed being is so important to learning andevolving systems. A decentralized, redundant organization can flex without distorting itsfunction, and thus it can adapt. it can manage change. we call that growth""From: http://www.aurosoorya.com/r&d/Out...1) Cultivate increasing returns. each time you use an idea, a language, or a skill youstrengthen it, reinforce it, and make it more likely to be used again. That’s known aspositive feedback or snowballing.6) Honour your errors – Errors help in evolution. “Evolution can be thought of as systematic error management.”7) Pursue no optima; have multiple goals – Complex machinery can’t be efficient; if it works, it is beautiful; forget elegance.8) Seek persistent disequilibrium – “Neither constancy, nor relentless change will support a creation.” We have to seek the middle point between equilibrium and death – the state of almost-fell. equilibrium is death This Order makes the collectivity in question behave in an organized, coherent, harmonised, efficient – biological – manner. Examples of such organized groups are ants and bees. Each bee does its work wonderfully in an organized manner, completely submitted to the ‘State’ – the beehive. The beehive doesn’t exist in any one bee, but emerges when the bees come together. Why can’t the same thing be true for humans, wonders the author."
14,0201483408,http://goodreads.com/user/show/16963542-martin-brochhaus,5,"Man! I loved this book. It's a tough and long read, but the author is so full of energy, curiosity and obsession with the topic, it is super entertaining to read.The ideas could have been distilled into a much shorter volume, of course, and some of the chapters felt a bit redundant to me, but overall I would say author really tried to shed light on a complicated topic from all possible angles.The amount of research that must have gone into this boggles my mind.This book asks big questions:1. What is life?2. What is intelligence/consciousness?3. What is evolution?I find it unbelievable that this was written some 20 years ago. If these people have thought so sharply at that time, now that most of their predictions have come true and are slowly drifting into mainstream consciousness, I must wonder what these people are theorising about TODAY.Overall, there is little actionable knowledge in this book, but it helped me to make A LOT MORE SENSE of this chaotic and hyper connected world we are living in today. Someone who is in their teens/twenties today and needs to decide how to align their life should devour this book.If you are on a quest, I'd recommend to read The Sovereign Individual, Sapiens, Homo Deus and then this. It will all come together oh so nicely, I promise!This was probably the most mind blowing book I have read in a decade or more."
15,0201483408,http://goodreads.com/user/show/38507143-christine-shan,5,"This book is about the same age as I am but the content seems as pertinent as fitting for this century.It is an amazing book full of ideas about life, technology, and evolution. The author explores topics that seem unrelated at first glance but then everything aligns and clicks into place in the latter half. The book was long but provided good context for people like me who are unfamiliar with the topics. There were some places I had to put the book down because the new ideas were whirling so excitingly in my head. This is a true gem if you love evolutionary biology, artificial intelligence and philosophy. "
16,0201483408,http://goodreads.com/user/show/23987251-hong-gao,4,"Integrate organ and nature to pursue underlying persistent logicThe underlying rules to govern nature and artifacts are openness, free. The evolution is more open, co-adaptive, incremental from atomic core to complex ecosystem. There is common and pervasive rule and laws to underpin living systems"
17,0201483408,http://goodreads.com/user/show/2237619-josh,5,"Kevin Kelly is one of the best and most original thinkers I've read, and this could very well be his crowning achievement. An absolute treasure of a book--worthy of many hours of careful reading. Odds are he will change how you think about world."
18,0201483408,http://goodreads.com/user/show/48065930-sainath,5,"Fantastic read. Some parts of the book are prescient, some are radically futuristic, and very little is dated.This book is about far too many things and maybe intends to leave the reader with more questions than answers. "
19,0201483408,http://goodreads.com/user/show/98023551-amy-springer,5,"This book was a life saver. I had so many thoughts running around my head about like and technology. Kevin Kelly has pieced it all together in a thoughtful and easy to understand way. My favourite quote is ""Life is the ultimate technology""."
20,0201483408,http://goodreads.com/user/show/692087-jennifer,5,AMAZING.
21,0201483408,http://goodreads.com/user/show/74816731-lailai,5,"Very impressive and interesting book! Although it is thick, but I Can’t help finishing it!"
22,0201483408,http://goodreads.com/user/show/4591603-kevin-yang,5,"For anyone who is interested in VUCA theory or decentralization, you must read this."
23,0201483408,http://goodreads.com/user/show/92362447-joseph-walker,5,Amazing insight into our frightening technological condition.
24,0201483408,http://goodreads.com/user/show/50677132-stephen,2,"Social implications poorly extrapolated, outlook too positivist. "
25,0201483408,http://goodreads.com/user/show/25958772-odanga,5,"Great book on the power of networks, evolution, artificial intelligence, consciousness and the world to come where machines and living organisms become indistinguishable."
26,0201483408,http://goodreads.com/user/show/89931129-s-a,5,"I wrote my thesis when I was amazed by the ideas of this book, the rules are true always in any ecosystem ."
27,0201483408,http://goodreads.com/user/show/51073638-norah,5,"Hands down the most intellectual and profound book I've read in recent years. Will read it again and probably again every couple years. Each chapter is rich in its content to be an independent book. Need constant break for digestion which makes it like reading a dictionary (in a respectful way!). So far, KK's many ""apocalypse"" of technology or society development has come true. He mentioned at the Q&A in the end that in the future (of a shared-hardware world), it's not the ownership of information, but the access to information, is key to power/success/everything that we define as most valuable. Curious to see when that will happen. "
28,0201483408,http://goodreads.com/user/show/62141990-caleb,5,What a brilliant magnum opus this is! Worth every second of the 11 months it took to get through this one!
29,0201483408,http://goodreads.com/user/show/36852749-stone,4,"It took me almost an entire year to finally finish this voluminous big cover. During this time period, I've already read Mr.Kelly's What Technology Wants What Technology Wants, which seems to correspond a lot to the prophecies in this 1994 book. As a result, my assessment on this book is more or less influenced by my judgement on the other one.Undisputed, Kevin Kelly was a great prognosticator of literally everything that took place in the information age, probably the best of his kind in Silicon Valley. Most of the predictions he made in this book have not only become true but extend further into the horizon---simply take a quick look at all the wearable devices and neurosensational contraptions we start putting on our body and even inside of our intestines these days. What enables him to make such accurate predictions, in my view, is the ""ultra futuristic optimistic progressiveness"" denounced by some commentators. The view that the tomorrow will get better is in any time unheard of throughout the human history until the explosion of science and technologies in the last 300 years. Both the million-year-old genetical intuition engraved in our DNAs and the millennial-old traditional teachings and indoctrinations are trying to persuade us to believe that we're still living under the same circumstance when in reality we are on the verge of an unprecedented transitional period and everything tends to get better off day by day.Despite the criticism made for Mr.Kelly's over-exaggeration of the role of machines and the ""delusional optimism"" of a combined human-technology ecosystem, I highly praise his work for two main reasons:1) He clearly identified the trend of the integration of biology and genetics with information technology for both the industry and the society. I was personally inspired by this observation that I started devising my own blueprint of a future full of bionic structures, cyborgs, and organic machineries that act just like living organisms.2) He established a holistic view of the effects of the advancement of machines in our ages. His insight on this tendency was not limited only to tech field but rather extended it to all the aspects of our society. This may well be reflected his 1999 book New Rules for New Economy. New Rules for the New Economy"
30,0201483408,http://goodreads.com/user/show/6782642-wil-michael,5,"Out of Control is one of the most different and interesting books I have read to date. Kelly beautifully describes the complex and simple structures we find throughout the networks in life. He describes things like hive behavior that make you rethink a beehive as rather then a bunch of dumb drones instead as a single super intelligent being. He delves into human psychology and the interworking of a human mob and its ability to function even without direct communication between those in the network. His story is read like poetry at times, which is surprising considering how much of it is about super complex systems of life. This book has certainly gotten me interested in chaos theory as it is quite interesting and mysterious. Before reading this book I looked at the world around me as simple and straightforward, now I see it as thousands of interconnected networks trying to survive together in a brutal world. This book is a bit old so it is amazing to see some of Kelley's theories proven and put into practice. However this was quite a hard book for me to read as it is not like a novel where you find yourself lost in the content of the pages. Constantly I found myself looking up things like collective unconsciousness and hive behaviour on google. The book itself is separated by its main points so it could have been written as a series of books. Overall I would totally recommend this book to anyone, and dont worry if it takes you a year of reading little chunks to finish it."
31,0201483408,http://goodreads.com/user/show/11509598-alex-lee,4,"In this well researched book, Kevin Kelly explores how agency emerges out of organization -- that the casual chain of ""where decisions are made"" isn't always locatable as a property of supervenience. Though a series of explorations (biospheres, cybernetics, group actions through crowd-feedback, evolutionary emergent behaviors, and so on), Kelly suggests that various causal chains can be complexified and managed but are often reliant on technocractic algorithms rather than human understanding. We reach our limit in grasping agency when group coherency is built out of several hundred+ factors but the suggestion that understanding is possible seems to be the undercurrent of Kelly's very interesting exploration.Towards the end, Kelly suggests an aesthetic list, one which if followed is meant to outline the possibility for extending understanding to the next level, to grasp emergent agencies. This is a bucketlist that treats the entire idea that things are ""out of control"" as being possibly ""in control"". He could have explored more in the direction of consciousness, but I suspect that Kelly shied away from this in order to maintain an organic but ""machinic"" (in the Deleuzian sense) view of agency.Some of the examples today may be somewhat outdated, but this was a fascinating book to read. Well worth the effort."
32,0201483408,http://goodreads.com/user/show/158289-scott-neal-reilly,5,"This is a great book. It covers a huge amount of material on complex systems, from robotics to economics to human psychology to ecology and more. Kevin Kelley is able to present relatively complex ideas like a well-versed scientist, but do it with the simple, engaging clarity of an excellent writer. There were a couple of pages that related to a project that I worked on back in grad school and where I know that he didn't get the material quite right, so I suspect that he was not perfectly true to all of the material/people/projects that he covered, but I've also seen the same work butchered a lot worse than he did, and, in the end, I still mostly agreed with his main points.Overall, I thoroughly enjoyed this book and would recommend it to anyone interested in complex systems. It's also the kind of book that I would even consider reading again (if I had time for that kind of thing)."
33,0201483408,http://goodreads.com/user/show/931699-jeremy,5,"What a book! I will be thinking about the concepts and ideas presented in this book for a long, long time. Kelly is a little more at home writing magazine articles, and sometimes the book lacks a coherent thesis, but that is more than made up for with wonderful prose, and an unbridled excitement for his subject.This book attempts to dissect the study of the unpredictable. From biological evolution to artificial intelligence to economies, it examines how and why complex, unpredictable systems form, and how they can be managed and created.This book was written in 1994, but it very rarely feels dated. The problems and concepts that technology was dealing with have become, if anything, more embedded and more interesting now. This book is a wonderful guide to anyone trying to navigate today's networked world."
34,0201483408,http://goodreads.com/user/show/12705473-william-crosby,4,"Extensive discussion of the development of neo-biological systems and the melding of biology and technology. Sometimes too wordy and anecdotal. Still, the often metaphorical and lyrical style of writing was a nice change from a dry textbook.One of the main points: that which we create can become autonomous, adaptable and out of our complete control.A few of the many concepts discussed: autonomous distributed systems, AI, hive mind, supermind, moreness, swarm model, coevolution, prairies, stable instability, game theory, variant disequilibrium, closed vs open systems, carbon, biosphere, smart eco-houses, ecological technology, neobiology, networks, sims, artificial evolution, genetic algorithms, connectionism, parallel processing, virtual ants, CAD, post-darwinism, symbiosis, saltation, spontaneous order, net math, crystallization, autocatalysts."
35,0201483408,http://goodreads.com/user/show/175986-jennifer,4,"I didn't read the whole thing, but just the first few chapters. I think it was sufficient for my purposes, but also very relevant. I love it when descriptions of natural systems match what you note about your own life or about God's purposes. It was somehow comforting to read the way biological systems organize (bottom-up, diversified, disorganized, and uncontrolled) and find that this way has advantages over our own way of organization (top-down, goal-oriented, organized, controlled). I'll have to come back to finish it in the future."
36,0201483408,http://goodreads.com/user/show/1462094-wessel-van-rensburg,4,"This is techno determinism on steroids, free market orientated and utopian. Digital darwinism would be an apt description in fact. It reads like poetry at times, which is surprising considering how much of it is about business.Very dated, but thats too be expected. He got it right that new media would be a powerful, liberating force for some, what he got wrong is that the new Networks won't have Hierarchy. And neither did the dawning of the digital post industrial society bring prosperity to the vast majority of Americans."
37,0201483408,http://goodreads.com/user/show/31104786-dave-peticolas,3,"This is an extended meditation on the idea that the worlds of biology and technology are converging, with consequences for both. Along the way we meet lots of interesting thinkers and doers and see what sort of crazy things some of them have been up to (Biosphere 2 anyone?).Kelley's a pretty good writer and, while all of his theses don't ultimately mesh together, I can't recall reading another book with as many densely packed ideas as this one. "
38,0201483408,http://goodreads.com/user/show/15014899-clivemichael,4,"Fascinating exploration, dated in places but incredible, inspiring; a mind expanding understanding of how everything works. Densely crammed with information and questions“ every additional week a child was reared by culture (grandparent’s wisdom) instead of by animal instinct gave human biology another chance to irrevocably transfer that duty to further cultural rearing. ““ To put it bluntly, humans are no more evolved than most bacteria.” pg 342His Nine Laws of God are basically equivalent to Permaculture Principles"
39,0201483408,http://goodreads.com/user/show/35385-kevin,4,"While working with the author who goes by the same name as myself, I had the opportunity to read his book. It was a complex and fascinating look into the merging of biology and technology and the resulting impact it's having on culture. His concept of the hive mind resonated with me, coming from an IT background. As my friends well know, I referred to the hive mind whenever I had the chance. This book has a major influence on the making of the film, ""The Matrix""."
40,0201483408,http://goodreads.com/user/show/16144846-lamec-mariita,5,"I found the book very enjoyable,entertaining and nice to read. The book's style is a combination of personal observations and interviews with leaders in their field. It's a must for anyone new to the field of Artificial Life. it won't bog you down with formulas and proofs, but is excellent in demonstrating that much of our current knowledge points to some revolutionary conclusions. This book is recommended if you are interested in stretching your mind and possibilities to new limits"
41,0201483408,http://goodreads.com/user/show/1011143-matta,4,"Liked this book, but it was written over a decade ago about ""cutting edge"" issues, so it comes across as dated in some aspects. And the chapters are somewhat disconnected, so the overall narrative of the book didn't keep me engaged. I gave up about half way through.I wish I had picked it up when it first came out."
42,0201483408,http://goodreads.com/user/show/1789533-maxim,4,"Broad overview of studies of complex systems of different kinds. It comes with detailed bibliography and can certainly be a starting point if you have casual interest in the field. As is usually the case with books written by journalist, not a scientist, some of author's generalizations and insights are trivial, so I give the book 4 stars7"
43,0201483408,http://goodreads.com/user/show/17801085-lei,0,"what an amazing book!lt's hard to read before you have finished the <>by Charles Robert Darwin.then it is easier to see what K.K want to tell you after you have read Peter F．Drucker's books!according of my written english ,the only i may promise : it is worthy to read as a businessman!by the way ,the details is easy to see if you focus!"
44,0201483408,http://goodreads.com/user/show/18664085-bowei-zhang,5,"It is really unbelievable that this book was written back in 90s. I would say it mentioned so many 'crazy' ideas (Gaia hypothesis, collective unconsciousness etc.) and really changed me. Moreover, I was watching a classic anime called Serial Experiments Lain during my reading period. They worked together like Oreo and milk, which is worth a trial!"
45,0201483408,http://goodreads.com/user/show/20947171-yates-buckley,5,"This book created an influential dream that emergence in technology would drive new beautiful realities. While the writing is clear and exciting, the underlying technopositivism is too strong and fraught with contradictions the author does not raise.Nevertheless this is a book one must read, if anything to make sense of how to respond to these claims."
46,0201483408,http://goodreads.com/user/show/130972-melissa,5,"I read this book about 12 years ago and I still talk about some of the little vignettes about hive theory and biospheres and out of control robotics. You don't even have to like science, it's awesome."
