,isbn,user_link,ranking,review
0,0393355500,http://goodreads.com/user/show/2531665-charlene,2,"Every time I read Dennett, I wonder why I have put myself through such an ordeal. Aside from wanting to yell at Dennett, who isn't even in the room, I get the urge to throw things and yell, ""No, no, and just NO!"". Skillfully, Dennett gives the impression that he is a deep and critical thinker. He does this by filling his many books and many long, long articles with some of the best arguments against his own work, and then addressing the criticisms. That gives the reader the false impression that he has a deep understanding of those counter arguments. At the end of the day, he does not. I took 4 pages of notes on this book, with the intention of including it all in this review. Instead of including the many (so, so many!) examples I collected of why his arguments are bad, I will try to give just one example that will hopefully illustrate how his thinking in general is limited and lacks an essential critical component. My example will focus on Dennett's assertion that while some living things know why they do what they do (they have purpose), other living things do not (they are less complex and act without knowing, and thus humans have an agency and purpose that other animals, plants, and microbes lack. While I love discussions about how local rules (do what your neighbor is doing, even if you don't know why) can give rise to global patterns (e.g. the termite following local rules but building global structure of complex termite mound), I found Dennett's discussions on the topic to be lacking. Early on Dennett described the non-agency of termites. (For an author who always uses far more words than needed to deliver his every argument, he did a shockingly brief and poor job of providing the mind-blowing details about termites and their mounds). Dennett makes it clear that termites have no conscious purpose. They don't know why they carry out the actions they do. Yet, they build a termite mound that is the equivalent of a breathing lung! Super complex structure from the agency-lacking termites. Much later in the book, Dennett discussed how some humans hadn't a clue what they were building when they took actions to build the atomic bomb. However, other humans did know what actions they were taking and served as master intelligent designers. There are so many things wrong with his understanding of termites and humans, it's hard to know where to start when making a counter argument. First, we could consider the queen termite as the master intelligent designer, since she orchestrates a pheromone-driven symphony of building complex mounds in her colony. Termites follow local rules (they don't know why they put a bit of dirt in a particular spot; they just follow what their neighbors are doing) but create global patterns (like a mound that is air conditioned, thanks to its lung like capabilities). Dennett failed to explain any of this to his reader. Second, even if we want to suggest the queen termite is not the same as the top clearance leader who worked on the atomic bomb, Dennett still fails to understand the lack of human agency. So what if some individuals knew why they built *that* bomb? So what if a human architect knows why s/he built a *particular* house or building? Dennett should be asking why human build in the first place, why they fight with bombs and other weapons, and why they do the many things that all humans do. Thirdly, and I think most important, Dennett seems to understand the argument that unless we are microbes, we can't actually understand what microbes know or don't know. Yet, he demonstrates that he actually doesn't understand that vital counter argument. Dennett is really sticking to his humans are special stance. For example: Humans know why they do what they do (or at least a subset of them know); AI will never be as smart as humans because human brains are too special for top-down evolution; plants are *obviously* not intelligent, it's just a matter of where we draw the line; non-human animals are less intelligent than humans, and so on). However, microbes built us. When we can make a huge entity that we can ride around inside and control (by making a brain, organs, skin, gut microbe communication systems, etc), then I might agree that we are as smart as microbes. Dennett doesn't know what microbes know. Yet, his confidence about their lack or agency and our possession of agency are steadfast. Every time humans have thought they were special, every time Dennett, *every* time, it turned out they were wrong. Another bothersome thing about this book is that Dennett is extremely aware of what outdated Dawkins has to say on the topic but he doesn't seem to be aware of the work of better scientists like Jeremy England or anyone working in the field of thermodynamics. When Dennett was spouting about how complex humans are, I kept thinking, ""Are you going to mention that complexity is the natural consequence of thermodynamics and illustrate for your reader what that means?"" Sure enough, a few sentences later, he actually did mention thermodynamics but it had nothing to do with thermodynamics and the emergence of complexity. So frustrating. He needs to start reading new people. My main motivation for reading this book was because Sean Carroll (physicist) plugged it on FB. I thought that maybe Dennett had really gone through some sort of change and really came to understand the Big Picture. While he is sometimes good about updating his thinking (unlike Dawkins), he continues to hold on to too many old ideas. So, while I appreciate that Dennett is able to point out the problems with Dawkins' arguments (arguments that end up hurting atheist arguments and not helping them), and while I appreciate that he is trying to update our concept of intelligent design (I think we do indeed need to update our understanding) he is just too old-school to do an effective job. "
1,0393355500,http://goodreads.com/user/show/4569933-stamatios,2,"With every respect to Dennett's considerable intellect, this was a mess of a book. I guess it was partly my fault for thinking that I was about to read a scientific textbook on the origin and evolution of intelligence. Instead, it felt like I was trapped in a dull cocktail party with a group of warring philosophers arguing on abstract issues such as the sense of one's self, cultural memetics, the nature of competence etc. Note that it's not these topics per se that I find dull, but the fact that, without any scientific means to test and measure their theories, philosophers have to resort to endless refutation and rhetorics - which is what Bennet spends a lot of his time doing in this book. While I enjoy reading philosophical texts on life and morality, and like to debate the various stances myself, I don't appreciate philosophy getting in the way of studying actual phenomena and tangible objects such as language and the brain.The book is also unnecessarily long, mostly for the reason I gave above. Rather than getting straight to the point, Dennet does a disservice to his readers by doing the rounds and debunking past theories or conflicting opinions, before returning to his own and trying to convince us through very lengthy and meandering examples why it's the right one. Ironically, if he hadn't taken the time to examine those different viewpoints, not only I would have enjoyed this book more, but I would also have found him more persuasive. Now however, I feel like I've heard only one, very biased, side of the argument and will reserve my judgement for when I've heard more on these topics.Despite all these glaring problems with this book, I can't honestly say that I hated it. Dennett has a knack for coining catchy expressions (I guess his study of memetics came in handy here) and I found many of his thought experiments genuinely ingenious. And even though his arguments were too long, and he uses too many words to say one simple thing, I admit that I enjoyed his prose - especially in the audio book format that I listened to. Does all that make up for the downsides however? Sadly no. I can't recommend this book to anyone but perhaps loyal fans of Dennett's, who may have a greater interest in his subject and have developed a tolerance to his style."
2,0393355500,http://goodreads.com/user/show/7258380-dan-graser,5,"Surveying Dennett's huge output, this is perhaps his most ambitious and accessible work. The criticisms below that there isn't much in the way of new thinking on several areas is valid and I don't think that proposing many grand new ideas was his intention for this work. As he states toward the beginning of the book:""Undaunted, I am trying once again and going for the whole story this time. I think we have made tremendous scientific progress in the last 20 years; many of the impressionistic hunches of yore can now be replaced with well-researched details. And second, I think I now have a better sense of the various undercurrents of resistance that shackle our imaginations, and I plan to expose and disarm them as we go, so that, for the first time, the doubters can take seriously the prospect of a scientific, materialist theory of their own minds.""On this level I certainly think he succeeds and this book is much more accessible than the at times impenetrable, ""Consciousness Explained,"" and, ""Freedom Evolves,"" both of which were quite interesting and provocative but at times maddeningly convoluted. This is a sweeping work and a unique one in the field of philosophy as Dennett's approach is a purely Darwinian, memeticist take on the development and functioning of the mind. Particularly interesting sections are his staunch disagreements with Noam Chomsky and his subtly different take on the mind with Steven Pinker. A very rewarding read, particularly if you haven't read much of Dennett's previous work. "
3,0393355500,http://goodreads.com/user/show/5469227-d-l-morrese,3,"The title of this book implies a journey, and that's what it feels like...a long, twisty one with diversions to view the scenery, most of which, frankly, is rather dull. Along the way we're supposed to have learned something about 'the evolution of minds', and perhaps we do, a bit, but not much, honestly, and after reading this, I'm not sure what it was. There is a long diversion to look at words as memes, and a lengthy stopover to take a few kicks at the dead horse of Descartes' mind/body dualism, but I'm not sure either of these required the number of pages devoted to them. My issues aren't so much that I disagree strongly with the things Dennett is saying, they're more to do with how long he takes to say them. There seems to be a lot of belaboring the obvious going on. I suppose I was hoping for a succinct presentation of Dennett's views on the nature of consciousness, and although it is frequently mentioned, we never get a clear, unobstructed look at it. Maybe it's here and I simply missed it. I may have allowed my attention to be diverted by the diversions. "
4,0393355500,http://goodreads.com/user/show/6243880-gary-beauregard-bottomley,3,"There is intelligent design. It's just not what the creationist think it is. Nature gives us competencies without comprehension. Comprehension means full understanding. Dennett gives the example of how the computer can do arithmetic without understanding as explained by Turing. His holy trinity within this book are Turing, Hume and Darwin. Each thinker provides an inversion to our 'manifest' knowledge by allowing an opening to the window to scientific knowledge. He'll explain in detail how each thinker allowed us to see the world differently but in an 'inverted way'. They all gave us an 'ontology' (his word) of the world for which we live in. Ontologies can be thought of as the furniture that makes up the world, the pieces of the things that we use to explain the world under consideration, the structure, the foundation, the ground, or the first principles.Dennett is never afraid to talk down to his reader. Pernicious teleology is how we think naturally as humans. We always impute a reason for the way things are. We accidentally assume a 'why' for the way things are, because that's how we think because we always assume meaning. ""Teleology is never free"" as he says in the book. We use science to redirect us back to the 'how' things are. There is no over all meaning for the way things became the way they are (at least I don't know the reason). Dennett is really big on emphasizing that 'free will' is an illusion in as much as that cause will always precede effect within the human realm (yes, there is an exception at the quantum level, but we don't control that, and it is not at our mercy), and if there was a great Judge in the sky or any where else, he would not be able to judge us knowing that we are the way we are because we were made that way and time and chance determined who we are. And as Dennett goes on to explain in this book, we still must be held accountable for our actions on earth, but, again, a great Judge in the sky can't hold us responsible for our actions because we don't happen in a vacuum we are a result of the world we are thrown into. Dennett doesn't say it but St. Augustine created the concept of free will as to be the analogous power that God had when he freely created the universe and that similarly resides in us in order that God can judge us. Yes, I know Aristotle uses the word 'free will' but he meant something different and closer to Dennett's compatibilitist definition. There's a template to the story that he's telling within this book that could be found in another book that I've read, ""Master Algorithm"". My mind kept referring back to that book as I was listening to this book and in the last chapter or so he tells you about that book in detail. I really loved that book but only rated it three stars because of two reasons 1) I didn't like its conclusions and 2) it was concise but overly complex in its presentation. I don't mind complexity in my books but I would not really recommend it to others because it could be very hard to follow. But, all the themes that were in that book are in this book. He called them tribes in the book ""Master Algorithm"". One of the tribes was Bayesian statistics. Our expectations based on prior experiences shape how we accept the present. That's what Bayesian statistics do for us. There is a really formal definition but it would involve probability functions, but at the heart that is what it is. Dennett relies on the heuristic to explain this. So I will too. The ""Master Algorithm"" shows how we are currently taking 'the inverse of the program and using machine learning' to solve complex problems through the aid of the computer. Dennett talks about Google and its language translation program which has done that brilliantly. It's a bottom up approach instead of a top down approach. Our mind and evolution both seem to work from the bottom up also. Cool stuff. But, Dennett only saved this stuff for the last chapter. Dennett definitely has a mind set that I tended to disagree with in this book. His very long section on the meme and culture over looked the reality of epigenetics and just briefly noted it and that was only to tacitly ignore it. Epigenetics are real. Just read Science News or check up on the Belgium babies born at the very end of WW II (June 1944 to May 1945) under the needlessly cruel Nazi occupation and see the analysis which is explained by epigenetics. Dennett takes TOM (theory of mind) and mirror neurons more seriously than I think should be warranted. He's trying to explain that our consciousness comes about through by the shaping of our environment by our behaviors. It's one way of looking at the problem, but maybe not the best. Popper (logical positivist) and Skinner (behaviorism) are probably not the right way to frame the extremes (imo) as he seems to do within the text. There just seems to be a another story that could be told.I really love Dennett. I've read four of his other books, and three of them are in my favorites list. I was little bit disappointed in this book because most of it was review for me, and I don't really agree with his behaviorism point of view in the development of consciousness, and I didn't really agree with his development of language as he presented it. Also, one can argue there is no proper ontology to the world (see Wittgenstein for details, e.g.), and embracing Hume (who is my favorite philosopher) leads to 'facon de parler' (Dennets phrase, means 'convenient fiction'), which doesn't bother me, but needs to be reckoned with in the context of the philosophy of science. I don't mind reading some one who I disagree with but I do mind not learning much more than what I've read in other books on the same topic."
5,0393355500,http://goodreads.com/user/show/3536004-jenna,2,"2.5 stars I had high hopes for this book, but -- *YAWN* Dennet's main ideas are interesting enough but there's not much new in this book. One gets the sense he is being paid per word, because he is extremely repetitive, the book just goes on and on and on; it is incredibly tedious and dull much of the time. 400+ pages that could be condensed into under 100. I forced myself to stay with the book, simply because this is Daniel C. Dennett, but had it been just about anyone else, I would have ditched the book after the first couple of chapters."
6,0393355500,http://goodreads.com/user/show/5817790-steve,4,"I love Dennett and I think he's brilliant. At the same time he's quirky and cranky and I don't know what else. A few bits in the book flew past me, but not so much - I think he was trying to reach a big audience. But I think the reason why I understood maybe 90% of this instead of 60% is because I've read other books of his and it's all beginning to sink in. So anyway, I liked it a lot, but I'm not sure I'd recommend it to someone who hasn't already read and enjoyed Dennett."
