,isbn,user_link,ranking,review
28,0641587716,http://goodreads.com/user/show/999171-anita,3,"This book is 6 lectures by Stephen Hawking, read by him--his electronic voice. I could hold on and understand the 1st one, but by the end I was really struggling with imaginary time, string theory, and quantum mechanics. I did learn a lot, but I only have scratched the surface. I do know now that black holes are not black, the second law of thermodynamics, and can understand that the universe is finite with no boundaries. Hawking has a way of explaining some difficult concepts with analogies that I could sort of grasp. He has a great sense of humor and a gift for teaching. I wish I had a better gift for learning. I was very interested n the history of theories of the origin of the universe, including the singularity that began it (much more scientific term than ""big bang""). He poses interesting questions on God and how none of these theories preclude God. Not for everyone, but you will feel both smarter and dumber for reading it."
29,0641587716,http://goodreads.com/user/show/46913324-angela-joves,4,"THE THEORY OF EVERYTHING by Stephen Hawkings explains that scientists are trying to unify a single theory to explain our world. They empasize more on why? rather than how? (ex:how is the process of electromagnetism? , Why is the process the way it is? YES) In actuality, two fields are combined to explain this, and those are Quantum Physics and Astrophysics, because QP explains the tiny and the small, while Astrophysics focuses on the giant of our outer space. Stephen also wrote that all of Albert Einstein's theories that are in his work, have been proved except one. Ans since the moment I read that (2 weeks ago) until now (July, 28,2018) there have been news of Gravitational Waves being found!!! and Einstein's theory yet to prove is involved with this new discovery of GW. I don't know if it now has been proven, but I must research (I think it has, with the GW found). :)"
30,0641587716,http://goodreads.com/user/show/4596610-nicola,4,"Superb. It wasn't nearly as intimating as I'd feared as Hawkings renders his theory's down to simple language that even I can understand, although I think my many readings of A Short History Of Nearly Everything helped a great deal. I'll give it a week and then I'll read it again a little more slowly."
31,0641587716,http://goodreads.com/user/show/51235242-divya-dutt,5,The whole quest of Physics has been explained beautifully by Mr. Hawking. Why does the Universe exist anyway ? For then we would know the mind of GOD .
32,0641587716,http://goodreads.com/user/show/15388765-emanuel,4,"I came to this book with just very basic notions of relativity, so I can't say I completely grasped all of the concepts and theories that Hawking explains. What I did enjoy was his style of writing and the way he compiled and deconstructed the different theories, opting for less mathematical language and academic terminology and using mundane examples so that an average reader like me could still follow.The book is a great introduction to the topic and poses several insightful problems and questions that instigate the reader to go out and find more about it. Overall it made me way more interested in cosmology and physics. Also, if you're into cinema, try watching (or re-watching) Interstellar just after you finished the book. I promise you some stuff will make way more sense, and you'll feel like you're ""in the know"" with the astronauts or certain scenes. "
33,0641587716,http://goodreads.com/user/show/39701006-amrendra,5,"Brilliant book. It is a compilation of 7 lectures by Hawking. These include his ideas about the Universe, it's origins and it's expanding model, Black Holes, the direction of time and finally the quest for the Theory of Everything. These lectures infact are the source on which his famous book 'A Brief History of Time' is based. Anyone with an interest in the Universe or plain Physics must read this text as a beginner's material on which further reading can be built up. The style is easy, making complicated things simple to understand. How Quantum Physics is so important and how the Uncertainty Principle plays a big role are just some of the fabulous questions these lectures posit for the curious reader and the student of Physics alike."
34,0641587716,http://goodreads.com/user/show/9381082-sana,5,Stephen Hawking continues to be my hero. He is obviously a brilliant mind but he is also great at explaining his theories. he starts the book so simply- with how man came to understand the earth was round- the slowly complicates it til its peak in the theory of everything (the last chapter). I love that when he speaks of God he explain everything and the possibilities and what one might make of them and doesnt impose his ideas. he is a a man who seeks knowledge and truth lacing of everything with wit and sarcasm makes this book quite awesome actually. and as a muslim this actually renewed my faith.
35,0641587716,http://goodreads.com/user/show/32209505-nandha-kumar,4,"Now I am going to take up a side of people who are saying Earth is flat. that is easy right? to say God created the world and that is it. sun revolves around Earth and that is it. if you took Stephen's way, man that is complicated to the core. In this book Stephen Hawking went his infinity level to make us understand how are we here. The English and the explanation was so simple anyone can understand apart from some theories. But who knows these theories maybe wrong like the author himself said. we just have to wait to know about the universe if they found the secret before the end of our time or the universe's."
36,0641587716,http://goodreads.com/user/show/37650802-kara,4,"This short collection of lectures covers an incredibly wide range of complex topics. Hawking's explanations are relatively straightforward and not overly technical, though he doesn't recap background information. I wish I had refreshed my brain on basic physics principles (the four forces of the universe, general relativity, quantum mechanics, etc.) before sitting down to read this, as I think I would have absorbed a lot more had I done that. These theories, especially the ones in later chapters, are inherently very complex, and I found myself struggling to understand them at times — but I chalk that up to the fact that I am not a theoretical physicist, and not to any shortcomings of the book itself. I have a feeling this is probably a book that it's helpful to read multiple times over so you can really absorb the content, so I might return to it at some point."
37,0641587716,http://goodreads.com/user/show/1995137-t-a-n-y-a,3,"Very interesting. Michael York was excellent narrator on audio book - brief look at how the universe began with research and theories given, not too deep or wordy, but balanced well for the lay science reader. Hawking offers knowledge of Milky Way and black hole evolution as well as challenges much thought on the universe expanding and how it will move through time after we’re gone from it. I especially appreciated the presence and time given to God and how His main part in its creation was included and not dismissed. "
38,0641587716,http://goodreads.com/user/show/115753559-celia-s-nchez,4,"Hawking has the ablity to illustrate complex propositions with easy analogies.This book consists of series of 7 lectures which includes blackholes, bigbang ,quantum gravity and string theory..This book is not for beginners..Basic knowledge of classical physics is necessary ....For a easy ride on hawking's background and black holes try ..Black Holes and Baby Universes and Other Essays(this book has a interview about his personal choice of music and books for desert island disks a BBC program)According to classical theory of General realtivity the laws of physics would break down at singularity in the beginning of the universe (in blackholes too)..So one needs to use quantum theories of gravity to discuss the very early stages of the universe.(no need of singularities in qm)..Even though we dont have complete theory to combine quantum mechanics and gravity we must incoporate Feynman's poroposal to formulate quantum theory of a sum over histories...I got confused while reading these areas (5 th lecture) ..Hawking avoids this fayman's sum over histories(atter mentioning the technical diffulties) and invokes a concept of ""Imaginary time ""(after reading 5 books of hawkins i cant completely grasp what this is)..A type of Eucledian stuff were the distinction between time and space completely disappears ..He uses this time logic in his talks on black holes also...That certain particles can exceed the speed of light for short distances according to uncertanity of W.Heisenberg) was a epiphany for me I was confused over the logicalityof black hole radiation..... Certainly the lecture ' Origin and fate of the universe "" needs re- reading and supplemetary books/video references His first lecture provides history of ideas from Aristotile's ditermination that the earth is round to the discovery 2000 years later of edwin Hubble, relativity(salute alexander fredman who got it right regarding expanson of universe a result of einstein's theory but he himself doubted ..postulated lambda a antigravity constant for a static universe though later called it as his biggest ""blunder"") In the final few lectures hawking ventures in to the question that remains unanswered by modern physics. how to combine gravity with quantum mechanics ...aka the theory of every thing ... recommended ...."
39,0641587716,http://goodreads.com/user/show/32218485-iyan-de-jesus,4,"I could easily give 5 stars but there are stuff that made me cringe a bit about this book. First, using ""thousand millions"" instead of saying ""billions"" or using numbers to make it more visually comprehensible. Second, trying to appease the sects by forcing in some god stuff in the middle/near the end of each lecture. Other than those, it's a good and entertaining book that made such a complex subject a little more understandable for the layman."
40,0641587716,http://goodreads.com/user/show/108762852-ali,5,Hawking’s thoughtful science communication quenches the drought for the general public’s education in cosmology and the fate of the universe. His account equips the reader with a foundation to begin pondering “why we are here” rather than merely “how” as he reveals the infinite wonders of our quantum world.
41,0641587716,http://goodreads.com/user/show/51684298-winterdragon,5,That I respect Hawking for his brilliant mind goes without saying. It is for his warmth and knack for making the obscure understandable that I truly admire him.
42,0641587716,http://goodreads.com/user/show/17062276-nichole-smith,5,Amazing. That is all. 
43,0641587716,http://goodreads.com/user/show/21607791-mehrdad,4,I read this book out of curiosity and I'm glad i did that. I didn't understand some parts of course cause I'm not a scientist in physics but i enjoyed the parts that i understood!
44,0641587716,http://goodreads.com/user/show/70298156-dhruv-sharma,4,"Am a big fan of Stephen Hawking, the way his books explains the complexities of various dimensions of space science is outstanding and the whole process of reading not just only becomes interesting but fascinating also.Book covers the history of ideas about the origin of universe from Aristotle, Newton, Einstein and Feynman. He then explains the Big Bang, black holes, and space-time and incorporates these thoughts into the search for a unified theory of “Theory of Everything”, he does explain, in simple metaphors, the flavor of what such a theory would be."
45,0641587716,http://goodreads.com/user/show/84013823-teshan,5,One of the best and simplest books I have read. Stephen Hawking explain very complex mathematical ideas very simply which anyone could understand. Really liked it ! 
46,0641587716,http://goodreads.com/user/show/10065397-sana,5,"Brilliant, thought-provoking and hopeful. I am glad that I decided to finally read it."
47,0641587716,http://goodreads.com/user/show/95482565-dalton-harmsen,4,"Interesting and clearly explained lectures, (mostly) understandable for laypersons."
48,0641587716,http://goodreads.com/user/show/69052467-dharmendra,5,"A simple and enlightening read!!!If you are curious about ""The Beginning of the universe"" or ""How it may end"" this book will give you a good start."
49,0641587716,http://goodreads.com/user/show/9295664-julie-maan,4,Would give it a five star if I understood more 🤦🏼‍♀️ 
50,0641587716,http://goodreads.com/user/show/51897941-patrick,3,Smart guy.
51,0641587716,http://goodreads.com/user/show/3133304-dale,3,"Read before teaching a class on Modern Physics. ""Modern science is based on the principle: 'Give us one free miracle, and we'll explain the rest.' The one free miracle is the appearance of all the mass and energy in the universe and all the laws that govern it in a single instant from nothing. ~ Terence McKenna. """
52,0641587716,http://goodreads.com/user/show/37309415-aditi-jaiswal,5,"We are just an advanced breed of monkeys on a minor planet of a very average star. But we can understand the universe, especially when the difficult mathematical concepts of origin and the plausible end of the universe are explained to us in 7 simplified and easy to comprehend lectures.These seven lectures are the history of history of the cosmos and our place in it, including the contributions of all the scientists of the world who tried to explain the universe, be it Chandrasekhar defining his Chandrasekhar limit or Einstein’s classical theory of relativity, from the big bang (expanding universe beginning with a singularity) to the black holes and cosmic censorship hypothesis ( God abhors singularity) and finally ending up with a quest of unification of physics to a complete,consistent and unified theory that would include all the partial theories (to combine general relativity with the uncertainty principle) as approximation to give you a proper grasp of a small proportion of scientific theories.The heavy laden mathematical concepts which we dread to even talk about is explained in such an uncomplicated yet cleverly amusing language, that I can proudly say that if I were to explain to you the concept of black hole, the arrows of time and string theory, I can do so in broad strokes to your understanding. This book will make you question everything about the universe out of curiosity, like why we know about only 3 space and 1 time dimension and why not the higher dimension that science fiction talks about, what will happen when an astronaut falls into a black hole? Will he turns into a spaghetti because of strong gravitational fields; what will happen if there were 2 dimensional people living in a 1 dimensional earth, so do they have to climb over each other in order to get past each other? Most importantly if you ever meet your antiself, don’t shake hands!The theory of everything does not give us an understanding of everything but it rather provides us an idea that there exists a unified theory to explain the existence of the universe and beyond, if we are smart and economically funded enough to seek answers.He gave the 3 possibilities that might help us in discovering the ultimate truth of life which we wonder about while gazing at the night sky thinking what is up there,how it came to be and where do we come from?"
53,0641587716,http://goodreads.com/user/show/53184865-abhishek-bagade,4,Does a good job of giving an overview about the current theories about our universe and how they came to be.
54,0641587716,http://goodreads.com/user/show/2579239-alex,3,“The most remarkable property of the universe is that it has spawned creatures able to ask questions.” 
55,0641587716,http://goodreads.com/user/show/1281512-kelly,3,Don’t choose the audiobook. The reader had a terrible sing-song cadence that made it sound like Winnie the Pooh. 
