,isbn,user_link,ranking,review
62,0393354377,http://goodreads.com/user/show/4272284-kristina,4,"Mary Roach makes science fun. I mean, I think science is fun anyway, but she makes it accessible for non-scientists and she makes it practical. Grunt: The Curious Science of Humans At War is her latest book and I enjoyed it very much. Once again, she tackles scientific topics no one else would think to address and she does it with curiosity, respect, humor and enthusiasm. Grunt explores the science of war and the problems soldiers must deal with (other than the reality of being shot or blown up). After reading these chapters, you realize how much we truly owe our soldiers.I never ever would have thought about military uniforms. Never in a million years. But here’s Roach with a whole chapter about this very topic. Apparently, the fabric of a uniform can affect a soldier’s ability to fight well. That seems like common sense now, but who thinks about this stuff? This is what a modern uniform must do (or come as close as possible): If possible, the army would like to dress its men and women in uniforms that protect them against all that modern warfare has to throw at them: flames, explosives, bullets, lasers, bomb-blasted dirt, blister agents, anthrax, sand fleas. They would like these same uniforms to keep soldiers cool and dry in extreme heat, to stand up to the ruthless rigors of the Army field laundry, to feel good against the skin, to look smart, and to come in under budget. It might be easier to resolve the conflicts in the Middle East (21).She should have added that they be quiet—zippers and buttons and velcro can be noisy and noise can give away a soldier’s position. Extensive testing of fabrics and designs goes on at the US Army Natick Soldier Research, Development and Engineering Center. It’s extremely involved and high-tech. From equipping soldiers with the appropriate clothes to putting them in vehicles that will shield them as much as possible from explosions and gunfire, Roach moves her focus to the human body itself and how the military tries to repair war injuries. Roach being Roach, she doesn’t discuss the usual prosthetics. Why should she? It’s a well-researched topic. No, Mary explores what happens when men have groin damage and their genitals have to be reconstructed. Penis transplants are also now possible. Roach witnessed the procedure (done on cadavers only) and said that by the time the book is published, the first ever penis transplant may have occurred. This chapter was kind of gross, but also very interesting. Roach discusses the possible psychological problems these transplants may cause.The problems of diarrhea, the helpfulness of maggots, and the strain of heat exhaustion are all topics covered in more detail than you may care for, but that’s Mary Roach—she doesn’t leave anything out. The chapters dealing with life in submarines was the most interesting for me, probably due to the lasting impressions the movie The Abyss had on me. I first saw that movie years ago and to do this day I’ve been fascinated with the idea of submarines and the perils of underwater living. It’s also a kick ass movie and I highly recommend it; it vividly shows the consequences of sea water pressure on mechanical objects. Mary Roach is a delight. Her self-deprecating humor and willingness to be a human guinea pig whenever asked (seriously, read her book Bonk. She does not embarrass easily) makes her science books fun to read. She asks the questions you would be reluctant to ask (even if it occurred to you to ask them) and she enthusiastically pursues the answers. If you’re interested in science, read her books. Even if you’re not interested, read her books. I think Mary Roach’s books should be read by high school students so they can understand that science has very real and practical uses. Plus, they will realize that it’s fun."
63,0393354377,http://goodreads.com/user/show/4361541-barb-middleton,4,"Every time I sit down to write this review, I struggle with the right words and can't help but feel like a ""goober"" myself. Journalist Mary Roach has a terrific voice that makes this science piece easy-to-read and while I laughed, for the most part, there were other times when it was too much. I am glad I read it after, ""The Pentagon's Brain: An Uncensored History of DARPA, America's Top-Secret Military Research Agency"" by Annie Jacobsen because it gave me some historical context that is lacking in Roach's book. Roach is upfront about not specializing in history or science, ""I'm the goober with the flashlight, stumbling into corners and crannies..."" Parts of her story were interesting, others not, and the end definitely abrupt; however, I appreciate the attempt to create characters that are easily visualized. Although even that got repetitive at times. The book doesn't quite nail it, but it is worth reading if you want to know about the side of the military that gets little press such as fabric design for combat, blast wounds, medic training, hearing loss, types of repellents, phalloplasty, and diarrhea to name a few. Her self-deprecating humor and figurative language add to the light tone and great voice. She pokes fun at her lack of knowledge throughout such as thinking that a mechanic's tattoo of pistons are martial arts weapons because of his fierce appearance. On a ship, she makes the mistake of identifying rifle holders as cup holders. She creates characters through detailed descriptions that I liked but became somewhat repetitious, particularly at the start. It seemed most people were gorgeous, adorable, or muscular: ""She is gorgeous, articulate, fast-moving, powerful. Lesser humans left blinking in her wake"" or ""...with a superhero jaw and muscles so big that when he walks in front of the slide projector, entire images can be viewed on his forearm"" or "" you wouldn't use the word distinguished but adorable."" Another officer is ""droll"" and ""adorable"". Even the maggots are ""adorable"" as ""they move like inchworms, like something you might see humping along the pages of a children's book."" That image gave me pause. Here's another one, ""His incisors touch down on his lower lip like children jumping on a bed."" No adorable, but an interesting simile. A fun made-up word is, ""The whole business is straight off my fathometer."" Sometimes she kapow's the reader with phrases that hide her lack of depth on a topic. Other times the book has a seriousness and poignancy that is insightful. She admires the bonding of soldiers and selflessness that defies reason. A man that lost both legs was more concerned about his fellow soldiers being okay than the fact he'd just stepped on an IED. Or how another soldier lost his limbs but said the worst part was losing his hearing because it made it so difficult to communicate with his wife and children. Or the part about how much the government spent millions on shark repellent based on one man's experience and another's political connections. She nails it sometimes and misses the mark at others. And the chapters are connected in a loose manner. As a journalism major, I enjoyed and admired how Mary Roach wrote this piece. She tackles many different topics and perhaps this is the downfall. It might have been better if she had focused on fewer. If you are looking for something historical or scientific then you might want to pair this with another book. "
64,0393354377,http://goodreads.com/user/show/1345046-todd-martin,3,"Grunt is Mary Roach’s latest book in which she examines technologies associated with  The Curious Science of Humans at War. Well, not really ‘war’ per se, her approach is to focus on technologies involved in keeping soldiers alive and comfortable while minimizing any discussion of weapons, killing or the subject of war itself. This is rather a fine line to tread since the purpose of keeping soldiers alive and comfortable is so that they can do their job (which often involves the use of lethal weapons to end human life), but Roach is known for writing about quirky science topics in an off-beat and humorous way, and the act of creating a fist sized-hole in a human body with a high velocity rifle round isn’t a subject that naturally lends itself to hilarity. Roach is also flirting with a topic fraught with controversy (the bloated US military budget, politicians pork barrel spending, US foreign policy, the national debt, unilateralism, torture, wars of choice, terrorism, drone strikes, civilian casualties, friendly fire, war crimes, the military industrial complex, the treatment of veterans, suicide rates, the conflict in the Middle East and on and on). Her approach is to desperately seek subjects that provide a safe haven so as to avoid any possibly of providing offense (while still managing to work excrement and genitalia into the conversation … obviously). Thus she has chosen to discuss such minutia as: the fabrics and fasteners used in military garments, vehicle armor, hearing protection, penis reconstruction surgery, dysentery remedies, heat exhaustion, sleep deprivation, and others. It’s not that these topics are unimportant (the clothes worn by a soldier while patrolling in a brutally hot desert environment certainly play a role in their comfort, safety and effectiveness), but by focusing on individuals who sweat the small stuff, she’s making a conscious decision to willfully ignore the big stuff. I'll also point out that, other than her coverage of submarine rescues, the remaining topics apply just as much to civilians as they do to the military. Roach is also extremely careful in her use of humor in the book, restricting it mainly to that of self-deprecation. A typical example follows the formula:Roach: Oh look, these uniforms have such cute pockets. They’d be perfect for carrying accessories like my bedazzler or a fresh banana. Military Personnel: That’s magazine holster for an M16A2 assault rifle ma’am.{Cue the trombone}: Wah - wah - waaaah.Given the carefully contrived scope of the book, I would characterize the restricted list of topics discussed as modestly interesting. But after having read most of Roach’s other work I feel like her ‘unflinching glimpse into salacious topics’ style has crossed over into the realm of self-parody. Enough already with the preternatural preoccupation with pee-pee, ca-ca, and the orifices from which these substances emerge."
65,0393354377,http://goodreads.com/user/show/51152697-kate,4,"This is a book about military science: the study of those things that might affect personnel in combat.he author has a reasonable sense of humor which is much like the military and black humor I am used too. In several places I laughed out loud, as when someone heard a rumor that red fabric had cooling properties. The Army decide to test this in the Philippines and had red under ware designed and ordered and red hat liners...they were anything but cool and the men sweated in places no one wants to sweat, and the red dye ran when wet down into the men's nether parts staining them much to the humor of the control group who wore white under garments. This was 1908 and the services were still on a learning curve.It covers everthing from uniform design, specifications for buttons, why zippers don't work special needs of snipers in gear requirements. How cloth is selected and engineered to wick moisture, retain body heat or allow cooling in hot desert climates. Uniform design: although it didn't mention helmet design which I have been told has been responsible for some of the serious facial burns in IE explosions. The research on the amount of water needed in desert conditions when soldiers burdened with a hundred ponds of gear, armour, supplies and munitions have to expend energy in day time heat of 120-135o. It also covers how the body beaks down when too much water is consumed.Of course it addresses the gigantic toll of intestinal distress from contaminated food, flies and sand tics, and the research that was started during the Spanish American war up to present.Studies and testing to properly armour up vehicles, how to protect bodies within vehicles from the tremendous bone shattering concussions. Much other research is cover in sections, how to prepare Medics to cope with the carnage of the injuries caused by modern weapons.Very interesting book, having family members that have worked in procurement, a son who was a Medical Officer in serving in theater I was familiar with some of the things covered, and the complaints of those who did not want one more piece of protective gear to weight them down or obstruct their movement. A good read for anyone not familiar with what many of the military research teams deal with."
66,0393354377,http://goodreads.com/user/show/1462387-karyl,5,"Mary Roach is like that little precocious kid that always asks, ""But WHY?!"" I don't think she ever grew out of that stage, and that is lucky for us. She has so many questions to satisfy her curiosity about literally everything, and it's that which fuels her books. I knew I was going to enjoy this book, simply because she wrote it, but it's even more amusing yet fascinating than even I had imagined!I'm glad that Mary Roach didn't go into the normal things you think of when you think of war -- things like guns, or bombs, or IEDs. Instead we look at the fabrics the military uses in its uniforms (I am rather glad I was ignorant of how easily flame retardancy washes out of fabric after my husband finished out all his years at sea, since his favorite coveralls were about as old as some of the guys under him), keeping troops safe when driving through dangerous areas (who knew they'd have to completely redesign the crash test dummy for upward impacts?!), hearing loss (something I'm quite familiar with, since my husband spent the last 23 years in the engine room of various warships), what happens when a guy gets shot in the junk, even how to keep troops free of diarrhea in the field. There is so much in this book that the average person just has never thought of in regards to military science, and of course, Roach injects her own brand of humor at just the right times for a little bit of levity. Read this book, even if you have zero interest in military science. It's funny, it's informative, it's just a good read. I found myself reading out whole pages to my husband while we were on a long drive, and now he (almost) wants to read it himself!"
67,0393354377,http://goodreads.com/user/show/8733987-christina,4,"This was my first experience with Mary Roach. While the topics she chose to research were fascinating, it was her sense of humor and how it blended in to her style of writing, that I could not relate to at the start of the book. I wasn't sure if she was mocking, making light of or was just generally trying to be funny, in regards of the areas she chose to research for this book. For this reason, I spent the first couple of essays a bit pissed off that she could possibly be making light of such a respectful arena. By about the 3rd chapter, I got a feel for her general reverence and then it all just clicked. I'm a believer and I want to get my hands on all that she has to write. Roach has the ability to bring to the light of day, areas of the military that we may never even give a moment of thought about and surely not consider of importance to the bigger picture of soldiers and the theatre of war. So, not only does she look into the nooks and crannies of the American military, she gives credit to ALL of the MEGA-research that goes in to daily operations that one may not even consider. In doing so, Roach helps to bring a shared glory to the Military as a whole, something that I know doesn't happen often enough. I gained a lot of respect for her writing when I made this realization, and I further appreciated the knack she has to make it all so readable. I highly recommend this to any one who has a bit of time to take a little trip through some of the little known and often really weird, areas of military research and operation. "
68,0393354377,http://goodreads.com/user/show/17379348,4,"This is my first Mary Roach book. I have been meaning to read something of hers for a long time, but when I won an ARC of Grunt, I really had no excuse anymore.So here's the thing. I have a big problem with people who glorify war and who think patriotism excuses despicable acts such as mass murdering. If this book worked for me, it's because it didn't focus on the killing aspect of war, but rather on the surviving. There was no chapter on guns or explosives. In fact, the only weapon mentioned in this book was something called Stench Soup, which was as life-threatening as its name implies.Roach is very funny and relatable, and her curiosity is contagious to the reader. There were certain points in the book when I was not sure what her opinion on war was, or even if she wanted to express one, but that was clarified at the end of the book. Which brings me to my last comment: I really liked the note that the book ended on. I am very particular about endings. Fiction or non-fiction, the way a book ends can make it or break it for me. And by ending, I do not mean the last chapter or even the general resolution. I mean literally the last couple of sentences. Roach, though, wrapped it all up perfectly.To wrap up myself, reading Grunt was an overall very good experience. I laughed, I shuddered, and I learned all kinds of information that I was never meant to know. And when it comes down to it, what more can you ask of a science book?"
69,0393354377,http://goodreads.com/user/show/2222340-chris,2,"What a disappointment. Grunt it is not. The author's penchant for monosyllabic titles has done her in. Maybe Boom would have been better because this book is not about grunts. The cover has an infantryman with an absurd amount of gear on his back. Yet there is only a page or two about the infantryman and his obscene loads. The subtitle of the book more accurately conveys the substance of this book: the curious science of humans at war. Some areas you would expect some coverage she omitted: woman in combat; NBC defense; biological barrier of flight; vision-we own the night with NVG's and infrared; PTSD; drones and robots; to name a few. What she does cover is two chapters on genital wounds and a long and perhaps irrelevant chapter on stinky things. I enjoyed the chapter on hearing.She was trying to inform and also entertain simultaneously and she didn't pull it off with me. Flippant footnotes in too small a font. Her overly dramatic account of trying to get special operators to talk to her about diarrhea fell flat. This book got rave reviews but it was written by and for the 99 percent of clueless Americans who as the military say ""are at the mall"" while the 1 percent deploy continually in ""endless war."" This book is described as witty, mischievous, fun, and entertaining. Since when has war been that?"
70,0393354377,http://goodreads.com/user/show/4882193-paul,4,"As with other Mary Roach books I've read, I thoroughly enjoyed this one. And I knew a bit about the subject matter, the military science of keeping soldiers, sailors, and airmen alive, healthy, and at their peak. In my case, it is aviation medicine and physiology. I flew fighters for the USAF, so I know all about altitude chambers, the infamous Nazi experiments of WWII our present-day cold water survival charts are based on, and the improvements we've made over the years in ejection technology. Mary Roach didn't get into the aviation side of military science with this book but she did explore in detail such topics as military clothing, boots, rations, armored vehicle technology, diarrhea and dysentery, the unique injury patterns associated with IEDS and other explosions, submarine escape systems, and sleep management ... critical subjects all, and not often thought of by anyone other than soldiers who have to perform an all kinds of crazy and dangerous environments. Her trademark humor is very much in evidence, and one simply cannot stop turning pages. In case you can't tell, I love Mary Roach and will read anything she writes."
71,0393354377,http://goodreads.com/user/show/2505581-gary-brecht,3,"A book definitely not for the squeamish, author, Mary Roach, pulls back the curtain to peek at the efforts of our military to protect and patch up our combat soldiers. The reader is given a tour of a wide variety of military units that specialize in such things as testing protective clothing and gear; training submariners to survive a sunken submarine. She introduces us to surgeons who must deal with the physical and psychological consequences of lost limbs. We discover that there is an ongoing analysis of combat deaths where experts examine the remains of fallen soldiers in an effort to learn ways to prevent future lethal incidents. Throughout the book Roach’s dry wit acts as a relief valve for the otherwise serious content. When all is said and done about the heroic efforts of these support units, one still marvels at how cavalierly our leaders commit our youth to war."
72,0393354377,http://goodreads.com/user/show/17367460-jim-angstadt,4,"GruntMary RoachAnother fast, fun, satisfying read from Mary Roach. The title is a little misleading. One might suspect that this book is about the military in general, or the army in particular. But, really, it is about numerous often overlooked areas of military operations, namely, clothing, vehicle design, genital surgery, staying focused during chaos, diarrhea, bug control, smelliness, sleep deprivation, and more.The author brings out the science behind these topics, and in the process, illuminates many talented, committed, generous, behind the scenes personnel - doctors, scientists, lab workers, staff - who are doing very good work."
73,0393354377,http://goodreads.com/user/show/8734097-p-d,4,"As always, Roach's books are a delight to read because they ask questions we wouldn't think of asking. When you're told to come up with the main challenges facing a modern soldier, you probably aren't going to name sleep deprivation, diarrhea, or hearing loss right away. She does mention right away that she isn't here to politicize anything, and that she is deliberately not going into PTSD/mental health because there are whole books that do a great job with the topic—but this shouldn't be too surprising as her writing has been consistently quirky, interested in the perspectives without judging them."
74,0393354377,http://goodreads.com/user/show/1072582-kaethe-douglas,5,"Grunt: The Curious Science of Humans at War - Mary Roach One morning you wake up and realize you just never thought that much about the stuff of war. Thankfully, Roach has gone before and asked the awkward questions. Yeah, new weapons and planes and ships have to be developed, I knew about those enormous contracts.. But also someone has to work out all the other stuff: what things do people really need to carry? what’s the best way to keep people alive? What makes a weapon ideal? Roach is out there following her curiousity to places I never considered, and arousing mine.Library copy"
75,0393354377,http://goodreads.com/user/show/4070288-jo,3,"I love Mary Roach, and her usual interesting facts and humor are on display in this book, but the tone did not match the material as well as it usually does. She took a quite cavalier and breezy approach to the military, improvements in military technology to prevent horrifying death, and military spending. Only the very last sentence of the book addressed this at all. The chapters also seemed less coherent then usual, covering the army, the navy, genital reconstructive surgery, a shark project from the 1940s, among other subjects, and not adding up to a general picture."
76,0393354377,http://goodreads.com/user/show/4802330-heino-colyn,5,"Man, I love Mary Roach. This book took me places I did not expect to go and I now know something about genital reconstruction and a lot more about poop. Mary makes me a more interesting person. She also does the best descriptions of people. I'd love to find a way for her to interview me about something, just so that I can read how she chooses to describe me.I love what she's doing for science writing and as always, I would happily recommend this to anyone who thinks they don't enjoy nonfiction or someone who finds science writing intimidating."
77,0393354377,http://goodreads.com/user/show/2127955-holly,5,"I  am so thankful I stumbled across Mary Roach. I never would have thought I would enjoy a non fiction book about science...let alone one involving the military. But she has this way of making the most complicated subjects approachable, and so, so fascinating. Roach gives readers a glimpse at the science and humanity behind the people who go to war, instead of the war itself. I just love her to pieces. In fact, I may be developing a bit of a nerdy girl crush on her. #noshame."
78,0393354377,http://goodreads.com/user/show/53176851-mrs-europaea,4,So interesting to read about the science of war. Mary Roach has a wonderful way of making hard subjects appeal to an average reader and she did this wonderfully in Grunt. Her dry humor and awkwardness makes what could be boring and wordy entertaining without discrediting the hard work of Service members or scientists. 
79,0393354377,http://goodreads.com/user/show/8101737-peter-tillman,3,"Progress report: Great stuff, but then I came to two chapters on *Genital mutilations* ...Now up to hearing damage. Interesting but not great, and occasionally gross. Roach really likes the gross-out stuff. Not my favorite of her themes.OK, I finished it, more or less. Definitely a mixed bag. I might try it again later, which has worked for me for some of her other books."
