,isbn,user_link,ranking,review
66,0307377903,http://goodreads.com/user/show/3809399-stormin,5,"I've been a fan of Jonathan Haidt for years based on watching his talks and reading his articles. In those talks and articles, he lays out the basic framework of Moral Foundations Theory clearly and (seemingly to me) comprehensively, and also shows how the theory works in practice (such as this article about What Tea Partiers Really Want).So, although I am a huge fan, I wasn't in too much of a rush to read ""Righteous Mind"" because I thought I already knew what would be in the book, and the rest would be filler. (This is why I don't read more non-fiction, by the way. I find that in most cases popular nonfiction hides 20-70 pages worth of good thinking amid 200+ pages of unnecessary bloat.)I was wrong.""Righteous Mind"" was captivating from beginning to end. It included much, much more material than I had anticipated (mostly about general human cognition as a backdrop for discussions of moral cognition) and the material is all first-rate. I admit to being somewhat biased by Haidt's praise of Hume (I love me some Hume), but I think anyone would be enthralled by his lucid, insightful discussion of what makes humans tick, morally speaking. Add to that his interesting autobiographical journey and his clearly outlined arguments (which I appreciated) and lastly his generous writing tone (he's especially careful to credit colleagues, including grad students, which speaks highly of him as a person) and this easily fits into my top 5 list of all-time great nonfiction. I don't even know if that list has 5 books in it yet, by the way. The only other popular science books I've liked this much are On Killing and The Social Animal: The Hidden Sources of Love, Character, and Achievement. (Honorable mention to The Myth of the Rational Voter: Why Democracies Choose Bad Policies).I listened to this book on Audiobook, even though I actually own a hard copy, and I will start re-reading it in the next couple of days in hard copy. Partly because it's just that good, and partly because there are so many passages I want to underline and referenced papers I want to look up.This is going to be one of those books that I highlight and annotate extensively and then keep on my office bookshelf so it's in easy reach. I definitely recommend it!"
67,0307377903,http://goodreads.com/user/show/2730649-kate,4,"I found Jonathan Haidt's first book an absolute revelation. It was a game changer for me. So I was pretty keen to get my hands on this one, especially as I'm a total political geek. It did not disappoint. There was so many factors to consider, I particularly liked the metaphor of the taste buds on the tongue being compared to his pillars of morality, the hive switch and the fact that religion meets our need to connect and be part of a group. The role group connection plays is a big part of the work I do - so this was of real interest. That said there were times when I mentally nodded off and couldn't take it all in. I found myself having peaks and dips throughout the whole book. So I loved the summary at the end of each chapter.As you would expect from an academic the attention to his evidence and source was excellent. The reference to the rider and the elephant was used in The happiness Hypothesis, however in this book he developed the resistance of the elephant further and gave us deeper insight into why reason alone is not a clear guide to the choices we make. The evolutionary and scientific why for it was fascinating. Currently here in New Zealand we are going through an election - sitting back and applying his learning's has given me a new understanding, which meant I have listened, watched and attempted to not try to make all and sundry think like me! Which I am sure can only be useful. My take home message is to sit with those that nudge my elephant in the direction where it's not keen to go and just hold that space. "
68,0307377903,http://goodreads.com/user/show/4048044-charlene-mathe,4,"I can't summarize this book -- it's just too vast; or perhaps a better word might be ""green,"" as in sprouting and untamed, new tastes not yet digested -- even though the author actually does an exceptional job of reviewing where he has been, before advancing to new concepts. I think the main benefit of the book is the author's invitation to examine how we process our judgments. He provides us some tools, some better than others, that might help us recognize the guiding narrative of our moral matrix. I doubt that he said this directly, but my take-away impression is to view myself and fellow humans as ""resonators"" first, and rational reactors after that. The instant we receive an impression, we resonate like a violin string; we accept or reject, we experience delight or disgust, agreement or dissonance. In a flash, our rational mind frames these responses to a logical matrix. This makes us vulnerable to manipulation and resistant to argument. Given this as our nature, let us seek out the loyal opposition and ask ourselves -- ""what if he/she is right?"" or ""could there be something to what he/she is saying?"" We can usually learn more from our opponent than from our sidekick. Nevertheless, the instant response of the inner resonator provides important information that we might never be able to match with the logical brain."
69,0307377903,http://goodreads.com/user/show/34749978-phil,4,"All of humanity should read this book. It should be required reading for all university students, activists, politicians, journalists, and political commentators. A copy of it should be mailed to every citizen with their voter ID cards. On online articles, there should be a box you have to tick indicating whether you’ve read it, and if not, you should be prevented from commenting. People should go door-to-door like Jehovah’s Witnesses handing out free copies and spreading the good word. Jonathan Haidt’s project in The Righteous Mind is highly ambitious. As the subtitle suggests, its aim is to explain, on the basis of contemporary psychological research, why political disagreement and strife comes about. Haidt’s strategy in answering this question is threefold: first, to defend a “social intuitionist” theory of moral discourse; second, to outline a “six-foundation” model of moral psychology; and third, to advance a “Durkheimian utilitarian” theory of political legitimacy. In keeping with this threefold strategy, the book is divided into three large parts, each corresponding to one of the three “major principles of moral psychology”: Intuitions Come First, Strategic Reasoning Second, There’s More to Morality than Harm and Fairness, and Morality Binds and Blinds. The first part of the book, “Intuitions Come First, Strategic Reasoning Second,” takes the form of an attack on what Haidt calls the “rationalist delusion” (p. 34). Under the influence of Lawrence Kohlberg, much of 20th Century moral psychology presumed a model of moral development on which human beings universally progress toward a practice of role-taking concerned only with considerations pertaining to fairness and harm. In Haidt’s view, looking outside the West show this picture to be mistaken: “Non-Western cultures moralize practices that have nothing to do with harm” (p. 15). Nor can those considerations that are unrelated to harm be dismissed as mere conventions. For “the distinction between morals and mere conventions” is not innate, Haidt tells us, but is, rather, “a cultural artifact” peculiar to the West (p. 20). Haidt’s fieldwork outside the West (especially in India) leads him to side with David Hume’s sentimentalist theory of morality against the “rationalist” philosophers descendent from Immanuel Kant. Reasoning, Haidt maintains, is and ought to be a servant of our passions: reasoning, he maintains, is guided by feeling, or, more accurately, by “intuition.” By this term, Haidt designates an act of moral perception, a immediate, more or less visceral, and certainly pre-linguistic instance of “seeing-that” (p. 51; cf. 75). In support of this intuitionist picture, Haidt argues that moral reasoning evolved primarily to pursue “social-strategic goals”: “Our moral thinking is much more like a politician searching for votes than a scientist searching for truth” (p. 89). In the second part of the book, “There’s More to Morality Than Harm and Fairness,” Haidt defends what he calls “moral pluralism,” i.e. the view that there is, descriptively, significant variation in the moral domain across cultures. This variation, he believes, can be explained by a set of “evolved cognitive modules,” i.e. “switches” or “circuits” that have adapted to perceive the threats and opportunities of social life (p. 144). These are innate in the sense that they are “prewired — flexible and subject to change — rather than hardwired, fixed, and immutable (p. 152). In other words, all the various systems of morality have their roots in a shared brain structure that provides a “first draft” that is then revised in light of experience (p. 153). Haidt calls these modules “moral foundations” and identifies six: Care/Harm, Fairness/Cheating, Liberty/Oppression, Loyalty/Betrayal, Authority/Subversion, and Sanctity/Degradation. This allows him to bridge moral psychology and politics. Drawing on responses to his Moral Foundations, Haidt identifies three ideal-typical political orientations and tries to define their respective “moral matrices”: Liberals care most keenly about the first three foundations, viz. Care/Harm, Fairness/Cheating, and Liberty/Oppression; Libertarians care exclusively about the second and third; and Conservatives care more or less equally about all six. As a result, he believes, Conservative political candidates possess an inherent advantage over their competitors; they have more of an intuitive grasp of moral psychology and are able to “activate” more of the public’s moral intuitions (p. 179). In the final part of the book, “Morality Binds and Blinds,” Haidt argues that humans have a “dual nature” (p. 255). While we are “mostly selfish,” our genetic makeup at the same time contains a “groupish overlay” that programs us to promote our group’s interest in certain special circumstances (p. 222). For this purpose, he tries to revive the long-discredited theory of group selection: natural selection, works simultaneously at multiple levels, exerting its influence both at the level of the individual and at that of the group (p. 254). In this connection, Haidt posits a “hive switch,” a module for “making groups more cohesive, and therefore more successful in competition with other groups.” (p. 259). In certain special experiences, human beings are able to “shut down the self,” becoming “simply a part of a whole” (p. 264). Religion, from this perspective, can be understood as an evolutionary adaptation to reinforce solidarity between members of a group (p. 313). The groupish overlay in our nature, Haidt understands as the source of morality: “Moral systems,” he says, “are interlocking sets of values, virtues, norms, practices, identities, institutions, technologies, and evolved psychological mechanisms that work together to suppress or regulate self-interest and make cooperative societies possible” (p. 314). This provides the foundation of Haidt’s Durkheimian utilitarianism, which he proposes as a theory to orient political decision-making (p. 316). This Durkheimian utilitarianism is, so he thinks, corrects Liberalism’s “blind spot” with regard to “moral capital,” i.e. to the resources required to “sustain a moral community (p. 341-342). For all the praise that I am ready to lavish on Haidt, The Righteous Mind I have several bones to pick with him. I’ll limit myself to just two points. The first is that he seems to me to underestimate the potential inherent to reason. Perhaps it is true that reason evolved to help us save face and pursue our strategic goals. This doesn’t change the fact that it brings with it certain unavoidable presuppositions of argumentation that equip it to “get to the bottom of things.” Indeed, Haidt’s own skepticism about reason brings him dangerously close to performative contradiction at a few points (see p. 57-58, 107, esp. 127). Of course reason is subject to all sorts of distortions; Haidt discusses these at length and expresses skepticism at any individual’s ability to reason (p. 105). But he doesn’t seem to notice that, in emphasizing the need for viewpoint diversity, he is advancing something strikingly similar to Jürgen Habermas’s theory of communicative rationality — which is, ironically, often lambasted as being excessively “rationalistic.”My second, related, objection is that Haidt is much too quick to dismiss Kohlberg’s model of moral development. It seems to me that he attributes excessive weight to the claim that “there is more to morality than harm and fairness” — would anyone, including Kohlberg really need to be convinced of this as a descriptive claim? (p. 114). It is precisely to accommodate this claim that most “rationalist” moral theorists like John Rawls and Jürgen Habermas make a distinction between the good (i.e. culturally specific interests) and the right (i.e. universalizable interests). Now Haidt himself thinks that he has bypassed this question by dismissing the distinction between “morals” and “mere conventions” as a “cultural artifact” peculiar to Western societies (p. 20). This brings me to the crux of my second objection, namely, that Haidt is much too quick to take cultural difference at face value. He does not at all consider the possibility of social learning, even though he himself notes that the effects of social class are much greater than those of culture (p. 25). If Kohlberg’s stages of moral learning are incorrect, then why does it seem that, across cultures, humans given enough resources, education, contact with other cultures seem to converge on moral universalism? And here you get the good/right distinction not as a mere cultural artifact, but as the result of a learning process: as we come to understand more about our place relative to other cultures, we learn to make the difference between what could be agreed to by all in discourse and what is specific to our cultural group. The converse view seems to me to be a bizarre brand of anti-realism that would be equivalent to coming across a culture that believes that spirits, not bacteria, cause diseases, and concluding that belief in bacteria is merely a “cultural artifact.” On that note, it seems to me that Haidt’s books suffers considerably from the fact that he takes no clear stance on the realism/antirealism debate in metaethics. Now admittedly, this is a work of popular science intended for general audiences, but he is engaging (though not very generously) with moral philosophers, which makes his avoidance of the debate a little frustrating — not the least because he appears to vacillate between the two positions. Some passages lean clearly toward a realist view reminiscent of John McDowell (p. 128, 133, 143-144), but then he goes all anti-realist — Simon Blackburn-style — and calls moral matrices “collective hallucinations” (?!?!?) (p. 239). So why all the praise? Haidt’s book is a call to dialogue and mutual understanding. Not in any kind of pie-in-the-sky optimistic kind of way — Haidt, as I have pointed out, has very little faith in reason and is quick to point out the mechanisms by which we divide into opposing ideological groups. But in shedding light on the causes of this disagreement, he at least gives us pause to the indignant righteousness that lead us so quickly to dismiss dissenting views as the result of psychological defect or moral perversion: maybe, just maybe, Conservatism isn’t just a symptom of fascism and misogyny (though of course it sometimes is!), and maybe Liberalism isn’t just the product of fragile snowflakes who are unable to take responsibility for their lives (though again...). Having grown up at the intersection of three different cultures with rather different politics myself (Québécois, English-Canadian, Lebanese), I have never been able to share the moral and political certitude of so many of my peers. I have always had misgivings both about what I see as the excessive individualism of much of Western culture and about what I see as the oppressive groupishness of much of Middle-Eastern culture. The need to resolve the cognitive dissonance between these was likely an important motivation for my studies in philosophy. But what I have found in philosophy departments — those bastions of rational thought — has all too often been the same dogmatic blindness that led me into the quandary in the first place. What Haidt offers is, if not a solution, then at least a framework for dialogue about one. What is most ironic in all this is that, despite Haidt’s irrationalist bent, he ends up a lone voice of reason in these thoroughly unreasonable times."
70,0307377903,http://goodreads.com/user/show/17339120-corey-wozniak,5,"Jonathan Haidt's _The Righteous Mind: Why Good People are Divided by Politics and Religion_ is a clarion call in our modern moment, in which both the Left and Right seem to have little desire to understand their political opponents. Some clever person on Twitter recently summarized what he called ""the syllogism of the Left."" It went like this:1. Everything I do & believe is based on love.2. You disagree with me.3. You are a hateful bigot.Another might be written this way:1. Everything I do/believe is based on Reason (/Science).2. You disagree with me.3. You are a moron.Equally absurd tautologies could be formulated for the Right:1. Everything I do & believe is based on love of God & country2. You disagree with me.3. You are a godless traitor.Haidt challenges the smugness of these silly tautologies through insights from moral psychology and Moral Foundations Theory. The insights from moral psychology, he argues, compels us to be much more humble about our own perceived ""righteousness""--and much more patient when we consider the opinions of others.I. Haidt points out that we rarely reason our way to our moral (/political) conclusions. Instead, intuitions come first, and strategic reason second. In Haidt's metaphor, our intuition is an enormous elephant-- our strategic reasoning is a frail rider sitting atop the elephant. The intuition responds to stimuli and only afterward do we make post hoc rationalizations for our intuition. To use another of Haidt's metaphors, our reason acts as Press Secretary for and in behalf of our intuition. (Trump is the elephant, poor ole' Sean Spicer reason.) Reason is always secondary and post hoc-- responding after-the-fact to the knee-jerks, snap judgements, and automatic processes of the Intuition. A final metaphor: Intution is the dog and reason/rationality its tail. He cites studies that show, for example, that people are more conservative when in the mere proximity of a trash can (!). This, of course, means that we rarely arrive at our moral (/political) conclusions after careful, deliberate reasoning. One of the most interesting parts of this analysis is Haidt's work on ""moral dumbfoundedness."" II. According to Moral Foundations Theory, the righteous mind is like a tongue with six taste receptors: Care/Harm, Fairness/Cheating, Loyalty/Betrayal, Authority/Subversion, Sanctity/Degredation, Liberty/Oppression. Each individual has a predisposition for different combinations of the receptors, which explains the different political/moral orientations of people. Conservatives and liberals vary because they value different configurations of the six receptors. Here's how YourMorals.org describes Moral Foundations Theory: ""The idea behind the scale is that human morality is the result of biological and cultural evolutionary processes that made human beings very sensitive to many different (and often competing) issues. Some of these issues are about treating other individuals well (the first two foundations - harm and fairness). Other issues are about how to be a good member of a group or supporter of social order and tradition (the last three foundations). Haidt and Graham have found that political liberals generally place a higher value on the first two foundations; they are very concerned about issues of harm and fairness (including issues of inequality and exploitation). Political conservatives care about harm and fairness too, but they generally score slightly lower on those scale items. The big difference between liberals and conservatives seems to be that conservatives score slightly higher on the ingroup/loyalty foundation, and much higher on the authority/respect and purity/sanctity foundations.""This difference seems to explain many of the most contentious issues in the culture war. For example, liberals support legalizing gay marriage (to be fair and compassionate), whereas many conservatives are reluctant to change the nature of marriage and the family, basic building blocks of society. Conservatives are more likely to favor practices that increase order and respect (e.g., spanking, mandatory pledge of allegiance), whereas liberals often oppose these practices as being violent or coercive. ""This means that morality is a matter of taste. (This is not to defend total moral relativism, however.)III. How does someone become a Republican or Democrat? How is it that someone ends up voting for a particular candidate or joining a political process? Haidt argues that the answer is, at least in part, genetic. Conservatives are more genetically prone to respond strongly to (perceived) danger/threats; Liberals are more genetically prone to seek sensation-seeking and openness to experience. These genetic traits then guide children along different paths. He imagines a pair of fraternal twins, a brother and a sister raised together in the same home:""During their nine months together in their mother's womb, the brother's genes were busy constructing a brain that was a bit higher than average in its sensitivity to threats, a bit lower than average in its tendency to feel pleasure when exposed to radically new experiences. The sister's genes were busy making a brain with the opposite settings.""The two siblings grow up in the same house and attend the same schools, but they gradually create different worlds for themselves. Even in nursery school, their behavior causes adults to treat them differently. One study found that women who called themselves liberals as adults had been rated by their nursery school teachers as having traits consistent with threat insensitivity and novelty-seeking. Future liberals were described as being more curious, verbal, and self-reliant, but also more assertive and aggressive, less obedient and neat. So if we could observe our fraternal twins in their first years of schooling, we'd find teachers responding differently to them. Some teachers might be drawn to the creative but rebellious little girl; others would crack down on her as an unruly brat, while praising her brother as a model student.""By the time they reach high school and begin to take an interest in politics, the two siblings have chosen different activities (the sister joins the debate team in part for the opportunity to travel; the brother gets more involved with his family's church) and amassed different friends (the sister joins the goths; the brother joins the jocks). The sister chooses to go to college in NYC, where she majors in Latin American studies and find s her calling as an advocate for the children of illegal immigrants. Because her social circle is entirely composed of liberals, she is enmeshed in a moral matrix based primarily on the Care/harm foundation. In 2008, she is electified by Obama's concern for the poor and his promise of change.""The brother, in contrast, has no interest in moving far away to a big, dirty, and threatening city. He chooses to stay close to friends and family by attending the local branch of the state university. He earns a degree in business and then works for a local bank, gradually rising to a high position. He becoms a pillar of his church and his community... The moral matrices that surround him are based on all six foundations. There is occassional talk in church sermons of helping the victims of oppression, but the most common moral themes in his life are personal responsibility... a nd loyalty to the many groups and teams to which he belongs. He resonates with McCain's campaign slogan, 'Country First.'""Things didn't have to work out this way... But their differnt sets of genes gave them different first drafts of their minds, which led them down different paths, through different life experiences, and into different moral subcultures. by the time they reach adulthood they have become very different people whose one point of political agreement is that they must not talk about politics when the sister comes home for the holidays.""*****Haidt has since become an interesting voice on issues of campus free speech (https://www.theatlantic.com/author/jo...) and political diversity in academia. He is the founder of Heterodox Academy, which I think is a great organization. Big fan of Jonathan Haidt!"
