,isbn,user_link,ranking,review
0,0307377903,http://goodreads.com/user/show/4828849-michael-burnam-fink,4,"Haidt is much better psychologist than political philosopher, and this book is both monumental and dangerously flawed.On the good side: Haidt draws broadly from research in psychology, anthropology, and biology to develop a six-factor basis for morality (Care/Harm, Liberty/Oppression, Fairness/Cheating, Loyalty/Betrayal, Authority/Subversion, Sanctity/Degradation), and show that moral judgement is an innate intuitive ability accompanied by post-hoc justifications. Morality serves to bind non-related groups, i.e. society, together, and moral skills have been favored by various evolutionary mechanisms over human history. This theory is, frankly, really good and really well developed.Haidt then goes on to show that Liberalism draws from only the first three moral factors while Conservatism draws from all six. This explains both the differences between liberals and conservatives, and why conservatives beat the stuffing out of liberals at the polls. This is also incontrovertible.But Haidt is unwilling to follow his theory to its ultimate question: Can a democratic political system that privileged the rights of the minority procedurally sustain decision-making based on all six moral factors? Care/Harm, Liberty/Oppression, and Fairness/Cheating are universal factors; everybody uses them, and we mostly agree on when they are upheld or violated. Loyalty/Betrayal, Authority/Subversion, and Sanctity/Degradation are intrinsically provincial factors; they're different for every culture, and every individual. A moral order for a pluralistic society which takes the latter three factors seriously must either force people to uphold a morality they do not believe in, or segregate people based on their different interpretations of morality. Perhaps I'm particularly sensitive to such concerns because I'm a liberal Jew, but forcing false beliefs on and/or ghettoizing people seems profoundly wrong. Conversely, giving a Moral Minority the ability to gum up the works whenever they feel their rights are under attack is killing good governance. Where conservatism fails is that we are no longer living in separate communities. It's one global economy, one atmosphere, one water cycle, one oil supply, etc. Haidt faults liberalism for damaging American moral capital in the 60s and 70s, but he doesn't explain how conservatism can become big enough rule the globe. "
1,0307377903,http://goodreads.com/user/show/5936947-sean-chick,1,"If you are a Republican this book will make you feel very good about yourself. According to Haidt you have a more balanced morality, a realistic view of ""human nature"" (beware anyone who says they understand human nature), and some other good stuff I forgot about. He points the finger at liberals but seems unaware about the political dangers of conservatism. He discusses liberals with disdain. With conservatives there is a kind of awe and he rarely discusses their hypocrisies. Of course he conveniently says we are all hypocrites and should not worry with it. There lies the reason why he is so kind to the contemporary right, which is a clan of hypocrites without equal. Haidt believes we do not reason so much as we rationalize, which really makes one wonder how we managed to even invent the wheel or start using fire. It also explains why he never includes ""truth"" in his limited moral universe. The Persians made it the center of their morality. I guess it would just complicate things, so like any hack, he ignores it, much the same way evolutionary psychologists often dodge the issue of suicide. It also makes it easier to accept contemporary conservatism, which has grown alongside tepid moral relativism. The above thoughts make him seem like a man at home in the world before the English Civil War administered the first blows for egalitarianism. In other words, this is perfect neo-liberal dreck for our vapid post-modern world. A fashionable book that in time will be mocked and at best studied as a curiosity, the main curiosity being why this man is taken so seriously. I suppose he just went to the right schools, just like the guys who sent us to Iraq, deregulated the banks, etc.Most of all, Haidt simply does not understand either side of the political fight. If Republicans love authority, why do they disdain the government? On the flip side the same holds true for government loving liberals. That is because the question is not how much government we shall have. The question is over who shall rule. Conservatives throughout history are defined by their acceptance of gross inequality, which is why any authority that approaches fairness is opposed by them. Haidt grasps this somewhat when discussing fairness and equality but not with the same success as Corey Robin.UPDATE: Years later and still ticking as my most popular review. It is not my best written or most nuanced. As such it requires an update, since it was very much a product of 2013. Has my opinion changed? I can make my case against the book with less vitriol, and a few lines do not really work so well. For instance, my point about rationality is a stretch. I saw Haidt as part of a gradual process, aided on the left and right, to debase the value of rationality. I could go on, but I think our declining faith in reason as an ideal, if not a full blown reality, is in part why you get FOX News and campus protests. My point though could have been better made, but I won't change the review. The old dog has been around for too long now. More to the point, the book still suffers from some flaws in research. It has a bias and more to the point has a limited understanding of morality. Haidt dodges questions of truth and hypocrisy because they would undermine his argument. I have no time anymore for arguments, left or right, that ignore their internal contradictions or other view points that would question their basic premises. Haidt's work is not without merit, but it is already showing its age.Yet, this review of Haidt shows its age. It was written when I was firmly on the left. I am not any longer, having seen the rise of anarchist views and resurgent critical theory. In 2013 I had seen years of right-wing hypocrisy, arrogance, and idiocy (Bush years, Tea Party). The left has responded in kind with its own blend. As such, the nation cannot hold together since both sides utterly hate and distrust each other. Our government system cannot handle such discord. It could not in 1861 and it will not today. In 2013 I may have appeared to be on the left, but since then much has changed, and I find myself being cast out by those in my camp for disagreeing with tactics and goals. I am a man without a party or a tribe and soon the wolf and the lion will be at each other's throats. Gone are the days online or in person when debate could be heated, but without hate. Just read the comments. Conservatives came to attack this review, and they almost always do so by using some ad hominem attacks. I was called a liar, told I was unreasonable with a ""bloated sense of compassion."" One person wrote ""I'm only enraging the situation by disagreeing with your obnoxious liberal elephant and will only make it more combative."" My answer? ""Not at all. Unlike what we see today on campus, I am all about debate."" This is where we are today. We no longer trade ideas online. Instead we look to score points, certain of how ""the other"" will react.The war starts among the people before it ever gets formalized. Bleeding Kansas and the Boston Massacre were preludes. We are seeing our own preludes in 2017."
2,0307377903,http://goodreads.com/user/show/4369435-jay-kamaladasa,2,"I had great expectations for this book after watching the author give an introduction in the Colbert report. However, the book didn't hold up to it's name. These are some of grudges I have against this book:1.) The author doesn't tackle conservative vs. progressive morals. He tackles left wing vs. right wing morals. This is a typical blunder made by the average American. And I would've overlooked it, as the book is geared towards an American audience. But the author is a professor in moral psychology; he should've known better. To illustrate what I mean; in America, conservatives fight for free markets, the freedom to bare arms, and less government intervention. However in countries that have not embraced capitalism as much, the liberals (or progressives) are the ones who fight for free markets, less government intervention and individualist ideals such as the right to bare arms and freedom of speech. It would've made much more sense in a philosophical context if the argument was about progressives (who want change) and conservatives (who want the things the way they are). But then the narrative would be too simple: of course we don't live in a perfect world, so we have to change society and it's prejudices and beliefs. Then the real question is what do we do to bring about change? This of course is a difficult question, and I don't expect an answer from one single book. But it's sad to see the author moving away from this simple approach for the sake of being in the ""middle ground""; which brings to the second point. 2.) The author tries too hard to stay on the ""middle ground"".Have you ever witnessed fights where you absolutely know that one party is being unreasonable, and someone comes along and tries to be ""fair"" to both parties? Obviously the unreasonable party profits and the reasonable party loses because the negotiations were trying to be ""fair"" to both parties. It's a simple case of the ""Anchoring effect.""; whoever anchors the furthest from the truth, wins. The author's six moral foundations is an excellent example for this. He defines Care, Liberty, Fairness, Loyalty, Authority and Sanctity as the six pillars of morality. In his haste to become neutral he assumes that these should be given equal weight. Really? Does he not know what Authority and Loyalty has done for us human history? Forget the mass genocides, and mass cult suicides, he should at least be aware of the classical psychology experiments like the Stanford Prison experiment, the Robber's cave experiment, and the Milgram experiment.. But no, the author gives the same value to Authority that he gives to Care. This is not a simple side argument, this is his main thesis. He derives everything else he says in the book from this comparison. And obviously, as we say in the scientific community; garbage in, garbage out. 3.) The author's epiphany comes from his visit to India, where he associated conservatism with likeable people. He probably didn't stay long enough to see the dark side of the culture. Unlike the author, I was born in the East. And I can tell you first hand that the morals which seem to paint a pretty picture of eastern culture, is just a pretty picture - nothing more, nothing less. Hiding behind that pretty picture is a culture of corruption, a culture where shame and guilt are the driving forces of society and a culture where an individual is judged by his/her group (race, creed, school, hometown etc). A culture where you must bow down to someone just because they are older than you, or are in a higher paygrade than you.I understand there are problems with the current individualist culture in the West. But believe me, the East is not the solution. Far from it, it's a backward step in human progression. The solutions to the problems of the West should come from the minds that have already evolved passed the hive-mind. Having said all that, the book is a good read. It's written beautifully with a style commonly found in most best selling non-fiction books these days. It get's you thinking, even if it's in the wrong direction. And it does point towards why there's a rift between left-wing and right-wing American political groups. I agree with the author that a lot of left-wing supporters just go with the tide and need to realize where the right-wing groups are coming from. What I don't agree is placing the philosophical ideal of conservatism on the same ground as the philosophical ideal of progressivism. "
3,0307377903,http://goodreads.com/user/show/793473-clif-hostetler,5,"I was hopeful this book might provide me with some sociological tools and rhetorical tricks to clear away the views of those who disagree with my positions on politics and religion. Of course this book does not deliver on this unrealistic hope. What the book does provide instead is an explanation why not everybody agrees with my definition of morality. This knowledge does not make disagreements go away, so the best I can hope for after reading this book is to comprehend the intuitive motivations of both myself and others, and then comprehend why those motivations can lead to morals that steer reasoning to opposite conclusions.The author, Jonathan Haidt, is a psychologist who has specialized on the nature of morals. This book could have been more accurately titled ""The Moral Mind."" The book is divided into three parts. The main point of the first part is what Haidt calls the first principle of moral psychology: Intuitions come first, strategic reasoning second. The second part of the book explores the second principle of moral psychology: There's more to morality than harm and fairness. The third part presented the principle that morality binds and blinds.Part One This author weaves together a history of moral psychology and the author’s own story to create a sense of movement from rationalism to intuitionism. The author throws in historical anecdotes, quotations from the ancients, and praise of a few visionaries. The author then set up metaphors (such as the rider and the elephant) that recur throughout the book. He then discusses the evidence to “tune up” the reader’s intuitions about moral psychology.The message here is that value judgments are seldom products of rational deliberation. We are hardwired by evolution to function first with our emotional brain at an intuitive level, and what follows may claim to be rational reasoning that explains our judgment but is actually rationalization of quick intuitive decisions. The inherited human brain is also social in nature and must exhibit behavior that is compliant with a person’s social environment (i.e. group or tribe). This explains why people don’t necessarily vote for their own self interests. Instead they vote in compliance with the values and belief system of the group they most closely associate with. Part TwoThe main point of this section of the book is that conservatives base their morality on six types of considerations or value judgments: care/harm, liberty/oppression, fairness/cheating, loyalty/betrayal, authority/subversion, and sanctity/degradation. Liberals base their morality on three areas: care/harm, liberty/oppression, and fairness/cheating. Haidt says this gives conservatives an advantage when campaigning for votes because they can appeal to their supporters in six ways and liberals can appeal to only three. Part ThreeHaidt in this section drives home the point that the tendency for humans to form morals has been ingrained into humans by evolution. Humans are products of multilevel selection, which made us both selfish and groupish. Haidt describes it as being 90 percent chimp and 10 percent bee. He suggests that religion played a crucial role in our evolutionary history--our religious minds co-evolved with our religious practices to create ever larger moral communities, particularly after the advent of agriculture. Quotations of Interest to MeI was surprised to learn from the following quotation that conservatives understand liberals better than liberals understand conservatives. After the following quotation in the book Haidt explains the reasons for the lack of understanding on the part of liberals.""In a study I did with Jesse Graham and Brian Nosek, we tested how well liberals and conservatives could understand each other. We asked more than two thousand American visitors to fill out the moral Foundations Questionnaire. One-third of the time they were asked to fill it out normally, answering as themselves. One-third of the time they were asked to fill it out as they think a ""typical liberal"" would respond. One-third of the time they were asked to fill it out as a ""typical conservative"" would respond. This design allowed us to examine the stereotypes that each side held about the other. More important, it allowed us to asses how accurate they were by comparing people's expectations about ""typical"" partisans to the actual responses from partisans of the left and the right. Who was best able to pretend to be the other?The results were clear and consistent. Moderates and conservatives were most accurate in their predictions, whether they were pretending to be liberals or conservatives. Liberals were the least accurate, especially those who described themselves as ""very liberal."" The biggest errors in the whole study came when liberals answered the Care and Fairness questions while pretending to be conservatives. When faced with questions such as ""One of the worst things a person could do is hurt a defenseless animal"" or Justice is the most important requirement for a society,"" liberals assumed that conservatives would disagree.""The following quotation is not really part of the main focus of this book, but I found it interesting because it illuminates an irony about many Christians who emphasize ""correct belief"" (i.e. orthodoxy) whereas modern polling shows ""correct belief"" not to be a reliable predictor of neighborliness and good citizenship. Haidt is quoting from Putnam and Campbell's 2010 book, American Grace: How Religion Divides and Unites Us.""Why are religious people better neighbors and citizens? To find out, Putnam and Campbell included on one of their surveys a long list of questions about religious beliefs (e.g., ""Do you believe in hell? Do you agree that we will all be called before God to answer for our sins?"") as well as questions about religious practices (e.g., ""How often do you read holy scriptures? How often do you pray?) These beliefs and practices turned out to matter very little. Whether you believe in hell, whether you pray daily, whether you are a Catholic, Protestant, Jew, or Mormon ... none of these things correlated with generosity. The only thing that was reliable and powerfully associated with the moral benefits of religion was how enmeshed people were in relationships with their co-religionists.It's the friendships and groups activities, carried out within a moral matrix that emphasizes selflessness. That's what brings out the best in people.Putnam and Campbell reject the New Atheist emphasis on belief and reach a conclusion straight out of Durkheim: ""It is religious belongingness that matters for neighborliness, not religious believing."" The following is Haidt's definition of moral systems:""Moral systems are interlocking sets of values, virtues, norms, practices, identities, institutions, technology, and evolved psychological mechanisms that work together to oppress or regulate self interest and make cooperative societies possible""This definition makes morals dependent on the social environment. There is no one single definition of morality that is true in all cultures.Some Links of InterestThe following links came from the Book's Website.Here is a pdf file of Chapter 9, the chapter on multi-level selection.Here is a pdf file with all figures and images from all chaptersHere is a pdf file will all of the references (the bibliography)Here is a pdf file with all of the end notesYou can read the introduction to the book here, and you can read a condensed version of Ch. 12 (on politics and polarization) at Reason Magazine.Here is a summary/outline of the book, with interesting comments and links, from Jan C. HardenberghHere is the out take from ch. 6 on Virtue Ethics, as referred to in Haidt's NYT Stone essay_________________The following short review of this book is from the PageADay Book Lover's Calendar for November 28, 2014:Hopefully, you managed to avoid talking politics during yesterday’s feast. Unfortunately, it’s much harder to ignore the antagonism of the larger political sphere. At the heart of our irritation and often outrage toward other people’s belief systems is a lack of understanding. In this cogent, thought provoking book, Jonathan Haidt not only explains the psychological and moral bases of various belief systems, but he also goes on to propose viable bridges among them. It’s heartening to imagine that the national discourse could one day learn from his example.
The Righteous Mind: Why Good People Are Divided by Politics and Religion,
 by Jonathan Haidt (Pantheon, 2012)"
