,isbn,user_link,ranking,review
20,0670025291,http://goodreads.com/user/show/49372463-ryan-kirk,4,"This was a fascinating book.I've never thought about combining a biological examination of the neocortex, the study of language recognition (and speech recognition), the development of Artificial Intelligence, and a dive into some of the trickier questions of consciousness, free will, and identity.Yet, that is exactly what Kurzweil does in this book.His arguments regarding the functioning of the human mind, and our attempts to mimic and improve upon those processes are compelling, even if at the time of writing proof was lacking in some areas.I'm not always a fan of Kurzweil. He spends a lot of time talking about himself and his own experiences in the field of AI. In some cases, I feel it's appropriate: He has done incredible work. Moreover, it does make it clear that in many cases in the book, Kurzweil his sharing his opinions and not facts.But there are places where it becomes unnecessary. A whole chapter is dedicated to objections, not necessarily focused on the topic at hand, but on articles written against his theories. Likewise, I'm aware he has an excellent track record at prediction. I don't need to hear about it again.I'd very much recommend this book for people looking to get a background in AI, or even human cognition. Particularly recommended for those interested in how the two intersect."
21,0670025291,http://goodreads.com/user/show/21981319-rajkumar-pagey,4,"I'd picked this book up assuming that it'd be just about artificial intelligence.But along with AI, it also taught me the biology of a human brain, the definition of consciousness and the philosophy of life.Read these lines:True mind reading, therefore, would necessitate not just detecting the activations of the relevant axons in a person’s brain, but examining essentially her entire neocortex with all of its memories to understand these activationsHow beautifully and simply, we understand how brain works with just this one lineAnd how about this?At the far end of the story of love, a loved one becomes a major part of our neocortex. After decades of being together, a virtual other exists in the neocortex such that we can anticipate every step of what our lover will say and do. Our neocortical patterns are filled with the thoughts and patterns that reflect who they are. When we lose that person, we literally lose part of ourselves. This is not just a metaphor—all of the vast pattern recognizers that are filled with the patterns reflecting the person we love suddenly change their nature. Although they can be considered a precious way to keep that person alive within ourselves, the vast neocortical patterns of a lost loved one turn suddenly from triggers of delight to triggers of mourning.Tell me if this is not the best definition of love you've ever read."
22,0670025291,http://goodreads.com/user/show/30053154-carlos-gait-n,3,"Ray Kurzweil really pushes the boundary of our understanding of the brain, and goes as far as claiming that the brain is a much simpler structure than we think. He proposes a basic structure comprised of several neurons that accounts for all learning in the brain. He then explains how he thinks we will be able to simulate this structure using computers and eventually create machines who can think and even be deemed conscious. Some of his claims might be wild, but they definitely spark curiosity and open the reader's mind to a world that might look very very different in a few years."
23,0670025291,http://goodreads.com/user/show/64425508-jan-sp-rer,4,"These are my key takeaways from the book.-Kurzweil emphasizes a nonstandard approach of brain modeling that is close to current neurological research and less related to the latest deep learning model designs. One will not find elaborations on the latest LSTMs or other “hot topics” in the book. Kurzweil wants to take a top-down approach and model the brain as realistically as possible. He goes into depth about how the brain is physically wired, how many neurons are in individual sections, how large these sections are, how many sections there are, and how they are connected. For example, Kurzweil says that the main learning comes not from inter-neuron connections (individual neurons that flexibly attach themselves to each other) but from inter-section connections of neuron clusters with about 100 neurons each. Kurzweil also explicitly states that he follows a multi-disciplinary approach. (pp. 115-116) As I have a computer science background, the book seemed to lack technical solidness at first, but this was because of my stereotypes about what a book about the mind should be like.-Evolution led to increasing abstraction. While physics was the first relevant field of study, chemistry became relevant when molecules formed from atoms. Then DNA evolved, making biology a useful field of study. Then neurology comes into focus as we travel down the evolutionary history. (p. 2)-The mammalian brain is capable of hierarchical thinking by using the neocortex. (pp. 2-3)-Brain Architecture: The neocortex is complex from the outside, but it is built with significant redundancy, making its design less complex than expected. This is due to repeating (hierarchical) patterns. (p. 11) “There are about a half million cortical columns in a human neocortex, each occupying a space about two millimeters high and a half millimeter wide and containing about 60,000 neurons (resulting in a total of about 30 billion neurons in the neocortex). A rough estimate is that each pattern recognizer within a cortical column contains about 100 neurons, so there are on the order of 300 million pattern recognizers in total in the neocortex.” (p. 38) Kurzweil states that there are about 10e15 connections in the neocortex, but they only take up 25m bytes of information in the genome (after lossless compression) (p. 90), while most of these 25m bytes constitute biological information (p. 155). A human brain is estimated (by Kurzweil) to be able to recognize a low 8-digit number of patterns. (p. 40) A neocortical pattern recognition module consists of: Dendrites that send signals in and out. Axon (output), expected pattern (signal from above), size parameter, weight, expected variability of the lower-level pattern, Inhibitory signals from above, inhibitory signals from below. (pp. 42, 66-68) Kurzweil’s description of the hierarchical nature of the pattern recognition design reminds of convolutional neural networks. (pp. 43-47) Language is just one higher-level pattern in our brain. Our thoughts are not necessarily in language format and need to be converted into this higher level. (p. 56) Kurzweil citing Donald Hebb: “When an axon of cell A is near enough to excite a cell B and repeatedly or persistently takes part in firing it, some growth process or metabolic change takes place in one or both cells such that A’s efficiency, as one of the cells firing B, is increased.” (p. 80) “The central assumption in Hebb’s theory is that the basic unit of learning in the neocortex is the neuron. The pattern recognition theory of mind that I articulate in this book is based on a different fundamental unit: not the neuron itself, but rather an assembly of neurons, which I estimate to number around a hundred. The wiring and synaptic strength within each unit are relatively stable and determined genetically--that is, the organization within each pattern recognition module is determined by genetic design. Learning takes place in the creation of connections between these units, not within them, and probably in the synaptic strengths of those interunit connections.” (p. 80) The brain’s physical structure is 2D, not 3D. (p. 82) Kurzweil compares neocortex modules to FPGAs. (p. 83) “The brain does not have sufficient flexibility so that each neocortical pattern recognition module can simply link to any other module… an actual physical connection must be made, composed of an axon connecting to a dendrite.” (p. 90) “Signals go up and down the conceptual hierarchy. A signal going up means, “I’ve detected a pattern.” A signal going down means, “I’m expecting a pattern to occur,” and is essentially a prediction. Both upward and downward signals can be either excitatory or inhibitory.” (p. 91) The optic nerve carries only ten to twelve output channels, each which only limited information. For example, one channel is responsible for detecting edges. (pp. 94-95) This sparse coding makes sure that the neocortex is not overwhelmed. (pp. 95-96) The brain is slow, but parallel. (p. 195) Today’s computers are at least 10m times faster than a brain. But the overall memory and throughput requirements of the brain are immense. (p. 195)-Hippocampus: Each side of the brain has one hippocampus. The hippocampus can remember novel events. If the neocortex sees unknown patterns, it will forward them to the hippocampus. The hippocampus then creates pointers to the neocortex. (p. 101) The hippocampus enables the short-term memory of the brain. It plays the memory sequence to the neocortex over and over again and thereby forms long-term memories. (p. 102)-Movement is controlled by the cerebellum and the neocortex, whereby the neocortex has taken over most functions from the “old” cerebellum. (p. 103) -“Finding a metaphor is the process of recognizing a pattern despite differences in detail and context--an activity we undertake trivially every moment of our lives.” (p. 115)-Similar to Elon Musk (maybe he got this idea from Kurzweil?), Kurzweil argues that the devices we use today are already extensions of the brain and we will soon interface our brains with technical devices via direct neural connections. (pp. 116-117)-The main contribution of the neocortex is that it sped up the process of learning. Complex learning is no longer only possible over many generations, but also within the lifespan of a single entity. (p. 122)-There are already brain scans that allow scientists to follow individual connections through the brain and attempts to fully simulate regions of the brain or even the whole brain. (pp. 129-130) For full brain emulation, one needs scanning, translation, and simulation. (p. 130) The Cyc project aims to aggregate all commonsense knowledge. (pp. 162)-Vector quantization is a way to preprocess visual information, arguably similar to how optic information is preprocessing information by the brain. (pp. 138-141)-Kurzweil strongly advocates the use of hidden Markov models to simulate how different layers (pattern recognizers) interact. (p. 143) “Today, the HHMM together with its mathematical cousins makes up a major portion of the world of AI.” (p. 155) Evolutionary genetic algorithms could be used to determine hyperparameters of pattern recognizers. (p. 147) Watson uses UIMA (unstructured information management architecture) to bundle the intelligence of its hundreds of subsystems. The special element of Watson’s design is that subsystems can contribute without providing a definite answer. The subsystems can also help to narrow down the answer. The subsystems consist of hidden Markov model variants,rule-based approaches, and other models. (pp. 167-168) “Neuromorphic” chips and similar approaches to simulate the behavior of brains’ parts can be more efficient than emulating the brain only with software. (p. 195)-LISP was popular in the AI community of the 70s and 80s because of the hierarchical nature that it supported. The elements of a LISP list can store other lists and even allow for recursion. (p. 154)-Rule-based systems can help to allow a system to be learned on-the-fly (self-labeling). Complex models usually take much data to be accurate while rule-based systems do not. A combination of statistical and rule-based systems leads to an optimized learning curve. (pp. 164-165)-One of the key differences that I found when comparing Kurzweil’s architecture to today’s state-of-the-art deep learning is that pattern recognizers (which are roughly comparable to neural network layers, I would say), do not just feed forward, but also backward. They feed backward and confirm that the pattern is “expected”. (p. 173)-Ideas that Kurzweil proposes to add to an artificial brain: A critical thinking module which would perform a continual background scan that would revolve cognitive contradictions. Unlike humans, the AI could then avoid holding conflicting views. Also, he would add a module that identifies open questions in each field and would search for answers in other fields. Another background process would be metaphor search. (pp. 176-177)-”Simply repeating information is the easiest way to achieve arbitrarily high accuracy rates from low-accuracy channels, but it is not the most efficient approach. Shannon’s paper, which established the field of information theory, presented optimal methods of error detection and correction codes that can achieve any target accuracy through any nonrandom channel.” (p. 184) The brain uses Shannon’s principle too (redundancy). (p. 185) The left and the right brain are to a large part redundant. A human can often function reasonably well after one side of the brain is removed. (pp. 224-225) Each side of a human brain is probably conscious by itself. (p. 227)-Predictions: Kurzweil predicts that there will be the first artificial humans in 2029 and become “routine” in the 2030s. (p. 210) If one were to clone a person into a robot so that this robot would be a 100% perfect emulation of the person, we would probably accept this robot to be an independent entity. But we would also say that this robot is not exactly this person, it is a clone. Now if we take the same person and gradually replace all of its brain and other organs, while keeping its self-awareness at all times, until it becomes fully artificial, we would probably say that this is still the same person. But this is contradictory if the second robot is exactly the same robot as the first (cloned) robot. The human body also gradually replaces itself (replacement of cells and molecules within the cells). (pp. 242-245) People will replace their organs more and more until their thinking will completely be in the cloud. (p. 247) Exponential growth (of computing power) will continue. Our current circuit technology (and the associated paradigm Moore’s law) will be replaced by another breakthrough paradigm that resolves the current limitations of circuits. (p. 255) The final limit to the physics of computation will probably be reached by the end of the century. This limit is defined by molecular computing. We still have a trillion-fold increase to go until we reach this limit. (p. 256) It is not true that only hardware is improving: Professor Martin Grötschel of the Konrad-Zuse-Zentrum für Informationstechnik Berlin observed that for a particular linear programming algorithm, the efficiency between 1988 and 2003 improved by a factor 1,000 due to hardware and by another 43,000 due to better software. (p. 269) The scientist’s pessimism seems to be present for a long time among the computer scientist community. The progress that CPUs made over the last decades was not seen as possible by many people back then. (p. 272) Kurzweil thinks that the question of whether we can break the speed of light will be a key question at the beginning of the twenty-second century as this will determine how quickly we can expand in the universe. (p. 281)-Some of the intelligent machines that we will build may not behave humanlike, but may still be “conscious”. (p. 213) Entities that are not convincingly conscious or do not even try to be could still be conscious. (p. 215)-Wittgenstein first proposed that the discussion about consciousness is circular, but the newer writings by Wittgenstein say that this discussion is really important. (pp. 220-221)-Freedom of will: Vilayanur Subramanian Ramachandran says that “free won’t” is a better term. Actions are already prepared unconsciously. Sometimes, the human can stop the action. But action does not normally form purely consciously. (p. 230) Wolfram says that the universe is deterministic, but we cannot have enough computing power to compute the future. Therefore, it is not really deterministic for us. (p. 239)"
24,0670025291,http://goodreads.com/user/show/66195255-diana-lucaci,3,Left at ch8
25,0670025291,http://goodreads.com/user/show/1339246-gendou,4,"This book focuses on two of the author's pet theories:1. The Law of Accelerating Returns (LOAR)
An evolutionary process inherently accelerates, as a result of its increasing levels of abstraction, and that its products grow exponentially in complexity and capability.
This is strait out of his last book, and refers to things like Moor's Law, and how the price drops when you mass produce something.What chronically Kurzweil fails to realize is that these returns are only exponential for a time. In the case of an invasive species, the population increases exponentially, until it fills up the new environment. In the case of Moor's Law, computing gets smaller until it hits the atomic limit. In the case of factories, eventually, supply is great enough that demand drops off, and a stable, low price is arrived at.He even says, ""no other species has been able to achieve this"" in reference to the kind of LOAR-driven growth human industry has achieved. But, being a uniquely human achievement contradicts his grandiose claim that this is a ""universal law"" and that it applies to all ""evolutionary processes"".Thankfully, he moves on from this failed idea to a more interesting one.2. Pattern Recognition Theory of Mind (PRTM)
It is the neocortex, after all, that has been responsible for every novel, every song, every painting, and the multifarious other products of human thought.
His core claim is that the human brain (the frontal cortex, in particular) is simple, and uses same rule (or repeated, fractal structure) over and over. Basically, he proposes that miniature cortical columns are basic unit of pattern recognition in the brain. Wired together into a hierarchy, these account for the properties of mind.Things start to get surreal when he talks about a hypothetical neuron that represent the pattern match for a high level concept, like the letter A. This happens not to be the way the brain is organized, as seen by laboratory studies.But, there's lots of talk about brain simulators, AI, natural language processors, LISP, computer resources needed to simulate human brain, etc. which is all sort of interesting.He gives a good explanation and demystification of the philosophical idea of qualia.He talks a lot about another (strictly) philosophical idea: consciousness. He dismisses the ""grand illusion of consciousness"" as fundamentally unscientific. Lee Smolin should have a look at this chapter!In one of my favorite chapters, Kurzweil proposes a thought experiment. First, consider that I make a robotic duplicate of your brain and body, then kill the original. Unsettling, right? But what if I gradually replace one neuron at a time with a synthetic, functional equivalent? He proposes that this would be much easier for people to accept, even though the end result is the same. I see this as a question of whether you want to sink slowly into the cold water, or jump in. There's no contradiction; both options are different in experience but have the (superficially) the same final outcome. This reminds me a lot of Permutation City by Greg Egan.While this book is a lot more acceptable his previous books, it still contains an awful lot of beleaguered pontification.
Evolution also moves toward greater complexity, greater knowledge, greater intelligence, greater beauty, greater creativity, and the ability to express more transcendent emotions, such as love.
He actually talks as if humanity is the ""purpose"" or ""goal"" of evolution! Its the rambling that gets him into trouble. Maybe not the best job of editing, in this book."
26,0670025291,http://goodreads.com/user/show/50864232-ed-zirkwitz,5,"An amazing cutting edge piece on how the brain and the mind work. Although so much is revealed, explained and predicted yet one gets the feeling only the surface has been scratched with so much yet to be learned and\discovered."
27,0670025291,http://goodreads.com/user/show/11673245-peter-gelfan,4,"A computer can recall facts and figures, organize, correlate, and calculate with a speed and accuracy that leaves mere humans in the dust, yet is almost helpless in dealing with nuances of language, gesture, perception, motion, and emotion which we accomplish without even noticing ourselves doing it. This book describes current theory about how the brain functions cognitively, and how a computer might be designed to mimic its operation and abilities while doing away with the brain’s shortcomings such as unreliable recall, inconsistency, self-deception, and memory loss. Speculatively, the book persuasively projects a future in which human intelligence — whose technological evolution, starting with language, has already far outstripped its biological evolution — will transcend its flesh-and-blood incarnation.The book is logically organized. It requires basic scientific literacy, and now and again gets into technical detail that can be challenging, while notes at the end provide additional technical information for those who want it. The writing is clear if occasionally plodding and repetitive. The voice is authoritatively knowledgeable; the author has been at the forefront of such research for decades. The tone is excitement over the subject matter and the author’s personal involvement in the field. He explains the material, which is fascinating, very well, but the businesslike, rather impersonal approach doesn’t add that extra dimension of engagement encountered in the best nonfiction writing. The book is certainly a memorable learning experience but not a memorable reading experience. Nevertheless, it’s very worthwhile for anyone interested in the field. I’d give it 4.5 stars if this site’s software were sufficiently evolved to deal with it."
28,0670025291,http://goodreads.com/user/show/16896341-sotiris-makrygiannis,3,"Well, I like that he is using Chomsky arguments at the end in order to build his argument over transhumanism. Nevertheless, his arguments are well articulated especially I liked the new strategy to infuse us with white blood cells in order to become transhumans, instead of terminator-like body updates. He totally avoids the Theseus dilemma (https://en.wikipedia.org/wiki/Ship_of...) if you is you after you have been augmented with technology. I like his thinking, no doubt but im more conservative on the future path of humanity. Queen song , who wants to live forever, describes best my scepticism. "
29,0670025291,http://goodreads.com/user/show/3363840-chris-elkjar,4,"I think this is one of Kurzweil's more interesting and well constructed books. Covering the same basic ideas of transhumanism and the singularity but adding in a lot more real word examples of how his technologies are actually making a difference already.His points about ""intelligent"" algorithms and evolutionary programming is far easier to digest than the massive futurist sections of ""The Singularity is Near"".Definitely his best work since The Age of Spiritual Machines even if it is covering a lot of the same material. "
30,0670025291,http://goodreads.com/user/show/16951905-dan-stojanovic,2,"Initially, I was both curious and entertained by the prospect and the future ramifications of uploading human consciousness into a computer. As the book went on, Kurzweil dug deeeper into the working brain at an evermore abstract, complicated and very confusing way, to try to dumb down and simplify how the human brain works. This is where the book breaks down. The material gets repetitive and twisted within its own complexities, to the point of misunderstanding and boredom. I was fine with the fact that the book is not entertaining, but when it became uninformative, I dropped it."
