,isbn,user_link,ranking,review
208,0201483408,http://goodreads.com/user/show/13870183-zhenshan-su,4,This is the kind of book that can give people a totally new and great respect of what the world is.
209,0201483408,http://goodreads.com/user/show/14012346-armando-vieira,0,On of the best books on thecnology capabilities. Truely visionary.
210,0201483408,http://goodreads.com/user/show/4041786-jake,4,"An excellent introduction to the ideas of ""emergence"" or ""emergent order,"" or what Hayek called ""spontaneos order."" Well worth reading."
211,0201483408,http://goodreads.com/user/show/12713920-carlos-d,5,Mind blowing extraterrestrial angles. I'm inlove...
212,0201483408,http://goodreads.com/user/show/23274686-jose-esp-n,5,"One of the first serious attempts to understand how evolving complexity is affecting out lives, my really first approach to chaos theory as a way to understand complex phenomena"
213,0201483408,http://goodreads.com/user/show/19018706,3,How do you know bees are idiots? 
214,0201483408,http://goodreads.com/user/show/1185947-dustin,4,"Very late to this game, but Kevin Kelly FTW. "
215,0201483408,http://goodreads.com/user/show/52676681-brett,0,"Evolution in software, pharmaceuticals, network theory, and a whole mess of thought leadership. Great read!"
216,0201483408,http://goodreads.com/user/show/25982334-david-bober,5,I still enjoy this book twenty years after I first read it. 
217,0201483408,http://goodreads.com/user/show/14359424-marilynn-shea,4,not something to 'read' and dismiss... a lot of chapters can be re-read from time to time.
218,0201483408,http://goodreads.com/user/show/308754-brendan-mcauliffe,1,This book is whats out of control
219,0201483408,http://goodreads.com/user/show/3573039-hokey,5,Awesome work! Pretty coooool!
220,0201483408,http://goodreads.com/user/show/57585891-joseph-patterson,3,Dated info
221,0201483408,http://goodreads.com/user/show/732347-kelly,4,"I love his curiosity, which perhaps explains my deep love of the last two chapters. "
222,0201483408,http://goodreads.com/user/show/113958-greg,0,"Epic and insightful, contributed substantially to my current research passions. "
223,0201483408,http://goodreads.com/user/show/680845-meghan,5,The smartest book I've read in years. 
224,0201483408,http://goodreads.com/user/show/1620483-bret,4,"Parts of this book are a little dated since it's been out for about 14 years, but it's full of interesting ideas."
225,0201483408,http://goodreads.com/user/show/133784-todd,5,This book was included in my book: The 100 Best Business Books of All Time. www.100bestbiz.com
226,0201483408,http://goodreads.com/user/show/1422618-frank,3,"Paulina Borsook's ""Cyberselfish"" exposes the rot at the core of this devil-take-the-hindmost vision. But it's a fun read."
227,0201483408,http://goodreads.com/user/show/2876496-amanda-p,3,I'm getting impatient...too many words...editor was on vacation?
228,0201483408,http://goodreads.com/user/show/3866165-curtis-schofield,5,"awesome book about emergence - natural systems , man-made systems and other ideas often diluted by Malcolm Gladwell."
229,0201483408,http://goodreads.com/user/show/4547536-james-ravenscroft,5,Still in the process of reading this gem. It is a fascinating compilation of reports and concepts that provide a fantastic insight into what happens when machines get smart.
230,0201483408,http://goodreads.com/user/show/4235519-liliana-cruz,4,"It's one of those books, that everyone must read. Shows us a different perspective to see technology and the real importance of this in our lifes."
231,0201483408,http://goodreads.com/user/show/13870183-zhenshan-su,4,This is the kind of book that can give people a totally new and great respect of what the world is.
232,0201483408,http://goodreads.com/user/show/14012346-armando-vieira,0,On of the best books on thecnology capabilities. Truely visionary.
233,0201483408,http://goodreads.com/user/show/4041786-jake,4,"An excellent introduction to the ideas of ""emergence"" or ""emergent order,"" or what Hayek called ""spontaneos order."" Well worth reading."
234,0201483408,http://goodreads.com/user/show/12713920-carlos-d,5,Mind blowing extraterrestrial angles. I'm inlove...
235,0201483408,http://goodreads.com/user/show/23274686-jose-esp-n,5,"One of the first serious attempts to understand how evolving complexity is affecting out lives, my really first approach to chaos theory as a way to understand complex phenomena"
236,0201483408,http://goodreads.com/user/show/19018706,3,How do you know bees are idiots? 
237,0201483408,http://goodreads.com/user/show/1185947-dustin,4,"Very late to this game, but Kevin Kelly FTW. "
238,0201483408,http://goodreads.com/user/show/52676681-brett,0,"Evolution in software, pharmaceuticals, network theory, and a whole mess of thought leadership. Great read!"
239,0201483408,http://goodreads.com/user/show/25982334-david-bober,5,I still enjoy this book twenty years after I first read it. 
240,0201483408,http://goodreads.com/user/show/14359424-marilynn-shea,4,not something to 'read' and dismiss... a lot of chapters can be re-read from time to time.
241,0201483408,http://goodreads.com/user/show/308754-brendan-mcauliffe,1,This book is whats out of control
242,0201483408,http://goodreads.com/user/show/3573039-hokey,5,Awesome work! Pretty coooool!
243,0201483408,http://goodreads.com/user/show/57585891-joseph-patterson,3,Dated info
