,isbn,user_link,ranking,review
31,0670025291,http://goodreads.com/user/show/47126025-stefan-iulian-tesoi,5,"I'm always on the lookout for new discoveries in the neuroscience field and to understand and learn more about the synergy of the  human mind, brain and consciousness  and this book by Ray Kurzweil, one of the leading figures in Artificial Intelligence, proved to be quite enlightening in this regard.I have a lot of notes and Kindle highlights on this book and here are some of them:  	 There are no images, videos, or sound recordings stored in the brain. Our memories are stored as sequences of patterns. Memories that are not accessed dim over time.  	 The human mind is capable of recognizing patterns even if they are altered: ""This represents a key strength of human perception: We can recognize a pattern even if only part of it is perceived (seen, heard, felt) and even if it contains alterations. Our recognition ability is apparently able to detect invariant features of a pattern—characteristics that survive real-world variations.""  	 We are constantly predicting the future and hypothesizing what we will experience.  	 Unused pattern recognizers (the authors thinks that our mind contains about 300 million of them) get reassigned to other more-used pattern recognizers:  ""That is why memories grow dimmer with time: The amount of redundancy becomes reduced until certain memories become extinct.""  	 DNA doesn't determines how the neuronal connections work:  ""There are on the order of a quadrillion (1015) connections in the neocortex, yet only about 25 million bytes of design information in the genome (after lossless compression), so the connections themselves cannot possibly be predetermined genetically. It is possible that some of this learning is the product of the neocortex’s interrogating the old brain, but that still would necessarily represent only a relatively small amount of information. The connections between modules are created on the whole from experience (nurture rather than nature).""  	 Four items of working memory at a time:  ""We are apparently able to keep up to about four items in our working memory at a time, two per hemisphere according to recent research by neuroscientists at the MIT Picower Institute for Learning and Memory.6 The issue of whether the thalamus is in charge of the neocortex or vice versa is far from clear, but we are unable to function without both.""  	 The brain is wired to seek novelty:  ""Each brain hemisphere contains a hippocampus, a small region that looks like a sea horse tucked in the medial temporal lobe. Its primary function is to remember novel events. Since sensory information flows through the neocortex, it is up to the neocortex to determine that an experience is novel in order to present it to the hippocampus. It does so either by failing to recognize a particular set of features (for example, a new face) or by realizing that an otherwise familiar situation now has unique attributes (such as your spouse’s wearing a fake mustache).""  	 There is a struggle between the old reptilian brain and the neocortex, but the neocortex has the last say:  ""There is a continual struggle in the human brain as to whether the old or the new brain is in charge. The old brain tries to set the agenda with its control of pleasure and fear experiences, whereas the new brain is continually trying to understand the relatively primitive algorithms of the old brain and seeking to manipulate it to its own agenda. Keep in mind that the amygdala is unable to evaluate danger on its own—in the human brain it relies on the neocortex to make those judgments. Is that person a friend or a foe, a lover or a threat? Only the neocortex can decide.""  	 There are medical cases in which a hemisphere was removed from a  patient's brain and the patient continued to function properly (and even to have an above average IQ):  ""While these observations certainly support the idea of plasticity in the neocortex, their more interesting implication is that we each appear to have two brains, not one, and we can do pretty well with either. If we lose one, we do lose the cortical patterns that are uniquely stored there, but each brain is in itself fairly complete. So does each hemisphere have its own consciousness? There is an argument to be made that such is the case. ""  	 Ultimately most of our thinking will be in the cloud:  ""What I believe will actually happen is that we will continue on the path of the gradual replacement and augmentation scenario until ultimately most of our thinking will be in the cloud.""Also posted on: My Blog"
32,0670025291,http://goodreads.com/user/show/32141051-christopher-willey,5,"All philosphy is merely a critique {of the technology} of language. Again! I keep picking books that redefine the boundaries of my understanding. Between the Inevitable by Kelly, and Drive by Pink they talked about finding a Heuristic. The question that question that does not have answers. A question that continually feeds. A question that only gets more interesting and complex as it is approached from different angles. “What are the connections between the informations systems nature has selected over eons and the information systems humans have evolved?” Exploring these topics, deeply and fully, is leading me to places I NEVER thought I would go! In my work, in my thoughts, and in my philosophy. My pleasure from engaging in this pursuit has turned into a deep and abiding joy. People, I think I’m on to something and it’s gonna change the world. The more I look, the more my question - and the resulting mental constructs - complicates and affirms it’s on existence. Stay Tuned. HMU if you want to share ideas. Chapters 9,10, and 11 are more philosophy than I thought possible. But so powerful. Major concepts I’m taking from this book: Blurring lines between disciplines (again)HMMCopy and InstantiationWolfram’s Cellular Automata Cooper’s LawQualiaConsciousness and IdentityImplications of the Law of Accelerating ReturnsQuote:Any old fool can make something complex, it takes a genius to make it elegant. -Albert Einstein"
33,0670025291,http://goodreads.com/user/show/16469107-fred-beshears,5,"In this book, Kurzweil develops what he calls a Pattern Recognition Theory of Mind (PRTM). He argues that the human neocortex is actually far less complex than one might think. Citing Vernon Mountcastle's work in 1957, Kurzweil describes the neocortex as having a ""remarkably unvarying organization ... composed of a single mechanism that [is] repeated over and over again"" (p. 36). According to the PRTM, the neocortex consists of around 300 million pattern processors that are, in turn, composed of around 100 neurons each. Each pattern processor can do a number of things with a pattern: ""learn it, predict it (including parts of it), recognize it, and implement it (either by thinking about it further or through a patten of physical movements)"" (p. 40-41).The patterns recognized by pattern processors are organized in hierarchies. Each pattern is composed of three parts: 1) the input from lower-level patterns or sense organs, 2) the pattern's name, which in the neocortex would be the axon that emerges from each pattern processor (when this axon fires the pattern has been recognized), and 3) the set of higher-level patterns that the lower level pattern is a part of (when a pattern processor's axon fires the message is received by dendrites in the neurons that make up the higher level patterns.Kurzweil's former company (Kurzweil Computer Products now known as Nuance Speech Technologies) has developed software based on a Hierarchical Hidden Markov Model (HHMM) to simulate the behavior of the neocortex. His in company - Patterns Inc. - is continuing this work. (Note: Kurzweil has been hire by Google to be their Chief Technology Officer.)Kurzweil admits that in many ways his HHMM software resembles the Hierarchical Temporal Model (HTM) developed by Jeff Hawkins and Dileep George (and sold by their company Numenta), which is described in On Intelligence. Kurzweil points out some technical differences between the two models (p. 73), which will probably not impress the lay reader.What may impress the lay reader is that these relatively new approaches to machine learning are now being incorporated in natural language understanding systems such as IBM's Watson system with impressive results. Watson beat the world's best human Jeopardy! players. Furthermore, Nuance Speech Technologies is now working with IBM on a new version of Watson ""that will read medical literature (essentially all medical journals and leading medical blogs) to become a master diagnostician and medical consultant"" (p. 6-7).In addition to his technical discussion of HHMM and PRTM, Kurzweil also returns to the themes he introduced in The Singularity is Near. In that work he develops the case for his Law of Accelerating Returns (LOAR), which is itself based on Moore's Law, which predicts that computer clock speeds and memory capacity will double about every two years. In How to Create a Mind, Kurzweil sticks with is prediction that a computer will pass the Turing Simulation test by 2029 and that a technological Singularity will come into being by 2045. The former is the point when a computer masters natural language to the extent that human judges will not be able to distinguish text messages they exchange with it from those they exchange with a human. According to Kurzweil, a technological Singularity is the point at which humans transcend biological evolution and computers attain a level of intelligence that far surpasses that of unenhanced human intelligence.In How to create a Mind, Kurzweil gives some additional details on how human intelligence might merge with machine intelligence. According to PRTM, unenhanced humans have around 300 million pattern processors. But, according to Kurzweil, by 2045 brain-computer interfaces will come into being which will enable enhanced humans to do ""most of their thinking"" in the cloud. So, instead of having 300 million pattern recognizers to work with, enhanced humans could have many times that number (why not a trillion or more pattern recognizers). Also, it's likely that enhanced humans would be able to acquire new knowledge and skills with out having to learn by traditional means - i.e. from direct experience, books, lectures, etc. In other words, when humans are able to do most of their thinking in the cloud, perhaps all the knowledge that exists in today's libraries will already have been read into some future version of Watson and directly accessible via the brain-computer interface or in some shared set of pattern recognizers.So it would appear that in Kurzweil's view of the post-Singularity world, schools may still exist, but their enrollment may consist mostly to those humans who do not wish to be enhanced. Of course, trying to predict what a post-Singularity world might be like is almost a contradiction in terms since for some the term Singularity is the point at which technological change becomes so immense that making predictions past that point becomes impossible.Nevertheless, I for one can't resist at least on speculation on what some of the issues might be for those who live past 2045 (assuming Kurzweil's prediction is correct). One issue that will probably come up is the relationship between personal identity and death. Many transhumanists believe that immortality will become an option in a post-singularity world, especially if enhanced humans are able to spread out into space. Many transhumanists also believe that ultra-intelligence will also become an option for enhanced humans. In a post-Singularity world a millionaire may not be someone with a net worth of a million dollars; instead we might be referring to someone with an IQ of over a million. But what would it mean to one's identity if one's IQ went from something in the neighborhood of 100 to a million. Also, what would happen to one's identity if one received a brain-computer implant that gave you the knowledge and insight of reading and understanding all the books in all the libraries. My guess is that the old you would still be there in the sense that you could remember events from your pre-enhanced life. But the new you would be a very different individual indeed. Therefore, you may get to live forever, but it may come at the cost of your former, unenhanced identity."
34,0670025291,http://goodreads.com/user/show/13997563-diana-d,2,"Just finished the book and even though I enjoyed most of it, it's not quite what I was expecting at first.The book starts by offering an overview of the biological brain and briefly describes some attempts towards replicating its structure/functions inside the computer. He gives a short outline of how his HHHMM (Hierarchical Hidden Markov Models) has made his speech recognition software so successful. Some chapters are spent going back and forth trying to prove how an artificially created 'mind' could be considered as valid as human. Towards the end he mentions some interesting topics such the philosophy of consciousness, identity, free will etc finishing by applying his Law Of Accelerating Returns (LOAR) to the field of AI in order to provide some predictions for the future of this field.The title and summary of the book raised my expectations into believing that this book is going to start with a baseline of human brain genetics and organic structures, mutations, replicating feelings or discussing topics such as whole brain emulation, robotoids, synthetic telepathy but none of these topics were covered."
35,0670025291,http://goodreads.com/user/show/20764973-julia,3,"This book is not very cohesive, ranges pretty dramatically in technicality, and (in my opinion) has too much information about the author. That said, there's lots to learn about the brain, the proposed method of using hidden hierarchical Markov models is interesting, and the discussions on intelligence and consciousness at the end are worthwhile. Also, upon rereading I've realized it's much more understandable (and I got a lot more out of it) when I had some exposure to discrete math, machine learning, etc. prior to reading it."
36,0670025291,http://goodreads.com/user/show/12542910-karen,3,"Many of the things Kurzweil talks about as being “in the works” when this book was published in 2012 have already come to pass (more examples of his own Law of Accelerating Returns).There is a lot of neuroscience (fascinating), philosophy of consciousness (quite interesting) and some quantum physics/computing (which I admit I skimmed though). The best thing about these books is that they make me feel optimistic that humanity is not going to burn in a fiery inferno."
37,0670025291,http://goodreads.com/user/show/33878213-pawe-skorupi-ski,5,"Definitely, a great introduction to Neuroscience and Future Studies for people with Computer Science background. Ray Kurzweil is a true Man of Renaissance. His arguments are really well-thought through and, even if can't be proven now or will never to proven right, are for sure very inspiring and thought-provoking."
38,0670025291,http://goodreads.com/user/show/46525458-dylan,5,"Fascinating! Totally changes the way I think about cognition, both in humans and in ""AI"". Also makes me think about inherent bias bring rooted in our basic thought process because we're trying to complete the pattern we think we recognize."
39,0670025291,http://goodreads.com/user/show/4355254-mohammadreza-seifollahi,5,"Ray Kurzweil, in this great book, explains a simple structure of mind, more specifically the neocortex and articulates his theory about how it works. This book is easy to read and grasp. I recommend it to everyone interested in #mind, #AI, and #future."
40,0670025291,http://goodreads.com/user/show/53522915-jake-stevens,4,"Second to last chapter on rebuttals was a bit self serving and didn't flow well, mostly rebutted arguments against his previous books (which I haven't read..)."
41,0670025291,http://goodreads.com/user/show/36566840-jerry-delince,4,A great primer in applied artificial intelligence.
42,0670025291,http://goodreads.com/user/show/18552801-payraw,5,I need to read this book again!
43,0670025291,http://goodreads.com/user/show/5612143-costin-grigore,5,"Nice overview on technologies, fields of study, theoretical limits, practical approaches, important ideas, books, authors that have impact on AI"
44,0670025291,http://goodreads.com/user/show/85406829-ibrahim,0,"One of the most beautiful books I have read in philosophy of mind, the book shows how the Hidden Markov Model - HMM can be better than neural networks in simulating the human mind. The book also has philosophical topics in consciousness and free will.Thanks to my friend who suggested this book to me."
45,0670025291,http://goodreads.com/user/show/73029907-cav,4,"This was a really fascinating book. Kurzweil lays out a few really interesting theories here; including his ""Law of Accelerating Returns"", as well as his theory of mind: ""Pattern Recognition Theory of Mind (PRTM)"", that I found to be particularly thought-provoking. Kurzweil is attempting to reverse-engineer the brain; human intelligence and consciousness.This book is part of that story.
Law Of Accelerating Returns:

""...Kurzweil, after Moravec,Moore's Law to describe exponential growth of diverse forms of technological progress. Whenever a technology approaches some kind of a barrier, according to Kurzweil, a new technology will be invented to allow us to cross that barrier. He cites numerous past examples of this to substantiate his assertions. He predicts that such paradigm shifts have and will continue to become increasingly common, leading to ""technological change so rapid and profound it represents a rupture in the fabric of human history."" He believes the Law of Accelerating Returns implies that a technological singularity will occur before the end of the 21st century, around 2045.""
https://en.wikipedia.org/wiki/Acceler...
Pattern Recognition Theory of Mind (PRTM):

""Kurzweil describes a series of thought experiments which suggest to him that the brain contains a hierarchy of pattern recognizers. Based on this he introduces his Pattern Recognition Theory of Mind (PRTM). He says the neocortex contains 300 million very general pattern recognition circuits and argues that they are responsible for most aspects of human thought. He also suggests that the brain is a ""recursive probabilistic fractal"" whose line of code is represented within the 30-100 million bytes of compressed code in the genome.Kurzweil then explains that a computer version of this design could be used to create an artificial intelligence more capable than the human brain. It would employ techniques such as hidden Markov models and genetic algorithms, strategies Kurzweil used successfully in his years as a commercial developer of speech recognition software. Artificial brains will require massive computational power, so Kurzweil reviews his law of accelerating returns which explains how the compounding effects of exponential growth will deliver the necessary hardware in only a few decades.""
https://en.wikipedia.org/wiki/How_to_...Pattern-seeking and recognition is a fundamental piece of architecture of the human mind, and Kurzweil examines this in-depth in the book.The start and subsequent ~50-75 pages was super-interesting, as was the later ~50-75 pages. I found the middle of the book to be a bit arduous, dry and esoteric, though. Maybe it's a subjective thing, as I imagine detail-oriented people in the field of AI would appreciate his attentions here. He talks about how micro-robots and other mechanical biotech will gradually supplant our own biology near the end of the book, which I would largely agree with.I found this quote near the end of the book to be particularly noteworthy:
 ""After lossless compression, due to massive redundancy in the genome, the amount of design information in the human genome is about 50 million bytes, roughly half of which (around 25 million bytes) pertains to the brain.That's not simple, but it's a level of complexity we can deal with. It represents less complexity than many software systems in the modern world.""
Overall I would definitely recommend this book to anyone interested in AI, or the neuroanatomy of the brain in general. Kurzweil is a brilliant mind, and this book reflects that."
46,0670025291,http://goodreads.com/user/show/174365-kurtbg,2,"This book makes an attempt at documenting how to recreate a human mind with technology. I was let down by this book. Perhaps it was too early to write the book. Other of Kurzweil books come off as just trying to be the first to document the idea. The structure and presentation of this book seems to support that premise.First off, there's the definition of the word 'mind.' it's a word made up by humans to describe a phenomena real or not. For a scientific approach you define it then move forward. Some chapters are spent going back and forth trying to prove how an artificially created 'mind' could be considered as valid as human. I wasn't looking for a wordplay book, but the author does the same thing with the words 'soul', 'freewill', and 'sentient/conscious.' I wasn't so interested in a proof of whether an AI representation of a mind would be considered a valid entity on par with a human. My thoughts: it's not, because whatever is electronically stored can be copied ad infinitum. It is a machine. A human body is not easily copied (even 1000 years from now) and is singularly irreplaceable.I think the author gets caught up in the representations.Onto creating a brain. The question is, do you want to build an AI replica of the human brain, or do you want to create an AI entity that can process and think like a human brain?Computers (hardware and software) are representations that store, process and act on inputs. A human brain does the same thing, but with organic structures, chemicals. Understandings in both sides can be used to build upon. The abstract concepts are the key here. What does a brain do and how does it do it? From there you go with whats feasible. Does a AI version need an equivalent of two hemispheres? why not four? It really doesn't matter. What does matter are areas of function and their interconnectivity.To build a replica of a human brain you would need to start witha baseline which is the genetics and organic structures of a human brain. This would include mutations, and potentially defects. Next there would need to be an impetus for that life form. Humans are driven by impetus which defines how they look at the world, what drives actions, and what drives learning.Humans have fears, survival mechanisms, ego, etc this drives knowledge accumulation. A similar impetus would be needed for an AI brain more than just a single purpose like playing chess, recognizing speech, or answering questions from the television show, Jeopardy.Next would be the interconnection of stimuli, their storage, weighting, retrieval and associations. The brain stores visual separate from the written and aural. Would you structure an AI mind similarly? What about smells, touch, temperature, deja vu etc?None of the above was discussed. Instead, there's a lot of talk on his previous works, shout-outs to his companies, patents, books, etc.A later chapter covers how he's a predictor of the future. He provides graphs showing, that if you historically document achievement you can identify - trends. Surprise! Can anyone do that? He also takes a section for some smackdown against a paper Paul Allen from Microsoft critiqued him. That doesn't really push the advancement of creating an AI initiative forward.Anyways, perhaps the book was too early for its time. I'd like to see a much better, and scientific book written on how to create an artificial intelligence."
