,isbn,user_link,ranking,review
0,0641587716,http://goodreads.com/user/show/89336018-ujjawal-sureka,4,"Genre: Science, Cosmology.Publication Date: 2002A book on Gravity, Black holes, matter-anti matter, light, quantum mechanics, time and space. Its a cosmological thriller."
1,0641587716,http://goodreads.com/user/show/3655942-rakhi-dalal,4,"An artist's sketch of a black hole's event horizonSometimes when we look at the evening sky, observe a shooting star far away or admire the beauty of moon, we are overpowered by this idea of our seemingly insignificant existence in the Universe. For if we compare our very own presence, that of our world or our country, even of our planet or our galaxy with the Universe, it is bewildering that we seem to occupy not even a speck of dust as compared to the vastness of the Universe. Many of us are then tempted to delve into the mysteries of this existence to make out some meaning, some significance. Whereas philosophy seems to correspond to our inner being in relation to world around, we need to turn to science in order to understand our relation with the Universe. The attempt thus taken, even though neither Science nor Philosophy seems to offer an absolute explanation, may bring about a more modest outlook towards our existence and empathy towards fellow beings. But since most of the scientific theories and their explanation are available theoretically in a technical manner, not many of us make an attempt to understand them. In this work, Hawking not only suggests making scientific knowledge simpler enough for everyone so that more people can understand and benefit from it but also presents to us scientific theories in very simple way. The work is a compilation of seven lectures delivered by Hawking in which he discusses various theories like Theory of relativity, Big Bang, Black Hole, Quantum theory, Quantum Gravity and String theory to finally propose a ‘unified theory’ which might one day be able to take every known theory into account and give us an explanation of the existence of Universe. Hawking is so lucid at explaining these theories and then presenting reasons as to why certain theories may not hold that even a naïve science reader like me can understand them. Moreover he is also quite witty at certain places, which makes the work an enjoyable read e.g.“In other words, the singularities produced by gravitational collapse occur only in places like black holes, where they are decently hidden from outside view by an event horizon. Strictly, this is what is known as the weak cosmic censorship hypothesis: protect observers who remain outside the black hole from the consequences of the breakdown of predictability that occurs at the singularity. But it does nothing at all for the poor unfortunate astronaut who falls into the hole. Shouldn’t God protect his modesty as well?”“However, in the end most people, including John Taylor, have come to the conclusion that black holes must radiate like hot bodies if our other ideas about general relativity and quantum mechanics are correct. Thus even though we have not yet managed to find a primordial black hole, there is fairly general agreement that if we did, it would have to be emitting a lot of gamma and X rays. If we do find one, I will get the Nobel Prize.”Some concepts like Black hole radiation, arrows of time and quantum theory of gravity are very interesting. The idea of ‘reverse arrow of time’ made my head spin in a good way. Towards the end, when Hawking discusses the need of a unified theory and the question why such a theory may not be possible, he ends his lecture in the following manner:However, if we do discover a complete theory, it should in time be understandable in broad principle by everyone, not just a few scientists. Then we shall all be able to take part in the discussion of why the universe exists. If we find the answer to that, it would be the ultimate triumph of human reason. For then we would know the mind of God.I will recommend this book to all those who want a have an idea about the Universe in terms of theories developed so far."
2,0641587716,http://goodreads.com/user/show/74953959-aakanksha,4,"This book is a boon for physics lover. The author didn't include complicated mathematical equations. He kept language simple and easily understandable. The author mixes science with philosophy. It exhibits a subtle sense of humor in the book. It's a short read. Stephen Hawking poses interesting questions about God. All in all, a recommended reading.Read full review - Books Charming"
3,0641587716,http://goodreads.com/user/show/54103953-archit-ojha,4,"After reading A Brief History of Time, I wanted to read Stephen Hawking's other books immediately.The Theory of Everything consists of lectures and notes by Prof. Hawking. His writing still amazes me whenever I get to have a look at his books."
4,0641587716,http://goodreads.com/user/show/4099020-carla-ren,5,"I wasn't sure what to expect when I approached this book. Being such a huge Einstein fan and knowing how he struggled in his own, final quest for the Theory of Everything just before he died, well, I didn't know what to think. Had Hawking finally cracked that elusive nut?I was originally homeless when I first discovered this book, and living in my car with my 2 cats. I would head to the library on special days to kill time, and immediately go to this book and throw myself into its pages. I'd always been a sort of Hawking/Penrose fan up to this point, but really got into the details of the theories seriously when I decided to return to college to study math and theoretical physics.I was pleasantly surprised at the amount of levity and wit Hawking used to approach his topical essays! And he made a successful, conscious choice to remove most of the superfluous ""professor-speak"" and attempt to keep it on a level that most non-scientists could understand. I commend him for that. This book was a bit of an eye-opener for me. My favourite essays were of those on black holes. The interesting thing, is that since reading this book, we have discovered the existence of hyper-giants, which weren't around when Chandresekhar devised his now famous, ""Chandresekhar limit"" when calculating at what conditions an imploding star would finally fold under the mass of itself and become a black hole. It makes me wonder what this now does to his limit calculations.All in all, a superb book for the scientist and non-scientist alike. Highly recommend. "
5,0641587716,http://goodreads.com/user/show/26837471-swati,4,"Language is lucid. However, at times theories are quite complex and simple pictorial illustrations if incorporated might have had been useful. The book starts off with the ancient theories on universe evolution and gradually explains reasons for non-feasibility of the same in a structured manner. It is followed by explaining that why universe is non-static, future of stars, different evolutionary models, flaws in them, the paradox which is created if we assume singularity to be existent at the time of bing bang, concepts of quantum gravity and imaginary time to find solutions for fundamental limitations arising because of singularity assumption, possible histories of universe and ultimately capability of string theory to resolve unsolved mysteries. At the end author has explained that why unified theory is not possible presently but might be possible in future.Author does tried to add light humour in some parts. Fascinating read!"
6,0641587716,http://goodreads.com/user/show/8673311-kaustubh,5,"Not a novel per se but a collection of lectures by Mr Hawking, which explores the origins of the universe and tries to find the answer to ""Why does the Universe exist, anyway?"". Stephen Hawking tries to explain the origin of the Universe or The Big Bang without going into the technicalities and also gives a brief overview of various theories present that try to explain the state of the Universe (even the String theory). The writing is simple but still multiple readings will be required to completely understand the full book (for me atleast). Hawking's witty propositions and his subtle doubts at the existence of THE CREATOR makes it a very enjoyable experience.A must read for anyone interested in cosmology5/5"
7,0641587716,http://goodreads.com/user/show/6595648-bam-the-bibliomaniac,3,"Audiobook was not the smart choice for this for me. I'm not an auditory learner and didn't take this into account. So I don't think I retained any of this information. However, while I listened I was completely enthralled. He really does a great job of simplifying deluxe principles. Thermodynamics seem to be the focus here. "
8,0641587716,http://goodreads.com/user/show/3568752-larissa-fauber,4,"Black holes, stars, the beauty of a supernova and the universe. Take these together and mix them with a scientist: Boom! An explosion! A Big Bang! The theory of almost everything we are eager to understand about the beginning of the times. This review will include a brief history of this book [PUN]!Not only did Stephen Hawking describe those concepts easily in this book, but he also made us have free access to his deep studies. He was born exactly 300 years after Galileo's death and became one of the most influential people in the area of Cosmology. Don't you feel a little bit scary to get his work to read? Don't you have the idea that it'll be tough and appalling? I'm here to demystify your wrong judgements towards this book!  First, is it paid off to read the analysis of a scientist who is not always right? Sure it is! For someone who admits having made a mistake in his first theory of black holes, Hawking deserves more than the knighthood offered by the Queen Elizabeth, which he declined by the way. The term black hole was coined in 1969 by the American scientist John Wheeler. I would rather grant you an excerpt from the book than trying to explain it to you: ""... a star that was sufficiently massive and compact would have such a strong gravitational field that light could not escape. Any light emitted from the surface of the star would be dragged back by the star's gravitational attraction before it could get very far. Although we would not be able to see them because the light from them would not reach us, we would still feel their gravitational attraction. Such objects are what we now call black holes, because that is what they are—black voids in space."" (Page 37)""To understand how a black hole might be formed, we first need an understanding of the life cycle of a star. A star is formed when a large amount of gas, mostly hydrogen, starts to collapse in on itself due to its gravitational attraction. As it contracts, the atoms of the gas collide with each other more and more frequently and at greater and greater speeds—the gas heats up. Eventually the gas will be so hot that when the hydrogen atoms collide they no longer bounce off each other but instead merge with each other to form helium atoms. The heat released in this reaction, which is like a controlled hydrogen bomb, is what makes the stars shine. This additional heat also increases the pressure of the gas until it is sufficient to balance the gravitational attraction, and the gas stops contracting. It is a bit like a balloon where there is a balance between the pressure of the air inside, which is trying to make the balloon expand, and the tension in the rubber, which is trying to make the balloon smaller."" (Pages 38-39). ""According to the theory of relativity, nothing can travel faster than light. Thus, if light cannot escape, neither can anything else. Everything is dragged back by the gravitational field. So one has a set of events, a region of space–time, from which it is not possible to escape to reach a distant observer. This region is what we now call a black hole."" (Page 44)Yes, black holes are not black and Stephen was humble enough to carry on studies to correct his thoughts and publicly announce his misunderstanding regarding his set of principles in print. Einstein had the guts to confirm that his cosmological constant was an incorrect belief, Stephen followed his steps and it may be one of the reasons we look up to them both. I do, wouldn't you? Having said that, many may think that Hawking does not believe in God, yet what we see here is that he discourses about the Big Bang Theory and gives God the credit for this event. Along the pages you also read how the Catholic Church admits in 1951 that the Big Bang is in accordance with the Bible. The Catholic Church misperceived Copernicus and Galileo regarding their theory of the Earth being the centre of the universe and it invited some experts to advise it on cosmology in the Vatican in 1981. It was when Hawking attended this conference that his interest in the origin of the universe was reawakened. The pope told the scientist that it was okay to study the evolution of the universe after the big bang, but they ""should not inquire into the big bang itself because that was the moment of creation and therefore the work of God"".From my point of view, Stephen's search for the theory of everything is his inner search to meet and understand a real God. His fascination with the universe leads his thoughts to the Hands of a creator that has put forward the laws that rule the cosmos. So as to justify my idea for that, just take a look at his last words on this book: ""if we do discover a complete theory... we would know the mind of God.""So, what's the ""Theory of Everything""? Well, this is only a simple review and I don't like spoilers! Do you really think I would give you ""everything""? [PUN]. Read the book, I strongly recommend it and I guarantee it'll be BRIEF ;)Larissa Fauber Click here to check Larissa Fauber's profile on Goodreads. Click here to read Larissa Fauber's reviews.

"
9,0641587716,http://goodreads.com/user/show/15403498-jerecho,4,"This book is about theories of everything, really? No, but nearly. It tell us about theories in the universe, important scientific discoveries, facts and future development. It's nice to read something like this. It adds something to the general knowledge we know about the world and the universe we live in."
10,0641587716,http://goodreads.com/user/show/18918586-arash,3,"Excellent start, very comprehensible and enjoyable to read. The first three chapters are marvelous. Towards the end, either it reaches my horizon limits in physics, or the author is too occupied to justify his own theories to care about the reader's understanding. I was lost in the end. All in all, a recommended reading. "
11,0641587716,http://goodreads.com/user/show/82007298-hazel,3,"60%~Insightful, but I didn't really enjoy the writing format and the writing itself. I am so into Astronomy and kind of Stephen Hawking books, but sorry, the writing of this book didn't make me inspired to learn from here. "
12,0641587716,http://goodreads.com/user/show/3633211-vikas,4,"This book is a collection of lectures by Prof. Hawking many years ago. I read it immediately after ""A Brief history of Time"" so the content was basically same in this one too as these were the lectures given by Prof. Hawking. But it again is very well presented so in all liked it too as the information provided is good though ubiquitous now. Hope to read more books by Prof. Hawking.People who don't read generally ask me my reasons for reading. Simply put I just love reading and so to that end I have made it my motto to just Keep on Reading. I love to read everything except for Self Help books but even those once in a while. I read almost all the genre but YA, Fantasy, Biographies are the most. My favorite series is, of course, Harry Potter but then there are many more books that I just adore. I have bookcases filled with books which are waiting to be read so can't stay and spend more time in this review, so remember I loved reading this and love reading more, you should also read what you love and then just Keep on Reading."
13,0641587716,http://goodreads.com/user/show/54353853-lakpa-tashi-bhutia,3,"Typically this book is for people who is inclined towards science(Physics in particular). But if want to read, you can go on your own. Most of the non-science people will not find this book pleasing. But author tries his best to make this book for everyone. By keeping mathematical equations away."
14,0641587716,http://goodreads.com/user/show/5994781,4,"Pleasantly accessible, for the most part."
15,0641587716,http://goodreads.com/user/show/113217872-danyal-talpur,5,"*Book review by Danyal Talpur*  The book the ""theory of everything"" is written by Stephen Hawking. This book is mostly about Cosmology. This book is comprised of seven lectures, these lectures are on the creation and the fate of the universe, Black holes, direction of time, and the theory of everything. The writing style of Stephen Hawking is very simple and easy, he illustrates very complex ideas with daily life examples. In the first lecture, Stephen Hawking gives an outline of the history of the history of the universe, he gave a review of past ideas about the universe. He started his lecture from Aristotle's ideas and end it at our present belief about the universe.  In the second and the fifth Chapter, Stephen Hawking talked about expanding, origin, and the fate of the universe. In these chapters, he deals with questions like will the universe eventually stop expanding and start contracting? Will it expand forever? In these chapters, he also describes how time had begun at Big Bang? Stephen Hawking applies Quantum mechanics, the law of gravitation, and Einstein's relativity to prove that the universe must have a beginning and the universe could not be statistics. In the third and fourth lectures, Stephen Hawking talked about black holes. He described how black holes are formed? What is inside the black holes? Will people be able to come out of black holes? The author proves his ideas with physics laws.  In the sixth lecture, Stephen Hawking discusses the direction of time. He described that does time travel is possible? Can we predict the future? In the seventh and last chapter, Stephen Hawking described the ideas about the theory of everything. Actually, the theory of everything is not still given by anyone. There are some theories of science that are not unified with each other like Quantum mechanics and general relativity. However, one would hope to find a complete, consistent, unified theory that would include all these partial theories as approximations. The quest for such a theory is known as "" the unification of physics."" Einstein spends much of his latter time to unified all the theories but he refused to believe in Quantum mechanics. When all the theories will be unified, we shall really understand the universe and our position in it.  The theory of everything is one of the must-read books for science and cosmology lovers. Stephen Hawking illustrates highly complex ideas in a very easy way. I highly recommend every bookworm to read this book."
16,0641587716,http://goodreads.com/user/show/70312326-yasameen-safaa,0,Can God make a stone so heavy that He can’t lift it?
17,0641587716,http://goodreads.com/user/show/82596342-iman-shabani,5,"This definitely was a nice read. After reading it for a second time, I can say, all-in-all it's a good starter book for most people that are not much familiar with physics. After all Stephen Hawking was not only a scientist, but also a science communicator, maybe not as much as people like Carl Sagan, or Neil Tyson, but considering his disability, a pretty good one I'd say.Some of my friends think for one to understand such a book, you need to have some understanding in concepts like general relativity, or quantum physics. While that will definitely help you have an easier time reading such a book, but the way Stephen wrote this, helped me, as someone not versed in those concepts, understand most of the topics to some extent; and so I think it can help most of you as well.One other good thing about this book, is the fact that it's a quick read, and might motivate some people to give it a shot, whom will avoid it otherwise. This could even give you enough inertia to move to more-in-depth books on the subject.Bottom-line, I recommend this book for you. Have a good time reading it in case you decided to. :)"
18,0641587716,http://goodreads.com/user/show/65522073-trisha,4,"I’m spellbound post reading this one. A wonderful amalgamation of lectures written in layman’s language for the average Physics lover or anyone just as curious as me. Hawking tries to summarise all possible theories beginning from the General relativity through Quantum Mechanics and leaves us wanting for more. I’d have appreciated the book more had there been some pictorial depictions to simplify the lectures. Though, all in all, this book is an adventure in itself."
19,0641587716,http://goodreads.com/user/show/30673216-rashmi-basant,4,Read this buddy. You will find yourself into the another level. You will find the all these are men who are fighting for each other are just meaning less.
20,0641587716,http://goodreads.com/user/show/12430250-pallavi-kamat,3,"Talks about the origin of the universe, black holes, big bang, etc. Also, features Subrahmanyan Chandrasekhar and his work on the limiting mass of cold stars."
21,0641587716,http://goodreads.com/user/show/76520925-eldi-qevani,5,4.5 StarsA great introduction to those who wanna start reading science non-fiction books!
22,0641587716,http://goodreads.com/user/show/51920759-vinicius-carvalho,4,"By a lucky coincidence, I picked up to read/listen Stephen Hawing's last book, written and narrated by himself when still alive, a few days before the first picture taken of a black hole was disclosed by the Event Horizon Telescope Project, reinforcing the validity of Einstein's and Hawking's theories. This breakthrough event was even a bigger deal for me, as the subject was fresh on my mind.This is another great but short Hawking's book which helps a layman like me to understand a little better the edge of Physics theories and research.Although I'm not well versed and intelligent enough to comprehend all that is explained, it is so exciting to be able to think about the grandiosity of the universe compared to how tiny, and at the same time complex and hugely improbable are life on earth, human life and everything we developed up to now."
23,0641587716,http://goodreads.com/user/show/55881076-robert-cox,3,"Ok moral of the story is you really don't need to read like all of these Stephen Hawkings books. In fact just one (""A Briefer History of Time"" would be my recommendation) is sufficient. And if someone is so inclined to continue our unofficial, unlicensed and uncensored lesson in Physics I'd spread the love, check out Rovelli or Tyson. As a stand alone book ""The Theory of Everything"" is a good, broad strokes lesson of astrophysics with a little more time spent explaining prevailing theories of the past that have been disproved as well as contemporary theories put forth that will probably be disproved. "
24,0641587716,http://goodreads.com/user/show/108519141-miriam-neves,5,"After reading this book, my mind is among the stars. I truly believe that S. H. had the power to teach such difficult concepts to everyone and still share his passion about astrophysics.Is a book that talks a little bit about the big questions,""why are we here?"", ""what was big bang?"", ""is it a place to God?"".If you really want to find the answers to some of the most important questions, this book is right for you.I can say, that when I finished this book, I was very sad, because I just wanted to read more. Absolutely a 5 stars book"
25,0641587716,http://goodreads.com/user/show/32780300-omnia,5,"must be read, and then re-read."
26,0641587716,http://goodreads.com/user/show/45432931-roopkumar-balachandran,5,"This book is the compilation of seven lectures given by Stephen Hawking. The first lecture is the outline of history of the universe from the big bang to black holes. He briefly describes the previous ideas about the universe. The second lecture he describes theories of gravity of Newton and Einstein that the universe is either expanding or contracting but not be static. A detailed explanation of the big bang in layman's language finds place in the lecture.The 3rd lecture the author talks about black holes. How a black hole is formed and some information on the singularity and quantum mechanics.The 4th lecture is about black holes are not black holes and elaborates on the quantum mechanics of energy leaking out of black holes. In the 5th lecture the author applies his quantum mechanical ideas to the big bang and the origin of the universe, and he proposes that the space-time is finite and its extent is without boundary. (Needs second time reading to understand).In the 6th lecture he questions why the laws of physics is time symmetric and why the past is so different from the future. I find it little bit difficult to grasp at first. If some one posts a video for this principle it will be much appreciated. In the 7th and final lecture is about the most famed Unified Theory. He closes that lecture with an optimistic view of science which I quote below.""However, if we do discover a complete theory, it should in time be understandable in broad principle by everyone, not just a few scientists. Then we shall all be able to take part in the discussion of why the universe exists. If we find the answer to that, it would be the ultimate triumph of human reason. For then we would know the mind of God."""
27,0641587716,http://goodreads.com/user/show/50057424-ronald,4,Thanks for this Hawking!! 
