,isbn,user_link,ranking,review
43,0393355500,http://goodreads.com/user/show/39066355-craig-cowled,5,"This is a book that takes some time to digest. I've been reading it in short spurts over many months, allowing the deep subject matter to stew in my mind. Dan Dennett is a Professor of Philosophy at Tufts University and he has spent his very long career seeking to explain, among other things, how the brain produces mind. Dan's approach to this question is quite interesting. He insists on using scientific findings to direct his thinking and he avoids metaphysical prognostication.There is a school of thought in ""philosophy of mind"" studies that there exists a so called hard problem of consciousness. The hard problem of consciousness was described by Prof David Chalmers, an Australian philosopher at ANU, as the subjective experience of awareness that transcends the physical. Chalmers uses the label qualia to describe this subjective feeling that arises in our minds when we experience the world. He believes the nature of qualia is fundamentally different to physical matter and that, as a consequence, consciousness must be a foundational property of the cosmos.""Hogwash,"" says Dennett. According to Dennett, the hard problem of consciousness isn't hard, but it is difficult to get your head around it. The reason it is difficult is because our conscious experience is so compelling in its richness and detail that we are driven to believe that there is an internal observer, the self, which is the beneficiary of all the sensations and emotions we experience and which, importantly, is the author of all our thoughts, dreams and desires. We believe so strongly in this autonomous self, a belief enforced and maintained by a culture which rewards the worthy and punishes the unworthy, that we almost instinctively avow a metaphysical theory of mind. That is, we feel sure that there is something spiritual and ineffable about 'mind' which simply cannot be explained by the wet, meaty stuff in our 'brain'.The apparent duality of mind and brain has led to a widespread and persistent belief in dualism. René Descartes described dualism in a way that has resonated with Western philosophy for centuries. According to his view, which is shared by Chalmers, reality consists of matter stuff and mind stuff. It is quite understandable how dualism gains traction in our thinking when you consider the experience of death. One moment the body, made of matter, is breathing, moving and speaking and a moment later it is still and lifeless. It certainly seems obvious that some 'thing' has left the body at the point of death. This phenomena continues to support belief in souls and spirits to this day.Is there any evidence of a ghost in the human machine? The short answer is no. The evidence from controlled experiments in neuroscience indicates that the conscious mind becomes aware of decisions after the brain has already made the decision. To use a metaphor, our consciousness is like the surface of a wave. The surface of the wave is not the cause of the wave. It is where it is because of everything happening beneath the surface.Dennett's book is his latest attempt to synthesise the lessons of science into an explanation of how mind comes from brain. Dennett draws on three ""strange inversions of reason"" in the history of science and philosophy. I'll give a paragraph to each of these.Firstly, there is Darwin's strange inversion of reason from the 'trickle down' hypothesis of Intelligent Design to the 'bubble up' theory of Evolution. Darwin noted that there was variation of traits within a population of any given species. He also noted that individuals within the population struggle to survive within their environment. Darwin's key insight was that certain traits provide some individuals within that population an advantage, improving their chances of passing those traits onto future generations. To use a construction analogy, evolution is like a crane building up from the foundation and Intelligent Design is like a skyhook.Secondly, there is Turing's strange inversion of reason. Turing is the father of modern computing. What he showed, which we all now experience everyday with our smartphones and laptops, is that a perfect computing machine does not need to have any comprehension in order to do arithmetic.Thirdly, there is Hume's strange inversion of reason. Our conscious experience consists of a flow of moments in time. We observe things happening all of the time and we instinctively attribute causes to the things that happen. The cause - effect relationship is so fundamental to our experience, but Hume says that we never experience cause and effect, we only ever experience each moment. The cause - effect relationships we perceive are actually a projection from our minds onto the world. We do this, says Hume, because we have come to expect outcomes from certain actions. And this is Hume's inversion of reason, that, in a metaphorical sense, we project our expectations onto the objects of the natural world. We taste honey and say that it is sweet. The sweetness of honey is not an intrinsic property of honey. There is nothing about the molecules of honey that is, in essence, sweet. We have projected the attribute of sweetness onto the honey as part of our ontology, our 'way of being'.According to Dennett, these three strange inversions of reason provide us with the tools to understand how our conscious experience arises from brain stuff.Evolution through natural selection (Darwin's strange inversion) builds biology from the simplest of replicating forms to the amazingly diverse range of species we have today, of which humans are the beneficiaries of large and intricately wired brains.Our nervous system is stimulated by billions of neuron spikes in any given moment. These spikes result in a cascade of spikes throughout the brain, known as spike trains. Some of these spikes represent external things (i.e., sight, sound, touch, taste, smell), bodily sensations, responses from the brain's memory centres, and various layers of representations of those representations. There is no reason to suspect that individual neurons are somehow self-aware or conscious as they go about their business of responding to stimulus time and time again. The billions of neurons in our brain are competent without having comprehension (Turing's strange inversion).Some neuronal connections could fire in response to say the colour blue, a baby's face, the concept of multiplication, the word 'self', or a directive to contract a specific muscle. Every firing between two neurons strengthens the connection. The strength of the connections between neurons is a measure of the degree of expectation regarding the likelihood of that connection firing again. In this way, our brains develop expectations which can be triggered without any external stimulus, as happens with optical illusions.Most of the spike trains in our brain have no apparent impact on our conscious experience (e.g., regulatory processes in the medulla oblongata for respiration and circulation). Some of the neural spikes in our brain, however, are clearly correlated with consciousness. Our conscious experience seems to consist of representations that have been filtered through many levels of brain processes in many parts of the brain yielding a projection (Hume's strange inversion) into ""subjective space"". There is no need, according to Dennett, to ask the what, where, or how of subjective space. Doing so is a violation of Occam's razor because the subjective space adds nothing to our understanding other than a smug satisfaction that we have control of our brains when the reality is that our brains control us.Dennett does think the ""what for"" question is interesting, though. He suggests that our conscious experience is available to us to facilitate communication with each other. That is, having access to our own conscious experience helps us to share with other people what we are thinking, what we are planning, how we are feeling, and how we might be able to cooperate to make our lives better and enhance our chances of survival. Consciousness, in this view, is for others; not merely for our own benefit, but for the benefit of our social species.From Bacteria to Bach and Back is a difficult, thought-provoking read. Dennett's style is somewhat rambling as he advances the various prongs of his argument a little at a time, before back-tracking and carrying his argument a little further. He spends a great deal of the book attempting to point out the fallacies in our thinking that are a result of our conditioning. While reading this book, I found that I needed to take a break from time to time, re-read sections, and cogitate.In my view, Dennett's argument is quite convincing; however, I don't think he has captured the whole picture just yet. For one thing, research continues on the physical structure of brains (i.e., the connectome, and neuroglia, etc.), neuroscience, cognitive psychology, and artificial intelligence. I suspect that our understanding of consciousness will improve as the science progresses. I'm not entirely sure that Dennett is on the money, but he does seem to be on the right track. I will be particularly interested to see experimental results testing the validity of qualia.I'll leave you with a fascinating 2017 experiment by Roman Yampolskiy available in pre-print on arXiv titled, ""Detecting Qualia in Natural and Artificial Agents."" Using the hypothesis that the ability to be fooled by an illusion is an indicator that an 'agent' has a kind of subjective experience, which is not based on the real world, Yampolskiy shows that some deep neural networks can be fooled by optical illusions into seeing something that is not there. I'm not convinced that this is actually a demonstration of conscious AI, but it might be a rudimentary precursor on the pathway to conscious AI."
44,0393355500,http://goodreads.com/user/show/25525237-jim-robles,5,"A great read by one of the, if not the, preeminent philosophers of our time. Five stars!Of course the unanswerable questions remain unanswered. It is the journey that matters.From p. 371: ""If the brain was so simple we could understand it, we would be so simple we couldn't."" - Emerson M. Pugh, The Biological Origin of Human Values. I am inclined to agree that no entity/machine can understand itself. Also from p. 379: What I cannot create, I do not understand. - Ricard Feynmam.I disagree with Professor Dennett's assertion (p. 375 -388) that collaboration and tools are letting us create things that nobody fully understands. Of course our definition of ""fully"" is critical here. I have created computer programs (thermal models) whose computations I could not duplicate in my lifetime: that does not translate to I do not fully understand the results and how they were derived. Learning computers are a new challenge, but even here that act in accordance with their human programing. I have also been the architect developing (mechanical/electrical) avionics architectures trading mechanical/electrical options (as opposed to processor/network or software (options) across development cost, unit recurring cost, operation & support cost, performance, weight, volume, reliability, integrity and ease of technology insertion. Yes there were experts in each field on the team, who contributed specialized knowledge. Having said that such design teams are not democracies. The only place where there is enough bandwidth to pick the optimum solution, across the trade space, is in the brain of a single human being: AKA the architect. If the architect does not understand, although less absorbed in the details that the specialist, the architecture design could not be achieved. Again yes: there is a tiered structure of such architectures, but at each level there is an architect who understands their components at that level.I also had the opportunity to discuss mathematical proofs with a prominent mathematician at a Tier I university, who frequently collaborates with mathematicians in other specialties, who disagreed sharply with Professor Dennett's assertion that nobody understands the entire proof.""My overarching claim in this book is that the evolutionary perspective in general and the memetic perspective with regard to culture transform some of the apparently eternal puzzles of life, that is, meaning and consciousness, in way inaccessible to those who never look beyond the manifest image that hey grew up with and the disciplines they were trained in"" (p. 242-243). This just plays to my preconceptions: in much of what I have read and heard, about free will and consciousness, I have been struck the the lack of consideration of the evolutionary imperative.""The ultimate origin(s) of language and the orign(s) of life are still unsolved problems, . . . ."" (p. 265).I am a Stoic. We believe that our ""rights"" inhere in our ability to use language. There is a great deal here on the decisive difference between humans and other species. In particular ""Their motives may well be honorable - they are eager to expand the circle of the beings owed moral consideration because they can suffer - but until we can identify the important features, the features that matter, and explain why, this gesture is worse than empty"" (p. 337-338). Take that PETA! Beyond that it seems that our very human consciousness is a consequence of our communication by speaking.I read this as agreeing that we have autonomy but not ""free will,"" in the sense that we can pursue what we want, given environmental and other constraints, but we cannot change what we want. This may be disturbing to some, but it is not new. Paul acknowledges this in Romans 7-15:New International VersionI do not understand what I do. For what I want to do I do not do, but what I hate I do.New Living TranslationI don't really understand myself, for I want to do what is right, but I don't do it. Instead, I do what I hate.This and more at:http://biblehub.com/romans/7-15.htmMy Father ran into, and was ""cleaned out"" by, a shell game practitioner on a trip to Spain. A splendid explanation of how this was done is on p. 306-307.""Or, with some justice we could say the Information Age began over 530 million years ago, when eyesight evolved during the Cambrian Era, triggering an arms race of innovation in behavior and organs that could respond swiftly to the information gathered from light"" (p. 107).""Batesian mimicry (such as a nonpoisonous snake with markings that mimic a poisonous variety) is a similar kind of parasitism, getting the benefit without going to the cost of manufacturing poison, and when mimics outnumber the genuinely poisonous snakes Aesop's moral take hold and the deceitful signals loses its potency"" (p. 127).""The oxygen level 600 million years ago was only 10% of its current level, so although the change is imperceptibly slow, it is dramatic over time"" (p. 147)."". . . . eyesight and flight . . . . have both evolved several times in different species"" (p. 149).""Economists have shown why centrally planned economies don't work as well as market economies, and centrally planned (top down) architectures are ineffective brain-organizers for much the same reasons"" (p. 160).""Our species has had a sustained population growth unprecedented in any other vertebrate species (aside from our chickens, cows, and pigs)"" (p. 177).""Dogs in effect domesticated themselves over many generations until their human neighbors became their owners, their companions, their guardians, their masters"" (p. 197)."". . . . and if we wait until we are teenagers to learn another language we will probably always have difficulty not only with our agents but with effortless perception of the words spoken by others, since we will have unreliable and imperfect phoneme detectors"" (p. 200).""The contrast between us and chimpanzees here is striking: by now, thousands of chimpanzees have spent their entire lives in human captivity, and such chimps have heard almost as many words as human children hear, but seldom pay any attention"" (p. 203).""We are the only species that has discovered other things to die for (and to kill for): freedom, democracy, truth, communism, Roman Catholicism, Islam, and many other meme complexes (memes made of memes) "" (p. 218-219).""The notorious confirmation bias is our tendency to highlight the positive evidence for our current beliefs and theories while ignoring the negative evidence. This and other well-studies patterns of error in human reasoning suggest that our skills were honed for taking sides, persuading others in debate, not necessarily getting things right"" (p. 220).""(The brains of domesticated animals are always smaller than the brains of their nearest wild kin; use it or lose it, and domesticated animals have a relatively unchallanging life, being protected from predators and starvation, and provided with mates at procreation time)"" (p. 232).""Many persistent cultural phenomena are maladaptive, and no theory that aligns cultural innovations with genetic innovations (""adaptions transmitted by other means"") has any way of accounting for these"" (p. 24x).""The savannah hypothesis that once a drier climate drove our ancestors out of the trees and onto the grasslands, upright locomotion was favored since it permitted seeing farther over tall grass . . . ."" (p. 258). Also see p. 264 on ""bees"" to see how distance runners (Cro-Mangons)obliterated football players (Neanderthals).""Human culture started out profoundly Darwinian, with uncomprehending competences generating various valuable structures in roughly the way termites build their castles"" (p. 282-283).""And once you have a habit of going into question-posing mode, all your R&D becomes much more top-down, using more directed research, and relying less on random variation and retention"" (p. 297).""Here is yet another strange inversion: this practice of sharing information in communicative actions with others, giving and demanding reasons, is what creates our personal user-illusions"" (p. 343).""McFarland . . . . explaining ourselves to others is the novel activity that generates the R&D that creates the architecture of human consciousness. . . ."" (p. 344).""Our access to our own thinking, and especially to the causation and dynamics of its sub personal parts, is really no better than our access to our digestive processes; we have to rely on the rather narrow and heavily edited channel that responds to our incessant curiosity with user-friendly deliverances , only one step closer to the real me than the access to the real me that is enjoyed by my family and friends"" (p. 346).""The scientists and philosophers who declare free will a fiction or illusion are right; it is part of the user-illusion of the manifest image"" (p. 368).""Orgel's Second Rule: Evolution is clever than you are"" (p. 382)."
45,0393355500,http://goodreads.com/user/show/11041240-zarathustra-goertzel,4,"Good book that details how minds and their subsidiary competences might come about.He has a passionate fetish for ""strange inversions"": competence without comprehension, designerless designs, et cetera.In other words, ""adaptation to the enivronment"" leads to ""designerless designs"", and we arrive at agent-free telealogy.In Soviet Russian words make you. Words are digital memes.All in all, his vision is fairly clear and lucid. Santa Danny is on the right track, making pretty decent headway.The vision alone would win him 4-5 stars. Alas, he delivers the vision like a condescending prick.Good ol' Saint Dan of the 20th century sceptical rationalist sees it his duty to ridicule all philosophers, thinkers, and segments of the population he disagrees with.Can he just deliver his vision and understanding of ""The Evolution of Minds""? No!We must know everyone who messes up, and how absurd Santa Danny finds them.Some of the ad-hominem is snuck in without explanation, so only those ""in the know"" will really notice what he's talking about.Moreover, he generally ""explains away"" disagreement with him by suggesting people just ""can't get it"" due to ""cartesian gravity"" or some other cognitive bias they just can't get over.Yes, thanks. I want to hear about how I am delusional if I don't agree with you after reading your book. Another possibility is that people are biased against Santa Danny because he's a douchebag. Hmm...Unfortunately, Dennett seems to go easy on himself. He seems not to apply the same level of sceptical scrutiny to his own ideas as he does to others, or at least he gives himself leeway in how he personally expresses them. Fortunately, these negatives are mostly concentrated in the start of the book. He is most likely the reason some people come to dislike ""reductionism"" as well.Occam's Razor applied to an extreme becomes its own sort of awkward bias, as you go out on a limb to, say, concoct an explanation with the 'smallest parts possible'. Is it still the simplest explanation?What does it mean to ""assume nothing""?A common case is the sceptic who doubts all observations about dogs until they are observed in the laboratory. Thus they will deny various capacities nearly every dog owner observes as they have not been satisfactorily verified in the lab yet. Of course the intent is to avoid athropomorphising and assuming too much capabilities. Yet why is assuming, obviously, too little a ""good approach""?One reason I read this book is that on topics of ""qualia"" and consciousness, Dennett seems to go 95% of the way and cut-off. (As well as general curiosity in the formation of minds :))Reading this book, it became apparent that the reason he leaves the icing out is because he's got his nose stuck in a ""war with dualists"" and fears using any wording that might give them any fodder against him. **cue the collective sigh**Anyway, he basically goes there (provided one has learned to read between the lines).He generally uses the ""manifest image"" and ""what it's like to be X"" rather than the gloss for the latter ""qualia"", as, well, we all know the term is kinda awkward. Although in arguing against the term ""qualia"" he essentially strawmans it or conflates it with some particular interpretation of ""qualia"" rather than simply regarding it as a gloss for ""what it's like to be X"" (as per the WIkipedia opening sentence definition). A shame he doesn't provide adequate scrutiny to his own rhetorical sleights. He seems to like the term ""user illusion"" for ""self/world model"", which is in line with his predilection with ""human/cognitive errors and delusions"". In my opinion, ""user interface"" would still sound better. To my surprise, he actually asserts The Hard Problem of Consiousness as a crucial component to the study of Mind and Consciousness! He was just nit-picking about the wording all along. Go figure: ""We won't have a complete science of consciousness until we align our manifest image identifications of mental states by their contents with scientific image identifications of the subpersonal information structures and events that are causally responsible for generating the user illusion we take ourselves to operate in.""All-in-all, he talks about the hard problem, qualia, and the Combination Problem -- simply in his own words. Questioning the ""cosmic divide"" between conscious, feeling, thinking entities like humans and stones, with grizzy bears somewhere in-between, Dennett suggests remaining agnostic. However, if he has to choose, he seems to come out on the side of ""why assume there's some cosmic divide?""Basically, he is on the panpsychist side of things. The reason he stops at 95% it appears is largely due to wanting to be careful. He wants to word things right, without risking saying ""too much"" with the wrong word choice.He mentions 2nd person consciousness studies (which Ben G has described in more lush detail).Ultimately, his view is fairly cogent and probably worth taking some time to see (before moving on) :). "
46,0393355500,http://goodreads.com/user/show/111124452-mehdi,4,"In this compelling essay, Dennett takes his readers on a journey through time and space, from the competent yet uncomprehending bacteria to the semi-intelligent designers that we are, and back. As a newbie in the world of philosophical literature, I must say this book was both a revelation and a struggle. Dennett's ideas, thorough research, and his scientific and philosophical insights have given me a lot of food for thought (What is consciousness? What does set humans and other animals apart? How does cultural evolution differ from natural evolution?). I will definitely explore the topic more in the future.The struggle came from Dennett's writing style, hence my 4-star rating. On multiple occasions, I had the feeling that he had made his sentences and vocabulary unnecessarily sophisticated and, at times, difficult to understand for someone who isn't used to reading philosophy books. His overuse of brackets and m-dashes to add in comments, thoughts or details within sentences make them difficult to follow. Overall, I was not sure what audience he was targetting, whether it was the accomplished philosophy student, or an educated general audience.Reading some online summaries helped me push through the tough passages, and the journey was worth the trouble. I think Dennett is well aware of the difficulty of his topic, and I am grateful for the brief reviews and the final summary that he included in his book."
