,isbn,user_link,ranking,review
23,1451640099,http://goodreads.com/user/show/11596464-kimberly,4,"What a wonderful historical commentary intermixed with delightful anecdotes. I fell in love at the chapter ""All About e,"" and continued to grow more fascinated the more I read."
24,1451640099,http://goodreads.com/user/show/21860762-stan-fleetwood,4,Great book. Fascinating.
25,1451640099,http://goodreads.com/user/show/9013977-ian,5,Great book with just the right depth for anyone interested in mathematics.
26,1451640099,http://goodreads.com/user/show/50614697-sb,3,"An incredibly interesting book regarding numbers and their role in our lives. For marketing purposes, Bellos argues that certain number sets are preferable, e.g. £7.99 over £8. The brain processes numbers from left to right, so £7.99 will register as cheaper than £8. In addition, prices ending in .99 are easier to forget and therefore harder to compare with other items that may be cheaper. For this reason, if you're selling something relatively cheap, it helps to sell at a round number, like £5 to help the consumer better remember the item and return to purchase. Brands that have numbers in their name should think carefully before choosing even or odd numbers; odd numbers (as the name suggests) are noted for ""not fitting in"" and being different. Odd numbers are also associated with rebelliousness and not following the crowd; Bellos uses the examples of Levi's 501, Levi's 500 just wouldn't have the same ring to it and that extra 1, is delivering to the customer that little bit more. However, when it comes to domestic products and items that you can't afford to have fail (condoms, domestic products, cleaning agents) your numbers need to communicate strength, competence and being able to get the job done. He uses the example of WD-40, arguing that no one would have enough faith in WD-39 (""why not 40?"") For household products, divisible numbers are more attractive to consumers than indivisible ones.Bellos notes that in both the East and the West, odd numbers are imbued with more spiritual significance than even ones. Perhaps it is because the brain processes even numbers a lot quicker than it does odd numbers. 7, for example, is a much loved number the world over and is seen as a mystical and magical number in many cultures. Bellos thinks it is because 7 is unique among the first 10 numbers, as it is the only number that cannot be multiplied or divided within the group. When 1,2,3,4 and 5 are doubled, the answer is less than or equal to 10. 6,8 and 10 can be halved and 9 is divisible by 3. It's also a prime number and people generally tend to prefer lower numbers (perhaps because they're easier for us to understand?) From very early on, the number 7 has been loved and praised by many cultures; the Jews declared that it took God six days to make the world and we still have a seven-day calendar, the Aztecs had a seven-day calendar too, though this was likely based on the amount of planets observed in the sky. Restaurants should also leave the £ sign out of their menus if they want customers to spend more (£ being a painful reminder of having to pay) and should refrain from listing their dishes on one side and having a column of prices on the other side; a quick scan of the prices will quickly force price-sensitive customers to read the menu from right to left. It is far better to list prices after the description of the item and customers will spend more, e.g.:Roast fillet of smoked haddock with warm potato salad and crispy onions 7.50Round numbers are more upmarket; a posh restaurant should never price a main dish at 34.99, as this appears a bit bargain and a bit cheap.Benson's Law states that the most common leading digit in any set of random data will be 1 and the least common 9; the order of probability of these numbers occurring decreases, the higher the digit. So, 2 as a leading digit is more common than 3, which is more common than 4 etc. This law holds true whether you're looking at newspaper numbers, sports scores, share prices or death tolls; this is surprising, as we would intuitively expect every number to have an equal chance of occurring. This law has been used in fighting financial crime, as sets of numbers that do not conform to Benson's law can show that data manipulation has occurred. Bellos gives examples of voting numbers falsified in Iran and companies manipulating their financial data for gain. In animals, metabolic rate does not rise as fast as mass, showing that animals get more efficient at producing energy as they get bigger; lifespan is directly proportional to mass, so the bigger the animal, the longer its life."
27,1451640099,http://goodreads.com/user/show/12454900-brad-eastman,3,"This is a fun book to read for those of us who have some background in math from a long time ago, but don't use it very often. I took a year of high school calculus and a semester of university calculus more than thirty years ago. I work with lots of engineers who are for more intimately acquainted with mathematical concepts. Mr. Bellos explains concepts in mathematics in a historical fashion, but also shows how the concepts were used to solve real world problems and create new applications. Mr. Bellos starts with a fascinating discussion of the psychology of numbers, showing how knowledge of human reaction to certain quantities can be used for marketing, detecting fraud and understanding behavior. He then proceeds to explain how are understanding of triangles, comics and circles grew throughout time and how that growing understanding led to amazing inventions and understanding of our world. He discusses exponential growth, calculus, differential equations, trigonometry and the rise of mathematical models of life and the universe. Along the way, he incorporates interesting biographical details making the book a fun read. Me. Bellos clearly marvels at the coincidences of numbers and the underlying rationality of mathematical systems. His enthusiasm is infectious. Do not skip,the footnote material where Mr. Bellos incorporates a lot of interesting etymology of mathematical terms and other historical facts."
28,1451640099,http://goodreads.com/user/show/16065798-sam,5,"Thoroughly enjoyed this 2014 book about numbers. Explains in plain English complex mathematical concepts, including historic and philosophical dimensions. Somewhere in the last 2-3 chapters I got quite out of my comfort zone and started to wonder - just what is mathematics good for? Is mathematics really of any relevance to my life anymore?But Alex Bellos was able to retain enough relatedness and good humour for the book to land despite the stretch at the end. If it lacked that stretch it might lack endurance as a book. Writers in STEM often take a particular perspective on the field, inevitable given the breadth and depth in the current era. Bellos is an Oxford graduate of Mathematics and Philosophy - a terrific combination, but he works as a numerate foreign correspondent in Argentina. He performed many interviews for this book.I did find the mathematics history and philosophy more interesting than some of the current advanced mathematics, and mathematicians. It seemed the more contemporary and refined the maths gets, the more 'odd' get the characters and concepts. Greatly enjoyed."
29,1451640099,http://goodreads.com/user/show/5717592-martin,4,"I can't get enough of these post-school mathematics books. This one focuses on exactly what the sub-title describes: how we're involved with numbers on a daily basis, how we interact with them, what they mean, how wonderful and elegant all of this is, and how excitingly self-referential the more you explore.This books goes a bit further than most in exploring the wacky gamesmanship lives of the several personalities who explored numerical phenomena and its manifold depths - and it barely scratched the surface. There's so much more to explore, and to know, and to apply.I think our school system has this all backwards. Books like *this* should be part of curricula, whetting appetites, and once whetted, a curious ambitious sort could grab a textbook and learn more if he or she wishes, and parlay to discovery and advancement.Would that it were so."
30,1451640099,http://goodreads.com/user/show/5433361-linda,4,"This title has been tantalizing me since I added it to my To-Read list in May 2014. Having finished it, I now feel a bit like Aesop's Fox (""The Fox and the Grapes""). Here are these beautiful mathematical truths (the ""grapes"") and I cannot grasp them all. I was familiar with some of them, such as pi, and e, and i (the square root of -1), and Euler's Identity (e^i*pi +1 = 0), but others were totally new or only marginally familiar. Not that the book was BAD, it just seemed to be written for professional mathematicians rather than laypeople. (What was really discouraging? The fact that, 49 years ago, I graduated from the University of Utah with a BA degree in mathematics. Guess I should have tried to keep up with advances in the field.)"
31,1451640099,http://goodreads.com/user/show/10174911-syed-ashrafulla,3,"This is meant to be a fun book about some of the more whimsical parts of mathematics. The problem for me is that it's too trivial. It's enough to look at the chapter on logarithms. Every three paragraphs ends with ""isn't this neat!?"" like it's a TV show. That doesn't belong in a book. Books are active engagement mediums, I'm already interested, sentences like those interrupt what is being told. It's the equivalent of breaking the fourth wall.I'm ok with the higher level descriptions and I believe laypeople can pick up the math. I just dislike the presentation and as a result the book."
32,1451640099,http://goodreads.com/user/show/8197573-kari,5,"I never thought I’d say I loved reading about math, but here we are. There are complex ideas in this book, ranging from geometry all the way to derivatives and integrals. With a basic understanding of math through calculus, this is a great book. It’s beautiful and fun and educational and funny all in one. He provides clear concise explanations, with appendices to explain more in depth if math wasn’t to it thing. He provides real life examples and takes you through history from Ancient Greece to computers. It’s amazing and I loved it. "
33,1451640099,http://goodreads.com/user/show/1849937-yofish,4,"A dozen (basically) independent chapters, each on a different math topic. A pretty good description for the layman. Lots of stories about the personalities involved. I liked how he would start a chapter with a fairly straightforward topic and just sort of let it lead to wherever it led. For example, negative numbers lead to imaginary numbers and eventually to the Mandelbrot set. Trigonometry leads to the measuring of Mount Everest. I also really liked the chapter on the Game of Life, which one doesn’t often see addressed in these “Math for the Layman” books."
34,1451640099,http://goodreads.com/user/show/119656859-the-book-grocer,5,"

Purchase Alex Through the Looking Glass here for just $12!

Translating complex mathematical concepts and ideas using examples across art and history to demonstrate how they apply to life and the world around us. You don’t need to be good at maths to be completely enthralled with this book. Hermann- The Book Grocer"
35,1451640099,http://goodreads.com/user/show/46616940-oscar-despard,5,"This is a fascinating book, which describes simply the mathematical concepts which govern our world. Bellos strikes the right balance between being patronisingly simplistic and being excessively professorial, and thus manages to create this compulsive read. The book’s explanations of famous mathematical concepts, interspersed with entertaining anecdotes, are accessible and mind-boggling in equal measure, and produce a book that could be recommended to anyone."
36,1451640099,http://goodreads.com/user/show/4764429-liz,3,"I really enjoy Bellos' writing (also having read his previous book Here's Looking at Euclid). I think he's really good at writing about math in a way that can be understood by a layperson (can't confirm since I have a math degree, but I THINK he does this well) but also doesn't lose the intricacies and rigor of the content described. He also makes really good math jokes. "
37,1451640099,http://goodreads.com/user/show/76492198-phil,4,"This is s great book if you like anything about science or math. You don’t need to be a savant to understand the concepts. I gave a copy to my sister in law, a math teacher, as I think some of the information might be used as special topics in a high school math class. It may just excite a few young minds to pursue math. "
38,1451640099,http://goodreads.com/user/show/82351125-eric,4,"Very good. Would have wanted it to go into more detail in places, but this is a very good place to start when trying to work out which areas you want to do further research into. Probably not quite as good as numberland. It’s also nice that it can be read without knowing any of the content in numberland."
39,1451640099,http://goodreads.com/user/show/7214023-jake-cooper,2,"Assumes readers are very novice at math (okay), and tries to make them say ""wow"" rather than ""aha"" (less okay). I much preferred his earlier Here's Looking at Euclid."
40,1451640099,http://goodreads.com/user/show/9764243-angela,4," A it more complicated from the math point of view that the first one, so I really need to take my time understand it ( it could not be read before going to bed ). Full of details about the live of mathematicians and insights about how they manage to make discoveries in a lot of math branches.I really liked the conclusion:""Math is, and always has been, a game. it's the game of life."""
41,1451640099,http://goodreads.com/user/show/315151-art-king,5,"Alex starts the book with ""Math is a Joke"" and ends with ""Math is a Game"". In between is a wonderful romp through the lives of the people who have illuminated many amazing mathematical things. The best science and discovery book I've read in a long while.																							"
42,1451640099,http://goodreads.com/user/show/55586171-kyle,5,"Great book on math for all backgrounds. If you don’t know math, it’s a good educational book. If you enjoy math and love it, it is quite interesting and intriguing; providing a deeper understanding and different perspective on some things with a lot of humor. Best math book I’ve read so far!"
43,1451640099,http://goodreads.com/user/show/72960748-ryan,4,"I picked up Grapes of Math long ago and finally sat down to read it. I wish I had been shown some of these chapters going through school, as I think it's eye opening. It's also quite interesting of a read for a math book."
44,1451640099,http://goodreads.com/user/show/7596560-stefan,2,"Not for everyone. If you already heard most of the stories, this will not grip you. If you don't have a basic grasp on math, this will go over your head. Maybe recommended for mid- to late school age?"
45,1451640099,http://goodreads.com/user/show/95713748-rolande,5,"Brilliant. If you love numbers, or maths, then you'll love this book. This is definately one of the best books I've ever read. Some parts are difficult to get your head round but the author does make allowances for this. "
46,1451640099,http://goodreads.com/user/show/20488652-catherine,4,"I loved this book, particularly the beginning (the ending probably gets a little too dense for me). It explores mathematical concepts and where they appear in nature and life. If you’re interested in mathematics but not in the field yourself, I recommend this book. "
47,1451640099,http://goodreads.com/user/show/44242100-mike-vandeman,5,"This is a fun read! It combines math with math history. This is the kind of book that, were I a kid again, would make me want to study math. This is math at its best, without the pain."
48,1451640099,http://goodreads.com/user/show/68410895-naomi-johnson,5,"I love how Alex Bellos writes so passionately about maths, and shows his readers how interesting and exciting maths is."
49,1451640099,http://goodreads.com/user/show/30437725-jon,5,Loved the cell automaton chapter
50,1451640099,http://goodreads.com/user/show/51051584-linda,4,"I enjoyed this book---a little bit of math history, psychology, and computation. The writing and drawings were clear and helpful."
51,1451640099,http://goodreads.com/user/show/10485390-laura,4,"This intriguing math book has everything from stories I️ now use to tell 5th graders about math, to concepts I️ can’t possibly understand. I️ want to read more by this engaging author. "
52,1451640099,http://goodreads.com/user/show/233296-chris,5,Outstanding book that will spark your curiosity in math. Bellos does a great job of explain complex math concepts in understandable terms.
53,1451640099,http://goodreads.com/user/show/2791785-jason-keglovitz,4,Far better than the typical pop-math book
54,1451640099,http://goodreads.com/user/show/10887408-sweemeng-ng,5,Very good good book on the introduction to maths. If I read this book in school I probably will develop more interest in maths. 
55,1451640099,http://goodreads.com/user/show/14404332-sara-goldenberg,5,"Oh myyyy. Now that’s a book!!!! He’s funny, he’s interesting, and he writes well. Can’t wait to read his other work!!!"
56,1451640099,http://goodreads.com/user/show/31018321-jenna,5,It takes a lot of talent to make a book about the history of trigonometry not boring. 
57,1451640099,http://goodreads.com/user/show/31737525-nestor-mata-cuthbert,5,An entertained and interesting journey through math.The way the author goes through concepts and present them opens new perspectives to what we learned years ago.
58,1451640099,http://goodreads.com/user/show/5254180-atti,5,"One of the best books I read so far, wish i had found it sooner. I read the UK edition 'Alex through the looking glass'"
59,1451640099,http://goodreads.com/user/show/27365529-ivan-taylor,5,"I loved this book. Having done my undergraduate degree in Mathematics and working for 33 years in Operational Research, I knew some of these stories but others were new to me and fascinating."
60,1451640099,http://goodreads.com/user/show/5433361-linda,4,"This title has been tantalizing me since I added it to my To-Read list in May 2014. Having finished it, I now feel a bit like Aesop's Fox (""The Fox and the Grapes""). Here are these beautiful mathematical truths (the ""grapes"") and I cannot grasp them all. I was familiar with some of them, such as pi, and e, and i (the square root of -1), and Euler's Identity (e^i*pi +1 = 0), but others were totally new or only marginally familiar. Not that the book was BAD, it just seemed to be written for professional mathematicians rather than laypeople. (What was really discouraging? The fact that, 49 years ago, I graduated from the University of Utah with a BA degree in mathematics. Guess I should have tried to keep up with advances in the field.)"
61,1451640099,http://goodreads.com/user/show/10174911-syed-ashrafulla,3,"This is meant to be a fun book about some of the more whimsical parts of mathematics. The problem for me is that it's too trivial. It's enough to look at the chapter on logarithms. Every three paragraphs ends with ""isn't this neat!?"" like it's a TV show. That doesn't belong in a book. Books are active engagement mediums, I'm already interested, sentences like those interrupt what is being told. It's the equivalent of breaking the fourth wall.I'm ok with the higher level descriptions and I believe laypeople can pick up the math. I just dislike the presentation and as a result the book."
62,1451640099,http://goodreads.com/user/show/8197573-kari,5,"I never thought I’d say I loved reading about math, but here we are. There are complex ideas in this book, ranging from geometry all the way to derivatives and integrals. With a basic understanding of math through calculus, this is a great book. It’s beautiful and fun and educational and funny all in one. He provides clear concise explanations, with appendices to explain more in depth if math wasn’t to it thing. He provides real life examples and takes you through history from Ancient Greece to computers. It’s amazing and I loved it. "
63,1451640099,http://goodreads.com/user/show/1849937-yofish,4,"A dozen (basically) independent chapters, each on a different math topic. A pretty good description for the layman. Lots of stories about the personalities involved. I liked how he would start a chapter with a fairly straightforward topic and just sort of let it lead to wherever it led. For example, negative numbers lead to imaginary numbers and eventually to the Mandelbrot set. Trigonometry leads to the measuring of Mount Everest. I also really liked the chapter on the Game of Life, which one doesn’t often see addressed in these “Math for the Layman” books."
64,1451640099,http://goodreads.com/user/show/119656859-the-book-grocer,5,"

Purchase Alex Through the Looking Glass here for just $12!

Translating complex mathematical concepts and ideas using examples across art and history to demonstrate how they apply to life and the world around us. You don’t need to be good at maths to be completely enthralled with this book. Hermann- The Book Grocer"
65,1451640099,http://goodreads.com/user/show/46616940-oscar-despard,5,"This is a fascinating book, which describes simply the mathematical concepts which govern our world. Bellos strikes the right balance between being patronisingly simplistic and being excessively professorial, and thus manages to create this compulsive read. The book’s explanations of famous mathematical concepts, interspersed with entertaining anecdotes, are accessible and mind-boggling in equal measure, and produce a book that could be recommended to anyone."
66,1451640099,http://goodreads.com/user/show/4764429-liz,3,"I really enjoy Bellos' writing (also having read his previous book Here's Looking at Euclid). I think he's really good at writing about math in a way that can be understood by a layperson (can't confirm since I have a math degree, but I THINK he does this well) but also doesn't lose the intricacies and rigor of the content described. He also makes really good math jokes. "
67,1451640099,http://goodreads.com/user/show/76492198-phil,4,"This is s great book if you like anything about science or math. You don’t need to be a savant to understand the concepts. I gave a copy to my sister in law, a math teacher, as I think some of the information might be used as special topics in a high school math class. It may just excite a few young minds to pursue math. "
68,1451640099,http://goodreads.com/user/show/82351125-eric,4,"Very good. Would have wanted it to go into more detail in places, but this is a very good place to start when trying to work out which areas you want to do further research into. Probably not quite as good as numberland. It’s also nice that it can be read without knowing any of the content in numberland."
69,1451640099,http://goodreads.com/user/show/7214023-jake-cooper,2,"Assumes readers are very novice at math (okay), and tries to make them say ""wow"" rather than ""aha"" (less okay). I much preferred his earlier Here's Looking at Euclid."
70,1451640099,http://goodreads.com/user/show/9764243-angela,4," A it more complicated from the math point of view that the first one, so I really need to take my time understand it ( it could not be read before going to bed ). Full of details about the live of mathematicians and insights about how they manage to make discoveries in a lot of math branches.I really liked the conclusion:""Math is, and always has been, a game. it's the game of life."""
71,1451640099,http://goodreads.com/user/show/315151-art-king,5,"Alex starts the book with ""Math is a Joke"" and ends with ""Math is a Game"". In between is a wonderful romp through the lives of the people who have illuminated many amazing mathematical things. The best science and discovery book I've read in a long while.																							"
72,1451640099,http://goodreads.com/user/show/55586171-kyle,5,"Great book on math for all backgrounds. If you don’t know math, it’s a good educational book. If you enjoy math and love it, it is quite interesting and intriguing; providing a deeper understanding and different perspective on some things with a lot of humor. Best math book I’ve read so far!"
73,1451640099,http://goodreads.com/user/show/72960748-ryan,4,"I picked up Grapes of Math long ago and finally sat down to read it. I wish I had been shown some of these chapters going through school, as I think it's eye opening. It's also quite interesting of a read for a math book."
74,1451640099,http://goodreads.com/user/show/7596560-stefan,2,"Not for everyone. If you already heard most of the stories, this will not grip you. If you don't have a basic grasp on math, this will go over your head. Maybe recommended for mid- to late school age?"
75,1451640099,http://goodreads.com/user/show/95713748-rolande,5,"Brilliant. If you love numbers, or maths, then you'll love this book. This is definately one of the best books I've ever read. Some parts are difficult to get your head round but the author does make allowances for this. "
76,1451640099,http://goodreads.com/user/show/20488652-catherine,4,"I loved this book, particularly the beginning (the ending probably gets a little too dense for me). It explores mathematical concepts and where they appear in nature and life. If you’re interested in mathematics but not in the field yourself, I recommend this book. "
77,1451640099,http://goodreads.com/user/show/44242100-mike-vandeman,5,"This is a fun read! It combines math with math history. This is the kind of book that, were I a kid again, would make me want to study math. This is math at its best, without the pain."
