,isbn,user_link,ranking,review
0,0896087794,http://goodreads.com/user/show/22591633-zanna,5,"The most important teaching in these pages is that there is no coming technofix for climate change: the tech is here, we have the tech, and further developments will only be made if economic pressure throws the awesome power of human ingenuity behind making them. What is needed to create that pressure is political will, nothing else. From economic perspective, Tim Jackson points out more or less the same thing in Prosperity Without Growth.Monbiot exposes the sneaky tactics (astroturfing, bribing famous people etc) that multinationals use to spread bare-faced malicious LIES about climate change. The doubt-mongers really are paid to spread fake stats and attack environmental campaigners.He advocates the contraction and convergence strategy and calls for carbon rationing. His reimagining of Britain's transport infrastructure particularly struck my imagination, so much so that my brother painted a picture of it for me..."
1,0896087794,http://goodreads.com/user/show/11104899-dan,5,"A well written, well-informed and, crucially, well-sourced book. Hardly a point is made without a footnote, and this is essential as Monbiot has to convince his reader that everything he is saying is founded in reality. To my knowledge he is one of very few who has made the assertion that it is not too late to tackle Climate Change AND demonstrate how it can be done. It drives him to an unpalatable conclusion: that government has to take control and force change upon society, something few politicians have the guts to do. There are some shocking revelations here too, such as the changing of energy efficiency ratings at the behest of white goods manufacturers, which amounts to deceiving the public of all European nations."
2,0896087794,http://goodreads.com/user/show/719200-micah,5,"This is the most important book I have ever read, and I encourage everyone to deeply consider the points Monbiot has exhaustively researched and lucidly described. No issue today compares in importance to climate change - everything else is made irrelevant if it is not tackled. Monbiot illustrates why this is and what must be done to combat it. He is deeply sympathetic to the condition of industrialized societies, yet appropriately harsh and realistic. I honestly cannot stress enough the brilliance of Heat and how essential it is that we adopt Monbiot's proposals."
3,0896087794,http://goodreads.com/user/show/178249-edward-kidder,4,Monbiot argues emissions must be reduced 90% by 2030 and shows how we can do it in several areas. Well written with passion and humor. Cement was a surprise. A ton of CO2 for a ton of cement cured. Who knew? Air travel was the only category with no constructive suggestions. He gets at the core of the matter for those of us using more than our share-- we need to learn to adapt voluntarily.
4,0896087794,http://goodreads.com/user/show/204822-betsy-stubblefield,5,This is an essential book for anyone who cares about the planet and social justice... so that should be everyone.
5,0896087794,http://goodreads.com/user/show/1500718-ryan,4,"Monbiot gives out very little sugar with his pronouncements. He considers the notion that the only way to reduce carbon emissions by 90% is to live in what is described as a third world country. Thinking that modernity is mostly quite nice, Monbiot sets out in this book to see if he can design a way to reduce carbon emissions by 90% without reducing quality of life. A 90% reduction in emissions? If this sounds alarmist, Monbiot starts from the position that most government documents twist science to sound less dire because ""if they adopted the position determined by science rather than the position determined by politics, no one would take them seriously."" Having said that, because people are not going to sacrifice the many fossil fuelled comforts of modernity, he favors regulation. Even here, Monbiot is less than enthusiastic:""But the thought that worries me most is this. As people in the rich countries--even the professional classes--begin to wake up to what the science is saying, climate-change denial will look as stupid as Holocaust denial, or the insistence that AIDS can be cured with beetroot. But our response will be to demand that the government acts, while hoping it doesn't. We will wish our governments to pretend to act. We get the moral satisfaction of saying what we know to be right, without the discomfort of doing it.""The notion that a majority of people will just become some form vegans, vegetarians, flexitarians, or pescatarians, for example, is in other words unrealistic. But what is the difference between this expectation and placing hope in mass movements or grassroots movements or punching up movements that would lead to the election of leaders who would endorse the sort of massive regulation Monbiot calls for here? I note a similar phrasing of this argument from Klein, David Roberts, and Bill McKibben, but if people won't reduce their consumption, why should we predict that they'll vote for it?By the way, I don't ask this question in order to imply market based solutions will save us. When it comes to buildings, for example, Monbiot points to efficient designs that could be adopted but that aren't because there is little market incentive to pay for them. But what about efficiency? Monbiot cites the Khazzoom-Brookes Postulate, which if I understand it correctly, suggests that as we increase energy efficiency, people use more energy. The money saved is spent elsewhere, maybe in consuming more energy. This was both the first time I'd encountered this theory as well as the first time I've encountered 'postulate' used as a noun.For the most part, he reaches his 90% goals, except when it comes to aviation. In the end, Monbiot concludes that people will have to mostly give up long-distance travel. Given that ""I travel the world and have been to every continent"" has become a sort of lifestyle declaration, I worry that this will be a tough nut to crack.Heat was published in 2007. Much of its commentary on denialism is backed up in Merchants of Doubt (2010). I'd love to see an update on these chapters. The Tesla batteries seem unexpected by this writing, as does battery development in general. Natural gas has increased relative to coal, though Naomi Klein notes that its production releases methane, so perhaps we're not as far ahead as we might have hoped. Methane is being released from the tundra, so his worries about positive feedback loops have begun. Nevertheless, there is a willingness to get into the weeds in this book that I admire and that I'd welcome in more of these climate change books."
6,0896087794,http://goodreads.com/user/show/21158516-ron-joniak,4,"An extremely well written book where Monbiot offers a plan to drastically cut our current carbon footprint by examining our transportation systems (cars / airplanes / boats), houses and construction infrastructure, energy, and distribution of goods. In all parts of the book, the author offers a fair and balanced review of the current technology on hand and the political and economical structures available. Unfortunately, many of the solutions Monbiot offers is not currently being implemented, likely as (he admits) they will cause many disruptions in our everyday life that we have come to cherish.This book left me feeling more pessimistic about society, especially considering that this book is now dated. Regarding Monbiot's plan here, one thing he did not take into consideration was the displacement of workers in his plans. He suggests shutting down airfare travel quite drastically (as airlines are highly detrimental to the planet and we currently have no real alternative), shutting down superstores/large grocery stores (and instead, having some mix of delivery services and local shops), and finding ways to keep cars off the roads (many people depend on truck driving/cars for their jobs). While, I agree that all of these things NEED to happen, Monbiot makes no mention of the elephant in the room here. The elephant I speak of is capitalism. Capitalism, in its current form, will not allow us to live the type of world Monbiot envisions. I think, deep down, he knows this too. In any case, this is a fantastic read, and you WILL learn something by reading this book. It's just a tad bit dated now and unfortunately, gave me a very pessimistic look on climate change (note: I had a pessimistic view going into this read). "
7,0896087794,http://goodreads.com/user/show/22378179-simon-wood,5,"MONBIOT'S MANIFESTO George Monbiot's Guardian columns are always well worth reading, as was his well received and best selling book on the links between big business and the state in Britain (""Captive State""). ""Heat"", whose subject matter is global warming, is likewise a well written, and informative read, dealing with some of the issues thrown up by the dangers of climate change.The book begins by summarising the state of scientific knowledge at the time of its initial publication in 2006, and how this bears on the reductions of greenhouse gas emissions required in a country such as ours in order to make a fair share in reducing the risk of damaging global climate change. The result appears to be a reduction of 90% by 2030. Before moving on to the important questions of how this can be achieved, Monbiot takes time out for an entertaining look at what he terms the ""denial industry"". Publications such as the Daily Telegraph and the Daily Mail seem to be the leading sites for those who are keen to rubbish climate change, among the authors he cites are leading climatologists Melanie Phillips, Peter Hitchens, and most disturbingly of all for those of us who have fond memories of him from childhood, David Bellamy. Bellamy is apparently now a campaigner who vigorously denies the possibility of climate change, some of the information cited in his Daily Mail Article (""Global Warming? What a Load of Poppycock!"") came from millionaire American Lyndon Larouche's publication ""21st Century Science and Technology"" - other propositions that Larouche has supported over the years include the notion that the Royal Family is running an international drugs syndicate, and that Jewish bankers control the British Government. One wonders if fellow Daily Mailist Mad Mel knows about this last one? One wouldn't have thought it was amongst her favourite causes?The main body of the text involves examining a number of sectors of the economy including housing, transport, power generation, airlines, retail and industry and looking at what could be done to meet the targets that science appears to indicate. Monbiot's aim, which some in the environmental movement may find controversial, is to look at each sector individually and work out how they could meet the targets with the minimal amount of change to their functioning, and by association to the functioning of the economy as a whole. With the exception of the airline industry, which he would drastically curtail, his proposed solutions appear to meet those criteria.This is an interesting book that clearly brings into the public debate a serious set of proposals for limiting the possibility of climate change occurring while minimising the effects on the way we live now. No doubt climate change doubters, and those whose pecuniary interests seem to compel them to muddy the water (primarily the oil, coal and automobile industries), will scoff at Monbiot's efforts; but even if their doubts were to be taken seriously, the desirability of reducing our reliance on finite energy resources ought to be sufficient reason for making the changes, or changes that are just as effective, in reducing our output of greenhouse gasses. A book I'd well recommend to anyone with an interest in this issue, which going on the current scientific evidence, should be all of us."
8,0896087794,http://goodreads.com/user/show/8176218-cedric-jean-marie,4,"Having read quite a few books on the subject I approached this book thinking that I would reinforce what I already knew and while there was definitely some familiar subject matter I was pleasantly surprised to find that within it's pages are detailed steps to curtail global warming by addressing the greatest contributors to the warming of the planet.The author acknowledges that much of what he proposes must be broached by the political leaders of the world through rigid policies strong leadership he does not explain how the various countries can go about implementing any of his recommendations. What he does tackle is setting a target of reducing carbon emissions by 90 percent by 2030 by various improvements in the way we do things as well as reducing or eliminating certain activities in order to achieve the goal. I learned a lot of interesting things in the book and have become more wary of bold claims, achieving a carbon cap of 0.33 tonnes per person is not an easy matter and anyone who professes to have an easy way out is often selling something. The book also opens your eyes to frivolousness of our society and how we've come to accept it as normal. The biggest shock was the chapter on flights, if what he suggests is true many people in the developed countries are going to have a hard time adapting given that we all aim to please ourselves rather than think of others welfare where our actions are concerned. I have a hard time seeing our country develop the political will to meet the targets described in this book considering the current leaders in charge and the widespread ignorance on the subject and I for one don't see either of those two things changing in the near future. 2030 isn't very far away and with so much work and change to implement are we all just doomed like all other civilizations before us. It's sad to see a race incapable of learning from it's mistake and worse some of them breeding doubt and lies where there ought to be clarity and action.If you are interested in trying to make a difference give this book a go, chances are you were already aware of the issue, those who should be paying attention will unfortunately not read this book or any others on this subject. They'll get the summaries just so they can say they are educated on the subject in order to continue to manufacture doubt."
9,0896087794,http://goodreads.com/user/show/609777-mainzer,2,"How many light bulbs do we need to change in order to save the planet? None, points out Monbiot, so its too late, we're doomed! Unless we reduce carbon emissions by 90% by 2030 which is of course completely unthinkable. The US war machine will probably still be on overdrive all over Mesopotamia in 2030. George positions himself as a somewhat fanciful alchemist coming up with lots of totally implausible measures - like no more flying - to put a break on global warming. There are a few good diehards who are prepared to make the necessary sacrifices but the great majority, of course not. As George points out the campaign to save civilization is a campaign not against other people but against ourselves. And ""we"", are our own worst enemy. Meanwhile, the corporations and the wealthy are arming themselves for the future, buying water rights, privatizing all the natural resources, putting enclosures around everything, building fortresses, and are probably prepared to let a few billion undesirables perish to save themselves.The tragedy of Monbiots book is that he still talks in terms of ""us"", the people of the world, the United Nations, how ""we"" can save the world, when the captains of industry and those in first class have already drawn up their contingency plans. For the rest, it will be a fight for survival and the possibility of all out class war.PS: Me and my boy will be holed up in the Zapatista autonomous zone where at least the Zapatistas have control over food production, water supplies and a potential army of self defense."
10,0896087794,http://goodreads.com/user/show/1823794-jeff,4,"We've got to do something about global warming. This book outlines the high carbon producing sectors of our daily lives, from industry, transportation, farming, and the costs associated with cutting CO2 emissions by 90%.The author calls for improved home insulation/heating systems, an end to air travel, more local and seasonal farming, ""carbon rationing"", wind power generation, more mass transport and carbon sequestration.The final technology has been proven in limited cases (to extract oil from rock), so the case is offered that if the technology were extended as a necessary measure for companies, it would be viable.Most environmentalists and environmental groups seem to not actually take action on this problem seriously, or they only look at a small set of facts. They are merely lobbying for aesthetic changes. The author is also highly critical of carbon trading schemes proposed by the Kyoto Protocol, which have now been proven to not work.The bottom line is that unless world governments tackle this problem together, and impose and strictly enforce a lot of the ideas in this book, we're going to see a 2 degree C rise in temperatures by 2030, which is enough to cause major environmental catastrophe.The author then goes to say that we'll have a major environmental catastrophe by 2030, but we'll have a major global economic depression in addition if we hit peak oil before that time.All in all, this was probably the most comprehensive 12 step program off of carbon that I've ever seen published."
11,0896087794,http://goodreads.com/user/show/7487165-stinaz,3,"Well written coverage of a number of behavioural, cultural and political changes that could be made to combat a uncomfortable level of climate change. Monbiot suggests that a 90% reduction in C02 emissions is needed to stop global warming from taking off to unsuitable levels. I tend to agree, but the stats and science he used (or at least how he showed it) didn't quite seem to provide as much statistical evidence for that position as I would have liked. Similarly all of his ideas on how to cut emissions from various activities by 90% didn't seem to have the proof that those suggestions would equate to a 90% cut. Overall, he covered a lot of different aspects and all the important ones when it comes to reducing greenhouse gases and climate change. He also had some good points that we need drastic cuts and not the weak efforts of Kyoto etc. I just think he could have backed up the arguments with more stats on exactly how those ideas get us to 90% cuts. I think that he has the scientific research backing to prove it, he just didn't quite make those connections in the book. Still would recommend.Best take-away message - that politicians and governments are happy to vocalise their concern for climate change and sustainability, but not worried about making change because people are too comfortable in their high emission lives to do anything about it. In other words, people are more inclined to say that they want change than to actually accept change themselves."
12,0896087794,http://goodreads.com/user/show/1768003-sam,4,"Following the dismissal attempts by the world's politicians to reach some kind of agreement at last year's (2009) climate change summit, this book makes very interesting reading. Not only does Monbiot address what needs to be done on a global scale to reduce carbon dioxide in the atmosphere below 450ppm (parts per million), which is the level needed to prevent run away global warming and a unmitigated ecological and global disaster, he also addresses why governments are so slow to actually take action (if they do at all).Monbiot has provided an objective look at each of the main sectors that contribute to carbon emissions and how these can changed through technology and changes in usage (including individually) to reduce emissions. The only problem with many of his suggests, as he happily (or should I say un-happily) admits himself, is that many of his suggests needs politicians to make changes that neither we nor big business will particularly enjoy or be happy about, which lets face it is not something politicians are ever likely to do. This book should have been compulsory reading at that failed climate summit, and had it have been the outcome could've have been very different. Let's hope they find it in time for the next one."
13,0896087794,http://goodreads.com/user/show/4687255-cambridge-programme-for-sustainability-leadership,5,"One of Cambridge Sustainability's Top 50 Books for Sustainability, as voted for by our alumni network of over 3,000 senior leaders from around the world. To find out more, click here.Heat begins by making a powerful and compelling case that climate change is a threat to be taken extrememly seriously and is caused by human-made emissions. Exacerbating the problem is what Monbiot calls the 'denial industry': an active campaign of dissuasion by certain sectors of business, wealthy classes, media and governments to deny climate change with bold assertions based on poor science, often financed by the corporations. The result is that the public remains confused or sceptical and the politicians feel dismepowered to take the bold action that is needed."
14,0896087794,http://goodreads.com/user/show/1960544-rob-manwaring,5,"Monbiot on top form, and really quite worrying predictions about the lack of political will to tackle climate change. Monbiot is exhaustive in his pursuit of seeking solutions to reduce carbon emissions by 90% by 2030. And frankly, we're not going to make it. The section on nuclear power was surprising, as was the analysis on coal and 'carbon capture' technologies. My favourites though were his prescriptions for the transport sector. The notion of using Storkey's coach network was inspired, as was the role for airships for short haul flights. And he was right, the section on cement was dull. Read it, people. "
15,0896087794,http://goodreads.com/user/show/838641-amy,3,Always weird to read a book 15 years after it was published about climate change and have the reaction of ‘wow you thought it was bad then? Wait till you get to 2018!’ Does not hold up with test of time and I imagine future generations would view his suggestions as naive at best. 
16,0896087794,http://goodreads.com/user/show/12377782-emma,5,Everyone should read this
17,0896087794,http://goodreads.com/user/show/89796323-viktoria-tomcheva,5,"Heat: How to Stop the Planet From Burning marks an important moment in our civilization’s thinking about global warming. The question is no longer Is climate change actually happening? but What do we do about it? George Monbiot offers an ambitious and far-reaching program to cut our carbon dioxide emissions to the point where the environmental scales start tipping back—away from catastrophe. Though writing with a ""spirit of optimism,"" Monbiot does not pretend it will be easy. The only way to avoid further devastation, he argues, is a 90% cut in CO2 emissions in the rich nations of the world by 2030. In other words, our response will have to be immediate, and it will have to be decisive. In every case he supports his proposals with a rigorous investigation into what works, what doesn’t, how much it costs, and what the problems might be. He wages war on bad ideas as energetically as he promotes good ones. And he is not afraid to attack anyone—friend or foe—whose claims are false or whose figures have been fudged. After all, there is no time to waste. As Monbiot has said himself, ""we are the last generation that can make this happen, and this is the last possible moment at which we can make it happen."" George Monbiot is the best-selling author of The Age of Consent and Captive State, as well as the investigative travel books Poisoned Arrows, Amazon Watershed, and No Man’s Land. In 1995, Nelson Mandela presented him with a United Nations Global 500 Award for outstanding environmental achievement. He has held visiting fellowships or professorships at the universities of Oxford (environmental policy), Bristol (philosophy), Keele (politics), and East London (environmental science). Currently visiting professor of planning at Oxford Brookes University, he writes a weekly column for the Guardian newspaper. "
18,0896087794,http://goodreads.com/user/show/91011051-m-e-rolle,5,"Monbiot is one of the few writers today who get it and don’t mince words. I wish I could get everyone I know to read this book and others he’s written, so they finally truly understand. When the proof is too real for anyone to ignore, it will be far too late to act. "
