,isbn,user_link,ranking,review
116,145162445X,http://goodreads.com/user/show/193310-brian,4,"the baked-in problem is that this explanation of how 'something' can emerge from 'nothing' must accept that 'nothing' operates by laws of quantum gravity. is this truly 'nothing'? shit, i dunno. krauss touches on this as admirably as possible. but i guess i should also throw quotations around 'possible', eh? and there's the problem. "
117,145162445X,http://goodreads.com/user/show/1374596-blarg,0,"This book was unexpectedly disappointing. As a non-scientist who reads extensively about cosmology, particle physics, and quantum mechanics, I wasn’t surprised that the author spent the first 142 pages of his book rehashing what we know so far about the formation and evolution of our universe and its component structures. Some of the information is quite recent, and I expected the foundational knowledge to be important to understanding the argument and evidence that would presumably follow.Unfortunately, I was fairly well stunned (and disappointed) that he then blithely extrapolated one known phenomenon into a wildly different context with barely an acknowledgement of how different it is, and then declared victory in a ridiculous and unnecessary argument with theists.It is true that we know from recent experiments that what we long thought of as “empty space” beyond the edges of our solar system is not “nothing.” Even places in deep outer space that are truly empty of any dust or molecules are still physical structures that are capable of holding matter – similar to how an empty shoe box is still a physical box.We all know that shoe boxes are made from cardboard, and we now know that space itself is made of a seething sub-microscopic “quantum foam” that contains vast amounts of energy and strangeness. (See http://www.scaleofuniverse.com/)Quantum mechanics also tells us that inside this quantum foam, at the tiniest microscopic level, all sorts of particles and anti-particles are constantly winking into and out of existence. The author describes on page 154 that under the right circumstances, two charged plates can be brought close enough together such that a “real particle-antiparticle pair can “pop” out of the vacuum, with the negative charge heading toward the positive plate and the positive charge toward the negative one.”As crazy as this sounds, we know from Einstein’s famous equation that energy and mass are essentially interchangeable. They are different manifestations of the same thing, and under the right circumstances (such as nuclear fusion), we can convert matter into huge amounts of pure energy such as nuclear weapons.These same principles suggest it is entirely reasonable for energy to turn into particles (mass), and the author presents a compelling case of how the math works out fine when an equal balance of particles and antiparticles pop into existence, because they represent zero net energy. (Imagine having two bank accounts with zero balances and then electronically transferring one dollar from one account to the other. Suddenly one account has one dollar and the other account has a negative balance of one dollar.)Unfortunately, this is where the author makes a leap of faith that I simply can’t follow. He concludes that because it is probable (or even certain) that miniscule quantum particles and antiparticles pop in and out of existence inside our spacetime, it must follow that it is possible or probable that the same thing happens outside of spacetime – in a manner that allows for the creation of a quantity of spacetime that is so huge as to be literally mind-boggling.(Our Milky Way galaxy contains approximately 300 billion stars, and is so vast that it would take a rocket ship (traveling 500 miles per hour) more than 147 billion years just to cross the Milky Way. And our galaxy is one of more than one hundred billion galaxies in the universe.)After making the case that it is possible for universes to pop into existence so long as they have zero total energy, the author completely fails to explain why our universe seems to have far more matter than antimatter. I was expecting him to say there must be vast amounts of antimatter beyond our view , but he instead provided a head-scratching explanation of how the imbalance could have come to be – without addressing the fact that such an imbalance flies in the face of everything he postulated about the primacy of zero energy systems.Near the end of the book the author unintentionally shows how weak his arguments are when he comes right out and claims that it is a “fact” that “in quantum gravity, universes can and indeed always will spontaneously appear from nothing.” It may be true that this is so in some version of the speculative (and unquestionably incomplete) theory of quantum gravity. But it certainly is not a fact and the author’s presentation of it as one is emblematic of the sloppy reasoning found throughout his book.Finally, a grudging word about the book’s discussion of religion. I am embarrassed for everyone that a book dedicated to exploring cosmology and scientific principles spends so much time pointing out how the overwhelming huge mountain of scientific facts (based on easily repeatable experiments) conflicts with the mix of inconsistent ancient myths that comprise monotheistic religions.From my perspective, ""religion versus science"" isn't a conversation worth having because religion brings nothing testable to the table. Religion isn't even the equivalent of a spoon at a knife fight. (It's more like claiming a cupcake is a great life preserver while living in the desert, far from water.)I would have greatly preferred that the author split this book into three books. One being his robust and excellent discussion of modern cosmology, the second being a more logical explanation of his theory of nothingness, and the third being a scientific evisceration of the myths of theistic religions. Having read the book the author wrote, however, it is clear to me now that he (and/or his publishing company) intended to pick a fight with religion in order to generate buzz, controversy, and sell more books.He should have spent more time explaining and defending his central theory, and laying out the case for the next generation of scientific experiments that we should perform in order to prove or disprove his theory."
118,145162445X,http://goodreads.com/user/show/23888196-rama,5,"Is it true that the laws of physics allow creating something out of an empty space?This is one of the best books I have read in recent years that summarizes the laws of physics and the origin of the universe in a splendid manner. The author describes as how our universe was created out of nothing; just an empty space with virtual particles using quantum physics and relativity without invoking string or brane theories.Moments after the big bang, a slight asymmetry in the distributions of matter and antimatter resulted in our universe. This asymmetry was extremely minute, one part in a billion, which means that there were approximately one billion photons for every proton (matter) in the universe, which is still found in the cosmic microwave background radiation (CMBR), remnants of the glow of early universe; the moment after matter-antimatter annihilation occurred. The essence of the book is that the application of the laws of quantum physics and relativity to physical reality produces facts that stun common sense. The reader begins to appreciate the author's argument and the physical laws that support it. The author also has a humorous look at the nature of things while discussing strangeness of quantum physics. At several instances he jabs at politicians, leaders of corporations, and men who profess to preach God, with hard facts of physics.A summary of the book is as follows: When a balloon gets blown up larger and larger at a fast pace, the curvature at its surface gets smaller and smaller, closer to being flat. A similar mechanism called inflation lead the early universe into a long lived universe removing all its curvature. The cosmic inflation is a period rapid of exponential expansion of our universe, moments after its birth. As the energy of empty space is converted into the energy of something, the universe was driven closer and closer to being essentially flat on all observable scales. Secondly, the laws of quantum physics imply on very small scales for very short times, empty space is a boiling bubbling brew of virtual particles with wildly fluctuating fields. These quantum fluctuations ended the period of exponential expansion during inflation. That is, different regions of the early universe stopped inflating at slightly different times and the density of matter and radiation were slightly different. These small fluctuations in the density of matter resulted in gravitational collapse to form galaxies, and later stars. It is the quantum fluctuations of empty space, the quantum nothingness that evolved into cosmos. If a closed universe had been created (with curvature); it would have collapsed on its own gravity, leaving nothing. A flat universe mediated by inflationary expansion led to a long lived universe.Virtual universes that pop in and out of existence, within a very short time, are interesting theoretical constructs. The virtual photons carry zero energy, and they do not violate energy conservation or Heisenberg's Uncertainty Principle. Hence the formation of virtual particles from empty space is in accordance with laws of physics. The dynamics and the nature of things are not as simple as they appear from Newtonian laws of physics. For example, when an object is moving through space, the space itself evolves with time and the terms of present and future becomes relative and not absolute, according to relativistic physics, and the laws of quantum physics applies not only to physical properties of objects but space itself.The phenomenon of Hawking-radiation applies quantum physics to a classical entity such as black hole and this study reveals that a black hole can radiate virtual particles. Due to quantum fluctuation in its vicinity, just outside the event horizon, one of the partner particle falls inside the event horizon and loose its gravitational energy; the other partner particle will fly off to infinity clearly visible in the universe without violating in the laws of the energy conservation. The total positive energy of this particle is compensated by its twin particle's lost energy. Thus the black hole is able to radiate particles. The net effect of a particle falling inside the black hole results in its lowering of energy than before. This process progressively results in a black hole less and less energy and finally the black holes disappear out of existence. Thus the reality of something coming out of nothing during the beginning of the universe or something going out of existence from something is real.For every effect there is a cause, but what was there before the first cause? Vedanta philosophy reasoned from this conundrum that the universe and God must be eternal. There is no first cause, in fact causes go backwards and forwards in all directions. There is no beginning and no end. Physics offers a more convincing argument for the concept of God in the idea of multiverse. According to this, our universe is one of the several billions of universes, each with its own set of physical laws and physical reality. The fundamental forces and universal constants are not unique in multiverse physics and anthropic principle is unnecessary. Only the inhabitants of a universe can see and experience their universe, but God as an entity can see and experience all the universes"
119,145162445X,http://goodreads.com/user/show/635936-jeremy,5,"lawrence krauss' new book, a universe from nothing: why there is something rather than nothing, summarizes the continuing developments in the field of cosmology. in addition to championing these new insights in the study of modern physics, krauss also frames these advances in the appropriate context of their resulting implications for theologians and deists. adapted from a lecture he delivered at the 2009 atheist alliance international annual convention (and made popular on youtube), a universe from nothing explores the history of the universe from the big bang through inflation to its theoretical endpoint using the most current (and widely accepted) science.krauss is marvelously adept at conveying his broad scientific knowledge in as succinct and lucid a manner as is perhaps possible, making it relatively easy for a non-theoretical physicist to grasp the concepts he is attempting to illustrate. among the more notable and recent advancements that krauss examines in the book are the discoveries that the universe is now accelerating following the so-called ""cosmic jerk"" that took place some five billion years ago (see also 2011 nobel prize in physics), the abundance of dark energy that appears to account for nearly three-quarters of the universe's total mass (that resides mostly in ""empty space""), and the uniform flatness that characterizes our universe. the majority of the book is spent assembling and explaining the related pieces that together form a picture of the universe which, according to the latest scientific data, seems to have evolved from nothing- in fact, may have only been able to evolve precisely because there was nothing.
the ultimate arbiter of truth is experiment, not the comfort one derives from one's a priori beliefs, not the beauty and elegance one ascribes to one's theoretical models. the results of experiments that i will describe here are not only timely, they are also unexpected. the tapestry that science weaves in describing the evolution of our universe is far richer and far more fascinating than any revelatory images or imaginative stories that humans have concocted.
as our understanding of the nearly 14 billion-year-old universe is constantly evolving, there is clearly much to be learned about cosmology. krauss is enthusiastic in his dissemination of the accumulated knowledge, and seems eager to welcome whatever conceptual refinements future advancements will inevitably bring. a universe from nothing is not simply a scientific treatise however, as krauss considers the ramifications these new insights have on age-old theological arguments.
for more than two thousand years, the question, ""why is there something rather than nothing?"" has been presented as a challenge to the proposition that our universe- which contains the vast complex of stars, galaxies, humans, and who knows what else- might have arise without design, intent, or purpose. while this is usually framed as a philosophical or religious question, it is first and foremost a question about the natural world, and so the appropriate place to try and resolve it, first and foremost, is with science.
richard dawkins, in the book's afterword, characterizes krauss' book as ""the knockout blow"" to the theologian's remaining arguments in favor of a creator. with a few hundred billion galaxies in the observable universe and a modern physics that seems to indicate that our universe could have only arose from nothing, krauss' assertion that god is ""unnecessary- or at best redundant"" is as compelling as the science he uses to arrive at said claim. a universe from nothing, like most books of reason and evidence, will do little to dissuade those whom ardently profess their belief in a deity, but as cosmology clarifies our place in the universe with greater precision, the arguments in favor of a creator seem ever less defensible. krauss, in this eminently readable (and often funny!) book, has ventured further down the road of rationality and empiricism, allowing us a guided tour on the never-ending quest to truly understand the nature of life in this brilliant universe we call home.
if we wish to draw philosophical conclusions about our own existence, our significance, and the significance of the universe itself, our conclusions should be based on empirical knowledge. a truly open mind means forcing our imaginations to conform to the evidence of reality, and not vice versa, whether or not we like the implications.
"
120,145162445X,http://goodreads.com/user/show/1651956-riku-sayuj,4,"Krauss has managed to draw an almost perfect normal curve (Bell Curve) with this book as far as engagement and content is concerned. The Start of the CurveIt starts slow by promising us a full whirlwind historic tour from Galileo to CMBR and beyond and takes its own sweet time getting to even Einstein and then dwells on the most known aspects of modern science as if no one has heard of all that before. The RiseThen as I was contemplating postponing the book for some future date, Krauss suddenly draws himself up to his full commanding ivory tower height and things suddenly get hard to comprehend. Now I was perked, this was what I was there with him for, after all.The Peak of the CurveMaybe it is because that was the only part of the book which I knew not enough about. I had read about the fact that the only way to explain the universe is to postulate an inflationary scenario for the early universe but Krauss puts it in terms which no other author which I have read has done. He makes it beautiful, breath-taking and completely believable that in a few micro seconds the universe expanded by an order of magnitude of 24 and attained the final shape that we see now! And he systematically charts out how this theory was derived based on observed size and density of universe, based on postulated energy of empty space, based on curvature of the universe and on the nature of acceleration of distant 'standard candles'. During this part of the book as well as the part in which he lists out the reasons for why the universe we live in is flat and accelerating and dominated by energy (as against mass, ie, by repulsive force of acceleration than by attractive force of gravity) and then slam-dunks it in by explaining how all this can only be explained by an inflationary early universe.The DipJust as I was bristling with all the new knowledge and information and thinking of the rave review this book is gonna get and about how knowledgeable I was going to be as I finish it, Krauss grinds the journey to a screeching halt as far as science is concerned. He takes a major left turn and plunges into an entire chapter on speculating if scientists wo trillion years into the future can ever find out the true nature of the universe. The anser is no. All evidence of the origins of universe would be lost or obscured by then and Kraus concludes that it is possible that even with the best scientific method, minds and far advanced technology, it is posible to reach the wrong conclusions. In face no matter how advanced that civilization is they will never know of a world beyond their own meta-galaxy! This is a wonderful thought an Richard Dawkins comments extensively on it in the afterword but surely it didn't warrant so many pages in al already small book? But in spite of the boring nature of the chapter, it is sill a very profound one - All our attempts to understand anything is limited by the presence of physical evidence, so we must also think about what might already have been obscured from us in the 13.odd billion years of the universe and this is especially true if the inflationary hypothesis is correct because an inflation like that would be like a flood over a crime scene. So the chapter is about humility even though Krauss tried to make it into an argument about why we live in a very special time, the only time we can wonder why it is special. This is again a clear opening to fit a god-of-the-gaps into. I am amazed at how many new avenues Krauss has opened up in this book. Is he secretly against Dawkins and Hitchens?The Lower EndAnd then he shifts into trying to explain the universe in terms of the Anthropic Principle which I have a tough time accepting even though I agree with the sturdy logic of it. I just feel it is Wrong, that is all, to explain things by saying that we wouldn't be here to talk about it if it were not so and that is the answer.The interest is still held fo a while as he does a critical analysis of string theory and concludes that it is a wonderful mathematical and theoretical edifice but it has proven/predicted not one single observation in 25 years or so and hence is more or less a dead-end. He plainly asks the common reader to get over the string theory hype and stop talking about String Theory to show how knowledgeable you are. If anyone talks of string theory and TOE to you, count on the fact that he heard about some stuff during the Great Hype and never bothered enough to understand or keep up-to-date.The Long Tail of the CurveAnd then comes the low point of the book, which Krauss probably put in only to gain traction with Dawkins and Christopher Hitchens. The long rant about religious claims and about their argument about ""How can something come out of nothing"" - the only answer is that it does, it still is happening and something can also go back into nothing in the future. So what does that prove? Not much I think except to accept that the universe is right strange, brotha. Then comes the epilogue about how science has to be respected and all that Carl Sagan stuff as science as a candle in the dark, the normal curve tending towards zero on the tail now, reader barely awake.The AnomalyAnd finally, the book winds down with a poetic afterword by Dawkins registering a major upturn anomaly in the normal curve towards the very end. (any good normal distribution will have the outliers after all).TakeawaysThe reader can come way from the book with a feeling that he now knows some 'deep' quantum kick-ass fundamentals without having been stretched as much as, say, a Brian Greene would do to you in The Elegant Universe: Superstrings, Hidden Dimensions, and the Quest for the Ultimate Theory. This must be the reason for the sudden popularity of the book and comparisons with 'The Origin of Species' and with A Brief History of Time as the next great opening of windows by science and as the final nail in the coffin that Darwin built for religion. Richard Dawkins sure sounds very pep in his afterword, as if, now that this book is out, no more argument is possible.I am not to sure about that of course. Ultimately the book is making the claim that everything we can measure and see and know anything at all about, ever, is just 1% of the universe. That is to say that physics can never know anything about 99% of what exist in the universe. Now, that is dangerous territory and can play right into the hands of religious aficionados. I wonder why Dawkins was elated by the book and not feverishly going back to the drawing board to counter all the hundreds of nonsensical faith-based claims that can crop up from this information.Final WordIn the end, I liked the book. It was worth the read for that amazing middle portion and for the analysis on string theory. but to compare it with The Origin of Species as a landmark work or to talk as if it is the definitive word in the argument strikes me as hyperbole. It is a well-written work accessible to the lay-reader that tries to explain how much modern science does not know. If that fills you with a sense of wonder, this is the book for you.Post ScriptPS. I really don't get why Ian McEwan turned up to comment on the cover. Some mix up? Hmm..."
121,145162445X,http://goodreads.com/user/show/1713956-manny,3,"Point/CounterpointA Nice Brief Account Of The Inflation/Ω/Dark Energy ThreadKrauss, who was personally involved in some of the work and knows all the key actors, does a fine job of summarising progress in cosmology over the last fifteen years. The most significant development, needless to say, has been the discovery of Dark Energy. Krauss presents the background and shows why it wasn't quite as unexpected as has often been made out; he was one of the few people to have predicted it, though it sounds like he could hardly believe his own prediction. He is also good on showing you how solid the evidence is. To people outside the field, it isn't at all obvious that the case is a strong one, since it depends on ultra-precise measurements of the distances to the most remote galaxies, something that is anything but trivial to do. Krauss straightforwardly says that he had doubts at first and urged his colleagues not to jump on the bandwagon; but, after a while, so much material had accumulated that it was almost impossible to explain the facts in any other way.Holy Fucking Shit, This Book Just Blows My MindOh My God, I was going to say, but Krauss, in this stunning book, gives you solid evidence that God doesn't exist. The latest advances in astronomy have uncovered a bunch of amazing new facts. Believe it or not, we now know the age of the universe to four significant figures!! Yes, the universe is 13.72 billion years old - not 13.71 billion or 13.73 billion!!!But that's just the starting point in Professor Krauss's whirlwind tour of all human knowledge. He tells you how 99% of the universe is invisible dark matter and dark energy. Incredibly, there's exactly enough invisible stuff to make space perfectly flat. And that means... wait for it... that the universe could only have started from nothing! Yes, you heard me. If things started with nothing and got blown up by inflation (don't worry, he tells you what it is), then you'd have exactly what we see today!So who needs God? Not Richard Dawkins, who wrote the cool afterword!"
