,isbn,user_link,ranking,review
62,1585422207,http://goodreads.com/user/show/98176236-sayoni,3,"Penny Le Couteur and Jay Burreson’s Napoleon’s Buttons provides readers with a view of both science and history that is often neglected. Le Couteur and Burreson weave unique details about history into the novel while simultaneously expressing the significance of the seventeen molecule groups attributed to in the title. In many cases, those molecules crucially changed the course of history. For example, the fall of the Roman Empire can be blamed on lead poisoning. Lead acetate was used to sweeten their wine. Lead containers were used to store these drinks, and water often reached homes through lead pipes. All of the above mentioned systems were mostly available to wealthy aristocrats, and eventually, symptoms of lead poisoning became prominent in leaders such as Emperor Nero, leading to the empire’s collapse. Additionally, Napoleon’s soldiers’ weakness was partially due to inefficient tin buttons on their coats. The extremely frigid temperatures led the buttons to crumble, making the soldiers unable to properly contain heat. This detail is just one of the many interesting points included in the book. The importance of precision and accuracy were also explored in Napoleon’s Buttons. One chapter of the book discussed the accident involving the space shuttle, Challenger. This section explained that a mere temperature difference affected rubber seals such that its pliability was crucially altered, leading to the tragic explosion. Unusual, intriguing facts are presented in Napoleon’s Buttons, and the connections made between history and the seventeen molecules is eye-opening. The above examples are only samples from book with a vast collection of enlightening information. From tin buttons to the cause of the Salem Witch trials to hotels made of salt, the information amounts to a broader understanding of the application of not only chemistry, but science as a whole and history as well. Napoleon’s Buttons allows readers not only to learn, but more importantly, to enjoy learning.I would give this book 3 out of 5 stars, because although it included many fascinating details, at times, I was reminded of reading a textbook. The format of the book sometimes mirrors the format of a textbook, and this caused my mind to drift at times. There was so much information presented in each section of the novel that it could become difficult to digest. Also, some of the points seemed disconnected and did not always flow smoothly. For example, an inventor would be briefly mentioned, and the following sentence would not further discuss his/her accomplishments. The next page would jump to the name of a company or another scientist’s name. These details seemed to be plopped into the book and did not quite have a purpose. If the goal was to credit those individuals, then that could have been accomplished another way. I found myself distracted by those names because they did not contribute to my understanding of the information presented. When the images of the molecular structures were shown, it was difficult to connect that back to the passage, as the relation between the structure and its significance was not always made explicit. Personally, the structures did not consistently aid my understanding of the book. I expected them to be supplementary, but did not feel that was the case while reading. An abundance of facts and knowledge became slightly overwhelming. However, the book was still an enjoyable read. Having a basic understanding of chemistry helped me to appreciate it more. Napoleon’s Buttons allowed me to marvel at the possibilities of science that I had previously been oblivious to. Overall, this book led me to the realization that science truly is ubiquitous."
63,1585422207,http://goodreads.com/user/show/5396658-paulo-limp,4,"	Napoleon’s Buttons is a great example of a 'trivia book'. This is a book where you learn lots of interesting facts, but just tidbits of information. So, great to impress friends and relatives at a dinner table… and that’s it.	This books mixes History and Chemistry (mostly Organic Chemistry), picking up substances precious to mankind, describing both the historical relevance associated with the “stuff”, and its chemical structure. It is advisable to have at least some basic knowledge in both disciplines to fully enjoy the book (no need for a degree, though). Its title relates to the fact that La Grand Armeé wore uniforms with Tin buttons – however Tin becomes breakable under very low temperatures – Russian-style low temperatures. This could have led to the soldiers losing their coats and capes just when they needed them the most – perhaps even being decisive to the result of the war, and the fate of Europe.	No worries – Penny Le Couteur knows this is speculative, and should not be taken too seriously. It works to illustrate the point. The molecules described in the book were in fact, more important than tin buttons. There are both examples from old substances, like salt, olive oil, and sugar – to more recent discoveries, like plastics, antibiotics and analgesics.	There is some pattern, though, that the reader can observe through the book. The story usually goes this way: Some substance was very valuable to man, and was hard to get. Some people got rich extracting it. Then rich countries from Europe found a way to steal the stuff, and became even richer, until some scientist was able to synthesize the molecule (usually in the 19th century), and then it became cheap and available to everyone.	Or… Some scientist (again, in the 19th century) accidentally discovered a new substance, when he was trying to do a different thing. Fortunately, he realized the value of what he had invented, and the world became a better place because of it.	Yet, I learned lots of “cool stuff” in the book, as I’ve mentioned. For instance, I was shocked to learn that up until recently, chemists considered part of the “scientific method” to actually taste the new chemicals they created (!?), recording the sensations on the tongue. I hope not too many scientists died this way – it was surely a way to dedicate one’s life to science.	I learned how penicillin kills bacteria. I learned why vegetal oils are mostly liquid at room temperature, while animal fat is mostly solid. I learned why a meal with vegetables is called a “salad”. I learned how refrigerators stay cold. And many more interesting facts.	There is no “deep knowledge” to be obtained from this book. On the other hand, for those “nerdy” like me, there is plenty to keep you interested – and also to make you look smart in your friend’s eyes."
64,1585422207,http://goodreads.com/user/show/35986416-stacy,4,"Right off the bat, I was so engaged and attached to this book! It opened my eyes and I became extremely fascinated with the idea of how these tiny (unseen to the naked eye) molecules have such big roles in changing the course of history. There is a quote that really spoke out to me as soon as I opened the book:“The idea that momentous events may depend on something as small as a molecule---a group of two or more atoms held together in a definite arrangement---offers a novel approach to understanding the growth of human civilization. A change as small as the position of a bond---the link between atoms in a molecule---can lead to enormous differences in properties of a substance and in turn influence the course of history (pg.6).” Already, it grabbed my attention.To be honest, at first, I thought that this book was not going to be interesting because I am not a huge non-fiction fan, especially when it comes to science (science is the course that I often have difficult understanding in). However, I was proved wrong because this book is a smooth blend between history and chemistry, and it is filled with interesting factual stories to how each of these molecules were discovered and/or created. It also contained visuals and diagrams of each molecule's chemical structure when looked at microscopically (it gets down to the ""nitty-gritty"" of the structure and properties). These pictures aid my understanding in the significance of their structures and chemical elements and how it played with discussing the roles of the molecules. It discussed about the compound's bonds, protein chains, OH groups, benzene rings, and more! These differences in the visuals allowed me to pinpoint the tiny differences in the structures to see how it would change the roles of these molecules. I also enjoyed how some of the scientific terms that I unheard of were defined along in the paragraphs, which guided my understanding even more. However, I wish that some of the visuals would be pictures other than their structures or would be displayed in a different format as it can often get monotonous viewing them over and over again.This book allowed me to ponder and analyze the value of these molecules and question ""what ifs"" these molecules did not come into existence. Would our world and lifestyles be where it is right now? Or would it be in a different state? These questions were the reason why I became so intrigued and engaged by this book; it places you in a state of thinking and makes you itch to find out more about these molecules.Overall, it was a great book to read and I enjoyed my experience. I would definitely suggest this book to other readers!"
65,1585422207,http://goodreads.com/user/show/68463765-jack-sundquist,3,"In 1812, 600,000 French troops of Napoleon’s Grande Armée marched towards Moscow in the hope of conquering Russia. However, frigid temperatures, disease, and lack of supplies forced the Grande Armée to retreat, and only 10,000 French troops returned. What could have caused the most powerful army an Earth to collapse? One theory has to do with the buttons of the soldiers. French troops wore tin buttons to hold up their uniforms. In cold temperatures, however, tin decomposes into a fine white powder. So, Napoleon’s troops would have certainly had their buttons disintegrate. Could the lack of buttons forced French soldiers to hold up their uniforms themselves, preventing them from being able to bring as much supplies as possible, contributing their food and clothing shortages?This and other historical events are given in Napoleon’s Buttons: 17 Molecules that Changed the World by Penny Le Couteur and Jay Burreson. This nonfiction book discusses 17 important molecules, and their impact on history. Each molecules has their own chapter, which mostly follows the following structure: the molecule is introduced through a story that explains the importance of the molecule. Then, the structure of the molecule is given and the properties of the molecule is explained through this structure. Finally, the chapter ends through further explanation of the impact of the molecules and a summary of the chapter. The most interesting chapter to me was phenol, a group of molecules that was found in early antiseptic, plastics, marijuana, cotton, photographic paper, electrical insulator, billiard balls, and many more. It was also responsible for limiting the killing of elephants, development of the inexpensive Kodak camera, and widespread use of electrical energy. The fact that a single molecule group could be used in such a large variety of items is fascinating to me.I give this book four out of five stars. It is a very interesting book that explains how many unappreciated aspects of our life came to be. It combines chemistry with history to provide the reader with a very informative experience. The reason I did not give it a five is because this is not the most entertaining book. There are some times in this book that I felt the book took too long about a specific event, but the majority of the book is still interesting. I would recommend this book to anyone because it will give them a different perspective on the causes and effects of historical events. You do not need to know about chemistry, but having a knowledge of chemistry will let you appreciate this book more. "
66,1585422207,http://goodreads.com/user/show/45859662-george-goodall,3,"I have a soft spot for social histories of technology -- books that demonstrate how a particular thing came about and, more importantly, the impact that that thing has had on us. ""Napoleon's Buttons"" is certainly part of that oeuvre. My first encounter with the book was years ago in an airport book store; I didn't buy it. It did, however, get a mention in what I was reading at the time, Foucault's ""Archaeology of Knowledge"" (I was in grad school). In a bit of marginalia I scrawled: ""Guns, Germs, and Steel [Diamond]? Salt [Kurlansky]? Napoleon's Buttons? SCOT?"" Foucault's passage deserves repeating here:""From the political mobility at the surface down to the slow movements of 'material civilization', ever more levels of knowledge have been established: each has its own peculiar discontinuities and patterns; and as one descends to the deepest levels, the rhythms become broader. Beneath the rapidly changing history of governments, wars, and famines, there emerge other, apparently unmoving histories: the history of sea routes, the history of corn or of gold-mining, the history of drought and of irrigation, the history of crop rotation, the history of balance achieved by the human species between hunger and abundance.""(Yeah, it's Foucault.)""Napoleon's Buttons"" is an ""unmoving history"" of organic chemistry... mostly. There is a chapter on salt (see Kurlansky above) but it's mostly to set up a discussion on chlorine, CFCs, etc.For such a dry topic, it's actually quite a fascinating read. The history of organic chemistry is really the history of modern trade and science. The title comes from the great coats of Napoleon's army during its disastrous winter campaign in Russia. The buttons of these coats were made from a tin alloy that crumbled in cold temperatures. Without buttons, the soldiers froze, and Napoleon lost. Chemistry has its consequences.Each chapter is the story of a new substance:- Peppers, nutmeg, and cloves- Ascorbic acid- Glucose- Cellulose- Nitro compounds- Silk and Nylon- Phenol- Isoprene- Dyes- Wonder drugs- The pill- Molecules of witchcraft- Morphine, nicotine, and caffeine- Oleic acid- Salt- Chlorocarbon compounds- Molecules versus MalariaOverall, an interesting read but it is perhaps better as a reference volume for esoteric trivia questions."
67,1585422207,http://goodreads.com/user/show/66814782-dawn,4,"Overall, this book takes a chemical look at 17 molecule families and not only their uses and discoveries, but how they changed the way things were done even if people hadn't come to the place where chemical composition was detected. The writing is detailed but interesting. The writers show diagrams of the molecules they discuss, so their introduction gives a brief description of how chemical compounds are diagrammed. The title is explained right away in that the buttons which were sewn on Napoleon's army men were not made of metal (they were made of tin) which was able to retain its shape in the cold the men experienced during the Russian winter of 1812-1813. So, not only were the men attempting to fight and move resources for battle, but they were also holding their coats together because the tin had disintegrated. The authors wonder if history might have been changed if the clothing were instead accessorized with metal better able to withstand the frigid temperatures. At the back of the book, there is an index and a selected bibliography."
68,1585422207,http://goodreads.com/user/show/114641769-tayah-turocy,4,"Napoleon's Buttons was not what I expected in the best of ways. I thoroughly enjoyed reading and learning through each incredibly unique chapter. This book had the absolute best mix of history and chemistry. As a chemistry PhD student, I felt very comfortable about the way the chemistry was presented, but I still learned a lot of new information and interesting facts. I am not a big history buff; however, the topics discussed were well explained, relatable, and understandable. I have never read a book that so clearly described so many things in a single story. Although the transitions where a bit far-fetched between chapters, I did appreciate the attempt to link diverse subjects together. Further, I loved how the description of chemistry grew in complexity from chapter to chapter. If you are looking for a fun book club novel, this book would be great. The number of chapters and topics seemed overwhelming at times, but it successfully kept the readers' interests peaked with consistent switching between both chemistry and historical ideas. "
69,1585422207,http://goodreads.com/user/show/7690422-dina,5,"Awesome book. Grammatical errors don't really bother me that much when the content is as engrossing as this! I'm not an English buff either so the only reason I noticed so many errors is because the person before me apparently had a field day correcting the authors' mistakes with pencil. Anyhow this book is really cool -- anyone who loves chemistry or history or both will appreciate it. And even if you want to learn just a bit of trivia, you'll learn a lot of it from the perspective these authors bring. The title is kind of an attention-grabber because the story of Napoleon's buttons is touched on in the intro and there are other molecules that take up way more anecdotal space than that one. Some of the stories you'll recognize like the importance of spices and sugar on The Age of Discovery in Western Europe and worldwide. However, though the stories are recognizable, the focus on molecules and the scientific advances that came about are refreshing and put a new spin on these tales. "
70,1585422207,http://goodreads.com/user/show/106519798-bella,4,"Combining history with science, Le Couteur and industrial chemist Burreson lay out the basis of molecular structures, accentuating the difference a microscopic molecular alteration can make. The text is divided into 17 chapters, with each chapter allotted to individual molecules or similar groups of molecules. Not only do Le Couteur and Burreson confer natural molecules, but synthetic as well, making sure to encompass the majority of human activity. They explain how peppers, nutmegs, cloves, and more launched a wave of global explorations, beginning with the Middle Ages and ending with the European colonies. The authors reveal a multitude of tall tales from all over the world and weave them into their novel to dramatically illustrate the scientific structure of modern society. Napoleon's Buttons: How 17 Molecules Changed History is Contemplative, astounding, and effortlessly written. "
71,1585422207,http://goodreads.com/user/show/108304936-izzy,1,"Dfn pg 200. (Skimmed to 222)I was interested in the concept of this book. Especially with the story of Napoleon's buttons--which is used in the books introduction (which is also part of title), the thing is though none of the chapters is that grabbing.The authors do note in the intro that the history presented would be disjointed and that they will talk a out groups of molecules, I believe the help of anctual historian would have been helpful. It got bogged down by too much science talk that when history did come in I was bored, on the otherhand the opposite happened too. Most of what I learned was about molecules, the history I knew most of (because it really just seemed like general statements) with learning some new small bits. Which okay it's about science, but the reason I kept stopping and what ultimately made me stop reading was how often it seemed too nonchalant on certain subjects."
72,1585422207,http://goodreads.com/user/show/15429459-leah,4,"Audiobook.For the first time I ever, I felt something was lost by listening rather than reading, and that only because I wasn't able to see the Lewis structures diagrammed in the book. Though they tried to make allowances for that by explaining, it wasn't the same. That said, I really enjoyed this book. History, especially history of chemistry, is one of my favorite things, and it was such a treat to see a survey of world history through the lens of chemistry. It's amazing how many things were brought into being or alongside each other throughout time because of capitalism (aka greed). There were many amazing discoveries, but many lives were lost and peoples were subjugated because of it. It was very sobering and sad. "
73,1585422207,http://goodreads.com/user/show/12078125-iangagn,4,"The chemical compounds from this book that I remember on the top of my head are : capsaicin (peppers), something about nutmeg that potentially repelled disease -- the Black Plague -- transmission vectors (i.e. insects), vitamin C, silk, dyes, hallucinogenic compounds used by so-called witches, morphine, caffeine and salt. All in all, it's pretty diverse and interesting. I've been on a sciencey book binge lately and there were things that I already knew since they were covered in other books like The Disappearing Spoon or Drug Hunters, but that's not the author's fault. Even though there was substantial overlap in their coverage of the common molecules, it was only a minor part of the book itself. I'm definitely satisfied with Napoleon's Buttons overall."
74,1585422207,http://goodreads.com/user/show/98227371-max-tolmoff,4,"Napoleon’s Buttons is a great book to read if you are into history and maybe want to learn a little more about chemistry. The book’s intro includes information about chemical structures so people who are not experienced with chemistry are still able to get intro he book. This is a great book because it shows how the smallest things in life can make the biggest differences. People don’t really think about how a tiny molecule could alter the course of history, and the seventeen molecules explained in the book are not the only examples. Every molecule in the natural world has a major role in preserving it and this book really sparked my interest for learning more about bio chemistry. If you like history and also like to understand how things work, I highly recommend Napoleon’s Buttons "
75,1585422207,http://goodreads.com/user/show/19545267-christine,5,"Borrowed the audio book from the library, finished it in 3 days and promptly bought a paper copy, that is how much I liked this book!As a chemical engineer and a lover of history, this book was able to combine chemistry and the potential role it had on history perfectly. I learned so much from this book, for example, the piperine molecule gives pepper its “spicy” taste because of the shape of the molecule stimulates the nerve receptors to register pain. And that the British obtained New Amsterdam from the Dutch by going to war over nutmeg, which was thought to ward of the black plague! Fascinating information. It is amazing how chemistry helped change our world, for both the good and bad. "
76,1585422207,http://goodreads.com/user/show/424546-charity,4,"Everything on Earth is made from the same handful of substances with properties that vary dramatically based on the proportions and structure of their combinations. Tiny changes have had enormous effects on human history, and we often don't know whether those changes are positive, negative, or both until well after the fact. At times overly simplistic, overall this book provides an intriguing perspective on how chemistry shapes our world.This is one of the many excellent books we've discovered thanks to the Build Your Library book lists assembled by Emily Cook. If you're looking for great reads on tons of subjects for yourself or your children, I highly recommend checking out the Build Your Library homeschool curricula."
77,1585422207,http://goodreads.com/user/show/52558090-v,3,"+ Good range of molecules and stories from around the world and across eras+ the historical bits are pretty wide-ranging,+/- It tries to be a lot of things at once: a historical narrative and a chemistry book. In practice, the combination is a bit hit-and-miss. It leans towards more of the latter, but it makes a good effort. Overall, it's ,ore of a history of chemistry than a book about the chemistry of history- much more science than expected, and quite a lot of it is Greek if you're not at all a sciencey person. Fortunately, the narrative is written for the layman and compensates for any skimming"
78,1585422207,http://goodreads.com/user/show/31980216-vanessa-princessa,4,"I read this book thanks to Blinkist.The key message in this book:The world hidden from the naked eye, the one composed of the molecular bonds between atoms, is responsible for some of the most significant events in human history. By telling the stories of these molecules, they can be brought out of the chemistry lab and put into the context of the real world. Suggested further reading: The Violinist’s Thumb by Sam KeanThe Violinist’s Thumb is an exploration into DNA, the double-helix of life itself. The following blinks chronicle the scientific discoveries that led us to understand DNA and the major role it’s played in the emergence of life on earth."
79,1585422207,http://goodreads.com/user/show/5836738-theresa,4,"This is a very well written and interesting book about certain molecules and how they have influenced history.I found it very readable, but since I am already pretty solidly knowledgeable on my chemistry, I found the lengthy explanations about chemical structure tedious. I just kept wanting to get to the more interesting history tidbits, so I ended up skipping chunks of the book to find stuff that appealed to me. To me, this was a three star read at best. But since I think someone with less chemistry experience would find the clear, well written and accurate basic chemistry explanations interesting and helpful, and appreciate that aspect more, I gave it 4 stars."
