,isbn,user_link,ranking,review
145,0805092994,http://goodreads.com/user/show/22699228-matthew-quann,4,"[4.5 Stars] Despite them numbering amongst my closest friends and family, humans have a rather horrible tendency to be assholes. Apart from the stereotypical acts of human depravity, there is also the passive damage inflicted on the natural world by our very existence. In Elizabeth Kolbert's outstanding The Sixth Extinction, the author writes in exceptionally readable and compelling language on a subject that is essential reading for members of our species.  Eschewing one particular approach to the depiction of extinction, Kolbert alternates the subjects of her chapters between multiple disciplines. History, geology, biology, ecology, and many other disciplines all make for a varied and hard-hitting treatise on the demise of the world's organisms. What's more, Kolbert breaks up her exposition with her experiences at the various places around earth on which she writes. These sections ground what can be very esoteric subject matter as the effects of these theories are seen through Kolbert's eyes. In a similar vein, Kolbert's aim with the book is not to accuse and depress, rather she seeks to educate the populace on the changes occurring on Earth. I have read many reviews that called this book depressing and guilt-inducing, however it was my feeling that the book maintains an upbeat, yet objective, tone throughout.  I am more likely to be found reading fiction than nonfiction; stories and characters have always interested me more than fact and figures. Perhaps it is that my professional days are filled with fact that I seek escape on my personal time. Despite this predilection for fiction, I am occasionally taken in by a nonfiction book and revel in the fashion the author arrives at their conclusion. The Sixth Extinction not only has the benefit of being one such book, it also has the prestige of being a book of great importance. If you're overwhelmed and unaffected by the media's liberal use of global warming, climate change, ocean acidification, and extinction events then this is exactly the book you should be reading. Its appeal is visceral as well as intellectual, and should be read by as many humans as possible. After all, we just happen to be the book's primary villains."
146,0805092994,http://goodreads.com/user/show/3123067-elizabeth-a,5,"This Pulitzer Prize winner for General Nonfiction (2015) was my book club selection this month, and I listened to the audiobook, which is really well narrated by Anne Twomey.Sapiens: A Brief History of Humankind by Yuval Noah Harari was my absolute favorite book last year, so I was primed to read this one. This non-fiction science book briefly covers the major and minor extinction cycles that have occured over the life of the planet, as well as current theories as to what caused them. The book is divided into 13 chapters, and each chapter deals with a specific current extinction, or near extinction, event. I loved the dots that this book connected for me. I loved that this current extinction cycle (clearly caused by Sapiens) is discussed in the context of the very long history of the planet. I loved learning about things I had no idea about, annual coral reef sex orgies comes to mind, and was saddened to learn about some of the species that have gone the way of the Dodo in my lifetime. I loved the science and learning about some scientists I knew nothing about. There is so much covered here, but all in a very accessible, easy to read manner. I am surprised that I was left with a feeling of hope at the end of this book. Not because I think that Humans will halt or reverse the processes we have put into play, but rather because after we become extinct, life will continue to find a way. Context is everything. I highly recommend this one."
147,0805092994,http://goodreads.com/user/show/13977687-taryn,4,"My husband Adam and I discussed this book as part of our He Read, She Read video series. Because despite what some people would have you believe, climate change is real, scientists can be trusted, and humans have had a significant impact on the earth pretty much since our appearance on it. So yeah, it felt like a timely choice!Fortunately for me, Adam, with his scientist mind, is more reserved in his judgment and optimistic in his outlook than I am. With the help of our (local!) beer of choice for this episode, he managed to talk me off the ledge. For now, anyway.Click here to watch!"
148,0805092994,http://goodreads.com/user/show/419287-jessica,0,"I do really want to read this, but I'm worried it will push me into a profound depression from which I might never return."
149,0805092994,http://goodreads.com/user/show/12497452-jennifer,4,"An accessible, smart read if you’re interested in evolution, geology, and how we’re generally f*#ked."
150,0805092994,http://goodreads.com/user/show/45632570-tim,4,"I realised today I'll be sad when the lockdown ends. There's something very magical about it, as if the planet is getting a good spring cleaning and all its inhabitants an urgently needed recalibrating of priorities. I love how people who do important jobs are suddenly getting all the love instead of narcissistic moronic reality TV celebrities and the like who had the limelight before. And the absence of cars, especially at night, is wonderful. The shot of the Himalayas visible from New Delhi for the first time in decades was especially poignant. And, on the whole, people are more friendly. There's a lot more generosity towards the poor. And so many health workers over here in the UK are of ethnic minority backgrounds that racism more than ever has been highlighted as the outlandish unforgivable expression of brute stupidity it is. The virus has made a nonsense of militant nationalism too. Takes a pandemic for most to understand that every border is in essence illusory; that we're all in this together. And how pettily absurd Brexit now seems. I hope this new generation will take on board this rejigging of social and ethical priorities and as a result be much more committed to looking after the planet.   Anyway, Elizabeth Kolbert in this book visits a series of research centres all over the globe, all with their own specialised subject, all charting and trying to prevent the sudden alarming demise of various species of mammal, bird, reptile and insect. She intersperses these individual and local sagas with an overview of how extinctions have occurred in the planet's history. Meticulously and convincingly she helps us to understand how quickly and carelessly we're heading towards the next big extinction, the first caused by humans. I liked this more than The Uninhabitable Earth because it's completely cleansed of the hellfire indignation which for me marred David Wallace-Wells' book."
151,0805092994,http://goodreads.com/user/show/5875398-rebecca,4,"(3.5) Feeling smugly secure about how much you care for animals and the environment, or how low your personal impact is? You won’t be after you read this.Warming today is taking place at least ten times faster than it did at the end of the last glaciation, and at the end of all those glaciations that preceded it. To keep up, organisms will have to migrate, or otherwise adapt, at least ten times more quickly. Though it might be nice to imagine there once was a time when man lived in harmony with nature, it’s not clear that he ever really did.Harboring some hubris about your place in the world? Here’s a tonic:a hundred million years from now, all that we consider to be the great works of man—the sculptures and the libraries, the monuments and the museums, the cities and the factories—will be compressed into a layer of sediment not much thicker than a cigarette paper.What else can I say about this book? The picture Kolbert paints of our situation is every bit as depressing as you might expect. I already knew the facts about climate change and animal extinction, but according to Kolbert the prognosis is even worse than I was aware, given that ocean acidification – “global warming’s ‘equally evil twin’” – is one contributor I hadn’t ever considered. Likewise, though I’d heard about the crisis with the world’s amphibians, I was entirely ignorant of the bat cataclysm (white-nose syndrome).As a longtime New Yorker journalist, Kolbert writes at a good level for laymen: not talking down, but not assuming any specialist knowledge either. I was somewhat unconvinced by her thematic, species-by-species approach here; it makes each chapter more like an individual essay than a part of a larger argument. Winging her way around the world (what carbon footprint?!), she considers auks and ammonites, mastodons and endangered zoo animals in captive breeding programs, dying coral reefs, and pockets of Amazonian rainforest. By the end, you’ll be in no doubt that we are in the middle of a major extinction event, and that our era will be known as the “Anthropocene” – the age of the influence of man.Luckily, there are spots of humor to lighten the tone, such as “The reason this book is being written by a hairy biped, rather than a scaly one, has more to do with dinosaurian misfortune than with any particular mammalian virtue.”As Caspar Henderson writes in his Guardian review, “The extinction crisis is so vast and complex that it almost repels thought. We need a lot more imaginative thinking about the choices we can make and what comes next.” Now that this has won a Pulitzer, one hopes it will get people talking and doing some of that imaginative thinking. Unfortunately, it’s so much easier to bury heads in the sand and keep going as we have been. Time will tell whether we heed the lessons of this book."
152,0805092994,http://goodreads.com/user/show/4886576-cody,4,"There have been very long uneventful stretches and very, very occasionally ""revolutions on the surface of the earth."" To the extent that we can identify the causes of these revolutions, they're highly varied: glaciation in the case of the ordovician extinction, global warming and chances in chemistry at the end of the Permian, an asteroid impact in the final seconds of the Cretaceous. The current extinction has its own novel cause: not an asteroid or a massive volcanic eruption but ""one weedy species. As Walter Alvarez put it to me, ""We're seeing right now that a mass extinction can be cause by human beings."" (265-266) ""With the capacity to represent the world in signs and symbols comes the capacity to change it, which as it happens, is also the capacity to destroy it. A ting set of genetic variations divides us from the Neanderthals, but that has made all the difference. (258)It isn't unique to note that humanity has dangerously altered the planet in a way that no other species before it has done as conclusively demonstrated by Elizabeth Kolbert in The Sixth Extinction: An Unnatural History. What makes this book not only important but a must-read is the case by case basis which she follows through with each chapter of extinct or near-to-extinct case studies of populations of animals, from the American Mastodon to the frogs of central Panama to the Sumatran Rhino. Because of the subject matter and the grand question of purpose among our own species, the ones before us, and the ones that will come after we're gone, this book is something that stays with the reader afterwards, pondering the grand invention of creation, evolution, and eventual disarray. The book provides a great overview of the subject matter that newcomers will find informative and enjoyable, and despite the information presented, does offer glimpses of hope and even humour. What is so fascinating about the subject matter is the concept of how life has survived and altered itself time after time on our bountiful rock, and how little we as a species really understand the world we have seemingly (or rather forcibly) inherited. It was only roughly 300 years ago that palaeontology began to take it's first steps as a major science with the discovery of mastodon bones in North America, and that whole different worlds existed before ours. It was only in 1831 that Charles Darwin boarded the HMS Beagle and made his way around the world, specifically to the Galapagos, giving us terms in his ""On the Origins of Species"" that now represent mainstream science. Neanderthals only were discovered shorted after Darwin's voyage, and it was only in 2004 that a hobbit like humanoid species was discovered on the island of Flores in Indonesia. How freaking amazing and unbelievable is that?It was interested to see Kolbert's travels around the globe, diving into the globalisation aspects of humanity that give us terms like ""New Pangaea,"" how bat populations in the Northeastern part of the US have dropped off significantly do to factors that bats elsewhere in the world are immune to, the investigation into rainforest populations in South America, and the incredible efforts scientists are doing to protect endangered species, like giving rhinos ultrasounds and crows handjobs. It's a tale of our grim actions, but the hopeful aspects of our understanding of the world that can add it. The choice is up to us as a species."
153,0805092994,http://goodreads.com/user/show/16174645-paula,4,"Fascinating and disturbing. Looks like, and not surprisingly, mankind will be causing the demise of our own species in the sixth extinction."
