,isbn,user_link,ranking,review
215,1585422207,http://goodreads.com/user/show/68463765-jack-sundquist,3,"In 1812, 600,000 French troops of Napoleon’s Grande Armée marched towards Moscow in the hope of conquering Russia. However, frigid temperatures, disease, and lack of supplies forced the Grande Armée to retreat, and only 10,000 French troops returned. What could have caused the most powerful army an Earth to collapse? One theory has to do with the buttons of the soldiers. French troops wore tin buttons to hold up their uniforms. In cold temperatures, however, tin decomposes into a fine white powder. So, Napoleon’s troops would have certainly had their buttons disintegrate. Could the lack of buttons forced French soldiers to hold up their uniforms themselves, preventing them from being able to bring as much supplies as possible, contributing their food and clothing shortages?This and other historical events are given in Napoleon’s Buttons: 17 Molecules that Changed the World by Penny Le Couteur and Jay Burreson. This nonfiction book discusses 17 important molecules, and their impact on history. Each molecules has their own chapter, which mostly follows the following structure: the molecule is introduced through a story that explains the importance of the molecule. Then, the structure of the molecule is given and the properties of the molecule is explained through this structure. Finally, the chapter ends through further explanation of the impact of the molecules and a summary of the chapter. The most interesting chapter to me was phenol, a group of molecules that was found in early antiseptic, plastics, marijuana, cotton, photographic paper, electrical insulator, billiard balls, and many more. It was also responsible for limiting the killing of elephants, development of the inexpensive Kodak camera, and widespread use of electrical energy. The fact that a single molecule group could be used in such a large variety of items is fascinating to me.I give this book four out of five stars. It is a very interesting book that explains how many unappreciated aspects of our life came to be. It combines chemistry with history to provide the reader with a very informative experience. The reason I did not give it a five is because this is not the most entertaining book. There are some times in this book that I felt the book took too long about a specific event, but the majority of the book is still interesting. I would recommend this book to anyone because it will give them a different perspective on the causes and effects of historical events. You do not need to know about chemistry, but having a knowledge of chemistry will let you appreciate this book more. "
216,1585422207,http://goodreads.com/user/show/45859662-george-goodall,3,"I have a soft spot for social histories of technology -- books that demonstrate how a particular thing came about and, more importantly, the impact that that thing has had on us. ""Napoleon's Buttons"" is certainly part of that oeuvre. My first encounter with the book was years ago in an airport book store; I didn't buy it. It did, however, get a mention in what I was reading at the time, Foucault's ""Archaeology of Knowledge"" (I was in grad school). In a bit of marginalia I scrawled: ""Guns, Germs, and Steel [Diamond]? Salt [Kurlansky]? Napoleon's Buttons? SCOT?"" Foucault's passage deserves repeating here:""From the political mobility at the surface down to the slow movements of 'material civilization', ever more levels of knowledge have been established: each has its own peculiar discontinuities and patterns; and as one descends to the deepest levels, the rhythms become broader. Beneath the rapidly changing history of governments, wars, and famines, there emerge other, apparently unmoving histories: the history of sea routes, the history of corn or of gold-mining, the history of drought and of irrigation, the history of crop rotation, the history of balance achieved by the human species between hunger and abundance.""(Yeah, it's Foucault.)""Napoleon's Buttons"" is an ""unmoving history"" of organic chemistry... mostly. There is a chapter on salt (see Kurlansky above) but it's mostly to set up a discussion on chlorine, CFCs, etc.For such a dry topic, it's actually quite a fascinating read. The history of organic chemistry is really the history of modern trade and science. The title comes from the great coats of Napoleon's army during its disastrous winter campaign in Russia. The buttons of these coats were made from a tin alloy that crumbled in cold temperatures. Without buttons, the soldiers froze, and Napoleon lost. Chemistry has its consequences.Each chapter is the story of a new substance:- Peppers, nutmeg, and cloves- Ascorbic acid- Glucose- Cellulose- Nitro compounds- Silk and Nylon- Phenol- Isoprene- Dyes- Wonder drugs- The pill- Molecules of witchcraft- Morphine, nicotine, and caffeine- Oleic acid- Salt- Chlorocarbon compounds- Molecules versus MalariaOverall, an interesting read but it is perhaps better as a reference volume for esoteric trivia questions."
217,1585422207,http://goodreads.com/user/show/66814782-dawn,4,"Overall, this book takes a chemical look at 17 molecule families and not only their uses and discoveries, but how they changed the way things were done even if people hadn't come to the place where chemical composition was detected. The writing is detailed but interesting. The writers show diagrams of the molecules they discuss, so their introduction gives a brief description of how chemical compounds are diagrammed. The title is explained right away in that the buttons which were sewn on Napoleon's army men were not made of metal (they were made of tin) which was able to retain its shape in the cold the men experienced during the Russian winter of 1812-1813. So, not only were the men attempting to fight and move resources for battle, but they were also holding their coats together because the tin had disintegrated. The authors wonder if history might have been changed if the clothing were instead accessorized with metal better able to withstand the frigid temperatures. At the back of the book, there is an index and a selected bibliography."
218,1585422207,http://goodreads.com/user/show/114641769-tayah-turocy,4,"Napoleon's Buttons was not what I expected in the best of ways. I thoroughly enjoyed reading and learning through each incredibly unique chapter. This book had the absolute best mix of history and chemistry. As a chemistry PhD student, I felt very comfortable about the way the chemistry was presented, but I still learned a lot of new information and interesting facts. I am not a big history buff; however, the topics discussed were well explained, relatable, and understandable. I have never read a book that so clearly described so many things in a single story. Although the transitions where a bit far-fetched between chapters, I did appreciate the attempt to link diverse subjects together. Further, I loved how the description of chemistry grew in complexity from chapter to chapter. If you are looking for a fun book club novel, this book would be great. The number of chapters and topics seemed overwhelming at times, but it successfully kept the readers' interests peaked with consistent switching between both chemistry and historical ideas. "
219,1585422207,http://goodreads.com/user/show/7690422-dina,5,"Awesome book. Grammatical errors don't really bother me that much when the content is as engrossing as this! I'm not an English buff either so the only reason I noticed so many errors is because the person before me apparently had a field day correcting the authors' mistakes with pencil. Anyhow this book is really cool -- anyone who loves chemistry or history or both will appreciate it. And even if you want to learn just a bit of trivia, you'll learn a lot of it from the perspective these authors bring. The title is kind of an attention-grabber because the story of Napoleon's buttons is touched on in the intro and there are other molecules that take up way more anecdotal space than that one. Some of the stories you'll recognize like the importance of spices and sugar on The Age of Discovery in Western Europe and worldwide. However, though the stories are recognizable, the focus on molecules and the scientific advances that came about are refreshing and put a new spin on these tales. "
220,1585422207,http://goodreads.com/user/show/106519798-bella,4,"Combining history with science, Le Couteur and industrial chemist Burreson lay out the basis of molecular structures, accentuating the difference a microscopic molecular alteration can make. The text is divided into 17 chapters, with each chapter allotted to individual molecules or similar groups of molecules. Not only do Le Couteur and Burreson confer natural molecules, but synthetic as well, making sure to encompass the majority of human activity. They explain how peppers, nutmegs, cloves, and more launched a wave of global explorations, beginning with the Middle Ages and ending with the European colonies. The authors reveal a multitude of tall tales from all over the world and weave them into their novel to dramatically illustrate the scientific structure of modern society. Napoleon's Buttons: How 17 Molecules Changed History is Contemplative, astounding, and effortlessly written. "
221,1585422207,http://goodreads.com/user/show/108304936-izzy,1,"Dfn pg 200. (Skimmed to 222)I was interested in the concept of this book. Especially with the story of Napoleon's buttons--which is used in the books introduction (which is also part of title), the thing is though none of the chapters is that grabbing.The authors do note in the intro that the history presented would be disjointed and that they will talk a out groups of molecules, I believe the help of anctual historian would have been helpful. It got bogged down by too much science talk that when history did come in I was bored, on the otherhand the opposite happened too. Most of what I learned was about molecules, the history I knew most of (because it really just seemed like general statements) with learning some new small bits. Which okay it's about science, but the reason I kept stopping and what ultimately made me stop reading was how often it seemed too nonchalant on certain subjects."
222,1585422207,http://goodreads.com/user/show/15429459-leah,4,"Audiobook.For the first time I ever, I felt something was lost by listening rather than reading, and that only because I wasn't able to see the Lewis structures diagrammed in the book. Though they tried to make allowances for that by explaining, it wasn't the same. That said, I really enjoyed this book. History, especially history of chemistry, is one of my favorite things, and it was such a treat to see a survey of world history through the lens of chemistry. It's amazing how many things were brought into being or alongside each other throughout time because of capitalism (aka greed). There were many amazing discoveries, but many lives were lost and peoples were subjugated because of it. It was very sobering and sad. "
223,1585422207,http://goodreads.com/user/show/12078125-iangagn,4,"The chemical compounds from this book that I remember on the top of my head are : capsaicin (peppers), something about nutmeg that potentially repelled disease -- the Black Plague -- transmission vectors (i.e. insects), vitamin C, silk, dyes, hallucinogenic compounds used by so-called witches, morphine, caffeine and salt. All in all, it's pretty diverse and interesting. I've been on a sciencey book binge lately and there were things that I already knew since they were covered in other books like The Disappearing Spoon or Drug Hunters, but that's not the author's fault. Even though there was substantial overlap in their coverage of the common molecules, it was only a minor part of the book itself. I'm definitely satisfied with Napoleon's Buttons overall."
224,1585422207,http://goodreads.com/user/show/98227371-max-tolmoff,4,"Napoleon’s Buttons is a great book to read if you are into history and maybe want to learn a little more about chemistry. The book’s intro includes information about chemical structures so people who are not experienced with chemistry are still able to get intro he book. This is a great book because it shows how the smallest things in life can make the biggest differences. People don’t really think about how a tiny molecule could alter the course of history, and the seventeen molecules explained in the book are not the only examples. Every molecule in the natural world has a major role in preserving it and this book really sparked my interest for learning more about bio chemistry. If you like history and also like to understand how things work, I highly recommend Napoleon’s Buttons "
225,1585422207,http://goodreads.com/user/show/19545267-christine,5,"Borrowed the audio book from the library, finished it in 3 days and promptly bought a paper copy, that is how much I liked this book!As a chemical engineer and a lover of history, this book was able to combine chemistry and the potential role it had on history perfectly. I learned so much from this book, for example, the piperine molecule gives pepper its “spicy” taste because of the shape of the molecule stimulates the nerve receptors to register pain. And that the British obtained New Amsterdam from the Dutch by going to war over nutmeg, which was thought to ward of the black plague! Fascinating information. It is amazing how chemistry helped change our world, for both the good and bad. "
226,1585422207,http://goodreads.com/user/show/424546-charity,4,"Everything on Earth is made from the same handful of substances with properties that vary dramatically based on the proportions and structure of their combinations. Tiny changes have had enormous effects on human history, and we often don't know whether those changes are positive, negative, or both until well after the fact. At times overly simplistic, overall this book provides an intriguing perspective on how chemistry shapes our world.This is one of the many excellent books we've discovered thanks to the Build Your Library book lists assembled by Emily Cook. If you're looking for great reads on tons of subjects for yourself or your children, I highly recommend checking out the Build Your Library homeschool curricula."
227,1585422207,http://goodreads.com/user/show/52558090-v,3,"+ Good range of molecules and stories from around the world and across eras+ the historical bits are pretty wide-ranging,+/- It tries to be a lot of things at once: a historical narrative and a chemistry book. In practice, the combination is a bit hit-and-miss. It leans towards more of the latter, but it makes a good effort. Overall, it's ,ore of a history of chemistry than a book about the chemistry of history- much more science than expected, and quite a lot of it is Greek if you're not at all a sciencey person. Fortunately, the narrative is written for the layman and compensates for any skimming"
228,1585422207,http://goodreads.com/user/show/31980216-vanessa-princessa,4,"I read this book thanks to Blinkist.The key message in this book:The world hidden from the naked eye, the one composed of the molecular bonds between atoms, is responsible for some of the most significant events in human history. By telling the stories of these molecules, they can be brought out of the chemistry lab and put into the context of the real world. Suggested further reading: The Violinist’s Thumb by Sam KeanThe Violinist’s Thumb is an exploration into DNA, the double-helix of life itself. The following blinks chronicle the scientific discoveries that led us to understand DNA and the major role it’s played in the emergence of life on earth."
229,1585422207,http://goodreads.com/user/show/5836738-theresa,4,"This is a very well written and interesting book about certain molecules and how they have influenced history.I found it very readable, but since I am already pretty solidly knowledgeable on my chemistry, I found the lengthy explanations about chemical structure tedious. I just kept wanting to get to the more interesting history tidbits, so I ended up skipping chunks of the book to find stuff that appealed to me. To me, this was a three star read at best. But since I think someone with less chemistry experience would find the clear, well written and accurate basic chemistry explanations interesting and helpful, and appreciate that aspect more, I gave it 4 stars."
230,1585422207,http://goodreads.com/user/show/52644147-hailey-levin,5,"No need to worry about having an in-depth understandings of the world of chemistry to enjoy this book. There is enough of a introduction to the basics that one can read the book without being overwhelmed by technical details, but can still appreciate the tiny molecular differences that make some of the stories so fascinating. The book gave my world view a nice kick in the teeth. There is so much that we take for granted, not realizing the hardship and battles that had to happen just for us to have what we do. I mean, nutmeg -- really! I would love to use bits of this in my classroom when exploring molecular structure; it would be a great way to tie in history. "
231,1585422207,http://goodreads.com/user/show/12503333-joan-funk,4,I enjoyed this book. There is a little bit of chemistry in it but not so much is to drive you nuts- particularly if you are chemistry adverse. This is not the kind of book that you stay up late reading or you have to get to the end but it’s a great in your car book if that makes sense. The sections on each of the 17 minute molecules stand alone so you can read that section and when you get done if you don’t pick it up for a while that’s perfectly fine. The connections between things with just minor changes in their molecules was very fascinating. It was an easy read. I learned quite a bit. 
232,1585422207,http://goodreads.com/user/show/5445995-donnie,5,"This is one of my favorite kinds of nonfiction. A book that talks about an area, in this case chemistry, in a way that is understandable and fascinating. The author devotes a chapter to each of 17 molecules and discusses their discovery and the cascading impact of the molecules as scientists in the past tried to determine their usefulness. Some molecules, like sodium, caused wars, toppled kingdoms, and encouraged ""international trade."" I found each chapter interesting and plan to read this book again because there were too many interesting facts to process in a single reading--at least for my aging brain. If you like history and aren't afraid of ""gentle"" chemistry, this book is for you."
233,1585422207,http://goodreads.com/user/show/95025914-wilmington,5,"EnlighteningI read Seeds of Change by Henry Hobhouse many years ago, which explained how the six plants changed the course of humanity. Napoleon's buttons is a very similar kind of book, combining chemistry and history. This book also includes the basics of organic chemistry for non scientists, so that the reader can appreciate how similar some molecules from different plants really are. The 17 molecules discussed in the book our eyes are natural, like piperine from pepper or isoeugenol from nutmeg, or completely manmade like the birth control pill or CFCs from early refrigerators. A great book, easy to read, well researched and entertaining."
234,1585422207,http://goodreads.com/user/show/1272349-neven,3,"A perfectly informative science book, though not a standout in terms of style or interesting content. It proposes an idea that’s, when you think about it, maybe too obvious to spell out: that certain molecules (e.g. salt, hemoglobin, polymers) have played major roles in history. Given that everything is made of molecules, that’s sort of a given. But the book then undercuts its point by clarifying, at every turn, that history is complicated and more than any one factor or molecule has decided Napoleon’s defeat in Russia or the American independence. This is true, but it wouldn’t be UNtrue to charm the reader into a molecular perspective on those stories with a little more confidence. "
235,1585422207,http://goodreads.com/user/show/1186222-erin,3,"For being a non-fiction, this book was just fun!17 molecules that changed history, caused wars, and benefited the human race. Each chapter followed the same formula: What the molecule is, it's chemical structure, and how it shaped the world. I would recommend this to anyone and everyone, especially those who are interested on the HOW things work in the world around them. I wish I had read this before I taught high school chemistry. There were lots of cool anecdotes that would have been fun to share. "
236,1585422207,http://goodreads.com/user/show/94604387-keith-preston,3,"I would probably have gotten more enjoyment from this book if I were able to understand chemistry at a deeper level. The 17 molecules that changed history are each detailed on how the chemical bonds work as well as the influence the compound had on history. From salt to phenols, from ascorbic acid to rubber, there were some compounds that made all the difference in wealth, power, and personal health. A fun romp through the chemical side of history - an aspect of history that many do not consider."
237,1585422207,http://goodreads.com/user/show/16487082-jessica-davis,3,"I should have read this book when it was gifted to me before college. The language is simplified and, although the book introduces chemistry terms and properties well, it’s not really interesting if you have ever taken an organic chemistry class. One thing that really bugged me was the condescending tone the author takes as they are teaching and imploring the reader to appreciate chemistry, chemists, and science. Yet, I enjoyed the history and kept reading to soak up all the info. This might be interesting for a high school student that appreciates chemistry."
238,1585422207,http://goodreads.com/user/show/5125829-ana,4,"My high school chemistry teacher recommended this book to me, and now I have read it for a course in the chemistry of art in my final year of university.This book is not so much a journey as a sashay through time, equipped with the chemist's eye. History is viewed through the lenses of seventeen different influential iterations of chemistry--and it is undeniably an illuminating view, for all its ease of reading."
239,1585422207,http://goodreads.com/user/show/10064010-adrian-mendoza,4,"Utterly fascinating. The book does a great job of bringing the invisible world of chemistry and bringing it to life in historical, real life examples. Makes you come to appreciate the influence of chemistry in the world around you. A proper read for any looking for an intriguing glimpse into the historical, economic and cultural development of the modern world and no, you do not have to be a chemist or vaguely familiar with chemistry to enjoy this book."
240,1585422207,http://goodreads.com/user/show/3488439-daphne,4,Pretty interesting book. All chapters had something new and interesting in them. Even if some of the molecules/history is something I already knew about. Very well written overall. 
241,1585422207,http://goodreads.com/user/show/11281158-kathy,4,"Fascinating, fabulous read. Be prepared for the challenge of chemistry blended with history of molecules that will stretch your mind and engage you in a way that is entirely unique!"
