,isbn,user_link,ranking,review
26,0618056734,http://goodreads.com/user/show/10979968-sarah,3,"I was happy to appreciate the inside reference for Chapter 8's title, (all you Brief Encounter fans out there, etc.) In reading through, I had the feeling that somewhere in the editing process someone said, ""Please add more sign posts at the beginning and ending of all your chapters. Please continue to remind your reader what your point is because your reader is probably stupid."" From that advice I'm imagining Dawkins was made to make those written reminders against his will because it makes the writing very chunky in places. I found most of these markers completely unnecessary. In the third quarter of the book, it felt like the ambition to show the real beauty and provide poetic examples lost confidence. The first several chapters, especially Barcodes in the Stars, were my favorite. I am always most easily enchanted by the poetic possibilities of the universe, in part because of the incredible distances being covered. After further discussion on genes with David, some of the chapters became more clear. I should have revisited some Khan Academy sections on genes before diving into this, but it was still a good science read. "
27,0618056734,http://goodreads.com/user/show/22249197-tomas,2,"Premise of this book is wrong. Why search for link between scientific evidence and poetry ? Poetry is not going to persuade anybody about scientific facts. The person who doubts relentless efforts of scientists to discover truth about life and universe because it is not poetic is an idiot. It almost co-relates with the religions views on life. Everything must be pretty, non-chaotic and explained in one or two sentences. Truth about almost everything is complicated and there are really no simple answers to anything. Therefore the facts will not be pretty enough to put on the wall or read out loud in Hide park. Plus poetry will not help improve our society, will not cure any disease. And in my opinion is highly overrated.I have read many books written by Mr. Dawkins and every single one I liked except for this one. Book itself is not bad and there is a lot of interesting stuff mentioned here as well. But you have to go through a lot of poem being quoted."
28,0618056734,http://goodreads.com/user/show/25687639-mark,3,"Readability 5. Rating 5. I have had this one for years and started it more than once. Finally decided to plow through. I think the kindest thing I can say it that it was a mixed bag. I think he uses the phrase ""tiresome pedant"" and even though he has written some great stuff, parts of this one were brutal and he comes across as a tiresome pedant. Part of it is simply taste - I don't care about arguments one should use with those who believe in pseudo-science and I am not worried that if someone watches The X-Files that they will abandon scientific thought (hint: fiction and non-fiction are not the same thing). Some other parts were just tedious- either overdone or rehashes of things he covered better elsewhere. The bright spot for me was the discussion of perception and virtual reality later in the book. Bottom line: if you can't get enough of Dawkins go ahead and read this one, otherwise, look to his other stuff instead."
29,0618056734,http://goodreads.com/user/show/73669373-tyler-joseph,3,"I’ve personally come to the conclusion that this will most likely be the last Richard Dawkins book I’ll read. I will not deny the fact that Mr. Dawkins is brilliant, however his writing certainly isn’t. I enjoyed his book “The God Delusion” but even that was border line dry and I would consider that to be his most entertaining book. This book is certainly filled with solid information hence why I gave it the benefit of the doubt and gave it 3 stars. If I wanted to simply learn the information I would buy a textbook and learn these concepts in much more depth that he is able to do within a 350 page book but people like me buy books by him and other science educators in hopes of being entertained along the way, in which he fails miserably at doing. As a scientist/educator I give Mr. Dawkins an “A” but as a writer... I give him a “D-“"
30,0618056734,http://goodreads.com/user/show/92114168-josh,5,"Really is a beautiful way to view the nature of science. The title ""unweaving the rainbow"" is very apropos, as you'll see. Now whenever I walk outside I think about the world in a more ""pleasantly informed"" way. You shed the common stigma science holds, being cold and uncaring. Obviously, being Dawkins, he really makes you want to go out and just learn - learn anything find out how not why and improve yourself, all the while remembering learning and understanding is actually art. It really is poetic to think of any living thing on the planet almost as your ""sibling, far removed"" for example. It's also VERY applicable to the present; it's not the mystery, but the explanation and knowing that brings beauty to anything in life."
31,0618056734,http://goodreads.com/user/show/84743100-jon-papai,4,"I was ready to give three stars until I got to chapter eight. In earlier chapters Dawkins discusses realms where he is not a specialist. In chapter eight he takes down some of the more absurd evolutionary ideas promulgated about the Cambrian explosion by Stephen Jay Gould in that era. Here Dawkins brings his deep knowledge of evolution to bear. He also tips his hat to Daniel Dennett's criticisms in Darwin's Dangerous Idea: Evolution and the Meanings of Life. Raised rating to four stars.Chapters 1-7 are OK. From eight on, Dawkins writes about realms he really knows, even tipping his cap to the meme. Skip to that part if you think the beginning is a drag."
32,0618056734,http://goodreads.com/user/show/20909277-tim,3,"The first few pages sum up, as well as I’ve ever seen done, the wonder and awe we can find in what science tells us about the world around us. Sadly Dawkins then goes on and follows it with an entire book on the subject. OK, that’s unfair. Some bits of the book are first class, particularly (as you’d expect) the section explaining the true nature of natural selection when looked at from a genetic point of view. Other parts are more mixed and Dawkins just can’t seem to prevent himself from occasionally being a bit of dick in places, as seems to be his nature. Still, a worthwhile read, especially if you’ve not had much exposure to the topics he covers."
33,0618056734,http://goodreads.com/user/show/1924813-dan,4,"I was disappointed because from a lifetime of reading science, including other Dawkins, I was already familiar with the topics, which Dawkins addresses here expertly. This is for the non-scientist with an interest in science but has not been reading science through 50 years. Worth a fifth star for those really interested.Dawkins does not truck with baloney, but I found the tone friendly and conversational. Complaints about the style remind me of an observation of Bernard Shaw: The power of accurate observation is commonly called cynicism by those who have not got it."
34,0618056734,http://goodreads.com/user/show/83702714-tara-leigh,2,"The writing was very good for a science book. The little and big facts were very interesting, and I say this as a scientist, albeit not in his field. But unfortunately, the author comes across as very arrogant and very preachy and very ...well, somewhat mean, as he tells us how stupid certain ideas are. I couldn’t get past it. I read the whole thing, but it became a slog about half way though, once the arrogance really showed itself. The first half was excellent though, and I’m glad I read it. Just- yuck. 🎶why you gotta be so rude?🎶"
35,0618056734,http://goodreads.com/user/show/4551268-sara-g,4,"I mostly loved this book. It's a bit dry in the middle, but I love reading Dawkins's dry wit and science is endlessly fascinating to me. There's a whole section about false science vs. real science, and why society is obsessed with the paranormal and astrology while at the same time dismissing actual science as boring or nerdy, and I especially enjoyed that part. Also, the last chapter is entirely about how our brain evolved with a big section about memes and how they work, which was fascinating. The fascinating stuff was worth slogging through the dry parts."
36,0618056734,http://goodreads.com/user/show/84696143-ben-moore,3,"A beautiful case for the beauty and poetry of science. Incredibly rich description. Dawkins sells himself short when he says he isn't poetic. No other author brings biology to life like he does. I felt genuinely challenged to try to take inspiration from scientific sources for future poetry.Sadly it all gets rather bogged down in some pretty embarrassing critiques of religion and a truly bizarre condemnation of the fantasy genre. As ever, Dawkins excellent writing is held back by silly and ill-informed ranting. A terrible, terrible shame."
37,0618056734,http://goodreads.com/user/show/77661620-gary,4,"A very informative book, with good quotes and poems chosen to back up points. The second half of the book was a lot more difficult to read, I found. I enjoyed reading about physics and the history of science, though the later chapters on genetics, the selfish cooperator and self-feeding co-evolution proved challenging to keep up with at times. Not that it was any less interesting, but required me to take my time reading or to reread parts to fully grasp the arguments presented."
38,0618056734,http://goodreads.com/user/show/4830021-yash-arya,5,"One of the best books I've ever read. Most schools can often make Science seem like a dull collection of facts. I highly recommend this book to anyone who would like to experience the beauty of Scientific thought. Once you have read the book, you may eventually forget all the details, but will always remember the essence."
39,0618056734,http://goodreads.com/user/show/6222903-loren-dillon,4,"Dr. Dawkins disagrees with the notion that by explaining the science of a phenomenon (rainbow as in the case of Isaac Newton), it is robbed of its wonder. He then provides examples of how by meticulously analyzing a subject we get to appreciate it more and ends up benefiting our lives."
40,0618056734,http://goodreads.com/user/show/43005204-satheesh-kumar,4,"Started off with an interesting premise, but soon got tiring as Dawkins belabors each point with too many examples (not all of them intriguing). The examples may interest people with no science background. "
41,0618056734,http://goodreads.com/user/show/1275149-cheryl,2,"Some gems, but overall, his tone is arrogant and inhumane. I love all the ways that humans are alive, and wonder is our birthright; I don’t think anyone who believes in astrology would read this book and there was to much delusion in the book and not enough wonder. "
42,0618056734,http://goodreads.com/user/show/8540972-agata,2,"""And [ranting] in his hands is all the more damaging because [Richard Dawkins] is a graceful writer.""Why, oh why, did you have to put your rants in writing, Richard? Your poetry on beauty is so much better."
43,0618056734,http://goodreads.com/user/show/15252526-iami-menotu,5,Beautifully written book. A scientist write for everyone to understand about the beauty of science and how it made our world better for all
44,0618056734,http://goodreads.com/user/show/74525183-kate,2,The second star is for the nuggets of interesting biology and cognitive science scattered among the scornful derision and self aggrandizement.
45,0618056734,http://goodreads.com/user/show/23753941-ian-calhoun,5,"This book took way longer to read than I thought, but it was worth it."
46,0618056734,http://goodreads.com/user/show/5883903-marcus-tay,4,A beautiful explanation of things like rainbow.
47,0618056734,http://goodreads.com/user/show/101336882-keith-christoffers,0,New
48,0618056734,http://goodreads.com/user/show/1690088-tony,1,"Almost unreadable. I only finished it because I bought it on Amazon, because all the bookshops and the library are closed due to COVID-19."
49,0618056734,http://goodreads.com/user/show/57773209-chris-seltzer,3,"I fully appreciate what Dawkins was trying to do by fusing science and literature. However, I think it's one of his lesser works. There are better science communicators for this type of thing."
50,0618056734,http://goodreads.com/user/show/6148067-delson-roche,5,"Dawkins explains human nature , culture through the eyes of science. Another classic by Dawkins, I just can't have enough of his books."
51,0618056734,http://goodreads.com/user/show/86978744-shivantika,3,The first chapter is something otherworldly but the rest is just useless rantings.
52,0618056734,http://goodreads.com/user/show/9947765-misha,5,A delightful and reinvigorating stay on the brain health farm
53,0618056734,http://goodreads.com/user/show/553795-nemo,3,"I guess I am a bit fed up with the writing style of Dawkins, which is so ""ke yi"" to show his erudite, sense of humor, and ""guan tong"" art and various science. So in this book he talked like a godfather in the area of poetry, language origin, physics, media, astronomy, and of course evolution and biology. Again, what I like most and maybe like only by reading this book is his ideas and examples of selfish genes and memes, which are a repeat of his best book selfish gene. And it is refreshing to read these great ideas again and think about that ""I am nothing but just a secondary phenomenon, a survival machine made by genes"". Then, I don't really enjoy his various talk shows about art and other spaCes of science. I can't say he is wrong in them, it is just that I am not a fan when he talk about too many things and get lost from time to time. It is a bit like when I read Sagan Demon daunted world and I really want the book to end a bit faster."
54,0618056734,http://goodreads.com/user/show/12856123-sam,2,"I have read a lot of Dawkins’ books and this is not one of his best. I’m always incredulous that the same author can write so differently and pitch at different intellectual vantage points. The whole premise of this book is to defend scientific enquiry from the viewpoint of blunt realism and posit it as poetic and romanticised curiosity in the natural world. I suspect this is in response to the criticality to his believed determinism of life, as demonstrated in works such as The Selfish Gene. Unfortunately Dawkins is very conversationalist in this book and quotes heavily from Literature to provide some support for his arguments which are weak at best. This is a book where obvious science is alluded to with apparent parallels drawn in literature. If you were to remove the heavy use of quotations you would be left with very little scientific substance and I found myself bored throughout reading. "
55,0618056734,http://goodreads.com/user/show/45781981-clarence-cheong,5,"That this book proclaims to be about 'delusion and the appetite for wonder' is puzzling, for Dawkins devotes only a few sections to ridiculing mystics and offering slightly demeaning explanations for our naiveté when faced with an authoritarian account of the unaccountable. Dawkins spends more time elaborating on another considerable obstacle towards public acceptance and appreciation of science: our tendency to see science as cold, calculating, and devoid of poetry. This book is rife with examples of how science introduces us to worlds stranger and more mystical than we could have imagined, and of reminders that our everyday reality, as illuminated by science, hums along with miracles at every turn - miracles that we, unfortunately, have taken for granted. Dawkins' exhortations to gaze at the wonder of science - peppered with quotes from Romantic poets for good measure - can get a little pedantic, like the canned laughter in a sitcom that tells you how to respond at every moment, but as a whole I think he makes his point pretty well.Beyond this overarching theme of the poetry of science, Dawkins introduces disparate scientific concepts - it seems - with no rhyme or reason. First we learn about light, then waves, then DNA evidence, then we break for a section on statistics and 'poetic science', before continuing to learn about genes and the brain's capacity to understand the world. I can't find much meaning for why Dawkins is telling me about this concept at this point of time, which reduces somewhat my motivation to understand everything he's saying. But fortunately, though the concepts can get technical and a bit complex, Dawkins explains things pretty clearly, so there weren't many moments when I felt completely lost. Dawkins' rambling about scientific concepts is also redeemed by the fact that the ideas being presented are often genuinely fascinating. Although the content was more thought-provoking than comprehensive, I walked away feeling like I had learnt something new.The best thing about this book is probably the writing; in fact, I picked it up after reading an excerpt from it in a book about good writing by Stephen Pinker. The opening line - 'we are going to die, and that makes us the lucky ones' - is one of the best I've read in all of fiction and non-fiction, and Dawkins brings this idea full circle when at the end of the book he concludes that science's contribution to humanity lies in allowing us to say 'yes, this is why it was worth coming to life in the first place'. Simple, 'masculine' language - striking and effective. Dawkins writes with economical grace, as befits a man of science.But there are moments when he falters, offering faulty and underwhelming logic. For instance, he argues that if we were to reject DNA evidence in court, we would be forced to reject all evidence from less reliable sources - such as from eyewitnesses. I'm not too familiar with exactly why people want to ban DNA evidence in court, but I suspect it is because DNA evidence is inaccurate in a different way than eyewitnesses, possibly because it can be contaminated. In any case, there could be objections to the use of DNA evidence that are entirely unrelated to its reliability.Additionally, Dawkins spends quite a few chapters explaining the difference between good and bad 'poetic science'. I expected a more profound point, but it turned out the difference lay solely in whether the analogy made was scientifically accurate or not. Dawkins himself takes significant poetic liberties, tracing tenuous connections between concepts to bridge chapters, and at times I wonder if he may be guilty of the same 'bad poetic science' he rails against.As a whole, this was a great read, and would definitely recommend to anyone with some background in science or who, like me, has always harboured a suspicion that science contains great poetry."
56,0618056734,http://goodreads.com/user/show/6384410-cory,4,"I believe that Animal Farm's best paragraph is its last, and the opposite can be said of Unweaving the Rainbow; the best writing is found on the first page. Not to say that the rest of the book isn't worth reading, just that it begins brilliantly. ""We are going to die, and that makes us the lucky ones. Most people are never going to die because they are never going to be born""Dawkins has said that he plans on having Unweaving the Rainbow's first paragraph read at his funeral, and I hope he doesn't mind that I do the same. Arguable the beginning of the book can't be topped, but every few pages or so there will be another line that strikes the same emotional chords. It's science writing that makes your spine tingle. In part, Dawkins is sharing his love and fascination with the ""poetry"" of science. The truth about how rainbows form doesn't at all diminish their beauty, if anything, it adds to it. How wonderful is it that the right combination of sunlight and rainfall can cast a whole spectrum of colors upon the sky? But Dawkins is also making a small plea to the other science writers of modern times; he is asking them not to forget their feelings of wonder and amazement when they go to write their books and papers. If metaphor or simile can be used to enhance the readers understanding, it is wise to use them and contribute to the poetry of science. After The God Delusion (life changing, by the way), this was the second book by Richard Dawkins that I read. I must admit, it gets pretty dry at times, but don't give up on it! There is some of the best science writing out there in between those covers, and it very well could change how you look at the world. Every time I look at the night sky I feel as if it's the first time I've seen it, and that is the kind of feeling this book is trying to pass on: sheer amazement at the workings of the cosmos. Read Unweaving the Rainbow with the curiosity of a child and an adult's appreciation for literature and you will not be disappointed. "
57,0618056734,http://goodreads.com/user/show/19638210-dane-cobain,4,"Richard Dawkins is clearly a man of some considerable genius - his overall knowledge of physics and biology (and evolutionary science in particular) shines through in everything he ever does. Here, he refutes Keats' famous accusation - the poet accused Newton of destroying the poetry of the rainbow by explaining the origin of its colours, dispelling nature's great mystery.Dawkins goes on to argue that, in fact, science makes the world even more beautiful, because when you start to understand exactly how the world works, you can appreciate it for all of its genuine scientific beauty. And he's got a point.Now, I'm not the most scientifically-minded guy, although I try to approach things logically - I just don't necessarily know my quarks from my quasars, like Dawkins does. Nevertheless, his special brand of science is approachable and easy to understand and, in Unweaving the Rainbow, he explains how the world works in a way that enhances its natural beauty. And boy, is nature beautiful.Sure, it's not exactly easy-going, but Dawkins communicates his point with authority and aplomb, drawing from a long line of poetic and scientific thinkers to convey his message, a reminder of power of science to open minds and to educate the uneducated.This might not be the best book to read if you're superstitious, religious or otherwise inclined to use that spurious word 'faith' to defend whichever system you believe in, although it might just change your mind about a few things. You'd be better placed to read Unweaving the Rainbow if you prefer to rely on solid facts, as the compelling concepts it contains will only enhance your appreciation of the world that you already look at objectively.Dawkins' explanation of statistics and probability theory is also a highlight, and there are some true gems hidden inside the manuscript. Well worth a read, it's truly mind-expanding."
58,0618056734,http://goodreads.com/user/show/10050710-scott-hicks,4,"Wow. This was my first ever Dawkins literary experience, and all I can say is, wow. I was compelled to pick it up after watching some discussions with Dawkins on a variety of issues and topics. I'm happy to say that his eloquence in speaking is incredibly similar to his clear written-form prowess. What always seemed to impress me throughout reading Unweaving the Rainbow: Science, Delusion and the Appetite for Wonder was the way Dawkins made even the most complicated of subjects in the science world interesting and intriguing, and, most importantly, understandable. While there were certainly many ideas that flew right over my head, be assured it was at no fault of Dawkins, who still managed to make them compelling and engaging to me. He possesses a large arsenal of knowledge and wit that challenges you to think critically along with him as he tackles areas such as astrology, bad poetic science, the power and intrigue of genetics, uncanny occurrences all of us can relate to, and so much more. For me, it increased my awareness of the world and gave me a perspective I am certainly grateful to have. The first few pages alone shocked me with just some simple statistics and reflections on the universe.I encourage anyone to read this book. Go into it with an open-mind and remember that Dawkins' has written it to persuade you, and Dawkins himself even reminds you to think critically for yourself. I think you will feel satisfied from the experience just as I was, and enlightened with new perspective on many topics we encounter every single day of our lives. While Dawkins' has the reputation of being a ""chief Athiest"" of sorts, this book is much more focused on science rather than religion, and science stretches into all aspects of our life, so what do you have to lose?"
