,isbn,user_link,ranking,review
193,0393077829,http://goodreads.com/user/show/64763446-jacob-larsson,3,"Ramachandran is first and foremost a brilliant neuroscientist, and when he discusses his subject he does so with a curiosity and intellect that rivals some of the very foremost neuroscientists in history. Where this book loses me is when Ramachandran strays from what he knows best and make some pretty sweeping claims in fields he is not very proficient in. Sometimes it's obvious that he does so to bridge to fields together in a positive way. Where it's most grating is when he dismisses people who have worked in their respective fields their entire life, without giving good reason to do so (this is especially obvious when he is talking about linguists and philosophers). This was an overall good read with the chapters deep diving into interesting neurological disorders framed as captivating mysteries that Ramachandran solves à la Sherlock Holmes, but the book lags when Ramachandran loses attention to the topic and strays from what makes this book good."
194,0393077829,http://goodreads.com/user/show/59592059-shubham-bansal,5,"Know thyself!Philosophers, Psychologist, Mystics, Gurus, Sales People, and many many others are in the field of studying human. In fact, studying 'a human' is probably one of the biggest academic areas. The studies range from being purely biological, to ontological, physical, mental or spiritual but we are yet to find a congruent theory about what a human is. Questions like, how humor came to us, what is self, how does introspection evolve, how does empathy and morality came into existence, are fascinating. This book tries to explain some of these questions and other metaphysical concepts in terms of neurology and evolution. When seen from the point of view of neurons and brain wiring, everything seems to be so clear and objective. It is like reading human in terms of binary numbers. Although a lot of research needs to be done, as mentioned many times, this book still takes you on an awesome ride. "
195,0393077829,http://goodreads.com/user/show/59056179-ariel,4,"There were some points in it, where the author seems to wander into the realm of metaphysics and science fiction, such as wondering where our introspection and sense of self ""comes from""; concepts and ideas I personally think we could go round and round with and never really resolve. But I suppose that was the point of the book, it is in the title after all. But the majority of the book covers neurology, neurological disorders, solutions that seem part psychology and part neurology, and anatomy. I found it interesting, and reading the graphs in the front as a sort of basic map of the brain, it was fairly easy to understand which parts of the brain he refers to for which function. Favorite quote from the book ""Science tells us we are merely beasts, but we don't feel like that. We feel like angels trapped inside the bodies of beasts, forever craving transcendence."""
196,0393077829,http://goodreads.com/user/show/17031673-ritu-malik,5,"Unless there is an extraneous motivation like a looming Book Group deadline or the strong urge to have a self-imposed classroom to decipher what goes in this organ that whizzed us 'Homo Sapiens' at the top of the food-chain, it will be hard to finish this book. Notebook and pen, an absolute must along with a huge mug of caffeine! Though, with all the groundwork, the ""overwhelmed' feeling remained a constant. In over 350 pages, Ramachandran has demonstrated with simple experiments, how our brain evolved and consequently our vision-perception and language, among many other things. The Chapters on Synethesia and Mirror Neurons were my favorite. What was fascinating to me is that Neuroscientists have just scratched (from memory only 1/3) the mystery of our pre-frontal cortex, that you question, -'Can we ever get better of Nature?'Through his simplistic style of writing, cross-referenced with Philosophy and English proverbs, it is a readable book for a Neuroscience novice."
197,0393077829,http://goodreads.com/user/show/80093563-jonathan-fishbein,4,"This has literally been on my ""to read"" list for 6 years! I first heard of it when Ramachandran was interviewed on NPR--I remember beyond so fascinated that I sat in my car to listen to the full interview. Anyhow, I finally got around to it and wasn't disappointed (although it did drag a little and took me longer than anticipated to finish). I enjoyed the anecdotal stories of patients with various brain injuries, and how those injuries inform us how a normal brain works, how we understand, use language, appreciate aesthetics, appreciate the concept of self and so-on This isn't for everyone, but it is written for the layman, so I think if you have even a cursory interest in neurology, you would appreciate and enjoy it."
198,0393077829,http://goodreads.com/user/show/56399556-harshita,5,"I am 'general public' with working understanding on neuroscience.The discussions/ illustrations in this book blew my mind, such complex concepts explained so simply backed by research methodologies. This is one book that I will reccommend to everyone who is anywhere close to interested in the working of our super machine - brain.My favourite part is where the author discussed about our perception of shadows and how having only one sun puts limitations on how we see things; ref: chapter Seeing and Knowing. Definitely the book I will read again and again. (To combat attention blindness... ref to Now you see it by Cathy Davidson that I'm currently reading.)"
199,0393077829,http://goodreads.com/user/show/31026998-monica-patel,4,Amazing view of what makes us Human from neuroscience point of view... I especially enjoyed the chapter on evolution of Language. It's a great mix to read with other non fiction like Sapiens and Happiness Hypothesis. Most interesting thing was V S Ramachandran learned more about brain and behaviors from abnormalities rather than healthy brain. Since I'm not neuroscience student and don't know anything about brain and it's working some of the theories put forward by the book were unbelievably or I should say I am skeptical about them. But this definitely intrigued me to read more on them. Over all enjoyable read :)
200,0393077829,http://goodreads.com/user/show/47357826-puja-killa,5,"4.5*Bold and brilliant. This book attempts to answer many queries which have intrigued me, some since I was a child. Like origin of language. I am sure we all have wondered about who got to decide the specific words and sounds that we call language. And how were they decided? That one chapter on language itself made the book worth reading for me. And that’s just one chapter. There is a lot of educated guesswork and speculation. But Dr Ramachandran takes delight in putting bold theories forward and seems happy to take any forthcoming criticism with a large dose of his good natured sense of humour."
201,0393077829,http://goodreads.com/user/show/65666109-mike-lingle,5,My favorite book on the brain. Ramachandran's foundational work on mirror neurons is fascinating. He focuses on illnesses and defects to help understand how one part of the brain affects the rest. He goes through real-life situations where patients had some type of disease or injury and shares the detailed outcomes from their diagnosis as a way to explain how things work together (and what happens when they don't).Everything in the brain is non-linear and the way things work is astounding. It reads a bit like a physics book (which I love) and left me feeling amazed.
202,0393077829,http://goodreads.com/user/show/26223313-heathyr,3,"What's with all the sympathies for Freud? Anyways, it would have been a better book if I bought into his underlying premise, that humans are somehow different, and special in some mystical way. This book embraced a VERY broad range of topics, including musings on art, the development of language, and synesthesia. In my opinion, he tries to make mirror neurons explain way more than they're probably related to, but I guess that's his life work so... I love his style though, it's unexpectedly funny."
203,0393077829,http://goodreads.com/user/show/19094894-beverly-hollandbeck,3,"This is supposed to be a non-technical explanation of what goes on in the brain that gives us a consciousness as a human and makes us different from animals. The author also explains what goes wrong neurologically that results in misrepresentations in one's mind (""that's not my arm; it's my mother's""). While interesting in the types of things that can go wrong, the author missed the mark in being non-technical. He tells and shows in intricate detail, and names in Latin precision, exactly where the misfiring is happening. This needed a dose of Oliver Sacks."
204,0393077829,http://goodreads.com/user/show/81360012-najeeb,4,"SIMPLY GENIUSThe ideas put forward by the author are just as brilliant as they are simple. The genius of the experiments designed to prove/disprove the ideas leave u awestruck. Mr Ramachandran reminds us, that even in this age of advanced micro and nanotechnologies, sometimes good old brainstorming coupled with well crafted experiments can take us a long way. Though some parts of the book can seem to convey ideas too preliminary or too vague, its a great read for anyone intrigued by the way our supercomputer works! "
205,0393077829,http://goodreads.com/user/show/19710768-robert-bogue,5,"Life is chaos. It’s the million-billion random connections that make life interesting. All art and all science seek to understand us. We try to understand the connections in our own minds that make us, well, us. By understanding ourselves, we will have completed a quest that is as old as humanity and gained access to the keys that unlock productivity and happiness. The Tell-Tale Brain: A Neuroscientist’s Quest for What Makes Us Human is less of a solution and more of a treasure map, leading us to landmarks that help us understand who we are.Click here to read the full review"
206,0393077829,http://goodreads.com/user/show/7486666-leah,4,"This book is a fascinating look at how the brain, unique to humans in its quest for understanding itself, can try to grow and learn about humanity, about how the brain itself works, how disorders are both heartbreaking and intriguing simultaneously, and how this brain researcher has set out to find answers. He is also a funny author, who throws in a few curve balls that sometimes make you laugh and sometimes make you roll your eyes and groan. I appreciate the ""humanness"" of his writing. This book was definitely an interesting read!"
207,0393077829,http://goodreads.com/user/show/79215548-alexander-topalov,5,"Book is absolutely amazing. If you are interested in how the brain works how you can use that knowledge to your advantage this book is for you. The stories are bizarre, they are engaging and above all they illustrate how the “normal” brain works, processes and interprets information. This is immediately helpful especially when you want to unlock some creativity, learn to a new skill, enjoy or understand art or simply get to a tough situation. I would 100% recommend this book."
208,0393077829,http://goodreads.com/user/show/85067571-madalina-banuta,5,"We take symmetry as a sign of beauty because it's an indicator that that person was/is parasites free. We prefer lighter skin people as partners because on lighter skin you can tell better if that person suffers from anemia. I didn't know how little is known about the brain until I read this book. Now I know the size of my ignorance, but I also got loads of big insights or smaller trivia nibbles like the ones above - great conversation starters at a party, I would reckon!"
209,0393077829,http://goodreads.com/user/show/47161175-lim,0,"So many questions answered, and left so many incomplete. I'm not fit to rate this book because as much I understood, I am also astonished/surprised/confused/scared and so many other things. I will need to do more research on the subjects associated or reread this book again, to take in a lot of the things I've come to know from this. Definitely very keen to find out more about Neuroscience (hahah who am I, right?)."
210,0393077829,http://goodreads.com/user/show/81026067-shravan-venkataraman,5,"A brilliant book for neuroscience enthusiasts. In this book, VSR's experiments related to brain - on a wide array of things - synesthesia, vision, perception, high performing autism - asperger's, and so on. I need to read this book again for probably two three times. This is an amazing and very lucidly explained book, and a brilliant intro to neuroscience as such. "
211,0393077829,http://goodreads.com/user/show/101245733-radha-kumari,4,"A great book to understand neuroscience; the author has a unique way of presenting facts and making speculations. It includes physiology and technical language, yet doesn't get boring. The author has great story-telling abilities with a good sense of humor. Some of the theories and case-studies are mind-blowing. "
212,0393077829,http://goodreads.com/user/show/5133745-sarah,4,"This was my first book by VSV, after reading about his incredible breakthroughs in other books. I enjoyed the first part of the book on chronic pain and the last chapters on aesthetics and self awareness, they were so good they warrant the four stars, but I struggles through the chapters on senesthesia and autism and nearly abandoned the book when I though they were never going to end. "
213,0393077829,http://goodreads.com/user/show/84860723-subha,5,I got a good insight about autism after reading this book...Prof ramachandran explains very complex neurological details in a very easy manner so that even layman like me can understand.never got bored throughout the book.even when he guesses few things in the book those seems more logical and makes sense
214,0393077829,http://goodreads.com/user/show/11480261-heather,2,"It would be more convincing if his mirror box method of curing phantom limb pain was more easily and reliably reproducible. The book seems to rely on too many anecdotal accounts. weird side note: I listened to the audiobook and during the example of speaking gibberish, I heard 3 distinct sentences in Thai, albeit very badly pronounced. "
215,0393077829,http://goodreads.com/user/show/85277069-meghan,4,"Overall, a great book. Ramachandran’s research has had an incredible influence on the field of neuroscience and everyone knows this. The only reason why I gave it four stars is because of several unnecessary jokes and comments that I assume were attempts to add humor, but felt oddly inappropriate and like they were aimed at a male audience. Just unnecessary. "
216,0393077829,http://goodreads.com/user/show/45973253-lalit-mohan,5,"These ideas will go down in history as a major stepping stone to transcendence. ""Science tells us we are merely beasts, but we don’t feel like that. We feel like angels trapped inside the bodies of beasts, forever craving transcendence.”"
217,0393077829,http://goodreads.com/user/show/23218972-sarahkat,3,"A lot of the same info as in Phantoms in the Brain. This would be good if you haven't read the other. The audio narration was a bit stale. I enjoyed Phantoms more, possibly because I read it in book form"
218,0393077829,http://goodreads.com/user/show/67054549-kirsten,5,"Had to read chapters of this for school but I loved Ramachandran's voice and found the subject matter so fucking engrossing that I bought the whole book. Really interesting, accessible, and has helped me view the world through a clearer lens. "
219,0393077829,http://goodreads.com/user/show/9731893-ken-mattes,5,"Wonderful perspective of a neuroscientist to address the known function of brain regions, their interactions and hypothesis projection regarding what makes us human and the formation of self.Worth the listen/read."
220,0393077829,http://goodreads.com/user/show/15408-chris-march,3,"Some fascinating oddities of neurological disorders, along with mostly testable speculations, marred by some off-color humor and inappropriate digressions. I preferred his earlier book ""a brief tour of human consciousness""I listened to the audiobook at 1.5x"
221,0393077829,http://goodreads.com/user/show/8988257-raluca,4,"The book deals with the many findings of what Mirror neurons do as well as functionalities of the other parts of the brain. It was a most educational book in neurology and behavioral psychology for one as unknowledgeable as myself, who often got lost in the terminology."
222,0393077829,http://goodreads.com/user/show/111250931-subham,5,I would suggest everyone who is scientifically inclined to read it. It is very well written and is fascinating in many ways. The case studies are really interesting and the chain of logic will often baffle you. 
223,0393077829,http://goodreads.com/user/show/14050505-andy-boroditsky,3,"It was extremely interesting in some aspects, but utterly slow and boring in some parts, especially in the second half. I suffered with this book for more than a month, it is simply too long and unstructured for my taste. "
224,0393077829,http://goodreads.com/user/show/98142361-megan-byrd,1,"Why do I need to know that a student had a lower back tattoo? Way too much unnecessary dialogue and recreation of complete conversations. Not enough practical brain application and at times, offensive language for atypical neurology. "
225,0393077829,http://goodreads.com/user/show/27871349-john-g,2,"The Tell-tale Brain did not explain much for me, and I didn't finish it."
226,0393077829,http://goodreads.com/user/show/16991337-chehalis,0,"I loved reading this book. It was for my bio-psych class in undergrad, but it was entertaining rather than just having to read the textbook."
227,0393077829,http://goodreads.com/user/show/19641131-frances,3,"Interesting as usual, but not as wonderful as Phantoms in the Brain (draws on the same case studies, too)"
228,0393077829,http://goodreads.com/user/show/17794099-emily,5,Oh this was such a great book. I felt like I learned so much. I hope Dr. Ramachandran writes another book. I'd like to know what other advancements have been made since this was published.
229,0393077829,http://goodreads.com/user/show/81581523-brittany,3,"It was good, but I just wasn't in the mood for non-fiction. I'll come back to this one!"
230,0393077829,http://goodreads.com/user/show/32735520-ferhan-siddiqui,5,"Brilliant book. Slightly pedantic at times, (understandable given the technical topic) but always thoughtful"
231,0393077829,http://goodreads.com/user/show/61721469-gordon,4,"Good book. He has the humility to not claim to have the answer to the hard problem of consciousness, or to explain it away as ""akshully it's not even a problem""."
232,0393077829,http://goodreads.com/user/show/55966876-nari,4,"Rehashes some material from his prior book, Phantoms In the Brain. "
233,0393077829,http://goodreads.com/user/show/8814018-j-k-george,4,Just full of amazing things most of us do did not know. 
234,0393077829,http://goodreads.com/user/show/46041120-pranjal-chandrakar,4,Complex workings of the brain explained with the help of simple examples.
235,0393077829,http://goodreads.com/user/show/87653061-alpesh-maru,4,Must read book to get insight in field of neuroscience and to know about fascinating cases.
236,0393077829,http://goodreads.com/user/show/103824776-ashley-thompson,4,very interesting book on neuroscience
237,0393077829,http://goodreads.com/user/show/104647337-david,4,Nicely written and easily to follow. This book is pretty dense with info and written at a medium to high level. 
238,0393077829,http://goodreads.com/user/show/107112581-matthew-upton,5,Amazing book. Great approach to tackling topics with no authoritative conclusions as if yet
239,0393077829,http://goodreads.com/user/show/77131587-oleg,2,"""No one has proven the mechanism yet, but here is how i suspect it works."" This is all what you have to know about this book."
240,0393077829,http://goodreads.com/user/show/8240777-timothy-kauphusman,2,I read this book in order to learn about neuroscience not the author's political views
241,0393077829,http://goodreads.com/user/show/105298937-greg-keel,5,"Good book if you are interested in neurology and how the human potentially developed aspects we attribute to consciousness (art, music, self, etc.). "
242,0393077829,http://goodreads.com/user/show/100407077-vevek-seetharaman,4,"A neuro scientist take on philosophical questions like ""Consciousness"", ""free will"" etc. A good read "
243,0393077829,http://goodreads.com/user/show/5916225-erin-panjer,4,"I did enjoy the book, it would have been 5 stars, if it weren't for his chapter on autism, and an underestimation of the sophistication of dolphin speech. Still a great read."
244,0393077829,http://goodreads.com/user/show/103037898-christine-kaulesar,4,"""Everything is connected one way or another.""Very interesting and informative read if you are intrigued by the intricacies of the brain."
245,0393077829,http://goodreads.com/user/show/48474901-aleksandra,5,Only took me 10 months to read.. but generally very eye opening and well written. A perfect complement to my human sciences course at University.
246,0393077829,http://goodreads.com/user/show/103360381-denis-scuba,5,"Very lovely book. It is not, by all means, a comprehensive guide to psychology. Rather, it is a good read for a beginner in this topic.Must read."
