,isbn,user_link,ranking,review
117,0393077829,http://goodreads.com/user/show/9039201-narong-atsawasuranat,4,"Many ideas in the book are just pure speculative or educated guesses like the author said. it's also full of undone experiments to confirm the theories the author has proposed. many brain damage cases are fascinating though. I'd like to translate the example that's in Thai language since the author used to study in Thailand when he was young . ""Sawadee Khrap, Chua alai? Kin Krao la Yang?"" means ""Hello, What's your name? Have you eaten yet?"" :)"
118,0393077829,http://goodreads.com/user/show/4475077-abigail-king,4,"Loved this. Author's cockiness is usually entertaining but occasionally irksome. How many times did I flip back to the author photo on the jacket and think, ""really, VS?"".But it's a brave and powerful exploration of a difficult subject and there are pages that should be required reading for every human (and robot). "
119,0393077829,http://goodreads.com/user/show/660445-karin-mitchell,5,"I love that Dr. Ramachandran can update you on current neuroscientific breakthroughs and still sound like a person you'd like to have over for a beer and a burger. I'm wild about the mirror neuron information in this book. The information in the book is largely accessible, but I feel like I should read this book a second time in 6 months to make sure it sinks in. "
120,0393077829,http://goodreads.com/user/show/2530965-ronald-barba,5,"The evolution of the human brain, past our understanding of the presumed limitations of that evolution. What? [R]EVOLUTIONARY. A great deal of focus on mirror neurons and the plasticity of the brain, and all this is presented to the audience in an easily digestible, slightly comedic-style of writing. "
121,0393077829,http://goodreads.com/user/show/5751225-simmons51,4,"Fascinating research by a neuroscientist about how the brain works, and sometimes doesn't work, at least not in the usual way. Autism, phantom limbs, and synesthesia are just a few of the areas discussed. The author also explains his theories on the evolution of the human brain and what it is that makes us different from other animals. "
122,0393077829,http://goodreads.com/user/show/5738823-judith,4,"""Science tells us we are merely beasts, but we don't feel like that. We feel like angels trapped inside the bodies of beasts, forever craving transcendence. That's the essential human predicament in a nutshell."" Ramchandran explores what it means to be uniquely human from a neuroscientist's perspective.Fascinating."
123,0393077829,http://goodreads.com/user/show/8124742-jonathan,0,"Published in January of 2011. Most Amazing, insightful stuff from a new hero of mine in the neuroscience field. His writing is readable and exciting. Lots of science and case studies for the general reader and not dummied down to the point of a kid’s book. If you like Oliver Sack’s books, this guy is for you. Look for his lectures online. His delivery is exasperatingly brilliant."
124,0393077829,http://goodreads.com/user/show/6134087-karan-tyagi,5,"I wanted to get more information about neurology and the librarian recommended me this book, and its really good. This book talks about the main points on being a neurologist and basic conflicts they go against. It also talks about how they find ways to control the mind and make your body do stuff that you can never attempt on doing. I really enjoyed reading this book. "
125,0393077829,http://goodreads.com/user/show/646513-lisa,5,"Phantom limbs, synesthesia, the evolution of language, the underpinnings of empathy, art appreciation, a sense of self: How do our brains allow us to perceive, understand, interact with, and enjoy the world around us? The questions, poignantly raised by Ramachandran, are as fascinating as his theories and answers.--Lisa Genova"
126,0393077829,http://goodreads.com/user/show/5804318-sandeep-saroha,4,This book gave me exactly what I wanted - how the mind works. Ramachandran takes on complicated topics like self and free will. who would have thought that neuroscience can give answer to these seemingly philosophical and spiritual ideas. Ramachandran is pioneering this work and he is rightly called by Richard Dawkins - marcopolo of neuroscience
127,0393077829,http://goodreads.com/user/show/11313613-nancy,3,"Great book written by a brilliant doctor. Many times the book was a little too deep into the science for me to comfortably follow along, but what I did get was really interesting and I did learn a lot. Unfortunately, I think to really absorb the material I'd have to read it again, much more slowly and deliberately."
128,0393077829,http://goodreads.com/user/show/7711047-michael-edwards,3,"I might have liked this book more had I been less familiar with the subject matter. I feel like it lacked the personal touch to help connect with the disorders. I also disliked the many tests he came up with, but didn't try, seems pointless to fill a book with things you think might happen, if you could just as easily test it and let us know."
129,0393077829,http://goodreads.com/user/show/692335-adam,5,"The author is a well known medical researcher in the brain. The book uses plain language to describe the working of brain, our concept of self, beauty. What I found interesting is the writer's description on several mental illness and his view from anatomical, evolutionary perspective. It has quoted and discussed Freudian psychology and the interaction with neurological science. "
130,0393077829,http://goodreads.com/user/show/13305511-karin-gottshall,2,"If consciousness is a medical condition, then I guess this book can be considered a ""tour"" of it. This book fails to live up to its ambitious subtitle, and is terribly written to boot. I gained no real insight into ""what makes us human;"" all I really got out of this book are some fun anecdotes to impress people with at parties about the freaky things that can happen when you poke someone's brain."
131,0393077829,http://goodreads.com/user/show/13486996-donna,3," Very interesting book, however not as enjoyable as Ramachandran's previous book ""Phantoms in the brain"". Rather too indepth and complex for a casual read. More suited to someone with a good prior knowledge of neurology. I am a medical doctor with an interest in neurology and I still sometimes lost track of what was bring explained. "
132,0393077829,http://goodreads.com/user/show/1003570-marcali,5,"""...Ramachandran at his best, a profound intriguing and compelling guide to the intricacies of the human brain."" —Oliver Sacks(what better praise, than from Caesar?)So much great stuff ....if had Buffett-level capital worth, would call up & fund every one of the mentioned still un-done experiments."
133,0393077829,http://goodreads.com/user/show/15952053-judit-szabo,5,"Fascinating insights from one of the most down-to-earth, patient-oriented neuroscientists, Vilayanur Ramachandran. The book is full of interesting experiments, and if you came across this book while looking up info on synaesthesia, that is discussed extensively, too. I would recommend it to anyone who is interested in how the brain works."
134,0393077829,http://goodreads.com/user/show/1923397-ninakix,5,"this book was fairly controversial for the way it took what we know about mirror neurons and expands it outwards into a number of fanciful and interesting theories. Frankly, even still, it's one of the more interesting thins I've read on mirror neurons. But the book is primarily about connections: the way our brain makes connections and enables us to think in unique ways."
135,0393077829,http://goodreads.com/user/show/20051503-kunal-sen,5,"Another fantastic book by Dr.Ramachandran. This time he goes beyond hard science and speculates about things like the neurological and evolutionary basis of art, aesthetics, consciousness, self, and free will. He brings these issues from purely philosophical discussions to the edge of experimental exploration. We are living in very exciting times!"
136,0393077829,http://goodreads.com/user/show/9533949-kimball,2,"I listened to this while driving back up to Utah on Christmas Break of 2013. I thought the subject was fascinating. However, a lot of it went over my head because I was unfamiliar with terms and procedures. The author also used figures in his examples and since it was an Audio book I couldn't see it and thus was even more lost. I will need to read it again when I'm older."
137,0393077829,http://goodreads.com/user/show/5897674-darran-mclaughlin,3,"This is my first exposure to Neuroscience, which seems to be very fashionable these days. There was a lot of fascinating material in here but to be honest it took me ages to read and I was distracted a lot of the time. It does sound as if Neuroscience may be able to solve a lot of mysteries about the mind, the self, human nature etc... I'll have to explore it further later on. "
138,0393077829,http://goodreads.com/user/show/28558528-souradeep-chowdhury,4,"Ramachandran is no prolific writer, but he is an excellent researcher. With innocuous questions like a child may ask, and by employing the simplest of research techniques, he has succeeded in uncovering much of the black box. The target audience for such a book may be limited, but for those who do manage to read and assimilate the information, it's worth everything you put into it."
139,0393077829,http://goodreads.com/user/show/17666233-curiosbag,5,"Mind blowing!! My first brain science book and I love as the author describe things easier for non specialist to be able to understand brain anatomy, symptom, disease and related phycology. And it changed my way of seeing people as a person in perspective view of scientific. very informative! brilliant book! "
140,0393077829,http://goodreads.com/user/show/11231806-zdravko,4,"while mostly rehashing his previous books, v.s. ramachandran also adds some new insights, such as (1) exploring the connection between synesthesia and creativity by identifying the mechanism of cross-modal abstraction (which probably also has some bearing on the ability of system 1 to do what kahneman calls 'intensity matching'), or (2) his speculative account of the evolution of language."
141,0393077829,http://goodreads.com/user/show/21460808-vish-wam,5,"An enthralling book on the intricacies in the workings of the brain written in the most humorous of ways possible. A definite pre read for any one taking up life sciences. Puts us in contemplation of life's most significant questions like ""What is consciousness?"" ""What defines the Self"" and so on. One is simply made stranded with the definition Body: ""Just a vehicle for the human mind"""
142,0393077829,http://goodreads.com/user/show/37181126-stephanie,4,"Loved it. Took a star off because the publisher let him include a number of mildly stupid misogynistic and anti-semitic joke attempts. Informative, enjoyable, got through it in a day because, hell, it was fun. Accessible to the general population yet still had a lot to offer the physiology nerds/zombies of the world looking to delve deeper into the workings of the BRAAAIIINS."
143,0393077829,http://goodreads.com/user/show/15614479-kaushik-nayak,5,"This is a great attempt by a neuroscientist to explain the science of the workings of the brain to general audience. Ramachandran first takes a disorder as a starting point to make conjectures about the various pathways of the brain that could be involved in the abnormality. Then with a series of experiments on the patients, he arrives at a conclusion to assert why the conjecture is true."
144,0393077829,http://goodreads.com/user/show/5217753-debra-daniels-zeller,3,"This was an intriguing book about the human brain and I loved the section about synesthesia and autism, but it felt off balance because so much of it was devoted to art and how can we know what good art is. Many parts seemed repetitious and all the real estate devoted to the characteristics of art, I got bored. For me this book could have used a good editor."
145,0393077829,http://goodreads.com/user/show/20849833-debjeet,5,"This is one of the most fascinating and well researched books on neuroscience I have ever read,,every other sentence I end up underline in this book,,so many useful information on how our brain processes things is simply beautiful..This is must have book for any one who has slightest of interest on neuroscience."
146,0393077829,http://goodreads.com/user/show/8277087-ari-lapin,2,"I started off with great expectations for this book as I have read of some of the research that the author has performed and find it fascinating. The subject is also hard to make uninteresting. However I did not find it to be well written, and the author’s incessant and unnecessary political digs further detracted from my enjoyment of the book. "
147,0393077829,http://goodreads.com/user/show/4965001-jane-thompson,5,"Brain StoryThe author presents a theory of the construction of the brain and how we see ourselves. Sometimes it is difficult to understand, but h He also makes clear the relationship of the brain's structure and the sense of self. I was particularly interested in his ideas regarding phantom limb pain and found it very interesting."
148,0393077829,http://goodreads.com/user/show/6892589-akshay-jain,5,Amazing x 100000000The author has amazingly explained the things modern neuroscience has found out about the brain and connected that with what that means from a top level. Great intuition combined with good writing. Leaves you hungry to learn more about the brain and the nature of consciousness itself.
149,0393077829,http://goodreads.com/user/show/1555526-bernadette,0,"So far so good, written in a manner that is easily accessible to non-neuro scientists. The only complaint I have is the weird and creepy casual sexist comments he makes like trying not to look at a student's tattoo that is barely covered by her low rise jeans."
150,0393077829,http://goodreads.com/user/show/793776-siri,3,Ramachandran is an accessible writer for a subject than can sometimes be inaccessible: science. Lots of his real life experiences humanize the subject matter. I learned some stuff about phantom limbs and the brain that i will likely never apply. It was all very interesting.
151,0393077829,http://goodreads.com/user/show/9908646-teresa,4,"""Ramachandran uses neuroscience to explore questions of human existence through the discussion of very unusual cases.""read more at: http://likeiamfeasting.blogspot.co.uk..."
152,0393077829,http://goodreads.com/user/show/260338-dianne,4,I listened to this on CD. Caught myself more than a few times thinking about what exactly my brain was doing while I was driving! I would like to see/read the print version to view the diagrams and figures that were referenced. I can't say it enough - brains are fascinating.
153,0393077829,http://goodreads.com/user/show/18316739-santosh-ramakrishnan,5,Great work. Great analysis. Loved the completely unethical approach to analyzing the functions of the brain and its evolution. Truly enlightening. Great work by a great person !! Really appreciate !!
154,0393077829,http://goodreads.com/user/show/749242-andy-plonka,4,"While I don't totally agree with the author's main premise that humans are not just another animal, but a superior being, some of the experiments that he and other scientists interested in Neurology have done have contributed to our understanding of how the nervous system works."
155,0393077829,http://goodreads.com/user/show/4866356-sorcha,3,I really did not appreciate Ramachandran's barbs towards creationists. Stick with the shit you know and quit trying to act intellectually superior to anyone who dares oppose own person beliefs. I get it. You're an atheist. Good for you. 
156,0393077829,http://goodreads.com/user/show/1833465-jenny,4,"A survey of neuroscience discoveries and theories backed up by simple experimentation. Similar to the stories of Oliver Sachs. I actually expected to hear overlapping anecdotes but these were all new to me, with the exception of the phantom limb treatment involving mirrors, which I'd heard before."
157,0393077829,http://goodreads.com/user/show/24057268-nissa,4,Learning how the brain works is always fascinating. Since I listened to audio version I am sure some went over my head. I had to really pay attention or I would get lost. He has studied mirror neurons and of which is able to explain and propose future explanations of much of our behavior. 
158,0393077829,http://goodreads.com/user/show/918423-david,4,"An expansion of Ramachandran's A Brief Tour of Human Conscious. Uses interesting stories as examples of how the brain functions. For instance, the man who looks at familiar faces but thinks they are imposters. Or people who are paralyzed but deny it. The brain is a weird interesting organ."
159,0393077829,http://goodreads.com/user/show/6659514-devina-dutta,4,"Fascinating and brilliant, the book through its various case studies and real life examples succeeds in introducing a layman into the interesting world of neuroscience. With the help lucid explanations and his inherent droll humor, V.S. Ramachandran presents a truly compelling book. A must read!"
160,0393077829,http://goodreads.com/user/show/5788976-ratforce,0,"If you like Oliver Sacks' writing, you may enjoy Ramachandran's science writing. Like Sacks, he writes about specific case studies, and his book also reads more like fiction. A fascinating exploration of how the brain works. "
161,0393077829,http://goodreads.com/user/show/259436-jim,2,Audio CD. The narrative was all over the place. Didn't build upon itself. Had a long chapter about art and the brain that didn't fit in at all. Some of the patient stories were interesting but the book fell short overall.
162,0393077829,http://goodreads.com/user/show/27623102-cem-guvener,3,I love to read and learn about how brain works (actually about how much we know about how it works) but this one was a tough read with a lot of terminology. I listened to an audiobook which may have made it tougher so that may have been a problem.
163,0393077829,http://goodreads.com/user/show/26695186-ravikiran-b-a,3,"Engaging for a while, after which it gets too technical, with Dr. VSR sacrificing his enjoyable case studies in favour of long-winded textbook-ish descriptions of neuroscience and brain physiology. Educational for sure, but has a tendency to put the reader off at times."
164,0393077829,http://goodreads.com/user/show/13657366-sean,5,"A Brilliant Trip Through the BrainDr. Ramachandran, one of the most brilliant neuroscientists of our time, takes his reader on an incredible journey through the workings of the mind that is both thought provoking and incredibly entertaining."
165,0393077829,http://goodreads.com/user/show/74777457-emir,5,"It did a remarkable job transmitting Ramachandran's thingking style about science and in his investigations.However, forgive me for this Mr. Ramachandran, I could not get rid of the feeling that I was reading Phantom's in the Brain Extended Edition."
166,0393077829,http://goodreads.com/user/show/27131081-andrea-norr,5,Ramachandran delves into a complex and interesting subject in this book. The explanations he posits for many unusual and typical brain behavior are fascinating. I appreciate the book is written so many people can read and understand it. 
167,0393077829,http://goodreads.com/user/show/51610309-karnish-thakkar,4,"I got many goosebumps from this book . Facts like TMS induced skill development,tiny/enormous word connection with change in oral cavity shape,maleria induced fever to treat autism,the dancing nymph description... and many more .worth to read "
168,0393077829,http://goodreads.com/user/show/66271309-vikki-houghton,4,"A very clear, informative and wildly interesting summary of some major aspect of neuroscience. Ramachandran breathes some of his effortless humour into the prose, which can sometimes be rather specialised and technical (though only a touch, it is still comprehendable for a lay person). "
169,0393077829,http://goodreads.com/user/show/76863493-kevin,5,"Fantastic survey of neuroscience that keeps you intrigued as if you were reading a mystery thriller. Also enjoyed how Ramachandran unabashedly posited his own opinions, theories, and wild ideas throughout the book. Reminds us all of why science is so cool."
170,0393077829,http://goodreads.com/user/show/553795-nemo,4,"I really enjoyed the few chapters about vision illusion, and art origin, etc. The whole book is a bit too much with brain anatomonical tech terms and unless i am a doctor of neuron, i really am lost here and there during the reading. Overall i guess i still learned somthing about brain working. "
