,isbn,user_link,ranking,review
46,0393077829,http://goodreads.com/user/show/5206455-jon,2,"The stories and research were fascinating, but it seems the book had a secondary purpose to bash religion. I could have done without that. The author creates some interesting theories that he can't really prove, yet claims in the same breath that he must be correct and there is no other explanation. That is not scientific thinking."
47,0393077829,http://goodreads.com/user/show/10968957-david-anto,4,Very good collection of puzzling mental disorders and speculative analysis of possible interference onto the human nature. No grand overarching idea and rather loosely interlinked chapters. Many parts are just pure speculation but I guess it's better to start somewhere than just staying silent on these important topics. As a pop science book I think it is among the best ones out there. 
48,0393077829,http://goodreads.com/user/show/11820811-camelia-rose,4,"Very informative book. The author covered many different topics in neuroscience, all in his opinion related to human race's ""uniqueness"". However, I wish he had a better focus. Each chapter could have been turned into a book or multiple books. I wish he had informed us whether the patients mentioned in the book had been ""cured""!"
49,0393077829,http://goodreads.com/user/show/30281185-sajith-kumar,4,"A rare work of erudition that elevates man out of the company of apes and establishes his uniqueness among all life forms, yet having solid foundation on true science.V S Ramachandran is a distinguished professor and neuroscientist at the University of California, San Diego. He is best known for his experiments in behavioural neurology and has been called a latter-day Marco Polo by Richard Dawkins. He is a renowned author on neuroscience and is a recipient of India’s third-highest civilian award and honorific title: the Padma bhushan. In this book, Ramachandran narrates literally what goes on in the brain in our everyday lives. With inputs from his vast clinical experience, he tells about what goes wrong in the case of peculiar disorders of the brain. He does it in a careful way as to be comprehensible to lay readers, while at the same time not going down too low as to feel pedantic for those who have background knowledge. One fact that is clearly visible throughout the treatise is the amount of knowledge, or lack of it, that is accumulated over the years in the field. A neurologist is a person who can claim ignorance of many areas coming under his field of specialization, but can still get away with it. The purpose of the book is to expose the uniqueness of man among planetary life. Man owes his special status to his brain. Readers with special interest in the field will find this book to be of immense use in pursuing their aim further, while others get a sense of wonder at the literally mind-boggling aspects of the brain.All books on the popular science genre treats man only as an advanced ape. Mere ape, as Ramachandran remarks sarcastically. The reason behind this forced mediocrity is that the creationists are breathing down their necks, constantly on the lookout for a slip of the tongue or an expression of wonder at man’s special powers which will then be blown out of all proportions as evidence for the biblical claim that God created man in his own likeness. That’s why popular authors invariably trumpeted man’s similarities with other apes at the risk of downplaying his unique characteristics. Ramachandran does a fine job of dispelling the notion of man’s humble pedigree. He takes the bull by its horns and categorically declare that man is unique and special. This book is a glorious narrative of the organ that makes man so outstanding – the brain. But he achieves this feat not by philosophical arguments alone. Quite fitting for a neuroscientist, he lists out several areas of the brain which are found only in humans. The Wernicke’s Area is seven times larger in man than in chimpanzees, which caters for comprehension of meaning and semantics of language. Similarly, the angular gyrus and the supramarginal gyrus are uniquely human (don’t ask me what they are, but the author knows it best). The greatest advantage of this book is its sole reliance on evolution as the route through which these peculiar features came to reside in our brains. It is often suggested that around 150,000 years ago, the human species’ speech and language skills experienced an explosive surge forward. Development of culture, civilization and science is rooted on this remarkable change which took place at that time. How can evolution, which operates through minor changes in each generation account for this sudden explosion of creativity? This is a tricky question, as even a tiny misstep or faltering would be construed as phenomena that can’t be explained by science by that horde of propagandists who go by the name of creationists or intelligent designers. Ramachandran states that even with minuscule amounts of change per generation, when these are accumulated in sufficient quantity to tilt a hypothetical balance in a new direction, such a rapid change is termed a ‘phase transition’. This defined a new paradigm that ushered in a strange new world that man ascended the ladder of progress with each passing generation until at last he wielded the power to destroy his own species.‘Publish or Perish’ is a dictum ruling over the lives of research scholars. Even though this strictly means publication in peer-reviewed journals, catering to the general public doesn’t do any harm if the author is honest and the results genuine. Charlatans often bypass the peer review process and dive straight to the common pool where they can maintain a semblance of authenticity to their ideas which might not have any anchoring on facts. But Ramachandran is different and the pet ideas that are spawned from his painstaking research are presented in a lucid way. Synaesthesia, the peculiar disorder in which a person sees colour associated with a number, sound or even an abstract concept is the author’s favourite. Some people visualize numbers with a colour tinged with it. Curiously, this disorder is said to be more pronounced in people having a strong bent to creativity, like artists, poets, or painters. The author has done extensive analyses of this trait and presents the results in a very simple way. It turns out that in those people’s brains, the areas that are responsible for differentiating numbers and colours have heavy crosswiring of neurons. These areas are adjacent too, resulting in cross talk between the regions and generating the illusion of seeing colour when it really is not there.Language and art are exclusively human. No other animal has come anywhere near us in sharing these wonderful traits. Naturally this calls for the attention of neuroscientists to explain why. The author earmarks several chapters to illustrate his hypotheses and the logical conclusions that can be drawn from them. Readers readily agree with the propositions that are consistent and plausible. However, repeatability and falsifiability are two prime requirements for any scientific theory to hold its ground. The sample sizes of many of the tests actually conducted are very small, you can count them with the fingers of your hands! How can a theory be extrapolated for global significance when the number of people who had undergone testing is infinitesimally small? The author is not at fault here, as the disorder and its symptoms are so rare that it may take a lifetime of observation to arrive at a decent number of volunteers ready to undergo the rigorous examination. But when we move on to the realm of art, we get an impression that the narration is highly speculative and subjective. Ramachandran adores ancient Indian temple art and comes up with theories that purportedly prove that the abstract notions of aesthetics embedded in those sculptures follow universal rules of art propounded by the author himself. Educated Indians, who are otherwise normal, sometimes harbour illusions about the country’s great past that was imagined to be thriving with scientific knowledge and technological innovations that the West could catch up only in the post-Renaissance era. It is to be doubted that Ramachandran also entertains some minor illusions regarding ancient temple art – on a strict historical sense, his example sculptures are medieval rather than ancient, coming from the Late Chola and Khajuraho periods. In addition to the small number of test subjects, the results seem to be biased somewhat. A sketch of a prancing horse is shown on page 310 that are produced by a normal child, an autistic child and the great Leonardo da Vinci himself. It can be easily seen that the figure drawn by the normal child is very bland and hideous, while the picture made by the child with autism comes very close to the graphical richness attested by da Vinci’s. Then he goes on to argue that autism dulls many of the brain areas that control social interactions, but at the same time may enhance the regions dealing with art. This seems like jumping to conclusions, or at least may be thought of as not proved by the examples cited. How can you conclude that all normal children would draw in such an uninspired way or that all autistic children would come up with prized art?The book is very stimulating and easily readable in the first half of it, but not particularly so in the second. While the author has maintained the right balance between hard to grasp neurological terms in the earlier half, he has shed all such inhibitions of keeping a check on outlandish names later on in the book. The most trying chapter is the last one, of course. However, the narrative is very witty and some of it very pointed indeed. The text eminently does its duty to grab the attention of its readers. Illustrating important concepts with the help of case studies is a potent combination to guarantee readers’ interest riveting on to it. There is a fine glossary and an extensive index which is grouped according to topic and we sometimes find it to be not much useful for looking up a word in a hurry.The book is highly recommended."
50,0393077829,http://goodreads.com/user/show/11100789-karthick,4,"Absolutely fascinating book. Some parts will offend liberal feminists (but then, what doesnt?) and some will offend those who belive that culture determines our nature. But Ramachandran has backed with research with not just theoretical claims, but with strong evidence as well. He places several interesting hypotheses, especially on questions of the Self and art, whose validity may be explored further in the near future. Importantly for psychoanalysts, this book of neuroscience provides validation of quite a few Freudian theories. Anyone who wants to know about how their most important organ functions must read The Tell-Tale Brain."
51,0393077829,http://goodreads.com/user/show/1300459-sambasivan,5,"Amazing book by a phenomenal author. He is one of the handful of scientists who can explain things to a layman. Neurology being his specialty area, Ramachandran has penned a brilliant analytical exposition on what makes us human. In the bargain, he elucidates the working of the brain. With case studies and insights from them. We are in the 19 th century progress level (of chemistry) when it comes to knowing ourselves. But the future appears bright with major inroads being made on the discovery of the powers of the brain and therefore I expect that we keep improving the understanding of the self in the near future. "
52,0393077829,http://goodreads.com/user/show/9743754-anand,5,"A brilliant book to understand the mysteries of the brain; written in a manner that answers some important questions, arouses curiosity and astounds - all in the same breath! In one word: un-put-down-able (!)"
53,0393077829,http://goodreads.com/user/show/77061786-aimee,4,Audiobook. Good overview of some of the functions and disorders of the brain. 3 1/2 stars. Enjoyed Dueling Neuroscientist more.
54,0393077829,http://goodreads.com/user/show/107623267-sivaraj-s,5,Unbelievable insights..
55,0393077829,http://goodreads.com/user/show/51524202-clelixedda,3,"This book is half very interesting and surprising facts and half (sometimes wild) speculation about the brain and its evolutionary development. I did not dislike it and actually found it quite interesting, but the author seemed to be quite full of himself (sometimes facts and speculation were not clearly distinguished from one another and thus he presented his theories as more plausible than they seemed to me). Also, his humour is exhausting (he actually acknowledges this, which made me laugh a lot) and so is the fact that he clearly imagined a heterosexual male reader. Nevertheless, I learned some things and really enjoyed the first half of the book. "
56,0393077829,http://goodreads.com/user/show/1950709-derek-davis,4,"A thoroughly engaging, enlivening, even entrancing study of neurological research by a leader in the field--with a couple peculiar omissions and fixations.Ramachandran's work has had both theoretical and practical ramifications in neuroscience. His intuitive experiments in working with brain-damaged patients who suffer from a wide variety of often peculiar ailments have led to both a deeper understanding of brain function and clinical relief from such ailments as ""phantom pain"" from missing limbs (his use of mirrors for phantom-pain treatment even appeared in an episode of ""House"").His written approach is direct, personal and appealing. Some have complained of his gratuitous and sometimes raucous sense of humor, but for anyone who has read Indian literature in English, this is simply how most Indian writers approach their work. Live with it if (like me) you enjoy such stuff, or otherwise ignore it and charge ahead to the facts and speculations.Two, to me, broad caveats, though. First, Ramachandran is strangely obsessed with proving that the human brain, in its construction and interconnections, makes people demonstrably alone in the line of animal evolution. His recurring mantra about the ""unique"" aspect of human cognition seems, first of all, unnecessary and intrusive and, second, makes broad assumptions about animal intelligence and function that, so far as I know, have never been tested. I don't get the feeling that the man has ever had a pet or carefully examined animal behavior. And birds' brains, as one example, work very differently from hominids'.Second, though he spends a great deal of time discussng ""mirror neurons"" (motor areas of the brain which activate while watching someone else perform an action), he gives no more than 4 pages to memory, and that 3/4 of the way through. True, this is not a book about memory, but if you're talking about 'intention"" and triggered imitation, how can you totally ignore the existence or function of memory?Still, this is a remarkable piece of work: open, accepting, willing to look at almost all aspects of physical and biological science that can impinge on his area of specialization. There's a heck of a lot to think about here, especially in his conjectures about the development/function of aesthetics (in visual art) and—his special concern—the origins of the internal idea of ""self."" He's especially good at carefully explaining what he's describing, rather than tossing blind terms around. A fine piece of work."
57,0393077829,http://goodreads.com/user/show/11353425-jeremy,4,"I liked this book in spite of its structure. I learned some really interesting ideas about how our brains work, and the anecdotes about real patients, in the vein of Oliver Sacks, were also interesting. It read like a rambling conversation, but you still learn a lot from it.This book is titled, ""The Tell-Take Brain: A Neuroscientist's Quest for what makes us Human."" I wouldn't say there's much of a quest for anything here, or even a conclusion about what makes us human. The chapters are arranged in the following way: phantom limbs, seeing vs knowing, synesthesia, ""the neurons that shaped civilization,"" autism, the evolution of language, two chapters on aesthetics, and introspection. Some chapters (seeing vs knowing, introspection) taught me a lot about how our brains do a lot of different things that give us a singular experience of consciousness. Other chapters (autism, the evolution of language) are purely theories on the topic, which are given no supporting data and don't contribute to the flow of the book. They seems like well thought out theories, but still they're theories. And others still (synesthesia) don't really say anything at all. The writer tries to bookend the whole thing by talking about themes, but really, there is none.The author also spends a bit of time propping up his own discoveries, and making it clear that he prefers Indian culture more than western culture. A little strange and unnecessary. But I read the whole book and I was very interested in what I learned. I've read many neuroscience books and I would recommend this over many others. It's just that several of the chapters seem like random digressions, and then they don't even have a point. It's like you've sat down with the author and had a discussion that takes so many digressions and some just don't have conclusions. You still walk away thinking you had a fascinating conversation."
58,0393077829,http://goodreads.com/user/show/26674095-gy,5,"First reaction after closing the book was to start again, against difficulties to fall in love with neuroanatomy. I hope it’s not disrespectful to draw the line of reference, but the alpha & omega, the lecturer of all lecturers for me is prof. Steven Strogatz and last time I heard the !AHA! bell in my head was when finished with his book “Sync”. “The Tell-Tale Brain” was the next to reach and rang this bell. The reader will enjoy the tale that is behind AHA!, and I’d not to immerse more deeply to avoid readers deprivation from a great sensation related to term that Dr. Ramachandran is calling !AHA! To solve mysteries of everyday life is one of the main tasks of our brains. Successfully solving these tasks is an imperative, it is a matter of Death or Life, and for normal person it’s very much trivial assuming the person is not exposed to war conditions or other hazards. But, the reader embarked on “The Tell-Tale Brain” will soon have to admit that there is a twilight zone of human mind that is so bizarre that will in a fracture of second cause goose bumps of the highest intensity. For that purpose author will introduce disorders that will make you turn around your axis. Yet, I must emphasize, this book is not about neuropsychiatric disorders! No matter to what extent is the evolution incomprehensible for our linear minds, I clearly felt that the author made it to I stop many times during the read and to turn my head behind, into the deep past, and to gaze with the eyes wide open across the darkness of millions of years trying to grasp the term of sudden qualitative change called a phase transitions - the very moments, key points of the evolutionary past, when incremental changes stopped having incremental effects!I’m going to leave the future reader with one of most exciting quotes from Dr. Ramachandran’s book: “How very odd that when your lover smiles at you, she is in fact half-baring her canines, reminding you of her bestial origins.”"
59,0393077829,http://goodreads.com/user/show/5885099-angus-mcfarlane,4,"Reading about the mysteries of the brain and recent attempts to unravel them provides a fascinating look into 'raw' science. There is much to learn from the established theories of science and how they came to have their authority, however, we usually only get to hear about them after the fact. Neurology has only scratched the surface of how the brain works, so the intuition, creativity and surprises emerging from new discoveries and those yet to be figured out are 'out there' to be enjoyed. The author of this book, allows this excitement to come to the fore, displaying a willingness to speculate to begin the hypothesis forming process, rather than keeping potentially zany or wrong ideas within to protect pride, reputation, etc.Most of the discussion describes how the study of mental disorders reveal how the brain works, and in turn how humans are the special, unique perhaps, beings that we are. Plasticity, perception (visual), synesthesia are areas I've read about previously, but still found fresh, particularly in the light of human uniqueness. The role of mirror neurons on empathy, autism and language was new to me - they are not unique to humans but seem to be uniquely developed in our species. A final stab is taken at self consciousness and (visual) art/beauty. These last two are especially speculative but I found the rules of aesthetics made sense both in terms of my own (limited) experience of art, and in terms of the biological explanations for their existence. The rules also seemed to have analogy with oral perception (ie what makes music different from noise), but I'd need to check this again to be sure. Self awareness stuff was ok but a bit more vague to me.Overall, the authors stories and arguments are told with wit and personality, and although the brain anatomy is still a little daunting for me, most of the book is pretty accessible."
60,0393077829,http://goodreads.com/user/show/662191-noreen,4,"Why I Like the Storytelling of ScienceI wanted to know how the world works and whether there was any meaning or purpose in the universe, but I was unsatisfied by the explanations given by philosophy, religion, and received wisdom; the stories were obviously made up in the absence of evidence, some of them to the point of absurdity. Yet, to me, science meant no more than taking math and physics classes and odors and explosions issuing from the chemistry lab. I didn't have much interest in it. I thought I was alone in these thoughts until a few years ago when, triggered by my conversations with a science-denying christian fundamentalist, I began to rethink science. Through reading I gained an understanding and appreciation of the scientific method and critical thinking. Nothing people make up about how the world works matches nature's storytelling. Rebecca Goldstein wrote in Plato at the Googleplex: Why Philosophy Won't Go Away, that empirical science is ""that ingenious arrangement whereby reality is afforded the opportunity to answer us back."" I am unable to engage in the doublethink religious belief demands. I need an internal coherence and narrative that matches what my senses tell me. That's why I like reading about science. My ReviewSomewhere recently I came across the term ""fancy that"" to describe science books for general readership. This is one of those. I wouldn't be able to comprehend the studies Ramachandran publishes in peer reviewed journals. Here he simplifies his research and speculation for people like me. Though an entire thesis -- or two -- could be written on the subject matter of each chapter, and though sometimes it is oversimplified (what kind of brain scan was used in a certain instance and how reliable was it?), I enjoyed reading the book and ruminating on its many insights."
61,0393077829,http://goodreads.com/user/show/2409682-oscar,5,"V. S. Ramachandran’s book provides an enlightening and philosophical discussion regarding certain aspects regarding the human brain. He often takes a philosophical approach regarding what makes us human, that is, in regards of what the human brain does, such as develop a sense of self, structure language, enjoy art, among other things that other species are unable to do. Such philosophical discussion, however, serve as a means for the book to delve into discussions regarding how science has explained these things and how the brain and its different components are responsible for several of our cognitive abilities that make us human. Ramachandran also makes great use of discoveries resulting from certain illnesses such as phantom limbs, synesthesia, autism, among other issues in order to show how studying these cognitive issues have resulted in a greater understanding regarding how the brain processes everything from sight, language, meaning, to physical touch. What made this book so enjoyable for me besides the fact that it provides solid and accessible information regarding different aspects of the brain is Ramachandran’s ability to connect the different discussions within the underlying theme that the evolution of the brain and its processes have made us human and have allowed the species to reach the point that we are in. Ramachandran also exhibits a great deal of enthusiasm and as such looks to address just how much we still have to learn about the human brain, which will result in exciting discoveries. Ramachandran also makes it clear when he is speculating regarding issues that are still unclear, but his speculation is sincere, thoughtful, and provides much food for thought that can only lead to further research, discoveries, and yes, more questions. "
