,book_link,isbn,isbn13,book_title,avg_rating,author_name,book_desc,genres
17,http://goodreads.com/book/show/853858.The_Man_Who_Found_Time,073820692X,9780738206929,The Man Who Found Time: James Hutton And The Discovery Of Earth's Antiquity,3.89,['Jack Repcheck'],"There are three men whose contributions helped free science from the straitjacket of theology. Two of the three-Nicolaus Copernicus and Charles Darwin-are widely known and heralded for their breakthroughs. The third, James Hutton, never received the same recognition, yet he profoundly changed our understanding of the earth and its dynamic forces. Hutton proved that the earth was likely millions of years old rather than the biblically determined six thousand, and that it was continuously being shaped and re-shaped by myriad everyday forces rather than one cataclysmic event. In this expertly crafted narrative, Jack Repcheck tells the remarkable story of this Scottish gentleman farmer and how his simple observations on his small tract of land led him to a theory that was in direct confrontation with the Bible and that also provided the scientific proof that would spark Darwin's theory of evolution. It is also the story of Scotland and the Scottish Enlightenment, which brought together some of the greatest thinkers of the age, from David Hume and Adam Smith to James Watt and Erasmus Darwin. Finally, it is a story about the power of the written word. Repcheck argues that Hutton's work was lost to history because he could not describe his findings in graceful and readable prose. (Unlike Darwin's Origin of the Species, Hutton's one and only book was impenetrable.) A marvelous narrative about a little-known man and the science he founded, The Man Who Found Time is also a parable about the power of books to shape the history of ideas.","['Science', 'History', 'Nonfiction', 'Science', 'Geology', 'Biography', 'Science', 'History Of Science', 'Science', 'Popular Science', 'Biography Memoir', 'Science', 'Earth Sciences', 'Science', 'Natural History']"
18,http://goodreads.com/book/show/314114.The_Web_of_Life,0,0,The Web of Life: A New Scientific Understanding of Living Systems,4.17,['Fritjof Capra'],"The vitality and accessibility of Fritjof Capra's ideas have made him perhaps the most eloquent spokesperson of the latest findings emerging at the frontiers of scientific, social, and philosophical thought. In his international bestsellers ""The Tao of Physics"" and ""The Turning Point, "" he juxtaposed physics and mysticism to define a new vision of reality. In ""The Web of Life, "" Capra takes yet another giant step, setting forth a new scientific language to describe interrelationships and interdependence of psychological, biological, physical, social, and cultural phenomena--the ""web of life.""During the past twenty-five years, scientists have challenged conventional views of evolution and the organization of living systems and have developed new theories with revolutionary philosophical and social implications. Fritjof Capra has been at the forefront of this revolution. In ""The Web of Life, "" Capra offers a brilliant synthesis of such recent scientific breakthroughs as the theory of complexity, Gaia theory, chaos theory, and other explanations of the properties of organisms, social systems, and ecosystems. Capra's surprising findings stand in stark contrast to accepted paradigms of mechanism and Darwinism and provide an extraordinary new foundation for ecological policies that will allow us to build and sustain communities without diminishing the opportunities for future generations.Now available in paperback for the first time, ""The Web of Life"" is cutting-edge science writing in the tradition of James Gleick's ""Chaos, "" Gregory Bateson's ""Mind and Matter, "" and Ilya Prigogine's ""Order Out of Chaos.""","['Science', 'Nonfiction', 'Philosophy', 'Science', 'Biology', 'Biology', 'Ecology', 'Environment', 'Nature', 'Environment', 'Psychology', 'Environment', 'Sustainability', 'Biology', 'Evolution']"
19,http://goodreads.com/book/show/382057.What_Remains_to_Be_Discovered,0684863006,9780684863009,"What Remains to Be Discovered: Mapping the Secrets of the Universe, the Origins of Life, and the Future of the Human Race",3.58,['John Maddox'],"What wonders of science will the 21st century bring? John Maddox takes up this challenge by describing precisely what remains to be discovered. Building on twenty-three years' experience at the helm of the world's preeminent science magazine, Nature, Maddox identifies new areas of discovery in physics, biology, health, intelligence, and global catastrophe. As Maddox shows, the rate of scientific discovery will continue to accelerate, hurtling us toward ever more exciting discoveries in the next century.","['Science', 'Nonfiction', 'Science', 'Popular Science', 'Science', 'Biology', 'Futurism', 'Biology', 'Evolution']"
20,http://goodreads.com/book/show/2803.Electric_Universe,0307335984,9780307335982,Electric Universe: How Electricity Switched on the Modern World,3.77,['David Bodanis'],"In Electric Universe, David Bodanis weaves tales of romance, divine inspiration, and fraud through a lucid account of the invisible force that permeates our universe. In these pages the virtuoso scientists who plumbed the secrets of electricity come vividly to life, including familiar giants like Thomas Edison; the visionary Michael Faraday, who struggled against the prejudices of the British class system; and Samuel Morse, a painter who, before inventing the telegraph, ran for mayor of New York on a platform of persecuting Catholics. Here too is Alan Turing, whose dream of a marvelous thinking machine—what we know as the computer—was met with indifference, and who ended his life in despair after British authorities forced him to undergo experimental treatments to “cure” his homosexuality. From the frigid waters of the Atlantic to the streets of Hamburg during a World War II firestorm to the interior of the human body, Electric Universe is a mesmerizing journey of discovery by a master science writer.","['Science', 'Nonfiction', 'History', 'Science', 'Physics', 'Science', 'Technology', 'Science', 'History Of Science', 'Business', 'Audiobook', 'Science', 'Popular Science', 'Historical']"
21,http://goodreads.com/book/show/558059.The_Fractal_Geometry_of_Nature,0716711869,9780716711865,The Fractal Geometry of Nature,4.21,['Benoît B. Mandelbrot'],"Clouds are not spheres, mountains are not cones, and lightning does not travel in a straight line. The complexity of nature's shapes differs in kind, not merely degree, from that of the shapes of ordinary geometry, the geometry of fractal shapes.Now that the field has expanded greatly with many active researchers, Mandelbrot presents the definitive overview of the origins of his ideas and their new applications. The Fractal Geometry of Nature is based on his highly acclaimed earlier work, but has much broader and deeper coverage and more extensive illustrations.","['Science', 'Science', 'Mathematics', 'Nonfiction', 'Environment', 'Nature', 'Science', 'Physics', 'Art', 'Philosophy', 'Mathematics', 'Geometry', 'Science', 'Biology', 'Reference']"
22,http://goodreads.com/book/show/3961946-atom,1840468734,9781840468731,Atom,4.1,['Piers Bizony'],"No one ever expected the atom to be as bizarre, as capricious, and as weird as it turned out to be. Its tale is one riddled with jealousy, rivalry, missed opportunities and moments of genius. Piers Bizony tells the story of the young misfit New Zealander, Ernest Rutherford, who showed that the atom consisted mainly of empty space, a discovery that turned 200 years of classical physics on its head, and the brilliant Dane, Niels Bohr, who made the next great leap into the incredible world of quantum theory. Yet he and a handful of other Young Turks in this revolutionary new science weren't prepared for the shocks that Nature had up her sleeve. At the dawn of the Atomic Age, a dangerous new force was unleashed with terrifying speed...","['Science', 'Nonfiction', 'Science', 'Popular Science', 'History', 'Science', 'Chemistry']"
23,http://goodreads.com/book/show/6719017-reading-in-the-brain,0670021105,9780670021109,Reading in the Brain: The Science and Evolution of a Human Invention,4.03,['Stanislas Dehaene'],"A renowned cognitive neuroscientist?s fascinating and highly informative account of how the brain acquires readingHow can a few black marks on a white page evoke an entire universe of sounds and meanings? In this riveting investigation, Stanislas Dehaene provides an accessible account of the brain circuitry of reading and explores what he calls the ?reading paradox?: Our cortex is the product of millions of years of evolution in a world without writing, so how did it adapt to recognize words? Reading in the Brain describes pioneering research on how we process language, revealing the hidden logic of spelling and the existence of powerful unconscious mechanisms for decoding words of any size, case, or font. Dehaene?s research will fascinate not only readers interested in science and culture, but also educators concerned with debates on how we learn to read, and who wrestle with pathologies such as dyslexia. Like Steven Pinker, Dehaene argues that the mind is not a blank slate: Writing systems across all cultures rely on the same brain circuits, and reading is only possible insofar as it fits within the limits of a primate brain. Setting cutting-edge science in the context of cultural debate, Reading in the Brain is an unparalleled guide to a uniquely human ability.","['Science', 'Nonfiction', 'Psychology', 'Biology', 'Neuroscience', 'Education', 'Humanities', 'Language', 'Neuroscience', 'Brain', 'Writing', 'Books About Books', 'Humanities', 'Linguistics', 'Teaching']"
24,http://goodreads.com/book/show/1823138.The_Tiger_That_Isn_t,1861978391,9781861978394,The Tiger That Isn't: Seeing Through a World of Numbers,3.89,['Michael Blastland'],"Numbers have become the all-powerful language of public argument. Too often, that power is abused and the numbers bamboozle. This book shows how to see straight through them - and how to seize the power for yourself. Public spending, health risks, environmental disasters, who is rich, who is poor, Aids or war deaths, pensions, teenage offenders, the best and worst schools and hospitals, immigration - life comes in numbers. The trick to seeing through them is strikingly simple. It is to apply something everyone has - the lessons of their own experience. Using vivid and everyday images and ideas, this book shows how close to hand insight and understanding can be, and how we can all use what is familiar to make sense of what is baffling. It is also a revelation - of how little the principles are understood even by many who claim to know better. This book is written by the team who created and present the hugely popular BBC Radio 4 series, More or Less.","['Nonfiction', 'Science', 'Science', 'Mathematics', 'Economics', 'Science', 'Popular Science', 'Business', 'Politics', 'European Literature', 'British Literature']"
25,http://goodreads.com/book/show/7550814-stuff,0,0,Stuff: Compulsive Hoarding and the Meaning of Things,3.88,['Randy O. Frost'],"What possesses someone to save every scrap of paper that's ever come into his home? What compulsions drive a woman like Irene, whose hoarding cost her her marriage? Or Ralph, whose imagined uses for castoff items like leaky old buckets almost lost him his house? Randy Frost and Gail Steketee were the first to study hoarding when they began their work a decade ago; they expected to find a few sufferers but ended up treating hundreds of patients and fielding thousands of calls from the families of others. Now they explore the compulsion through a series of compelling case studies in the vein of Oliver Sacks. With vivid portraits that show us the traits by which you can identify a hoarder's piles on sofas and beds that make the furniture useless, houses that can be navigated only by following small paths called goat trails, vast piles of paper that the hoarders ""churn"" but never discard, even collections of animals and garbage; Frost and Steketee illuminate the pull that possessions exert on all of us. Whether we're savers, collectors, or compulsive cleaners, very few of us are in fact free of the impulses that drive hoarders to the extremes in which they live. For all of us with complicated relationships to our things, Stuff answers the question of what happens when our stuff starts to own us. ","['Nonfiction', 'Psychology', 'Science', 'Self Help', 'Health', 'Mental Health', 'Sociology', 'Mental Health', 'Mental Illness', 'Health', 'Audiobook', 'Adult']"
26,http://goodreads.com/book/show/250814.The_End_of_Science,0201626799,9780201626797,The End of Science: Facing the Limits of Knowledge in the Twilight of the Scientific Age,3.58,['John Horgan'],"As staff writer for Scientific American, John Horgan has a window on contemporary science unsurpassed in all the world. Who else routinely interviews the likes of Lynn Margulis, Roger Penrose, Francis Crick, Richard Dawkins, Freeman Dyson, Murray Gell-Mann, Stephen Jay Gould, Stephen Hawking, Thomas Kuhn, Chris Langton, Karl Popper, Stephen Weinberg, and E.O. Wilson, with the freedom to probe their innermost thoughts?In The End Of Science, Horgan displays his genius for getting these larger-than-life figures to be simply human, and scientists, he writes, ”are rarely so human...so at ther mercy of their fears and desires, as when they are confronting the limits of knowledge.”This is the secret fear that Horgan pursues throughout this remarkable book: Have the big questions all been answered? Has all the knowledge worth pursuing become known? Will there be a final ”theory of everything” that signals the end? Is the age of great discoverers behind us? Is science today reduced to mere puzzle solving and adding detains to existing theories?Horgan extracts surprisingly candid answers to there and other delicate questions as he discusses God, Star Trek, superstrings, quarks, plectics, consciousness, Neural Darwinism, Marx's view of progress, Kuhn's view of revolutions, cellular automata, robots, and the Omega Point, with Fred Hoyle, Noam Chomsky, John Wheeler, Clifford Geertz, and dozens of other eminent scholars. The resulting narrative will both infuriate and delight as it mindles Horgan's smart, contrarian argument for ”endism” with a witty, thoughtful, even profound overview of the entire scientific enterprise.Scientists have always set themselves apart from other scholars in the belief that they do not construct the truth, they discover it. Their work is not interpretation but simple revelation of what exists in the empirical universe. But science itself keeps imposing limits on its own power. Special relativity prohibits the transmission of matter or information as speeds faster than that of light; quantum mechanics dictates uncertainty; and chaos theory confirms the impossibility of complete prediction. Meanwhile, the very idea of scientific rationality is under fire from Neo-Luddites, animal-rights acitivists, religious fundamentalists, and New Agers alike.As Horgan makes clear, perhaps the greatest threat to science may come from losing its special place in the hierarchy of disciplines, being reduced to something more akin to literaty criticism as more and more theoreticians engage in the theory twiddling he calls ”ironic science.” Still, while Horgan offers his critique, grounded in the thinking of the world's leading researchers, he offers homage too. If science is ending, he maintains, it is only because it has done its work so well.","['Science', 'Philosophy', 'Nonfiction', 'Science', 'Physics', 'Science', 'History Of Science', 'Science', 'Popular Science', 'Writing', 'Essays', 'Sociology', 'Science Nature']"
27,http://goodreads.com/book/show/2467566.The_Long_Tail,1401309666,9781401309664,The Long Tail: Why the Future of Business is Selling Less of More,3.82,['Chris Anderson'],"The New York Times bestseller that introduced the business world to a future that s already here -- now in paperback with a new chapter about Long Tail Marketing and a new epilogue.Winner of the Gerald Loeb Award for Best Business Book of the Year.In the most important business book since The Tipping Point, Chris Anderson shows how the future of commerce and culture isn t in hits, the high-volume head of a traditional demand curve, but in what used to be regarded as misses -- the endlessly long tail of that same curve.","['Business', 'Nonfiction', 'Economics', 'Science', 'Technology', 'Computers', 'Internet', 'Business', 'Entrepreneurship', 'Business', 'Management', 'Buisness', 'Internet', 'Web', 'Audiobook']"
28,http://goodreads.com/book/show/310330.The_Whole_Shebang,0684838613,9780684838618,The Whole Shebang: A State-of-the-Universe[s] Report,4.06,['Timothy Ferris'],"From the prizewinning author who has been called ""the greatest science writer in the world"" comes this delightfully comprehensive and comprehensible report on how science today envisions the universe as a whole. Timothy Ferris provides a clear, elegantly written overview of current research and a forecast of where cosmological theory is likely to go in the twenty-first century. He explores the questions that have occurred to even casual readers -- who are curious about nature on the largest scales: What does it mean to say that the universe is ""expanding,"" or that space is ""curved""? -- and sheds light on the possibility that our universe is only one among many universes, each with its own physical laws and prospects for the emergence of life.","['Science', 'Nonfiction', 'Science', 'Physics', 'Science', 'Astronomy', 'Space', 'Science', 'Popular Science', 'Science Nature', 'History', 'Writing', 'Essays']"
29,http://goodreads.com/book/show/134225.Disturbing_the_Universe,0465016774,9780465016778,Disturbing the Universe,4.2,['Freeman Dyson'],"The autobiography of one of the world's greatest scientistsSpanning the years from World War II, when he was a civilian statistician in the operations research section of the Royal Air Force Bomber Command, through his studies with Hans Bethe at Cornell University, his early friendship with Richard Feynman, and his postgraduate work with J. Robert Oppenheimer, Freeman Dyson has composed an autobiography unlike any other. Dyson evocatively conveys the thrill of a deep engagement with the world-be it as scientist, citizen, student, or parent. Detailing a unique career not limited to his groundbreaking work in physics, Dyson discusses his interest in minimizing loss of life in war, in disarmament, and even in thought experiments on the expansion of our frontiers into the galaxies.","['Science', 'Nonfiction', 'Biography', 'Science', 'Physics', 'History', 'Biography', 'Autobiography', 'Philosophy', 'Science', 'Astronomy', 'Biography Memoir', 'Science', 'History Of Science']"
30,http://goodreads.com/book/show/979694.Microcosmos,0520210646,9780520210646,Microcosmos: Four Billion Years of Microbial Evolution,4.21,['Lynn Margulis'],"Microcosmos brings together the remarkable discoveries of microbiology of the past two decades and the pioneering research of Dr. Margulis to create a vivid new picture of the world that is crucial to our understanding of the future of the planet. Addressed to general readers, the book provides a beautifully written view of evolution as a process based on interdependency and the interconnectedness of all life on the planet.","['Science', 'Nonfiction', 'Science', 'Biology', 'Biology', 'Evolution', 'History', 'Science', 'Natural History', 'Philosophy', 'Science', 'Popular Science', 'Environment', 'Nature', 'Biography']"
31,http://goodreads.com/book/show/98810.God,1591024811,9781591024811,God: The Failed Hypothesis: How Science Shows That God Does Not Exist,3.93,['Victor J. Stenger'],"Throughout history, arguments for and against the existence of God have been largely confined to philosophy and theology. In the meantime, science has sat on the sidelines and quietly watched this game of words march up and down the field. Despite the fact that science has revolutionized every aspect of human life and greatly clarified our understanding of the world, somehow the notion has arisen that it has nothing to say about the possibility of a supreme being, which much of humanity worships as the source of all reality. Physicist Victor J. Stenger contends that, if God exists, some evidence for this existence should be detectable by scientific means, especially considering the central role that God is alleged to play in the operation of the universe and the lives of humans. Treating the traditional God concept, as conventionally presented in the Judeo-Christian and Islamic traditions, like any other scientific hypothesis, Stenger examines all of the claims made for God's existence. He considers the latest Intelligent Design arguments as evidence of God's influence in biology. He looks at human behavior for evidence of immaterial souls and the possible effects of prayer. He discusses the findings of physics and astronomy in weighing the suggestions that the universe is the work of a creator and that humans are God's special creation. After evaluating all the scientific evidence, Stenger concludes that beyond a reasonable doubt the universe and life appear exactly as we might expect if there were no God.","['Science', 'Religion', 'Religion', 'Atheism', 'Nonfiction', 'Philosophy', 'Science', 'Physics', 'Philosophy', 'Skepticism', 'Religion', 'God', 'Spirituality', 'Reference']"
32,http://goodreads.com/book/show/17798.Fads_and_Fallacies_in_the_Name_of_Science,0486203948,9780486203942,Fads and Fallacies in the Name of Science,4.07,['Martin Gardner'],"This witty and engaging book examines the various fads, fallacies, strange cults, and curious panaceas which at one time or another have masqueraded as science. Not just a collection of anecdotes but a fair, reasoned appraisal of eccentric theory, it is unique in recognizing the scientific, philosophic, and sociological-psychological implications of the wave of pseudoscientific theories which periodically besets the world.To this second revised edition of a work formerly titled In the Name of Science, Martin Gardner has added new, up-to-date material to an already impressive account of hundreds of systematized vagaries. Here you will find discussions of hollow-earth fanatics like Symmes; Velikovsky and wandering planets; Hörbiger, Bellamy, and the theory of multiple moons; Charles Fort and the Fortean Society; dowsing and the other strange methods for finding water, ores, and oil. Also covered are such topics as naturopathy, iridiagnosis, zone therapy, food fads; Wilhelm Reich and orgone sex energy; L. Ron Hubbard and Dianetics; A. Korzybski and General Semantics. A new examination of Bridey Murphy is included in this edition, along with a new section on bibliographic reference material.","['Science', 'Nonfiction', 'Philosophy', 'Skepticism', 'History', 'Philosophy', 'Psychology', 'Science', 'History Of Science', 'Science', 'Pseudoscience', 'Science', 'Mathematics', 'Writing', 'Essays']"
33,http://goodreads.com/book/show/298252.About_Time,0684818221,9780684818221,About Time: Einstein's Unfinished Revolution,4.2,['Paul Davies'],"An elegant, witty, and engaging exploration of the riddle of time, which examines the consequences of Einstein's theory of relativity and offers startling suggestions about what recent research may reveal.  The eternal questions of science and religion were profoundly recast by Einstein's theory of relativity and its implications that time can be warped by motion and gravitation, and that it cannot be meaningfully divided into past, present, and future.  In About Time, Paul Davies discusses the big bang theory, chaos theory, and the recent discovery that the universe appears to be younger than some of the objects in it, concluding that Einstein's theory provides only an incomplete understanding of the nature of time. Davies explores unanswered questions such as:  * Does the universe have a beginning and an end? * Is the passage of time merely an illusion? * Is it possible to travel backward -- or forward -- in time?  About Time weaves physics and metaphysics in a provocative contemplation of time and the universe.","['Science', 'Science', 'Physics', 'Nonfiction', 'Philosophy', 'History', 'Science', 'Astronomy', 'Science', 'Popular Science', 'Science', 'Mathematics', 'Philosophy', 'Theory', 'Science Fiction', 'Time Travel']"
34,http://goodreads.com/book/show/1111741.George_s_Secret_Key_to_the_Universe,1416954627,9781416954620,George's Secret Key to the Universe,4.01,['Lucy Hawking'],"Stephen Hawking, author of the multi-million copy bestselling A Brief History of Time, and his daughter Lucy explain the universe to readers of all ages. George's parents, who have always been wary of technology, warn him about their new neighbors: Eric is a scientist and his daughter, Annie, seems to be following in his footsteps. But when George befriends them and Cosmos, their super-computer, he finds himself on a wildly fun adventure, while learning about physics, time, and the universe. With Cosmos's help, he can travel to other planets and a black hole. But what would happen if the wrong people got their hands on Cosmos? George, Annie, and Eric aren't about to find out, and what ensues is a funny adventure that clearly explains the mysteries of science. Garry Parsons' energetic illustrations add humor and interest, and his scientific drawings add clarity; there are also eight 4-page full-color inserts of scientific photos.","['Science', 'Childrens', 'Nonfiction', 'Adventure', 'Childrens', 'Middle Grade', 'Space', 'Science', 'Physics', 'Science', 'Astronomy', 'Audiobook', 'Childrens', 'Juvenile']"
