,isbn,user_link,ranking,review
87,0735214484,http://goodreads.com/user/show/9146810-paul,3,"Range by David Epstein promotes the idea of learning and experiencing broad experiences and education over the idea of narrow focus. Epstein bases this hypothesis on the fact that most of today's jobs and skills have patterns that are hard to discern and where feedback is difficult to receive. These are called ""wicked"" environments and he believes that having a broad education and skills in many different areas will set the individual up for more success later down the road. In other words, the more experiences you have, the more experience you will use to analyze situations to become successful. The narrow focus of specializing in something for 10,000 hours in order to be great at it works but only in certain fields. When it comes to getting a job, inventing something, or discovering something meaningful, using the experience from many avenues of life is more inclined to deliver success. The book is told in a case study fashion where he takes diverse examples of individuals that took the broad range approach and were successful with it. Overall, I think that the way that Epstein wrote the book is approachable, scholarly, and easy to digest. It does get a little repetitive though. Do I think that Epstein has a point? Yes, of course, he has a point, but it all relies heavily on the desired outcome of the individual. The meticulous practice of a very narrow skillset will produce results in that given field just as a wide range of learning will give results in more ""wicked"" fields. I think what Epstein is encouraging the readers to do is to think about their path in life and how we might think differently in accomplishing those goals. He is also speaking to the people that fail often, that failure is a part of growth and the journey. Just because an individual doesn't stick with a passion wholely for their entire life doesn't mean they won't be successful in something else later in life. A good book that is worth a read or a listen that gets a little repetitive and maybe doesn't take into account all the different variables of how people become successful in what they do. Basically, whether you are a specialist or a generalist, the key is to not give up, and keep growing and learning. "
88,0735214484,http://goodreads.com/user/show/908968-ryan,5,"In this world of increased specialization, we believe that narrow focus on one activity or field of study is the best way to be productive, successful, and contribute to society. “Range” by David Epstein argues against these ideas and makes the case that generalists are more successful and make more contributions than specialists.I’ve always thought of myself as a bit of a dilettante, with undergrad degrees, advanced degrees, work outside of these fields, and even different hobbies. I took pride that I was a “Renaissance Man” and that I had a wide experience and view of the world. However, I secretly wondered if this approach hurt my success. I was so encouraged to read this book that argues that truly successful people are generalists who combine different views, ideas, and areas of study to make great leaps in advancement for society.Epstein uses a number of examples from sports to science to illustrate his point. When we specialize, studies have found, that we focus so narrowly that we don’t get outside viewpoints and the resulting echo chamber prohibits real advancement. By combining different experiences and ideas, we can get true innovation and real advancement. The author then explains that this will be more important in the future. Computers and automation will soon take over all of the repetitive, specialized skills and do it better. But generalists will be able to cross different areas of humanity to create truly new ideas and invent more solutions to problems facing us.I thought that “Range” was a great book with a lot of interesting anecdotes and compelling insights. It was recommended by Austin Klein and Ryan Holiday on their year end lists of best books. I agree with their recommendation and I think this book is encouraging to anyone who has diverse interests and didn’t follow a clear path. ★★★★★ • Audiobook / Hardcover • Nonfiction • Listened to Audiobook on Scribd, borrowed from the San Jose Public Library. ◾︎"
89,0735214484,http://goodreads.com/user/show/9282968-jatan,4,"Somewhere between a self-help guide, and a management manual, I always find it hard to parse books like this. Its thesis, however, is an interesting one, which Epstein hammers through with numerous case studies. Of course, it suffers from the usual drawbacks of the genre: stretched analogies, culling of detail in service of the Narrative, limited discussion of scientific evidence, if at all. That said, even in this sphere, Epstein strikes me as one of the more sensible ones, having, among other things, debunked Gladwell’s 10,000 hour rule though his earlier work. tl; dr: excellent anecdotes, limited life applicability. "
90,0735214484,http://goodreads.com/user/show/26825646-isabella-zink,5,"I read a lot of popular science books, and this was definitely one of the more interesting ones. Not only did I actually learn a lot of new information (many of the other books I’ve read cover the same studies), on a personal note it definitely brought some relief for my own anxieties. I’m one of the those people who seems to switch interests at the drop of a hat, although if you look closely you can see how they are related. When I read Duckworth’s  Grit , I questioned whether or not I was a gritty person due to the fact that my interests varied from year to year. I couldn’t really tell whether or not I was quitting something because it was hard, or if I was moving on because it wasn’t a real interest match. After reading this book, I’m much more inclined towards the latter attitude. I’ve been reluctant to commit to one specific thing for the sake of ‘stability’ (or a cost-sunk fallacy) because I don’t want to miss out on something else that may fit me way better. This idea of sampling interests suits me just fine for the moment. On some levels, this book also sort of contradicts Cal Newport’s book  So Good They Can’t Ignore You  which discourages readers from ‘following their passions’ and instead demonstrates how to make the most of your life/job by growing to love what you do. He argues that you shouldn’t expect to find a ready-made job based on your passions; instead, your passion follows from hard work and experience. In Epstein’s book, he takes the stand that sampling many different things is the best way to go. While working at something else to pay the bills (or something that actually is interesting in its own right), explore other paths through hobbies, and maybe start over in school or in a new career. Overall, I prefer Epstein’s idea about sampling until you find what works for you. Maybe intensely commit to something for a short period of time (hello micro-fixations my old friends) or dabble at something on the weekends. That seems like a much more fun way to live than pouring all of my energy into something I may grow to like more because I’m loathe to lose my head start. "
91,0735214484,http://goodreads.com/user/show/86144704-ryan,2,"Too many stories I already know. Doesn't consider the good arguments for the other side. Eg a basic question: the best scientists are more likely to have additional creative pursuits, but why think this is causal and not an effect of being more open to experience? Thought-provoking in that Gladwell way.""Rather than letting students grapple with some confusion, teachers often responded to their solicitations with hint-giving that morphed a making-connections problem into a using-procedures one.""""Malamud analyzed data for thousands of former students, and found that college graduates in England and Wales were consistently more likely to leap entirely out of their career fields than their later-specializing Scottish peers.""“It gave me this template for seeing my career. Virtually every good thing in my life I can trace back to a misfortune, so my feeling is you don’t know what’s good and what’s bad when things happen. You do not know. You have to wait to find out.”""Psychologist Dan Gilbert called it the “end of history illusion.” From teenagers to senior citizens, we recognize that our desires and motivations sure changed a lot in the past (see: your old hairstyle), but believe they will not change much in the future. In Gilbert’s terms, we are works in progress claiming to be finished.""""The cult of the head start""""Dabble time"" as part of company culture for Bill GoreWant to learn about: AI, Flynn Effect, Fermi Problems, Dunbar labs, Duke Ellington, Tu Youyou"
92,0735214484,http://goodreads.com/user/show/72769596-sourabh-rohilla,5,"In a lot of ways, reading this book affirmed few ideas I was thinking about after finishing college. So, this review might suffer from confirmation bias. :)Around the world, early specialisation is a favoured strategy to discover your life's work. You'd be invariably told to find 'what you want to do in life' as soon as possible and then double down on it. Well, this strategy might not be optimal. It is okay to take your time trying out different things before deciding how you want to contribute to the world. The book is full of examples where people with 'range', i.e. multiple perspectives were able to solve problems which the domain experts were not able to solve. Stories where some 'outsider' made a contribution to a field because being an outsider gave them freedom to be actively open minded about problem statement. The author advocates that world need specialists as well as people who can connect the dots and see the forest in addition to the trees.In a world, where people carry humanity's knowledge in their pockets, you need more people who have range in their thinking.This book is also a ""calm-down-it's-okay"" message for people who focus on one thing maniacally until they find next thing to focus on. It's comforting for those whose mental meanderings and creative explorations make sense to them but might seem random/unrelated (at least at first) hops to others."
93,0735214484,http://goodreads.com/user/show/2875383-xavier-shay,5,"Surprisingly good. Many stories I hadn't heard, decent amount of research.Particularly shocking/insightful for me was that positive student evaluations of instructors is inversely correlated with long term learning.""The economists suggested that the professors who caused short-term struggle but long-term gains were facilitating “deep learning” by making connections. They “broaden the curriculum and produce students with a deeper understanding of the material.” It also made their courses more difficult and frustrating, as evidenced by both the students’ lower Calculus I exam scores and their harsher evaluations of their instructors.""Also this:""In one of Kornell and Bjork’s interleaving studies, 80 percent of students were sure they had learned better with blocked than mixed practice, whereas 80 percent performed in a manner that proved the opposite.""This is pretty cute:""In crisis, Swanson saw opportunity. He realized he could make discoveries by connecting information from scientific articles in subspecialty domains that never cited one another and that had no scientists who worked together. For example, by systematically cross-referencing databases of literature from different disciplines, he uncovered “eleven neglected connections” between magnesium deficiency and migraine research, and proposed that they be tested.""Nice coda:""So, about that one sentence of advice: Don’t feel behind."""
94,0735214484,http://goodreads.com/user/show/11815960-anthony-locke,5,"Epstein argues convincingly that interdisciplinary thinking is often more valuable than specialized thinking, particularly if someone wants to be innovative or bring new solutions to fields defined by a narrow set of tools. He shows how people who follow non-linear career/skill paths often thrive later in life. I thought there were a couple of profound insights into understanding “calling” as it relates to ministry. Is any calling – whether to medicine, law, or ministry – so great that it can supersede natural human development and change? Epstein argues that calling is much more fluid. How can we predict how circumstances or human development will change our perspective on our calling? It makes sense that a Christian college student falls in love with college ministry and feels called to vocational ministry to students … yet it also makes sense that person’s sense of calling would shift once they hit their early 30s. If our view of vocational ministry calling is irrevocable, I think it can lead to cognitive dissonance and disillusionment. I’m not sure if this idea correlates with the number of people who go to seminary and find themselves doing something else five years later, but it’s food for thought. Definitely had the thought that if I have more school in my future, maybe instead of a PhD I'll get an MPP instead. Enjoyed listening to this book!"
95,0735214484,http://goodreads.com/user/show/792145-sue-bridehead-a-pseudonym,5,"Fascinating and important. This book makes the case that we need both types, specialists and generalists--working together--in order to solve humanity's greatest challenges. I feel so much better now about being a generalist/experimenter who's sampled from a variety of disciplines (and musical instruments) and who reads widely. In fact, going forward, I'm going to give myself permission to try even more things. Side note: The book talks a lot about the value of using wide-ranging analogies in order to describe little-understood problems. We owe modern astronomy, among other things, to the power of analogies. I love that. When I was a teenager this guy I worked with at a summer job told me repeatedly, ""Your analogies make no sense."" From time to time I'd think back to his comments and assume I drew these unlikely connections between things because I was a poet, and that it was strictly a language thing. But now I realize I'm just a straight-up genius and he was out of his depth conversing with me. Take that, summer job guy!"
96,0735214484,http://goodreads.com/user/show/5185619-scott-wozniak,4,"Solid survey of various studies and actual histories of great performers. It turns out that while we love the stories of early achievers and prodigies, there are as many (if not more) stories of late bloomers and generalists who have big impact.There are a lot of example stories (a little bit too many to be perfect, in my opinion). But the biggest insight in the book is to understand the difference between ""kind"" environments and ""wicked"". Kind environments have fixed rules and follow repeatable patterns. Chess and golf are good examples of this. Wicked environments are variable and have unavoidable uncertainty. Starting a new business and writing a book are like this. The choices are too broad and you're trying to do something new, not repeat something perfectly. For kind environments, start early and stay narrow in your focus. For wicked environments, avoid over-focusing and learn how to bring in ideas from adjacent spaces."
97,0735214484,http://goodreads.com/user/show/4075233-kavinay,5,"I worry about how much Epstein's writing appeals to me since it often feels like confirming biases and suspicions I already harbour. But if you've ever spent any time invested deeply in long-term development (sports, kids, yourself), so many of the topics covered in Range are likely real issues you've encountered. Do I specialize early, am I missing out by not committing down one path, should I even bother with some interest that isn't directly applicable to my work or field of study? There's a lot of pop psych about head-start approaches to development but not much which validates what you come to realize with age is still a valid and useful path to success: breadth and experimentation.The next time some coach or trainer tells you how imperative early specialization is, this is the book that will help you feel more comfortable at dealing with a culture hellbent on being first rather than growing into skill and talent."
98,0735214484,http://goodreads.com/user/show/12902101-romans-karpelcevs,3,"I enjoyed reading the book but I didn't particularly like it.It narrated interesting bios and stories from people. The narration and storytelling kept me interested, but that's about it. It hardly went deep into the generalisation vs specialisation apart from ""Try many things before settling onto one"", and ""More diverse knowledge helps in the uncertain world"". The gist of the book could be a short article if you strip all the biographies. Especially when you understand that some bios are actually irrelevant and not really about the generalisation. The world needs both and both can triumph and both can fail. So we're kinda left with that we started. So do whatever and succeed, kinda? I mean, I'm not exactly sure I have any takeaway for myself or for raising my child apart from what I already knew: it's best not to settle down and develop yourself in different directions. And rather not to triumph, but to be a fuller and happier human being. "
99,0735214484,http://goodreads.com/user/show/21969998-elsie-lo,4,"Finally! At last! Reading this book felt like when Adam set eyes on Eve - flesh of my flesh and bone of my bones! Ok let's not be that dramatic, but reading Range made me feel finally seen and known and dare I say understood? David Epstein walks through story upon story of how generalists are innovating life forward in a world with increasingly ""wicked learning environments"" through interdisciplinary prowess (or trying and failing a lot in a lot of different things - not glamorous compared to specializing and getting really good in one thing). His writing style is similar to Malcolm Gladwell, whose endorsement of the book is front and center on the cover - ""I loved Range"". I gave it four stars because some of the stories and examples are a bit tedious to get through, full of a little too much technical and scientific detail, which a different kind of reader might appreciate more than me."
100,0735214484,http://goodreads.com/user/show/2533101-kristjan-wager,5,"Range is a great book on the advantages of generalists over specialists, and goes into the details of the mechanisms behind why this is so. We have all heard about how certain people have become masters in their field by training in it from an early age. What this book makes clear, is that while this is possible in certain narrow areas, e.g. chess and golf, it is uncommon for masters in other, more chaotic, fields to have become so through a narrow focus. Rather they have tried out several things, giving them a broader range when reacting to new situations. Similarly, breakthroughs in areas are often not done by people specialised in one narrow aspect of that area, as they cannot make the connections to other relevant fields.In a time where education seems to be aimed at getting people to specialise as soon as possible, Range is an important book, and well worth reading."
101,0735214484,http://goodreads.com/user/show/5242010-rex,2,"In the 20th century, we created a false dilemma on nature vs nurture. It turns out to be 100% nature and 100% nurture. It's not either/or but both/and. So as this false dilemma on expertise vs breadth. It's 100% expertise, 100% breadth. Reason:we have both a professional life and an amateur life. So:#1. 100% expertise on our professions that is making a living.#2. 100% breadth on leisure, hobbies, sports, arts, crafts, etc.It's both/and.I believe this book is trying to rebuttal the 10,000 hours theory that's extremely popular right now. But for expertize pursuing, 10,000 hours is not even enough. Will Marie Curie stops at 10,000 hours? Will Michael Phelps stops at 10,000 hours? Be an expert in our professional area. Be as broad as we could in our hobbies and leisures."
102,0735214484,http://goodreads.com/user/show/8973302-sunethra,4,"A very solid case for side projects, hobbies, meandering interests, curiosity driven rabbit holes and passion projects! I feel like a closet generalist coming out to the hyperspecialized world - observations that I have had from experiencing and living through silod, regimented and rigidly rule based collective (not just work!) setups were given a coherent and tightly argued shape and form. The author himself lives/has lived several aspects of his thesis about cultivaring range and that makes his narrative rather powerful. He is also thoughtful to point out counter arguments to his premises and how these can and have been tested under various assumptions. A highly recommended read!"
103,0735214484,http://goodreads.com/user/show/5652283-douglas,4,"I really related to this book (maybe naively so) in my current situation at work. I have broad experience and am only what could be called a “generalist” and have been feeling unsure how much value that will bring. The contrasts that Epstein makes between head starts and late starts, kind learning environments and wicked ones, meandering minds and focused ones, and the chain of command compared to the chain of communication were all very compelling to me at this time. Was an easy read for this genre and worth exploring the value of *Range* personally as I want to explore more broad learning now than I felt confident to do before. "
104,0735214484,http://goodreads.com/user/show/2828794-lauren-albert,5,"Wow, a feeling of hope. “Don’t feel behind.” He writes at the end. “Compare yourself to yourself, not to younger people who aren’t you.” A meandering career path is not necessarily a sign of failure but rather might be your way to finding where you should be, at least at the moment you are there.I’ve always known that creativity depended on crossing intellectual borders but Epstein shows it again and again with examples from many different areas. Specialists succeed in predictable spaces. Generalists are more often able to succeed in what he calls “wicked” environments. Well worth reading. "
105,0735214484,http://goodreads.com/user/show/3346245-deane-barker,4,"Interesting book about how generalists have value, and there might be a myth about those single-minded people who start in one discipline and stay there.It's good, but the different chapters are not well-differentiated -- the titles are vague, and I had trouble following the development of the narrative. I couldn't tell how one chapter was any different than another.It also falls into over-anecdotalism, a la Gladwell. Some sections just feel like story after story, and sometimes you can't figure out how the stories relate to the central point."
106,0735214484,http://goodreads.com/user/show/48845227-matt-athey,4,"I enjoyed that Epstein looks at how an emphasis on specialization can actually hamper our ability to really excel at something. I am not sure I'd throw out Gladwell's 10,000 hour rule completely but I definitely see tremendous value in being well-rounded in a lot of areas and giving my ""natural specialities"" a chance to break through. Probably the point that had the most impact on me is that, if you want learning to stick it should be slow and hard not quick and easy. I am prone to rush through learning and then struggle to remember things later. Recommended reading for all. "
107,0735214484,http://goodreads.com/user/show/8970951-emily-polson,0,"Lots of helpful and interesting ideas in this book about the benefits of having diverse experiences and developing enough self-knowledge through them to find a path/career that offers the best match quality. A quote I'd like to file for my own reference: ""Compare yourself to yourself yesterday, not to younger people who aren't you. Everyone progresses at a different rate, so don't let anyone else make you feel behind. You probably don't even know where exactly you're going, so feeling behind doesn't help. Instead . . . start planning experiments."""
108,0735214484,http://goodreads.com/user/show/8271440-zachery-tyson,3,"A quick, light, entertaining read in the vein of Malcolm Gladwell's Blink. Not particularly deep, but that is sort of the point of Range - breadth vs. depth. That being said, it's not particularly broad either, covering what you'd expect in this sort of book - Philip Tetlock, Superforecasters, some light cognitive science, innovation from outsiders, etc. The most valuable part for me was the interesting anthropological survey of early 20th-century Soviet peasants being converted to modernity."
109,0735214484,http://goodreads.com/user/show/8706348-geoff,5,"Pop science / pop psych so take with a grain of salt, but it's a nice corrective to the current idea that early specialization is a must for success. I loved the idea as well that specialization and deep within-domain expertise works best in ""kind worlds"" where there are consistent rules, lots of repetitions, and lots of quick feedback. Thought provoking; I'll want to come back to this in a few years I think."
110,0735214484,http://goodreads.com/user/show/1617330-todd,5,"Preaching to the choir here. My managers are probably annoyed that I go off to play in music clubs, prioritize workouts, leave early to cook and so forth. But I believe a wide variety of interests makes me a better person. So this book is a feast of validation for me. Turns out I have this in common with most Nobel Laureates.There's also a great defense in here of basic research. Kay Bailey Hutchinson can suck it."
