,isbn,user_link,ranking,review
36,0060988479,http://goodreads.com/user/show/1983025-rick,4,"
 A groundbreaking work of science that confirms, for the first time, the independent existence of the mind–and demonstrates the possibilities for human control over the workings of the brain.
Conventional science has long held the position that 'the mind' is merely an illusion, a side effect of electrochemical activity in the physical brain. Now in paperback, Dr Jeffrey Schwartz and Sharon Begley's groundbreaking work, The Mind and the Brain, argues exactly the opposite: that the mind has a life of its own.Dr Schwartz, a leading researcher in brain dysfunctions, and Wall Street Journal science columnist Sharon Begley demonstrate that the human mind is an independent entity that can shape and control the functioning of the physical brain. Their work has its basis in our emerging understanding of adult neuroplasticity–the brain's ability to be rewired not just in childhood, but throughout life, a trait only recently established by neuroscientists. 
Through decades of work treating patients with obsessive–compulsive disorder (OCD), Schwartz made an extraordinary finding: while following the therapy he developed, his patients were effecting significant and lasting changes in their own neural pathways. It was a scientific first: by actively focusing their attention away from negative behaviors and toward more positive ones, Schwartz's patients were using their minds to reshape their brains–and discovering a thrilling new dimension to the concept of neuroplasticity. 
The Mind and the Brain follows Schwartz as he investigates this newly discovered power, which he calls self–directed neuroplasticity or, more simply, mental force. It describes his work with noted physicist Henry Stapp and connects the concept of 'mental force' with the ancient practice of mindfulness in Buddhist tradition. And it points to potential new applications that could transform the treatment of almost every variety of neurological dysfunction, from dyslexia to stroke–and could lead to new strategies to help us harness our mental powers. Yet as wondrous as these implications are, perhaps even more important is the philosophical dimension of Schwartz's work. For the existence of mental force offers convincing scientific evidence of human free will, and thus of man's inherent capacity for moral choice. 
   From Publishers Weekly 
  Schwartz (A Return to Innocence), a UCLA psychiatrist and expert on treating patients with obsessive compulsive disorder (OCD), teams up with Begley, a Wall Street Journal science columnist, to explore the mind/brain dichotomy and to discuss the science behind new treatments being developed for a host of brain dysfunctions. Building on the work presented in Schwartz's first book, Brain Lock, the authors begin by demonstrating that OCD patients are capable of rechanneling compulsive urges into more socially acceptable activities and that, by doing so, they actually alter their brains' neuronal circuitry. By presenting a wide array of animal and human experiments, Schwartz and Begley show that similar neuroplasticity is possible in stroke victims, often leading to a return of function previously thought impossible. The medical results and treatments they summarize are exciting and deserve widespread attention. In a chapter entitled ""Free Will and Free Won't,"" the authors turn to the philosophical, examining the implications neuroplasticity might have on the differences between mind and brain; they also discourse on the existence of free will. Unfortunately, their integration of quantum mechanics and Buddhism into a search for a mechanism to explain the patterns scientists have been discovering is too superficial to fully engage readers. Nonetheless, a great deal in this book is sure to motivate discussion and more research.Copyright 2002 Reed Business Information, Inc. 
   From Booklist 
  Schwartz's undergraduate major was philosophy, and that interest as well as Buddhism has broadened his outlook and makes this book potentially attractive to more readers than those habitually interested in ""brain science."" Psychiatrist Schwartz pioneered the use of positron-emission tomography in studying obsessive-compulsive disorder (OCD). The behaviorists' therapeutic use of the often-harsh exposure and prevention method with OCD struck Schwartz as brutal and unproductive. Searching for a new approach, he gradually developed the four-step method that he and science writer Begley thoroughly describe here. Employing the Buddhist idea of willful mindfulness, Schwartz and his colleagues enjoyed considerable research and clinical success. A long, informal collaboration with physicist Henry Stapp enabled Schwartz to overcome the problem of free will and moral action, and one of his major achievements was proving the neuroplasticity of the adult brain, thanks to which the formation of new transmission routes coincides with that of new neurons. Schwartz and Begley bring to life the thinking and work of many original investigators in a book that thoughtful readers will enjoy. William BeattyCopyright © American Library Association. All rights reserved
"
37,0060988479,http://goodreads.com/user/show/99098442-paige,4,The book has great information. The only part that was hard for me was the quantum physics. I got quite lost here. Quantum physics only takes up about two chapter. Great analysis of experiments and what was gained from them. 
38,0060988479,http://goodreads.com/user/show/21910134-lauren-ocean,2,"Poorly organized presentation of questionable ""science""."
39,0060988479,http://goodreads.com/user/show/7683188-g-curtin,4,Chapter 8 on the Quantum Brain... blew my mind. Worth the read just for those few pages. Cheers to adult neuroplasticity 
40,0060988479,http://goodreads.com/user/show/50716035-bunny-sawyer,5,One of the most intriguing books I’ve ever read 
41,0060988479,http://goodreads.com/user/show/18833120-marius,5,"One of the hardest-to-read books I have completed in my life. It is a very rewarding as a true brain food in terms of deep insights, sophisticated analysis and bright ideas it presents.Enjoy!"
42,0060988479,http://goodreads.com/user/show/106572938-william-see,5,A book every human should read.
43,0060988479,http://goodreads.com/user/show/20947171-yates-buckley,4,"Good overview of neuroplasticity for the lay audience, but not up to date to recent research."
44,0060988479,http://goodreads.com/user/show/22563730-victor-negut,3,"The first half of this book is very good. It contains a well developed analysis of the history of OCD, and stroke therapy and its relation to neuroplasticity. It could be written and understood very well with or without invoking a discussion of free will. The author then enters the realm of quantum mechanics. His ignorance in the field could be disregarded if he did not misrepresent the field so wildly. He tries to use quantum mechanics to propose the existence of a mind force which he has invented. It lacks any scientific rigor, he grasps at straws. I was disappointed because much of this book is well worth reading. I would have likely given the book 5 stars if he did not make such uneducated references to quantum theory."
45,0060988479,http://goodreads.com/user/show/30541335-jimmy-ele,5,"Nonwithstanding my lapse of attention ironically induced by this book at page 323 at the precise chapter entitled ""Attention Must Be Paid"" I have decided to give this book a 5 star rating. Once I mustered up the willpower and attended to the rest of the book using the power of Mental Force I was able to induce a change in the plasticity of my brain, and my boredom dissipated in the same way a photon's momentum would, should a person decide to try and pin down its position. Many controversial subjects dealing with the relationship between mind and matter as well as quantum physics are examined. Not only are these subjects examined, but Jeffrey backs up his statements with actual scientific experiments which give his proposal a sturdy backbone, and a sturdy backbone is definitely needed in order to withstand the sure barrage of materialistic sciences proponents blows. Some of the experimentation that had to go down in order for these findings to become known are of a very animal offensive nature, and a big part of the book is dedicated to explaining the details of the rise of PETA. The trial of the man responsible as well as his justifications are all treated in an objective manner showing both sides of the story. Long story short, I'm so glad I wasn't one of those Silver Spring Monkeys and I'm glad that even though the experimentation yielded positive results, there is an organization dedicated to protecting the rights of these creatures. Many people of the scientific community will probably dismiss this book as ""hokey"" ""new age"" stuff, and Jeffrey doesn't necessarily care as is evidenced by his constant quoting of the Buddah. However, being a person who loves to entertain different ideas no matter how ""hokey"" they may seem, I found this book to be very well researched and backed by substantial scientific evidence especially in the subject of Quantum Physics and OCD studies. I highly recommend it to all of my friends and would encourage anyone who has experienced a lack of will lately or the intrusion of unwanted thoughts to give it a read. Knowing that there is a problem is the first step and then willfully attending to that problem by the techniques elaborated upon in this book could help many people suffering from some of the diseases written about in this book."
46,0060988479,http://goodreads.com/user/show/5900498-michael-johnston,4,"I was fascinated by this book. From neurology to quantum physics to existential philosophy, the author covers enormous territory in pursuit of an interesting idea - that the mind exists as a force of nature independent of the the brain. Scientific determinists have long argued that the chemical and synapitic make-up of the brain determines who we are. That all of our behaviors and beliefs are essentially pre-determined by the chemical and synaptic make-up of the brain. Schwartz rebels against this deterministic view and produces a step-by-step refutation based on research in several scientific fields but most prominantly from his work with OCD patients in which he was successful in retraining the behavior and remapping the brain. He notes that research in the last 20 years has provided overwhelming evidence of brain neuroplasicty (essentially the ability of the brain to alter it's own physical make-up over time based on experience). Going a step further he higlights that concerted mental effort that has the ability to physically alter brain physiololgy. For example, there was an experiment conducted with two sets of volunteers in which one was told to repeatedly practice a smiple five finger piano exercise and the other was told to only think about practicing the same exercise. The result? Not only did the repeated practice rewire the motor cortex of the brain, but thinking about the exercise had the same degree of impact on cortical remapping. In other words, mental effort altered the physical make-up of the brain.Beyond traditional neuroanatomy, however, Schwartz also seeks in quantum mechanics an explanation for how something non-physical like the mind can affect something physical. While the correllation here seems less definitive, there is ample room for quantum mechanical explations to provide the basis for his general thesis. I admit that there were times, when his theories developed a neo-religious tone, that he sounded a little nutty. However, ultimately the book is a tour deforce of theory refuting the Cartesion divide between mind and brain. I strongly recommend it for those interested in physchology, neuroanatomy or existential philosophy."
47,0060988479,http://goodreads.com/user/show/26821349-john-hewlett,2,"On the whole I have to say this book sucked. I am willing to give credit where credit is due in that it offers a really good overview of the history surrounding the idea of neuroplasticity. It recounts the studies and experiments performed by the major players in what was by the end of the last century representative of a massive paradigm shift within the neuroscience and neurobiological communities - namely that adult brains are not immutable and cortical remapping in response to physiological insults (strokes, hemispherectomies, etc) is a fact rather than wishful thinking and covered the additional fact that the adult human brain does indeed form new neurons based on research by Fred Gage at the Salk Institute. But that's where my praise stops. In the mid-2000's I attended a lecture by Pasko Rakic, MD, PhD. Dorys McConnell Duberg Professor of Neuroscience and Professor of Neurology at Yale University. He was responsible for describing the proliferation of neural stem cells from the subventicular area of the human brain. It would be difficult to find a man with a more distinguished career in 20th century neuroscience - he is perhaps the biggest skeptics of adult neurogenesis meanfully contributing to repair etc. The ""Mind and the Brain"" ended up being in support of psuedoscience and a half cocked idea of reviving some form of cartesian dualism, thinly masked by scientific jargon that, not surprisingly involved the language of quantum mechanics. I found the mechanisms discussed for making the case for ""self-directed change"" and ""free-will"" unconvincing at the very best. It wasn't science, it was philosophy, a respectable discipline in its own right but conjecture shouldn't be passed off as legitimate science and here we are well over a decade following the publication of this book, and the ideas put forth in the last three chapters have not born much fruit. Everything was going fine until about chapter 8 when Schwartz decides to go off the rails on a crazy train, hard."
48,0060988479,http://goodreads.com/user/show/426865-valerie,3,"I'm enjoying this book 'cause I'm very interested in the topics (mind, brain, and science) and it provides a good history of the subject (i.e. Descartes, dual interactionism, epiphenomenalism, etc.) which I didn't really have until reading this. The fact that Schwartz has signed the Discovery Institute's ""A Scientific Dissent from Darwinism"" hasn't really impeded my ability to listen to him with an impartial ear. BUT, I'm thus far unconvinced by the solidity of his central theses or original ideas, which attempt to argue for mind/brain dualism and free-will (which, btw, is the notion of free-will dependant on belief in ""mind"" as separate entity from brain?) and which from what I can tell so far are:1. Because he's treated OCD patients successfully by a combo of behavior and thinking changes (i.e. telling patients to think differently about what's happening when they get the urge to do the bad behavior) where strict behavioralists have failed (i.e. just force person not to do behavior and they'll eventually form new habits) there must be something called ""mind,"" i.e. something other than a physical brain state that is having a causal effect on brain state and behavior.Seems like a jump to me without really explaining how this proves the existence of ""mind."" Like - who can say that the brain itself just underwent random changes and mind is still just a shadow of the brain changes and not really its own thing? 2. Because experiences change the brain, i.e. neuroplasticity exists, so does ""mind"" ... he hasn't actually gotten to this argument yet where I am in the book but I think he's heading there, and while there was a time when I jumped to this conclusion myself, I can now see how naive it is. Just because the brain changes based on interaction with the environment has nothing to do with whether mind or free will exist. I think..."
49,0060988479,http://goodreads.com/user/show/4771466-john-martindale,4,"This book was really interesting, he makes the case that the mind is not merely an illusion, but it can have a causative force on the brain, which is quite a controversial stance to take in the scientific community. Personally it was quite a pleasure to hear Schwartz opposing the materialistic, deterministic and behaviorist view point which are still orthodoxy in the cult of scientific naturalism. But yeah, a lot of the book is the history of brain science and how a couple of folks accidentally stumbled upon how neuroplasticity still happens in the adult brain. Now what is amazing is how these findings utterly enraged the scientific community, for assumptions didn't allow for any changes in the brain. it seems way to much of the scientific community takes the ""To hell with truth! Don't confuse me with the facts, I have my mind made up!"" stance, for they fought against it, like scientist today oppose intelligent design. This just confirmed to me all the more that the common talk about the scientific community being so open minded and always pursuing truth no matter where it leads, is a bunch of B.S. the the discovery of Neuroplasticity and the power of mental force has brought so much good to the world, but those who proposed it to begin with were practically crucified. Whats more it is interesting that the ones who stumbled upon it were not educated by the current paradigm, so they were actually open to the scientific findings from their experiments. But yeah, I ought to shut up now. "
50,0060988479,http://goodreads.com/user/show/1167923-patrick,5,"This book delivers new ideas about the independence of the mind, neuroplasticity of the adult brain, and cogently lays out the efficacy of quantum mechanics at the root of the mind/brain relationship. Also, the author writes some of the best descriptions of quantum mechanical effects and the brain research tales that empower the concepts. Very good book. Highly recommend.Amazon review:A groundbreaking work of science that confirms, for the first time, the independent existence of the mind–and demonstrates the possibilities for human control over the workings of the brain.Conventional science has long held the position that 'the mind' is merely an illusion, a side effect of electrochemical activity in the physical brain. Now in paperback, Dr Jeffrey Schwartz and Sharon Begley's groundbreaking work, The Mind and the Brain, argues exactly the opposite: that the mind has a life of its own.Dr Schwartz, a leading researcher in brain dysfunctions, and Wall Street Journal science columnist Sharon Begley demonstrate that the human mind is an independent entity that can shape and control the functioning of the physical brain. Their work has its basis in our emerging understanding of adult neuroplasticity–the brain's ability to be rewired not just in childhood, but throughout life, a trait only recently established by neuroscientists."
51,0060988479,http://goodreads.com/user/show/1258937-liz,3,"This one gets a solid meh. The descriptions of psychology are interesting and the narrative he creates out of our intellectual movement from a kind of behavioralist rigid idea of the brain to our contemporary understanding both of neuroplasticity and the mind are compelling. At the same time, I found the idea of using quantum physics to be productive, though not in the way Schwartz intended. He makes a good argument for a non-deterministic view of the brain (contrary to, say, Daniel Dennett) based on the simple nondeterministic view of the universe. But then he shifts into a kind of ""dualism post the discovery of Buddhism in the West"" that never properly explains, for example, WHY the idea of the mind as emergent is impossible. His insistence on the mind as such and on keeping the Cartesian boundaries he claims to knock down was just unsatisfying, more so because the idea of quantum indeterminacy as the answer to free Will was actually really cool. Long story short, he mistakes the ideology with which he makes sense of the phenomenological world as an accurate explanation for those experiences, but fails to provide enough evidence for this reader, at least, to believe that said ideology is a response to the data rather than to the author's own theology. The individual claims are fascinating right up to the end, but the overall thesis needs work."
52,0060988479,http://goodreads.com/user/show/51527001-jerry-wall,4,"Update of desCartes mind body dichotomy. Is the mind the brain or vice versa? Can the mind change the brain. Briefly, yes. As we think and direct our thoughts we can change the brain, thus plasticity.A lot of physics as well and neurology. Briefly and in my feeble reaction as the brain is falling into its wonted custom of chasing compulsions to therapeutically wash hands many times to satisfy our thoughts we can redirect our thinking to do gardening (his example) so that the brain nerve networkredirects and changes neural connections (with more thoughts of doing A the brain gets tuned to the thought and the wiring in favor of doing A so doing A thoughts are reinforced.), i. e with more use those nerves get more emphatically wired. The brain . . . the organ through which the ind finds expression and through which it acts in the world. p. 365Mind we now see, has the power to alter biological matter s\ignificantly; that three pound lump of gelatinous ooze within our skull is truly the mind's brain. p 369. . . Wm. James recognized the array of things we can attend to (so if we are thinking about how nice it would be to wash our hands compulsively, we aren't [can't attend] thinking about gardening. . . p. 369Volitional effort is effort of attention per James. p 370It is the life we lead that creates the brain we have. p.373"
53,0060988479,http://goodreads.com/user/show/144751-kathryn,4,"I found this book very interesting. It discuses, neuroplasticity, most specifically the use of directed thinking to change the chemical structure of the brain. Dr. Schwartz goes into detail his Four Steps method for treatment of OCD, which pulls heavily from Buddhist meditation. This book was very informational, with a strong emphasis on the specific science involved, but was not jargon-heavy, and could be followed by an interested reader. It gives great background on the history and development of Neuroscience. It is also quite broad, touching on topics from Buddhism, Philosophy, Quantum Physics, learning disorders, the beginnings of PETA and the first scientist ever charged with animal cruelty. As I said, the scope of the book is vast. Dr. Schwartz comes down quite hard on the scientific community and materlism, as pertains to science in particular, as the a fundamental problem in modern society.Neuroplasticity itself is a relatively new idea in the science community, and one that isn't always embraced, but Schwartz does well to explain the details and background of this fascinating development. The ramifications of neuroplasticity are vast, and will not be fully understood for quite some time. "
54,0060988479,http://goodreads.com/user/show/1448125-jim,4,"The flaws in this book are many. The primary author, Schwartz, is self-obsessed, whether describing his own research or simply describing his Mercedes and land holdings. He also wanders off topic for most of a chapter, recounting the controversy with PETA about the treatment of lab monkeys (not the point of the book, but it is an interesting chapter). He makes up misleading new terminology (like “mental force”), and summarizes decades of physics far less effectively than many who have popularized physics before him. He attempts to unite neuroplasticity research, quantum mechanics, the philosophy of William James, and the teachings of Buddhism and his efforts not surprisingly are doomed to disappoint experts in each of these fields, yet, in the end, I admired the effort. The main point of the book, to describe current research in brain plasticity and to demonstrate that the practice of mindfulness to treat illness, is both fascinating and immediately useful. If you just want to read about mindfulness practice, it might be easier to just read Pema Chodron or Thich Nhat Hanh. But if you think that those practices don't apply to treating stroke victims, dyslexia, OCD and other mental illnesses, or, even just tinnitus, this book may convince you otherwise. "
55,0060988479,http://goodreads.com/user/show/26211610-tim-jin,3,"While interesting and fascinating, ""The Mind and the Brain"" was just hard to digest because it was written in a way to be very technical and you need the necessary vocabulary to understand the authors. It's almost too technical for someone to pickup from the coffee table and read. You might take a glance and put it down because it might not interest you unless you are a brain surgeon or want to know more about OCD and how it affects the brain. I just wished that the authors would had gone more in depth and studied more on physical disabilities, such as Cerebral Palsy and the brain. Cerebral Palsy happens when there is a lack of oxygen to the brain and damaged that portion. I have CP and my brain allows me to type with my feet, as I write this review, but other people with the same disability doesn't have the same abilities like myself. I hope that some day, these authors will do a study on disabilities and the brain and publish their findings. The authors covered almost everything that is possible on this human organ that is so hard to understand, but they left out involuntary motor skills that is caused by trauma to the brain."
