,isbn,user_link,ranking,review
28,0060572000,http://goodreads.com/user/show/899549-melissa,2,"I had really high hopes for this book. . .I loved his earlier book, The Professor and the MadmanGenerally speaking, I enjoy disaster history (Isaac's Storm, The Children's Blizzard, etc).But the science bits, explaining plate tetonics and exactly what kind of earthquake hit San Francisco in 1906 too far too long. I ended up skimming quite a bit of it, something I rarely do. His trip across the US, checking out fault lines, also got skimmed. The stuff about the actual disaster was good--there just wasn't enough of it. Not near enough about the aftermath and the human stories and the rebuilding. And then more pondering on other earthquakes and future earthquakes and. . .When I read in his bio that the author was trained as a geologist, it all made a lot more sense. It just wasn't what I was expecting, and I still don't feel like I have a good grip of the San Francisco disaster--unlike the masterful Isaac's Storm--where there's plenty of science, but also plenty of history. "
29,0060572000,http://goodreads.com/user/show/1008236-bookmarks-magazine,0,"Winchester's latest work is a lesson in unfulfilled expectations. Though he presents the book as a history of the San Francisco quake, over the first 200 pages Winchester offers an abbreviated version of John McPhee's Annals of the Former World. Where McPhee made clear his intentions to write a comprehensive geological history of the North American continent, critics feel duped by Winchester, or by the publisher's marketing department. Many reviewers are dismayed to see him reusing information from Krakatoa (**** July/Aug 2003). Even more wish he'd return to the human elements that made The Professor and the Madman such a critical and commercial success. Here, exhaustive research begets a fault-filled book, with little human or thematic tension to bind it together.This is an excerpt from a review published in Bookmarks magazine."
30,0060572000,http://goodreads.com/user/show/13181751-michael,1,"Ok.... this book is NOT about the San Francisco earthquake. Well... at least the first half isn't. That's as far as I made it. I put this book down 4 times to read others, so I gave it a go. The first half of this book is plate tectonics lesson along with a journal of the authors travels to plate tectonics related areas in western North America. NOT about the earthquake! This man is obviously very intelligent and should be a science professor if he isn't already. I bought this book to learn about the San Francisco earthquake.. i read 250 (of the 500 pages) and didn't learn a single thing about the quake. I had enough. It's a drawn out science lesson that I would imagine eventually discusses the event in the title. I was thoroughly disappointed and plan to try another book on the subject... that actually talks about THE EARTHQUAKE!"
31,0060572000,http://goodreads.com/user/show/25032671-kris,3,"Sprawling. Long-winded. Full of rabbit trails, non-sequiturs, detours, ramblings, and tangents.Winchester talks about geology, the California gold rush, history in Iceland, insurance companies, immigration, even other earthquakes. Only more than half way through the book does he finally get around to talking about the 1906 San Francisco earthquake.His writing isn't engaging enough for me to happily wait for him to get around to the main point. As a result, I started tuning out sometimes, not caring about what I missed, and waiting for it to be over. His sentences are also far too long, so it made this audio book feel even longer than it was.I've no idea why Winchester would think this to be good nonfiction writing. He talks just to hear himself talk."
32,0060572000,http://goodreads.com/user/show/625444-diane,2,"Simon Winchester is such a pain. He selects wonderful topics to write about and as long as he keeps himself out of the book, it can be wonderful. This one is pretty bad. I almost quit listening (he reads the book which isn't good)but am glad I endured the first three chapters or so because the information on the earthquake itself and its aftermath is pretty interesting. There were at least three things I would like to learn more about: the cattle stampede during the earthquake, Angel Island, and Arnold Genthe's the photographs taken during/after the earthquake and of Chinatown before the earthquake. The book ends as it begins with long, self-absorbed ramblings by Winchester."
33,0060572000,http://goodreads.com/user/show/5422600-kristi-thielen,5,"I've read Winchester's books on Krakatoa and geologist William Smith; both were excellent and this doesn't disappoint either. I've also read Philiip L. Fradkin's ""The Great Earthquake and Firestorms of 1906,"" which is much more about the people and politics of the event, rather than the geology, which is the focus of Winchester's book. Both books are well worth the read, if you are interested in this subject. Winchester's in-depth discussion of plate tectonics is engrossing - and it's delightful to learn about the brave and thoughtful post office official who decreed that victims would be able to send mail to worried loved ones elsewhere, even if they couldn't afford the stamp. "
34,0060572000,http://goodreads.com/user/show/35136-sarah,4,"I LOVE Simon Winchester. The guy's voice is like audiobook crack: he's British and he's perfect. If you want to read his other works, definitely listen to them. Start with Krakatoa; it blew my mind.This book is almost as good as Krakatoa. I learned a lot and couldn't believe how my public school education failed to educate me on history. I did get a little bored on the 9th CD, but the 10th picked up when he recounted his trip to Alaska and then back to Yellowstone. Certainly a must-read... or better yet a ""must-listen-to."" "
35,0060572000,http://goodreads.com/user/show/4380068-bill,3,"Like most of Simon Winchester's novels, I enjoyed this one. The focus is the San Francisco Earthquake and Fire of 1906. The earthquake, while the focus, is more an opportunity for Winchester to discuss fault lines, new geology, some history, sociology, etc. I like his meandering pace and always find the information he provides on his subject, accessible and interesting. Worth reading."
36,0060572000,http://goodreads.com/user/show/3314747-denise,5,"Love it. Looked at the two and one star reviews to see if Mr. Winchester was being accused of presenting misinformation. Relieved to find that is not the case. As for the reasons that are given, bah humbug! Yes he has a hefty vocabulary and he does meander; my advice, get a friggin dictionary and enjoy the ride."
37,0060572000,http://goodreads.com/user/show/35482263-gumble-s-yard,3,"A very similar book to Winchester's - ""Krakatoa: The Day the World Exploded: August 27, 1883"". Like that book the actual disaster is really only covered well over half way through the book, with Winchester aiming to give background and context to the story. In the first book this included the evolution of the Dutch East India Company and its spice trade, Darwinism, and the development of underwater telegraph cables). In the second it includes the Gold Rush, and the history of San Francisco. Both books cover geological issues - particularly continental drift and plate tectonics, as well as the history of related geological events to the main one described. The latter book seems to have a sub-plot of Winchester's own travels around the edge of the North American plate - from Iceland at its eastern edge to the San Andreas Fault at its eastern edge and to Anchorage in the North, via areas of geological interest such as New Madrid (possible site of a future mid-plate rupture developing) - however in practice this makes the book unstructured and hard to follow. Both books have interesting detail but are too long to be fully engrossing - particularly the latter book. An interesting subtext is that he makes claims that the rise of militant Islam (an Indonesian uprising against the Dutch) was prompted by Krakatoa and that Pentecostalism was given the crucial boost to its credibility by San Francisco earthquake which was seen as God's judgement on evil."
38,0060572000,http://goodreads.com/user/show/1136355-mary,3,"Everything you ever wanted to know or didn’t want to know about the geology of the North American plate meeting the Pacific plate... the San Andreas etc... this book is basically a geology book with not really that much about San Fran... I have to admit that the book is written well... not at all dry or much of a slog( a slog only because the topic is not for me) anyway.. I learned some very interesting tidbits...how will I ever hear the term Richter Scale without remembering dear eccentric nudist , vegetarian and sex maniac Charles Richter...or that Enrico Caruso drew a picture of himself in his pj’s and fur coat watching San Fran burn?? Or that Ansel Adams was 4 years old and while running to get his breakfast tripped when the second tremor hit and broke his nose and it was never fixed giving him the nose he was so famous for?? Anyway, I think I would not have picked this book up if I had thought it was really everything you want to know geologically speaking.. I feel rather annoyed by the title.... and the description.. but it was my fault and basically the book was interesting and informative... just not a “you must read this”... in fact if you live in California I think you should not read it.... unless you were thinking of moving... "
39,0060572000,http://goodreads.com/user/show/2985672-david-hill,4,"Winchester's telling of the 1906 San Francisco earthquake begins in Wapakoneta, Ohio and ends in Yellowstone National Park. He covers a fair amount of territory in between, and spans a time scale of hundreds of millions of years.If you're looking for four hundred pages of story about the earthquake and fire that took place in and around San Francisco in 1906, this isn't the book for you. This is a Simon Winchester book. He does tell the story of what happened the day the earth shook, and the days immediately after. But he takes his time getting there, and he wanders around quite a bit in the process. You not only get what happened, but why. I might say Simon Winchester is in the Dirk Gently school: ""Everything is connected."" But that overstates it. It may seem like Winchester is giving us everything, including the kitchen sink, but he does tie it all together. He tells the story, the whole story, and nothing but the story. And to tell the story of the earthquake, to understand the earthquake, you must cover a fair bit of geology.I enjoyed the book, but having read some of his other works I expected that he wouldn't restrict himself to the human story, the stories of the people affected, how they coped, and the tragedies they faced. I am interested in reading a book that is more focused on the people, and it looks like Winchester's bibliography suggests at least half a dozen candidates."
40,0060572000,http://goodreads.com/user/show/54244616-krlb,3,"I have a friend who, when asked a question, will give a prolonged answer, making sure to include every possible tangential piece of quasi-related information, often losing track of the original question altogether. I was reminded of him when I read this book. Not that it's badly written, or uninteresting - to the contrary, the author has a very thorough understanding of the subject matter and all related topics. It's just that in order to get to San Francisco of 1906 the reader must plow through a very detailed explanation of the major faults throughout the world, understand the different types of tectonic plates and how they move, how seismographs operate, etc., maybe a bit more than is necessary. Some readers may find this background information useful and gripping; I kept checking to see how many pages were left to be read. This is a good book to have read if your dinner conversation revolves around earthquakes; otherwise, Wikipedia might be sufficient."
41,0060572000,http://goodreads.com/user/show/26742517-ray-clendenen,5,"This is a wonderful book. It's the third book of his I've read, and I thoroughly enjoyed each one. Winchester is an Oxford-trained geologist, so I learned a ton about plate tectonics and earthquakes as well as California and San Francisco history. My only issue with the book is that Winchester's vocabulary is bigger than mine, so I had to look up quite a few words, such as ""gallimaufry,"" as well as several French phrases that he assumes his reader will know. But it was good for me. I'm looking for a place to use that word. It means ""hodgepodge."" "
42,0060572000,http://goodreads.com/user/show/30176460-beth,3,"The book was interesting, but the Author's narration kept putting me to sleep!"
43,0060572000,http://goodreads.com/user/show/2759420-jake,3,A good history of the 1906 San Francisco earthquake and fire. It is also a reminder that one of the greatest cities in the world is doomed. But the rest of us are too when the Super Volcano under Yellowstone blows (which is connected deep underground).
44,0060572000,http://goodreads.com/user/show/2309191-thewanderingjew,5,"Simon Winchester has elevated the language of science to the language of poetry. His eloquence will hold the attention of and also captivate the reader with his brilliant explanation of the formation of the earth, the ocean floor, the plates that shift and slide to wreak havoc or as he might say cause mischief in so many places. He describes such things as the molten lava “breathing” beneath our surface in such a way that you see the river of fire. He describes the movement of the faults so that you see them slipping and sliding under each other, layered irregularly atop each other, forming ridges like those in a carpet, as commonplace as a crease in a piece of fabric. He uses metaphors and similes to enlighten the reader and make the subject fluid rather than as arid as science can sometimes be for the layman. When Winchester likens the movements of the plates to a freight train stuck on the tracks with only the center moving outward, the reader can surely see the force of that pressure as it moves the front of the cars forward, finally, in a burst, resulting in the return of that bulge to the center, although in the front there may be concomitant damage; and when he describes the ripple that erupts in a carpet, sometimes, after walking on it repeatedly, the reader will see that “pleat”, as he calls it, forming a mountain one day as it continues to rise. When he describes the splitting water mains and the rupturing gas lines, the reader can feel the disaster in San Francisco approaching, along with the heat, strong tremors and fear, as well as the astonishment and wonderment also felt by some victims. Winchester brought the dry science behind an earthquake and other natural disasters to life. I could visualize the earth forming, the continents moving and the oceans spreading as the earth moved beneath me. With a vocabulary that has become obsolete in the pens of most writers, as they concentrate on sound bites and acronyms, he has mastered the art of prose, making often unfathomable subject matter less bone-dry with his use of language.Winchester speaks of Freud, Einstein, and Caruso in a casual manner as he creates the foundation for his story with vignettes that sometimes make the reader smile. He begins with the moon landing of Neil Armstong and tells the story of our magnificent planet. Viewing the earth from that bird’s eye view, he describes the inner core beneath the earth’s crust so well that you think you are listening to the secrets of a mystery novel that are slowly being fleshed out, when actually you are being presented with scientific facts. Traveling up and down the western coast of the United States, his explanations burst with information that are at once comprehensible rather than opaque. His research gleaned from journals, diaries and letters is impeccable and his knowledge coupled with his writing skill has made this a very enjoyable, informative read. I know that he placed me in San Francisco at the moment of the quake. I could almost feel the turmoil as the earth raged beneath its surface wreaking havoc above it.Today, the technology has improved so much that analysis is done by machines more often then people, but the first hand accounts did not contain the coldness of the machine, and therefore the story was connected to emotion. I learned of the reputation San Francisco had when it was born, I could see the cavalier attitude that prevailed, the indifference to any impending disaster, although there had already been some in the previous century. He even draws a relationship between the rise of radical faiths like Islam and Pentacostal Evangelists during catastrophic times, equating the catastrophes to a sign of G-d’s displeasure and a need for doubling down on their dogma. His analysis of the behavior of the insurance companies during the disaster is still relevant today! Although I cannot profess to have understood every word of this highly detailed and descriptive book, concentrating on the April, 17, 1906, San Francisco earthquake, I can say that I thoroughly enjoyed listening to this author read his own book with just the right tone and emotion to capture my ear completely. The book is both entertaining and informative."
45,0060572000,http://goodreads.com/user/show/644163-curtis,5,"Much of the discussion of tectonic theory and geology in Winchester's title on the Krakatoa eruption is not covered in this book for obvious reasons. I would recommend those with the interest to read that title at some point.A fair amount of this book covers not the actual aftermath of the earthquake which most people remember as the great San Francisco earthquake of 1906 but rather events leading up to it and the nature of American and world geology.I'm not going to write a spoiler here but I will touch on some points as to why this is an interesting read. To us 100 years seems a lifetime away but in geological times it's pretty much just a heartbeat. When you talk about the '06 event or the 1888 Krakatoa event it is sort of like discussing something that happened in political news just yesterday, or earlier today. It requires a perspective adjustment to see it's significance. The Earth is not on our schedule it has a timeline all it's own.There is a great deal of research in the area of studying earthquakes but as yet no real way to know when and where one will hit. This book however gives you an idea of how they work and of the different types. Not all earthquakes are the same and his focus is on those occurring along the faults in North America. The book delves into events on the East Coast, the Midwest, and of course the West Coast. It also discusses the role of volcanism in North America including the Super Volcano that is Yellowstone National Park.Again the Gaia theory of a world that is essentially a big ecosystem or machine is touched upon. Winchester is not an apostle of this hypothesis rather he lays out cooly for the reader. Interesting in 1906 there were a number of significant geological events that occurred ranging from volcanic eruptions to major earthquakes in South America. Is the result of the continual churning of the continents as pressure is released in one area and built up elsewhere? Movement in one region of the world perhaps leading to slippage in another? It is an hypothesis.Without writing a spoiler I'll provide one very contemporary observation he touches on. In 2002 there was a major earthquake in Alaska that thankfully didn't hurt too many people as it may have. Interestingly a change was observed in the geysers of Yellowstone some 1500+ miles away. Normally erupting in a very precise timetable it has apparently been shown that the timing change at precisely the time the shockwaves came in from Alaska. Of course it doesn't matter where on earth you are or if you feel them, earthquake vibrations can be recorded.Interesting in that Yellowstone is one of roughly ten volcanoes known by the new term Super Volcano (coined by the BBC in the late 1990s I believe). To perk you interest more? If you have ever been to Yellowstone it's not like other volcanoes with the crater on top of mountain peak. The crater there is essentially an indentation in the tectonic plate, that is the entire park roughly 40 miles wide is the crater. The lava chamber stretches under three states. If it goes you have to think about a nuclear ice age type of thing.Oh and it's a thousand years overdue :)So just when you thought it was crazy to live in California and that a 1906 earthquake was an interesting but irrelevant historical fact right?The gist: the big earthquake also due in California could conceivably effect the magma chamber etc of the largest volcano in the Western Hemisphere if not the world.Another interesting note. We are seeing some effects of global warming in the weather. About 7/8 of the worlds tectonic plate surface is underwater. What effect might the warming of the oceans have on a interrelated system per the Gaia hypothesis. The amount of energy the warming creates is astounding. That last isn't in Winchester's book, just an observation of my own. "
46,0060572000,http://goodreads.com/user/show/43101325-michele,2,"I'm struggling with the rating, as so much of the book had nothing to do with the San Fran quake of 1906. I have to admit, I skimmed chunks of this book. It took nearly to the end for the author to finally get to the quake.Some people love this book, I am not among them. Ugh. "
47,0060572000,http://goodreads.com/user/show/5624-john-adams,3,"It has been a while a few books since I have actually written a review, so lets see if I can make it interesting?Have ever had that thing where you hear about a disease, say like myocardial infarction, and then you look at a stick of butter and all of sudden you are biting your lip, sweating, and debating on whether or not you should call 911? It’s call hypochondria. After reading this book, I got that for earthquakes. I look at the ground. I look at the fault behind my house. I look at crack in my drywall, and all of a sudden I imagine the earth shaking and my house tipping over like a fat kid on a seesaw. Although, since I live in the Bay Area, it’s not a matter of will it happen, it’s a matter of when it will happen--and apparently that’s soon.I picked up A Crack in the Edge of the World because I wanted to read something on Bay Area History, but what I got, and what I didn’t expect, was to be so interested in geology. Winchester argues the synthesis and interconnectedness of the world’s ecology, geology, and environmental systems. In essence, if earthquake hits Jakarta then Old Faithful might skip a minute. It’s an argument that on the surface seems rather simple, but in reality proof is scarce (mostly as a result of the lack of measurable data). For about half the book Winchester adeptly walks the laymen through this complicated geological story. The other half of the book, Winchester takes the reader into 1906 San Francisco. He capably utilizes primary source material and vividly creates the world. He paints streets and shows falling buildings and burning stoves. Not to my surprise, the history of the event coincides with my imagination. The earthquake strikes and fire ravages the city. People are ill prepared and the religious blame the ‘sinners.’ When it’s all over they rebuild with very little concern of it ever happening again. In addition to telling the overall story, the book’s greatest strength is that it offers the lesser known details. For example, the queen of China exerted political influence on the United States in order keep Chinatown centrally located and the epicenter (which he details a long story of coming to consensus) is located in Daly City. Winchester is a good writer and the book is an easy informative read. I lack enthusiasm only as this book follows the pattern of “why I rarely read non-fiction.” I feel like if I wanted to digest the book I could have in about thirty minutes. It repeats itself and spends whole chapter to make a simple point. Personally, unless there is something exceptional or a compelling human story (see Jon Krakauer), I tend to lose interest in “non-fiction” after I understand the methodology and get the “point.” So admittedly I bumbled through the end. But overall, I did enjoy the book and I would recommend it to anyone interested in geology, San Francisco history, or earthquakes. "
