,isbn,user_link,ranking,review
70,0465094252,http://goodreads.com/user/show/5605932-vidyadhar,4,"The author takes the core issues with the present situation in fundamental physics, and raises questions in the manner in which physics research is organized both in theory and observations. The main basis for these questions is quite clear: the time lag between developing and testing hypothesis has become very large. The author dubbed this as an eternal inflation and also reveals cognitive biases in theoretical physicists’ selection or rejection of problems, and correspondingly, in their skepticism about research. And its implications are that physicists might have “lost in math” to make predictions. On the contrary, most physicists still believe in what they do and hope to find the “right kind of math”. Those who can`t stand the situation leave, and those who stay are the ones with few complaints – or maybe they just manage to convince themselves everything is all right. Perhaps, because the “right kind of math”, like happiness, can’t be found by complaining about its absence."
71,0465094252,http://goodreads.com/user/show/8884040-emil-o-w-kirkegaard,5,"Quite funny book, yet informative."
72,0465094252,http://goodreads.com/user/show/41911492-isabelle-leo,4,"Tear it up, Sabine!!!!"
73,0465094252,http://goodreads.com/user/show/29820367-sarah-modak,2,"I thought I knew enough about physics as a lay person to understand this supposedly pop science book, but I was wrong. And I know for a fact that's not on me, but this author. MOST of it went completely above my head which made me very very annoyed, especially since I've read quite a few articles and a bunch of books dealing with astrophysics and particle physics that were written specifically for people from non-physics backgrounds and done just fine. The book went around and around in circles, I found no clear path or train of thought through it. I also found the tone condescending and whiny. I do not understand why she took such a long winding path just to come to the conclusion that the human sense of aesthetic shouldn't come in the way of science and theory-building. This entire book could have been summarised in just about a 100-page paper and it's really made me mad that I suffered through it and it was such an energy-block in my life. This is not to say that the content of the book was bad. Given what one learns by reading the book, anyone would agree that her premise is stable. Assuming things really are the way the author puts them, it's credible that physics is stagnating because of cognitive biases and researchers being led astray by human ideas of beauty, and also a belief that the laws of nature must be beautiful. Although, I am no physicist, and it's a bit disconcerting to believe the claim that so very many brilliant researchers are so wildly off-course. What is also disconcerting is the author saying 30 years of a lack of breakthroughs is a really big deal. Isn't 30 years next to nothing in scientific research time, especially with what particle physicists are trying to achieve today?? But perhaps those are my own biases.The book gets way easier, better, and more readable from the chapter on quantum mechanics onwards. Also, the appendix in which the author mentions ways in which we all can avoid falling prey to cognitive bias and be sure that researchers are not chasing after beauty and creating theories based on unconfirmed assumptions, is one of the most lucid and to-the-point parts of the book. After one wades through the cesspool of angst and jargon, the info and data in this book is interesting and very important. All in all, Lost In Math is probably best read by someone from a physics or at least a STEM background, and/or a high tolerance level. "
74,0465094252,http://goodreads.com/user/show/11290063-cole,5,Sabine Hossenfelder is the most kindred of scientific spirits.
75,0465094252,http://goodreads.com/user/show/14671945-kian,5,Exceptionally good!
76,0465094252,http://goodreads.com/user/show/10176548-sydney,1,"This rating is more a reflection upon myself than the book. The idea of the book was interesting, but I just felt like the points I did get were too repetitive. There was also this weird gossip-y vibe about physicists. Maybe if I were more aware of their works I would have enjoyed it but I'm not and I didn't."
77,0465094252,http://goodreads.com/user/show/73759826-jo,4,Sabine shares her experience with physics and math inside a chaotic world where beauty can bright up. She brings a fresh and new perspective to classic theories. This book is a most for new science students. It will encourage them to explore unconventional and innovative paths.
78,0465094252,http://goodreads.com/user/show/3829594-prasanth-kancharla,4,"The book reminded me of the excitement of reading physics again, after long time. In a time where science is becoming increasingly written by experts for experts, Sabine Hossenfelder gives a good view of the developments (or rather lack of developments) in the fundamental physics today. Modern physics has hit the plateau recently with the experiments becoming more costly and lengthy. Our quest to understand nature has reached a point where we have developed theories that are practically impossible to be verified by experiments. This questions the definition of science itself where we are trying to explain that is not observable. This is the main point of Sabine Hossenfelder criticism on the current approaches to scientific method and practices of the community. She takes this as an opportunity to present the current state and also rise questions around the content of recent proposals in fundamental physics. This is followed by a memoir of her travels conducting interviews with physics, (including Steven Weinberg, Garret Lisi, Nima Arkani-Hamed etc.) where she presents their views and opinions on the concerns. The book is interesting as it reminds our powerlessness in understanding the nature and how mankind might have been in similar states in history, challenged by the limitations of means to study deeper and longer. It helps us to rethink our understanding on physics vs. philosophy vs. fiction.I would also recommend to read Jeremy Butterfield's detailed review (https://arxiv.org/ftp/arxiv/papers/19...) on the book that gives further insight into how the ideas of the book resonated with one of the contemporary philosophers. "
79,0465094252,http://goodreads.com/user/show/24081766-michel-meijer,4,"I am keeping tracking the modern books on theoretical physics, like those of Woit, Green, Carrol and others. The mathematics discussion from Sabine Hossenfelder is one of the newest on the block and a very pleasant read. There are three bascis themes in the book that are quite related. First, the lack of progress towards new enhanced theories of elementary physics in the last 20-30 years is described, and how all new measurments confirm the standard model from last century. Secondly is the way mathematicians and physisists deal with the ever growing difficulty to deal with this lack of progress (think multiverse appraoches as a last, probably not scientific, resort). And thirdly Hossenfelder worked on the question if beauty and naturalness should be leading factors in the design of new theories (a more philosophic topic).Sabine Hossenfelder writes her story more or less as the sceptic journalist. She interviews leaders in the field and discusses the above. But it is clear that she is not a fan of the multiverse approach and the beauty/naturallness thinking. Some alternatives are being probed as well, but these theories suffer from criticism from the field itself. She also explains that rogue thinkers have less and less opportunity to work down their theories due to funding and how modern theoretical physics works in the communicty. In this sense the book is a real folllow-up of Peter Woits ""Not even wrong"".The science in the book flips between very easy to understand to extremely difficult for a guy like me (for example Gauche theorie and Lie groups). I am still looking for a book that can help me understand what this exactly is and how the Standard Model came to be.Anyway, I think this is quite a light read, which summarizes the field quite well. Four stars."
80,0465094252,http://goodreads.com/user/show/13269556-brian-powell,4,"There is no sign of supersymmetry despite decades of experiments. There is really no scientific motivation for its existence in the first place, beyond aesthetics, undefined notions of simplicity, and beauty subjectively conceived. Yet thousands of really smart people want to spend billions of dollars on new colliders to find it. This is dumb, Dr. Hossenfelder says so, and somehow she gets a ton of shit for it. Well, she doesn't say so exactly. What's great is she lets others make this point for her: Weinberg, Polchinski, Arkani-Hamed. The book is primarily interviews with some insightful glue from the author holding it together. While the failure of a new collider to detect SUSY or similar speculative predictions can be assessed objectively in terms of lost dollars, it's much harder to account for all the careers spent chasing false hopes. It makes me think of all the thousands of preprints that end up on the arxiv, many of which probably end up getting published, that are quite possibly ultimately about nothing. Fiction. Worse than ""first-order"" speculation like SUSY or string theory are the volumes of work on models built on these conjectures, like brane-world incarnations of inflation or dark matter that arises from some SUSY-infused GUT symmetry. To any aspiring physicist interested in high energy theory, they must seriously level with themselves: there's at least a decent chance that this house of cards built on so much sand is wrong; as in—it has nothing whatsoever to do with the actual universe. Are you ready to devote your life's work to it?"
81,0465094252,http://goodreads.com/user/show/730704-john,2,"I’m not sure who the target audience of this book is, certainly not me. It investigates the current difficulties in particle physics and the lack of any real progress, or even current theories with any real promise. It’s a science in crisis, if you ask me, and Sabine Hossenfelder understands this.The problem with the book is that she assumes so much (if her target audience is people like me). She constantly bandies about various terms that she seems to understand, but she doesn’t really define, but assumes the reader knows what they mean. Here is one example:“‘The people looking for phenomenology,’ Joe goes on, ‘they all have the same problem, they have to reach across the remaining 15 orders of magnitude. It’s a very hard problem.For most of string phenomenology, it’s not so much that you have a theory, but that you have a possible phenomenology that someday may be part of the theory and it’s not because people are doing the wrong thing but because deriving phenomenology is such a difficult problem.’”I realize the author is quoting a physicist, but what the heck does this paragraph even mean? I could come up with multiple examples of this kind of passage because they are littered throughout the book and make it very difficult to understand, but you get the point. It’s like a nurse wrote a book on medicine and expects you to know all of the medical terminology, even the most arcane. So yeah, not my cup of tea."
82,0465094252,http://goodreads.com/user/show/37277866-ellison,5,"Very well written in a relaxed informal, at times conversational, voice. Hossenfelder has a wry sense of humor; a rare commodity in science writing. She's a good counter to authors like Sean Carroll - who I also like but who at times lacks a little humility.“Theoretical physicists used to explain what was observed. Now they try to explain why they can’t explain what was not observed.’She quotes George Ellis - 'Trust matters a lot in science. And if people go around saying it’s really possible that we live in a simulation, I can’t trust them as scientists, or even philosophers.’‘Minding the boundary between science and philosophy, I think, could help physicists separate fact from belief. And I don’t see a big difference between believing nature is beautiful and believing God is kind.’"
83,0465094252,http://goodreads.com/user/show/4038192-jacob-vorstrup-goldman,5,"This possibly concludes a slight detour into physics on my part. Sabine is erudite and well-argued, but often fails to really roast the (mostly) theoretical physicists she talks to, which I think would have made the book better - but her career most likely worse. What are you going to do. There is tons of interesting information contained within this book, and it is placed dead center in the current research environment - this is not a compelling history of mistaken geniuses or popular picture of the failure of physics, it is a serious whisteblower-account of a field gone awry, and if you don't know your muon from your quark and quantum field theory from quantum chromodynamics, this will be (slightly) difficult to follow. Bottom line: just because it is hard to score doesn't mean we get to move the goalposts. Strong recommendation."
84,0465094252,http://goodreads.com/user/show/863686-david,5,"Brilliant, and an absolutely vital read if you are involved in research in the sciences. The critiques and lessons here extend beyond physics, stretching to the ways we fund, the ways we select for publication, the ways we reward thinking. Too long have these issues been ignored. Too long have those involved insisted that they were free of biases and cognitive distortion.But lest one think such a book must be a slog, let me set the record straight: this is a page-turner. Hossenfelder keeps things moving along briskly, and her frequent interviews with various major physicists all add real character to the proceedings. And there's plenty of wit, too. Mostly dry, often hiding near the end of a paragraph or in some parentheses or a footnote.Highly, highly recommended."
