,isbn,user_link,ranking,review
3,0060572000,http://goodreads.com/user/show/175635-trevor,5,"I have to say that I really do like this man’s books. I think the only reason I would read a book on Krakatoa is because Winchester wrote it. It is also very likely that the only reason I would read a book on an earthquake is because Winchester wrote it.Let me tell you what there is to love about this book.Firstly, Winchester starts off by talking about the Gaia Theory – essentially that everything is related to everything else. He does this because talk of earthquakes has only begun to make sense since we learnt of plate tectonics – that the continents float about the world on huge plates and that these rub up against each other and cause volcanos and earthquakes. And one of the most fascinating things about plate tectonics is that this idea has only been around in science since the 1960s. Think about that for a moment – that we have only had any real idea about the how and the way of volcanos and earthquakes for a little over forty years.Prior to the 1960s we also had a very localised view of how these catastrophic events happened. We really didn’t have any notion that an earthquake in Tokyo might impact on a volcano in Hawaii. We still have only hints about how these two events might be related, but the fact we can even seriously ask the question now ought to send a shiver down your spine. “What a piece of work is Man… in apprehension how like a God…”Gaia theory holds that the whole of the world is linked up by a series of complex and remarkable interconnections. And just to celebrate, Winchester writes his books in a way that brings to the fore layer after layer of beautifully observed relationships between earthquakes and racism and artists leaving for the hills and architecture and religion.When people say things like, ‘everything is related to everything else’ I generally feel a little uncomfortable in that ‘let me get out of this conversation as quickly as I can’ kind of way. There is a scene in Douglas Adams’s Dirk Bogart’s Holistic Detective Agency where Dirk is at a complete loss what to do next and so, figuring that everything is connected to everything else, he follows a car at random, which, naturally enough, brings him to where he needs to go. This is fiction after all.Winchester’s paths are never random. His relationships never fail to delight. His keen eye for both the fascinating and the absurd never fail him. I really am very fond of his books and this one is no exception.There is a part of this book where he is describing the horrific fire that started as the earthquake ended. This was a city ready to burn, and the quake bursting both gas pipes and water pipes beneath the city did much to strike that particular match. There is a photo in this book taken from the top of a hill. In the distance you can see the smoke billowing and being blown into the background of the picture. How Winchester explains what you are looking at and what is about to happen in the world of this photograph is one of those moments in a book that is a pure joy. He starts off by stating what we all think – that fires move in the direction that the winds blow them. Clearly, in this photograph, the wind is blowing towards the back, so that will be the direction the fire will go. He then points out that what is in the distance behind the scene in the photograph is water and already burnt buildings. It is then that he says that city fires not only make their own winds, but that they move in the direction of the fuel that is available – not always in the direction of the wind.One of the more fascinating connections with this earthquake was the start of the Pentecostal movement. The pastor who started the Pentecostal movement said, a mere three days before the quake and fire, that God was preparing a sign – and when God prepares signs, he provides the entire Burma Shave experience. The most Godless city in the United States virtually wiped off the map in one go. God does seem to have learnt his lesson though, as this time there are no wives being turned into pillars of salt and the only good man in the town didn’t end up getting drunk and doing a Fritzl with his two daughters. At least, at the time it seemed they only spoke in tongues – I’ve no idea when Pentecostals started getting down and dirty, but I assume it was a long time prior to when the Swaggarts and Bakers did their stuff.I liked this one very much, but then, I’ve enjoyed every one of his books so far."
4,0060572000,http://goodreads.com/user/show/146952-grumpus,2,"This one was tough to rate. I loved  Simon Winchester’s books Krakatoa: The Day the World Exploded: August 27, 1883 (P.S.) and The Professor and the Madman: A Tale of Murder, Insanity, and the Making of the Oxford English Dictionary (P.S.) for their story-telling style. This one however, is written in a very scientific manner. Indeed, according to Amazon’s text stats, this book was written at 15.2 grade level as measured by Flesh-Kincaid readability—for comparison, Amazon indicates that only 9% of the books are at a higher level. Further, at an average of 30.7 words per sentence, the average sentence in this book has more words than 97% of Amazon’s books. Yeah, yeah, I'm a numbers geek.While I enjoy learning new words and usually have a dictionary nearby as I read, this book slowed me down with the number of times I had to stop and look up words. Here are a few examples from page 117 of the hardcover edition: gasconading lickspittles, gimcrack houses, panjandrum, and Spanish-speaking hobbledehoys. If you’re looking for a scientific explanation about the history of plate tectonics from when the first landmasses broke the surface of the water to the present day, this book is for you. The story of the 1906 San Francisco earthquake just gets lost in the scientific jargon."
5,0060572000,http://goodreads.com/user/show/6316460-becky,1,"I am 150 pages from the end of this tome, and you know what? I am going to DNF hard. I just dont care about it anymore. I really tried, I really did, but Winchester hasnt even started talking about THE ACTUAL EARTHQUAKE YET. I just have too many other books to read before I due to continue on with this self-absorbed shit.This was my last attempt with Winchester. He simply isn't an engaging author. I find him pompous and his books horribly bloated and lacking in any energy, connection, or emotion. I've read state budgets that were more interesting."
6,0060572000,http://goodreads.com/user/show/615172-shawn,2,"Like a train wreck, I can't look away.The 1906 earthquake that most notably affected San Francisco is a fascinating topic, and I like books with a bit of Science in them, but oh my god! could this author be any more of a pain in the ass? I just have to prove it with a couple of examples, but truly sir: Mr. Winchester, I implore you, where are your trustworthy editors? Nowhere, mon frere. Example One in my hypothetical thesis entitled ""why Simon Winchester is a pain in the ass"": in one paragraph (pgs. 91 and 92, oh, it's a long-ass paragraph) Mr. Winchester makes use of the following words: panjandrum, lickspittle, gimcrack, gasconading. Now, I believe I have already more than proven my thesis, but two further examples for the sake of thoroughness: 2. in a book about the San Francisco quake, the quake happens in real time in the narrative on page 205; before that is background discussion of plate tectonics and other gimcrack subjects. Finally, example three has to be seen to be believed. I think I'll just put a sample paragraph here that shows the tedious, longggggg-winded, pretentious writing style (and mind you, the author seems like a good dude and all, no offense intended, he just needs a competent editor). The following paragraph, I'd hone down to five or six words if I were editing: ""I went to New Madrid, Missouri."" He uses 175 words:""To begin to answer that—and geologists have been grappling for years with the vexing problem of those earthquakes that occur where they ought not to—I first had to drive some 600 miles west, to the site of one of the most remarkable earthquakes that America has ever known—by some accounts the biggest ever experienced in the Lower Forty-Eight states. I then had to travel another 400 miles westward, to a village set deep in the Midwestern plains, where a seismograph is mounted inside the general store. My second destination was a somewhat obscure and all but forgotten place, though one of some importance in explaining why America suffers earthquakes so far from the edges of the plate on which it stands. My first intended stop, however, was at a town that suffered an event that took place over a series of weeks during the winter between 1811 and 1812—a hitherto unremarkable Mississippi riverside town that has since entered the lore and the lexicon of seismologists around the world: New Madrid, Missouri."" The End"
7,0060572000,http://goodreads.com/user/show/1242165-schmacko,2,"Boy howdy, Simon Winchester sure knows his geology! And while he’s telling you about it, he’ll also throw in a long tangent about camping on Mount Diablo. And then he’ll tell you about the Gaia theory. And then he might get distracted by a story from his college days. And then he FINALLY arrives – 205 pages into this book – at the Great San Francisco Earthquake, the theme of this book. But then – and I want to strangle him for this - he’ll forsake all the human lives of the city and their stories for a lengthy explanation on how the broken gas pipes caused a massive fire.I am reminded of a joke about either Tolstoy or Michener – or both – that they take four chapters to tell us about how the earth formed. Winchester takes the whole book. The earthquake happened in a city…a city populated with people…yes, I get that there were buildings and gas pipes and other stuff there that got shook around in physically and scientifically fascinating ways, but all that stuff Winchester concentrates on was all put there by the humans that the author almost completely ignores.The person that Simon Winchester seems most interested in telling us about is Simon Winchester. He likes big words. He went to Oxford. He knows geology. He goes camping.I now know a lot more about geology. I should’ve read the flap more carefully, because I wasn’t looking for a self-possessed windbag’s explanation on plate tectonics. I was looking for the human heart of the disaster, like what Eric Larson did with the Galveston hurricane in Isaac’s Storm. I didn’t get that…"
8,0060572000,http://goodreads.com/user/show/545336-mike,5,"I hate these science books by Winchester, he wreaks havoc on my Book Challenge because I cannot zip through it. I have to slow down and really enjoy it. Yeah, giving A Crack in the Edge of the World: America and the Great California Earthquake of 1906 5 Stars for making plate tectonics interesting. Seriously. You don’t get to the San Francisco part of the story until page 230. The SF story is more interesting for the attempt by politicians and others to remake the 1906 event into a slight tremor that caused a big fire—didn’t want to make SF a dangerous place to invest and live. Fire can be prevented—earthquakes can’t. The 1906 earthquake released about 21 feet of movement along the San Andreas fault. According to Winchester in 2005, there was 17 feet of fault slippage stored up as of 2005. Scary sh*t, it only a matter of time until the next big one.What I find so interesting about the “new” geology, i.e., plate tectonics, is that it has been developed in my lifetime, essentially since 1970. An old science, completely remade in a generation. This may seem a little weird but when I read this passage, I had some dramatic music playing in my head, something like Holst’s The Planets…here is Winchester’s description of the very, very early life of our planet:(view spoiler)[
  It was at this point in the planet’s history that the earth’s eggshell-like crust, which was slowly forming on the surface from this cooling scum, began to stop doing what up to that point it was prone to do, and that is to keep on remelting itself. For eons it kept sinking back into the mantle just a few millennia after it had formed, utterly wrecking itself in the process—and then it would popup out of the molten ocean of lava and be reborn in a totally different guise Instead, all of a sudden, large chunks of crust were staying afloat, more or less permanently. In cooling, the crust was forming itself into rocks that would themselves be permanent— if only the external forces permitted them to remain at the surface and did not try to drag them or push them down toward the heat again.	As they slowly cooled, some of these rocks-to-be separated themselves out, according to perfectly understandable laws of physics: The lighter materials of the scum rose to the surface, the heavier ones passed downward in one enormous fractionating column—a little like the Skaergaard, though over infinitely longer periods of time and under very different physical conditions The lighter materials generally formed themselves into those rocks we now call granites—the course-grained rocks that tend to be prettily light in color as well as in constitution The heavier fractions created layers of rocks like basalt and diorite and gabbro, which were darker and tended to sag downward under the force of gravity forming sloughs, whereas the granites tended to form uplands. The darker and heavier slabs lay sluglike and low on the earth’s surface, and in time they began both to accumulate and to accommodate water that fell from the skies; over many millions of years, this resulted in the creation of oceans. Dark rocks underlay the seas; granites made up the new continents. And this law of basic igneous geology has remained a verifiable truth ever since.	The new crust, as it spread and wafted itself around the surface of the sphere, also became cracked, as cooling crusts of clinker and furnace slag are wont to do, and the plates, or rafts, or slabs of floating or sagging clinker that were then formed between the cracks began to swirl about, thanks to the currents of terrifyingly hot material that were(as they still are today) upwelling and sinking back underneath. No doubt the slaggy scum came under the influence of other forces. There was gravity, there were great gyrations in the planet’s magnetism, there was its spinning motion, the occasionally too-close-for comfort proximity of the moon and other planets, and the tilting and wobbling of the earth’s own axis of rotation. The third planet from sun, it must be remembered, is in geological terms a comparatively small ball of material, subject to all manner of kinetic and thermal influences; and the first continent-in-the making was turned this and that for millions of years, as it struggled gamely to get a grip on itself and remain more or less in place on the ever-changing molten mantle that underlay it.
(hide spoiler)]The book carries on in similar fashion through the various discoveries on our energetic little ball of earth. Winchester takes a circuitous route to 1906 San Fran but I just loved the journey. Not for everyone but worked for me. Good account of the earthquake and the aftermath. Oh, and he leaves us with a warning about the super-volcanic hot spot beneath Yellowstone, actually the cycle for this one to blow is due anytime. Winchester also casually points out that the earth’s faults are connected and often one earthquake sets off others all around the world.Just great fun reading!"
9,0060572000,http://goodreads.com/user/show/1662632-richard,4,"This is a mostly delightful tour of geology, earthquakes and plate tectonics, with an emphasis on California's infamous San Andreas Fault and the 1906 earthquake that devastated San Francisco. I can highly recommend it.Much to the delight of info gluttons, Winchester as always ranges widely from the nominal focus of the book. Any reader looking for an in-depth history of the whys and wherefores of the earthquake and fire will be more than satisfied, as well anyone wondering about the broader surrounding topics.Of course, if you want your author to go straight to the heart of the matter, this isn't your book and, furthermore, you really should forego any of Winchester's books.By the way, this book was more personal to me than to most of you out there: I've lived in San Francisco for almost my entire adult life, and I'm a third-generation Californian (and almost a third-generation San Franciscan). I've backpacked for many years in the Sierras, thrown up millions of years ago by the mechanisms he describes in the book, and I felt connected to every scene he describes in the city.Still, my reaction to this book isn't unalloyed praise. I think there were several false notes. The more obvious one was the connection to Pentecostalism. I agree it was an important phenomena of the time — actually, I wouldn't be here if my mother's parents hadn't found each other while attending a Pentecostal church during the depression. But the movement almost certainly would have taken off with or without San Francisco's earthquake; that kind of exuberant religiosity seems to be a fundamental part of U.S. culture. Despite the specific anecdotes that tie the two stories together, I felt it was really a post hoc, ergo propter hoc kind of connection, and detrimental to the book's focus.The other significant annoyance was that several times the author referred to San Francisco and other places in close proximity to the fault as ""very dangerous"". Now, maybe when the Big One hits I'll change my tune, but substantially fewer than 1000 Californians have died in earthquakes in the past century. As I'm writing this at the end of April 2013, and the New York Times just reminded me that three years after the 1989 Loma Prieta earthquake (which killed 63 in the region), Los Angeles lived through the Rodney King riots, which killed 54. And, of course, at least 15 (and possibly many more) have just died in the explosion of a fertilizer company in Texas. Frankly, life is dangerous; everyone dies in the end. Living in an earthquake zone does slightly raise the likelihood of dying prematurely (or being seriously injured), but there are many, many other factors that affect mortality rates even more. Coastal California — right along the San Andeas Fault — has a famously benign climate, for example. I suspect the overall health of the locals is higher because of it, and probably lengthens their life expectancy more than the earthquake risk shortens it. Winchester even makes fun of the residents of Portola Valley, a town that lies directly upon the fault line — amused at how they argue endlessly about whether and where to move this building or that, only to go back to sipping their sauvignon blanc. He agrees that their ""way of life [is] quite unrivaled in its quality anywhere in the world"", yet still thinks that there can be ""no greater monument to hubris"" that the choose to live there.I suppose he really thinks they'd be better off somewhere else, but I think there's a lot of hubris in his assertion that he is right and several million residents of the San Francisco Bay Area are being irrational. Perhaps he should have asked the scientists at the Menlo Park's USGS — the same folks he thanks for helping in his studies. After all, their office is on alluvial soil about eight miles from Portola Valley, and they undoubtedly live in the area. It apparently did not occur to Winchester to ask them what they feel about that risk.I'll take the certitude of a quake and its consequent increase in my mortality over living elsewhere, thank you.Addendum: Stephen Colbert's bit on the earthquake is amusing: The San Francisco Earthquake: Was It Really That Bad?.­"
10,0060572000,http://goodreads.com/user/show/651974-james-peavler,3,"This book only gets a three from me because I felt it was falsely advertised. As a Bay Area native, earthquakes have always held a strong fascination for me. I experienced a fairly large one in 1989, and my memories are still as strong today as they were then. So when I pick up a book that gives me an impression that its about the year 1906, and the seismic activity that occurred all around the world that year, ending with the ultimate seismic event near the shores of San Francisco, it was disconcerting to read about the geologic history of the earth.As fascinating as that was, when over half the book is about the formation of the earth and the world as we now know it, and the Great Earthquake of 1906 seems to be almost an afterthought for the final 100 or so pages . . . well, needless to say, I was a bit disappointed. It's a time in California history that I find enthralling, and was nestled in my bed ready to read about how the ground rolled and the buildings fell and fires consumed, yet I had to dredge through why Iceland is where it is and why dirt in Japan is related to dirt in Africa. Believe me, it was interesting, but when you pick up a book expecting one thing and read another, it's a disappointing experience. By the time I actually reached the earthquake in San Francisco, I could have cared less at that point. I just wanted to be done with the book."
11,0060572000,http://goodreads.com/user/show/261544-jz-temple,5,"Now I'm surprised to see so many people who didn't like this book, but I'm guessing it's more a matter of style. Winchester certainly does take his time getting to the San Francisco part of this book but it is ""America and the Great California Earthquake..."", and like his previous book on Krakatoa he does like taking the discussion far afield. However, it's the kind of book I like, much more about ""why"" and ""how"" rather than ""who"" and ""when"". I would recommend it, especially if you liked ""Krakatoa""."
12,0060572000,http://goodreads.com/user/show/16012-andrew,2,"It takes Winchester nearly 100 pages to get into the meat of the story -- the 1906 Earthquake that destroyed San Francisco. Until then, we have to wade through tales of his Oxford days and camping on Mt. Diablo. A tough read that brings little joy -- although he does capture the sense of magic we all feel when discovering, and re-discovering, San Francisco. Some exerpts:""There is a tendency common to most of us to take the more modest of our landscapes for granted. We see a wide and fertile plain and we drive across it, as fast as its flatness allows, rarely pondering what might have brought it into being. We come across a valley, and, though we might take pleasure in it appearance, we give it all too little thought...What forces first made them...?""""What I remember most about the city, which was spread out beyond the low hills and clustered like a jewel box of gleaming spires and glittering windows on its tiny thumbnail of a penninsula, was just how astonishingly delicate it all looked. It was quite unlike New York or Chicago or Boston. Those places were gray, massive, battelship-like cities, cities that were indelibly written into, and indestructibly welded onto, their landscapes... But not, it seemed to me, this preternaturally beautiful city of San Francisco... How tightly San Francisco appeared to cling on it its hillsides: One could imagine knuckles whitened, sinews straining, teeth gritted."""
