,isbn,user_link,ranking,review
81,0300136595,http://goodreads.com/user/show/2332398-mjdrean,4,Learned a lot and enjoyed the process.
82,0300136595,http://goodreads.com/user/show/8767419-bradley-roth,2,"Interesting, but sometimes got the science wrong. Horrible explanation of tides."
83,0300136595,http://goodreads.com/user/show/18791476-harold,3,For youngsters. Chatty (with lots of parentheses) and plenty of errors in discussing ancient Egypt (one wonders how many errors are elsewhere). But very easy reading
84,0300136595,http://goodreads.com/user/show/21768115-richard-sansing,4,"Well-written and comprehensive history of science, from ancient civilizations to the present day. Each of the 40 chapters is short; 5-8 pages. Quite accessible to the non-expert."
85,0300136595,http://goodreads.com/user/show/26467876-zois-kouris,4,Bynum did a very nice Job for the non-complete history of the science. Missing facts especially Greek medicine and mechanics science. 
86,0300136595,http://goodreads.com/user/show/2620175-adam-hinterthuer,3,"It is exactly what it says it is...a little bit of history. Nice refresher on a lot of advancements, but just made me want to read more in depth about a lot of the things he touched on."
87,0300136595,http://goodreads.com/user/show/10694421-chuck,5,"This book got off a little slow, but was a great and amusing overview of the history and development of science and the associated technology. A very worthwhile listen/read"
88,0300136595,http://goodreads.com/user/show/31284253-amanda-giske,4,A fun way to learn about science and how scientist discovered everything we know of today
89,0300136595,http://goodreads.com/user/show/34993553-abhishek-agarwal,3,A little too concise for vast topic it sets out to cover.
