,isbn,user_link,ranking,review
190,0393348741,http://goodreads.com/user/show/1737220-richie-partington,5,"Richie's Picks: GULP: ADVENTURES ON THE ALEMENTARY CANAL by Mary Roach, W.W. Norton, April 2013, 336p., ISBN: 978-0-393-32912-4""Food, glorious food!We're anxious to try itThree banquets a day --Our favorite diet!-- from the musical Oliver""Silletti hands me a plastic cup and sets a timer. We are moving on to unstimulated saliva. This is background saliva, the kind that's always flowing, though much more slowly. A minute passes. We turn away from each other and quietly spit in our cups.""'Look at the difference compared to stimulated.' Silletti tilts her cup. 'You can't pour it easily. It's so viscous. Look!' She dips the end of a glass pipette into her sample and pulls it away. Filament is a nice word, Silletti's word, for the mucoid strand that trails behind.""Relatively little is known about unstimulated saliva. Partly, Silletti says, because no one wants to work with it.""'Because it's so gross?'""'Because it's harder to collect. And you can't filtrate it. It clogs the filter, like hair in the drain. And you cannot be precise because it's so slimy.'""'Right, it's gross.'""Silletti tucks a strand of her glossy black hair behind her ear. 'It's difficult to work with.'""Unstimulated saliva's trademark ropiness is due to mucins, long chains of amino acids repeating to form vast webs. Mucins are responsible for saliva's least endearing traits -- its viscosity, elasticity, stickiness. They are also responsible for some of its more heroic attributes. Unstimulated saliva forms a protective film that clings to the surfaces of the teeth. Proteins in this film bind to calcium and phosphate and serve to remineralize the enamel. Webs of mucins trap bacteria, which are then swallowed and destroyed by stomach acids. This is good, because there are a lot of bacteria in your mouth. Every time you eat something, every time you stick your finger in your mouth, you're delivering more.""It is now a decade since I immersed myself in Mary Roach's STIFF: THE CURIOUS LIVES OF HUMAN CADAVERS, whilst a member of YALSA's 2004 Best Books for Young Adults committee (which we, in due course, included on that year's selection list).Mary Roach's nonfiction explorations keep getting even more funny and fascinating. I am thinking that Roach's work and popularity must just build upon themselves: When you become well-known for writing incredibly funny, bizarre, and well-researched science books, I imagine that you are subsequently granted more time to complete the next project and can trade on your popularity to more easily gain access to top scientists and studies in progress that provide up-to-the-moment information. So, each time you tackle a new topic, you end up with a book that is even better than the ones before.""'What was hard,' Leavitt said, 'was finding the judges.' Leavitt needed a pair of odor judges to take 'several sniffs' and rate the noxiousness -- from no odor to 'very offensive' -- of each of the sixteen people's flatal contributions.* """" *It could be worse. In a study of malodorous dog flatulence carried out at the Waltham Center for Pet Nutrition in Leicestershire, England, the far end of the scale was 'unbearable odor.'""The fact is that GULP is a gas. Mary Roach begins with an exploration of the functioning of the nose and mouth as she explores how we interact with our food from one end of our bodies to the other. Side-splittingly hysterical, gross, eye-opening, fascinating, disturbing, and unforgettable are all words that readily describe what it's like to experience these step-by-step alimentary adventures and the million side journeys on which we are led by Ms. Roach through her research into these yummy topics. I advise you to not try reading this book while anywhere that you have to be quiet -- you could conceivably choke to death trying to stifle the laughter.At the same time, the breadth of research and quality of information delivered here is such that I've been repeatedly talking about this book to anyone who will listen and am gearing up to pitch it to any high school AP science student who crosses my path:""Why is it, then, that stomachs don't digest themselves? Why do one's stomach juices handily digest haggis or tripe but not the very stomach that excretes them? ""It's something of a trick answer. In fact, stomachs can digest themselves. Gastric acid and pepsin digest the cells of the stomach's protective layer, or mucosa, quite effectively...A healthy adult has a new stomach lining every three days. (More clever stomach tricks: key components of gastric acid are secreted separately, lest they ravage the cells that manufacture them.)"" It is so intriguing to read about what our own bodies are doing every day -- in fact what they are doing at this very moment. Now every time someone spits, burps, or farts (or talks about spitting, burping, or farting), I am thinking about some of the crazy stuff I've picked up from this brilliant piece of nonfiction. Richie Partington, MLISRichie's Picks http://richiespicks.comBudNotBuddy@aol.comModerator http://groups.yahoo.com/group/middle_... http://slisweb.sjsu.edu/people/facult..."
191,0393348741,http://goodreads.com/user/show/70632050-robin-tobin-on-the-back-porch-reading,5,No one is better at non fiction topics than Mary Roach.
192,0393348741,http://goodreads.com/user/show/5909620-chelsea,4,All of Roach's books have been interesting!
193,0393348741,http://goodreads.com/user/show/38036772-annie,4,"The last Roach novel I had yet to read- my knowledge of her oeuvre is complete. It’s a pretty classic Roach- interesting, with endlessly fun trivia and Roach’s trademark nonstop hilarity. I wouldn’t say this is her best, but it doesn’t flop like Spook did, by any means. Somewhere in the tidy middle. It was certainly the cause of numerous barks of laughter."
194,0393348741,http://goodreads.com/user/show/4310312-cloak88,4,"What goes in must come out....Mary Roach investigates everything about digestion. From the mouth and chewing to the very end with the anus and going passing gass. She gives a humorous overview of past and present scientific interests in our digestive track. What people thought it was, what it does, what goes right, what we do wrong and how science has done about it.Don't eat while reading this, but it is interesting!"
195,0393348741,http://goodreads.com/user/show/6449756-sonja-arlow,4,"4 ½ starsI absolutely love this author’s inquisitive mind, writing style, humour and the subject matters she chooses. My favourite is still Stiff: The Curious Lives of Human Cadavers but this one is a close second. It had me bursting out laughing even with the high yuk factor of the content.In typical Mary Roach style:“No engineer could design something as multifunctional and fine-tuned as an anus. To call someone an asshole is really bragging him up.”She dives into the subject at hand discussing topics ranging from what makes pet food (and ours) irresistible to Fido to ""taboo"" topics as intestinal gas and our bowel habits. We read about the dangers of prisoners secreting contraband in their stomachs or up their bottoms. It also looks at the digestive systems of competitive eaters and we even learn why Elvis died, and yep it was on the toilet. And these are not even the ""odd"" sections of the book. That’s reserved for discussing where the myth of fire breathing dragons come from (they are basically gassy snakes), what morning breath really is, why rabbits and rats eat their own droppings and things I never wanted to know, ie the anal violin. Take it from me, don’t eat while reading this :-)The only criticism I have is that with an Kindle the footnotes at the end of each chapter becomes a bit confusing as you cannot easily just flip back pages to see what she is referring to.This book will not be to everyone’s taste (excuse the slight pun) but I loved it!"
196,0393348741,http://goodreads.com/user/show/2596042-lisa-harmonybites,5,"This is my third Roach book, after Stiff (about corpses) and Packing for Mars (on space exploration). This one is about the digestive tract. Yes, really. All the books I've read by her are very entertaining and had me smiling throughout--though this was the first one (on page 229) that made me laugh out loud--a rare distinction and why this one is getting that fifth star. Roach dares to ask all the questions you wish you thought of--or wished you weren't too squeamish to ask. She'll tell you in this one all about the science of poop, farts, spit and more. Her last chapter is called ""The Ick Factor."" She says in her introduction she wants the reader ""to say 'I thought this would be gross, but its really interesting.' Okay, and maybe a little gross."" Mission accomplished.Along the way though you do learn a lot of esoterica, and some useful medical facts, too. Such as the basic tastes are sweet, bitter, salty, sour--and umami (brothy). I thought it was only the first four. Did you know that ""catfish are basically swimming tongues""? That Sudanese use a condiment of fermented cow dung? That""laundry detergent is essentially a digestive tract in a box?"" That an effective medical treatment is to introduce useful microorganisms by transplanting them using another's feces? Roach also takes a shot at debunking food fads such as probiotic foods, gluten-free and the fetish for fiber. (Good luck on that--food myths are immortal.) Definitely a great read--just not while you're eating."
197,0393348741,http://goodreads.com/user/show/1180982-jennifer,5,"It isn't any secret that I love Mary Roach, and here's why - you know how you will be thinking about something, and then whatever that thought is leads you to something else, and so on and so forth, and pretty soon you are on a completely different subject in your own head? That's how Mary writes - which sounds like it might not be good but in truth is awesome because you aren't left with those ""I wonder about ..."" questions. She can anticipate what one subject will make you think of next. It's like the squirrel in your head who bounces from subject to subject and keeps you from ever getting bored wrote a book :)All that said, this is just another great, funny, sciency book. Kind of gross in places, fascinating throughout, and funny enough to make you laugh out loud and annoy those around you. Wacky but really interesting information about the digestive system, human and otherwise. Very recommended.*We are large, mobile vessels of the very substances we find most repulsive.*"
198,0393348741,http://goodreads.com/user/show/1628041-book-concierge,3,"Audio book narrated by Emily Woo Zeller3.5*** Science writer Mary Roach tackles the human digestive system in this work of nonfiction. Starting with the nose (Chapter title: Tasting Has Little To Do With Taste) and ending with, well, the “output,” Roach entertains and informs as she reports on various scientific studies, in some cases interviewing the researcher, and/or participating a re-creation of the study. There’s definitely an “ick” factor in this subject matter, but Roach manages to give vivid descriptions without (for the most part) completely turning the reader’s stomach. I listened to the audio version, capably narrated by Emily Woo Zeller. She reads with enthusiasm, which increased my interest in the material. I think she must have been smiling through much of the narrative because she sounded so “happy” (if one can be happy about this subject). Certainly made me smile."
199,0393348741,http://goodreads.com/user/show/12620745-debbie-dj,4,"  I did not think it possible to find a book more ""off the beaten path"" than her book ""Stiff"", but this one surly is. If you read ""Stiff"", you'll have no trouble reading this book, if not, look out! Roach has a willingness to take us places others will not go with wit and extensive research. She literally takes us from one end to the other. Yes, from mouth to anus. Oh my, what a ride! I found myself having to take breaks from this book as a little goes a long way. However, this book contains a lot of useful information as well as delving into questions one only vaguely thinks of. Intriguing to say the least. Did you know Elvis died of constipation? Me neither! The ""ickiness"" factor aside, this is an amazing read."
200,0393348741,http://goodreads.com/user/show/2205083-bryce,4,"Reread Review 2018Still so good... and gross. Original Review 2014While reading this book, I was constantly, impatiently waiting for people to ask about what I was reading. ""The taste of cat food"" or ""the self-regulating acidity of the stomach"" or simply ""farts"" were such fun answers to give. I trust Mary Roach to give me the weirdo facts about already weirdo subjects, to go just one step further down into the weirdo basement than you would expect. It's why I automatically buy her books when they come out and it's why her books always entertain even when the choice of subject matter isn't normally what I would consider interesting."
201,0393348741,http://goodreads.com/user/show/8460201-karen,4,"Mary Roach simply owns this space of ""highly accessible non-fiction about taboo-ish 'sciency' subjects told in plain English in an engaging and humorous way"". It is quite a genre to own ;)This is my second book of hers (the first I read was Stiff: The Curious Lives of Human Cadavers) and I just love them. I learn SO much and I find the subject matter endlessly fascinating. SO much more entertaining to read Roach's work than a bunch of textbooks and papers.Can't wait to read another."
202,0393348741,http://goodreads.com/user/show/2450538-louise,3,"An interesting and sometimes disgusting look at what goes on in the digestive tract from the mouth all the way down to the anus. What's that? You're disturbed by my using the word 'anus'? Then this book is not for you because it gets a lot worse than that.I would have rated this higher, but I got tired of Mary Roach's asides and unnecessary footnotes. Some of those footnotes just seemed to explain her jokes, which made the not-funny ones venture into painful territory. Roach is a great pop-sci writer, but not a very good comedian."
203,0393348741,http://goodreads.com/user/show/7288965-manray9,3,"Who knew gut flora could be so interesting? Mary Roach's Gulp is an engaging layman's look at the myriad scientific and cultural facets of the human alimentary system from input (eating) to output (defecation). Roach's only shortcomings, probably due to attempts to appeal to a popular science audience, are the occasional lapses into being a little too cute. I give it a strong Three Stars. "
204,0393348741,http://goodreads.com/user/show/11312848-margaret,4,"I waited to review this because at first I was amused by it, but thought Roach was being a little too cute. In the week-ish since I finished, I find myself thinking about it all the time. In yoga, I'll think, ""Is this my mula banda, or am I holding in a fart right now? Could a fecal transplant change my life?"" That's at least a four-star haunting right there."
205,0393348741,http://goodreads.com/user/show/24377699-cheese,2,"Couldn't finish it. I thought this was a book about nutrtion, but it's more of a disgustingly graphic look into what Humans eat."
206,0393348741,http://goodreads.com/user/show/5639554-heather-r,4,"Really it's a 5-star book, but I took a star off for stomach-churning details. Although now I know how that whole system works!"
207,0393348741,http://goodreads.com/user/show/22299570-kaytee-cobb,4,"Exactly my kind of non-fiction read: smart and funny and irreverent, with a healthy sprinkling of swear words. Warning: do not listen to this one while eating."
208,0393348741,http://goodreads.com/user/show/2109885-literary-ames-against-gr-censorship,4,"Dear Elvis Presley,I'm so sorry for laughing and judging you based on how I believed you'd died. Living with Hirschsprung's disease had to be awful, always worrying, always in discomfort. People assuming you were fat when the distended abdomen was a sign you were seriously ill. Begging your forgiveness,AmyAt autopsy, his colon was ""two to three times normal size ... was jam-packed [length-wise]... The impaction had the consistency of clay and seemed to defy Florendo's efforts with the scissors to cut it out."" The clayey material, he says, was barium, administered to prep Presley for a set of X-rays - taken four months earlier. ""That barium was... Just like a rock."" He says the impaction obstructed at least 50 to 60 percent of the diameter of Presley's colon ... [It] had expanded so dramatically [at the end of his career] that it crowded his diaphragm and had begun to compromise his breathing and singing.' Soiling himself on stage happened regularly, he had no control whatsoever because of the disease. 'The resulting arrhythmia [from straining to make a bowel movement] can be fatal ... especially likely to happen to someone, like Elvis, with a compromised heart.' It's a common cause of death but wasn't well-known or understood at the time of Presley's death. 'Stool softeners are administered as a matter of course on coronary-care wards.'______________________________________Nasal regurgitation. Fistulated stomachs. Rectal feeding. Holy water enemas. Mythbusting Mary Roach concentrates on the strange, the unethical, and the downright funny aspects of the alimentary canal.I've learned many things:✺ Eat more liver. Organs are the most nutritious parts of an animal.✺ Never take alka seltzer / bicarbonate of soda / baking soda after eating too much.✺ Never light a match or breathe without apparatus near a manure pit.✺ Never punch someone in the mouth unless I'm willing to lose a finger.✺ Anal cancer exists and is contracted the same way as cervical cancer.✺ A human cannot survive being swallowed by a large fish. Jonah lied.✺ Fire-breathing dragons snakes are possible under the right conditions.✺'Humans perceive five tastes - sweet, bitter, salty, sour, and umami (brothy) - and an almost infinite number of smells. Eighty to ninety percent of the sensory experience is olfaction [smell].✺ Never take the ability to smell, taste, or swallow for granted.✺ 'brachioproctic eroticism' = 'fist-fucking' ✺ To respect the ""prison wallet"" (rectum). When I need to go, I'm going. I don't want to be constipated.✺ Never insert an object rectally unless I'm will to lose it up in there.

 That's an eel eating it's way through this guy's colon after rectal insertion.Well, Roach has covered the three basics of animal biology: feeding, sex, and death. Her witty approach to her subject matter helps the medicine go down, as it were. She makes learning fun by breaking things down into easily digestible bites (puns intended), though there are a few less interesting bits. I wonder what she'll cover next. *Many thanks to the publisher for the e-ARC in return for an honest review."
209,0393348741,http://goodreads.com/user/show/81608379-clarence-reed,3,"ReedIII Quick Review: Mary Roach's lighthearted style presents facts in an entertaining way. If you are interested in the topic, Roach's books offer a fun way to get obscure facts. This topic “the alimentary canal” can be a bit gross at times."
210,0393348741,http://goodreads.com/user/show/18695911-daniel-chaikin,4,"Gulp is Roach's 5th major non-fiction book and I think that colors a lot of its character. It feels very casual, and to a large extent Roach is simply having fun in her own way. She follows the topics that interest her, the ones that lead to some of the oddest places. That means as a reader you will be entertained (a word that has a one-off shade of meaning here), but if it changes your life in anyway, its purely accidental. You won't come away with a feeling that you now know the digestive system. Instead you'll feel terrible for Elvis Presley, fascinated and disgusted and slightly impressed by the culture smuggling up there in prison, and you might pause for a second when she slightly modifies the advice of 8 glasses of water day with ""but not all at once.""The book has a loose structure, from one end of digestive tract to the other, but mainly this is a collection of essays on specific odd digestive trivia. That makes it perfect for background audio on my daily commute, and I'll continue to seek out her other books.The reader gets mixed grades*. She reads mostly fine, but she struggles with voices and then compensates for this by doing a lot of voices. (note to narrators of nonfiction - every person quoted doesn't need to be given a unique voice, especially not a strange one that likely has no connection to the voice of the real person quoted.)*Emily Woo Zeller won an ""AudioFile Earphones Award"" for Gulp. So, take my criticism with that in mind.-----------------------------------------------68. Gulp: Adventures On the Alimentary Canal (audio) by Mary Roachreader: Emily Woo Zellerpublished: 2013format: 8:21 digital audio acquired: library listened: Nov 7-16rating: 3½"
211,0393348741,http://goodreads.com/user/show/773729-kelly,5,"Fascinating book...there are a few chapters that may be hard for the faint of heart. There were a few things that turned my stomach (only a handful of pages total), but for the most part I was mesmerized by all I was learning about the Digestive Tract. How come competitive eaters stomachs don't burst? Did you know a person who has lost their sense of taste and smell could starve to death? How do prisoners sneak things like cell phones and tobacco into prison? Did you know saliva has antiseptic qualities? This book starts with our sense of smell and the mouth and follows the digestive tract all the way through elimination. I took so many notes (on great facts and hilarious quotes) that if I expounded on them I'd probably need to publish a book on this book ;-) If you haven't read anything by Mary Roach I have to tell you reading her books is a treat. She is irreverent at times but her total grasp of all the details pertaining to her subject, play on words, wit (including Monty Python references), impeccable research and hilarious footnotes keep you smiling. One of my favorite footnotes was in reference to asking an ad man how he got people to be in an advertising photo for an anti-gas pill. He laughed and said they didn't - they had to use stock photos because no one wants to be in those types of ads. So here is my favorite footnote:""Back in the 1980s when everyone looked a bit off, my friend Tim and his brothers had some publicity photos taken of their band. Eventually they sold the rights to a stock photo agency. Years later, one of the images turned up on a greeting card. The inside said, ""Greetings from the Dork Club."""
212,0393348741,http://goodreads.com/user/show/5448792-b-schrodinger,4,"Mary Roach has written yet another winner here. Her early books ""Bonk"" and ""Spook"" were a little flat and derivattive, but ever since then she has delivered.Yes, she chooses deliberately risque subjects and yes there is always a chapter on farts, but damn she can make things interesting. It seems she can make the fine balance of making a scientist such as myself happy, while also placating my inner 8-year-old. And really, all she is doing by telling us how artificial farts are made, and the size of Elvis' colon is saving us time; I know I'd be looking up articles to see if anyone has gas chromatographed a fart after reading this. Mary has already done the Not Safe For Work googling for us.Mary's books are great for everyone. You do not have to be a scientist to enjoy them, and you do not need to be an 8-year-old boy either. If you are a bit squemish and delicate about bodily functions, read this, get over yourself and enjoy the wonderful piece of biology that you occupy. So everyone, get out there and read some Mary Roach. You'll laugh, learn, be amazed and there'll be plenty of WTFs. May we have many more wonderful Mary Roach adventures!"
