,isbn,user_link,ranking,review
52,0735214484,http://goodreads.com/user/show/5686119-book,4,"Range: Why Generalists Triumph in a Specialized World by David J. Epstein“Range” is a provocative look at the misconception that specialization and head starts are the sole source for success. Best-selling author David J. Epstein takes the reader on a journey of what it takes to succeed in a world obsessed with specialization. This stimulating 351-page book includes the following twelve chapters: 1. The Cult of the Head Start, 2. How the Wicked World Was Made, 3. When Less of the Same Is More, 4. Learning, Fast and Slow, 5. Thinking Outside Experience, 6. The Trouble with Too Much Grit, 7. Flirting with Your Possible Selves, 8. The Outsider Advantage, 9. Lateral Thinking with Withered Technology, 10. Fooled by Expertise, 11. Learning to Drop Your Familiar Tools, and 12. Deliberate Amateurs.Positives:1.	A well-written, well-researched book. Epstein has a gift of maintaining the reader’s interest.2.	A fascinating topic, why generalists succeed in a specialized world.3.	This is a fun book to read. Epstein is a gifted author that knows how to keep the reader’s interest via a combination of interesting facts and stories.4.	Plenty of studies and facts to support the author’s main arguments. “One study showed that early career specializers jumped out to an earnings lead after college, but that later specializers made up for the head start by finding work that better fit their skills and personalities.”5.	Create cognitive dissonance but in a good way. 6.	Debunks the myth that one requires a good head start to succeed. “Our greatest strength is the exact opposite of narrow specialization. It is the ability to integrate broadly.”7.	Addresses key issues in today’s society. “Flynn’s conclusion: “There is no sign that any department attempts to develop [anything] other than narrow critical competence.””8.	The paths to excellence. “The psychologists highlighted the variety of paths to excellence, but the most common was a sampling period, often lightly structured with some lessons and a breadth of instruments and activities, followed only later by a narrowing of focus, increased structure, and an explosion of practice volume.”9.	Keys bits of educational information. “Excessive hint-giving, like in the eighth-grade math classroom, does the opposite; it bolsters immediate performance, but undermines progress in the long run.”10.	Interesting concepts. ““Match quality” is a term economists use to describe the degree of fit between the work someone does and who they are—their abilities and proclivities.”11.	What conmen know. “Writer, psychology PhD, and professional poker player Maria Konnikova explained in her book The Confidence Game how the sunk cost mindset is so deeply entrenched that conmen know to begin by asking their marks for several small favors or investments before progressing to large asks.”12.	The impact of ageing. “Adults tend to become more agreeable, more conscientious, more emotionally stable, and less neurotic with age, but less open to experience. In middle age, adults grow more consistent and cautious and less curious, open-minded, and inventive.”13.	Philosophy to live by. “We learn who we are in practice, not in theory.”14.	Interesting look at innovations. “Big innovation most often happens when an outsider who may be far away from the surface of the problem reframes the problem in a way that unlocks the solution.”15.	Key conclusions. “Where length of experience did not differentiate creators, breadth of experience did. Broad genre experience made creators better on average and more likely to innovate.”16.	Forecasting. “The average expert was a horrific forecaster. Their areas of specialty, years of experience, academic degrees, and even (for some) access to classified information made no difference.” “A hallmark of interactions on the best teams is what psychologist Jonathan Baron termed “active open-mindedness.” The best forecasters view their own ideas as hypotheses in need of testing. Their aim is not to convince their teammates of their own expertise, but to encourage their teammates to help them falsify their own notions. In the sweep of humanity, that is not normal.”17.	The key to healthy organizations. “So when Geveden became CEO, he wrote a short memo on his expectations for teamwork. “I told them I expect disagreement with my decisions at the time we’re trying to make decisions, and that’s a sign of organizational health,” he told me.”18.	The power of cross knowledge. “To recap: work that builds bridges between disparate pieces of knowledge is less likely to be funded, less likely to appear in famous journals, more likely to be ignored upon publication, and then more likely in the long run to be a smash hit in the library of human knowledge.”19.	A key point of advice. “Compare yourself to yourself yesterday, not to younger people who aren’t you. Everyone progresses at a different rate, so don’t let anyone else make you feel behind.”20.	Notes included. Negatives:1.	Repetitive.2.	No formal bibliography. 3.	At the end of the day, this is not hard science. 4.	It’s hard to top his previous book, “The Sports Gene”.In summary, Epstein provides compelling arguments that support his main argument that in most fields generalists are more likely to succeed than specialists. He crosses many domains to support his main theme and does so while keeping the reader enthralled. It’s a lot of fun to read. I recommend it!Further recommendations: “The Sports Gene” by the same author, “Outliers” and “The Tipping Point” by Malcolm Gladwell, “Quiet” by Susan Cain, “Thinking Fast and Slow” by Daniel Kahneman, “Grit: The Power of Passion and Perseverance” by Angela Duckworth, “The Power of Habit” by Charles Duhigg, “Originals: How Non-Conformists Move the World” by Adam Grant, “Drive” by Daniel H. Pink and “Atomic Habits” by James Clear."
53,0735214484,http://goodreads.com/user/show/2166820-kim,4,"Slightly different form of book review, but bear with me . . .When I was a freshman in college, some unknown force took me out of my comfort zone to an ice rink for a work study job. I signed up for the women's club hockey team and learned how to drive a zamboni. By the time I was a senior, my mother criticized me for not have worked at a law firm or doing other ""relevant"" work to being a lawyer. While I felt that I had learned so much from my experiences on the ice, all of a sudden that comment made me feel behind.When I began law school, I was surprised to learn that there was no pursuit of ""specialty"" while attending school, and that in fact your entire first year of classes was completely planned out for you. But then the minute you graduate and enter the world of working in law firms, almost immediately, by default to where you land your first job and who you work for, you end up in an area of specialization, likely to stay there your entire career. As a result of law school, I felt that the firm life for me was a not a quality match. Unlike most of my classmates, I ended up working almost immediately as an in house counsel and very little of my work involved in depth pursuit of any areas of the law, including business. And for years, I felt behind.While I never pursued the traditional career path after of law school, I have always felt that I benefited from, as they say, learning how to think like a lawyer. The Law School Admissions Exam actually tests the taker on Analytical and Logical Reasoning (as well as reading comprehension) and law school itself denies specialization (with some exceptions). I was surprised this was not really investigated in this book, or that it was not compared as a potential resource to model a new curriculum for medical school from. Maybe in the next version . . .All in all, most of my adult life I have felt behind. And then all of a sudden . . .I didn't. I enjoy my job and all the experiences I have lived through from it. I do not regret the path I took, even though it took me a long time to understand its value and appreciate it. And now, after reading this book, I feel both vindicated and encouraged to experience new things, expand my reading base (and not feel an ounce of guilt for all the fiction fare!) and meet new people. "
54,0735214484,http://goodreads.com/user/show/12086858-yousif-al-zeera,4,"This book is crucial as it seriously challenges the assumption of ""specialization"". While specialization works well in ""kind"" environments, it usually falls short when it comes to ""wicked"" environments which mostly the case in most domains. ""Well-rounded"" individuals by virtue of their ability to connect things between interdisciplinary areas are in better shape to further progress sciences and technologies. "
55,0735214484,http://goodreads.com/user/show/14551209-dan-connors,4," In many ways, specialists rule our world. If you find a niche or specialty, you've got it made. But can you take this to extremes? Can you create a chess champion by training a child from birth in chess maneuvers and little else? When does specialization work best and when do generalists shine? These important questions are looked at in David Epstein's book.  Epstein looks at the cult of the head start, which in some ways has given certain children a decided advantage in school, sports, and social situations. Starting them early and fast in certain disciplines, like a tiger mom pushing her cubs, places them above other kids temporarily. But the author says that many times the other kids eventually catch up, and given their better read on what they're capable of and what the world has to offer, eventually pass up the early achievers.  The world is broken into two types of experiences that we have to navigate. Kind ones like math, chess, and golf, play by certain rules that the more you practice the better you get. In those environments specialization takes advantage of the predictable nature of the game and maximizes results. Unfortunately, most of the world is the other type of experience- wicked. In wicked environments things are decidedly unpredictable, and what worked yesterday could be useless today. In these situations prior practice not only doesn't help, it hurts because people fall back on earlier patterns, wasting precious time before figuring out a new approach is needed. Here is where the generalists shine, because they can use their more varied experiences to synthesize new approaches.  Epstein draws from real examples of successful musicians, athletes, and artists who went through what he called a ""sampling period."" Rather than dive right in from childhood, the sampling period allows people to try their hand at a variety of activities before finally settling in on one thing. This is basically the idea behind liberal arts education, where general information about the world is pumped into ALL students so that specialists have more tools in their tool belts once they start working on problems.  The book spends a refreshing chapter on failure, changing your mind, and grit. Failing is not necessarily bad. Too many stay in bad situations rather than admit they made a mistake and discard all the training and investment they had in getting there (sunk cost fallacy). Long term goals always have to be adjusted as we grow and the world changes. Switching can be good and those that do it report it was one of the best things they ever did. There is no failure if you use the lessons from it to move forward.  The author talks about something called Innocentive, where outsiders are given problems that have stumped specialists. Their fresh viewpoint sometimes comes up with the perfect solution. This is basically the argument for diversity everywhere all the time. When you lose diversity, you narrow your options for finding the best solutions.  Specialization can fool you into thinking you know everything. You know a lot about one situation, but your brain is unaware of what else might be out there that's unexpected. This is how we got the 2008 financial crash, the Iraq war, and many other blunders. The Dunning Kruger effect has been profiled many places, and it states that people who know just a little about something can get overconfident because they don't know what else is out there. The author goes into Phillip Tetlock's research on prediction, and how specialists and experts were no better at predicting the future than anyone else in his famous study.  So what can be done about this problem? Because so much time and money is spent on creating specialists, we will always tend to listen to them, even when they might be wrong. In arenas that might be considered complex, unpredictable and wicked, we need to rely more on generalists. Generalists can pull from their varied experience and create new solutions that are unique and powerful. Specialists need to be challenged to think outside the box and not be afraid to drop their assumptions to focus on a better solution when necessary. The author tells the tragic story of firefighters who refused to drop their tool when faced with a rapidly approaching firestorm. Those that did, survived, but those that didn't were too slow to escape.   This was an enjoyable and informative book. It was thought-provoking and made me want to expand my horizons even more. None of us is capable of seeing every possibility, but diversity, variety, and creativity will help us when the unexpected happens."
56,0735214484,http://goodreads.com/user/show/59833287-erik-rostad,4,"Overall, some helpful and insightful ideas. Some of the examples were a bit long, but perhaps I’ll remember them better that way. One of those books where you might intuitively know about his conclusions, but it’s nice to see some reasoning behind them."
57,0735214484,http://goodreads.com/user/show/3677821-pete,4,"Range : Why Generalists Triumph in a Specialized World (2019) by David Epstein is an interesting book about the value of not being overly specialised and focused on one thing.The book starts by pointing out how Tiger Woods took up golf at an early age and how this example is picked by many as an example of how mastery of a subject needs to be done. Epstein compares this to Roger Federer who played many sports before focusing on tennis. Epstein states, with some evidence, that stars like Federer are more common than stars like Woods.Range then looks at how some tasks like chess, that have great feedback and that are well defined can be suited to specialising and diving deep into one thing. However a lot of what we value highly, like creating new companies, scientific breakthroughs, writing interesting new books and management is more 'wicked' in nature with immediate feedback being poor and requiring synthesizing knowledge for a myriad of sources.There are interesting digressions into the world of music where it's shown that many top musicians played multiple instruments with great skill and moved skills from one area to another and found new insights doing so.Epstein also talks to a number of scientists, academics, managers and people in many other roles who have had careers that moved from one area to another and he points out that this often benefited them greatly.Range is a well written, interesting book that makes its points with style. Epstein makes a strong case for trying lots of things and deliberately trying to widen our horizons. The book is also filled with interesting stories about people in many different fields. Range is well worth a read. "
58,0735214484,http://goodreads.com/user/show/5742005-siddhartha-kumar,3,"Find this review - and some more - on my website here.---------------------------------------------Started with a tightly-knit structure, but faltered at the end. The last few chapters were a slog to get through - mostly because of numerous ""business-class"" style case studies. Main takeaway? Other than the central idea around which the book revolves (and succinctly mentioned as the book subtitle too), the idea of interleaving is what struck me the most. I had already read about this particular method in Michael Nielsen's brilliant post on Anki (Augmenting Long-term Memory) and it was interesting to read about it formally in the book. Interleaving is the technique of mixing up your learning in varied environments so that it makes some unusual connections that you'd normally won't think about - and might come in handy when you are faced with a problem in a new environment you haven't previously encountered.In the end, ""Range"" suffers from the same deficiencies that a lot of other pop-psychology/self-management books suffer from - too many anecdotal evidence and case studies. A reviewer here on Goodreads summed it the best - ""Finally, Range is designed to appeal to people who are already skeptical of specialization/ enthusiastic about generalized skillsets. I worry that some of the appreciation of this book is just a soothing exercise in confirmation bias for generalists.""Still, I'd recommend it to people who (like me) are skeptical about their tendency to dabble in too many disparate fields at the same time - this might be the soothing pill that you were looking for."
59,0735214484,http://goodreads.com/user/show/51329997-christina,4,"Though the underlying hypothesis around the value of generalist experience is actually rather intuitive, I found ""Range"" to be an articulate and novel contribution to the conversation around the methodologies of success that isn't particularly prevalent today. The book does read like a very standard nonfiction book: ""hook, thesis, case study/anecdote, case study/anecdote (x100), thesis"", and the examples run on a bit longer than they need to, and sometimes don't necessarily have particularly unique messaging in each. But a lot of Epstein's messages ultimately resonate with my own life philosophies, and were helpful for some of my own thinking about my career and interests. My favorite takeaway, one that spans my views around work, relationships, friends and life in general is this: ""Start the proactive pursuit for match quality"" - and be generous to yourself in the time needed to find that match. ""Range"" is a fun read for noodlings - I recommend!A couple of my favourite quotes below: ""Our work and life preferences do not stay the same because we do not stay the same.""""You have to carry a big basket to bring something home.""""Good judges are good belief updaters.""""The best forecasters view their own ideas as hypotheses in need of testing.""""The process culminated with more concern for being able to defend a decision than with using all available tools to make the right one.""[Being ""outcome accountable""]""Compare yourself to yourself yesterday, not to younger people who aren't you.""""You probably don't even know exactly where you are going - so feeling behind doesn't help."""
60,0735214484,http://goodreads.com/user/show/1925924-catriona,5,"Experience is never wasted I found this riveting in all the best ways non-fiction can be: extremely readable, endlessly fascinating, thought provoking, leaves a lasting impression and you see the world a little differently on the other side of it - things once in darkness are illuminated. Personally, Epstein made me feel comforted that all was not lost if i hadn't completed my 10,000 hours in a highly specified domain by now and that a gradual whittling of specialism, rather than a laser focus from an early age, can be just as (if not more) likely to work to your benefit in the long run. Our world is more complicated than ever, full of ever changing and nuanced problems where analogies from other domains can help us tackle problems in novel ways (treating tumours with ancient military strategy anyone?) that can lead to greater, faster leaps in understanding and measurable progress. Epstein argues that those who haven't narrowed their experiences prematurely will provide the biggest benefit to the modern world around them, at least in terms of creative and complicated problem solving. Should the urban legend that is the 10,000 hours to greatness, finally be put to bed? Does rigid repetition of procedure make us less likely to be successful in a unfamiliar situation? I'm not sure who is right, or who is right for me - but i do know i am as inspired after reading Range as i was with Gladwell's Outliers and i reckon it deserves the same level of curiosity to be applied to it."
61,0735214484,http://goodreads.com/user/show/61808093-alexander-rivas,4,"I am so grateful this book was written because I feel that I fall in line with the thesis of how some people achieve more when they have a wide range of interests they pursue. I always battled with the 10,000-hour theory because I am the type of person that is always starting and stopping interests I have. A specific example would be the way I read books. I don't just read a certain type of books, I read all types of books, which in my opinion helps me read more and increase my joy for reading as well. That is why reading case study after case study in this book of people that don't ascribe to the 10,000-hour rule but still achieve massive success was important for me. I no longer feel bad that I don't stick to something until I master it because that path is not for everyone. It is very rare that there is only one path to anything and I think being a professional or achieving success has many paths. I have the bias of being someone that would benefit for this book and can see why others who believe in deliberate practice repeated until perfected would not agree with this book. It is always good to be aware of all the paths that why you can make a conscious decision on how you will approach your journey to success. "
