,isbn,user_link,ranking,review
40,0300136595,http://goodreads.com/user/show/17091230-liz-genik,4,"I'm not a big fan of informative books because usually they are not quite as intresting as novels, but i was nicely surprised by this book. would recommend for people who love random facts / science."
41,0300136595,http://goodreads.com/user/show/15560373-elliot-chalom,2,"I went into this book with very high expectations, having loved A Little History of Philosophy. Nigel Warburton's philosophy book, from the same series, was a terrific launching point before the more daunting task of reading Wittgenstein, Voltaire, etc. which I've now been doing for several months. The goal was for Bynum's science book to act as a similar introduction to ""science"" as a genre, providing a post-high school level base from which to read more. I also hoped it would do what ""Philosophy"" did and provide a taste of different scientific sub-topics so that I know where I would like to explore further. To use a scientific term, this book should have been a catalyst.So why is it mostly a failure?1. As one Goodreads reviewer noted, it's written at about a Grade 6 level, even though it isn't marketed or shelved that way. Yes, the book actually defined the word ""catalyst."" That's a bit elementary.2. The organization is terrible. The chapters are generally ordered chronologically. Does anyone think or write about science, as a broad topic, chronologically? The most obvious way to organize this book would have been by sub-topic - a section on theories of the origin/development of species/man, a section on space, etc. - though other forms of organization may have made sense as well. (I can't even think of the right sub-topics to list after reading this book. That should say it all.)3. We get it - science is wonderful. It;'s the most wonderful thing that has even been or ever will be. Bynum doesn't need to hammer that home in a sunshine and roses way every chapter.I learned a few things so I can't go as low as one star. But I would highly recommend that anyone looking for a framework from which to start learning more about science (anyone like me, who didn't study it in college or beyond) pick up another book."
42,0300136595,http://goodreads.com/user/show/25898891-r-k,5,"There are very few books that are able to truly enrapture a vast audience with a complex subject and leave them a more learned group. William Bynum is a proficient story teller with his ability to educate the public including those in the science community on the history of science. He covers a vast majority of science topics and gives a nice illustration to the reader of how science has evolved from its predecessors such as Aristotle to present day scientist. He also shows the consistent strain science had, for the most part of its life, with religion. An issue that although may not be as strong today as it was centuries ago, still persists. Each chapter talks about a new scientific advancement and the people responsible for their discovery. Being a member of the science community Being a member of the science community and having a passion for knowledge, I was enthralled by this book. It kept me entertained with its comedic moments and gave me more background on the various subjects of science that are often taught in schools today. Speaking of which, I would highly recommend students, teachers, and other knowledge pursuers to read this book. This book in general is for everyone of all backgrounds but upon reading topics such as Newton's Laws and the discovery of the atom I felt that this little book was able to effectively educate me on how these laws/discoveries came to be. I ended up understanding and enjoying more from this book than 4+ years of textbook reading. It got the message across simply and effectively which is needed in our fast paced world. This book is a must have for all because the more educated the public is in science the better we can make our present and future Earth."
43,0300136595,http://goodreads.com/user/show/34988305-fabio,5,"A little History of Science 	This is a book for you if you love science. It explains the history of science, from philosophers to the elements, introductions to DNA, physics and so many other important discoveries. One scientist was Aristotle who spent his life learning and teaching and explained a lot of wonders in his notebook. One example from his notes is the observation that a the concept of 0 did not exist. Therefore there was no 10 instead there would be X (used as the roman 10). One aspect of science is that it is almost everywhere. Think about it, it took science to create computers and other devices that we use everyday (sometimes too often). The book also describes the history of science related terms. For example, debugging (in the olden days) actually meant cleaning out the computer because moths and flies could be short circuiting the tubes used in early computers.The book concludes with the theory of the big bang (also known as the theory of everything) which happened about 13.8 billion years ago. Gamow, a Russian scientist, developed the concept of the big bang and that the universe is infinite but couldn't prove his theory. Other theories of the big bang were developed by Penrose and Hawking. They discussed the idea of a dark star/black hole and that one may have started the big bang. Overall the big bang theory has a lot of controversy and it may take many years to prove.“A little History of Science” is one of my favorite books because it explains so many things about science and keeps you wondering about the future. "
44,0300136595,http://goodreads.com/user/show/19650910-ira-noviani,4,"The book provides a decent summary of the science history in less than 300 pages. It strengthens the points that the science is evolving, and while it was not perfect in the beginning, it gets better subsequently with thousands of scientists improve and expand the work of their predecessors. It also capture the influence of one discovery and development of one field to lead to another discover and improvement of another. One of such example would be the advancement in lens to benefit the astronomy and biology subjects.However, there is a part of my own self that think this book is a bit biased towards the general view that Asian countries do not really make significant contribution throughout the long line of the science journey (apart from being an enabler with the invention of paper and math). The majority of its story discussed the science from the very angle of Anglo-Saxon point of view which I beg to differ. There seems to be some inventions and discoveries from the Asian countries being left out from the book and I wonder if that is due to language barrier that prevents the authors to dig deeper to the East side. A quick search on Google presented a list on Wikipedia of the Asian contribution. https://en.m.wikipedia.org/wiki/Scien..."
45,0300136595,http://goodreads.com/user/show/2947269-truthnwisdom,4,"It seemed only natural after reading A Little History of Philosophy and A Little History of the World that I should read A Little History of Science. I picked up the book at the bookstore in the airport, another impulsive purchase when one loiters at the transit area, awaiting for flight.I rather enjoyed it as the snippets of facts are easy to digest and at times interesting. Issac Newton, for instance, was a titan in his contributions towards the progress of mankind but did not have a pleasant disposition. After reading the bits about the Babylonians and astronomy and how horoscopes came about, I decided it is not worth my while anymore to read my daily horoscope and to find the one based on horoscope compatibility. Interestingly, my company had recently hosted an event with the British High Commissioner in Singapore to commemorate the 100th anniversary of Wallace’s death and his contribution. Ironically, when I came to the chapter on Darwin, there were only a couple of lines on Alfred Russel Wallace and his influence on Darwin. An easy to read book for this era when we are competing with the Internet for readers' attention. "
46,0300136595,http://goodreads.com/user/show/14633278-shonna-froebel,5,"This book consists of short chapters (around 6 pages each) taking us from the beginnings of science to the present. Bynum shows how science and religion often went together in the past, with the first people doing science being priests. He shows that science can be both simple observation and complex laboratory work or complicated formulas. He shows the development over time and how each new advance built on work done earlier. The writing assumes no prior knowledge of the different aspects of science, with all technical terms explained in words even a child can understand. Bynum makes science both interesting and approachable and shows how science has influenced humans and the world we live in over time. From astronomy to zoology, chemistry to physics, medicine to technology, genetics to geology, he shows the progress over time and the interrelationships between different branches of science. A great introduction to the subject that leaves the reader with many avenues for future investigation."
47,0300136595,http://goodreads.com/user/show/2324135-michelle,4,"I won a copy of A Little History of Science from a firstreads giveaway, and I was expecting something a bit loftier and academic. Instead, W.F. Bynum has composed a short and sweet synopsis of science, focused on the greatest scientists of history. Bynum starts with ancient Chinese scholars learning to make compasses, and works his way through Plato, Newton, Darwin, Watson and Crick, Babbage, and many others.Bynum's book does for the science what Gombrich's A Little History of the World did for history. It is succinct, and plainly written so that anyone will understand the progress from discovery to discovery that science has made through the ages. Perhaps most importantly, Bynum provides historical context, and acknowledges the outdated world views held during each discovery he catalogues. This is a charming read for anyone wanting to get an idea of the history of science. It covers all fields from geology to medicine, quantum physics tp paleontology and more."
48,0300136595,http://goodreads.com/user/show/22134423-aleta,1,"This was very much an impulse buy from a year or so ago. I thought it would give this lover of math, disliker of science some shallow water to wet my feet in the sea of science in and hopefully courage to then wade further out. But alas, the water was more than shallow, it was in fact the kiddy pool. I think? As other reviewers have commented, this feels neither nor - as if Bynum himself did not know whether he was writing for adults or children. The so-called scientific history is merely a messy collection of factoids of the general knowledge (or even general ignorance) kind. I knew most of it already and even spotted an error. And this comes from someone who only read the first two chapters - the final straw being when I saw another reviewer mention several minor and major factual errors. That is inexcusable and completely defeats the purpose for which I picked up the book in the first place."
49,0300136595,http://goodreads.com/user/show/4230992-artguy,4,"All of science in one simple book. It might seem to give short shrift to all subjects, but the fact is, if you all of the material in the contents of this book-- I mean, really know it, you would be highly educated.I picked up many tidbits of information, and found large gaps in my knowledge of science. Many names come up that I have never heard a thing about, and yet I definitely should have. Should I blame my rather pathetic Catholic school science education? Well, yes, but it also showed me that I need to do more reading, more learning.This relatable book is one of those that keep you entertained while simultaneously giving knowledge that we also should have some conception of. A quality I particularly enjoy is that it is not as Euro-centric and US-centric as most of my scientific education has been."
50,0300136595,http://goodreads.com/user/show/21413615-yoni-fogelman,4,"So far, A Little History of Science provides an appreciation of science and science evolution, showing us how much we often take for granted. The book does this by providing examples from various cultures and periods throughout western and eastern history, discussing facts and putting those facts in the context of specific people and groups. For example, did you know that a group called The Atomists created the theory that atoms are the source of everything in the universe. At the time, some people in Greece believed the universe was made of only 4 elements! So far, A Little History of Science provides a kid's eye view of original scientific thought as it emerged and developed throughout history. Stay tuned...!"
51,0300136595,http://goodreads.com/user/show/1954469-ron,3,"Emeritus Professor William Bynum provides a decent, readable, popular approach to the history of science. He starts at the beginning with the ancient Babylonians and Egyptians and the concepts of counting (i.e. arithmetic), astronomy, and medicine. From there Bynum traverses the sciences in chronological order introducing individuals and concepts until he and the reader arrive at computers in our digital age. If you are looking for a readable popularization of science, this is a book for you. Unfortunately, he provides no bibliography or notes for further exploration, so a good place to start, but you need to find more on your own."
52,0300136595,http://goodreads.com/user/show/4910587-scott,4,"This is a great compact book of a little bit of the history of science. It is written mostly in layman's terms and language so you don't have to be a scientist to enjoy it. The author takes you back quite a ways in time and develops the beginning of the book well. The last part, contemporary history seems to have some huge gaps and missing major events. Even if the book were a few years old it was still lacking. It was a little too brief on the more modern aspects, but a great little introductory book into science history and how physics relates to chemistry relates to biology relates to genetics...etc."
53,0300136595,http://goodreads.com/user/show/12825901-704anna,4,"this would be more like a 3 and 1/2, but i decided to round up. overall this was a really cool book. bynum manages to fit a basic history of science into a relatively short book. however this book is not for beginners wishing to be introduced to a subject. it is better read as a follow up (after learning about the subjects of the book). this way, you already know about the topics, but are learning about the roots of the subject, which is veryvery interesting. i liked mostly and thought it was good. (overall)"
54,0300136595,http://goodreads.com/user/show/4282067-liam,4,"""'I do not believe that the ""Sacred Disease"" is any more divine or sacred than any other disease, but, on the contrary, has specific characteristics and a definite cause. Nevertheless, because it is completely different from other diseases, it has been regarded as a divine visitation by those, being only human, view it with ignorance and astonishment.'"" (quoting Hippocratic author on epilepsy, 21)""'Nature knows only the individual.'"" (quoting Buffon, 109)""'... a man of enlarged curiosity.'"" (of Darwin, 153)"
55,0300136595,http://goodreads.com/user/show/30716470-wei-ye,5,"I must say that this book is one of my favourite. The book not only contains science, but also the history of science. Science can be really boring if you pay all your attention to its formula and theory. I think what really makes science compelling is its history. Science is rather flexible, everyone can have a different perspectives towards one theory. Descartes thought that ""I think therefore I am"" and I find it really useful. It is always about the word 'think' through our learning towards science and other subjects. "
56,0300136595,http://goodreads.com/user/show/19008054-lukas-dufka,4,"A lovely primer that chronologically ties together all the major developments in history of science. Anyone reading this book will get a clear sense, if they didn't have it before, that it is our scientific advances that are chiefly responsible that history still seems to be moving forward to a better and more prosperous future. If for only that reason, it should be read at schools together with regular history textbooks, which usually focus more on battles and kings, and less on the greatly more important and beautiful scientific undercurrent of our past. "
57,0300136595,http://goodreads.com/user/show/4799772-carlos-alonso-niemeyer,1,"I think that this book should be required reading for every high school student in America.If I can remember, or recall, every one of the discoveries and inventions discussed in the book, I will consider my self a ""well educated science enthusiast"".However, the chapters were too short and a the topics were discussed only at a high level.I liked the parts that talked about electricity and lighting technology. Easy read."
58,0300136595,http://goodreads.com/user/show/1249392-mysteryfan,3,"Compressing millenia of scientific development into 250 pages is not an easy task. Bynum takes a good stab at it. He believes magic, religion, technology, and science have been the tools to understand and control the world. I would have been confused in a number of places if I hadn't already known a fair amount about the topics, so I wouldn't consider it an introductory book. Still worth reading to put developments in context."
59,0300136595,http://goodreads.com/user/show/19157406-omar-ali,3,"Ran out of audio books and found this in the library. I am about halfway through and its a nice quick canter through the history of science. Very elementary and easy to follow. Good for young people. And for old people who don't mind a quick romp through familiar territory. OK, done, and I must say it goes downhill a bit as it reaches the 20th century. Maybe the material is too extensive (and my own knowledge a bit more), but the last section is not impressive. "
60,0300136595,http://goodreads.com/user/show/32466893-sam-e,5,"I loved this book. It traced the progressions made in the scientific field through history, in a very well written way. It was a fun read that left me baffled many times as to how the ancients, with their limited tools, were able to come up with so many great scientific theories and discoveries. The work itself was written in a simple forthright manor, which made it easy to read without getting bored. If you are into this type of thing, I would recommend it without a second thought."
61,0300136595,http://goodreads.com/user/show/160042-starry,3,"It's like a science version of A Little History of the World in that it tells sweeping historical stories in the manner of a twenty-minute bedtime story for children. But it didn't work quite as well in this book for some reason. And it seemed a little cheap in that the ""double helix"" chapter is just a regurgitation of Watson's book ""DNA: The Secret of Life"" with no added insight or commentary from the author. Are the other chapters similarly knock-offs?"
62,0300136595,http://goodreads.com/user/show/55656390-esteban-mendoza,4,"I think this book summarize pretty well the history of science in a way that anyone can understand. It's recommended for people with little or no knowledge at all about science. People with understanding of the topics explained will find it boring. One thing to improve: it would have been nice to have pictures or illustrations for a few topics, you know the saying, ""a picture worth a thousand words"""
63,0300136595,http://goodreads.com/user/show/5336246-angela,2,"Bynum's book about science is ok. There is enough information to keep you interested, but not enough to make me recommend it. There were a few times in this book where I felt dropped into an existing conversation. If you come across it, pick it up. If you don't, I wouldn't go searching for it."
64,0300136595,http://goodreads.com/user/show/12315890-ellen,3,"I won this in a Goodreads First Reads giveaway...thank you Goodreads! This is a very good little review of the science we all learned in school and more. Some of the very British terms such as ""jolly good"" and ""spot-on"" made me smile a little at times, but it is a well-written, clear, and interesting book suitable for younger or older readers. I enjoyed it!"
65,0300136595,http://goodreads.com/user/show/3047128-athena,5,A Little History of Science provides an excellent introduction the history of science. I appreciated that the author did not write the book in a textbook format but as a non-fiction novel. I was caught up in the book from the beginning to the very end. I highly recommend this book to teens as well as adults who would like a refresher in the general sciences.
66,0300136595,http://goodreads.com/user/show/18569944-kelly,4,"A retelling of many of the crucial discoveries in science throughout history.Pros: Easy to read, to the point with each scientist, covers a variety of sciences, advocates for a Nobel prize in geologyCons: May be too much jumping around/jargon for those not familiar with the content. It starts in chronological order, but starts jumping around in time and subject."
67,0300136595,http://goodreads.com/user/show/9772894-jessica,4,"A highly readable history of scientific discovery from the dawn of human history to the 21st century. Broken down into manageable chapters organized by subject, Bynum explains the not only the fundamentals of each, but how they interacted with other discoveries and the relevance of advancement to our understanding of the universe as a whole. Highly recommended. "
68,0300136595,http://goodreads.com/user/show/10418576-bob,3,Audio Book - Primarily a brief biography of the great scientist in history presented chronologically beginning the Greek philosophers. Another book that could be listened to over and over even though the reading was a little dry and the material dwelled a little more on the individual and a little less on the science than I would have liked.
69,0300136595,http://goodreads.com/user/show/18760055-david,3,"This book is better the less science history you know. If you've already gone through a tertiary science education you may find you're already familiar with large parts of the book. It's still handy as a single chronological index of most important concepts. It's also quite a light read, given the topics."
70,0300136595,http://goodreads.com/user/show/18654073-mkhlahmd,4,"To compile every progress of science in every field is not that easy. To make it interesting reading material without the help of graphic content is even harder. To me, this book has it's own way of attracting readers. Good job Bynum."
71,0300136595,http://goodreads.com/user/show/327607-taffnerd,4,"What a fantastic book! Bynum covers every significant scientific discovery in clear, fun prose. It's not specifically geared towards kids but anyone over the age of 12 with an inclination towards science would find a lot to love in this book. "
72,0300136595,http://goodreads.com/user/show/565487-tuck,3,"fast paced, chock full of fun science, ranges over wide time span and scope of science thought through the ages. but also very elementary and kinda boring if one already knkows all this stuff. would be great for younger readers cept very little illustrations and index not very robust. "
73,0300136595,http://goodreads.com/user/show/5978625-aaron-wong,4,"Bynum, W. (2012). A little history of science. New Haven, CT: Yale University Press.In 1838, #ThomasMalthus wrote in his Essay on the #PrincipleofPopulation that the poor marry too early, have too many children and cannot take care of them. Times haven't changed that much then. "
74,0300136595,http://goodreads.com/user/show/2207949-puri-kencana-putri,4,"101 science book for everyone. I really like the last sentence of this book, ""We need good scientists, but we also need good citizens who will ensure that our science will make the world a better place for us to live in."""
75,0300136595,http://goodreads.com/user/show/49553254-rod-rod,2,"Allright, it gives you good notion if you, like me, are a science aficionado. Anyway, I have missed some Nicola Tesla for example, and as noted in other reviews I have read, the worshiping of science reflected in this book is sometimes, tiresome. "
76,0300136595,http://goodreads.com/user/show/34401400-stephanie-lam,5,This book is for anyone that like science. Brief summary of the history of science. Have great information to know about the history of science. Show the science evolution and how much science grow and spread. 
77,0300136595,http://goodreads.com/user/show/11446804-adam,4,"An easy read because of short focused chapters. I don't know that there was anything surprising or knew, having a science degree. But it was a good combination of many facets of science and some connections that are neat to see in the same book.I liken this to Bill Bryson's book of similar title."
78,0300136595,http://goodreads.com/user/show/20714456-nicholas,4,"A fascinating book, although it took me forever to read because my mind kept wandering and going on tangents. "
79,0300136595,http://goodreads.com/user/show/8448607-leew49,4,"Bynum's book provides a nice overview of science, aimed at the intelligent layperson, from ancient times to the world wide web. Good starting point for other reading as well as a quick, brush-up reference."
80,0300136595,http://goodreads.com/user/show/11646197-richard,0,"Very short chapters broken into specific scientific discoveries i.e. - viruses, gravity, natural selection, etc. Kinda boring, some bits of it, but I was able to plow thru it ...."
