,isbn,user_link,ranking,review
45,0393308189,http://goodreads.com/user/show/1131766-abe-something,4,"I learned quite a bit reading this book. Given some of the info is outdated, some of it theoretical, and some of it is of little value to me - the beauty of this collection is the voice. Stephen Jay Gould is the Carl Sagan of Natural History. Do people call him that? They should if they aren't. I was familiar with Gould on account my taking some Anthropology 101's in undergrad about 10 years ago. I had always kept him on my list of ""accessible, fun academics I'd like to spend some more time reading in the future"". Check that box.Ever Since Darwin is a series of essay's Gould wrote for a Natural History magazine. They're collected here and organized by Gould under related subject headers.I am crazy about the theory of ""predator satiation"" a concept that, along with a handful of other ideas, has inspired me to draw a series of mini-comics sharing Gould's work with my fellow public transportation users. There are probably more relevant works to read in the realm of Natural History (I just happened to find this in a box on the sidewalk), or even more highly recommended works by Gould - but if you see a copy around read a few essays. "
46,0393308189,http://goodreads.com/user/show/7324264-john,5,"All of Stephen Jay Gould's admirable traits as a splendid scientist, fine historian of science and gifted writer are prominently on display in this elegant collection of essays; the first of many he published from his celebrated essay column ""This View Of Life"", which was published for over twenty five years in Natural History, the popular journal of the American Museum of Natural History. Gould brilliantly illustrates the explanatory power of Darwin's theory of evolution via natural selection, discusses some of the most fascinating discoveries from a fresh, more mathematically rigorous, approach to paleontology to which he, himself, contributed, and ruminates on the sociology of science in one exceptional essay after another. He does this in engaging, often lyrical, prose, in which he draws analogies from literature, film and baseball to make his cogent points. Anyone who enjoys great writing, especially on science, won't be disappointed with this tome nor the rest in Gould's essay collection series."
47,0393308189,http://goodreads.com/user/show/7873778-jerry,3,"Written in the 70's, ""Ever Since Darwin"" is very dated, and I wouldn't recommend it to anyone looking to broaden their understanding of evolution. However, it does provide a great insight into the mind of one of the most vocal proponents in the field - the late Stephen Gould. The most interesting is Gould's discussion of the spread of misinformation about evolution in the media. Gould talks about being angry when Punctuated Equilibrium (Gould's hypothesis that evolution happens in quick spurts of change, followed by long periods of stasis, rather than the gradual change predicted by Darwin) was hailed in newspaper headlines as the downfall of evolution. Gould's hypothesis was later abducted by religious fundamentalists who misquoted Gould's criticism of Darwinian evolution in an effort to replace science with religious fundamentalism in public schools. Ironically, Creationists and Intelligent Design proponents continue to misquote Gould to this day."
48,0393308189,http://goodreads.com/user/show/6882315-kevin-carlo-artiaga,5,"This book has rather been cruelly separated from me by a friend who had vowed to read it as quickly as possible and has then proceeded to ignore it for half a year. The science in it is just a bit outdated (plate tectonics was still a new thing at that time! hah!), but that in itself is interesting as it shows how biology has grown through the years. I like the fact that it explores both the subject of the science of biology as well as the scientists who on whose shoulders we are currently standing on: what drives them, their hopes and prejudices. The book has, for example, an interesting essay about Charles Darwin as the Beagle Captain's reluctant companion and how it might have influenced his writings.I am, however, more interested about the essays about the strange and wonderful living world, which I believe every person should have deeper understanding of, and this is a wonderful book which will give them just that. "
49,0393308189,http://goodreads.com/user/show/373703-adrian-colesberry,5,"The greatest modern voice for the neo-Darwinian synthesis. He and a colleague, whose name I forget, re-purposed Kipling's term ""just-so stories"" to describe evolutionarily plausible but unprovable explanations for things. An amazing critical thinker, Gould realized that if you didn't establish some way of critiquing evolutionary explanations, they would become the equivalent of folk explanations, overpredicting to the point that they could never be disproven. Once evolutionary explanations became non-disprovable, it stops being a science and starts being a belief, like believing in god. So he spent a lifetime not just doing his own research but in popularizing disciplined neo-Darwinian critical thinking in this series of essays in Natural History magazine or Nature magazine, I forget. Most of my understanding of the neo-Darwinian synthesis comes from reading Gould. "
50,0393308189,http://goodreads.com/user/show/1334545-david-s-t,4,"When it comes to popular writings on Evolution, the two names I most often hear are Dawkins and Gould. While I've read several books from Dawkins, this is my first one from Gould. This one is in the essay format which it seems is the norm for Gould's books. Overall the essays vary in quality but for the most part they're good, although some are a little dated (which happens with any science books published 35-40 years ago). My favorite ones were the first section over Darwin and a section which looks at odd organisms. In this later section, you get some interesting essays such as one over the Irish Elk and my favorite essay about the lampsilis mussel, which makes itself look like a swimming fish in order to get attacked by larger fish, then it shoots spores into the larger fish. This book makes me want to read more of his works. "
51,0393308189,http://goodreads.com/user/show/13126807-alex-rubenstein,5,"This was a fantastic survey of Darwin's theory of ""descent with modification"". I learned many fascinating tidbits, from the perhaps serendipitous occurrence of Darwin securing a spot on the Beagle's voyage--and not as the ships naturalist--to why he never explicitly used the term 'evolution' in his theory, as well as other important clarifications to supplement his theory in the prevailing biosocial ideas of the mid-19th century. Gould writes with impeccable wit and has a great objective sense to anticipate the criticisms of his own perspective, and to reply with convincing persuasion. He is a pleasure to read, and makes one hungry to follow this with his other ""Reflections"" essays published as columns in Natural History Magazine. Five stars."
52,0393308189,http://goodreads.com/user/show/8721244-megan,5,"Not an essay goes by that I don't deeply regret finding Gould's work after his death. His writings are tremendous, thoughtful, and accessible. It's thanks to his work that I chose a career in science. This collection hits all his great themes. The best essays, however, are those on the philosophy of science: what it means, how it's biased, and how it still does disservice to the unfairly stereotyped. Even an earth scientist like me is given much to think about, especially about how I can better serve the public through integrity and shrewd analysis. Great for professionals, students, and thoughtful people of every kind."
53,0393308189,http://goodreads.com/user/show/30982871-james-f,4,"This was the first collection of Gould���s articles from Natural History magazine. All the essays have some connection with the theory of evolution, either historically or as exemplifications. I read the book for the first time when it was relatively recent; today, of course, after thirty-five years, the science is somewhat dated, particularly with regard to human evolution. The essays are still fun to read, though, and many of his points are still quite relevant, especially about the misuse of science for political purposes��� it didn���t begin with the Bush administration, the Reagan administration, or even the Third Reich."
54,0393308189,http://goodreads.com/user/show/1015045-nola-redd,4,"An excellent collection of individual essays that fit well together. I tended to read the book by sections (of which there are eight), and each section worked well together and felt unified, rather than simply lumped together. Although the science is quite obviously dated, the history it reveals, combined with the thought processes, are very interesting. I do not pretend to be extremely knowledgeable on the subject, since my scientific bent is more inclined toward physics and astronomy than biology and genetics, but, aside from a few annoying assumptions, Gould did a great job of breaking things down for the lay person."
55,0393308189,http://goodreads.com/user/show/766243-steve,4,"This book is a bit dated and some of the essays drag on a bit more than I would deem necessary, but it approaches evolutionary theory from many different angles and definitely got me thinking. I would recommend it to any of you interested in learning more about how evolutionary theory applies directly to many facets of the natural world. It's nice, too, because it is easy to skip over or skim through articles of lesser interest to you without taking away from the enjoyment or understanding of the other articles. "
56,0393308189,http://goodreads.com/user/show/2446806-mike-davis,4,"Gould is best known as an advocate for atheism, but those leanings are not readily apparent here. The book is a series of short essays on various aspects of evolutionary theory as seen from a 1977 perspective and as such is of historical interest. Additionally, most of what Gould says is still mainstream opinion and hasn't changed in nearly 40 years. His approach to evolution is best summed up by the last sentence in the book: ""I will rejoice in the multifariousness of nature and leave the chimera of certainty to politicians and preachers."""
57,0393308189,http://goodreads.com/user/show/48354-matt,3,"Probably shouldn't have bothered with this one, since virtually every topic in this collection of essays is dealt with better and in more detail in his later works. Still, enjoyable for pointing out why you shouldn't give a dwarf a hammer, why we don't have ants the size of cars, and for containing the thunderously awesome quote ""A man does not attain the status of Galileo merely because he is persecuted; he must also be right."""
58,0393308189,http://goodreads.com/user/show/3338889-will,3,"This is my second reading of this book, only this time around I only read the epilogue, introduction and the last two chapters. I was looking at Gould's critique of sociobiology. Gould, although one of my intellectual heroes, likes to ride the middle ground and not completely upset either side of the debate.This book is great, but I gave it three stars due to the biology-geekiness of most of the chapters."
59,0393308189,http://goodreads.com/user/show/30879861-jon,4,I've read several of Stephen Jay Gould's essay collections and enjoyed them all. This is not one of my favorites simply because of the essay subjects but I still found it highly enjoyable. I think he had a gift for taking complex subjects and making them easy for the reader to understand. I highly recommend his books!
