,isbn,user_link,ranking,review
0,0465094252,http://goodreads.com/user/show/1713956-manny,4,"Sabine Hossenfelder is a theoretical physicist, and she's pretty mad about the way her subject has gone over the last thirty years. She's written this book to tell you why she's mad, and what she's done to try and find out what went wrong. She's talked with a bunch of people, some of them major stars of the physics world. She's asked them questions and she reports their answers. Somehow, even though a fair amount of it is near-incomprehensible physics-speak, she makes it cool and funny. She's got a great voice, laid back and detached and deadpan. She reminds me a little bit of Jessica Chastain in Molly's Game. Jessica's talking about poker and Sabine's talking about physics, but the two subjects aren't as far apart as you first think. When you come down to it, they're both high-stakes gambling games.Physics is on a losing streak. It went all-in with the Large Hadron Collider and bet fifteen billion dollars that it would find supersymmetric particles. (The Higgs was just the consolation prize; Sabine says that was pretty much a given). Most of the experts thought the supersymmetric particles were there, but they didn't show up. Physics tossed in a few billion more to upgrade the LHC to higher energies, and there were still no supersymmetric particles. Now it's sitting hunched over its cards as dawn begins to break, wondering what it's going to say to its wife.The problem is that the stakes have gotten so high that the physics gambling syndicate can only afford to play a few hands. Most of the time, it has to fold. It needs to be very careful about the hands it does choose to play, the ideas that involve setting up a real experiment. They have an army of experts, the theoreticians, whose job it is to give them advice on which experiments might be worthwhile; Sabine is one of those experts. It's a frustrating life. Usually, you know you're developing an idea which will never be tested. In practice, the theoreticians now present their work mostly to each other. They judge it by aesthetic standards, and fashion also plays a large role. Fundamental physics has entered a decadent period.The theoreticians deny that anything is wrong. Mathematical beauty is very important, they say. It's our only real guide to what distinguishes a promising theory from an unpromising one. Supersymmetry was so beautiful that it had to be true; Nature has so far refused to agree, but maybe they just need to build a larger collider. In contrast, the Standard Model, which is universally agreed to be hideously ugly, irritates the hell out of everyone by passing all the experimental tests they can throw at it. It is in fact rather confusing when you write it down.Sabine is suspicious about the cult of beauty. She upsets theoreticians when she suggests that it might not be scientific to work this way. She points out that many ideas now considered brilliant and beautiful were called monstrosities when they first appeared. (Quantum mechanics was a bit of an ugly duckling). She thinks scientists should read more philosophy and sociology, and try to understand their real motivations. In case you're in any doubt, she gives plenty of details about just what isn't working. She tells you where the bodies are buried, with little sketch maps and instructions on how deep to dig. She says people tried to talk her out of writing Lost in Math, and that now she'll never get tenure. It's pretty interesting to see someone telling the truth, and you realise how seldom that happens. I just couldn't put this book down."
1,0465094252,http://goodreads.com/user/show/28709846-manuel-ant-o,4,"If you're into stuff like this, you can read the full review.Implausifiability in Physics: “Lost in Math - How Beauty Leads Physics Astray” by Sabine Hossenfelder“The time it takes to test a new fundamental law of nature can be longer than a scientist’s career. This forces theorists to draw upon criteria other than empirical adequacy to decide which research avenues to pursue. Aesthetic appeal is one of them. In our search for new ideas, beauty plays many roles. It’s a guide, a reward, a motivation. It is also a systematic bias“In “Lost in Math - How Beauty Leads Physics Astray” by Sabine HossenfelderOne of the most obnoxious notions I’ve ever read in Physics is the one that purports that we’re a simulation. If it's all a simulation, why wouldn't the world that simulated us be a simulation too? This is the turtles all the way down idea. This doesn't mean it isn't true but it's also the same question as, if God created the universe and us, who created God? The answer I sometimes get when I say it’s all hogwash, is that the theory is aesthetically pleasing. Where is the evidence? And more importantly, is it “implausifiable” (I’m borrowing here Hossenfelder’s term)? The supposed evidence for our universe being a simulation seems to largely include the idea that if we extrapolate our technological progress further ahead in time, we will be able to build such a simulation ourselves *therefore* we are a simulation."
2,0465094252,http://goodreads.com/user/show/8101737-peter-tillman,5,"I have no way to judge Dr. Hossenfelder’s qualifications as a theoretical physicist, but I can say up front, she’s one hell of a writer.I have a bunch of notes, but you know what? If you just want a straight review, go to Steven Woit’s, linked below. My first impressions: theoretical physicists are supposed to come up with stuff that can be tested by experiment. If you can’t test the idea, or if it flunks the test, you move on (see Feynman). Physicists have been working away for *30 years* to try to improve the Standard Model. Basically, no recent progress. This should be a hint to the physics community. Instead, they’ve doubled down on untestable stuff like String Theory, that, to some physicists’ eyes, is beautiful. But: “Who gives a fuck what you like or dislike? Nature doesn’t care”— this is hotshot physicist Nima Arkani-Hamed https://en.wikipedia.org/wiki/Nima_Ar... , in a pungent interview with the author. Unlike the author, he’s a tenured physicist at Princeton, and says he’s found his dream job.My outsider thoughts: just about all the physicists Hossenfelder talked to *hate* the Standard Model, https://en.wikipedia.org/wiki/Standar..., mostly because it’s “ugly”, and incomplete. Well, so what? It works, and if it ain’t broke, why fix it? It’s not like there isn’t plenty of other cool stuff for physicists to work on. Such as, current physics only accounts for maybe 5% of the known universe. Dark Energy (68%) and Dark Matter (27%) supposedly are the rest, and we have NO CLUE what they are made of! C’mon, girls and boys, Nobel Prizes await you….Hossenfelder has written a breezy catch-up text for modern physics, well suited for people like me, whose formal exposure to physics ended decades ago. And I can *almost* understand most of the stuff she’s talking about. This is a Big Deal, and very rare in popular science books. So, read it for that, and her cool interviews with top physicists, and her pungent remarks about her chosen field. I wish her well. It must get *really old* to be an eternal postdoc, which is how she’s spent the last 15 years. She has a new appointment now, but it's another short-term contract. She says she'll be fine when that runs out, https://backreaction.blogspot.com/201.... Go, Sabine!Here’s a good, long, detailed review of the book by Peter Woit, https://en.wikipedia.org/wiki/Peter_Woit , a theoretical physicist who is also critical of String Theory. This is the review to read first. Woit says, “you should get the book and read the whole thing” Indeed.http://www.math.columbia.edu/~woit/wo...Lots of links, too.And here's a Reading Strategy for non-technical readers:1. Read the first and last chapters2. Read her end-of-chapter summaries for the rest.3. Read the interviews! Some of the best stuff is here. Previews at http://www.math.columbia.edu/~woit/wo... Steven Weinberg!4. Don't worry about the rest."
3,0465094252,http://goodreads.com/user/show/70459127-tara,4,"A quick summary of the book’s contents: Many physicists these days are inclined to believe that beautiful, elegant theories are the only ones truly worth pursuing. Hossenfelder argues that this is the main reason why there hasn’t been a major breakthrough in the foundations of physics for over 40 years. She asserts that this often debilitating aesthetic criteria has become a rigidly adhered-to dogma, and that physicists are in fact beating themselves soundly with their own outworn yardstick. She contends that this bias now interferes heavily with objectivity, which, believe it or not, is kind of an essential ingredient to any scientific discipline. This thought-provoking analysis of the limitations of beauty as a guideline is presented alongside several intriguing interviews of current physicists, which are interspersed throughout the text.Topics examined in depth, or else merely touched on, poked fun at, ogled lasciviously (hey, physics can be pretty sexy!), or otherwise brought to the reader’s attention, include: a brief history of physics, the standard model of particle physics, supersymmetry, the notion of “naturalness,” string theory, the multiverse, quantum mechanics, quantum gravity, grand unification, and issues with the basic structure and methodology of the scientific community which unfortunately tend to discourage innovation.Pros: I agree wholeheartedly with her main thesis, which is essentially that dogma has no absolutely place in science, and that scientists should be wary of biases which may be coloring their perspective and influencing their methodology. (This is obviously a gross oversimplification of her case, and I would urge anyone interested in her exact arguments and supporting evidence, to read the book themselves. While it isn’t terribly long, it is terribly illuminating and informative.) Also, the interviews were quite fascinating; it was very helpful to hear what various big names in physics had to say on the matter at hand. And lastly, I couldn’t help but enjoy her snarky sense of humor. The book is full of unexpectedly sarcastic remarks, and I found this undeniably refreshing. For instance, here is her (humorous) rationale for studying history:
“While I was in school I hated history, but since then I have come to recognize the usefulness of quoting dead people to support my convictions.”
Very cute.Cons: At times, it was a bit repetitive, and could have benefited from more rigorous editing and tighter overall organization. It is also heavier on Philosophy of Science than I was expecting it to be, though this is clearly a subjective preference—perhaps you’re a fervid devourer of that kind of thing, in which case the abundance of philosophical material will instead constitute a distinct advantage.Bottom line: I am not a theoretical physicist, so I can’t really directly address any of the higher level physics Hossenfelder critiques. I will instead content myself here with reiterating what I thought was the strongest aspect of her principal argument: Dogma can be positively insidious. It can creep into areas, such as theoretical physics, you wouldn’t think would stand for it. The most important thing you can do is to be ever vigilant that your own thinking doesn’t become twisted, caged, or otherwise hindered by anything of that sort. Clearly, this is a truth applicable not only to modern physics, but to any field of science, and, more importantly, to life in general. Lost in Math serves as a powerful reminder of this fact, and furthermore discusses quite a few strange and interesting facets of modern physics along the way. As such, it packs a considerable punch, and is well worth reading."
4,0465094252,http://goodreads.com/user/show/23100707-jean,5,"Hossenfelder is a theoretical physicist. This is her first book written for the lay audience. The author is a research fellow at the Frankfurt Institute for Advanced Studies in Germany. The book is about the abuse of mathematics while pretending to do science. The book is a series of interviews with well-known physicists. She builds a case of how science fails to self-correct itself and set about proving a theory. Hossenfelder does some critical thinking that she outlines in the book. I understand the politics of science and Hossenfelder put her career on the line by writing this book. If you are interested in science/physics, this is a worthwhile book to read.I read this as an audiobook downloaded from Audible. The book is eight hours and forty minutes. Laura Jennings does a good job narrating the book. Jennings is a voice actor and full-time audiobook narrator."
5,0465094252,http://goodreads.com/user/show/25304792-g-r-reader,5,"I figured that if Luboš Motl hated the book this much, it had to be worth reading. It's usually a sound principle, and it didn't let me down this time either. "
6,0465094252,http://goodreads.com/user/show/31506695-david-wineberg,5,"The universe is unacceptable to physicistsWell back into history, Man has tried to force nature into symmetry. Some of our greatest scientists spent their lives trying to force the solar system and then the universe into spheres, cubes, cones and cylinders. Or to find superpartners for every particle so they fit the (newish) theory of supersymmetry. That it has never worked has deterred no one, it seems. Sabine Hossenfelder is a theoretical physicist whose very job it is to create new theories (and let mathematicians sweat the details). She has admitted defeat. Her book, Lost in Math, is all about the blizzard of theories we all hear about. They have not only remained unproven, they are often unprovable. She quotes colleagues who admit “It is not an exaggeration to say that most of the world’s particle physicists believe that supersymmetry must be true,” because it so elegant and easy to work with. And despite the facts.Hossenfelder says she got into physics because she couldn’t understand people. Physics made sense; people were indecipherable. With no little irony, she wonders if she should get out of physics, because she can’t understand the people. This is a great basis for a book, and Hossenfelder pulls it off with humor, charm, and almost no resorting to math. It makes for a fabulous tale, as she travels the world to meet with the who’s who of physics. She records their near-unanimous dissatisfaction with their field, both because it is not proving beauty wins over ugly, and because ironically, no progress is being made. The book quickly becomes totally informed irreverence from an insider.Physicists have problems with large numbers. First, they can’t justify or even explain them. Second, when you take the inverse of a large number, it is uncomfortably small, which they also can’t justify or explain. The latest disappointment was the long awaited discovery of the Higgs boson, which seems to have disappointed everyone with its ungainly mass. Physicists like numbers to be as close to 1 as possible. They call those numbers “natural” and they lend themselves to pretty theories and formulas. But the universe repeatedly refuses to co-operate in this matter. With all the components and predictions of the current standard model, a total of one qualifies as natural. Everything else is classified as “fine tuning.” Whole theories that utterly fail claim to have discovered “interesting boundaries.” And all with a straight face.The later 20th century found physicists chasing three principles: symmetry, unification, and naturalness. These guiding lights have led them far astray. They have invented numerous unproven theories that are far more elegant than what they observe in nature. They are so elegant, physicists insist that nature must employ them, and their quest becomes to prove nature has done so, not whether or not it is valid. Beauty, Hossenfelder says, is a treacherous guide.In 2018, there remains absolutely no evidence for:-extra dimensions beyond visible 3D and time-new elementary particles beyond the 25 fundamental particles known since the 1960s- vortex theory-string theory-multiverse. Even Stephen Hawking got into it. His posthumously published (second to last) paper explores the beauty of multiverses, though no one has ever been able to demonstrate their existence or influence. Or need, other than for mathematical beauty.Hossenfelder finds some of it comes from sheer boredom. The multibillion dollar Large Hadron Collider has given physicists no new particles or proven any new theories. Physicists are used to rapid advances, dozens yearly, and everyone getting a Nobel Prize sooner than later (most often by age 30 in the 20th century). In the absence of concrete advances, they are trying to fit a cube into a round hole. Or as one string theorist put it – physicists are using a map of the Alps to travel the Himalayas.It has come to the point where anything that isn’t natural and elegant can simply be assigned to another universe, and the job is done. Hossenfelder interviewed one renowned physics professor who complains that physicists now insist their theories need no proof at all, that they should simply be accepted as true, and developed from there. This is precisely why Hossenfelder got into physics; she couldn’t understand people like this. The professor agrees; he is baffled and worried about the whole field.One of the many nice things about Hossenfelder’s style is that she doesn’t begin with 50 pages of dreary history and instruction. She gets right to the issue and only then backpedals into origins. She advises that readers can skip this if they know it. But that would be a mistake. She writes so smartly and her perspective is so untainted by the usual academic constraints, it’s even a pleasure to read the history.She tries to explain the bias that physicists exhibit. But she can’t get past the fact it is about aesthetics and not science. Everyone she speaks with is in favor of it. They admit the pretty theory gains automatic acceptance, while the complicated answer founders. She fears this is precisely why theoretical physics has made no advances in decades. And why she thinks she might be better off leaving it.Truth be told, many of the sciences foster these same viruses. Biology says it is in crisis. I reviewed the excellent Are We Smart Enough To Know How Smart Animals Are? by Frans deWaal, in which he comes down hard on social scientists for their totally prejudiced studies unconsciously designed to prove animals don’t measure up to Man. They are basically all invalid, and Hossenfelder thinks the same thing is going on in theoretical physics.Douglas Adams said that in the whole history of written English, you will never find the combination of words: “as pretty as an airport”. Here’s another I never thought I’d see: a fun theoretical physics book.David Wineberg"
