,isbn,user_link,ranking,review
10,0060988479,http://goodreads.com/user/show/19333702-bethany,4,"This book was fascinating and hopeful. I read the author's other book ""You are Not Your Brain"" and found the tone too cheesy and pop-self-helpish. It also left me with a question about the difference between the mind and the brain. When I found this title, it seemed it would answer my question--and it did. The tone of this book is much more academic, though still intended for lay people. It wanders through the history of experiments that have led neuroscientists to their current understanding of neuroplasticity. It delves into the philosophical debate over the nature of the brain vs. the mind. It ends up in a discussion of quantum physics and how that creates a scientific basis for there being a mind independent of the brain, capable of acting on the brain. All of this has implications for treating OCD and other disorders such as depression and anxiety that are for hopeful."
11,0060988479,http://goodreads.com/user/show/21680009-seth,4,"Schwartz achieves tremendous success in detailing the concept of neuroplasticity and how the mind can act as a ""force"" to effect lasting neurological changes. This empowers the reader as much (and probably more) than any self-help book out there, since he extensively backs his ideas with research article after research article. The brain has the capacity to change itself via attention and conscious effort, effectively challenging the reader to, at the risking of sounding trite, be the change she wishes to see. At the heart of this practice lies the idea of mindfulness. Recognizing one's impulses when they arise as an objective spectator, i.e. exhibiting ""bare"" attention to one's thoughts and desires and considering them nonjudgmentally, forms the foundation of concerted volition. Only by recognizing one's problematic or intrusive impulses/desires can she then shift her focus and attend to more desirable and productive behaviors.However, there was perhaps too much buildup for how little payoff was delivered in the closing chapters. Schwartz's foray of the quantum side of the brain, I think, should have been a more essential feature of this book, given his introduction, but it ends up coming out as a hastily scrawled footnote supposedly solidifying his theories of neuroplasticity. He fails to properly reify this soiree with sufficient precision, resulting in a disappointingly effete exploration of a quantum basis for the mind-brain interface that's more wishful and speculative than convincing and rigorous. Despite the ineffectual quantum sojourn, Schwartz lays his arguments out effortlessly with engaging prose and amusing anecdotes, not to mention elucidating an important moment in the history of animal rights as they pertain to science. Ultimately, after giving it due consideration, I still disagree with his thesis of free will being resurrected by this ""new"" science of volitional neuroplasticity. I maintain it's just as likely that volitional effort arose via evolutionary processes concomitant with the exquisite development of our prefrontal cortices (and hence the executive functions contained therein) which allowed the brain a means of inspecting and subsequently altering its own behavior as a way of adapting to novel environments and stimuli. "
12,0060988479,http://goodreads.com/user/show/42261661-lucas-g,3,"This book took me way longer to finish than is reasonable. That may have contributed to my frustration. But the book is frustrating for many legitimate reasons. It claims to be a book about how the mind, an immaterial substance, influences the brain, a physical substance. But it takes almost 200 pages before the authors really get to that point. Before that, it is just a series of reflections on the history of neuroplasticity research. Also, there are no citations so the curious reader can't easily look deeper when something of interest comes up. While much of the history is interesting, it is tangential to the point. For example, dozens of pages are filled with discussions of legal battles surrounding testing on moneys. Interesting. But not what the readers want. With that said, the key insight of the book is great. Schwartz's research demonstrates how mental activity can cause physical changes in the brain. This has been seen in Schwartz's OCD patients who were able to refrain from giving into compulsions and refocus their thoughts elsewhere, which ultimately created new neural pathways and eliminated the compulsions. If Schwartz is correct, his research deals a serious blow to materialism. Schwartz goes into weird territory, however, when he jumps head first into quantum mechanics. His position is that quantum mechanics, specifically the Quantum Zeno Effect, provides the physical mechanism for the mind interacting with the brain. The proposal is interesting, if not a bit weird. Overall, if you're interested in philosophy of mind or neuroscience, you probably need to read this book. But be judicious. Not all the history is necessary, so perhaps skim over that information"
13,0060988479,http://goodreads.com/user/show/8811289-correen,5,"It kept my attention, introduced me to new ways of thinking (at least for me) and pulled together disciplines in ways I would not have considered, e.g., psychiatry, philosophy and quantum physics.He even relates quantum physics to OCD disorders.I plan to read the book again and am recommending to my more scientifically oriented friends."
14,0060988479,http://goodreads.com/user/show/2825982-marc-dorval,5,"I really enjoyed this book as an additional introduction to neuroplasticity. Throw in some philosophy, quantum physics, and some fascinating history and you have a book that's educational and interesting at the same time."
15,0060988479,http://goodreads.com/user/show/11461255-steve,5,"If you would like to know more about the human brain, I highly recommend this book. I read it a number of years ago after hearing the author interviewed and I have remembered it ever since. Jeffrey M. Schwartz, MD, is a research psychiatrist at UCLA. His descriptions of how the brain is formed will astound you! The stories of how nerves are reclaimed and reused (in the event of a limb amputation, for example) are amazing. Did you know that violinists have a much larger portion of their brain devoted to their fingers? Much of the book is based upon experiments using PET (positron emission tomography) which allows the researchers to see what is occurring chemically in the brain at the same time that the patient is describing it. Ironically, Schwartz himself believes that there is much more to the conscious mind than simply the physical wiring. He uses the Buddhist notion of ""mindfulness"" in explaining what seems to be there and his interpretation I found pretty convincing. He also demonstrates that the idea that our brain is largely complete in youth and rigid after that is untrue and the adaptability of the brain (neuroplasticity) is available throughout our lives. Very hopeful and optimistic though some of the animal experiments may make some people squirm."
16,0060988479,http://goodreads.com/user/show/7511563-duchess-nimue,5,"The Mind and The Brain is a book that discusses how those two are separate. It talks how The Mind is more then chemical reactions in The Brain, and how the science grew to the the understanding of this.Neuroplasticity is defined as an ability of neurons to create new links between nerves, which can happen with the use of mental force. Author places a substantial importance on attention, for without it, our successes would be much smaller.Dr. Schwartz talks about his technique for treating people with OCD, and how similar techniques, developed by other like-minded people, turned up to have a great track record in treating people that suffered a stroke, or people with dyslexia, or depression. More than talking about those techniques, Schwartz talks about how people got to those ideas, he takes us on a ride through the history of neuroscientific science, it's scientific research, and introduces us to quantum physics. "
17,0060988479,http://goodreads.com/user/show/5815159-holly,5,"At first, I was like:And then I got to the second half of the book and I was like:Because QUANTUM PHYSICS IS WEIRD, Y'ALL. And then I ended up with a little bit of this:So, yes. Super interesting read if you'd like to understand why and how attention or the ""mental force"" of your mind can actually change the brain's structure."
18,0060988479,http://goodreads.com/user/show/3966025-avle-margarin,2,"a really weirdly written book. on the one hand it tries so hard to present itself as a serious scientific work, but the New Agey zealous and anecdotal tone doesn't really help in taking it seriously. also, it could have really used some editing, I mean I UNDERSTOOD YOUR ACHIEVEMENT IN OCD THERAPY THE FIRST TIME YOU EXPLAINED IT, YOU DIDN'T HAVE TO REPEAT IT ON EVERY SECOND PAGE OF THE DAMN BOOK. still, the quantum mechanics introduction is alright, as well as the summary of different schools of thought on the mind/brain problem, and I'll always cherish argumented attempts at salvaging the concept of free will."
19,0060988479,http://goodreads.com/user/show/6893402-counsel182,4,"Probably more like 3.5 stars but I'd give this book the benefit of the doubt. A seemingly 'easy' philosophical issue: is there a duality between mind and brain doesn't seem so simple to neuroscientist. Do mental forces affect the brain by altering wave functions causing us to act differently? The authors exhaustively explore this and other issues as it pertains to amputees, individuals with brain traumas as well as OCD patients. There also is a rather interesting chapter on the infamous (notorious) Silver Spring monkey experiments conducted in the 1980's and what was hoping to be accomplished. A bit erudite at times but a rather interesting introduction to the field of neuroplasticity."
20,0060988479,http://goodreads.com/user/show/2629565-jim,4,"Outstanding! Schwartz while working with OCD patients and developing a therapeutic intervention for them discovered what he calls ""self-directed neuroplasticity"" (mental force). He works with the physicist Henry Stapp to establish the mechanics of self-directed neuroplasticity in quantum physics and connects this with the Buddhist practice of mindfulness.In all of this, he makes a case for the human mind and human will having impact on the human brain: in other words, the mind can change the brain."
21,0060988479,http://goodreads.com/user/show/909198-mary,4,The author develops a 4 part mental therapy to help individuals with Obsessive Compulsive disorder resist their obsessive and compulsive behaviors. His therapy involves being attentive to what you are feeling and then refocusing your behavior on a productive tasks. He believes that one can change the pathways in the brain that facilitate this behavior. He describes different studies where human and animals have changed behaviors thus demonstrating the neuroplasticity of the brain. This book offers very interesting reading to those who want to learn about the mind brain connection. 
22,0060988479,http://goodreads.com/user/show/1939519-julieta,4,"First of all, neuroplasticity is just fun to say. It makes you sound all educated when you drop it in a conversation. But the truth of the matter is that Jeffrey Schwartz is able to explain a complicated subject to the common folk and teach us to utilize the benefits of science. So, where is your mind???? Find that out and you hold the keys to the kingdom. The answer is actually quite simple. "
23,0060988479,http://goodreads.com/user/show/10014821-jonas,4,Jason Shawartz does an amazing job at walking the reader through what is happening in the brain when we are paying attention and apply focus to something. He details the Neuroscience behind what takes place as we create new habits in how we think and shows what free will really is. Controlling what we choose to think about and focus on. ... Its the proof behind James Allen's classic As a Man Thinketh.
24,0060988479,http://goodreads.com/user/show/1821314-steve,5,"This book explains the ability of the mind, or the will, to influence the brain. This has application for language learning. We can and do influence the ability of our brains to develop new neural circuits to cope with new languages. Language learning is more a matter of attitude than aptitude, I have always felt. This book supports this view."
25,0060988479,http://goodreads.com/user/show/7587692-ness,4,"SF Library Audiobook - 4 stars“Cells that fire together, wire together”I wanted to challenge myself to read something educational (and take a break from romance). Neuroplasticity is the brain's ability to form new neural connections. I’ve become interested in this topic as a way to cope with migraine but also as a way to fight brain diseases (eg Alzheimer, dementia) because the ability to make new brain connections and create new circuitry is one way to not be stuck when old wiring breaks down.Through the author’s work with OCD patients, he found that self-directed neuroplasticity is real, and it takes a lot of effort (mental force). This book takes us on his personal journey as he tries to find the science behind why this works and the people he met along the way. I enjoyed reading about the success of helping dyslexic children, who knew it would stem from a hearing issue??This book provided background to the different scientific theories throughout history, but I can’t recall any of the scientist names nor their theories now, only in vague terms of materialism, behaviourism...philosophy and free will, it’s hard to not cover these areas when talking about the mind and the brain. I’ll have to research these another time. There were very in-depth chapters in regards to the mechanics of the brain itself. Again, very interesting, but challenging to keep up at times, having had only studied first year psych in university. I was listening to this at x1.5 speed, but slowed it down to x1.25 when it started talking about quantum physics and quantum mechanics. Over. My. Head. The areas that interested me the most was the practical applications to help those who suffer from OCD, depression, dyslexia, Tourettes and stroke. I found myself sharing these anecdotes with my husband. It was interesting to find out that the Silver Spring Monkeys experiment brought about PETA.The anecdote of the concert pianist who practiced for hours a day and lost the ability to play the piano was fascinating. The concept that neurons that fire together, wire together, meant that her excessive piano playing resulted in her brain grouping fingers together, making her unable to play singular notes. She was able to re-train her brain to separate the sensory input for each finger.Key take-aways* Cells that fire together, wire together.* ATTENTION is important for neuroplasticity.* Internal mental states can shape the structure and hence the function of the brain.* Areas you dedicate attention to in your life, take up a greater portion of your brain.* Intention governs attention.* Exercise helps with the ability to acquire memory (due to increased blood flow to the brain).* Thoughts are not facts  important for those with suffering from OCD, anxiety, depression"
26,0060988479,http://goodreads.com/user/show/80604787-erno-berezvay,2,"Wow, where do I begin? I have mixed feelings with this book, as it started off as one of those which has potential to be a good book, but ended up being the one which I had to stop before the last chapter. The science what the authors present is questionable, and the counterarguments what they line up are weak. One example:""...this intervening thing called 'the feeling of mental effort', they might argue, is mere side effect with no casual power of its own. But this sort of reasoning is inconsistent with evolutionary theory. The felt experience of willful effort would have no survival value if it didn't actually do something...""Well, that is just simple not true. Consciousness just as easily be a spandrel (which has no value but as a consequence of the evolution of different things. Fx.: chin types) Bringing quantum physics in sounds fancy, but as the Copenhagen Interpretation says, it is just ONE interpretation of the phenomenon. Using it as a solid fact is false. Supposing that the 'mind' or 'soul' has anything to do with the physical world also sounds a bit spooky and unproven. The OCD example what they discuss in the book just as well can be explained with behaviorism or neuroplasticity induced by other brain areas being active. Why? Because they are told to do so. No mentioning that anyone has ever done it without instruction or anything like that. I also look at the content with a suspicion eye, as the authors are mentioned as being religious and somehow the conclusion tries to brings back a non material soul into the neuroscience. On the other hand though, I learnt a lot about OCD and Tourette's and their clinical treatment, and I personally liked the detour to the Silver Spring Monkeys (even though it didn't fit as much as the authors might have thought). Unfortunately, I had to put down this book with disappointment. "
27,0060988479,http://goodreads.com/user/show/13789064-adrian-mora,4,"Rating 4.4 I love Brain Books!Dr. Jefferey Schwartz is a Neuropsychiatrist (I was unaware there was such a thing) whose main expertise is helping OCD patients. He seems like a bit of a hippy and believes mindfulness from the Buddha doctrine offered a radically new approach to OCD treatment. This led to a regimen called the ""Four Steps"". Relabel, Reattribute, Refocus and Revalue. Basically a way to distract your brain with focusing your attention on better behaviors. At the time (late 80's) the approach to treat OCD was abrasive and just plain cruel. For example, if you were a person who needs to wash your hands every ten minutes they would ask you wipe your hands all over a public toilet seat to ""help"" overcome your fears. OKaaaay?! Allegedly they had a very high success rate. Dr. Schwartz believed the results were fake news! He knew there was a better way. As more research discovered the brain was more malleable than originally thought and Dr. Schwartz had to look into what was coined Neuroplasticity. He knew if the compulsive brain could be distracted with better behaviors then the brain could change itself mentally and down to the neuron level, physically. And he was right. This book is all about this quest to learn and understand more. I really enjoyed this book and highly recommend to anyone looking to understand more about how the mind affects the brain!p.278""In quantum theory, experience is the essential reality, and matter is viewed as a representation of the primary reality, which experience."" - Stapp"
28,0060988479,http://goodreads.com/user/show/108893873-saransh-srivastava,5,"The mind has its own separate science. Sometimes it thinks apart from logic. Whenever we give an order to our believer, the mind lives in its own separate world without overcoming the idea. Logic is two different aspects of mind. Sometimes we also think about what the conscious and subconscious mind have to do with each other, but this thinking is a contradiction. In spite of the failure of the conscious mind, our subconscious mind can repulse everything that the worldly attendants present before us. In reality, the mind has a different existence of its own, it is so powerful that it does not need to be ordered.Personally, I have realized this myself that the power of the mind is ready to overcome all challenges. A very good example of this is Persistence yoga. Based on mythological beliefs in our Indian culture, it is believed that cure of incurable diseases is also possible with the power of mind. Not only this, by persistence yoga we can also achieve what science today calls impossible. From this book also we get to know the strength of mind and mind. Next, after reading this book, it turns from concept to belief that neurological disturbances can be overcome by the power of the mind."
29,0060988479,http://goodreads.com/user/show/16210905-d-finch,5,"This was a great book. I don't think Schwartz has proved the existence of a new force, put any nails in the coffin of materialism, or demonstrated the existence of free will, but to be fair to Schwartz I don't think that's possible.All mental acts have physical correlates (as his own evidence demonstrates) so it's always going to be logically tenable to be a determinist and a materialist. What makes the book great is the depth to which he pushes the argument, the evidence he assembles to support it, and the clarity with which it's expressed.Also valuable is the discussion of neuroplasticity. Even if you believe that your decision to reprogram yourself is itself determined, the fact remains that the brain can act on itself to create meaningful change. You're not stuck with the neural circuits you currently have."
30,0060988479,http://goodreads.com/user/show/82899836-kenzie-brenna,3,"I really really wanted to like this book and there were certain neuro psych chapters that had me turning each page as fast as I could but alas I couldn’t figure out how such a steep jump into quantum mechanics was made.I reread and tried over and over again, perhaps I will come back to those chapters at a later time. It just seemed so odd, being a science communicator is difficult so maybe if the information was communicated in a different way I would have understood it better.I definitely recommend people giving this a read though because it’s important to judge for yourself and you will learn at least something new and fascinating in one of the chapters!"
31,0060988479,http://goodreads.com/user/show/52508278-lily,4,This book offers a very interesting explanation on how the mind works and the factors that affect the thoughts we have. The author gives insight on neuroplasticity and numerous examples on how this was studied in order to have the understanding of it we have today. Certainly a curious reading that introduces the theory of quantum physics and how it affects our thought process. At times it was difficult to understand however a re-reading of particular chapters helps.
32,0060988479,http://goodreads.com/user/show/23133809-p-s-winn,4,"This is a great what is possible book. Looking at the human mind and what it is possible of is fascinating. The author offers a great scenario that the mind, so powerful, is capable of many things. How we use it is up to you. I have long believed we could use our minds to do many things, including healing ourselves and more extraordinary things. We have great minds, why not use them?"
33,0060988479,http://goodreads.com/user/show/82594046-lou-sills,5,Clear and compelling articulation underkying the science of will and attention and one's ability to change behaviors by and because of altered neutal pathways...indeed the brain is plastic if only you are willing...if only you attend I know a masterful book when I am compelled to read owing to excitenent and wonder!
34,0060988479,http://goodreads.com/user/show/88979133-kathleen-lamothe,5,"This was an epic tour-de-force of some of my favourite topics - neuroscience/neuroanatomy, philosophy of free will, the psychology of attention, willpower, & concentration, quantum physics, and the Buddhist & secular roots of mindfulness meditation. If yr a fan of any (or all) of these topics, then do yrself a favour and give it a whirl on yr headphones! "
35,0060988479,http://goodreads.com/user/show/26159747-sunny-baker,4,"Great philosophical read. Definitely attempting to isolate the mind from the brain as a separate entity, one might argue successfully (philosophically) or unsuccessfully (biologically,) no evidence as of yet. ""The mental force"" is a scientific evidence of human free will and moral choice, according to Schwarz. Great read that leaves many open questions. "
