,isbn,user_link,ranking,review
22,0735214484,http://goodreads.com/user/show/36489698-r-nair,5,"The best thing this book can teach you - practice does NOT make perfect.Here's why-Tons of books talk about how early specialization is the key to success in life and a majority of parents are seen pushing their kids into activities at an early age to give them that 'career advantage' later on in life. David Epstein trashes this idea so thoroughly in this book that I feel it should be mandatory reading for couples trying to have a baby. Epstein starts off with the poster boy for early specialization - Tiger Woods, who was already winning golf tournaments by the age of 4. His success led to training centres across the world for babies that incorporated the 'Tiger approach' - basically begin training the moment the sperm cell fertilizes the egg. Epstein talks about the flip side of the coin, great athletes, musicians, scientists who are practically the 'Tiger Woods' of their chosen domains but who weren't even interested in the fields they are now famous in till late in life. A good example is Roger Federer, possibly the best tennis player on the planet, who didn't take tennis seriously till his late teens. Until that point he was sampling all types of sports including football and basketball, even refusing advanced training in tennis so that he could continue playing with his friends on a lower skill level.So here's the crux - specializing early on in life (being a 'specialist') may bring success, no doubt. But those who have experience in diverse fields (the 'generalists') are the ones you can expect to achieve the greatest amount of success in any field. And this message is critical in our world where educational institutes are busy churning out individuals with narrow, non-transferable skill-sets with no basis in abstract thinking or cross-disciplinary creativity. This dearth reduces human flexibility when it comes to broad unpredictable problems to the point that we all are becoming more similar to Artificial Intelligence than the other way around. Why? Because AI can learn and use tactics to be used over and over again, but the moment the rules become flexible and the tactics require adaptation to changing unfamiliar patterns, AIs are well known for being blatantly unsuitable for the task. We all like to think that such tasks are the domain of humans and will remain so, because 'creativity'. But considering how much of our training is geared towards non-abstract, repetitive, familiar problems that schools and Universities drill into us in the name of specialization begs the question, is something uniquely human being lost between the lines?Studies done on musical students ranging from prodigies to novices shows that genius level musicians didn't practice any more than amateurs at the beginning of their careers. They only increased their practice durations after having sampled multiple instruments and choosing the one they liked. Countries where students are compelled to choose a specialization in the last two years of high-school learn the skills for that particular career and are encouraged to stick to it for the rest of their lives to achieve success, but in countries where students continue sampling different fields even in college have been seen to be just as successful with more of them actually staying in their chosen fields. NASA (a hub for specialists) spent 30 years trying to predict solar particle storms and the problem was eventually solved by a retired engineer who had worked with scientists and had a general idea of multiple fields. Famous musicians like Pianist Dave Brubeck, guitarist Django Reinhardt or jazz musician Jack Cecchini never had any formal musical training. 'Polymaths' - people with specific areas of expertise but with a broad knowledge of other domains have the most number of patents as per the records of the U.S. Patent office. Even in the field of comic books, the best comic artists are not the ones with the most experience but those who have had exposure to the most number of different genres. My favourite example has to be of Physicist Andre Geim, who used to spend his Friday nights performing random experiments unrelated to his field of study and eventually discovered graphene after peeling off scotch tape from a piece of graphite. He levitated a frog under magnetic fields once for fun before that. He ended up winning the Nobel Prize for the first experiment and an IgNobel Prize for the second, Brian Clegg's  The Graphene Revolution: The Weird Science of the Ultra-thin goes into much more detail on this. All in all the message here, brilliantly argued, is this - true elites, irrespective of their eventual area of expertise, tend to engage in diverse fields early on. They are known for their curiosity and interest in seemingly completely unrelated domains and suppressing this knack in them by parents or educational institutions is a cause for worry for all of us. The world needs both specialists and generalists to progress. This book makes an excellent case for nurturing the generalists just as much as we do the specialists.Maybe the most decisive part of a candidate's C.V. from the point of view of a recruiter may not just be the 'Achievements' but one ignored by most applicants and recruiters alike - 'Interests and hobbies'"
23,0735214484,http://goodreads.com/user/show/16212136-peter-pete-mcloughlin,4,Covers the idea of having a wide range of knowledge outside one's specialty helps people succeed. Often new ideas come from thinking analogically about things unrelated to what one is looking at. Has lots of case studies that make the argument that having a wide range of experiences can help with one's endeavors.
24,0735214484,http://goodreads.com/user/show/75748905-elizabeth,5,"A generalist may know nothing about everything, but one can argue that a specialist knows everything about nothing. Today's world is increasingly specialized, but Range: Why Generalists Triumph in a Specialized World does a magnificent job of showing that broad knowledge has distinct advantages over depth. This is not an original concept, but David Epstein presents an easy-to-read compilation of innumerable anecdotes and case studies, and each holds their own as compelling. For the nerds, there's plenty of tangential trivia (Van Gogh made his greatest works only in the last 3 years of his life!) to satisfy, but Epstein also manages to elucidate new psychological perspectives on familiar subjects. He explores musicians, athletes, military, scientific researchers and inventors, and video game designers, to name a few. It would be an impossible task to cover every field, but he certainly encompasses a vast range that demonstrates his point: these fields are rife with specialists, yet generalists shine in unexpected, delightful, and vital ways. However, what struck me most was how the insight of Range hit an immensely personal note for me. Having attended one of the top public STEM highschools in the nation, I knew of parents who would start prepping their children with Kuman, admissions prep classes, and the like in 3rd grade. This is simultaneously frightening and disturbing to me. Does a 3rd grader know that they're interested in STEM? Some of Epstein's strongest points are demonstrating how the race to get a headstart can be damaging and has vast ramifications for how we raise up our next generation. My parents wouldn't let me take ice-skating lessons because they said nothing would come of it. I was 12 at the time, and that was too late in their eyes. This kind of perspective—that one should specialize early and fast to achieve success—is counter to the most fulfilling education for kids, and Epstein provides critical evidence to show the benefits of an alternative. He doesn't provide clear-cut binaries. It's not always better to have breadth rather than depth, and Epstein points out situations where specialists thrive and where specialists are essential to the functioning of generalists. Ultimately, let this book stand as a comfort to those people who don't quite know where they're going...“The precise person you are now is fleeting, just like all the other people you’ve been.” There's no need to scramble to place yourself in a narrow box because there's an important space for the generalists out there too."
25,0735214484,http://goodreads.com/user/show/732347-kelly,0,"Growing up, whenever anyone asked me what I wanted to do with my life, I'd say either something super sarcastic or ""nothing."" Because the fact we expect people to know what they want to do for their lives before they're 18, 21, 25? Is bananas. You don't know who you are or what you like or don't like yet (add in that you need experience to GET experience in today's global economy and it makes it worse). So Epstein's premise is one I really agreed with already and I found his exploration of why cross-disciplinary knowledge to be validating to my belief that together, all of our strengths solve problems better than being super specialized in a niche arena. I listened on audio at 1.5 so can't speak too much to the performance other than it worked. I appreciated the idea of ""hedgehog"" vs ""fox"" for types of people. In no way does this book say those with highly specialized skills and knowledge aren't good but rather, they also benefit from working with generalists to collaborate and solve problems outside their field -- and even within their field. Worth reading for anyone who feels the value in collaboration and a breadth of knowledge. Also great for those who, like me, like doing a lot of things and still don't know what they want to ""do"" when they grow up but are, indeed, doing something they love BECAUSE they get to apply so many of their interests and talents somewhere. "
26,0735214484,http://goodreads.com/user/show/40236446-bartosz-majewski,5,"I used to have some envy towards people who are highly specialized in their field. Over time I've developed an understanding that mastering one field (mine was sales) and then developing myself within adjacent fields (management, strategy, marketing, writing, public speaking) is an optimal strategy. After reading Range I'd have to change my mind again. Since people ask me for advice on various topics like career development I need to correct myself: if I told you that you should specialize I might have been totally wrong. Read the book and figure how specialized or generalist do you want to be for yourself."
27,0735214484,http://goodreads.com/user/show/23760-janssen,4,"I thought this was so fascinating, especially as a parent. "
28,0735214484,http://goodreads.com/user/show/29221912-zainab-alqassab,4,"“It’s stupid to claim that birds are better than frogs because they see farther, or that frogs are better than birds because they see deeper. We need birds and frogs working to explore it”. As indicated by the title the book argument basically revolves around how people with wide range of knowledge and diverse experience flourish in a world populated by a highly specialized people. In each chapter the author backed up this argument by either sharing a story or some studies.  I liked the opening of the book, how the author started with familiar idea going through Tiger Woods and Laszlo’s daughters successful experience of “Starting something at young age gives a head start”. Linking these stories to the “Kind environment learning” by illustrating how the same reasons behind this approach success can be turned into limitations with catastrophes sometimes when applied in other domains which required ( wicked learning). The first chapters was intriguing especially about the influence of economical and social changes on the educational system. I was highly interested in this topic and the stories he shared about scientists, NASA, Van Gogh ( gonna read his biography soon),.... . However, i got bored at the last chapters as i felt he was repeating himself and i did get the idea which was awesome: “We need broad people with at least one area of depth” which i totally agree with as the world we live in has shifted it is demands from acquisition of structured knowledge to mastery of skills aka the 21st century skills. "
29,0735214484,http://goodreads.com/user/show/6590000-bjoern-rochel,4,"A good read in the style of ""Team of Teams"" or ""Barking up the wrong tree"". Debunks the general applicability of the 10000h rule and deliberate practice for knowledge work (e.g. the wicked world) and shows with a lot of case studies that often top performers are the result of a larger broad experimentation phase, followed by late specialization. I pretty much enjoyed all of them from Roger Federer, Vincent Van Gogh, Gunpei Yokoi (the Gameboy inventor), Johannes Kepler (the father of modern astronomy), Frances Hesselbein (a CEO by accident who took over the Peter F. Drucker foundation) and others.Also follows Kahneman/Tversky (Thinking fast and slow) and Chip Heath (Decisive) regarding the quality of expert forecasts and predictions. One star less because the last third felt a bit low on insights to me (mostly because I've already knew them from other books). So take the 4 stars with a grain of salt. It's a great book :)"
30,0735214484,http://goodreads.com/user/show/3250759-paul-fulcher,3,"David Epstein's Range is a follow-up to his The Sports Gene. The sub-title How Generalists Triumph in a Specialised World rather explains the book's message, and his opening example contrast Tiger Woods (already a confident and dedicated golfer by aged 2) with Roger Federer, much more of a dabbler in different sports. Epstein suggests early specialisation is generally the exception not the rule, and its value confined to certain narrow domains (he calls them 'kind' learning environments) which are reasonably predictable, and much less so in the, much more common in real-life, 'wicked' environments. In that sense the Polgar sisters are very much the exceptions that prove the rule, given the nature of the game of chess.One illustration he uses that, was personally resonant as a mathematician is that class-learned maths, often fails miserably in the real-world since problems are no longer presented neatly alongside the technique you are expected to use to solve them. So he advocates a much more explorative approach to learning, including the benefit of failing and falling-behind.The book goes on to consider a range (appropriately!) of related ideas, including suggesting that short-term planning is more important than long-term career goals. Perhaps my favourite quote in the book, related to this concept, comes from Paul Graham, the English-born American computer scientist and programmer, entrepreneur, venture capitalist, author, and essayist and co-founder of the seed money startup accelerator, Y CombinatorInstead of working back from a goal, work forward from promising situations.Although I note Graham has previously said that the ideal age to start a start-up is between 23 and 38 (http://paulgraham.com/start.html) which seems to rather go against the spirit of Range.""Range"" rather contradicts the key concepts in two other similar books in recent years, although Epstein, commendably, explains why he disagrees and indeed where the other concepts are still applicable:- the ""10,000 hours"" rule, whose origin can be traced back to Anders Ericsson's paper The Role of Deliberate Practice in the Acquisition of Expert Performance, but which was widely publicised by Malcolm Gladwell's Outliers: The Story of Success. Ericsson later published a book Peak: Secrets from the New Science of Expertise, including a clarification than 10,000 hours wasn't a magic number and focusing more on the role of deliberate practice (https://www.salon.com/2016/04/10/malc...), but Range would still take a different approach.Interestingly Gladwell himself has provided a blurb for this book: ""For reasons I cannot explain, David Epstein manages to make me thoroughly enjoy the experience of being told that everything I thought about something was wrong. I loved Range."" -- and The Tipping Point- ""GritGrit"", indeed Range advocates quitting as often the right and, in the longer-term, more productive strategy. Epstein has pointed out that the author of Grit herself suggested last year, “don’t confuse the healthy development of a work ethic with premature commitment to a singular passion,” (https://characterlab.org/tips-of-the-...) but it should be said that her comment was really confined to childhood, also commenting that ""in adulthood and even late adolescence, there are tremendous benefits to specialization,"" which Epstein would generally disagree with.Style-wise this is the usual collection of anecdotal stories and (perhaps less here than in some other books) scientific/statistical evidence, largely selected to fit the story. It was striking to me that one piece of evidence - the well-documented long-term trend of an increase in IQ scores in the Western world - was cited both by this book, and the previous non-fiction book I read, Superior: The Return of Race Science, to reach completely different (and to an extent opposing) conclusions. Slightly more unusually, several of the anecdotes use the author himself as a exemplar, which slightly grated with me.One might question why policymakers aren't focusing on introducing the techniques this books advocates, such as Superforecasting: The Art and Science of Prediction, into public policy in the UK. Of course, one person has made that his mission - the controversial Domimic Cummings (see e.g. https://dominiccummings.com/the-odyss...). But, compared to Epstein, Cummings does seem to take a rather prescriptive approach to the new techniques he advocates, particularly the greater use of statistical methods: indeed one of Epstein's most interesting case studies is on the Challenger disaster / Carter Racing business case study where Epstein argues that, contrary to the normal lesson drawn The Challenger decision was not a failure of quantitative analysis. NASA's real mistake was to rely on quantitative analysis too much.Like most such books (indeed almost all I've read) it is hard not to conclude that 80%, or more, of the useful content can be gained in 20%, or less, of the time from reading a summary or watching a TED Talk: see https://youtu.be/BQ2_BwqcFsc, and my 3.5 rating reflects this.But a worthwhile read and a very interesting concept."
31,0735214484,http://goodreads.com/user/show/78041434-andrew-hoskins,2,"Core idea resonates with me and a few interesting stories and examples that I remember, but wow what a slog to get through (I didn't finish and skimmed mostly). Endless examples trying to prove the same points. Could be summarized in a 10 page length blog post."
32,0735214484,http://goodreads.com/user/show/12635407-nidhal-guessoum,5,Wonderful. A must read for everyone.
33,0735214484,http://goodreads.com/user/show/111566858-greta,5,"“We learn who we are in practice, not in theory.”What is better: getting a head start and narrowing down early on a specific field or exploring different options, gathering informations in different fields ? This book teaches so much about performance, success, education and not being afraid to quit the path you‘re on, if it‘s not the best fit for you. It's perfect for all students, insecure about switching their subjects or struggling with which major to choose. David Epstein looked at the success stories of exceptional achievers in all different kind of fields and makes a strong case against narrowing down too early. Here is what this book teaches me:Specialists only get better through their extensive experience, when they work in a domain where patterns constantly repeat. Where feedback is provided easily, consequences are immediately visible and where are no unknown variables. As soon as patterns don‘t clearly repeat, feedback is delayed or inaccurate and unpredictable human behavior is involved (like in the big majority of our life’s) experts have greater difficulties to react to changing circumstances and to abstract their knowledge to solve new occurring problems. Successful adapters are circuit breakers, avoiding the same patterns. They have range.Education today is too narrow and we are not taught to interleave and apply broader concepts. The more the learner creates abstract models and the less they rely on particular examples, the better they become at applying their knowledge to abstract information. We benefit from running through a trial and error phase. We shouldn't settle down on a path that doesn't fit to us. We should sample and gather experience before we specialize.Outside the box thinking develops with experiencing different fields and being able to apply concepts from different areas of life. A head start is faster but learning is slow and short term struggle in studying leads to long term benefits. We learn better when we try to solve problems our self even if we fail completely. In school studying is too easy. Teachers give too many hints and don‘t encourage the own problem solving but rather present patterns and rules to problems that already have been solved. Rather than being able to abstract in order to solve new problems that didn‘t exists in that form before and which is the foundation of all development of science, students are only able to solve problems they saw in that form before. ""Grit"" is work ethic and resilience combined with consistency and knowing what you want. It‘s often claimed that Grit is an indicator for success, and head starters show a lot of grit. But late starters that struggled and changed their paths show to be the exceptional achievers. Learning stuff is less important, than learning about yourself. Match quality information can‘t be gathered if we don‘t explore. Those who explore and don’t narrow down, will faster gather feedback. We fail if we stick to tasks that don‘t fit to us and don‘t have the balls to quit, instead of recognizing that there are better options available for us. Before we start something we should define under which circumstances we‘ll quit and do so as early as possible. Struggling happens if we are forced on things that don‘t match to us. Consistency for the purpose of consistency isn‘t helpful and changing something increases the chances of finding the right thing.We should focus on who we are at that moment, our current motivations and interests and what we want to learn. Then we should decide what the best opportunities are in this particular situation. We should think short term instead of long term. Our work preferences stay not the same because we change and most of our personal changes happen between in our twenties. Early specialization is making a match for someone who doesn’t exist yet. We work best under an environment that suits us and we learn who we are not in theory but in practice. We should act first and then think. Test and learn and not plan and implement. Get an idea, evaluate it and eventually quit. Experimentation has advantages. Great successors also have great fails. Don‘t feel like you‘re behind, everyone progresses at a different pace. You probably don‘t even know where you‘re going yet, so feeling behind doesn’t help. Most successful people didn‘t follow a straight path either. Start to plan experiments, approach your own projects and be willing to explore as you go in your own speed. Consider abandoning your goals entirely should the need arise. A diverse group of specialists can not replace the contributions of broad individuals, because they rely on them to provide outside of the box thinking. There is nothing wrong with specialization and we all specialize to some extend. But sources of experimentation and self exploration are sources of growth, creativity, abstract problem solving and innovation.""Our work preferences and our life preferences do not stay the same, because we do not stay the same.”"
