,isbn,user_link,ranking,review
123,0393348741,http://goodreads.com/user/show/999171-anita,5," Mary Roach has done it again. She has created a book that I purposely read slowly so I could savor every bite, picture, and footnote*. This time she takes us on a trip down the Alimentary Canal, from nose, tongue, and teeth to the bitter end of the trail with all the explorers, characters, scientists, and even Elvis to enlighten us on our way. Roach has a way of taking you along this field trip asking all the questions that you know you wouldn't have the guts to ask, of the professionals who are passionate about your gastrointestinal tract. As always, I learned a lot, laughed a lot, and dreaded to see the last page. If you've ever had a colonoscopy, constipation, heartburn, or were interested in medicine or history, this book is for you. I also learned a thesaurus' worth of terms for excreta, including my favorite--digestive ash. I am prepared for prison with details and the slang used for ""hooping"" a phone into maximum security. I know the seriousness of constipation, the wonder of saliva, the strength of my jaws and the wisdom of the anus.  As always her eye and ear for the interesting, bizarre, and absurd make wonderful reading. This time I also noticed a universal truth that bears some thought. As a teacher I've seen thousands of names, and I know enough that you don't name a child Destiny, Brandy, or Jeeves for fear of setting up the expectations of a career. I even always enjoyed reading anything about earthquakes by the renowned seismologist Dr. Waverly Person. This book not only enlightens you on human biology, but also explores the name-fate/destiny factor. I only noticed this halfway through the book, but look at the power of names for these individuals: Dr. Doctor Willard Bliss--James Garfield's doctor; gastroenterologist, Dr. Terdman; flautus researcher, Colin Leakey; and Dr. Crapo, a researcher into manure pit deaths. Take care in naming your children. Mary Roach is a national treasure. She makes science fun, scientists human, and the world around us and in us understandable and awe inspiring. My only regret is that I will have to wait two years for her next book. She is definitely not full of digestive ash. *Only one of my many favorites; ""The human disgestive tract is like the Amtrak line from Seattle to Los Angeles: transit time is about thirty hours, and the scenery on the last leg is pretty monotonous."""
124,0393348741,http://goodreads.com/user/show/220791-lena,4,"Mary Roach's latest book examines what happens to food from the time we put it in our mouths to the time it comes out the other end. It contains all the elements of her trademark style - cheeky humor, a gung-ho attitude towards the disgusting, and actual quality science.There were many sections of this book I found genuinely fascinating. Her initial chapters about the elements of taste - both human and pet - got me hooked and wanting to read more, and her closing chapters about maladies of the colon (including what REALLY killed Elvis), the century-old scam of colonic irrigation, and the astonishingly high success rates of fecal transplants contain much useful information. In between, I marveled at the ability (albeit rare) of some humans to eat themselves to death and enjoyed the scientific dissection of the claims of those who assert Jonah-like survival of whale (or python or frog) swallowing.I must confess, however, that this book revealed to me that I am extraordinarily squeamish when it comes to discussions of certain aspects of the digestive system, in particular, stomach acid. This not so much a problem for me when such acid is contained to the stomach itself, as nature designed, but a not insignificant part of this book is dedicated to experiments in which these internal fluids are accessed from the outside of still living creatures, including a French-Canadian trapper who had the misfortune of being shot in the side and then treated by a doctor who saw his wound as an excellent opportunity to promote the advancement of medical knowledge. I'm not sure what it is about this subject (as well as disturbingly in-depth discussions of saliva) that caused me such consternation, but it did make the book somewhat harder to read, particularly since what little reading time I have these days coincides with the taking of my own meals. Given how many bodily taboos this book dives merrily into, I would not recommend the reading-while-eating strategy if you tend towards the squeamish yourself. Aside from that, however, if you like Mary Roach, you'll find plenty of good stuff to digest (ha!) here."
125,0393348741,http://goodreads.com/user/show/1291915-lauren,4,Fascinating and disgusting - Roach has the corner on this market! I learned several tidbits and interesting facts... although not necessarily ones to share in polite company at the dinner table!
126,0393348741,http://goodreads.com/user/show/10463035-caseythecanadianlesbrarian,2,"Parts of this were really interesting, parts were just gross and kinda made me nauseous. I also felt like the scientific way she looked at some things didn't pay enough attention to the humanity of people involved in the cases she was talking about (like drug smugglers and prisoners). And then there was the offhand comment with no evidence to back it up that Black people and Latin Americans are more homophobic than white people..."
127,0393348741,http://goodreads.com/user/show/15224258-veronica,4,Really interesting. I could have done without the chapter on Elvis though. Ms. Roach might point out that I was well within my rights—as a reader—to skip it. That’s true. I tend to read non-fiction in exactly the same way as I do a novel. Why? In a book like this one can skip around with reckless abandon since the only order is that of the alimentary canal itself. And we should all be relatively familiar with that!
128,0393348741,http://goodreads.com/user/show/1449138-scott,5,"Mary Roach usually writes the funniest book I read all year, and Gulp is likely to be no exception. I mean, I don't really read much, or really any, pure humor, but she always makes me laugh, frequently and out loud. Roach also packs more interesting facts per page--things I never knew before, or even ever thought to think about--than just about any other author; so many that I can't possibly retain all of the information in her books. And she has a genius for nailing people, physically and personality-wise, with a sentence or two, both people that she meets in the field, as well as obscure historical figures. AND she's a smart, tireless reporter, whose amiable personality and charisma is clearly endearing to those she visits, and who consequently go out of their way to play along with whatever adventure or bizarre investigation she's going on about. So, yes, I've enjoyed all of Mary Roach's books, about, basically, death (Stiff), ghosts (Spook), sex (Bonk), and astronauts (Packing For Mars), though the former two were better than latter. ANYWAY. Gulp is classic Roach, and possibly her best book yet. This time out she's interested in digestion, mostly human (though animals get a long look as well), from the moment food touches our lips to what it all ends up as when it's coming out of our buttholes. Or not coming out, in the case of the constipation chapter which, by the way, may have been what killed Elvis. As always with Roach, there's plenty of hard science here, and this (or Stiff) would make for great summer reading for high school biology students. She's a good, vivid explainer, and her light touch and palpable passion for her subject(s) keeps everything moving along at a brisk pace. Roach can be tiring, like that friend of yours who's always ON, and I sometimes had to put Gulp down just to get a break from her relentless enthusiasm. Also, not every injection of humor works, and on a Kindle, when you have to touch the tiny asterisk on the screen to jump ahead and read the jokey footnote, and then click again to return to the text proper, it can get a tad annoying, and feel a bit forced. But I can't think of another writer whom I'd want teaching me about gastric juices, fecal transplants, swollen colons, and the function of flatulence, among literally hundreds of other topics found here. "
129,0393348741,http://goodreads.com/user/show/223837-nicky,3,"Gulp is definitely light, popular science, with an abundance of footnotes, irreverent comments, and some interesting facts/experiences. I wasn't grossed out by it, since I can be fairly clinical, and rolled my eyes at some of the humour aimed at being gross; mostly it was an interesting read, certainly a quick one. It's accessible, no matter what level your knowledge of biology is at, mostly dealing with the various topics in an anecdotal way.I liked reading it, but now I have and look back, I think it dragged a little. Part of that's doubtless my sense of humour, which is defective and needs to be returned for a refund. Part of that is the endlessly anecdotal nature of it. I've reserved another of Roach's books from the library, but I wouldn't buy it for myself; I do have a friend who I think would find this quite interesting.Also, will people please quit hurrhurrhurring at the idea of faecal transplants? I'm sure it's all very well to laugh at it from a distance, but a) it's reinforcing the stigma about diseases like Crohn's or ulcerative colitis which really are not funny, and b) I have high hopes that they will actually find a way to cure or at least greatly alleviate inflammatory bowel diseases as a result of studies into this kind of thing. Several close friends have IBDs, and I cannot wait for the day they can quit feeling that shame/disgust."
130,0393348741,http://goodreads.com/user/show/1737220-richie-partington,5,"Richie's Picks: GULP: ADVENTURES ON THE ALEMENTARY CANAL by Mary Roach, W.W. Norton, April 2013, 336p., ISBN: 978-0-393-32912-4""Food, glorious food!We're anxious to try itThree banquets a day --Our favorite diet!-- from the musical Oliver""Silletti hands me a plastic cup and sets a timer. We are moving on to unstimulated saliva. This is background saliva, the kind that's always flowing, though much more slowly. A minute passes. We turn away from each other and quietly spit in our cups.""'Look at the difference compared to stimulated.' Silletti tilts her cup. 'You can't pour it easily. It's so viscous. Look!' She dips the end of a glass pipette into her sample and pulls it away. Filament is a nice word, Silletti's word, for the mucoid strand that trails behind.""Relatively little is known about unstimulated saliva. Partly, Silletti says, because no one wants to work with it.""'Because it's so gross?'""'Because it's harder to collect. And you can't filtrate it. It clogs the filter, like hair in the drain. And you cannot be precise because it's so slimy.'""'Right, it's gross.'""Silletti tucks a strand of her glossy black hair behind her ear. 'It's difficult to work with.'""Unstimulated saliva's trademark ropiness is due to mucins, long chains of amino acids repeating to form vast webs. Mucins are responsible for saliva's least endearing traits -- its viscosity, elasticity, stickiness. They are also responsible for some of its more heroic attributes. Unstimulated saliva forms a protective film that clings to the surfaces of the teeth. Proteins in this film bind to calcium and phosphate and serve to remineralize the enamel. Webs of mucins trap bacteria, which are then swallowed and destroyed by stomach acids. This is good, because there are a lot of bacteria in your mouth. Every time you eat something, every time you stick your finger in your mouth, you're delivering more.""It is now a decade since I immersed myself in Mary Roach's STIFF: THE CURIOUS LIVES OF HUMAN CADAVERS, whilst a member of YALSA's 2004 Best Books for Young Adults committee (which we, in due course, included on that year's selection list).Mary Roach's nonfiction explorations keep getting even more funny and fascinating. I am thinking that Roach's work and popularity must just build upon themselves: When you become well-known for writing incredibly funny, bizarre, and well-researched science books, I imagine that you are subsequently granted more time to complete the next project and can trade on your popularity to more easily gain access to top scientists and studies in progress that provide up-to-the-moment information. So, each time you tackle a new topic, you end up with a book that is even better than the ones before.""'What was hard,' Leavitt said, 'was finding the judges.' Leavitt needed a pair of odor judges to take 'several sniffs' and rate the noxiousness -- from no odor to 'very offensive' -- of each of the sixteen people's flatal contributions.* """" *It could be worse. In a study of malodorous dog flatulence carried out at the Waltham Center for Pet Nutrition in Leicestershire, England, the far end of the scale was 'unbearable odor.'""The fact is that GULP is a gas. Mary Roach begins with an exploration of the functioning of the nose and mouth as she explores how we interact with our food from one end of our bodies to the other. Side-splittingly hysterical, gross, eye-opening, fascinating, disturbing, and unforgettable are all words that readily describe what it's like to experience these step-by-step alimentary adventures and the million side journeys on which we are led by Ms. Roach through her research into these yummy topics. I advise you to not try reading this book while anywhere that you have to be quiet -- you could conceivably choke to death trying to stifle the laughter.At the same time, the breadth of research and quality of information delivered here is such that I've been repeatedly talking about this book to anyone who will listen and am gearing up to pitch it to any high school AP science student who crosses my path:""Why is it, then, that stomachs don't digest themselves? Why do one's stomach juices handily digest haggis or tripe but not the very stomach that excretes them? ""It's something of a trick answer. In fact, stomachs can digest themselves. Gastric acid and pepsin digest the cells of the stomach's protective layer, or mucosa, quite effectively...A healthy adult has a new stomach lining every three days. (More clever stomach tricks: key components of gastric acid are secreted separately, lest they ravage the cells that manufacture them.)"" It is so intriguing to read about what our own bodies are doing every day -- in fact what they are doing at this very moment. Now every time someone spits, burps, or farts (or talks about spitting, burping, or farting), I am thinking about some of the crazy stuff I've picked up from this brilliant piece of nonfiction. Richie Partington, MLISRichie's Picks http://richiespicks.comBudNotBuddy@aol.comModerator http://groups.yahoo.com/group/middle_... http://slisweb.sjsu.edu/people/facult..."
131,0393348741,http://goodreads.com/user/show/70632050-robin-tobin-on-the-back-porch-reading,5,No one is better at non fiction topics than Mary Roach.
132,0393348741,http://goodreads.com/user/show/5909620-chelsea,4,All of Roach's books have been interesting!
133,0393348741,http://goodreads.com/user/show/38036772-annie,4,"The last Roach novel I had yet to read- my knowledge of her oeuvre is complete. It’s a pretty classic Roach- interesting, with endlessly fun trivia and Roach’s trademark nonstop hilarity. I wouldn’t say this is her best, but it doesn’t flop like Spook did, by any means. Somewhere in the tidy middle. It was certainly the cause of numerous barks of laughter."
134,0393348741,http://goodreads.com/user/show/4310312-cloak88,4,"What goes in must come out....Mary Roach investigates everything about digestion. From the mouth and chewing to the very end with the anus and going passing gass. She gives a humorous overview of past and present scientific interests in our digestive track. What people thought it was, what it does, what goes right, what we do wrong and how science has done about it.Don't eat while reading this, but it is interesting!"
135,0393348741,http://goodreads.com/user/show/6449756-sonja-arlow,4,"4 ½ starsI absolutely love this author’s inquisitive mind, writing style, humour and the subject matters she chooses. My favourite is still Stiff: The Curious Lives of Human Cadavers but this one is a close second. It had me bursting out laughing even with the high yuk factor of the content.In typical Mary Roach style:“No engineer could design something as multifunctional and fine-tuned as an anus. To call someone an asshole is really bragging him up.”She dives into the subject at hand discussing topics ranging from what makes pet food (and ours) irresistible to Fido to ""taboo"" topics as intestinal gas and our bowel habits. We read about the dangers of prisoners secreting contraband in their stomachs or up their bottoms. It also looks at the digestive systems of competitive eaters and we even learn why Elvis died, and yep it was on the toilet. And these are not even the ""odd"" sections of the book. That’s reserved for discussing where the myth of fire breathing dragons come from (they are basically gassy snakes), what morning breath really is, why rabbits and rats eat their own droppings and things I never wanted to know, ie the anal violin. Take it from me, don’t eat while reading this :-)The only criticism I have is that with an Kindle the footnotes at the end of each chapter becomes a bit confusing as you cannot easily just flip back pages to see what she is referring to.This book will not be to everyone’s taste (excuse the slight pun) but I loved it!"
136,0393348741,http://goodreads.com/user/show/2596042-lisa-harmonybites,5,"This is my third Roach book, after Stiff (about corpses) and Packing for Mars (on space exploration). This one is about the digestive tract. Yes, really. All the books I've read by her are very entertaining and had me smiling throughout--though this was the first one (on page 229) that made me laugh out loud--a rare distinction and why this one is getting that fifth star. Roach dares to ask all the questions you wish you thought of--or wished you weren't too squeamish to ask. She'll tell you in this one all about the science of poop, farts, spit and more. Her last chapter is called ""The Ick Factor."" She says in her introduction she wants the reader ""to say 'I thought this would be gross, but its really interesting.' Okay, and maybe a little gross."" Mission accomplished.Along the way though you do learn a lot of esoterica, and some useful medical facts, too. Such as the basic tastes are sweet, bitter, salty, sour--and umami (brothy). I thought it was only the first four. Did you know that ""catfish are basically swimming tongues""? That Sudanese use a condiment of fermented cow dung? That""laundry detergent is essentially a digestive tract in a box?"" That an effective medical treatment is to introduce useful microorganisms by transplanting them using another's feces? Roach also takes a shot at debunking food fads such as probiotic foods, gluten-free and the fetish for fiber. (Good luck on that--food myths are immortal.) Definitely a great read--just not while you're eating."
137,0393348741,http://goodreads.com/user/show/1180982-jennifer,5,"It isn't any secret that I love Mary Roach, and here's why - you know how you will be thinking about something, and then whatever that thought is leads you to something else, and so on and so forth, and pretty soon you are on a completely different subject in your own head? That's how Mary writes - which sounds like it might not be good but in truth is awesome because you aren't left with those ""I wonder about ..."" questions. She can anticipate what one subject will make you think of next. It's like the squirrel in your head who bounces from subject to subject and keeps you from ever getting bored wrote a book :)All that said, this is just another great, funny, sciency book. Kind of gross in places, fascinating throughout, and funny enough to make you laugh out loud and annoy those around you. Wacky but really interesting information about the digestive system, human and otherwise. Very recommended.*We are large, mobile vessels of the very substances we find most repulsive.*"
138,0393348741,http://goodreads.com/user/show/1628041-book-concierge,3,"Audio book narrated by Emily Woo Zeller3.5*** Science writer Mary Roach tackles the human digestive system in this work of nonfiction. Starting with the nose (Chapter title: Tasting Has Little To Do With Taste) and ending with, well, the “output,” Roach entertains and informs as she reports on various scientific studies, in some cases interviewing the researcher, and/or participating a re-creation of the study. There’s definitely an “ick” factor in this subject matter, but Roach manages to give vivid descriptions without (for the most part) completely turning the reader’s stomach. I listened to the audio version, capably narrated by Emily Woo Zeller. She reads with enthusiasm, which increased my interest in the material. I think she must have been smiling through much of the narrative because she sounded so “happy” (if one can be happy about this subject). Certainly made me smile."
139,0393348741,http://goodreads.com/user/show/12620745-debbie-dj,4,"  I did not think it possible to find a book more ""off the beaten path"" than her book ""Stiff"", but this one surly is. If you read ""Stiff"", you'll have no trouble reading this book, if not, look out! Roach has a willingness to take us places others will not go with wit and extensive research. She literally takes us from one end to the other. Yes, from mouth to anus. Oh my, what a ride! I found myself having to take breaks from this book as a little goes a long way. However, this book contains a lot of useful information as well as delving into questions one only vaguely thinks of. Intriguing to say the least. Did you know Elvis died of constipation? Me neither! The ""ickiness"" factor aside, this is an amazing read."
140,0393348741,http://goodreads.com/user/show/2205083-bryce,4,"Reread Review 2018Still so good... and gross. Original Review 2014While reading this book, I was constantly, impatiently waiting for people to ask about what I was reading. ""The taste of cat food"" or ""the self-regulating acidity of the stomach"" or simply ""farts"" were such fun answers to give. I trust Mary Roach to give me the weirdo facts about already weirdo subjects, to go just one step further down into the weirdo basement than you would expect. It's why I automatically buy her books when they come out and it's why her books always entertain even when the choice of subject matter isn't normally what I would consider interesting."
141,0393348741,http://goodreads.com/user/show/8460201-karen,4,"Mary Roach simply owns this space of ""highly accessible non-fiction about taboo-ish 'sciency' subjects told in plain English in an engaging and humorous way"". It is quite a genre to own ;)This is my second book of hers (the first I read was Stiff: The Curious Lives of Human Cadavers) and I just love them. I learn SO much and I find the subject matter endlessly fascinating. SO much more entertaining to read Roach's work than a bunch of textbooks and papers.Can't wait to read another."
142,0393348741,http://goodreads.com/user/show/2450538-louise,3,"An interesting and sometimes disgusting look at what goes on in the digestive tract from the mouth all the way down to the anus. What's that? You're disturbed by my using the word 'anus'? Then this book is not for you because it gets a lot worse than that.I would have rated this higher, but I got tired of Mary Roach's asides and unnecessary footnotes. Some of those footnotes just seemed to explain her jokes, which made the not-funny ones venture into painful territory. Roach is a great pop-sci writer, but not a very good comedian."
143,0393348741,http://goodreads.com/user/show/7288965-manray9,3,"Who knew gut flora could be so interesting? Mary Roach's Gulp is an engaging layman's look at the myriad scientific and cultural facets of the human alimentary system from input (eating) to output (defecation). Roach's only shortcomings, probably due to attempts to appeal to a popular science audience, are the occasional lapses into being a little too cute. I give it a strong Three Stars. "
144,0393348741,http://goodreads.com/user/show/11312848-margaret,4,"I waited to review this because at first I was amused by it, but thought Roach was being a little too cute. In the week-ish since I finished, I find myself thinking about it all the time. In yoga, I'll think, ""Is this my mula banda, or am I holding in a fart right now? Could a fecal transplant change my life?"" That's at least a four-star haunting right there."
145,0393348741,http://goodreads.com/user/show/24377699-cheese,2,"Couldn't finish it. I thought this was a book about nutrtion, but it's more of a disgustingly graphic look into what Humans eat."
146,0393348741,http://goodreads.com/user/show/5639554-heather-r,4,"Really it's a 5-star book, but I took a star off for stomach-churning details. Although now I know how that whole system works!"
147,0393348741,http://goodreads.com/user/show/22299570-kaytee-cobb,4,"Exactly my kind of non-fiction read: smart and funny and irreverent, with a healthy sprinkling of swear words. Warning: do not listen to this one while eating."
