,isbn,user_link,ranking,review
0,0300136595,http://goodreads.com/user/show/6100646-brian-clegg,3,"Doing all of science in one book is not an easy task, nor is it obvious how to go about it. William Bynum has chosen to provide us with a breezy high speed canter through the history of science, with the keyword being ‘history’. There is a lot of about the people involved and the context, always good from a popular science viewpoint.Bynum manages to do this in an approachable way – almost too approachable sometimes as the style veers between writing for adults and for children. The bumf says ‘this is a volume for young and old to treasure together,’ but it really is neither fish nor fowl. The approach generally speaking is one that works best for adults, but then you get a sentence like ‘Galen was very clever and was not afraid to say so,’ that sounds ever so Janet and John.Perhaps my biggest problem with the book is that while the history side of it was usually fine, the science was not always so. Some of it was just little factual errors – stating that the human appendix has no function – actually it has recently been discovered to have one – or referring to ‘degrees Kelvin’ like ‘degrees Celsius’ where the unit on the Kelvin scale is just kelvins (no degrees). But the problems were more painful when it came to modern physics – it did rather look like the author really didn’t know what he was writing about.He tells us, for instance, that cyclotrons and synchrotrons were used by Chadwick in ‘smashing high-speed neutrons into heavy atoms’ – but these devices can only accelerate charged particles, and Chadwick used slow neutrons from decaying radioactive substances. He also says that the twins paradox ‘is just a thought experiment and could only happen in science fiction’. Well, no, it’s not, and on a small scale with atomic clocks it has been performed many times. He also seems confused about gravity, commenting that in space ‘there is no gravity. Astronauts and their spacecraft are essentially in free fall.’ The last bit is true, but not because there is no gravity – there’s plenty of gravity at the kind of level that, say the ISS orbits. But that free fall means it isn’t felt.The absolute worst example is a paragraph that I find almost entirely without meaning. I would be grateful if anyone could explain this one to me:As Einstein’s E=mc2 tells us, at ever higher speeds – almost the speed of light – in the accelerators the mass is mostly converted into energy. The physicists found that these very fast particles do some fascinating things. The electron emerges unchanged from the accelerator. It is part of a family of force-particles – the leptons.I am baffled. Overall, then I am not sure what the audience for this book is, nor am I happy that they will get any sensible understanding of modern physics.Review first published on www.popularscience.co.uk"
1,0300136595,http://goodreads.com/user/show/931082-arminius,5,"This is a good book that nicely packs the most important work of scientists throughout history. In the 2nd century the Chinese learned how to magnetize iron by a method of high heating and cooling which caused it to point in the North-South direction. The Chinese also invented gun powder by blending charcoal, sulphur and potassium nitrate. In this century the Chinese produced the first medical books. Acupuncture also emerged as a medical treatment at this time. Aristotle’s writings dominated scientific thought for a thousand years after his death. Aristotle separated his science into three parts: the living world, the nature of change and the structure of the heavens. He had four elements as well: air, earth, fire and water. However, a few very important scientists followed in their own direction during Antiquity. The first is Euclid. Euclid described points, lines surfaces and volumes in a masterpiece book called “Elements in Geometry” 200 years before the birth of Christ. The next great scientist was Eratosthenes (c. 284-c.192 BC). He used Euclid’s geometry to measure the circumference of Earth. He measured the angle of the sun on the Summer Solstice at Alexandria. He then used the distance from Alexandria to the city Syene and calculated 25,000 miles as the Earth circumference using geometry. The actual distance, as we now know, is 24,901.55 miles. The last of the great ones is Claudius Ptolemy (c. 100- c. 178). He calculated movements of stars, planets and moons. He also charted the universe’s stars positioning. His book was used for centuries as the main source for astronomer education. There are two giants of Medicine – Hippocrates, who is famous for authoring a number of rules, named the Hippocratic Oath, and Galen. I want to focus on Galen however. Galen believed that to be healthy the body needed to be in a balanced state. He thought that the body consisted of four humours-blood, yellow bile, black bile and phlegm. These were either hot or cold and moist or dry. So diseases that were hot and moist would be treated with cold and dry methods. Galen also was the first doctor to feel a patient’s pulse. He knew by the strength of it if the person carried a disease. He also studied anatomy. He dissected many animals and was able to produce a book describing human organs, based upon his dissections, and their functions aptly entitled “On the Uses of Parts.”Galen also believed in a three part system of spirits, each associated with the most important body organs (liver, heart and brain). He was also subscribed to a theory that many diseases are creations from our own minds. One of the great Chemists was Paracelsus. He devised three basic principles –salt, sulphur and mercury. Salt gives things shape, sulphur is the reason things burn and mercury causes smoky and fluid substances. He believed that outside forces were responsible for causing disease. This opinion differed from Ancient thought so was mostly ignored during his lifetime but would prove true many years later. He also created a cure for one of the most dangerous diseases of his time, Syphilis, by using trace amounts of mercury. I could go on but with so many great scientists mentioned in the book I am just going to leave my review as is for this terrific book."
2,0300136595,http://goodreads.com/user/show/223837-nicky,1,"Reviewed for The Bibliophibian.If you don’t actually know much about the history of science, this book might well be for you; for me, it was painfully obvious, hitting exactly the topics I expected, skimming over what I expected it to skim. A worse crime, however, is that the author simply wasn’t accurate: if you’re going to write a non-fiction book, it’s important to make sure you don’t speak beyond your research.It does not take much research to find out that Egyptian hieroglyphs and Chinese characters are not pictographic representations of language. (To be perfectly accurate, some of the characters echo in form the thing they name; a cow head shape might mean the word cow, for instance. However, the languages also contain phonetic characters.)I didn’t read beyond that. On that point, I knew the author was wrong — on a subject that isn’t even a particular area of expertise for me; how, therefore, could I trust him to have done his research about anything else? If we’re talking deeply technical details, that’s different, but it is widely understood that Egyptian hieroglyphs and Chinese characters are not solely logographic. There’s too little time for something where I distrust the research and editing and I’m bored."
3,0300136595,http://goodreads.com/user/show/69752651-sidak-grewal,4,"I am 13 years old and I have recently finished reading ‘The little history of science’ by William Bynum. I enjoyed this book beyond words. This book comprises forty chapters and in those chapters the author tells us about the pioneers of science and technology. Each chapter is from three to eight pages long and full of interesting facts and stories. The best thing I liked about this book is the way the author explained about each scientist. The author makes each topic interesting for the reader and enhances the reader’s curiosity. The book is interesting and entertaining without compromising on the details.In conclusion, I would recommend this book to all people who are interested in science and wish to know more about its history and the pioneers who shaped the history. "
4,0300136595,http://goodreads.com/user/show/12487719-antonis,2,"Bynum tries to imitate Gombrich's classic ""A little History of the World"". He is not successful, although it's a good try. Almost all the right parts are there, but the sum does not satisfy the reader. "
5,0300136595,http://goodreads.com/user/show/45302017-susan,3,Perfect book for someone from a non-Science background and wishes to start their learning from somewhere. This is a little book that tells a grand tale about Science. It is a story of thousands of years of questions that people have asked.
6,0300136595,http://goodreads.com/user/show/4054541-wayne-mccoy,3,"Briefly comprehensive is the kind of strange oxymoron that would apply to this book. Written in short, digestible chapters, it attempts to explain human science from the development of numbers to the deciphering of the human genome.Written for younger readers, it's the sort of book, I would have devoured easily when I was 12 years old (and would seem to be recommended for about that age). Nitpickers will always point out what is missing, but for a book of about 272 pages, the only thing that might have been helpful might be a reading list for those looking for further information. Of course, any 12 year old boy can use Google to do their own poking about, but a few formalized resources might have been a nice touch.Easy to read, with some humor injected throughout (as well as some intriguing wood cut prints), it's an easy higher level look at a subject that humans have been studying for at least 4,000 years."
7,0300136595,http://goodreads.com/user/show/37716698-xiangting-lim,4,"If you want the greatest contributions in science at a glance, it is a great summary."
8,0300136595,http://goodreads.com/user/show/82778232-musa,3,"The chapters on physics are inaccurate or misleading a lot of the time, but I found the bits on medicine/biology to be very interesting."
9,0300136595,http://goodreads.com/user/show/8196123-kevin-bessey,5,"As the title suggests - and which is of no surprise - this book provides an excellent, but brief overview of the history of science. After reading other reviews, I noticed many people were unhappy with the length or subject matter so I guess I went into this one with lower expectations.My background is in biology, so naturally I'd prefer to read more about the history of life sciences, but I thought Bynum did a fair job of mixing the physical and life sciences together. I was a bit surprised that he didn't go into much detail with geology, but I think in all fairness he wanted to stick to the general themes within physical and life sciences, including medicine.My only complaint was that he didn't go too far into the golden age of microbiology. Naturally, by having a greater interest in the life sciences, I was eager to know more about the history and figures of that era. Bynum briefly mentioned spontaneous generation and I was let down that he never mentioned Francesco Redi's meat jar experiments. Instead he discussed Pasteur's broth/flask experiments, which became the final 'kick in the pants' to spontaneous generation.Altogether, if Bynum would have wrote more about what everyone complained about leaving out, this quick read would've turned into a lengthy text book - giving people something else to complain about. I think this book served a great purpose.Pros: a great overview of mankind's journey through science and why it is important.Cons: a ""for more reading on this topic"" section after each chapter would've been nice.Bottom line: a great read for anyone interested in getting the 10,000 foot perspective of science."
10,0300136595,http://goodreads.com/user/show/5049109-sharla,1,"Well, I found this book rather disappointing. First of all, I was dismayed to discover that it is pitched at about a Grade 6 level, but I suppose that that is more the book store's fault for not putting it in the right section. This book very much subscribes to the perspective that ""science is the only way"" of knowing about the world -- while it is one way, and the most prevalent way, in use, I don't think it is the only way. This book is often preachy about ""how science should be"" and I wondered if the author was ever going to acknowledge that many scientific advances have had terrible consequences (he finally did -- atomic bombs and eugenics being his examples). The controversy caused by the work of scientists such as Galileo and Copernicus, and even Darwin (which is still with us today) seemed to be mostly glossed over. Because the book is presented in chronological order, the topics jump around a lot -- back and forth between primarily chemistry, physics, and biology. Some key definitions were missing -- for example, the book does give the actual distance measured by a light year, but fails to indicate that this distance is the length that light can travel in a vacuum in one year. I found the explanation of Einstein's theories easy to understand, but other explanations were lacking. An enzyme is more than a protein that has a special job (could not one argue, using that definition, that every protein is an enzyme?). I should stop now, because I'm rambling, and end by again saying -- this book was really disappointing."
11,0300136595,http://goodreads.com/user/show/719392-josie,1,"I love books that look at the history of ideas and was quite disappointed by the old-fashioned, timeline minus analysis approach of this book. The lack of analysis made the book less interesting than it should have been – part of the joy of thinking about the history of science is seeing the gradual or sudden insights into physical world or the world of mathematical ideas and how these insights led to changes in how human beings saw their place in the world.It was also old-fashioned in the sense that the West was front and center in every age, including times when there was little of scientific interest taking place in Europe. Additionally, the author downplays important Chinese and Indian contributions to science and scientific thought by comparing them to contemporary understandings and not to their historical peers. There is no presence of Mayan astronomy or mathematics, or anything else that would indicate that people were doing anything that might be described as scientific thinking in the Americas. "
12,0300136595,http://goodreads.com/user/show/18833485-sandeep-chopra,2,"As an avid reader of science history, I don’t think this book is up there. It is more like a collection of great names in science and a sentence or two of what they did. Having done this, the author has tried to weave these names together to build a story around these. Some disconnects are obvious, other connects are forced. What results is a drab story. The history of science is fascinating. But introducing someone to this fascinating history with a book like this will only have one result - hatred for the subject. "
13,0300136595,http://goodreads.com/user/show/47569087-samuel-oktavianus,2,"A while ago, I finished reading A Little History of Philosophy and I've been in love with this series ever since. I was looking forward to reading another of this series, so I tried to get my hands on this one. As you can probably tell from the title, this book is about the history of science, starting from the day it was born up until the present era. Just like any little history series, the book is divided into 40 chapters, and each chapter has its own unique topics. This may sound very long, but each chapter only contains 4-5pages max—not too long or not too short. As I said earlier, the book covers everything about the history of science, from astronomy to medicine to quantum physics. I also admire the linocut-style illustration at the beginning of each chapter.This book can be too dull for some people who already know the basics of science history. Each chapter introduces a new concept very quickly at an almost repeatable pattern, to a point where it becomes super repetitive. I also feel like much of the chapter is dedicated to the history of medicine, and it would be great for every topics to be balanced equally."
14,0300136595,http://goodreads.com/user/show/56722053-bander,4,"An Amazing historically ordered and well written introduction to science.In 30 chapters, the author tells the story of the development of science over the years. Unlike Gribbin's book  Almost Everyone's Guide to Science: The Universe, Life and Everything, the author explains the scientific facts in a way that's easier to grasp, but not detailed enough. It's not a fault given the purpose of this book. There were chapters on medicine and physicians that I really liked. I found the author digresses occasionally but he soon returns to the original idea. I am planning to read a medical book of his edition, Great Discoveries in Medicine.Bottom line: I highly recommend it to everyone."
15,0300136595,http://goodreads.com/user/show/63434769-heather-gmiterek,5,"I really enjoyed this book. My high school education left me with some sizeable gaps; science being one of the larger gaping holes. I feel as though I could track along with a scientific conversation after this book. I may even ""get"" a few more of the jokes on Big Bang Theory now! The chapters were short and concise, easily understandable and peppered with interesting bits of history and personal quirks from each scientist it covered. This book would be great for a jr high student on up. "
16,0300136595,http://goodreads.com/user/show/70007805-katrina,3,"This was a pretty good, brief overview of science history, though it was sprinkled with inaccurate claims about the ""facts"" of evolution. I get so frustrated by these lame attempts to twist science to fit the scientists agenda, when evolution is so obviously false. Right after admiring our ""clockwork universe"", the author goes on to talk about the Big Bang, which is the exact opposite of order. Despite all that, I did really enjoy the actual historical scientific parts of this book. It's worth the read, as long as you skip a couple of chapters... :P"
17,0300136595,http://goodreads.com/user/show/29836626-richard-stableford,5,"Does what it says on the tin, giving a clear history of all aspects of science, who was involved, what their ideas were and how they developed. I admit I am more a arts person then a science person but understood most of what was been explained, be it in varying degrees. His style seems to be aimed at teens, and may come over as patronising to some, but I found it helpful, especially his definitions of technical terms."
18,0300136595,http://goodreads.com/user/show/30094785-alexis-kaelin,3,"Felt like a fleshed-out chronological line. It had all the relevant information, but when you try to just give the bare minimum, you lose all the fun details that make history interesting. I suppose if you know nothing about the history of science, it could be a good starting point to see where you interest lies to read more. However, it is so dry that it might turn some people off, which is a worry."
19,0300136595,http://goodreads.com/user/show/17357312-elizabeth-grieve,4,"Enjoyable history of science, aimed at readers of all ages apparently, but I would say perhaps better for children. My nephews, aged 13 and 11, both read and enjoyed it. It's really quite an achievement to distil such a huge topic into one book, and I think the author has done a good job here. Review of a digital copy from the publisher."
20,0300136595,http://goodreads.com/user/show/8193941-stephania,5,"Absolutely fantastic!!! If you are interested not only in science but also in the build-up of the knowledge that we have acquired, this is the perfect book. From the Babylonians to the WWW, this book does not only provide valuable (and referenced) information but it also works as a kick-off to learn many interesting facts of science and those who made and still make it possible."
21,0300136595,http://goodreads.com/user/show/7376960-lyn,2,"This book was a marathon that I considered not finishing. It was too dense to be read like a novel. Instead, it should be something read chapter by chapter over the course of a longer period. It also should be read by someone perhaps with less scientific knowledge. I didn’t learn anything new from it but was reminded of findings I had learned previously in school. "
22,0300136595,http://goodreads.com/user/show/19650834-odin,4,"Not quite as well-written as the other ""Little History"" books I've read so-far (The World, The United States) but definitely as informative as I've come to expect from the series. Especially helpful for kids (ages 10 and up would be my recommendation) and anyone else who is looking to explore the history of science in a general-yet-memorable manner. "
23,0300136595,http://goodreads.com/user/show/13865474-ami-steiner,5,"One of the best books for the curious, non-professional, scientists. A brief and very informative review of the major breakthroughs in Science. If you want to chose only one book to understand what science is all about, and what science achieved from ancient times until today - this is the book to read."
24,0300136595,http://goodreads.com/user/show/71327447-mike,3,"3.5 stars.A decent overview written in a breezy manner. I understand that this is an inherent problem in a ""little history"", but much of the information is so high level as to provide little actually insight into the concepts at play. Bryson's A Short History of Nearly Everything is a much better attempt at this sort of thing, though it is much longer."
25,0300136595,http://goodreads.com/user/show/110040125-stephen-lockett,4,From Ancient times to the current Genome Project Bynum takes us through the key scientific developments and the major players concerned. Each chapter covers a scientific topic in chronological order in layman’s terms allowing the reader to get an overview of how the human race’s body of scientific knowledge came about. 
26,0300136595,http://goodreads.com/user/show/84978882-carrie-d-angelo,3,"I'm a first year biology major so some of the stuff wasn't anything new to me but there were points when I was like, ""wow! I didn't know that at all! That's really interesting!"" Definitely would recommend as it's nice to listen to in the background (listened to audiobook) while doing laundry and stuff."
27,0300136595,http://goodreads.com/user/show/31110387-phil-curtis,2,"This book is a good general overview of science, however does get some of the modern physics wrong (he mentions light having mass which is not true). It never really drives into any details just names drops and skims over the basics. Not bad if you really don't know much about science but I'm sure there are better."
28,0300136595,http://goodreads.com/user/show/14269463-suha-alharbi,5,"Really good book for people who want to know the scientists and the discoveries they did throughout history. Small book but contains loads of precious information in physics, medicine, chemistry, space, geography, biology. "
29,0300136595,http://goodreads.com/user/show/51442357-albin-p-james,4,A short but intriguing walk through the history of science and it's pioneers. A recommended book for those not well versed in scientific ideas but want to know how it all happened. High highly recommend everyone to read it to get a feel of how science shaped our modern world.
30,0300136595,http://goodreads.com/user/show/12867613-diana-turner,5,"This is such an interesting history. I not only liked hearing about the different developments in math, chemistry, physics, medicine, etc. It was a history of vocabulary. A great book for someone who has studied some math and science."
31,0300136595,http://goodreads.com/user/show/22096390-chad-bunch,4,"Short and sweet. Full of interesting tidbits in short segments. Most of this science I had already learned and/or was familiar with, but some of it was new and good to hear. "
32,0300136595,http://goodreads.com/user/show/7787950-nicolle,3,"It was a little difficult to stay focused on this one, but it was fun to relive my grade school science education again. Not a particularly compelling read, but not a waste of your time, either. "
33,0300136595,http://goodreads.com/user/show/51228233-angela-puc,4,It's a pretty good summary of all the tech and scientific research that we had been through as humanity. 
34,0300136595,http://goodreads.com/user/show/22586474-burke-squires,3,Decent book but authors anti-religious bias ruined it for me.
35,0300136595,http://goodreads.com/user/show/68115099-jelfia,5,"Listen to the audio book, really enjoyed this. there was a few parts that seem disjointed. "
36,0300136595,http://goodreads.com/user/show/97807191-dalal,0,Didn't finish 
37,0300136595,http://goodreads.com/user/show/29968399-chris,4,Like other “a little history of..” books this one is a good intro to the topic and introduced key people and events contributing to the progress of science.
38,0300136595,http://goodreads.com/user/show/90665684-thanasis-oikonomou,4,A good summary about scientific discoveries and inventions around the world since the ancient years.
39,0300136595,http://goodreads.com/user/show/97514322-sparrowhawk,5,"Honestly,this is one of the books that I could read a thousand times again!Absolutely amazing🙌💫"
