,isbn,user_link,ranking,review
129,0486256642,http://goodreads.com/user/show/45669105-toby,5," This is quite possibly the greatest popular science book ever written. The author, George Gamow, must have been an incredibly knowledgeable scientist, as well as an excellent teacher and communicator. Certainly its one of my personal favourites.  The book's whimsical writing is engaging, as you're taken on explorations into the 4th dimension, into the atomic realm, into the world of genetics, and even back to the days of creation. The topics covered are impressive for such a small book, and they were chosen it seems because they deal with a few of the most profound questions a scientist can ask. What is most important, is that the author does not list off facts or expound theory like many science books do, he takes readers on a journey to investigate these questions, which is what science is really about: observing what you can't normally observe and piecing together a puzzle. It encourages actively and attentively thinking in joining him on his journey, rather than passively reading descriptions. While the facts presented are totally intriguing anyway, its the way that they are explored that the book handles best as it guides you through various steps in understanding our natural world through science. The reader can take away from this book how scientific questions are generated, how hypotheses are created and evaluated, how analysis of observations are done and how conclusions are drawn, even though this book never really explains a scientific method. The book masterfully presents the world through the lens of science and encourages readers to gain this new perspective. You end the book not having absorbed pointless information, but equipped with a new outlook on nature and the encouragement and means to apply it. The way this is written is such an effective way to communicate and to learn science, as Gamow firmly places imagination at the center of this journey. I certainly appreciated this as a young reader learning these interesting concepts for the first time. He puts forth some of the most interesting questions, explores the most perplexing territories, elucidates the facts, thoroughly explain concepts to the lay-person and speculates on what they mean in the grand scheme of things. He anticipates the wondering of the reader and will go on funny yet totally meaningful and relevant tangents to further enhance the reader's understanding of new ideas. He guides you through wonderful examples and ingenious thought experiments to reinforce the learning you do. For example, I particularly loved his comparison of the atomic nucleus to fluid, and nuclear forces to surface tension. He used a hilarious thought experiment to demonstrate the strength of ""nuclear fluid"" forces, saying that it could support the mass of Jupiter's satellite ""Demeter"" under the gravitational field of earth before its surface tension would give in and let go of a surface. That to me is both ingenious and hilarious. Who would think of such wild experiments? How fantastic this book is for someone learning the language and the facts of science. It teaches them not only the facts, but encourages creative and critical thinking. The book is now quite old, which may lead many to assume it is out-dated. I would argue that this book is actually pretty timeless. Everything written in it is still true, but with how far science has come, you are not getting the full picture any longer. There have been new subatomic particles discovered like the Higgs Boson, gravitational waves detected, advances in genetics and new developments to the theory of the big bang. Not to mention science faces new conundrums, like what dark matter is made of, what caused cosmic inflation, and how cancer can be cured. The author would have been delighted to include these new facts and questions, that would only further support the ideas he originally expressed. But unfortunately this is the only thing that might be a tiny bit of a drag for the reader. That being said, this book is meant to be a starting point for scientific thinking, meant for adults not equipped in the literacy of science but starting to wonder about what it has to say, teenagers just developing an interest, even kids starting to ask the bigger questions... Because it is meant to be a launching point into the world of science, it is still highly readable and relevant, and it achieves this goal with great success, despite not engaging with the newest of breakthroughs. It works a lot like a science class, though lacking in environment and inquiry experiences, and maybe covering more advanced topics than your high school classes, it can still be great in preparing the reader for encounters with further scientific studies. Once read, the reader is equipped with scientific knowledge to move on to the more cutting-edge stuff. What is most important about the book is not simply the facts however, but the emphasis on creative and critical thinking in investigating scientific concepts. I love the book for this reason. I have recently re-read it now that I have started to teach grade 9-12 science and physics in schools and have found it inspiring once again. "
130,0486256642,http://goodreads.com/user/show/56638259-prashant-ramesh,5,"Changed the way I think about numbers, physics, the universe. One of the best scientific works I've ever encountered."
131,0486256642,http://goodreads.com/user/show/32350020-stanley-daugherty,4,First book I ever bought with my own money. I read it and have since given it to my granddaughter who teaches high school mathematics.
132,0486256642,http://goodreads.com/user/show/808220-alexander-temerev,4,A great book offering some great insight in mathematical physics and scientific thinking for a wide audience. I wish I had read it as a child.
133,0486256642,http://goodreads.com/user/show/69619746-bill-bowne,3,"Read it long, long ago, when the science in it was still pretty current. One of the books that gave me a good start on a career in science."
134,0486256642,http://goodreads.com/user/show/63804580-arno-mosikyan,4,"A bit outdated in some sections, but still a nice read for a general reader."
135,0486256642,http://goodreads.com/user/show/7265617-katharine-rudzitis,5,"Charming and informative for a broad swath of science and mathematical concepts, plus great illustrations! Read this and The Knowledge. "
136,0486256642,http://goodreads.com/user/show/79800322-oliver-norman,4,"Rather outdated in places of course, but still a fun read. Interesting to read popular science from over half a century ago and see what tickled the mind and imagination."
137,0486256642,http://goodreads.com/user/show/91742912-fatima,4,It is full of truly smart pieces of information shaped in funny style that urges you to engage in this amazing trip where science and math intersects at their infinities.. ❤
138,0486256642,http://goodreads.com/user/show/106866640-void-sky,3,"Really liked the first half of the book. Especially part about relativity. Second half was not so interesting, at least for me. For some one it might be opposite. "
139,0486256642,http://goodreads.com/user/show/21278268-dirk-nachbar,5,"very accessible, Gamow was one of the few that still knew ""all of science"""
140,0486256642,http://goodreads.com/user/show/110072261-dave,4,"A bit dated, but still quite good Gamov writes with a nice sense of humor."
141,0486256642,http://goodreads.com/user/show/26553336-incanus,5,"A popular science book that covers a wide range of topics, starting from atoms and molecules, chemistry, genetics and ending with cosmology and the origin of the universe. George Gamow is a great teacher and he writes in a very accessible way with good examples. Even though it is written in the middle of 20th century, this is still a gem of popular science literature."
142,0486256642,http://goodreads.com/user/show/72283006-mario,3,"Interesting book, specially the mathematical part. I think it must have been an awesome book for it's date, but It is a bit outdated if you read it now."
143,0486256642,http://goodreads.com/user/show/4983189-priyadarshini-sur,0,"Though mathematics is not my cup of tea, I picked a book on mathematics’ ‘One two three.Infinity,’subtitled Facts and speculations of science by George Gamow .The book was originally written in 1947 and then revised in 1961. It's an amazing tour of some interesting bits of physics, mathematics , biology and about birth of planets, in under 350 pages.I read and re-read several times the chapters on mathematics and physics and marked the particularly interesting sections. The book opens with a discussion of mathematics, specifically very large numbers, with two examples of the power of exponential growth, Gamow mentions that arithmetic made easy ‘was not known in ancient times. In fact it was invented less than two thousand years ago by an Indian Mathematician. The book opens with a discussion of mathematics, specifically very large numbers, with two examples of the power of exponential growth The first is about a vizier who (in legend) invented the game of chess. When told by a king that he could have any reward he wished, he asked for one grain of wheat for the first square of a chessboard, two for the second, four for the third, and so forth. The king happily agreed, only to discover that the total amount of wheat would be more than the entire world's wheat production for two thousand years. The second is a legend of a temple in Varanasi containing a game of with 64 disks which, when complete, will mean the end of the world. At a move per second, this would take significantly longer than the estimated age of the universe Gamow mentions that ’arithmetic made easy ‘was not known in ancient times. In fact it was invented less than two thousand years ago by an Indian Mathematician.One Two Three... Infinity is full of stories like that, and charming examples of whatever point Gamow is discussing, all illustrated with wonderful and often whimsical line drawings by the author .I liked he chapters on ‘Dimensions and Co-ordinates ‘and ‘Time is the fourth dimension .As the book was last revised in !961 and Gamow died in 1968,the book is not updated as far as physics and biology are concerned. However the sections on mathematics hold up the best, and I will recommend Gamow's explanations of imaginary numbers and infinities to anyone."
144,0486256642,http://goodreads.com/user/show/10361209-dan-downing,5,"We who find gratification in the written word usually have a few books which repay re-reading every decade or two. Maybe Homer, or Greene, or Hegel or Flemming; perhaps Joyce or Fitzgerald or Melville or Bronte. Certainly scads of poets, a scattering of playwrights and for some readers those who wrote in technical fields: Carson or Darwin or Hawking or the present author, George Gamow.My copy of this title dates from 1959. I probably worked through it in 1960, maybe '61. It was in 1961 that a revised edition was published. Apparently, it is still in print and perhaps another revision has been made. In any event, the first time it was published was 1949: some things have changed since them.But some things have not changed. For a reader unfamiliar with today's basic concepts in math, genetics, cosmology and relativity, Gamow's work may be enjoyed and will yield great dividends so long as its limits are kept in mind. For the seeker who is cognizant of today's science, Gamow's occasionally whimsical and always understandable work may well re-root today's' savant in the uncertainties which still exist, even though we often fool ourselves into believing we know all the answers.His adventures in arithmetic and mathematics and probability still amuse and still hold up; the sections on cosmology and physics reveal the enormous amount of work done in the 70 or so years since the writing. Indeed, some reflection may lead one to realize we have learned more since the book was written than in all of history leading up to it. But that means that the hardcore fundamentals are discussed here. Georg Mendel's work was lost until about 1900; what was learned between then and 1946 astounded the world. But what came after the developments of the 1950s makes everything before pale. We can get a feel for that here in the pleasant company of George Gamow.With the caveats mentioned,Highly Recommended.Highly Recommended "
145,0486256642,http://goodreads.com/user/show/22844409-bishop,4,"Late 1940s layperson-targeted survey of the (1940s) scientific frontier, especially atomic physics, astrophysics, and chemistry, and starts with some awesome topics in set theory and number theory.I always remembered this book for its fantastic introduction to how there are differently sized infinities (Cantor's diagonal counting thing) but never got much beyond that I think because I first tried to read it in elementary school and it was too dense for me. But now I finally read the rest and found it pretty good too, and still worth reading as a general science refresher despite being 70-year old science. The cosmology stuff seems to be the most dated as far as I could tell, but even there it's become dated in an interesting way. Apparently in the 40s the big bang was thought to have started about 10 billion years ago and in the earliest known moments of the universe it was thought to have been a few sun-diameters across. It's interesting how more study has gradually deepened time (it's 13.8 billion years now) and shrunk the initial state down smaller and smaller (it's like an infinitesimal point, or possibly an infinitely large but infinitely dense expanse now) over the decades.I would love to find a present-day equivalent of this book, but I'm not sure there is one this good. I've got Penrose's titanic Road to Reality waiting in the wings but I don't know if I'll ever find the hundreds of hours necessary to tackle that beast until maybe after I retire."
146,0486256642,http://goodreads.com/user/show/10557154-tommy-carlson,4,"The Curve of Binding Energy makes many a reference to Gamow, including this non-fiction gem from 1947. It's a look at science covering a wide range from numbers themselves, hence the title, to the physical world from micro to macro scales. It's enhanced by illustrative drawings by Gamow himself, which are delightful.What I really loved about the book is that it's from an era far removed from my childhood. If you read enough science non-fiction, you get used to certain analogies being used to describe various things. This book far pre-dates anything I've read before on the subject. So the descriptions are new and novel to my eyes.It's also entertaining to see where future developments show him to be wrong. Some are technical, for example, the wrong hydrogen to helium fusion reaction for the sun. Some are more, well, almost philosophical. Gamow argues that protons and neutrons may well be the indivisible building blocks of nature. (Quarks don't show up until the 60s.)This probably isn't the book for a layperson looking to learn about science stuff. Rather, it's a book for the casual science fan who wants to see how science looked from the viewpoint of an earlier era."
147,0486256642,http://goodreads.com/user/show/30566360-aparajita-raychaudhury,4,"I would rate this book at 4.5.I love the idea of this book. Every popular science book I've ever read has usually been on a particular topic (like String Theory) or theme (like Cosmology). This is a book that picks 'The most interesting areas of current Science' and then goes ahead and explains it in a beautiful manner. It encompasses Physics, Chemistry, Biology, Geology and even some parts History. It's the best gift to encourage a curious child to explore more.Though some of the information is painfully dated, that itself makes the book interesting. I've always been fascinated about how Science changes it's mind (based on evidence), so it's immensely enjoyable to look up the latest information on topics I read here.The language is pretty accessible and the author's sense of humor is awesome. I chuckled out loud a few times even while reading on organic chemistry, and that's saying something given it my least favorite topic in high school.However the book's not perfect. Especially the last 'unit' (Macrocosm) felt hurried and curtailed, with too many 'read my other books' footnotes. So while I won't give this five stars, I would heartily recommend everyone to read it. Preferably in middle school. You would be hard pressed to find a better introduction to Science."
148,0486256642,http://goodreads.com/user/show/10329028-gary,4,"Great book. To be completely honest, I haven't read the whole thing. I pick it up and put it down again, depending on my mood. The first chapters about numbers and how we learned to count were GREAT. Especially the section on the different sizes of infinity. Clearly explained and fun to think about. Some of it seems a bit dated, and that is perfectly ok. For a science book to be this old and still in print is a testament to how good it is. It is a fun book, and it has pictures. I like books with pictures.The only reason I haven't finished it yet is I'll get caught up reading another book- or actually a couple different books at the same time, and I've managed to finish a few others before finishing this one. I have a goal of finishing all the books I currently own before buying a new one, but I've recently discovered Richard Feynman so those plans might fall apart."
149,0486256642,http://goodreads.com/user/show/33450469-nickdepenpan123,4,"It seems that this book inspired many young people (of the not so young past) to find out more about science or become scientists. And I can see why, it's well written, nicely organized and very informative.Science books get old fast, yet I read this sixty years after its first publication, and I find it better than other more modern books in similar topics.The style may be a bit dated, and some theories have been proven wrong (for example, the shape of the universe) but topics on relativity, quantum physics, non-Euclidean geometry, apparatus and major physics experiments are explained in a simple manner, yet without insulting the intelligence of the reader.The basic mathematics/calculus/geometry/statistics in the book always tie with issues in physics and how the universe works. Some parts may need a bit of concentration and rereading but no previous knowledge is assumed."
150,0486256642,http://goodreads.com/user/show/83744770-weiyong-xu,5,"This is a very interesting book which covers many important areas in science. Although some parts are a little out-dated now (e.g. Genetics), but we need to consider that at the time when the book was written, physics was the most exciting subject of science and the structrue of DNA had not be discovered yet. It makes me think how small and short our human life is, compared to the history and size of the Universe. Yet, it was definitely a miracle that we were able to read this book and understand so much about ourselves and the world. Science is so fascinating!"
151,0486256642,http://goodreads.com/user/show/20733235-hassan-rezaee,4,"This is a very good book, and is definitely worth reading, especially the chapter on dimensions, and the space-time is very well explained with easy to understand examples of real life. The book being written in 1988 has not been updated for some rather radical discoveries. For example, the Fermat’s Last Theorem was yet to be proved with Andrew Wiles, or at the time the life of sun was estimated 50 billion years!"
152,0486256642,http://goodreads.com/user/show/64423543-juan-meurrens,5,"Excellent read for anyone interested in physics, maths and philosophy.A comprehensible description of topics that are so counter-intuitive that they become almost impossible to talk about, mainly as a consequence of the inability of language as it currently is, to properly classify them.Luckily the book has lots of drawings and schema's to accompany those interesting concepts.It well shed a light on things you thought you understood, but turn out you don't.Would highly recommend!"
153,0486256642,http://goodreads.com/user/show/5935582-dan-cohen,4,"I wish I had written my review sooner after reading the book! I remember it was consistently entertaining and informative. Some of the science is a little out of date, of course, but the presentation and ideas (both mathematical and scientific) is excellent. The drawings are funny and the writing is engaging."
154,0486256642,http://goodreads.com/user/show/20304722-ilib4kids,0,"500 GAMI come upon this book, while I am writing my book about the place-value system.According to Wikipedia.It was written by theoretical physicist George Gamow, first published in 1947, exploring some fundamental concepts in mathematics and science, but written at a level understandable by middle school students up through ""intelligent layman"" adults."
155,0486256642,http://goodreads.com/user/show/90667692-albert,2,"This is an emotional review and not a rational one. The book uses the ridiculously archaic imperial system of measurements, so feet and miles etc. instead of the beauty of SI units based on meters. I got so sick of this imperial system of units that I stopped reading. This is supposed to be a book about science! "
156,0486256642,http://goodreads.com/user/show/35461072-rayfes-mondal,4,You wouldn't think a book from 1947 on physics would be interesting today but he covers much more than just physics and cosmology. I knew plants take in CO2 and produce oxygen but I didn't think about how most of the plant itself is actually produced from the carbon in that CO2 so it's literally making itself out of air. Neat!
157,0486256642,http://goodreads.com/user/show/7390635-serdar,4,"Fun science primer, a little dated in some respects, but some of the most enjoyable parts (like the discussion of mathematical infinities, plural) are timeless. Gamow has many other books in this vein. all enjoyable. Could be considered a predecessor of Carl Sagan's ""Cosmos""."
158,0486256642,http://goodreads.com/user/show/2232682-stephen,4,"Good book though a bit dated. The sections on genetics and subatomic physics have clearly seen developments that this book, printed in 1974, did not cover. The author's style is good and pedagogical; however, I enjoyed his book 'Gravity' more than this one."
