,isbn,user_link,ranking,review
0,0393308189,http://goodreads.com/user/show/1711431-eric-w,4," Note: I wrote this review sometime before Gould's death. How does one write about a book of essays? Ever Since Darwin is a collection of essays drawn from Natural History magazine for which Gould wrote a monthly column entitled ""This View of Life."" While not especially easy reading, all the essays provide an intellectual delight that make them well worth the effort. A common thread running through all is the wonder and amazement Gould has for the extraordinary variation and adaptability of nature. One can see in these essays the development of ideas more fully defined in Wonderful Life The Burgess Shale and the Nature of History  His examples are most absorbing and occasionally bizarre. He explains how the tiny gall midge reproduces in two ways: either normally from eggs as sexually reproducing flies; or without the aid of a father, i.e., via parthenogenesis, otherwise known as virgin birth. When food is abundant (midges feed primarily on mushrooms) the young grow in the mother's body feeding on her flesh. After she has been consumed they emerge and within two days their own children begin to feed off the parent. This matricide which at first glance might appear somewhat foolish is not just a disgusting freak of nature. As Gould points out, in light of evolutionary theory, the behavior is truly efficient and adaptive. As long as food is plentiful reproduction remains parthenogenetic. As food inevitably becomes scarcer the flies reproduce normally (hate to use the word normal in this context) at which point they can fly and scout out new food sources. ""The flightless parthenogenic female stays on the mushroom and feeds. When it exhausts its resources it produces winged descendants to find new mushrooms."" This still does not answer the question of why matricide? Gould explains better than I (read the essay entitled ""Why should a fly eat its mother?;"" but, basically it has to do with adaptability to environments which impose irregular catastrophic mortality (fairly common in nature,) or where food sources are hard to find but abundant when located. The best adaptability is to ""reproduce like hell while you have the ephemeral resource, for it will not last long and some of your progeny must survive to find the next one."" Whether this lesson should be applied to Man I will not hazard a guess.Gould recognizes the social and cultural influences of the scientific imagination. Theories, at their best, should free us from our prejudices, at their worst they support the biases of their creators (witness Wolcott and his misinterpretation of the Burgess Shale), illustrated also in the attempts to find parallels between individual development and evolutionary history. (Gould has another book Ontoqeny and Phyloqeny dealing with just this issue which I have not yet read, but will soon?) Gould is very skeptical of biological determinism. (At a recent conference I witnessed E.O. Wilson, author of Sociobiology The New Synthesis, Twenty-fifth Anniversary Edition , a proponent of biological determinism, and Gould argue these points, much to the fascination of the audience. Gould argues for biological potentiality.) Biological determinism has become popular in Gould's mind because it allows us to escape responsibility, e.g. the homeless are inevitably thus because they inherited the wrong genes; we can fob off responsibility for war to man's inherent aggressiveness rather than to blame the political structures we have created. Several essays deal with just such issues. Obviously I have not come close to doing justice to this richly diverse and fascinating collection of essays. Read the book, I guarantee you will be fascinated."
1,0393308189,http://goodreads.com/user/show/8360313-nathan,3,"If there's an overarching theme in these fascinating essays it's that scientists (and science) are just as vulnerable to political and social bias as everyone else, and we should be skeptical of claims that the scientific ""facts"" support a given political or social view. Unfortunately, in my reading, the author seems concerned with this misuse of science only when it's in support of philosophical ideals that he does not share. While he presents his own view as enlightenedly multifarious, it comes across more as an argument for the other extreme, only from a defensive position. Here's an example:I do not claim that intelligence, however defined, has no genetic basis—I regard it as trivially true, uninteresting, and unimportant that it does.In a book where there is no detail too small to inspire impassioned debate, a notion suddenly becomes ""trivial, uninteresting, and unimportant,"" the moment it doesn't directly bolster the author's egalitarian social views or may come to an uncomfortable conclusion.He goes on to claim,Our job is simply to provide the best environmental situation for the realization of valued potential in all individuals.Our job? As scientists? As human beings? It's unfortunate that an otherwise astute book that cautions against being too eager to derive philosophical conclusions from mere facts contains a smattering of political statements derived from nothing at all. It's as if the author seeks to bolster his well-meaning social ideals, not by finding support for them, but by arguing the fallibility of science proper."
2,0393308189,http://goodreads.com/user/show/3049744-daniel-gon-alves,4,"In this collection of scientific essays, Stephen Jay Gould promises to shine a light on Darwin’s dangerous and revolutionary idea, whilst informing the reader – in a comprehensive and adequate prose – about the new advancements in the field. The writing is lucid and compelling. The subjects are varied and detailed. And while it presents the reader with data and information about the various ideas floating around in the scientific community, it never asserts anything: the reader has to make their own conclusions. After all, that might be the ultimate purpose of a good essayist. Many people acknowledge Charles Darwin as the most brilliant scientist of all time. In 1859, he proposed a theory that would soon alter the perception of life on planet Earth. Until the 19th century, nobody had a conclusive scientific answer. For all purposes, all species on Earth had been created at a single moment in time by a divine entity. And although there are some who still hold their faith in that specious premise, today it is no longer a plausible idea. In essence, the evidence for evolution is abundant. More than a hundred years later, a lot of momentous events occurred: scientist discovered genetics, and fossil evidence was unearthed from the ground. There was a lot that Darwin did not know. That did not stop him from devising the most important theory in all biology."
3,0393308189,http://goodreads.com/user/show/47352429-santiago-hernandez,4,"“Ever Since Darwin” overall is a great read and is a great way to immerse yourself in the world of evolution. In this book, Dr. Stephen Jay Gould tackles various topics that fall within the realm of evolution, the history of evolution as a field of science, and even the biological arguments against racism and human nature.As stated before, this is a great book for further exposing yourself to the concept of evolution and the information surrounding it. Dr. Gould presents various cases from human evolution to the literal exploration of the evolution of life. In addition to this topic, Dr. Gould touches upon some of the history behind evolution starting with Charles Darwin himself and ending with the way natural selection was used to justify various outrages points of view.One of the largest issues, in my opinion, that this book makes an effort to fight is racism and it in no sense of the word fails. Dr. Gould uses a variety of information from the field of Biology to prove to the reader that scientifically humans are but one species and cannot be logically separated into different groups.All the way to the end, Dr. Gould’s “Ever Since Darwin” bombards the reader with information pertaining to evolution and ultimately shows her/him how far it’s come as a field. If there’s one thing I should point out, it’s that this book can prove to be quite hard to read at times with all the scientific jargon that it contains, and so I recommend that any reader should read this book (in order to get the most out of it) in a setting where they aren't pressured to read it by a certain deadline. Take the book in little by little and I’m sure that Dr. Gould’s prose will at least impart something interesting and worthwhile to your internal data bank."
4,0393308189,http://goodreads.com/user/show/822721-clare-bell,5,"Stephen J. Gould was a treasure of a science writer, who left us far too early, in 2003. Ever since I stumbled across his column in Natural History Magazine, I've been an avid Gould reader. This is his first collection of the Natural History columns, and, although not as brilliant as his later works, contains the promise that emerged in The Panda's Thumb, The Flamingo's Smile, and others. Even so, by itself, it is amazing. Gould's work has definitely shaped my view of evolution and biology. Many times I thought of sending him a copy of my fiction about how a society of sapient large cats might develop, but I waited until too late. He has delighted and enlightened me over the years, and his books have a place of honor on my ""keeper"" shelf. I re-read them constantly."
5,0393308189,http://goodreads.com/user/show/59510944-anima,5,"I very much enjoyed reading this collection of unique essays which explores, from a geologists’ point of view, few scientific theories that were popular about 40 years ago. All 33 essays are awesome. Essays number 6 (about 'ladder' vs 'bushes' ) and 9 (about Irish Elk) caught my attention with few things that I've never heard about. In essay number 6, ‘ Bushes and Ladders in Human Evolution’, Gould rejects the “ladder” representation of the human evolution from 'Australopithecus africanus' to 'Homo sapiens' introducing the “bush metaphor” saying that species did not “morphed” into the next one but rather “overlapped in time”-“In this paradigm, speciation – the formation of new species – occurs by branching off from the ancestral stock, while the ancestors continue on. The details of the process are fuzzy, but proponents argue that it almost always occurs in small, isolated populations … in marginal environments …”Essay number 9,’ The Misnamed, Mistreated, and Misunderstood Irish Elk’ evolves around the extinct Irish Elk known for its super-sized antlers –about 12 feet across a pair. Some scientists were supporting the idea that the antlers were increasing in size ‘ generation after generation’ and because very big antlers would have impeded eventually the Elk's overall function, the species disappeared. Trying to find out if it there is evidence for the ‘allometric’ correlation, Gould gathered specimens, did the measurements , and discovered that antlers were increasing “about two and a half times faster than the rest of the deer.” “ In spite of this apparent success, Gould remained dissatisfied. Can we really know that the giant antlers offer no selective advantage?, he asks rhetorically. Darwin …speculated that larger antlers might serve a role in sexual selection (“selected” as attractive by the female), rather than as better armament against predators or rivals. Another possibility, Gould suggests, is that they were used against rivals in “ritual combat” rather than literal combat; … In either case, we cannot dismiss the possibility that the antlers drove the size of the deer, rather than vice versa”"
6,0393308189,http://goodreads.com/user/show/1821338-jake,3,"Solid introduction to Gould's perspective on evolution and other issues in modern science. The essays were written in the late 1970s, but they still feel current-- I especially enjoyed his meditations on the Irish Elk, the role of size in evolutionary development, and the shakeup caused by the discovery of plate tectonics in the late 1960s. Towards the end of the book he gets a little hung up on his politics-- as an enlightened highly liberal humanist, he has little time or sympathy for scientists who distort the facts to match their conservative/racist/classist/sexist ideologies. That whole series of essays is praiseworthy and impossible to disagree with, but in the age of Obama, it feels a little bit dated and strident. And after reading ten essays where Gould assails the impact of conservative politics on science, even the most liberal reader has got to wonder: in what ways did Gould's own liberal bent bias his results?"
7,0393308189,http://goodreads.com/user/show/659760-john-miller,5,"a lot... makes science very enjoyable and readable without dumbing it down one bit, but just by eliminating jargon. puts science in its social context, and ties it in with other fields of life and learning. also compares general phenomenon in evolution as a system to other types of systems.. .. .Must read one of his books!"
8,0393308189,http://goodreads.com/user/show/92136859-dany,4,"""In the conventional model of scientific ""progress,"" we begin in superstitious ignorance and move toward final truth by the successive accumulation of facts. In this smug perspective, the history of science contains little more than anecdotal interest–for it can only chronical past errors and credit the bricklayer for discerning glimpses of final truth. It is as transparent as an old-fashioned melodrama: truth (as we perceive it today) is the only arbiter and the world of past scientists is divided into good guys who were right and bad guys who were wrong."""
9,0393308189,http://goodreads.com/user/show/6903379-reid,4,"What can I say? Pretty fascinating in parts, it seems dated and alive at the same time. I'm familiar with some of the basics, which probably prevented me from being enthralled, but he is definitely a very good essayist with a broad liberal viewpoint, which I appreciated. I definitely want to read more of his books, I should have read them long ago.Some personal highlights:Was strange when he mentioned that plate tectonics was a fairly new theory, within the last 10 years of his writing, in '75 and '76, because although I learned about continental drift, it seemed like no time had passed when I learned of tectonics in school as well. At the time I had no idea it was a new theory.I knew Darwin was not nearly the first to theorize about evolution, but he was about the only one that didn't rely on an ultimate supernatural force for the mechanism - more than half of the reason he was revolutionary was because of his ""uncompromising philosophical materialism."" I guess I take that for granted. Which is why I also got a big laugh out of Gould's opening sentence of Chapter 10: ""Since man created God in his own image..."" I said the same thing in my freshman college class of the politics of underdevelopment. For some reason God came up and I offered an opposing view, saying the very same thing as Gould. It was a conversation stopper.Most fascinating in a sci fi way was his chapter on size, growth, and the increasing ratio of volume to surface size, and then takes you through the absurdities of some sci fi movies, like the giant ant movie Them and the tiny human movie, what, The Incredible Shrinking Man, and how many of the actions would be impossible. For example, with a human the size of an ant, s/he could not overcome surface adhesion forces, so could never remove an article of clothing; or how the smallest drop of water from a ""shower"" would likely kill you. Related to evolution, he mentions that a human half our size couldn't wield a weapon with enough force to take down a large animal, since kinetic forces shrink with size as well. His main point being that size is a major aspect of evolution, and there are limitations and advantages with most developments of size, one way or the other. Another example is how insects with exoskeletons (and lobsters and crabs) can afford to molt because the surface adhesion forces are greater than gravity's force on them, keeping the creatures in their shape, whereas if we were to molt, gravity would turn us into puddles of goo.Something, by name, I hadn't known - the concept of neoteny (""holding youth"") - how human evolution has included the retardation or slowing down of ""maturation"" in the womb, as compared to other primates. Our brain may grow larger due to retaining rapid fetal growth rates, whereas those rates decrease sooner for other primates. Of course, our ""soft spot"" doesn't fuse until well after birth, and the ends of our digits and long bones are still cartilaginous at birth - that's why baby fingers are so rubbery. One other difference is that other primates ""begin"" with 5 aligned toes, but later the great toes rotate outward to oppose the other toes - luckily that doesn't happen with us, otherwise we'd be walking like orangutans. Perhaps some of the list he includes isn't neoteny, but just basic different evolution? I don't know. Apparently there have been some professional disagreements with some other parts of this book, but nothing earth shattering for most readers. Some of them are mentioned on his Wiki article.Another pretty fascinating chapter is on ""life history strategies"" - how some species, like some cicadas and bamboo have evolved to survive their predators by only reproducing in huge numbers in long primary-numbered years, such as 17 years for some cicadas, and 120 years (!)(ok, doesn't need to be primary) for a certain bamboo! The survival advantage being that no predator or their offspring could possibly align their production numbers to gorge on and wipeout that many offspring at such an ""unpredictable"" timeframe. (Bamboo and cicadas are apparently very very tasty to a lot of animals!)This is probably his most basic and ""beginner"" book, and as such, it's a pretty good intro to one of the best popular science writers to walk the earth. I should mention, too, he's known for criticizing bad science and biased thinking, and he'll often point out our arrogance, folly, and racism, and how even in science the privileged often defend the existing social arrangements. The essays in this book are wide ranging - you're bound to appreciate many of them."
10,0393308189,http://goodreads.com/user/show/971451-marshall,2,"This book explores various topics related to evolution. Darwin pretty much nailed it, and his discoveries are still the foundation of modern biology. However, much has happened since Darwin, and that's what this book discusses. Some of the articles were fairly interesting, like the one about Darwin's friendship with the captain of the H.M.S. Beagle, and how size of body structures influence its shape.I could have done without his politics at the end. He favorably quotes socialists and feminists, such as Friedrich Engles' claim that evolution is all about labor, Ashley Montagu's claim that women are superior to men due to neoteny, and Simone de Beauvoir's claim that human beings have no essence. He complains that some of the early biologists were racist and sexist (big shock, so was everyone else back then). As if the claim that women are biologically superior to men is somehow not sexist. He only seems to like abusing science for political ends if they agree with his views.He detests any claims of biological determinism. His reasoning is that determinists have been wrong in the past, and this can be used to justify prejudice. But here's the thing. This is science. People are wrong all the time in science. It's a self-correcting system. We learn from our mistakes and move on. Just because a claim is unpleasant or abused by bigots does not mean we should refuse to study it, for the simple reason that not understanding nature does not make nature go away. If science is abused by political ideologues, that is the fault of the ideologues, not of the scientists for asking questions about nature.He acknowledges this: ""Of course, no view should be rejected because we dislike its implications. Truth, as we understand it, must be the primary criterion. But the claims of determinists have always turned out to be prejudiced speculation, not ascertained fact."" In other words, we shouldn't bother researching it at all because these claims are just always wrong, period. His only evidence is a couple of anecdotes. But even if he's right that every deterministic hypothesis ever made, ever, has proven false, it was still useful to research it because we learn just as much from disproven hypotheses as proven ones. Disproving hypotheses is not considered a failure in science.He claims that ""the hallmark of humanity is not only in our mental capacity but also our mental flexibility. We have made our world and we can change it."" This is true, and yet that does not mean there can't also be nature that tilts people in certain directions. People can be genetically predisposed, inclined to behave in certain ways, and still choose not to behave in those ways. Sometimes they should choose to go against their nature (e.g. if they're sociopathic) and sometimes they shouldn't (e.g. if they're homosexual). Knowing our genetic predispositions ahead of time allows us to change ourselves and our world for the better.He asks, ""why are we so intrigued by hypotheses about innate disposition? Why do we wish to fob off responsibility for our violence and sexism upon our genes?"" Because that's what biology does. It researches nature. It's about understanding ourselves, not ""fobbing off responsibility."" If there is a biological component to violence, it would be useful to know that. The whole point of biology is to learn about our nature so we can manipulate it to improve our quality of life, and yet he seems to believe that it's all about throwing up our hands and giving up because it's just in our nature.I guess what bugs him is that, in addition to teaching us what we can change, science can also teach us what we can't change, and this is uncomfortable news. For example, we can't fly. We just can't. No amount of ""mental flexibility"" will change that. But by knowing that we can't fly no matter what, we won't waste our time and energy on it. Instead, we can use science in ways we can change. We can discover the laws of aerodynamics, so even though we can't fly, we can build machines that can. Understanding what is in our nature and beyond our control is paradoxically liberating and can lead to wonderful changes.Anyway, those are just a few things at the end that seemed boneheaded. As I said, the rest of the book is quite reasonable and fairly interesting."
11,0393308189,http://goodreads.com/user/show/51838782-lucas,4,Gould is pithy. His understanding is deep enough that he can actually describe evolution to the reader. Not every scientist can move beyond teaching and the constraints of the university. Gould always seemed unbound. He is more similar to Darwin and his coworkers than most students have a right to expect. Reveling in blessed work is enjoyable.
12,0393308189,http://goodreads.com/user/show/13009180-leslie-ann,5,"As a trained biologist, I should be ashamed of waiting this long to read Gould's essays, but better late than never. I appreciated Gould's interpretation of Darwin, his stress on considering the influence of societal and political prejudices on science, and his use of literary and sports metaphors in his prose.Some memorable quotes:I am a strong advocate of the general argument that ""truth"" as preached by scientists often turns out to be no more than prejudice inspired by prevailing social and political beliefs.[A]t its most exciting, [science] reformulates our view of the world by imposing powerful theories against the ancient, anthropomorphic prejudices that we call intuition.Why do we wish to fob off responsibility for our violence and sexism upon our genes? The hallmark of humanity is not only our mental capacity but also our mental flexibility. We have made our world and we can change it.The expression of any trait represents a complex interaction of heredity and environment. Our job is simply to provide the best environmental situation for the realization of valued potential in all individuals.We live with several unpleasant biological truths, death being the most undeniable and ineluctable. If genetic determinism is true, we will learn to live with it as well. But I reiterate my statement that no evidence exists to support it, that the crude versions of past centuries have been conclusively disproved, and that its continued popularity is a function of social prejudice among those who benefit most from the status quo."
13,0393308189,http://goodreads.com/user/show/8418772-victoria,5,"""But a man does not attain the status of Galileo merely because he is persecuted; he must also be right."" Gould's excellent prose and combined essays warn of hubris. Research and conclusions can be tainted by ideology. He reminds us to be aware of our biases and assumptions when crafting studies and interpreting data. Also, a reminder that we are part of the animal kingdom. This collection of essays is well worth your time.""The hallmark of humanity is not only our mental capacity but also our mental flexibility. We have made our world and we can change it."""
