,isbn,user_link,ranking,review
0,0674929810,http://goodreads.com/user/show/1030455-peter-macinnis,5,"Why do people persist in trying to square the circle, trisect the angle, run vehicles on water, build perpetual motion machines, deny evolution or attack vaccination?Aside from being stupid, that is . . . Wolpert's view, with which I agree, is that much of science is counter to our intuition. The world DOES look flat, superficially, the Sun DOES seem to move across the sky.I blame the teachers, but then I would, being an old science teacher. I was lucky enough to chair a lecture that Wolpert gave in Sydney, so I have a personal inscription in mine. It is precious. Lovely bloke, lovely mind!"
1,0674929810,http://goodreads.com/user/show/6228651-ahmad-abdul-rahim,4,"Aku memungut buku ini dari rak, bersama2 dengan Open Society tulisan Popper, sewaktu kemuncak isu gerakan anti-vaksin baru-baru ini. Open Society menekankan tanggungjawab keilmuan dan beban moral seseorang warganegara untuk mempertahankan demokrasi dan menyingkir pemikiran2 dogmatik (seperti kecenderungan skeptisisme terhadap fakta2 yang telahpun mapan dan teruji, dapat kita lihat pada gerakan2 antivaksin) yang bakal membantutkan pengamalan demokrasi yang sihat. Adapun buku ini menceritakan bahawa salah satu sebab sains moden begitu sukar diterima oleh sesetengah sektor di dalam masyarakat adalah kerana cara pemikiran sains tidaklah selari dengan akal budi atau 'common sense' - yakni cara pemikiran yang manusia ramai praktikkan pada kehidupan harian.Buku ini sedikit mengejutkan aku dengan tindakan penulisnya meneroka isu-isu yang jarang disentuh oleh seorang saintis yang berkecimpung aktif dalam bidang kajian saintifik seperti Lewis Wolpert - yang dalam kes ini merupakan pakar bidang embryologi.Bab2 pertama bermula dengan cara tipikal buku2 'Popular Science' mutakhir ini: trivia2 menarik, penemuan2 baru, quote2 dsb.Di sini aku bersetuju dengan idea utama penulis bahawa sains tidaklah begitu 'common sense'. Andaikan kita hidup dalam dunia tanpa pengkaji falak, pengkaji hayat, pengkaji bumi, pengkaji fizik: bagaimana mampu kita cerap daripada pengalaman seharian tentang sifat bumi yang sfera, tabiat pergerakan objek sepertinya konsep inertia atau beza antara velositi dan pecutan, bagaimana zuriat diperolehi, kenapa ada manusia mati tua dan ada yang mati muda...senarai ini terlalu panjang untuk dititipkan satu2.Juga adalah hakikat dimana selama hampir 2500 tahun, sains dan teknologi bukanlah sekutu rapat seperti yang kita saksikan sekarang. Itu satu lagi penggarisan kontras (contrast-distinction) penting yang diingatkan penulis. Penciptaan tenaga stim yang begitu emblematik dengan modeniti umpamanya adalah bermula dengan usaha beberapa generasi jurutera yang beberapa kali cuba dan gagal di dalam percubaan mencipta enjin baru sebelum akhirnya disempurnakan oleh James Watt (1736-1819). Mereka lakukan semua ini dengan pengetahuan saintifik yang hampir sifar di dalam dunia yang baru berjinak2 dengan idea pergerakan Newton (1642-1727). Hanya dengan perkembangan tradisi Wissenschaft di Jerman pada abad ke-18 dan abad ke-19 baharulah perkaitan antara perusahaan ilmiah, kajian dan aplikasi, terikat kemas dan dibangunkan secara sistematik di dalam persekitaran institusi, seperti disaksikan sekarang.Aku rasa bermula dengan bahagian satu pertiga terakhir buku ini baharulah gear perbahasan dinaikkan dengan penulis mula menyerang dan menjawab kritikan demi kritikan terhadap sains moden yang dihadapkan oleh sosiologi dan sejarahwan sains.Kritikan sains sosial terhadap sains moden bernada relativis untuk yang biasa mengikutinya. Sosiologis/sejarahwan mengatakan bahawa saintis terlalu pantas mengandaikan bahawa rumusan2 tentang tabiat alam yang dicapai mereka, menerusi ujikaji demi ujikaji yang bergerak secara falsifikasi, adalah objektif mutlak. Wolpert tidak senang dengan kritikan sebegini.Sebagai peminat sejarah aku sedikit cenderung untuk berpihak kepada hasil analisis dan dapatan oleh sosiologis/sejarahwan. Namun Wolpert memberikan respon yang tidak kurang ampuh: kalau begitu gamaknya kata sosiologis/sejarahwan maka apakah model sains atau cara pandang alam atau kosmologi lain yang mampu hadir sebagai ganti?Wolpert sebutkan disini umpamanya tesis ketiadasetaraan (incommensurability) Kuhn yang mengatakan antara dua paradigma sains, tiada kayu ukur objektif mampu digunakan demi melacak yang mana antara keduanya adalah lebih saintifik. Kedua-dua mereka, contohnya mekanik klasikal Newton jika dibandingkan kuantum fizik Planck atau bidang kimia sebelum dan selepas Lavoisier, bergerak atas andaian atau asumpsi2 yang berbeza tentang alam. Ibarat mengukur spektrum warna dengan ukuran sentimeter, sebarang percubaan untuk mengatakan yang satu lebih tepat dengan realiti, dan yang lain tidak, adalah sia2.Telahan Kuhn ini andai diperinci mengisyaratkan beberapa konklusi yang sukar diterima. Adakah tindakan beberapa komuniti orang pribumi yang menari beramai2 apabila musim kemarau dengan harapan supaya hujan turun, mampu dikatakan tidak kurang tepat pada takah kosmologi, dengan tindakan meteorologis yang menanam awan (cloud-seeding) untuk tujuan sama?Menariknya, pada muka surat seterusnya Wolpert ada membangkitkan tentang ketempangan sains moden dalam membincangkan beberapa hal, satu bentuk pengiktirafan dari beliau yang yang aku hormati. Cuma malang sekali, sebaik sahaja beliau berkata sedemikian, Wolpert tidak bersandar kepada perbahasan ilmu etika dan estetika sewaktu berbincang tentang topik implikasi kejuruteraan genetik dan tanggungjawab saintis terhadap hasil kajian mereka (Wolpert memberi contoh kes penemuan tenaga nuklear dan membandingkannya dengan pergerakan eugenik).Kelemahan buku ini adalah penulis terlajak-anggar kepakarannya di dalam mengolah beberapa isu seputar fenomena sains (bukan fenomena saintifik). Itu bukan bermakna perlecehan idea beliau. Seperti yang aku katakan, banyak daripada buah-buah fikir Wolpert adalah absah untuk dibangkitkan - walaupun aku akui kritikan beliau terhadap sosiologi/sejarahwan bukanlah satu kritikan yang akan diambil peduli dengan berat oleh sains sosial (aku masih tidak mampu articulate sebabnya). Cuma pembaca perlu tahu bahawa buku ini ditulis dari suatu pandang sudut yang menyeru untuk sudut pandangnya tersebut diberati dan direnungi sewaktu berbicara tentang sains dan perusahaannya."
2,0674929810,http://goodreads.com/user/show/4691170,1,"في الحقيقة لا يمكنني إعطاء تقييم واضح لهذا الكتاب , فانا لم أستطع إستيضاح فكرته جيداً ربما لأن الترجمة التي قرأتها له مبتسرة 93 :191 صفحة !!ولكن الكاتب يريد أن يؤصل أن العلم هو شئ متفرد بذاته , ومستقل عن التكنولوجيا حتى , وأن العلم لا علاقة له بالأخلاق أو بالظروف الإجتماعية أو بالفلسفة , لم يورد حججاً تروى ظمأي بهذا الصدد , وإتبع منهج في نقد مخالفيه جعل من الصعب علي فهم أفكاره أو فهم مخالفيه !!والفكرة الأهم أنه جعل ظهور مفهوم العلم بمعناه الحالي قاصراً فقط على أفكار الإغريق و الديموقراطية الإغريقية و محاورات الفلاسفة دون التقيد بنظام عقدي ما . فكرة في منتهى الغرابة طبعاً , وهو يبرر هذا بأن من سبقوا االإغريق من المصريين و الصينيين إنما كانوا مهندسين و تكنولوجيين ولم يكونوا علماء ولم يحدد من بينهم أشخاص كأرسطو و أفلاطون , وكانت علومهم وفلسفاتهم كلها تنصب على خدمة أفكارهم الدينية حيث كانت الأسئلة الكبرى مجابة لديهم , بعكس الإغريق الذين كانوا يبحثون عن الأسئلة الكبرى من خلال العلم و المناهج المنطقية , ولا يمكنني أن أجيب على هذا بالنفي أو بالإثبات إلا انني أزعم أن أفكار أرسطوا وغيره من الفلاسفة لم تكن سوى أفكار الإغريق الدينية بعد نزع الديباجة الوثنية التجسيدية منها و إعطائها الصورة الحقيقية لها فبدلاً من الآلهة إستخدمت قوى الطبيعة .وانصح ألا تقرأوه فالكتاب يتحدث عن كل شئ ولا يجيب على شيئ -ربما تلك الترجمة العربية السخيفة- الكتاب يحاول أن يخرج بالعلم من مستواه ويجعله متجاوزاً منزها عن أفكار العلماء وحتى عن التكنولوجيا , بالرغم أن أي علم ليس له تكنولوجيا يمكن ألا يعد علماً .سخافة !"
3,0674929810,http://goodreads.com/user/show/1447864-joshua-nomen-mutatio,0,Just reminding myself to pick this up soon. 
4,0674929810,http://goodreads.com/user/show/8703029-pete,2,"I was disappointed by this book. I am not convinced by the ideas that 1) science is something that has only appeared once in human history, and in Europe 2) Science and technology are fundamentally different 3) Science does not involve common sense. I think the book 1) re-mystifies science 2) reinforces age-old and the tiresome Western hegemony theme.My own view is that that thought processes in science are common sense when you have immersed yourself in the problem. If you have the money and time available to immerse yourself in esoteric problems then that is “science”. If the problems are directly related to the development of tools (often for industry) then that is “technology”. There is clearly a big overlap as science is driven by tools and science leads to breakthroughs in technology. Also ideas can become tools and this can lead to unexpected and wonderful discoveries. "
5,0674929810,http://goodreads.com/user/show/35348314-joe-stack,3,"The author writes clearly and succinctly about what science is, why it's difficult for many to understand, and the role of science in our culture. Until I read this book, I had not fully realized how much common sense can make understanding of scientific ideas so difficult. The chapters on pseudo-science, or what the author calls ""non-science,"" and ""moral and immoral science"" are worth reading by themselves."
6,0674929810,http://goodreads.com/user/show/5312150-jon-gould,5,Where you learn the just because it's logical - it may not be true
