,isbn,user_link,ranking,review
145,0465094252,http://goodreads.com/user/show/104781119-william-bies,4,"Those who follow physics blogs will be aware of the standing controversy between Sabine Hossenfelder and Lubos Motl. The former is a theoretical physicist who specializes in the phenomenology of quantum gravity; the latter, a former string theorist and dropout from the Harvard faculty who, apparently, no longer engages in any real fundamental research into high-energy physics but devotes himself largely to political activism, in causes such as climate denialism and anti-political-correctness agitation. Motl can be rude in the extreme to those with whom he disagrees (cheerfully ad hominem invective one of his favorite tropes), but is one who, if one sets aside his extreme political views, normally disports himself as capable of intelligent and incisive disquisitions in areas in which he possesses actual technical competence, such as string theory, supersymmetry, quantum theory and modern physics in general (but not at all climate science or any of the Geisteswissenschaften). His quite prolix postings on these topics are always worthwhile and informative. Philosophically, to speak nothing of theologically, he is rather naïve and uninformed. Hossenfelder, on the other hand, has the mind of a genuine critic. She is good at picking out the point behind an argument, in exposing fallacies and canards and in getting to the heart of the matter with unflappable criticism. Interested readers may wish to view her videos addressed to the scientific layman in which she outlines the status quaestionis and her own views on many topical issues of the day, such as the interpretation of quantum mechanics and the measurement problem, black holes, quantum gravity etc. Hossenfelder does allot some place to philosophy, recognizing the stimulating role it has played in many revolutionary scientific advances (though her own philosophy of science would have to count as unconventional). At least, she attends conferences in the philosophy of science, writes papers on the subject and engages in epistolary exchanges with philosophers of science. Thus, it is an occasion of note when Hossenfelder has set down her thoughts on what she views as the crisis in physics in a long-awaited book-length publication.The plan of Hossenfelder’s Lost in Math consists in a somewhat loosely organized series of reflections on the current state of physics—meaning, for her, fundamental physics, which embraces high-energy theoretical particle physics, quantum gravity and the interpretation of quantum mechanics—punctuated by interviews with leading practitioners in the mentioned fields. Her list of interviewees reads like a who’s who in the physics community: Nima Arkani-Hamed, Steven Weinberg, Frank Wilczek, Chad Orzel, Joe Polchinksi (but not, unfortunately, the presumably hard-to-get Edward Witten), and some lesser figures: Xiao-Gang Wen, Katherine Mack and Garrett Lisi. Interestingly, Hossenfelder has declined to interview Lee Smolin or Peter Woit, who presumably share her skepticism to some degree.The reader will find layman’s accounts of supersymmetry, the hierarchy problem, inflationary cosmology, dark matter and other things on the research frontier. Though pitched to the average educated reader, Hossenfelder’s tract is not intended as a popular exposition of the physics along conventional lines, so these explanations are kept fairly brief. What interests her, rather, is what she perceives as the decades-long crisis in fundamental physics and the underlying reasons behind it. For little of fundamental significance has been discovered in high-energy physics for going on forty years, apart from the celebrated empirical confirmations of settled theory at CERN and Fermilab (W and Z particles in the 1980’s; top quark in the 1990’s; most recently, the Higgs boson in 2012). Lost in Math covers many but not all issues at the research frontier in fundamental physics and cosmology. As the title indicates, the author attributes the crisis mainly to an uncritical attitude towards mathematical beauty on the part of the leading practitioners in the field. In the absence of experimental breakthroughs that might throw light on phenomena beyond the standard model, theoreticians have fallen back on internal criteria by which to evaluate and judge candidate theories, among which are those of an aesthetic nature. Hossenfelder hazards a definition of beauty in physics as the concurrence of three desirable things: simplicity, naturality and elegance. These concepts will require some elaboration in the scientific, not so much artistic context of physics; note that they are internal criteria having nothing to do with empirical prediction or confirmation. Simplicity has to do with Occam’s celebrated razor; we admire it when a single principle explains a broad range of phenomena and brings them under a common roof. Outstanding examples include Maxwell’s unification of electricity and magnetism and more recent unification of electromagnetism and the weak force by Glashow, Weinberg and Salam. Naturality is a little less tangible, but we appreciate when things fit together nicely and unforcedly, as if the theoretical idea in question was destined to play this role. Naturality also has a technical definition in terms of the dimensionless constants entering the theory. These should be on the order of unity (with considerable leeway, give or take a few orders of magnitude). Many feel that an explanation is called for when a numerical constant turns out to be either very small or very large. The last criterion is elegance, also somewhat hard to define but one knows it when one sees it. Einstein’s general theory of relativity is most elegant, for instance, whereas theories of modified gravity such as the tensor-vector-scalar theory are repulsively inelegant, even though they, too, have the formal property of covariance. A good sign of elegance in a theory is when it leads to unexpected and surprising results, beyond what it was originally formulated to solve. Surely, this imparts the ring of truth?But, as Hossenfelder points out with justice, beauty alone is not infallible. In the history of physics, there have been many beautiful ideas that fail and numerous cases of ugly theories that work. Among the former, she lists Plato’s theory of the regular polyhedra as models of the four elements, Ptolemy’s circular planetary orbits, the static or steady-state universe (of Parmenides and lately Hoyle), the nineteenth-century theory of atoms as vortices in the aether and the late Heisenberg’s unified theory involving a fundamental length; among the latter, quantum mechanics itself, which its founders found to be troubling and counterintuitive, renormalization in quantum field theory, Kepler’s elliptical orbits and the big bang theory of cosmological origins. In Hossenfelder’s view, there is no reason why beauty should be expected to work. Aesthetic criteria based on experience will not necessarily apply to theories about a new domain of phenomena.In Hossenfelder’s telling, the reliance on illegitimate aesthetic criteria leads to a vicious circle: unmotivated hypotheses beget negative experimental results, which imply a lack of useful data that in turn leaves theoreticians with no recourse other than to propose further unmotivated hypotheses. Obviously, when experiment yields no hint of novel phenomena beyond the standard model, as has been the case in fundamental physics for decades, it will not prove very helpful for the development of successful new theories. The Large Hadron Collider at CERN was widely predicted during the first decade of the twenty-first century to unveil any number of new effects: supersymmetry, extra large dimensions of space-time, microscopic black holes, parallel universes—what have you. Nothing unusual showed up. The sole successful prediction was the Higgs boson, which was not rooted in an argument from beauty (at least, as we would ordinarily conceive it).Despite all these negative results, the partisans of beauty in physics have not given up. Still today, there are several problems which in Hossenfelder’s telling are non-problems because rooted merely in aesthetics: the supposedly abnormally low mass of the Higgs (relative to the scale of grand unification); the small value of the cosmological constant; the small electric dipole moment of the neutron; the three gauge symmetry groups that appear in the standard model without explanation; and lastly the extreme weakness of gravity compared to the other fundamental forces. What is the author’s take on all this? We might have to accept these things arbitrarily; the cosmological constant, for instance, might well be a constant of nature whose value is just what it happens to be. Hossenfelder contends that the sole instance in which aesthetic criteria have lead to a breakthrough in physics, historically speaking, is when they give rise to the solution of a mathematical inconsistency. For example, Galilean invariance is incompatible with Maxwell’s equations (led to special relativity); special relativity is incompatible with Newtonian gravity (led to the general theory of relativity); special relativity is incompatible with quantum mechanics (led to the development of quantum field theory); spontaneous symmetry breaking is mathematically inconsistent without a Goldstone mode (led to prediction of the Higgs).Hossenfelder formulates her lapidary final conclusion in light of her reconstruction of the history of physics: ‘Ein empfundener Mangel an Schönheit is kein Widerspruch und daher kein echtes Problem’—a perceived defect of beauty is no contradiction and hence no genuine problem. This reviewer will suggest below that things are not quite so simple as that. Hossenfelder has not sufficiently analyzed what motivates the theoretical innovations that led to the resolution of the above-mentioned mathematical inconsistencies. Aside: isn’t the requirement of mathematical consistency itself ultimately an aesthetic argument?Now to some criticisms of the present work: its organization is somewhat loose, dictated by the need to go over the author’s interviews with leading scientists in different chapters rather than to proceed thematically. The author jumps from one subject the next, seemingly on the spur of the moment. The book can be repetitive, as the author and her interlocutors keep circling around the same few points. Off-the-cuff treatment of deep issues in the philosophy of science can be disappointing; Hossenfelder is not a systematic thinker. What is most important, the text is missing a condensed argument on principle against naturality, such as the author is very well capable of and has written technical papers on in the past. In fact, earlier this year, Hossenfelder gave a lecture to promote her book at the University of Stuttgart on May 14, 2019 (in German with English subtitles). This lecture is tightly organized and states the problem, as well as her own views, in a very condensed and accessible form. The curious layman might well prefer to spend an hour to watch the video of the lecture and, thereby, to spare himself the outlay of time it would take to read a 300-page book (this review has found it convenient to follow the outline of the lecture more closely than the book itself).This reviewer’s own views on the subject of the crisis in physics and the role of beauty: it is a mistake when Hossenfelder, following the general opinion in the physics community, concedes to string theorists a monopoly on beauty; a critical appraisal of the concept of mathematical beauty is needed anyway (along the lines of Kant’s critique of judgment). The author’s definition, mooted above, remains too descriptive. It does not get to the core essence of the phenomenon, which must have to do with the interaction of the faculties (sensibility, imagination, the will, understanding and reason). Perhaps something akin to Kant’s disinterested Zweckmässigkeit is involved in the judgment of beauty in the mathematical sphere, as well as in art. Needless to say, since we are talking about beauty in mathematical physics proper, a truly philosophical account would have to demarcate the respective domains of mathematics and physics and how they are interconnected. A tall order!In this reviewer’s judgment, Hossenfelder largely misses the point of mathematical beauty in physics due to a foreshortened historical perspective; her narrative is very much mired in current controversies, going back not more than thirty years versus the long track record that mathematical beauty enjoys in the history of physics all the way back to Copernicus, Kepler, Galileo and Newton; Einstein’s general theory of relativity; Dirac’s electron-positron theory; non-abelian Yang-Mills gauge theory and Gellmann’s eight-fold way in high-energy particle physics etc. What, then, is the point? Beauty, according to the definition sketched above which will serve as a reasonable starting point, does appear to be associated with innovative and revolutionary ideas. The explanatory power of such ideas is connected with the fact that they open up a new domain of phenomena to investigation and, normally, one can proceed from the simplest of starting points, hence their marks of simplicity, naturality and elegance. Ugly, ad-hoc ideas tend to be associated with unoriginal thought in Kuhn’s decadent normal phase, when all the nice, simple problems have already received solutions and one must proceed to ever-more complicated and baroque constructions, hence the lack of simplicity, naturality and elegance. We have seen plenty of these, particularly in the high-energy phenomenology of grand unification and in the string-theory landscape or moduli space of compactifications. Now, the error being made by contemporary theorists is to mistake beauty for originality. Yes, original thought often leads to a beautiful formulation of a theory, but this does not mean that every speciously beautiful theory must be original. Rather, these days one resorts to mathematical ideas known for their beauty and seeks to craft a physical theory around them—which is to put the cart before the horse!We could wish, in the closing chapter on how to address the crisis constructively, for more elaboration on how to structure the scientific community to mitigate disincentives to high-quality work. Hossenfelder names a number of sociological factors at play: more scientists pursuing academic careers than ever, closer contacts and collaboration among geographically dispersed scientists, short-term contracts constantly up for renewal, greater publicity meaning one has to pander to the tastes of the public. Not mentioned here in the text, but something the author has indeed devoted much thought to, are cognitive biases that hold back the untrammeled exploration of ideas. For instance, the well-known phenomenon of group-think, certainly at play in the physics community, militates against objectivity."
146,0465094252,http://goodreads.com/user/show/74415844-nemo-nemo,0,"AUTHORDr Sabine Hossenfelder, PhD, is a physicist and a scientific writer. Find out all about her and her works on her website here.WHO IS THE TARGET AUDIENCE?Students young and old, and all those who want to extend their knowledge of particle and astro physics will love Lost In Math. It is also a powerful tool for anyone wishing to increase their knowledge of the Large Hadron Collider (LHC) at Conseil Européen pour la Recherche Nucléaire (CERN).SYNOPSISDr. Hossenfelder’s compelling discourse on the subject of physics is not the usual heavily analytical, numerically driven revelation that is difficult to comprehend. Its focus is on an a selection of interviews with varied illuminated physicists. Dr. Hossenfelder then discusses the interviews and provides her opinions and views. She believes totally in the a priori method of traditional science. Yet she understands the elegant math of nature is a beautiful thing. She cautions us to guard against believing without empirical based evidentiary support.Dr. Hossenfelder posits that the tug-of-war between the empirical (hard facts) and the esthetics nature (soft elements) creates a stress for those struggling to find unity. It is these esthetic judgements that she credits as the driver of present day research.Dr. Hossenfelder shares her acumen and her considerable familiarity with the subject in a clear and concise manner, and without recourse to seemingly bottomless equations. Her sense of humor, whist dry gives the book a certain lightness not normally evident from such an able scientist. Her informal method aids the demystification of the subject for non-mathematicians.The interviews are interesting and informative, but it’s Dr. Hossenfelder’s opinions that take the work to the next level. Her eloquent elucidation on the status of theories and concepts are beautifully paced and completely engaging throughout. When she does feel that a concept requires a challenge, she does so in a compassionate manner.CONCLUSIONLost in Math is a solid read. It is tolerable even for those who avoid mathematics like the plague. Dr. Hossenfelder takes the time to verbally guide you through each topic, and you will almost never have to fear having to face down one of those pesky equations. You will have to endure a brief mention of leptons and quarks, but they quickly pass and are replaced with a discussion on dark matter and dark energy. I found myself falling in love with the totally engaging supersymmetry (loving SUSY). Forget your calculator, just jump in and enjoy this wonderful work. I guarantee you won’t regret it.Lost in Math was the very best read on the subject of theoretical physics that I have read in quite some time. Dr. Hossenfelder’s humor carried the day by diluting the technically advanced concepts and explanations. The interviews are generally unremarkable, however her criticism of each is a revelation.I do wish that the book had included more and larger plates. I would also have liked footnotes. That said, I found the appendices to be extremely helpful. Although Dr. Hossenfelder attempts to explain the mathematical and scientific method relating to the subject, those unfamiliar with basic theoretical physics concepts may struggle to follow.ACKNOWLEDGEMENTSI would like to thank Dr. Sabine Hossenfelder, NetGalley, and Basic Books for affording me the opportunity to review Lost in Math: How Beauty Leads Physics Astray.⭐⭐⭐⭐"
147,0465094252,http://goodreads.com/user/show/3885717-mike,4,"As an experimental particle physicist and someone who has taught quantum mechanics at the undergraduate level, I am familiar with many of topics discussed in this book, so I am never sure how the average reader will follow it. Given that caveat, I really enjoyed this book. Hossenfelder has misgivings about how some current theories of particle physics are evaluated. Everyone agrees that the definitive test of a theory is how well it predicts experimental data, but what does one do when the theory cannot be tested experimentally. Should we fall back on concepts like mathematically beauty? Hossenfelder discusses supersymmetry in great detail which by the current standards of the physics community it is beautiful. It has a yet unobserved symmetry between bosons and fermions. It predicts a dark matter particle with properties very close to what is needed to explain the structure of universe and it predicts the unification of the strong force with the electroweak force. It also predicts that many new particles would be seen at the LHC, and they haven't. My favorite quote in book is from Frank Close. ""The case for susy would be even more compelling if, well, it had been discovered."" Hossenfelder has been bothered by this use of beauty to determine, which theories to work on. She is worried that we may be missing the correct explanation, because too many people are pursuing beautiful theories that can't be tested. She does not merely express her opinion. She goes on a world wide search to talk to some of the brightest theorists in the world. Hossenfelder interviewed many so many Nobel Prize winners that early in the book she jokes that Brian Greene has not won a Nobel Prize when she discusses his book the Elegant Universe.I understood the book and enjoyed it, but I worry about recommending it to people without the background. I will see if I can get my wife to read my copy. She quite bright but has a completely different background."
148,0465094252,http://goodreads.com/user/show/549584-yzabel-ginsberg,4,"[I received a copy of this book from NetGalley.]I can’t say for sure that I understood everything in this book, since my knowledge of physics in general is very patchy, but overall, I liked its tone, and its global idea, because I can get why one would be easily led astray by theories that look ‘beautiful’. It’s something that I feel is very human, after all, as we often look for a form of harmony in the world surrounding us, if only to try and make sense of it. Perhaps the fundamental, underlying laws of nature don’t make that much sense, or don’t always look like they do, and so we try to understand them in ways that would reconcile us with an apparent lack of… meaning, maybe? But what if the theories we pursue, albeit ‘pretty’ and nicely wrapped, turn out to be wrong? Shall we keep pursuing those, in the hopes that we just haven’t seen proof yet due to technological limitations, for instance? It seems that the answer to this isn’t so clear cut. (The LHC being a good example. I’m tremendously excited by the LHC, and what it allowed to prove so far… but while we got the Higgs boson, we still haven’t gotten supersymmetry.)The book also gave me pointers about things of which I clearly don’t know enough, especially in order to understand where the author comes from, so I know I’ll have to focus on those at some point in order to learn more.As a side note, I don’t know, but I don’t feel particularl bothered by the ‘ugliness’ of the Standard Model. It may be in part because all I know about it, I learnt on my own, without following the regular cursus, so I never approached it with any specific idea in mind? We’ll see once I’ve studied more.Conclusion: Definitely interesting, although don’t approach it if you know next to nothing to physics, since some ideas won’t make sense otherwise."
149,0465094252,http://goodreads.com/user/show/3233709-sunni-c-vanreads,3,"Sabine Hossenfelder's Lost in Math: How Beauty Leads Physics Astray is a critique at theoretical physics discipline and how it's physicists are too focused on finding beautiful theories. In her case, beautiful theories are one's that have mathematical equations that fit nicely with their theories. However, she states that sometimes these discoveries are messy and there is no streamlined equation to fit. It's an interesting take on physics. I'm not a physicist myself, but I definitely find that other popular nonfiction physics books focus a lot on the wonders of physics. Her book adds a different dimension to this discipline that I would have never thought of on my own. Her writing style is candid and if feels as if you are with her as she interviews renowned physicists around the world to learn more about their quest for beauty in physics. It's also a bit funny at times. I felt as if the science she describes in Lost in Math is a bit complex for me, but I found an appendix at the end of the book to refer to for brief explanations of the scientific theories she mentions. Sadly, it was a bit hard for me to flip back and forth in an e-book so I didn't do this, and I only found out when I got to the end. I would recommend this to people who are interested in physics and probably have a bit more general knowledge on it. Thank you NetGalley for letting me read and review this ebook."
150,0465094252,http://goodreads.com/user/show/24258499-alan-johnson,4,"This is a book about critical thinking. The author focuses on certain areas of theoretical physics, which is her specialty. However, she also extends the analysis to other fields, most notably to contemporary academic economics, which she clams is in even worse shape from a rational perspective than her own field (pp. 224-26). The last chapter catalogs (pp. 230-31) some of the fallacies Hossenfelder elaborates throughout her book: confirmation bias, motivated cognition, the sunk cost fallacy, in-group bias, shared information bias, apophenia (finding patterns in noise), belief bias, halo effect, false consensus effect, attentional bias (mere exposure effect), communal reinforcement (turning “scientific communities into echo chambers in which researchers repeat their arguments back to each other over and over again, constantly reassuring themselves they're doing the right thing”), and ""the mother of all biases, the bias blind spot—the insistence that we certainly are not biased.” Appendix C identifies concrete steps that the academic community and others can take to remedy these errors in critical thinking. I am not a physicist, and the detailed physics discussions in this book are over my head. However, the book is worth reading even for a nonscientist, because it explains how fallacious thinking can affect even the most ethereal realms of academia. The lessons can be applied not only to theoretical physics but also to other academic fields and, indeed, to all aspects of human thought."
