,isbn,user_link,ranking,review
58,0393348741,http://goodreads.com/user/show/2109885-literary-ames-against-gr-censorship,4,"Dear Elvis Presley,I'm so sorry for laughing and judging you based on how I believed you'd died. Living with Hirschsprung's disease had to be awful, always worrying, always in discomfort. People assuming you were fat when the distended abdomen was a sign you were seriously ill. Begging your forgiveness,AmyAt autopsy, his colon was ""two to three times normal size ... was jam-packed [length-wise]... The impaction had the consistency of clay and seemed to defy Florendo's efforts with the scissors to cut it out."" The clayey material, he says, was barium, administered to prep Presley for a set of X-rays - taken four months earlier. ""That barium was... Just like a rock."" He says the impaction obstructed at least 50 to 60 percent of the diameter of Presley's colon ... [It] had expanded so dramatically [at the end of his career] that it crowded his diaphragm and had begun to compromise his breathing and singing.' Soiling himself on stage happened regularly, he had no control whatsoever because of the disease. 'The resulting arrhythmia [from straining to make a bowel movement] can be fatal ... especially likely to happen to someone, like Elvis, with a compromised heart.' It's a common cause of death but wasn't well-known or understood at the time of Presley's death. 'Stool softeners are administered as a matter of course on coronary-care wards.'______________________________________Nasal regurgitation. Fistulated stomachs. Rectal feeding. Holy water enemas. Mythbusting Mary Roach concentrates on the strange, the unethical, and the downright funny aspects of the alimentary canal.I've learned many things:✺ Eat more liver. Organs are the most nutritious parts of an animal.✺ Never take alka seltzer / bicarbonate of soda / baking soda after eating too much.✺ Never light a match or breathe without apparatus near a manure pit.✺ Never punch someone in the mouth unless I'm willing to lose a finger.✺ Anal cancer exists and is contracted the same way as cervical cancer.✺ A human cannot survive being swallowed by a large fish. Jonah lied.✺ Fire-breathing dragons snakes are possible under the right conditions.✺'Humans perceive five tastes - sweet, bitter, salty, sour, and umami (brothy) - and an almost infinite number of smells. Eighty to ninety percent of the sensory experience is olfaction [smell].✺ Never take the ability to smell, taste, or swallow for granted.✺ 'brachioproctic eroticism' = 'fist-fucking' ✺ To respect the ""prison wallet"" (rectum). When I need to go, I'm going. I don't want to be constipated.✺ Never insert an object rectally unless I'm will to lose it up in there.

 That's an eel eating it's way through this guy's colon after rectal insertion.Well, Roach has covered the three basics of animal biology: feeding, sex, and death. Her witty approach to her subject matter helps the medicine go down, as it were. She makes learning fun by breaking things down into easily digestible bites (puns intended), though there are a few less interesting bits. I wonder what she'll cover next. *Many thanks to the publisher for the e-ARC in return for an honest review."
59,0393348741,http://goodreads.com/user/show/81608379-clarence-reed,3,"ReedIII Quick Review: Mary Roach's lighthearted style presents facts in an entertaining way. If you are interested in the topic, Roach's books offer a fun way to get obscure facts. This topic “the alimentary canal” can be a bit gross at times."
60,0393348741,http://goodreads.com/user/show/18695911-daniel-chaikin,4,"Gulp is Roach's 5th major non-fiction book and I think that colors a lot of its character. It feels very casual, and to a large extent Roach is simply having fun in her own way. She follows the topics that interest her, the ones that lead to some of the oddest places. That means as a reader you will be entertained (a word that has a one-off shade of meaning here), but if it changes your life in anyway, its purely accidental. You won't come away with a feeling that you now know the digestive system. Instead you'll feel terrible for Elvis Presley, fascinated and disgusted and slightly impressed by the culture smuggling up there in prison, and you might pause for a second when she slightly modifies the advice of 8 glasses of water day with ""but not all at once.""The book has a loose structure, from one end of digestive tract to the other, but mainly this is a collection of essays on specific odd digestive trivia. That makes it perfect for background audio on my daily commute, and I'll continue to seek out her other books.The reader gets mixed grades*. She reads mostly fine, but she struggles with voices and then compensates for this by doing a lot of voices. (note to narrators of nonfiction - every person quoted doesn't need to be given a unique voice, especially not a strange one that likely has no connection to the voice of the real person quoted.)*Emily Woo Zeller won an ""AudioFile Earphones Award"" for Gulp. So, take my criticism with that in mind.-----------------------------------------------68. Gulp: Adventures On the Alimentary Canal (audio) by Mary Roachreader: Emily Woo Zellerpublished: 2013format: 8:21 digital audio acquired: library listened: Nov 7-16rating: 3½"
61,0393348741,http://goodreads.com/user/show/773729-kelly,5,"Fascinating book...there are a few chapters that may be hard for the faint of heart. There were a few things that turned my stomach (only a handful of pages total), but for the most part I was mesmerized by all I was learning about the Digestive Tract. How come competitive eaters stomachs don't burst? Did you know a person who has lost their sense of taste and smell could starve to death? How do prisoners sneak things like cell phones and tobacco into prison? Did you know saliva has antiseptic qualities? This book starts with our sense of smell and the mouth and follows the digestive tract all the way through elimination. I took so many notes (on great facts and hilarious quotes) that if I expounded on them I'd probably need to publish a book on this book ;-) If you haven't read anything by Mary Roach I have to tell you reading her books is a treat. She is irreverent at times but her total grasp of all the details pertaining to her subject, play on words, wit (including Monty Python references), impeccable research and hilarious footnotes keep you smiling. One of my favorite footnotes was in reference to asking an ad man how he got people to be in an advertising photo for an anti-gas pill. He laughed and said they didn't - they had to use stock photos because no one wants to be in those types of ads. So here is my favorite footnote:""Back in the 1980s when everyone looked a bit off, my friend Tim and his brothers had some publicity photos taken of their band. Eventually they sold the rights to a stock photo agency. Years later, one of the images turned up on a greeting card. The inside said, ""Greetings from the Dork Club."""
62,0393348741,http://goodreads.com/user/show/5448792-b-schrodinger,4,"Mary Roach has written yet another winner here. Her early books ""Bonk"" and ""Spook"" were a little flat and derivattive, but ever since then she has delivered.Yes, she chooses deliberately risque subjects and yes there is always a chapter on farts, but damn she can make things interesting. It seems she can make the fine balance of making a scientist such as myself happy, while also placating my inner 8-year-old. And really, all she is doing by telling us how artificial farts are made, and the size of Elvis' colon is saving us time; I know I'd be looking up articles to see if anyone has gas chromatographed a fart after reading this. Mary has already done the Not Safe For Work googling for us.Mary's books are great for everyone. You do not have to be a scientist to enjoy them, and you do not need to be an 8-year-old boy either. If you are a bit squemish and delicate about bodily functions, read this, get over yourself and enjoy the wonderful piece of biology that you occupy. So everyone, get out there and read some Mary Roach. You'll laugh, learn, be amazed and there'll be plenty of WTFs. May we have many more wonderful Mary Roach adventures!"
63,0393348741,http://goodreads.com/user/show/999171-anita,5," Mary Roach has done it again. She has created a book that I purposely read slowly so I could savor every bite, picture, and footnote*. This time she takes us on a trip down the Alimentary Canal, from nose, tongue, and teeth to the bitter end of the trail with all the explorers, characters, scientists, and even Elvis to enlighten us on our way. Roach has a way of taking you along this field trip asking all the questions that you know you wouldn't have the guts to ask, of the professionals who are passionate about your gastrointestinal tract. As always, I learned a lot, laughed a lot, and dreaded to see the last page. If you've ever had a colonoscopy, constipation, heartburn, or were interested in medicine or history, this book is for you. I also learned a thesaurus' worth of terms for excreta, including my favorite--digestive ash. I am prepared for prison with details and the slang used for ""hooping"" a phone into maximum security. I know the seriousness of constipation, the wonder of saliva, the strength of my jaws and the wisdom of the anus.  As always her eye and ear for the interesting, bizarre, and absurd make wonderful reading. This time I also noticed a universal truth that bears some thought. As a teacher I've seen thousands of names, and I know enough that you don't name a child Destiny, Brandy, or Jeeves for fear of setting up the expectations of a career. I even always enjoyed reading anything about earthquakes by the renowned seismologist Dr. Waverly Person. This book not only enlightens you on human biology, but also explores the name-fate/destiny factor. I only noticed this halfway through the book, but look at the power of names for these individuals: Dr. Doctor Willard Bliss--James Garfield's doctor; gastroenterologist, Dr. Terdman; flautus researcher, Colin Leakey; and Dr. Crapo, a researcher into manure pit deaths. Take care in naming your children. Mary Roach is a national treasure. She makes science fun, scientists human, and the world around us and in us understandable and awe inspiring. My only regret is that I will have to wait two years for her next book. She is definitely not full of digestive ash. *Only one of my many favorites; ""The human disgestive tract is like the Amtrak line from Seattle to Los Angeles: transit time is about thirty hours, and the scenery on the last leg is pretty monotonous."""
64,0393348741,http://goodreads.com/user/show/220791-lena,4,"Mary Roach's latest book examines what happens to food from the time we put it in our mouths to the time it comes out the other end. It contains all the elements of her trademark style - cheeky humor, a gung-ho attitude towards the disgusting, and actual quality science.There were many sections of this book I found genuinely fascinating. Her initial chapters about the elements of taste - both human and pet - got me hooked and wanting to read more, and her closing chapters about maladies of the colon (including what REALLY killed Elvis), the century-old scam of colonic irrigation, and the astonishingly high success rates of fecal transplants contain much useful information. In between, I marveled at the ability (albeit rare) of some humans to eat themselves to death and enjoyed the scientific dissection of the claims of those who assert Jonah-like survival of whale (or python or frog) swallowing.I must confess, however, that this book revealed to me that I am extraordinarily squeamish when it comes to discussions of certain aspects of the digestive system, in particular, stomach acid. This not so much a problem for me when such acid is contained to the stomach itself, as nature designed, but a not insignificant part of this book is dedicated to experiments in which these internal fluids are accessed from the outside of still living creatures, including a French-Canadian trapper who had the misfortune of being shot in the side and then treated by a doctor who saw his wound as an excellent opportunity to promote the advancement of medical knowledge. I'm not sure what it is about this subject (as well as disturbingly in-depth discussions of saliva) that caused me such consternation, but it did make the book somewhat harder to read, particularly since what little reading time I have these days coincides with the taking of my own meals. Given how many bodily taboos this book dives merrily into, I would not recommend the reading-while-eating strategy if you tend towards the squeamish yourself. Aside from that, however, if you like Mary Roach, you'll find plenty of good stuff to digest (ha!) here."
65,0393348741,http://goodreads.com/user/show/1291915-lauren,4,Fascinating and disgusting - Roach has the corner on this market! I learned several tidbits and interesting facts... although not necessarily ones to share in polite company at the dinner table!
66,0393348741,http://goodreads.com/user/show/10463035-caseythecanadianlesbrarian,2,"Parts of this were really interesting, parts were just gross and kinda made me nauseous. I also felt like the scientific way she looked at some things didn't pay enough attention to the humanity of people involved in the cases she was talking about (like drug smugglers and prisoners). And then there was the offhand comment with no evidence to back it up that Black people and Latin Americans are more homophobic than white people..."
67,0393348741,http://goodreads.com/user/show/15224258-veronica,4,Really interesting. I could have done without the chapter on Elvis though. Ms. Roach might point out that I was well within my rights—as a reader—to skip it. That’s true. I tend to read non-fiction in exactly the same way as I do a novel. Why? In a book like this one can skip around with reckless abandon since the only order is that of the alimentary canal itself. And we should all be relatively familiar with that!
68,0393348741,http://goodreads.com/user/show/1449138-scott,5,"Mary Roach usually writes the funniest book I read all year, and Gulp is likely to be no exception. I mean, I don't really read much, or really any, pure humor, but she always makes me laugh, frequently and out loud. Roach also packs more interesting facts per page--things I never knew before, or even ever thought to think about--than just about any other author; so many that I can't possibly retain all of the information in her books. And she has a genius for nailing people, physically and personality-wise, with a sentence or two, both people that she meets in the field, as well as obscure historical figures. AND she's a smart, tireless reporter, whose amiable personality and charisma is clearly endearing to those she visits, and who consequently go out of their way to play along with whatever adventure or bizarre investigation she's going on about. So, yes, I've enjoyed all of Mary Roach's books, about, basically, death (Stiff), ghosts (Spook), sex (Bonk), and astronauts (Packing For Mars), though the former two were better than latter. ANYWAY. Gulp is classic Roach, and possibly her best book yet. This time out she's interested in digestion, mostly human (though animals get a long look as well), from the moment food touches our lips to what it all ends up as when it's coming out of our buttholes. Or not coming out, in the case of the constipation chapter which, by the way, may have been what killed Elvis. As always with Roach, there's plenty of hard science here, and this (or Stiff) would make for great summer reading for high school biology students. She's a good, vivid explainer, and her light touch and palpable passion for her subject(s) keeps everything moving along at a brisk pace. Roach can be tiring, like that friend of yours who's always ON, and I sometimes had to put Gulp down just to get a break from her relentless enthusiasm. Also, not every injection of humor works, and on a Kindle, when you have to touch the tiny asterisk on the screen to jump ahead and read the jokey footnote, and then click again to return to the text proper, it can get a tad annoying, and feel a bit forced. But I can't think of another writer whom I'd want teaching me about gastric juices, fecal transplants, swollen colons, and the function of flatulence, among literally hundreds of other topics found here. "
69,0393348741,http://goodreads.com/user/show/223837-nicky,3,"Gulp is definitely light, popular science, with an abundance of footnotes, irreverent comments, and some interesting facts/experiences. I wasn't grossed out by it, since I can be fairly clinical, and rolled my eyes at some of the humour aimed at being gross; mostly it was an interesting read, certainly a quick one. It's accessible, no matter what level your knowledge of biology is at, mostly dealing with the various topics in an anecdotal way.I liked reading it, but now I have and look back, I think it dragged a little. Part of that's doubtless my sense of humour, which is defective and needs to be returned for a refund. Part of that is the endlessly anecdotal nature of it. I've reserved another of Roach's books from the library, but I wouldn't buy it for myself; I do have a friend who I think would find this quite interesting.Also, will people please quit hurrhurrhurring at the idea of faecal transplants? I'm sure it's all very well to laugh at it from a distance, but a) it's reinforcing the stigma about diseases like Crohn's or ulcerative colitis which really are not funny, and b) I have high hopes that they will actually find a way to cure or at least greatly alleviate inflammatory bowel diseases as a result of studies into this kind of thing. Several close friends have IBDs, and I cannot wait for the day they can quit feeling that shame/disgust."
70,0393348741,http://goodreads.com/user/show/1737220-richie-partington,5,"Richie's Picks: GULP: ADVENTURES ON THE ALEMENTARY CANAL by Mary Roach, W.W. Norton, April 2013, 336p., ISBN: 978-0-393-32912-4""Food, glorious food!We're anxious to try itThree banquets a day --Our favorite diet!-- from the musical Oliver""Silletti hands me a plastic cup and sets a timer. We are moving on to unstimulated saliva. This is background saliva, the kind that's always flowing, though much more slowly. A minute passes. We turn away from each other and quietly spit in our cups.""'Look at the difference compared to stimulated.' Silletti tilts her cup. 'You can't pour it easily. It's so viscous. Look!' She dips the end of a glass pipette into her sample and pulls it away. Filament is a nice word, Silletti's word, for the mucoid strand that trails behind.""Relatively little is known about unstimulated saliva. Partly, Silletti says, because no one wants to work with it.""'Because it's so gross?'""'Because it's harder to collect. And you can't filtrate it. It clogs the filter, like hair in the drain. And you cannot be precise because it's so slimy.'""'Right, it's gross.'""Silletti tucks a strand of her glossy black hair behind her ear. 'It's difficult to work with.'""Unstimulated saliva's trademark ropiness is due to mucins, long chains of amino acids repeating to form vast webs. Mucins are responsible for saliva's least endearing traits -- its viscosity, elasticity, stickiness. They are also responsible for some of its more heroic attributes. Unstimulated saliva forms a protective film that clings to the surfaces of the teeth. Proteins in this film bind to calcium and phosphate and serve to remineralize the enamel. Webs of mucins trap bacteria, which are then swallowed and destroyed by stomach acids. This is good, because there are a lot of bacteria in your mouth. Every time you eat something, every time you stick your finger in your mouth, you're delivering more.""It is now a decade since I immersed myself in Mary Roach's STIFF: THE CURIOUS LIVES OF HUMAN CADAVERS, whilst a member of YALSA's 2004 Best Books for Young Adults committee (which we, in due course, included on that year's selection list).Mary Roach's nonfiction explorations keep getting even more funny and fascinating. I am thinking that Roach's work and popularity must just build upon themselves: When you become well-known for writing incredibly funny, bizarre, and well-researched science books, I imagine that you are subsequently granted more time to complete the next project and can trade on your popularity to more easily gain access to top scientists and studies in progress that provide up-to-the-moment information. So, each time you tackle a new topic, you end up with a book that is even better than the ones before.""'What was hard,' Leavitt said, 'was finding the judges.' Leavitt needed a pair of odor judges to take 'several sniffs' and rate the noxiousness -- from no odor to 'very offensive' -- of each of the sixteen people's flatal contributions.* """" *It could be worse. In a study of malodorous dog flatulence carried out at the Waltham Center for Pet Nutrition in Leicestershire, England, the far end of the scale was 'unbearable odor.'""The fact is that GULP is a gas. Mary Roach begins with an exploration of the functioning of the nose and mouth as she explores how we interact with our food from one end of our bodies to the other. Side-splittingly hysterical, gross, eye-opening, fascinating, disturbing, and unforgettable are all words that readily describe what it's like to experience these step-by-step alimentary adventures and the million side journeys on which we are led by Ms. Roach through her research into these yummy topics. I advise you to not try reading this book while anywhere that you have to be quiet -- you could conceivably choke to death trying to stifle the laughter.At the same time, the breadth of research and quality of information delivered here is such that I've been repeatedly talking about this book to anyone who will listen and am gearing up to pitch it to any high school AP science student who crosses my path:""Why is it, then, that stomachs don't digest themselves? Why do one's stomach juices handily digest haggis or tripe but not the very stomach that excretes them? ""It's something of a trick answer. In fact, stomachs can digest themselves. Gastric acid and pepsin digest the cells of the stomach's protective layer, or mucosa, quite effectively...A healthy adult has a new stomach lining every three days. (More clever stomach tricks: key components of gastric acid are secreted separately, lest they ravage the cells that manufacture them.)"" It is so intriguing to read about what our own bodies are doing every day -- in fact what they are doing at this very moment. Now every time someone spits, burps, or farts (or talks about spitting, burping, or farting), I am thinking about some of the crazy stuff I've picked up from this brilliant piece of nonfiction. Richie Partington, MLISRichie's Picks http://richiespicks.comBudNotBuddy@aol.comModerator http://groups.yahoo.com/group/middle_... http://slisweb.sjsu.edu/people/facult..."
71,0393348741,http://goodreads.com/user/show/70632050-robin-tobin-on-the-back-porch-reading,5,No one is better at non fiction topics than Mary Roach.
72,0393348741,http://goodreads.com/user/show/5909620-chelsea,4,All of Roach's books have been interesting!
73,0393348741,http://goodreads.com/user/show/38036772-annie,4,"The last Roach novel I had yet to read- my knowledge of her oeuvre is complete. It’s a pretty classic Roach- interesting, with endlessly fun trivia and Roach’s trademark nonstop hilarity. I wouldn’t say this is her best, but it doesn’t flop like Spook did, by any means. Somewhere in the tidy middle. It was certainly the cause of numerous barks of laughter."
74,0393348741,http://goodreads.com/user/show/4310312-cloak88,4,"What goes in must come out....Mary Roach investigates everything about digestion. From the mouth and chewing to the very end with the anus and going passing gass. She gives a humorous overview of past and present scientific interests in our digestive track. What people thought it was, what it does, what goes right, what we do wrong and how science has done about it.Don't eat while reading this, but it is interesting!"
75,0393348741,http://goodreads.com/user/show/6449756-sonja-arlow,4,"4 ½ starsI absolutely love this author’s inquisitive mind, writing style, humour and the subject matters she chooses. My favourite is still Stiff: The Curious Lives of Human Cadavers but this one is a close second. It had me bursting out laughing even with the high yuk factor of the content.In typical Mary Roach style:“No engineer could design something as multifunctional and fine-tuned as an anus. To call someone an asshole is really bragging him up.”She dives into the subject at hand discussing topics ranging from what makes pet food (and ours) irresistible to Fido to ""taboo"" topics as intestinal gas and our bowel habits. We read about the dangers of prisoners secreting contraband in their stomachs or up their bottoms. It also looks at the digestive systems of competitive eaters and we even learn why Elvis died, and yep it was on the toilet. And these are not even the ""odd"" sections of the book. That’s reserved for discussing where the myth of fire breathing dragons come from (they are basically gassy snakes), what morning breath really is, why rabbits and rats eat their own droppings and things I never wanted to know, ie the anal violin. Take it from me, don’t eat while reading this :-)The only criticism I have is that with an Kindle the footnotes at the end of each chapter becomes a bit confusing as you cannot easily just flip back pages to see what she is referring to.This book will not be to everyone’s taste (excuse the slight pun) but I loved it!"
