,isbn,user_link,ranking,review
0,0060572000,http://goodreads.com/user/show/3427339-jeffrey-keeten,4,"”The planet very briefly shrugged”

1906...the shrug.We have all had those professors who have spent a lifetime sticking interesting facts into their heads. These facts may be pertinent to their particular line of enquiry for which they are considered an expert, or they might be random interesting tidbits of knowledge that have been squirrelled away for future research. They might even be just fascinating stories that may have very little to do with anything else. Except of course that everything is connected. Degrees of separation and all that. I had this Russian history professor at the University of Arizona who was decades removed from his best years, and nearing the time when someone was going to start talking to him about all the time he will have to devout to research...once he retires. The hook, in other words, was coming soon. His diseased spine bent him forward. It required some effort for him to raise his head far enough to look someone in the eye. He also listed a bit to the right when he walked, reminding me of Stevenson’s Hyde. He had a full beard, still naturally black despite his age, which made him look very Russian, and therefore, very authentic when discussing Ivan the Terrible or the Cossacks. He would pace back and forth with his hands behind his back gazing at the floor as he lectured. He always wore this black coat. I was once talking to him after class when he fumbled open the black buttons with thick fingers and flapped the jacket open. Hot air escaped as if he’d just opened an Egyptian tomb. Sweat stained his shirt from his armpit to his waist, and the fetid odor of fennel marinated in vodka and stale socks blossomed in the room. He was a terrible rambler, skipping from one point in history to another, and throwing in bits and pieces of history outside of Russia as well. One day a student interrupted him for the second time to ask, yet again, if what he was discussing was going to be on the test. He asked her very kindly to leave the room and to please drop the class. I was slogging my way through the class textbook, so I really didn’t need him to regurgitate what I was already reading. Mostly, I just wanted to stay quiet, and let him talk about whatever he wanted to talk about. Most people expect and want things presented to them in a linear fashion, so I was not surprised to see the class shrink in size as students abandoned ship for the lifeboats with the hope that some other teacher would provide them with more pleasant waters to float in. Now the reason I tell this story is that this book reminded me of that professor. Simon Winchester has written a book that is not easy to categorize. Is it simply a book of random musings, loosely contained to a theme by duct tape and bailing wire? Is it an indulgent travelogue? Is it a 101 geology seminar? Is Kenny G playing saxophone in the background? I’d have to answer yes to these questions...well...not Kenny G. Let’s not be ridiculous. The subtitle of the book is America and the Great California Earthquake of 1906. From perusing quickly through other reviews, there were many readers who were very frustrated with the fact that the book was not focused on the topic they were most interested in reading about... the Great Earthquake of 1906. The title is mildly misleading, but then again I think there was an editor, a publisher, and a writer who were unsure of exactly how to categorize this book and decided to simplify things for marketing purposes. 

The Eastern edge of the North American Plate reminds me of fortresses from another time.Winchester does discuss the San Francisco disaster, but before that he takes us on a trip to Iceland, to the eastern edge of the North American Plate, which also happens to be the location of some of the world’s oldest parliamentary democracies. The edge forms a dramatic, though stable geography that certainly lends grandeur to any gathering. We cross the U.S. where he discusses the 1886 Charleston quake, the rumblings that happened at New Madrid, Missouri, in 1811-12, and Meers, Oklahoma, where there is a beautiful fault visible from the air. He climbs Mount Diablo and catches a clear enough day to be able to gaze upon San Francisco. ”I squinted through a big brass telescope that had been obligingly placed on the parapet. My feeling that this was a confection of untoward and only half-urban-looking delicacy was confirmed by the magnifying lenses. How tightly San Francisco appeared to cling on to its hillsides: One would imagine knuckles whitened, sinews straining, teeth gritted.”

The San Andreas Fault, the Western edge of the The North American Plate, much more volatile than the Eastern edge. We slide over to Parkfield, California, which right now is the seismic capital of the world with numerous earthquakes per month that range up and down the richter scale. We go to Alaska to see where the trans-Alaska pipeline crosses the Denali Fault. The pipeline is crooked like the back of my professor and placed on rollers that will hopefully give the pipeline enough give to not rupture if an earthquake does occur. He does spend a decent amount of time talking about the 8.25 earthquake that forever changed the cityscape of San Francisco. He tells individual stories, some of them by famous people, some of them just incredibly unlucky people like Paul Pickney who had the distinction of surviving the 1884 Charleston trembler and the 1906 San Francisco quake. One of my favorite stories involved a four year old Ansel Adams who was thrown to the ground during the quake and cracked his nose. His parents and doctor decided not to fix the nose, and it became the most rugged feature of his famous, classical profile. 28,188 buildings were destroyed. It was stated, to quell fears of future and present residents, that most of the destruction came from fire (error of man) instead of from the earthquake (God’s wrath). They believe over 3000 people perished, but due to a conspiracy of suppression of the actual numbers only 700 were officially claimed. For the city to rebuild they needed more people to come West, and they quite effectively controlled the narrative of the extent of the destruction. 

It is a rare opportunity indeed to have your picture taken in front of such devastation. Irrefutable evidence that you were there. I thought it was interesting how suicide rates went way down after the earthquake. People suddenly had something more, something larger than themselves, to worry about. If their lives were stressful or pathetic or wretched before the earthquake, suddenly all of that was swept away, along with quite possibly all that they owned in the world. I have often thought that, if everyone had to worry more about day to day living, many of our psychological problems would be reduced in size or even possibly eliminated. I think we have too much time to think about our current state of affairs, many of them beyond our control; and yet, we are swimming in a relative lap of luxury and safety compared to most of human history. It is so difficult to be happy. Maybe we own too much and try to do too much. The San Francisco quake, called the Loma Prieta Earthquake, that occurred in 1989 was not, as everyone hoped, a releasing of pressure along the San Andreas. ”If the assumption about Loma Prieta is correct, then the last time the San Andreas Fault moved in Northern California was not in 1989 but in fact a very long time ago, back in 1906--which means that, with the steady annual movement of its foundations, the two plates are now nearly 200 inches, about 17 feet, out of kilter. This means that an unimaginably enormous amount of kinetic energy is currently stored in the rocks of the Bay Area; one day, and probably very soon, this energy will all be relieved, without warning.”I finished reading this book at about 12:55AM in the morning of November 19th, 2015. I was finally drifting off to sleep after sifting through some of the last pieces of information that Winchester had stuck in my head when I felt or heard a jolt that brought me wide awake. The window in the bathroom rattled. I didn’t for one second think it was a truck rumbling through the neighborhood. I knew it was an earthquake. My daughter texted me from her apartment in Wichita. “Did you feel that?”Oh yeah, I felt it alright. I found out the next morning that it was a 4.7 magnitude earthquake with an epicenter just south of us in Cherokee, Oklahoma. To say this book moved me would be an understatement. The timing couldn’t have been better for the universe to talk to me. If you wish to see more of my most recent book and movie reviews, visit http://www.jeffreykeeten.comI also have a Facebook blogger page at:https://www.facebook.com/JeffreyKeeten"
1,0060572000,http://goodreads.com/user/show/1232712-matt,2,"The story of how I started reading this book begins outside San Antonio, as I guided my Subaru Outback onto Interstate-10, set the cruise control, and settled back for the long, empty ride to El Paso. It was August 2010, and my wife and I were midway through our Great 2010 Unplanned Battlefield Tour Road Trip Extravaganza. After visiting Shiloh, Vicksburg, San Jacinto and the Alamo, I acquiesced to my wife’s plea that we see the Grand Canyon since a) it was the Grand Canyon and b) it wasn’t a battlefield (frankly, the battlefield-centric part of the road trip was my idea). Anyway, we had 700 miles to go to our overnight destination in Silver City, and precious few radio stations to help us pass the time. (Though I contend that my vivid retelling of the slaughter at Goliad was worth at least an hour to an hour and a half). Thus, my wife put in an audio version of Simon Winchester’s A Crack in the Edge of the World: America and the Great California Earthquake of 1906 to bide the time.The first thing we noticed was that Simon narrated this himself, in his rich, Oxford-ian accent, which sounded suspiciously like an average American actor attempting to impersonate a snooty English butler. The second thing we noticed was that his narrative didn't seem to be going anywhere. If Simon wasn’t (putatively) reading from his own book, I would’ve sworn that he’d had a couple glasses of wine and started rambling like Grandpa Simpson.The audio book was so bad it was funny. But after awhile, it was just bad. Accordingly, my wife hit the eject button, and we settled for the tense silence that comes from driving 1,000 miles and visiting four separate battlefields in four days. (The Days Inn in Silver City was a fine cap to that day; before we went to sleep, we played a game called Guess How Many Drifters Were Murdered In This Hotel).I’m stubborn when it comes to books. I don’t like to leave things unfinished. Sometime after we’d returned home, vowing to never speak of my total and absolute meltdown on the Kansas Turnpike (I have to pay to drive across Kansas!? I wouldn’t go to Kansas if they paid me!), I purchased A Crack in the Edge of the World from a used book store. It was the same digressionary, drifting storytelling as before, except this time it was up to my brain to provide the British accent. (And unfortunately, my brain often confuses British and Scottish accents). The book description and the subtitle might lead you to believe it is about the Great San Francisco Earthquake. You wouldn’t be entirely wrong. It’s there, sort of, buried in the midst of a steam-of-conscious verbal ejaculation that mimics Kerouac at his most frenzied, except that Winchester is fueled by ego and snobbery rather than mescaline. Mostly, though, this book is about Simon Winchester, and how he is smarter than you, more well traveled than you, and generally better than you in every particular facet of life. A Crack at the Edge of the World begins with Simon conning his publisher to pay him to travel across the world on a geologic journey, visiting places of seismic importance. Never mind that this mainly consists of Simon driving across the United States making condescending remarks about middle-America, he sure seems to be having fun! (Maybe I’m a bit jealous… I mean, I’d certainly love the chance to get paid to drive around looking down my noses at people and reciting various arcane bits of trivia. Hell, I’d do that for free). Look, I’m not saying Simon isn’t smart. He is. He certainly, most definitely, is intelligent. I know, because he told me. He also has a strong background in geology, so he can articulately expound about all the complex business going on beneath our feet. He goes on and on with erudition and awe about the collisions of tectonic plates and magma and the supercontinent of Pangaea (which will be the foundation for the failed Fox drama I am currently scripting), all of which is illustrated with maps and drawings and a picture of the general store in Meers, Oklahoma, because it’s just so quaint and rustic to his classically trained mind. This is all well and good, except that geology is boring except for the earthquakes so get to the damn earthquake already! Simon gets to the earthquake, rest assured. It just takes 234 pages of meanders, digressions, and entirely useless footnotes about topics completely unrelated to anything remotely touched-upon in this book. The ceaseless introduction of know-it-all non sequiturs might not have been so annoying in a book of more elegance. And to be charitable, there are some nice sequences, including Simon’s description of a night solo-camping on Mount Diablo. The problem, though, is that these detours are interspersed with a lot of seismological jargon that requires slow, careful reading to make any sense. The geology lessons, combined with the anecdotal side-streets, combine to slow the story’s pace to that of the continental drift. This is a short book that feels long, and it feels long for all the wrong reasons. As my frustrations grew, I imagined myself driving a car with Simon Winchester and Jonathan Lipnicki (the little boy from Jerry Maguire) as passengers.JONATHAN: Did you know that the human head weighs eight pounds?SIMON: Did you know that Robert Wallace of the U.S. Geological Survey took a violin with him into the field to serenade coyotes?JONATHAN: Did you know that my next door neighbor has three rabbits?SIMON: Did you know that President Warren G. Harding and King Kalakaua of Hawaii both died in San Francisco’s Palace Hotel and that King Kalakaua’s real name was David Laamea Kamanakapuu Mahinulani Naloiaehuokalani Lumialani Kalakaua? ME: Did you know that I’m driving this car off a cliff right now? Because I am.The section of the earthquake is necessarily disappointing. It’s not bad; not at all. It just underwhelms. This is due to the book’s structure, which does not allow for any narrative momentum. By the time San Francisco gets shook, we have learned all about the San Andreas Fault, Simon’s time as a grad student in Iceland, and the history of the State of California. What we haven’t received is any reason why we should care about the people of San Francisco, who serve mainly as shadowy witnesses to an event that itself becomes a backdrop to the author’s dog-and-pony show. Interestingly, the thing you tend to take away from this account of the earthquake – and which is echoed in other sources – is that most of the death and damage came from the resulting fire. This tends to undercut Simon’s compulsive need to talk about and describe seismology. He keeps warning us that a super-earthquake is going to knock California into the sea; yet he never acknowledges that the story he just told is a cautionary tale of building codes and effective fire response. (To be sure, no one ever went broke warning of our impending doom. All Cassandras – like the original Cassandra – will eventually be right; tragedy is always right around the corner). Despite what I’ve written, I am predisposed to enjoy a book like this. I am fond of the small literary sub-genre of travelogue-histories, in which a writer goes on a personal journey to visit all the artifacts (and the curators watching over them) that combined to make a historical event. Sarah Vowell (Assassination Vacation, The Wordy Shipmates) is a delightful tour guide, and her books brim with chirpiness and humor. Tony Horowitz (Confederates in the Attic, A Voyage Long and Strange) brings a more sober, journalistic discipline to his work, finding unforgettable modern characters who are almost mystically connected to the past. Simon Winchester is just as talented as Vowell and Horowitz. But he’s also as likeable as the Harvard-Bar-grad-student in Good Will Hunting who smarmily recites the works of Gordon Wood to embarrass Ben Affleck. I would love to take a road trip with Sarah Vowell or Tony Horowitz. I tried to take a road trip with Simon Winchester. We heard his voice on the radio and quickly gave up. If he’d actually been with us, sitting in the middle of the backseat, drinking a Slurpee and extemporizing about every historical marker we zipped past, I would have tossed him from the car. I’m certain that Simon Winchester would survive being thrown from a moving vehicle. He is, after all, the smartest person alive. Also, I’m certain that – even alone on a deserted highway – he would’ve found a curious bunny to lecture.And that bunny would listen for awhile, hoping that this odd man with the refined accent would get to a point. Finally, the bunny would give up and bound away. And the night would go on, the stars would come out, and Simon Winchester would still be speaking into the void."
2,0060572000,http://goodreads.com/user/show/279256-diane,3,"This is a fascinating but also frustrating book about the devastating San Francisco earthquake and fire of 1906. Simon Winchester has a passion for geology, which makes him a good person to write about this topic. However, his passion is such that he gets carried away on long tangents, and in truth, this book meandered so much that I nearly abandoned it in frustration. The meandering starts early, with a long prologue about Neil Armstrong and how his trip to the moon affected the way scientists think about the earth. There are also long passages on the history of geology and plate tectonics, along with the author's exploratory trips around the world. There is interesting stuff here, but the information could be have been streamlined.After several chapters, we finally focus more on the California earthquake of 1906, which was my favorite part of the book. Winchester describes the causes and effects of the quake, which was followed by a devastating fire that lasted several days and destroyed much of San Francisco. There is also a discussion about how a major earthquake is expected along the San Andreas fault sometime before 2032. (This section was truly alarming, as was the chapter talking about other fault lines expecting a major rupture in the coming decades, including the New Madrid fault line in my current state of Missouri, which could be devastating for a large chunk of the Midwest.) The last section of the book also meanders a bit, with sidenotes about the history of the insurance industry, and how certain businesses tried to downplay the damage of the Frisco earthquake There are interesting details about how the Chinese immigrants were treated both before and after the earthquake, with some city officials trying to drive them out of town. I also appreciated Winchester's description of how San Francisco was viewed in the late 1800s and early 1900s, and how the earthquake forever changed the city.Overall I liked this book, which includes good photographs and maps, but it seemed like Winchester tried to combine two subjects into one: the history of geology, and the 1906 disaster. The text of this runs more than 400 pages, and I liked most of it, but it needed more editing and revision. Simon Winchester is a prolific author, and I especially enjoyed his earlier work, The Professor and the Madman, which was about the creation of the Oxford English Dictionary. I would recommend A Crack in the Edge of the World to readers who like works about natural disasters or geology, but be prepared for a lot of roundabout discussion.Favorite Quotes""There is a tendency common to most of us to take the more modest of our landscapes for granted. We see a wide and fertile plain, and we drive across it, as fast as its flatness allows, rarely pondering what might have brought it into being. We come across a valley, and, though we might take pleasure in its appearance, we give it all too little thought, other than perhaps to assume there is probably a river somewhere within its folds, And, while we are generally awestruck by the more spectacular mountain ranges, it seems true to say that those hills that are simply hills, or those mountains that are simply mountains, rarely prompt us to ask: Just why are they there? What forces first made them and set them down here, in this particular place?""""This fragile, enchanting-looking place had also appeared, more than anything else, most terribly and fatally vulnerable. ""Despite the variety and gaiety and hyperbole, San Francisco in 1906 was also in fact a big, dirty, brawling, vulgar, smoggy, sooty, and corrupt town of rather less charm than myth and latter-day boosterism would have us believe.""""Trials of any kind — war, pestilence, natural or human violence, with wholesale death or total physical destruction, or both, being the harshest of all — may slow that growth or cause some other setback; but such things are just setbacks, and before long the original reasons for a city's existence reassert themselves. Life returns, buildings and roads are rebuilt, new monuments spring up or old ones are found and dusted off, and before long the city returns to its old self, ready to see what more fate can hurl at it, to challenge and strengthen and temper its will to survive. It may not always entirely regain its predisaster status — San Francisco had to cede much to Los Angeles, for example, But generally, so far as their respective quiddities are concerned, great cities always recover."""
