,isbn,user_link,ranking,review
211,0465094252,http://goodreads.com/user/show/11657479-richard-thompson,5,"This is one of the best physics books that I have read in a while. It is in the heart of my Goldilocks range, not too hard and not too easy. And I really liked the author's point of view. She talks about the lack of progress in basic physics in the last 30 to 40 years, and she does her bit of string theory bashing, but she does so in an even handed way and acknowledges that string theory and multiverses may even be right and that we may find meaningful ways to test them with experiments, even if it is never possible to do so directly. Clearly she favors some theories over others, but she acknowledges that a part of the basic idea of theoretical physics is to use math, intuition and imagination to come up with plausible explanations. And she is willing to give a fair hearing to all plausible explanations, even if she does not find them attractive.In the end, the real point of the book is that the ideas of naturalness, simplicity, elegance and beauty that draw physicists and that drive so much of theory are ultimately philosophical choices that may or may not be right in a given case so that caution should be used in selecting them as guidelines for developing new theories, and that there are inevitable psychological biases that affect even the smartest of us and that have sometimes lead theoretical physics down pathways that have not been productive. Her prescriptions in the end of the book are very practical and fair minded. She doesn't insist that we abandon supersymmetry or string theory or any other popular or unpopular theory, only that we try to be scientific about the way that we do science."
212,0465094252,http://goodreads.com/user/show/68316850-gavin,4,"A look at high-energy particle physics* in its present nightmare (of deep inconsistency and vastly expensive new data). Her thesis is that the problem is sociological and aesthetic: in the absence of new data sources, we form cliques and regroup around incompatible, unempirical beauty intuitions. 
it leads me to conjecture that the laws of nature are beautiful because physicists constantly tell each other those laws are beautiful.

experimentalists working with a detector developed to catch neutrinos reported on the first “interesting bounds on galactic cold dark matter and on light bosons emitted from the sun.” In plain English, “interesting bounds” means they didn’t find anything. Various other neutrino experiments at the time also obtained interesting bounds.
Her prescription is that we should stop limiting the field so heavily with naturalness or geometric naturalness or symmetry or unification or anti-fine-tuning intuitions, which collectively she (following her field) calls ""beauty"". Since Physical beauty is quite distinct from natural-language ""beauty"", I think it'd be better if we left those five components under a different name.Filled with interviews with some of the cleverest, deepest physicists of our time (Arkani-Harked, Wilczek, Weinberg, Lisi, Polchinski) and the several bandwagons they lead, blind, in different directions. Hossenfelder herself is funny, self-critical, scrupulously clear: the kind of curmudgeonly, unbiddable empiricist we always need.
“You ask, why do people still work on it?” Nima [Arkani-Harked] continues. “It’s in fact very funny. As I said, the best people had a pretty good idea what was going on—they were not sitting on their hands waiting for gluinos to pour out of the LHC. They also had a pretty level reaction to the data.”But not one of those “best people” spoke up and called bullshit on the widely circulated story that the LHC had a good chance of seeing supersymmetry or dark matter particles. I’m not sure which I find worse, scientists who believe in arguments from beauty or scientists who deliberately mislead the public about prospects of costly experiments.Nima continues: “The people who were sure it would be there are now positive it’s not there. There are people now who speak about being depressed or worried or scared. It drives me nuts. It’s ludicrously narcissistic. Who the fuck cares about you and your little life? Other than you yourself, of course.”He isn’t speaking about me, but he might as well be, I think. Maybe I’m just here to find an excuse for leaving academia because I’m disillusioned, unable to stay motivated through all the null results. And what an amazing excuse I have come up with—blaming a scientific community for misusing the scientific method.On the plane back to Frankfurt, bereft of Nima’s enthusiasm, I understand why he has become so influential. In contrast to me, he believes in what he does.
That sweet bitterness is telling; Hossenfelder is the broke-down hard-boiled P.I. of particle physics.
I shouldn’t be here, I should be at my desk, reading a paper, drafting a proposal, or at least writing a referee report. I shouldn’t psychoanalyze a community that neither needs nor wants therapy.

I hook onto the Wi-Fi. After a week of nonstop travel, my inbox is filling with urgent messages. There are two unhappy editors complaining about overdue reports, a journalist asking for comment, a student asking for advice. A form to be signed, a meeting to be rescheduled, two phone calls to be made, a conference invitation that needs to be politely declined. A collaborator returns the draft of a grant proposal for revision.I remember reading biographies of last century’s heroes, picturing theoretical physicists as people puffing pipes in leather armchairs while thinking big thoughts.
Her exposition is impressively clear, covering the whole standard model (and quantum mechanics, and much of modern cosmology) in plain diagrams and terse language. (Though, as usual with pop science, one can't really spot where the simplifications are misleading unless you're already an insider.)The heavies are in general very open and undogmatic about the state of things (they can afford to be, what with tenure). Weinberg:
 I don’t know how much elementary particle physics can improve over what we have now. I just don’t know. I think it’s important to try and continue to do experiments, to continue to build large facilities… But where it will end up I don’t know. I hope it doesn’t just stop where it is now. Because I don’t find this entirely satisfying… I don’t take seriously any negative conclusion that the fact that the LHC hasn’t seen anything beyond the standard model shows that there isn’t anything that will solve the naturalness problem… Supersymmetry hasn’t been ruled out because it’s too vague about what it predicts.
(There's a nice bit where Weinberg hears a new philosophical/historical theory of physics - that the revolutions always involve overthrowing an old aesthetic principle - and is immediately nerd-sniped and charmed by it. Also Wilczek:
According to McAllister, scientists don’t throw out everything during a revolution; they only throw out their conception of beauty. So whenever there is a revolution in science, they have to come up with a new idea of beauty. He lists some examples for this: the steady state universe, quantum mechanics, et cetera.“If that was true,” I go on, “it would tell me that getting stuck on the ideas of beauty from the past is exactly the wrong thing to do.”“Yes, right,” Frank says. “It’s normally a good guiding principle. But occasionally you have to introduce something new. In each of these examples you find, though, that the new ideas are beautiful too.”“But people only found that new beauty after data forced them to look at it,” I point out. “And I’m worried we might not be able to get there. Because we are stuck on this old idea of beauty that we use to construct theories and to propose experiments to test them.”“You might be right.""
)She even seeks out the ugliest theories, like Xiao-Gang Wen's string-net condensation, trying to find her own aesthetic limits:
I am skeptical, but I tell myself to be more open-minded. Isn’t this what I was looking for, something off the well-trodden path? Is it really any weirder to believe everything is made of qubits than of strings or loops or some 248-dimensional representation of a giant Lie algebra?How patently absurd it must appear to someone who last had contact with physics in eleventh grade that people get paid for ideas like that. But then, I think, people also get paid for throwing balls through hoops.
This bit understates a real problem (it implies we don't use Solomonoff induction out of pique rather than incomputability):
A way to objectively quantify simplicity is by computational complexity, which is measured by the length of a computer program that executes a calculation. Computational complexity is in principle quantifiable for any theory that can be converted into computer code, which includes the type of theories we currently use in physics. We are not computers, however, and computational complexity is therefore not a measure we actually use. The human idea of simplicity is instead very much based on ease of applicability, which is closely tied to our ability to grasp an idea, hold it in mind, and push it around until a paper falls out.
Better than The Trouble with Physics which I also liked (though he was narrower and less balanced about string theory). Maybe 5/5 if I reread it. Her blog is extremely worthwhile and more technical and thus less untrue.* OK, ""high-energy particle physicists and also Grand Unified Theorists of whatever stripe including some cosmologists"". But it is wrong to say that ""physics"" tout court has a crisis, nor indeed does Hossenfelder say this. (She didn't choose her own subtitle.)"
213,0465094252,http://goodreads.com/user/show/17468009-galen-weitkamp,4,"Lost in Math: How Beauty Leads Physics Astray by Sabine Hossenfelder.Review by Galen Weitkamp.The first thing that struck me when I opened this wonderfully perplexing book is the table of contents. Chapter 1: The Hidden Rules of PhysicsIn which I realize I don’t understand physics anymore. I talk to friends and colleagues, see I’m not the only one confused, and set out to bring reason back to Earth.Chapter 2: What a Wonderful WorldIn which I read a lot of books about dead people and find that everyone likes pretty ideas but that pretty ideas sometimes work badly. At a conference I begin to worry that physicists are about to discard the scientific method.I felt like I was reading Don Quixote again in which each chapter title is followed by an extended subtitle (introduced by the in-which trope) that humorously summarizes the adventure ahead. The second subtitle above nicely introduces what is probably the main concern of Dr. Hossenfelder’s book. The general reader may be surprised to learn that Mathematics and Physics can be pretty. Indeed they can be, but you don’t have to agree - after all, “Beauty is in the eye of the beholder.” There are many reasons why a mathematician or a physicist might think an idea is pretty, or beautiful or natural. For example, if it unifies under one explanation two disparate phenomena; or it generalizes a previous technique or assumption thereby promising to extend the latter’s domain of application. But how could a pretty idea waylay and corrupt the scientific method?To be regarded as a part of physics, an idea must have observable physical consequences. To be empirically distinct, it must have some observable consequences that distinguish it from other physical theories. To be acceptable it can’t have any consequences that contradict observation. Some of these things can be checked at the blackboard; but checking the predictions of a theory against the real world cannot. Observational verification can require a lot of time, effort and money. Since the Standard Model (of Particle Physics) was worked out in the seventies newer particle theories have been proposed that either generalize its symmetries (to make it mathematically more palatable) or attempt to geometrically unify particle theory with general relativity. Over the decades experiments have consistently confirmed the Standard Theory. No experiment or particle accelerator to date has been able to verify any of the distinguishable consequences of Supersymmetry, String Theory or Loop Quantum Gravity. The issue for theorists is: what to do in the absence of experimental confirmation. What clues should one pursue, if observation provides none? What’s left other than one’s own prejudices about what’s natural, what’s pretty or what’s beautiful? Dr. Sabine Hossenfelder discusses these issues at length, and makes some suggestions. Physicists should be aware of confirmation bias and all the other kinds of bias to which humans are susceptible. She also suggests that physicists interested in foundational issues should focus on unraveling contradictions rather than on unification or prettifying the ugly. "
214,0465094252,http://goodreads.com/user/show/21126957-hind,5,"Like Sabine writes and tries to address, physics has worked itself into a state where all our experiments result in null result after another, and our cutting edge theories are mere speculations of science fiction. The way she approaches this problem, trying to figure out how we got here, what we can do to fix it, and whether what we’re doing is justified in the first place, is wonderful. This is an excellent popular work on the cusp of physics and philosophy, but it comes with a little requirement of some understanding of theoretical physics. Recommended reading for scientists or scientists-to-be."
215,0465094252,http://goodreads.com/user/show/16212136-peter-pete-mcloughlin,4, As a corrective to taking theoretical speculations in physics and cosmology too far this book does a good job. It is a lament that using aesthetics in mathematics as a guide to theory is an unreliable guide to science in general. The conundrum is this. The data at the foundations is getting scarcer and scarcer as we push the limits of experiment. Particle accelerators can't reach high enough energies to probe things the way we'd like. With the scarcity of data at the frontier theoretical physicists decorate unknown parts of the map with embroidery of a mathematical aesthetic. The author hammers this point repeatedly. But what else are theoretical physicists gonna do when left to their own devices without much data to go on. Outside of banning the profession (not a good move) theoretical physicists are gonna do what they do. I don't know outside of some skepticism what her plan is.
216,0465094252,http://goodreads.com/user/show/17056998-mark-moon,4,"Thematically similar to Smolin's ""The Trouble with Physics"" but not so similar as to be uninteresting. Contains some brief excerpts from interviews with a variety of physicists with widely differing views on the relevance of aesthetic principles in cooking up new physics. I found the style informal in a pleasant way, and there was enough technical detail (especially in the notes) for my taste as well."
217,0465094252,http://goodreads.com/user/show/73419547-doctor-moss,5,"I liked Hossenfelder’s book a lot more than I was expecting. Given my expectations, I’m not sure why I bought it in the first place. I was expecting something along the lines of another physicist complaining that other physicists have abandoned empirical testability as the fundamental criterion by which to evaluate theories, and have gone wild with speculative, untestable theories like multiverse theory, string theory, and anthropic theories. And she does complain about that, but she also accepts that the solution cannot be simply to demand testability in some neo-Popperian dogmatism — there are good reasons for speculative mathematics in physics.The ultimate test of a scientific theory is still, by her thinking, empirical test. But that’s just part of the story. You can’t just “observe nature.” What do you observe? How do you observe it? What do you pay attention to? Those are all basic problems, although sometimes whisked by quickly as if their answers were obvious.Physicists look FOR things, led by speculative hypotheses. Their field of vision is narrowed by what they are looking for, and they construct increasingly complex (and expensive) ways of reaching the conditions under which they believe what they are looking for will be observable and in which they can focus their observations on what they are looking for. Doing so requires making bets on what they are likely to find, on what the unobserved parts of reality are like. Contemporary theoretical physics has reached this point in spades. Solutions to outstanding problems require energies beyond those reachable with current experimental technology (e.g., particle colliders) or observations of unreachable times and places (the early universe or hypothetical multiverses).Physicists have to make choices about which research directions are promising and which are not. Their funders have to make the same choices.But how, in the absence of empirical tests, do you evaluate speculative answers to problems? Of course, that’s not a new problem for physics or other sciences. Why did Kepler choose conic sections as a direction to pursue in understanding the orbits of the planets? The answer now doesn’t seem so different as the answer then.Physicists have had a long love affair with what Hossenfelder calls “aesthetic” criteria. Although the book’s title mentions only one criterion — “beauty” — and although Hossenfelder often talks about beauty as the criterion scientists use, it’s really an indistinctly bounded family of criteria, sometimes employed formally and rigidly and sometimes more intuitively.Chapter 5 of the book, titled Ideal Theories, distinguishes three criteria that she refers to as “presently popular themes” in theoretical physics. These are simplicity, naturalness, and elegance. Each has its own quirks and controversies.The influence of “beauty” in physics is certainly strong. Hossenfelder cites many examples, both within physics and in other scientific areas, where scientists have expressed the belief that a theory is so beautiful that it must or should be true. Paul Dirac is famous for his preference for mathematical beauty. Hossenfelder also cites the double helix model of DNA, said by James Watson to be “too pretty not to be true.”Things that are not pretty are things that are arbitrary, that have odd, unexplained values (the cosmological constant, or the mass of the Higgs boson), or that are overly complex and lack plain old intuitive comprehensibility (see Richard Feynman’s remark that “nobody understands quantum mechanics.”). Even when we have data against which to test theories, we still have an underdetermination problem. More than one theory, in fact many theories, may account for the data — which one do we choose? We use criteria such as the ones Hossenfelder talks about. And we, as she also recognizes, ask more than just that a theory account for the data — it should have some explanatory power as well — not just generate accurate predictions of result data but provide an understanding of how and why the results are what they are.Hossenfelder believes that the current criteria may or may not be the right ones, and may be rightly or wrongly applied. The problem shows itself in predictions that don’t come true (e.g., the new particles that, at least according to some accounts, should have been produced by now in runs of the Large Hadron Collider) or in a general chaos of theories, e.g., string theory or multiverse theory, that lack empirical tests and that provoke seemingly unresolvable debate.It’s important to realize that these criteria are not themselves empirical. It’s not as if scientists have tested naturalness, simplicity, and elegance and found, on the basis of empirical testing, that these are reliable criteria, their anecdotal successes notwithstanding.In part, what she prescribes is self-awareness. What are the assumptions, and what are the criteria that you are using in proposing a theory, or in devising ways of testing it? Are those assumptions and criteria examined? Can they even be well articulated? These questions sound at least partly philosophical, and Hossenfelder believes that a closer working relationship between philosophers and scientists is definitely part of the prescription. Too often, each has been trespassing, as fumbling amateurs, on the others' territory. One philosopher whose work she finds especially interesting is Richard Dawid, who has written a book (String Theory and the Scientific Method) probing into non-empirical evaluation of scientific theories. Philosophers like Dawid and cosmologists like George Ellis, with whom Hossenfelder talks late in the book, could build bridges between what has been a difficult relationship.Other prescriptions have to do with institutions, in which these “aesthetic” criteria have become embedded — universities, grant application and evaluation processes, publications and their evaluation criteria, . . . Hossenfelder includes an appendix, titled What You Can Do to Help, for scientists, administrators, policy makers, and others, including members of the public. Hossenfelder is easy to read. She writes in a colloquial, slightly irreverent manner — she presents herself as a dissatisfied member of the theoretical physics community looking for answers to the questions of the health of her profession. The book follows a kind of quest from place to place and interviews from one scientist to another (including names like Steven Weinberg, Nima Arkani-Hamed, as well as less mainstream theorists like Garret Lisi), trying to diagnose the problem physics has run into and how to get out of it. It feels very personal. She’s asking a kind of existential question — has my field totally gone off the rails, or do we have a way forward? I won’t spoil the ending."
218,0465094252,http://goodreads.com/user/show/11509598-alex-lee,4,"This is a pretty interesting book. At the end of each chapter Hossenfelder gives a summary of her points. Essentially this book approaches a philosophy of science, although she doesn't speak of it. Instead she wants to know what the state of physics is today. She interviews many different people and in the process comes to some conclusion that the state of her discipline is that people have mistaken mathematics as foundational for doing physics instead of experimentation. What Hossenfelder misses is the vehicle of a ""metaphysics of presence"", which is a rhetorical/discursive modality of self-BSing. To a large degree many of the Platonists and mathematicians that seek Platonism fall under the spell of their own conjectures, believing them to have some inkling of a greater, more universal, Truth.In other words, Hossenfelder rightly points out that her colleagues are using Math to do philosophy instead of physics, even though the content of their discussions are from physics... essentially doing science is a method, an approach that is substantially different from the methods of philosophy which have a different manner of putting things together. Hossenfelder finds the long way around to say this, probably to explore different aspects of physics (as there are many scientists), and because she lacks the philosophical language to make her point. All in all, a nice book, even if with the right language, it could be tighter.(This can be seen as part of a larger debate. It is covered in a chapter by Imre Lakatos on the Analysis-Synthesis method used by Descartes -- and why it was rejected)."
219,0465094252,http://goodreads.com/user/show/5157049-marie,3,"This is not my usual cup of tea, because I abandoned STEM long ago. It was sometimes heavy, interesting, witty, funny, even. And yet it got me going in a completely different direction of what beauty is, then again, like you can blame me for that. Just to clarify, Hossenfelder is no aesthete herself, as she uses a common definition: that beauty is a subjective criteria that we're too obsessed with seeking, but has no bearing in science (well, I could agree with this, but then again, the discussion about beauty is broader). In the case of physics, we're speaking of mathematical simplicity or expecting symmetry in physical theories that lead to things impossible to prove through experimental methods (i.e. some kinds of multiverse theories that seem pure terrible philosophical speculations to pretend you can control the whole destiny of the world because ""there's an universe where this could happen out there""One of my hobbies is to read about philosophy of science, particularly in the ethical / philosophical field, but this was a good reminder of the dangers of bad methodology and pseudoscience.The structure of the book follows between simple examples to understand physics and contemporary academia, interviews, and Hossenfelder's unmistakable use of sarcasm."
