,isbn,user_link,ranking,review
14,0393308189,http://goodreads.com/user/show/167115-ken-bishop,5,"Stephen Jay Gould is my favorite writer in any branch of science. He writes beautifully (loves words) and can explain anthropology to the layperson. Gould is one of the best people to correctly explain Darwin. The majority of writers who try to explain evolution, don't have a clue what they are talking about. If you are interested in this topic read all of his books. Sadly he is no longer with us, but his books live on."
15,0393308189,http://goodreads.com/user/show/19341029-aur-lien-thomas,4,"Simply divided, this book makes out of a broad and complex topic (evolutionary science) an entertaining and accessible subject.Some articles are more interesting than others, an unavoidable imbalance for such a collection but, all in all it's clever, very well written, witty at times and, always relevant.As this was my first Stephen Jay Gould, I would particularly recommend it to whose not knowing where to start with such a prolific writer. "
16,0393308189,http://goodreads.com/user/show/30490019-susan,5,"What I found most valuable about this book was Gould's careful (and sometimes irritated) explanations of evolution, what it does and doesn't do. I realized that even people who deny evolution should read it so that they at least understand what the evolution is that they reject, because common assumptions people make about evolution are not right at all."
17,0393308189,http://goodreads.com/user/show/51084501-doug,5,Wow! What a collection of essays! I have always wanted to read Stephen Jay Gould and this was my first book. What is amazing about his writing style is his knowledge of popular culture and how he integrates it into his writing! I found myself stopping and really thinking and reflecting about what he just said! Brilliant man! Can’t wait to read his Wonderful Life book soon!
18,0393308189,http://goodreads.com/user/show/59054793-tom,5,excellent collection of essays. all gould's little pet topics are here (though only one reference to baseball). some of the subject matter would later be expanded upon in gould's book the mismeasure of man. i look forward to eventually reading the 9 other essay collections !
19,0393308189,http://goodreads.com/user/show/3189852-nathan-box,3,"As always, this is not a book report. Rather, it is an opportunity to discuss some ideas that stuck with me while reading “Ever Since Darwin” by Stephan Jay Gould.”The Debate Should Be OverDuring the 2012 Republican Party Primary run, a debate was held where the nominees were asked to raise their hands if they believed in the theory of evolution. Most of the candidates raised their hands. As I watched, I was baffled that this is still a debate. Sure, we have learned much since Darwin first established the theory. If anything, what we learned has moved us closer, not further away from this truth. So, why the debate? Simply, religion. Evolution flies in the face of intelligent design. There are those who believe evolution might be a tool used by God, but there are vast swaths of believers who profess to biblical truth; the world was created in 7 days, man was made in the image of God, and we may have lived while dinosaurs roamed the Earth. Evolution pokes holes in the story of creation. This keeps it from being widely accepted.Legacy of Debate One of my favorite quotes from this book is the following:""As the new Darwinian orthodoxy swept through Europe, its most brilliant opponent, the aging embryologist Karl Ernst von Baer, remarked with bitter irony that every triumphant theory passes through three stages: first it is dismissed as untrue; then it is rejected as contrary to religion; finally, it is accepted as dogma and each scientist claims that he long appreciated its truth."" -Stephen Jay GouldThe theory of evolution unleashed debate across the world. Like any good theory, it was debated in the scientific community, tested, peer-reviewed, and then accepted. To this day, it is debated on the grounds of philosophy, religion, sociology, and still within the hallowed halls of academia. No theory has had such a profound impact on humankind. Beyond the debate itself, the way in which we’ve conducted ourselves while in the midst of debate has revealed much about ourselves. In my opinion, this theory and the theory of global climate change have caused something dangerous in our culture to rise, a war against intellectualism. In this war, facts don’t matter, and opinions win the day. A civil society built on the legacy of debate cannot prosper if there is no clear winner.Evolution MisusedMankind has a way of misusing new findings. Evolution was and is no different. Think of Hitler. Think of all those conversations about a superior race. Think of eugenics. Think of the harm we’ve done to each other because we didn’t fully understand a theory. When I think of the greatest invention of my lifetime, the internet, I think of the profound good connecting the entire world together can do. I also think of the myriad of ways in which it has been used to hurt people. Reflecting on evolution and where we currently find ourselves, I can’t help but think this may be the natural order of human discovery: theory, misuse, course correction. If that is the case, I hope we are soon arriving at a point in human history where the greatest inventions of our time are used for their most noble of intentions.Human NatureEvolution has much to say about human nature. It can begin to explain the way we are. It can begin to answer some of our most profound questions. How did we get here? How did the world begin? Where are we going next? How we choose to use this information is up to us. It can inform or cripple. It can answer or sow seeds of deceit. It can close gaps or deliver us to questions that can never be answered. My hope is, as with all things, that we will use it for good and to enlighten ourselves. Anything less would be a disservice to the pioneering man who first brought such an idea forward.Be good to each other,-Nathan"
20,0393308189,http://goodreads.com/user/show/32563817-douglas,4,"Science has long been the hole in my education, but thanks to Stephen Jay Gould, I believe I have found a medium to at least partially fill it. This essay collection, though not uniformly excellent (as it cannot help but be, the essays being written as they are on a wide variety of topics and at different times), is fascinating and educational nonetheless. It is productive, I think, to contrast this with another well-regarded science book written at the same time but with which I was much less impressed: ""Cosmos"" by Carl Sagan. If the latter book is rather more famous, I found that it has not aged well. It is primarily concerned with conveying how amazing the stars are, but it does so over a decade before the launching of the Hubble Space Telescope, and I tired of Sagan's tone of amazement towards everything.Though I have no doubt that a biologist would find the ""what"" of much of the science to be outdated - I was surprised to see continental drift written about as a very recent development - the ""how"" is fresh and interesting. By this I mean that pretty well all of the essays I most enjoyed were those that related to method: what counts as evidence, what evidence is strong, which is weak, why are some theories accepted and not others, etc. The specifics of what exactly is being examined mattered little, as I found myself excitedly telling my girlfriend about the cyclical variations in the populations of cicadas.Still, for my next foray into Gould's work (and there will be a next), I think I will probably skip ahead a few years to get something from at least the 1990's, science advancing as rapidly as it does. But Gould writes with such clear, vigorous prose and has the range of interests and learning that I prize in a writer that I would unhesitatingly recommend this to anyone. Orwell, Hitchens, Sowell, and Woolf will have to make room for another member in my pantheon of favourite essayists.4/5 "
21,0393308189,http://goodreads.com/user/show/11363783-angela,3,"Unlike some of the reviewers sharing the rating I have given this book, my problem is not Gould's alleged liberal humanistic standpoint. I would say that I personally share that, and his occasional flash of understanding that scientists are hampered in their thinking by social structures is very welcome to sociologists. However here Gould too often himself remains less critically analytical than he should, and still too easily retreats to commitment to the ""just so story"". Sometimes he seems to be bringing on critical analysis as a pawn to allow him to retreat to his own commitment. As is usually the case with evolutionary theory and Darwin especially, trying to build a science on the text of one man is always is danger of being snared by quasi-religious attitudes, and one sees it here even in Gould's tentative writing."
22,0393308189,http://goodreads.com/user/show/37163866-kiryl-bushwackacowski,4,"Excellent book by an engaging and knowledgeable author. The part touching on sociobiology and contemporary debates raging in this area is interesting not least because Gould gives us the tools to evaluate and debunk ideas where the scientific method isn't the primary driver but merely an afterthought or a rattly scaffold upon which individuals mount their arguments. Four stars only because I honestly wish there were more essays on evolution, paleontology, geology, and similar subjects, as they were simply fascinating."
23,0393308189,http://goodreads.com/user/show/4560826-jared,4,"Excellent collection of essays from an esteemed biologist. He focuses on big topics and uses fascinating examples to illustrate his points. Gould is certainly one of the great science communicators of our time. Some of the essays are notably out of date, but this gives us insight into how far we have come and what some of the controversies in biology have (and still) exist. Most chapters are ~6-7 pages long so it is a great book to read in short bursts or to have on hand when you need to fill some town time."
24,0393308189,http://goodreads.com/user/show/7591561-ivan-labayne,3,"science delivered by journalism; not shy about reflexive insights on the conduct and history of science and social commentary (there are attacks on racism, there was citations on engels re: questioning the naturalized supremacy of the mind); data presented not in the typecast dry way of science (cicadas reproduce every 13 and 17 years para di sumabay sa reproduction ng kanilang predators), for the majority of the existence of life, prokaryotic organisms lang ang meron). "
25,0393308189,http://goodreads.com/user/show/25481916-anthony-peter,2,"I like Gould's writing, but this first collection I found hard going. I think this was because several essays were on subjects that lacked, for me, enough rootedness in the concrete - 'Science in Society', 'The Science and Politics of Human Nature', 'Size and Shape'. In the essays on Darwin himself and Evolution I felt on surer and easier ground.I'll be trying 'The Hedgehog, the Fox, and the Magister's Pox' next."
26,0393308189,http://goodreads.com/user/show/57979716-isaac-jensen,3,"I quite enjoyed the first half of the book which focused on elucidating interesting examples of principles of natural selection in action. When he turned to the subject of humans, my interest waned. Gould rightly placed a strong emphasis on debunking pseudoscientific explanations of human difference and presents an agreeably enlightened take on human genetics and evolution, but it feels like a drag."
27,0393308189,http://goodreads.com/user/show/51015353-christina,4,This collection of natural history essays was a great read - enough scientific details mixed in with narrative-like explanations that you come away with a deeper understanding of the material without being bogged down in facts and figures.Will definitely be searching out his other collections.
28,0393308189,http://goodreads.com/user/show/31716487-miao,3,There are always things that are nice but you don't really like them.
29,0393308189,http://goodreads.com/user/show/80016610-kyle-boomhower,4,"Some essays were more compelling than others, but overall a great - and important - read for anyone interested in evolution or - more generally - natural history. "
30,0393308189,http://goodreads.com/user/show/34041951-henry-kline,4,"I found one of SJ Gould's collection of commentaries that I had not already read, great read even forty years after the fact"
31,0393308189,http://goodreads.com/user/show/92064005-zek,5,Wow
32,0393308189,http://goodreads.com/user/show/20792139-a-wallflower,4,This took forever. I’m happy I took notes all along. 
33,0393308189,http://goodreads.com/user/show/1690088-tony,2,A bit heavy for me.
34,0393308189,http://goodreads.com/user/show/178754-kate,5,"A pleasure from start to finish. I've been wanting to read Gould for ages, and he was even better than I expected. Can't wait to find more."
35,0393308189,http://goodreads.com/user/show/74228902-yip-chung-ping,5,I just like this book
36,0393308189,http://goodreads.com/user/show/26487643-tina-ambury,3,"A little dated. Certainly, some of the debated theories from the 70's have thankfully been trounced.Still, I like that the author has largely come down on the right side of history."
37,0393308189,http://goodreads.com/user/show/48206648-william-bibliomane,5,"This is the first volume of Gould's essays, reprinted from Natural History magazine in the days before the publication became little more than a shell of its former glory. Gould was, to my mind, a polymath. These essays may have slightly dated by now -- I read them nearly twenty-five years ago -- but this teacher's command of the language and skill in rational argument should make him required reading whether he's current or not. Good writing -- great writing -- should never go out of fashion. Just thinking about this book makes me feel as though I should read it again. Highly recommended. "
38,0393308189,http://goodreads.com/user/show/1866535-dave,4,"Unlike many of those who discuss the subject today, Stephen Jay Gould had a very positive and non-defensive approach to discussing evolution. “Ever Since Darwin: Reflections in Natural History” is Gould’s first book and is a collection of essays which Gould wrote between 1974 and 1977 for “Natural History Magazine”. These are organized into 8 sections which cover everything from the basics of Darwin’s theory through applications of that theory to the evolution of humans, through the history of life on Earth and the view and role of science in society. All in all there are 33 essays included on a diversity of sub-topics involving the theory of evolution, though certainly some points are repeated as one would expect when dealing with individual essays on a related subject.Stephen Jay Gould’s writing is easy to read, and these essays are targeted to people interested in science, but you don’t have to be a scientist to understand them by any means. Gould also makes the reading more entertaining by including interesting bits of trivia, such as covering who was the naturalist aboard the Beagle, correcting many bits of misinformation regarding Darwin and his theory, and discussing why Darwin waited so long before publishing. Unlike many more recent books (this book was originally published in 1977), Gould avoids getting drawn into the name calling which goes on between creationists and Darwinists. Gould’s enthusiasm for the subject comes through in his writing, and his passing in 2002 from cancer was a great loss to science, as well as to the public discussion of science to which he offered a thoughtful and insightful voice. That is not to say that Gould was never the focus of controversy, as he forced evolutionary biologists to rethink some of their ideas due to his ability to view things from a different angle. Some have claimed that his theories, such as punctuated equilibrium which he developed with Niles Eldredge, were never more than what was already contained in the theory of evolution, but I still see the echoes of his approach in many recent articles about evolution.I have heard some people claim that Gould later decided that “Ever Since Darwin” was his worst book, though I have never been able to verify this claim. It wouldn’t surprise me if that were true, as many authors cringe when looking back on their earliest works. That being said, I think the essays in this book still offer a wonderful place for those who are interested in the subject to get a good understanding of the subject and the theory. Of course, given that it was published in 1977 there is so much more that has been discovered that this should not be the only resource that one uses, especially if you want to understand the current state of the theory. "
39,0393308189,http://goodreads.com/user/show/802988-john,3,"Stephen Jay Gould was a Paleontologist and scientific ""philosopher""/thinker from Queens (!!!!) who taught at Harvard and also worked for the American Museum of Natural History. This book is a collection of his monthly essays/writings for ""Natural History Magazine"" through the 1970's. In it, Mr Gould outlines the social history of the Natural Sciences from Darwin up to the present (1979). When I say, ""Social History"" I am referring to the Scientists themselves. Stephen Jay Gould is a tireless champion of Darwinian ""theory"" and a formidable opponent to any scientist or philosopher who has tried to oppose the Theory of Evolution or Natural Selection. To do so, he has used Natural History magazine (a publication of the Museum) as his ""bully pulpit"".What is remarkable about this book, is how complete a record it is of the entire history of Natural Science (literally, ""Ever Since Darwin""). Mr Gould has specifically written these articles for the layman (not the scientist) and does not assume any prior knowledge in the Natural Sciences. He starts by explaining Darwin's theories in three easy sentences, proceeds (in progressive chapters) to give you the entire history of Natural Science from it's nay-sayers to it's newest controversies. His is a mind which can teach complex issues to the would-be interested without talking down to those who take the time to read his arguments. It's a fantastic overview of the History of Natural Science from a man who spent his life studying, championing, and teaching Natural History."
40,0393308189,http://goodreads.com/user/show/10134473-siria,5,"Gould's collection of essays is a must-read for both aspiring scientists and the public at large who wish to deepen their understanding of evolution and dispel pernicious misconceptions that have plagued the field since its inception in 1859 with Darwin's publication of On the Origin of Species. Each essay discusses an aspect of biology or evolution in the social context, or, how society (and often leading scholars in the field) have incorrectly perceived the concepts laid out in Darwin's work. The final chapter focuses on Gould's criticisms of biological determinism and the negative social impacts such a bias can engender: racism, sexism, etc. Although some essays do feel ""dated,"" particularly those covering the then-recent theory of plate tectonics, they still provide critical insight on how scientific theories are accepted or rejected in light of social biases to uphold the status quo. What makes Gould's perspective fascinating, aside from his eloquent writing style and evident mastery of his field, is his devout objectivism and insight into why even disproved theories are rational, scientific, and appropriate for the time. To dismiss the merit of Gould's work for it's datedness is as shortsighted as dismissing Darwin's work for not describing a mechanism to drive natural selection.I look forward to reading more of Mr. Gould's work and will strongly recommend it to my peers."
41,0393308189,http://goodreads.com/user/show/8401086-shucheta,4,"I just love the way Gould's mind works. He is always questioning Orthodoxy, he is not blind to be fact that the way our brains process ""pure facts and data"" are highly colored by our world view and our beliefs. Science, is after all, a human activity. Gould makes a brilliant case for this contention in his essay about plate tectonics and continental drift. Gould shows that same data can be, and has been used to support two completely opposing claims of static continents and continental drifts, depending on which theory was widely accepted at the time of interpretation. This understanding makes Gould a true skeptic. I started reading this book to understand the whole ""Pluralism Vs. Adaptionism"" debate of evolution, since Gould has been one of the most vocal advocates of Pluralism. This book, however, only briefly touches the subject- in only two essays and the epilogue. Gould criticizes sociobiology because of its deterministic approach and states that a gene centric approach (adaptionism) is going too far but doesn't really provide much evidence for the latter claim. There's a lot o ""I hope"", ""I suspect"" and ""I believe""s. So the whole debate still feels like a non-debate to me. Perhaps Gould elaborates in his later books. But I can understand why Gould started questioning adaptionism, because it has become orthodox, and Gould knows that orthodoxy is anything but unshakable. "
42,0393308189,http://goodreads.com/user/show/1028300-glen-engel-cox,3,"Jill had been trying to get me to read Gould for over a year. She subscribes to Natural History and so had a fresh dose every month to tackle me with. And I’m not sure of my reluctance. Jill would say that it’s because I’m reluctant to do anything that she wants me to do–I’m not ready to admit that (I certainly hope that that’s not true!). I think it may have been that I didn’t want to add Natural History to my voluminous stack of stuff yet to read– cleverly forgetting, if I had ever truly realized it, that Gould’s column was collected, and continuously being collected, in a series of volumes, of which this one is the first. Maybe I just wanted to start from the beginning.It’s a good thing that Jill had introduced me to some later Gould, because this, while genuinely entertaining, and definately intellectually stimulating, is a rougher mix. Gould has grown as a writer (and probably as a scientist) since originally starting his column.This isn’t a book to try to read at one sitting (I think it’s been at my bedside for the last year) because it is thick and meaty. While Gould attempts to write at a level that a layman can understand, he doesn’t simplify things. It’s a tough slog through some of these essays, but always worth the effort. I’ve got the next volume by the bedside now, and I look forward to growing with Gould."
43,0393308189,http://goodreads.com/user/show/10768018-jo-o,5,"""We can resolve small questions definitely (I know why the world will never see an ant 25 feet long). We do reasonably well with middle-sized questions (I doubt that Lamarckism will ever enjoy a resurgence as a viable theory of evolution). Really big questions succumb to the richness of nature—change can be directed or aimless, gradual or cataclysmic, selective or neutral. I will rejoice in the multifariousness of nature and leave the chimera of certainty to politicians and preachers.""SJ GouldThe book contains 33 chapters, which were originally essays published in magazines, reorganized to built this book that dives into 8 major topics of biology and geology: Darwinian history; Human evolution; Odd organisms and evolutionary exemplars; Patterns and punctuations in the history of life; Theories of the Earth; Size and shape; A historical view of science in society; The science and politics of human nature (part a: sex, race, and violence / part b: sociobiology).This book is a must have for enthusiasts of natural history. You will find the major themes, important histories from diaries and unfinished manuscripts, incredible obscure factoids, most tenacious debates of the last centuries and extraordinary real life examples of evolutionary theory meeting each other in a kaleidoscope of addictive writing style."
44,0393308189,http://goodreads.com/user/show/8444056-todd-stark,5,"This was Gould's first published collection of his magazine columns, for essays written between 1973–1977 and it illustrates why he was justly considered a masterful essayist. He is telling us a lot about biology but he is doing it in a way that also tells us a lot about how science is done. In his memorable examples and vivid descriptions he reveals the central role of imagination in science, along with the historical and cultural shaping of our imagination. Gould's own philosophical biases are sometimes evident in his essays, as they were even more in his later book ""Mismeasure of Man,"" but in this collection throughout he is very realistic about both the strengths and limits in our scientific understanding of living things. There's a certain measured skepticism here of our grand attempts at storytelling, all the while telling his own stories to illustrate, and always retaining a deep admiration for the things nature reveals to us when we look closely, carefully, and thoughtfully. This is Gould at his best I think, a splendid example of popular science writing that is both educational and deeply reflective and sets high expectations for its readers rather than talking down to them. "
