,isbn,user_link,ranking,review
13,0060572000,http://goodreads.com/user/show/7788536-curtis-edmonds,2,"Let us suppose that you are to take a flight from New York to California. You book the flight, make time to head out to the West Coast, and make your way to JFK. Only when you arrive, you find that your flight had been cancelled. The only flight available is out of Newark Airport, and it routes through some airline hub out in the middle of the country – Houston or Dallas or Chicago or Cincinnati, take your pick. So you get on a shuttle bus and head for Newark, and board your new flight, and settle in for a long siege. You’ve seen the in-flight movie. You’ve finished your novel well before you reach your intermediate destination. And then there’s a long layover, and you get back on another plane, with the same in-flight magazine and discarded USA TODAY sections and nothing else to read. And somewhere, over Kansas, you speculate that you are still a long, long way from San Francisco. Readers of A Crack in the Edge of the World: America and the Great California Earthquake of 1906, can relate, and more than you know. Author Simon Winchester is (metaphorically speaking) headed for San Francisco, but it takes a damnably long time to get there, and there are more detours along that route than even the most unfortunate airline reader will ever encounter, much less countenance. To give you an idea – just an idea – of where A Crack in the Edge of the World is going, the book starts in Wapakoneta. Ohio, known primarily as the home of Neil Armstrong, who has nothing to do at all with the San Francisco earthquake of 1906 that anyone, even the multitalented Winchester, can reveal. This is in the prologue, which introduces the Gaia Hypothesis and the New Geology and the rest of the science stuff. After that, Winchester gets near San Francisco – interjecting himself into the narrative by means of a story about his a camping trip to a nearby mountain – but it doesn’t take him long to get back to plate tectonics all over again. About every other chapter in Winchester’s book is noted as a “Chronicle”, and these chapters hew to what a reasonable expectation of what a primarily historical book about the San Francisco earthquake would be about. These are the short chapters. The long chapters are long indeed. One of them, “From Plate to Shining Plate”, is a first-person disquisition of a lengthy, and largely pointless, tour of the North American Plate. Highlights of this include a trip to Iceland (where the North American Plate begins), New Madrid, Missouri (where a devastating earthquake took place in 1811), and the Wichita Mountains of Oklahoma (where another fault is to be found). None of this, except by comparison, has anything to do with San Francisco, or 1906, or anything much of anything else. And the travelogues (there’s another one in the vicinity of the San Andreas Fault, and yet another up to Alaska at the book’s close) are at least marginally interesting. The scientific disquisition of the geology that underlines San Francisco is explained with a degree of depth that is only surpassed by its complete lack of clarity. (Anyone who has read, and enjoyed, John McPhee’s Annals of the Former World will recognize the shortcomings in Winchester’s book.) Winchester covers ophiolites, and strike-slip faulting, and epicenters, all before telling us anything in-depth about San Francisco and 1906 and the human scope of the disaster. Eventually, Winchester does get his reader to San Francisco. The earthquake, when it happens – that’s on page 243 of my version – is arresting, and powerful, and has a human impact. Winchester introduces us to the famous figures in San Francisco – Enrico Caruso, and Jack London, and the young Ansel Adams – and the ordinary people displaced by the tragedy. He focuses, admirably, on the fate of San Francisco’s Chinatown, and the fight made by nativist Californians to relocate its residents elsewhere. Winchester handles the historical sections with a grace and aplomb that’s totally missing from the first half of the narrative – in part by the simple action of taking himself out of the story, but mostly to his skill as a storyteller. A Crack in the Edge of the World is a perfectly reasonable choice for any seasoned airline traveler to bring along – not least because the reader has the power to skip over the more impenetrable sections. Unfortunately, there’s still no easy and simple way to skip over long layovers at O’Hare. "
14,0060572000,http://goodreads.com/user/show/13954899-kathleen,3,"This book is a bit slow and meandering, with more geological factoids than I needed to know, but still I enjoyed it.I lived in sparkling San Francisco for a summer, on beautiful Beach Street, which took a hit during the Loma Prieta quake of 1989. But that recent quake was nothing compared to the 1906 disaster Winchester portrays here. He bases his account on first-hand journal entries, letters, diaries, newspaper articles by James Hopper, and the bleak photographs that made Genthe famous. Winchester portrays the quake from a worldwide Pangea perspective, comparing fault lines and famous quakes, including Yellowstone National Park. He also portrays the after effects, including 26 aftershocks, water pipes bursting, cattle stampeding, and fire swallowing city blocks whole, while the mayor scrambled for water in a city surrounded by sea.I also recommend the docudrama movie THE GREAT SAN FRANCISCO EARTHQUAKE, directed and written by Philip Smith. Unlike Winchester, Smith portrayed Mayor Eugene Schmitz as a villain. We see him as an avaricious, corrupt politician — and a fool who refused to allocate resources to prevent fire, ignoring his fire chief's warnings, despite the fact that the city had burned six times since the 1849 Gold Rush. Smith condemns the mayor for handing the city over to martial law, allowing soldiers to execute about 500 citizens, including some who were innocent of wrongdoing. Others saw Schmitz as a strong leader taking drastic measures when needed.I also enjoyed Simon Winchester's book depicting one insane soul who helped compile quotations for THE OXFORD ENGLISH DICTIONARY: THE PROFESSOR AND THE MADMAN."
15,0060572000,http://goodreads.com/user/show/3777762-j-s,4,"Simon Winchester can be a bit too much sometimes. This was my second attempt to read this book, the first one bogging down in so much detail and personal travelogue and not really reaching the actual earthquake until 200 pages in (aside from a teaser at the beginning, of course). Nevertheless, this time I persevered and am glad that I did.The 1906 San Francisco earthquake was devastating to the city. Not only did the shaking (7.9 or 8.3 depending on the estimates) of the earth destroy many poorly built buildings, but the fires that followed burned many more in a largely wooden city. But this is much more than just the event here. Winchester loves geology and dives in deep here, starting with a tour of the entire North American tectonic plate - which of course actually starts in the middle of the Atlantic Ocean. So we get a tour of Iceland, and some history on large earthquakes that have occurred in the Eastern US. The San Andreas Fault gets a lot of attention as well as how we measure quakes. And of course there's abundant history on San Francisco. And if you don't mind a somewhat meandering and wide-ranging history full of science and travel, it's actually a rather entertaining book. "
16,0060572000,http://goodreads.com/user/show/1400289-chana,5,"Great book!I bought it for my 9th grader to read as part of her homeschooling program, but I read it before her. At first I thought I would never get through it. His writing is stilted and boring at the beginning, even as he describes the miracles of our astounding planet. And because I am not a student of geology, I was falling asleep over the technical talk.Soon he picks up speed and his language starts to flow, I start using my dictionary to gain an understanding of his geology terms, and we reach a meeting of the minds. I understand what he is saying and he is enjoying what he is teaching.I grew up in Southern California and went through the San Fernando earthquake in 1971, and the Northridge earthquake in 1994. Now I live in Seattle and was here for the Nisqually earthquake in 2001. it amazes me to think that my youngest kiddo, at 15, has never been in an earthquake! She was born later in 2001 than the Nisqually earthquake. I keep thinking we must be in for another pretty soon. That is a little frightening!So I make it through tectonic plate history, placement and movement of; and the early history of quakes along the San Andreas and related faults in Northern California. Good, good. Now onto the history of San Francisco, which I found fascinating, and then the quake itself and the aftermath. Wow! Mind-boggling! I loved this section, it was so very, very interesting. After this, he brings us into the present with a road trip that even includes a trip to Alaska to see the trans-Alaska oil pipeline which crosses the Denali Fault!! The pipeline is very cleverly constructed with expansion curves and sliders and has so far survived an earth movement of eighteen feet to the right without a drop of oil spilled. Well hey for human ingenuity in this case. Recommended read!"
17,0060572000,http://goodreads.com/user/show/1344256-kevin,3,"Wow, Mr. Winchester had a lot of time on his hands. I was expecting a different book, more concise regarding the earthquake in San Fran in the early 20th century. I wasn't expecting to learn about the Louisana purchase, and the myriad other little details that he discusses. It seemed as if in every CD the author goes off on a tangent. My wife listened in on a couple of CD's and without me prompting her, made the comment ""this guy is all over the place."" The last third really gets down to business. Otherwise, very informative. Plan to be bored several times."
18,0060572000,http://goodreads.com/user/show/251564-nancy-loe,2,The dustjacket is the best part.
19,0060572000,http://goodreads.com/user/show/3717253-margaret,4,"Very interesting and fun read. Not just about the San Andreas Fault / San Francisco Earthquake. Actually, the bits about 1906 were the least interesting for me. "
20,0060572000,http://goodreads.com/user/show/6158413-maria,5,"Though this book wasn't quite what I thought it would be, it was an excellent entree into the writing of Simon Winchester. I expected a social history of the events in San Francisco, instead this is a geological history of plate tectonics and earthquakes and its effects, specifically on April 18, 1906. I enjoyed the travelogue experience of accompanying him on his journey around the world and the U.S., exploring its beauty and its precariousness. Selected for my October book discussion group, I expect lively discourse."
21,0060572000,http://goodreads.com/user/show/51813793-tara,1,"Okay. Read the blurb for this book and tell me--what do you think this book is about? The 1906 earthquake maybe?Well, we'll see. Let's check out the first sentence:Some while ago, when I was half-idly browsing my way around the Internet, I stumbled across the home page of an obscure small town in western Ohio with the arresting name of Wapakoneta. He goes on to paint the town as a quaint, worried old man or woman taking pride in their mechanical work and sucking their teeth with worry over ""such newfangled developments as"" outsourcing to Mexico and Asia. The town is just an old fuddy-duddy though. It has a cool side too. Once upon a time, Neil Armstrong lived there. Cue: Oooh, Aaah.Do you see any hint of an earthquake yet? Or even of just San Francisco or 1906? No? Well, here is the connection:Wapakoneta ---> Neil Armstrong ---> Space ---> Being able to see Earth (""And it was a view that in time compelled humankind to take stock."") ---> navel-gazing ---> geology? (""A Born-Again Science"" Seriously).Now, to be fair, this is only the prologue. The actual book must be more focused and better-written, yes?Heh.Chapter one (after 22 full pages of prologue) does indeed begin well. It starts off with a little known fact as icebreaker (""...1906 was a year of the Fire Horse..."") and then starts the subject matter, much, to be honest, like any high school paper-- broadly. You know the sort-- the paper that begins talking about the importance of Shakespeare's works, rather than simply getting down to business and writing the requested analysis of the word ""fear"" as used in Midsummer's Night Dream? In this case, Winchester talks about earthquakes in 1906 in general. Now, this is interesting information. It is a fine way to start the book.The chapter goes from page 23 to page 28. Five whole pages.Here is the beginning of chapter two: ""I first saw San Francisco in the early seventies, at the end of a long westward drive that had taken me clear across the North American continent.""From page 29 to page 32 is all about him seeing SF. Then we get the history of the mountain he camped upon when he saw SF. This is followed by a brief introduction to plate tectonics (again) and then the narrative returns to him.What I remember most about the city, which was spread out beyond the low hills and clustered like a jewel box of gleaming spires and glittering windows on its tiny thumbnail peninsula, was just how astonishingly delicate it all looked. [...] I squinted through a big brass telescope that been obligingly placed upon the parapet. My feeling was that this was a confection of untoward and only half-urban-looking delicacy was confirmed by the magnifying lenses. How tightly San Francisco appeared to cling on to its hillsides: One could imagine knuckles whitened, sinews straining, teeth gritted.He then walks us back to his campsite, down to his car, and lets us know that San Francisco is one of the most temporary cities ever built.We are now 48 pages in and still no sign of the earthquake. (Well, that is a lie, there were a couple pages in the prologue concerning the timing of the quake.)The next chapter is relevant again. Context history. Like the last relevant chapter, however, it is very short. 8 pages (front and back).Chapter four starts our plate tectonics lesson. This doesn't bother me. The fact that several pages of that chapter are spent on the author recounting the ever thrilling tale of his youth when he once stood on two plates at the same time does.(Back in 2009; I am no longer reading this book) I am currently mid-chapter four and am trying to decide whether or not I honestly want to finish this book. The author's writing style and tone are driving me mad. He does little things, like anthropomorphize the Earth or attempt to create false anxiety with 'cliffhangers' (Oh no! He has a word stuck in his head that alters his perception of SF forever! Whatever could it be and why won't he tell us? etc.), that I cannot stand.Also, this book is reading more like what I'd imagine Gilderoy Lockheart would create on the subject, than what I'd hoped for: an interesting account of the earthquake. I am learning about Winchester's youth and the tangents he finds interesting, but not so much about subject in the title and mentioned on the back cover. Every time I start to get interested in what is happening, he ruins it all by pulling the camera focus back to him. I don't mind the tangents and such so much. I like context information. I just don't care about Mr. Winchester. Not even a little bit and the more he tells me about himself, the less interested I am.I honestly cannot remember if I ever bothered to finish the book."
22,0060572000,http://goodreads.com/user/show/841692-maryanne,4,"This book is about more than the San Francisco Earthquake. It is about 15 hours ofa) History of Geological theory, including the introduction of tectonic plate theoryb) History of tectonic plate movements from the beginning of earth's formationc) History of the North American Plate, including the ongoing origin story out of Iceland and recent historical intraplate activities esp those in the New Madrid seismic zoned) Geological cluster events, including volcanic eruptionse) History of CA from early settlers, and specifics of the founding of San Francisco from its days as Yerba Beuna (and why it was called Yerba Buena!) to the Gold Rush rush to political infrastructure to the f) The geological and sociopolitical discussion of the entirety of the San Andreas faultg) THE EARTHQUAKEThis is so much more than I bargained for. But Winchesters is a great teacher as well as story-teller. He repeats words, like 'right lateral strike slip fault' so that I can grasp it, even though I'm listening to the audio book. I would seek out more of Winchester's works. Just don't expect a quick discussion. "
23,0060572000,http://goodreads.com/user/show/7542274-emorgan05,1,"Calling it quits. As an audio book, this was too rambling and wandering to keep track of. Winchester flits from topic to topic and most of it is not about the earthquake."
24,0060572000,http://goodreads.com/user/show/1125315-colleen,1,"This book made me unexpectedly angry. For starters, the cover is a fucking lie--as is the flyleaf--all 6 paragraphs about the SF Earthquake with but one clue I see now for what was in store for me: ""But Winchester's achievement is even greater: he positions the quake's significance along the earth's geological timeline and shows the effect it had on the rest of twentieth-century California and American history.""--because yeah, he sure as hell tries to do that. For starters this book is NOT about the SF Earthquake, and if you pick it up thinking you are going to read a history delving into that day and the repercussions etc., you will be disappointed. If you wanted to read the pretentious musings of a self-indulgent Brit as he compulsively visits everything remotely connected to earthquakes in the Western hemisphere starting back to when the earth was just a little baby ball of molten lava, then you are in for a treat. You know, I've read a lot of non-fiction history books where the author plays a main role--everything by Sarah Vowell, and Betty Furness's Mabel is one of my all-time favorite books--and perhaps those two ladies had better editors or friends to tell them ""NO! YOU'VE EXPOUNDED ON PANGAEA LONG ENOUGH"" -- so it's not like I hate those kinds of books and have tons on my shelves, but dear god I hated this one. I wanted the author to fall into some crevice a 100 pages in. He never even gets to the topic of SF earthquake until like 250 pages in a 385 page book. I don't feel like I left this book knowing anything more really than when I started--other than the exact second it occurred, because there are multiple chapters about that, and just a few paragraphs it seems spared for the death count, which just seems to be ""dunno, no way to tell, 300 - 3,000."" If he wanted to write a book about tectonic plates and geology, he should write a book on that. But after hearing so much self-praise and hints to his delightful life of adventure and knowledge, it's also coupled with him conducting his ""research"" right after 9/11. I say research because it seems like it's mostly snotty observations on the towns he visits in the US--Americans are generally fat, slothish, freedom fry eating head-in-sand morons. Pithy passages like: ""There is worse, however: Someone suggested taking the road farther north still to Dawson City and being initiated into a drinking club that has its signature libation a whiskey in which is marinated some unfortunate frostbitten toe. It seemed almost a repellant an attraction as Wal-Mart.""I'm as rabid as a liberal as you can find, and I wanted to give him the finger after a few chapters of smirking. Tennessee described as ""tedious"" and ""too wide""? And I didn't bother to go through and mark previous passages to compare, but it seems like his descriptions of SF varied widely. Is it a beautiful city after all, unlike any other, or sorta ruined with meh houses with no plan and is only beautiful because a luck of nature? It seems he espouses to both views. Though...I do take it back, I did like finding out that the namesake of the Douglas fir, David Douglas, tripped and fell into a hole that had an angry bull (who had also previously fallen in hole) at the bottom, who gored him to death, but it wasn't worth reading all those pages to learn that fun fact."
25,0060572000,http://goodreads.com/user/show/9889724-m,2,"I have to first start out by saying I'm not a science-y person by any means, so a lot of his book went over my head, even though it's written for a layman. On the positive side, it is chock full of information about earthquakes: what causes them, why and when they happen, what each of the waves feels like, and some of the worst historical earthquakes and the damage they wreaked on human beings, structures and geography. It's also full of very interesting details about the San Francisco earthquake of 1906 and the aftermath. In short, this book has A LOT of information! Mr. Winchester certainly knows what he's talking about. He makes a very interesting, and I'm sure entirely correct, assertion that the Earth is a finely balanced living organism, and a disturbance on one side of the world can cause a disturbance on the other side. Just 12 days before the great quake in San Francisco, Vesuvius erupted in Italy. 1906 was also the worst year seismically speaking, of the 20th century. 2004 is (so far) the worst year of the 21st century. I had two difficulties with this book which prevents me from giving a higher rating- first of all, much of it is very dry and dare I say, boring- granted, I'm no science aficiando so a lot of it is due to being new information for me. But it was also distracting that almost every page had a little footnote, which may or may not pertain much to the paragraph it's annotating. I found them to be very distracting, and I started to get the sense that the author simply knows too much, but doesn't know how to cut it down to a manageable level. Sometimes I found the footnotes to be interesting and other times they were simply confusing why they were included in the first place. I think this is more a criticism of the editing than the writing. My other reason for the lower star is I didn't realize how scared I would feel after reading this book! Living in the Bay area is certainly one reason why, and the more I see the modern world exploiting the natural resources and further unbalancing the delicate ecosystem of Planet Earth, the more seismic misadventures we are going to experience. "
26,0060572000,http://goodreads.com/user/show/8706020-beth-cato,3,"I read this book for research purposes. While I did fill it with sticky notes and found the read overall quite rewarding, I was also left with a strong sense that it could have been a much better book.Winchester is a very knowledgeable fellow. The book is framed around his own travels to places like Iceland and then across North America, from Charleston, to New Madrid, and on westward to San Francisco. His goal is to explore tectonic theory and how the San Andreas Fault fits into the larger scheme of the living world. The data is quite interesting, but at the same time he rambles. It's like he came across too much good information and tried to squeeze it into one book. This creates a problem when a book about the 1906 earthquake doesn't get to the actual earthquake until page 241.This also creates the odd dilemma in that it felt like little of the book was on the actual quake. Information on the aftermath is interesting, such as the struggle to get insurance companies to pay up (especially German-based ones), and the plight of the Chinese and the ensuing wave of ""Paper People"" who tried to take advantage of or were genuinely lost because of the loss of immigration paperwork. He then, however, devotes too much space to how the ""wrath of God"" aspect of the earthquake inspired the Pentecostal church movement. Even his trip to Alaska to discuss the fascinating matter of how the pipeline has been created to withstand earthquakes is colored by derogatory comments on towns along the way, including a slam against Wal-mart that felt out of place in its arrogance.In all, its an interesting book that's diluted by too many tangents. Still worth reading, though, even if it caused me to roll my eyes or skim at times."
27,0060572000,http://goodreads.com/user/show/214234-dan,3,"Winchester's exhaustive look at the geology behind the 1906 San Francisco earthquake was quite edifying, but it was a bit short on the drama of the event itself and the aftermath. I've been looking for a good book on the disaster for a little while now, and when I came across A Crack in the Edge of the World I was thrilled. I'd read Winchester's Atlantic a couple of years ago and enjoyed it. However, the jacket copy is a bit misleading here. True, the book is about the 1906 earthquake, but I was expecting a good three hundred pages on the event and the aftermath, peopled with unforgettable characters. I was expecting something akin to Devil in the White City; instead, Winchester spent about 200 pages setting up the geology of the event. Yes, it was very informative, and I did enjoy it, but I would've enjoyed it had I been expecting it. The event itself takes up about 100 pages, most at the end, but with a teaser at the beginning as well. I learned some fun facts, and in the end I now feel like I have a good foundation on what happened on that fateful April day just over a century ago. I could've done with less geology and less of Winchester's overwrought prose. At least I anticipated the latter having read Atlantic. Recommended for history fans, and fans of natural disaster books.If you liked this, make sure to follow me on Goodreads for more reviews!"
